{
  "daySelector": [
    {
      "date": "2025-12-06",
      "day": "Samstag",
      "CalendarWeek": "49",
      "date_de": "06.12.2025"
    },
    {
      "date": "2025-12-07",
      "day": "Sonntag",
      "CalendarWeek": "49",
      "date_de": "07.12.2025"
    },
    {
      "date": "2025-12-08",
      "day": "Montag",
      "CalendarWeek": "49",
      "date_de": "08.12.2025"
    },
    {
      "date": "2025-12-09",
      "day": "Dienstag",
      "CalendarWeek": "50",
      "date_de": "09.12.2025"
    },
    {
      "date": "2025-12-10",
      "day": "Mittwoch",
      "CalendarWeek": "50",
      "date_de": "10.12.2025"
    },
    {
      "date": "2025-12-11",
      "day": "Donnerstag",
      "CalendarWeek": "50",
      "date_de": "11.12.2025"
    },
    {
      "date": "2025-12-12",
      "day": "Freitag",
      "CalendarWeek": "50",
      "date_de": "12.12.2025"
    },
    {
      "date": "2025-12-13",
      "day": "Samstag",
      "CalendarWeek": "50",
      "date_de": "13.12.2025"
    },
    {
      "date": "2025-12-14",
      "day": "Sonntag",
      "CalendarWeek": "50",
      "date_de": "14.12.2025"
    },
    {
      "date": "2025-12-15",
      "day": "Montag",
      "CalendarWeek": "50",
      "date_de": "15.12.2025"
    },
    {
      "date": "2025-12-16",
      "day": "Dienstag",
      "CalendarWeek": "50",
      "date_de": "16.12.2025"
    },
    {
      "date": "2025-12-17",
      "day": "Mittwoch",
      "CalendarWeek": "50",
      "date_de": "17.12.2025"
    },
    {
      "date": "2025-12-18",
      "day": "Donnerstag",
      "CalendarWeek": "50",
      "date_de": "18.12.2025"
    },
    {
      "date": "2025-12-19",
      "day": "Freitag",
      "CalendarWeek": "50",
      "date_de": "19.12.2025"
    },
    {
      "date": "2025-12-22",
      "day": "Montag",
      "CalendarWeek": "50",
      "date_de": "22.12.2025"
    },
    {
      "date": "2025-12-23",
      "day": "Dienstag",
      "CalendarWeek": "50",
      "date_de": "23.12.2025"
    },
    {
      "date": "2025-12-26",
      "day": "Freitag",
      "CalendarWeek": "50",
      "date_de": "26.12.2025"
    }
  ],
  "data": [
    {
      "id": "4824272",
      "outlet": "cafe",
      "date": "2025-12-09",
      "CalendarWeek": "50",
      "day": "Dienstag",
      "mealtime": "Mittagessen",
      "IdentNr": "12025120998003",
      "itemId": "21063",
      "RecipeID": "8211",
      "ProductPrice": "0.50",
      "ProductPrice_2": null,
      "GastDesc_de": "LES ARLETTES (Französische Blätterteigkekse) Vegan",
      "GastDesc_en": "LES ARLETTES  (French Puff Pastry Cookies) Vegan",
      "MenuName": "MINIS",
      "allergene": {
        "gluten": "Glutenhaltiges Getreide"
      },
      "merkmale": {
        "vegan": "Vegan",
        "vegetarisch": "Vegetarisch"
      },
      "naehrstoffe": "",
      "zusatzstoffe": [
        {
          "de": "Farbstoff",
          "en": "Colouring Agent"
        },
        {
          "de": "Alkohol",
          "en": "Alcohol"
        }
      ],
      "PrintOrder": "3",
      "CO2Value": null,
      "CO2Rating": null,
      "CO2Perc": null,
      "ClimateFriendly": null,
      "GastDesc": "LES ARLETTES (Französische Blätterteigkekse) Vegan",
      "date_de": "09.12.2025"
    },
    {
      "id": "4824273",
      "outlet": "cafe",
      "date": "2025-12-09",
      "CalendarWeek": "50",
      "day": "Dienstag",
      "mealtime": "Mittagessen",
      "IdentNr": "12025120998004",
      "itemId": "21058",
      "RecipeID": "9066",
      "ProductPrice": "3.50",
      "ProductPrice_2": null,
      "GastDesc_de": "Opéra Schnitte",
      "GastDesc_en": "Opera cake",
      "MenuName": "OPEN",
      "allergene": {
        "gluten": "Glutenhaltiges Getreide",
        "schalenfruchte": "Schalenfrüchte und Schalenfruchterzeugnisse",
        "huhnerei": "Hühnerei und Hühnereierzeugnisse",
        "soja": "Soja und Sojaerzeugnisse",
        "milch": "Milch und Milcherzeugnisse"
      },
      "merkmale": "",
      "naehrstoffe": "",
      "zusatzstoffe": null,
      "PrintOrder": "4",
      "CO2Value": null,
      "CO2Rating": null,
      "CO2Perc": null,
      "ClimateFriendly": null,
      "GastDesc": "Opéra Schnitte",
      "date_de": "09.12.2025"
    },
    {
      "id": "4824274",
      "outlet": "cafe",
      "date": "2025-12-09",
      "CalendarWeek": "50",
      "day": "Dienstag",
      "mealtime": "Mittagessen",
      "IdentNr": "12025120998005",
      "itemId": "21064",
      "RecipeID": "8330",
      "ProductPrice": "1.50",
      "ProductPrice_2": null,
      "GastDesc_de": "Saftige Brownie-Bananen-Cookies | Zuckerfrei",
      "GastDesc_en": "Fudgy Brownie Banana Cookies | Sugar-Free",
      "MenuName": "PEOPLES CHOICE",
      "allergene": {
        "erdnuss": "Erdnüsse und Erdnusserzeugnisse"
      },
      "merkmale": {
        "ohne_zucker": "Ohne_Zucker",
        "vegan": "Vegan",
        "vegetarisch": "Vegetarisch"
      },
      "naehrstoffe": "",
      "zusatzstoffe": null,
      "PrintOrder": "5",
      "CO2Value": null,
      "CO2Rating": null,
      "CO2Perc": null,
      "ClimateFriendly": null,
      "GastDesc": "Saftige Brownie-Bananen-Cookies | Zuckerfrei",
      "date_de": "09.12.2025"
    },
    {
      "id": "4824275",
      "outlet": "cafe",
      "date": "2025-12-09",
      "CalendarWeek": "50",
      "day": "Dienstag",
      "mealtime": "Mittagessen",
      "IdentNr": "12025120998006",
      "itemId": "21061",
      "RecipeID": "8672",
      "ProductPrice": "2.60",
      "ProductPrice_2": null,
      "GastDesc_de": "Quarkstollen",
      "GastDesc_en": "Curd Stollen",
      "MenuName": "SEASON",
      "allergene": {
        "gluten": "Glutenhaltiges Getreide",
        "schalenfruchte": "Schalenfrüchte und Schalenfruchterzeugnisse",
        "huhnerei": "Hühnerei und Hühnereierzeugnisse",
        "milch": "Milch und Milcherzeugnisse"
      },
      "merkmale": "",
      "naehrstoffe": "",
      "zusatzstoffe": [
        {
          "de": "Farbstoff",
          "en": "Colouring Agent"
        },
        {
          "de": "Alkohol",
          "en": "Alcohol"
        }
      ],
      "PrintOrder": "6",
      "CO2Value": null,
      "CO2Rating": null,
      "CO2Perc": null,
      "ClimateFriendly": null,
      "GastDesc": "Quarkstollen",
      "date_de": "09.12.2025"
    },
    {
      "id": "4824276",
      "outlet": "cafe",
      "date": "2025-12-09",
      "CalendarWeek": "50",
      "day": "Dienstag",
      "mealtime": "Mittagessen",
      "IdentNr": "12025120998009",
      "itemId": "12773",
      "RecipeID": "9037",
      "ProductPrice": "2.50",
      "ProductPrice_2": null,
      "GastDesc_de": "Biscoff Karamell \"Apple Pie\" Cookie | Vegan",
      "GastDesc_en": "Biscoff Caramel \"Apple Pie\" Cookie | Vegan",
      "MenuName": "CLASSICS",
      "allergene": {
        "gluten": "Glutenhaltiges Getreide"
      },
      "merkmale": "",
      "naehrstoffe": "",
      "zusatzstoffe": [
        {
          "de": "Farbstoff",
          "en": "Colouring Agent"
        },
        {
          "de": "Antioxidationsmittel",
          "en": "Antioxidation"
        },
        {
          "de": "Alkohol",
          "en": "Alcohol"
        }
      ],
      "PrintOrder": "9",
      "CO2Value": null,
      "CO2Rating": null,
      "CO2Perc": null,
      "ClimateFriendly": null,
      "GastDesc": "Biscoff Karamell \"Apple Pie\" Cookie | Vegan",
      "date_de": "09.12.2025"
    },
    {
      "id": "4824277",
      "outlet": "cafe",
      "date": "2025-12-09",
      "CalendarWeek": "50",
      "day": "Dienstag",
      "mealtime": "Mittagessen",
      "IdentNr": "12025120998010",
      "itemId": "12778",
      "RecipeID": "7093",
      "ProductPrice": "1.70",
      "ProductPrice_2": null,
      "GastDesc_de": "Brownies Miniatur",
      "GastDesc_en": "Miniature Brownies",
      "MenuName": "BROWNIE, BROOKIE UND BLONDIE DAY",
      "allergene": {
        "gluten": "Glutenhaltiges Getreide",
        "schalenfruchte": "Schalenfrüchte und Schalenfruchterzeugnisse",
        "huhnerei": "Hühnerei und Hühnereierzeugnisse",
        "soja": "Soja und Sojaerzeugnisse",
        "milch": "Milch und Milcherzeugnisse"
      },
      "merkmale": "",
      "naehrstoffe": "",
      "zusatzstoffe": null,
      "PrintOrder": "10",
      "CO2Value": null,
      "CO2Rating": null,
      "CO2Perc": null,
      "ClimateFriendly": null,
      "GastDesc": "Brownies Miniatur",
      "date_de": "09.12.2025"
    },
    {
      "id": "4824278",
      "outlet": "cafe",
      "date": "2025-12-09",
      "CalendarWeek": "50",
      "day": "Dienstag",
      "mealtime": "Mittagessen",
      "IdentNr": "12025120998011",
      "itemId": "16256",
      "RecipeID": "8775",
      "ProductPrice": "1.50",
      "ProductPrice_2": null,
      "GastDesc_de": "Schwedische Haferkekse | Vegan",
      "GastDesc_en": "Swedish Style Oatmeal Cookies | Vegan",
      "MenuName": "VEGAN SPECIAL",
      "allergene": {
        "gluten": "Glutenhaltiges Getreide"
      },
      "merkmale": {
        "vegan": "Vegan",
        "vegetarisch": "Vegetarisch"
      },
      "naehrstoffe": "",
      "zusatzstoffe": [
        {
          "de": "Farbstoff",
          "en": "Colouring Agent"
        },
        {
          "de": "Antioxidationsmittel",
          "en": "Antioxidation"
        },
        {
          "de": "Alkohol",
          "en": "Alcohol"
        }
      ],
      "PrintOrder": "11",
      "CO2Value": null,
      "CO2Rating": null,
      "CO2Perc": null,
      "ClimateFriendly": null,
      "GastDesc": "Schwedische Haferkekse | Vegan",
      "date_de": "09.12.2025"
    },
    {
      "id": "4824279",
      "outlet": "cafe",
      "date": "2025-12-09",
      "CalendarWeek": "50",
      "day": "Dienstag",
      "mealtime": "Mittagessen",
      "IdentNr": "12025120998012",
      "itemId": "16257",
      "RecipeID": "9067",
      "ProductPrice": "4.50",
      "ProductPrice_2": null,
      "GastDesc_de": "Crepes mit Zimt-Zucker und Apfelmus",
      "GastDesc_en": "Crepe with Apple Sauce and Cinammon Sugar",
      "MenuName": "KLASSIKER",
      "allergene": {
        "gluten": "Glutenhaltiges Getreide",
        "huhnerei": "Hühnerei und Hühnereierzeugnisse",
        "milch": "Milch und Milcherzeugnisse"
      },
      "merkmale": "",
      "naehrstoffe": "",
      "zusatzstoffe": [
        {
          "de": "Antioxidationsmittel",
          "en": "Antioxidation"
        }
      ],
      "PrintOrder": "12",
      "CO2Value": null,
      "CO2Rating": null,
      "CO2Perc": null,
      "ClimateFriendly": null,
      "GastDesc": "Crepes mit Zimt-Zucker und Apfelmus",
      "date_de": "09.12.2025"
    },
    {
      "id": "4841874",
      "outlet": "cafe",
      "date": "2025-12-10",
      "CalendarWeek": "50",
      "day": "Mittwoch",
      "mealtime": "Mittagessen",
      "IdentNr": "12025121098003",
      "itemId": "21063",
      "RecipeID": "8211",
      "ProductPrice": "0.50",
      "ProductPrice_2": null,
      "GastDesc_de": "LES ARLETTES (Französische Blätterteigkekse) Vegan",
      "GastDesc_en": "LES ARLETTES  (French Puff Pastry Cookies) Vegan",
      "MenuName": "MINIS",
      "allergene": {
        "gluten": "Glutenhaltiges Getreide"
      },
      "merkmale": {
        "vegan": "Vegan",
        "vegetarisch": "Vegetarisch"
      },
      "naehrstoffe": "",
      "zusatzstoffe": [
        {
          "de": "Farbstoff",
          "en": "Colouring Agent"
        },
        {
          "de": "Alkohol",
          "en": "Alcohol"
        }
      ],
      "PrintOrder": "3",
      "CO2Value": null,
      "CO2Rating": null,
      "CO2Perc": null,
      "ClimateFriendly": null,
      "GastDesc": "LES ARLETTES (Französische Blätterteigkekse) Vegan",
      "date_de": "10.12.2025"
    },
    {
      "id": "4841875",
      "outlet": "cafe",
      "date": "2025-12-10",
      "CalendarWeek": "50",
      "day": "Mittwoch",
      "mealtime": "Mittagessen",
      "IdentNr": "12025121098004",
      "itemId": "21058",
      "RecipeID": "9066",
      "ProductPrice": "3.50",
      "ProductPrice_2": null,
      "GastDesc_de": "Opéra Schnitte",
      "GastDesc_en": "Opera cake",
      "MenuName": "OPEN",
      "allergene": {
        "gluten": "Glutenhaltiges Getreide",
        "schalenfruchte": "Schalenfrüchte und Schalenfruchterzeugnisse",
        "huhnerei": "Hühnerei und Hühnereierzeugnisse",
        "soja": "Soja und Sojaerzeugnisse",
        "milch": "Milch und Milcherzeugnisse"
      },
      "merkmale": "",
      "naehrstoffe": "",
      "zusatzstoffe": null,
      "PrintOrder": "4",
      "CO2Value": null,
      "CO2Rating": null,
      "CO2Perc": null,
      "ClimateFriendly": null,
      "GastDesc": "Opéra Schnitte",
      "date_de": "10.12.2025"
    },
    {
      "id": "4841876",
      "outlet": "cafe",
      "date": "2025-12-10",
      "CalendarWeek": "50",
      "day": "Mittwoch",
      "mealtime": "Mittagessen",
      "IdentNr": "12025121098005",
      "itemId": "21064",
      "RecipeID": "8330",
      "ProductPrice": "1.50",
      "ProductPrice_2": null,
      "GastDesc_de": "Saftige Brownie-Bananen-Cookies | Zuckerfrei",
      "GastDesc_en": "Fudgy Brownie Banana Cookies | Sugar-Free",
      "MenuName": "PEOPLES CHOICE",
      "allergene": {
        "erdnuss": "Erdnüsse und Erdnusserzeugnisse"
      },
      "merkmale": {
        "ohne_zucker": "Ohne_Zucker",
        "vegan": "Vegan",
        "vegetarisch": "Vegetarisch"
      },
      "naehrstoffe": "",
      "zusatzstoffe": null,
      "PrintOrder": "5",
      "CO2Value": null,
      "CO2Rating": null,
      "CO2Perc": null,
      "ClimateFriendly": null,
      "GastDesc": "Saftige Brownie-Bananen-Cookies | Zuckerfrei",
      "date_de": "10.12.2025"
    },
    {
      "id": "4841877",
      "outlet": "cafe",
      "date": "2025-12-10",
      "CalendarWeek": "50",
      "day": "Mittwoch",
      "mealtime": "Mittagessen",
      "IdentNr": "12025121098006",
      "itemId": "21061",
      "RecipeID": "8672",
      "ProductPrice": "2.60",
      "ProductPrice_2": null,
      "GastDesc_de": "Quarkstollen",
      "GastDesc_en": "Curd Stollen",
      "MenuName": "SEASON",
      "allergene": {
        "gluten": "Glutenhaltiges Getreide",
        "schalenfruchte": "Schalenfrüchte und Schalenfruchterzeugnisse",
        "huhnerei": "Hühnerei und Hühnereierzeugnisse",
        "milch": "Milch und Milcherzeugnisse"
      },
      "merkmale": "",
      "naehrstoffe": "",
      "zusatzstoffe": [
        {
          "de": "Farbstoff",
          "en": "Colouring Agent"
        },
        {
          "de": "Alkohol",
          "en": "Alcohol"
        }
      ],
      "PrintOrder": "6",
      "CO2Value": null,
      "CO2Rating": null,
      "CO2Perc": null,
      "ClimateFriendly": null,
      "GastDesc": "Quarkstollen",
      "date_de": "10.12.2025"
    },
    {
      "id": "4841878",
      "outlet": "cafe",
      "date": "2025-12-10",
      "CalendarWeek": "50",
      "day": "Mittwoch",
      "mealtime": "Mittagessen",
      "IdentNr": "12025121098009",
      "itemId": "12773",
      "RecipeID": "9037",
      "ProductPrice": "2.50",
      "ProductPrice_2": null,
      "GastDesc_de": "Biscoff Karamell \"Apple Pie\" Cookie | Vegan",
      "GastDesc_en": "Biscoff Caramel \"Apple Pie\" Cookie | Vegan",
      "MenuName": "CLASSICS",
      "allergene": {
        "gluten": "Glutenhaltiges Getreide"
      },
      "merkmale": "",
      "naehrstoffe": "",
      "zusatzstoffe": [
        {
          "de": "Farbstoff",
          "en": "Colouring Agent"
        },
        {
          "de": "Antioxidationsmittel",
          "en": "Antioxidation"
        },
        {
          "de": "Alkohol",
          "en": "Alcohol"
        }
      ],
      "PrintOrder": "9",
      "CO2Value": null,
      "CO2Rating": null,
      "CO2Perc": null,
      "ClimateFriendly": null,
      "GastDesc": "Biscoff Karamell \"Apple Pie\" Cookie | Vegan",
      "date_de": "10.12.2025"
    },
    {
      "id": "4841879",
      "outlet": "cafe",
      "date": "2025-12-10",
      "CalendarWeek": "50",
      "day": "Mittwoch",
      "mealtime": "Mittagessen",
      "IdentNr": "12025121098010",
      "itemId": "12778",
      "RecipeID": "7093",
      "ProductPrice": "1.70",
      "ProductPrice_2": null,
      "GastDesc_de": "Brownies Miniatur",
      "GastDesc_en": "Miniature Brownies",
      "MenuName": "BROWNIE, BROOKIE UND BLONDIE DAY",
      "allergene": {
        "gluten": "Glutenhaltiges Getreide",
        "schalenfruchte": "Schalenfrüchte und Schalenfruchterzeugnisse",
        "huhnerei": "Hühnerei und Hühnereierzeugnisse",
        "soja": "Soja und Sojaerzeugnisse",
        "milch": "Milch und Milcherzeugnisse"
      },
      "merkmale": "",
      "naehrstoffe": "",
      "zusatzstoffe": null,
      "PrintOrder": "10",
      "CO2Value": null,
      "CO2Rating": null,
      "CO2Perc": null,
      "ClimateFriendly": null,
      "GastDesc": "Brownies Miniatur",
      "date_de": "10.12.2025"
    },
    {
      "id": "4841880",
      "outlet": "cafe",
      "date": "2025-12-10",
      "CalendarWeek": "50",
      "day": "Mittwoch",
      "mealtime": "Mittagessen",
      "IdentNr": "12025121098011",
      "itemId": "16256",
      "RecipeID": "8775",
      "ProductPrice": "1.50",
      "ProductPrice_2": null,
      "GastDesc_de": "Schwedische Haferkekse | Vegan",
      "GastDesc_en": "Swedish Style Oatmeal Cookies | Vegan",
      "MenuName": "VEGAN SPECIAL",
      "allergene": {
        "gluten": "Glutenhaltiges Getreide"
      },
      "merkmale": {
        "vegan": "Vegan",
        "vegetarisch": "Vegetarisch"
      },
      "naehrstoffe": "",
      "zusatzstoffe": [
        {
          "de": "Farbstoff",
          "en": "Colouring Agent"
        },
        {
          "de": "Antioxidationsmittel",
          "en": "Antioxidation"
        },
        {
          "de": "Alkohol",
          "en": "Alcohol"
        }
      ],
      "PrintOrder": "11",
      "CO2Value": null,
      "CO2Rating": null,
      "CO2Perc": null,
      "ClimateFriendly": null,
      "GastDesc": "Schwedische Haferkekse | Vegan",
      "date_de": "10.12.2025"
    },
    {
      "id": "4872395",
      "outlet": "cafe",
      "date": "2025-12-15",
      "CalendarWeek": "50",
      "day": "Montag",
      "mealtime": "Mittagessen",
      "IdentNr": "12025121598000",
      "itemId": "21060",
      "RecipeID": "8826",
      "ProductPrice": "3.50",
      "ProductPrice_2": null,
      "GastDesc_de": "Rumkugel",
      "GastDesc_en": "Rumball",
      "MenuName": "CHOCOLATE",
      "allergene": {
        "gluten": "Glutenhaltiges Getreide",
        "schalenfruchte": "Schalenfrüchte und Schalenfruchterzeugnisse",
        "huhnerei": "Hühnerei und Hühnereierzeugnisse",
        "soja": "Soja und Sojaerzeugnisse",
        "milch": "Milch und Milcherzeugnisse"
      },
      "merkmale": "",
      "naehrstoffe": "",
      "zusatzstoffe": [
        {
          "de": "Farbstoff",
          "en": "Colouring Agent"
        },
        {
          "de": "Alkohol",
          "en": "Alcohol"
        }
      ],
      "PrintOrder": "0",
      "CO2Value": null,
      "CO2Rating": null,
      "CO2Perc": null,
      "ClimateFriendly": null,
      "GastDesc": "Rumkugel",
      "date_de": "15.12.2025"
    },
    {
      "id": "4872396",
      "outlet": "cafe",
      "date": "2025-12-15",
      "CalendarWeek": "50",
      "day": "Montag",
      "mealtime": "Mittagessen",
      "IdentNr": "12025121598002",
      "itemId": "21062",
      "RecipeID": "8635",
      "ProductPrice": "1.50",
      "ProductPrice_2": null,
      "GastDesc_de": "Quarkbällchen",
      "GastDesc_en": "Quark balls",
      "MenuName": "FAVOURITES",
      "allergene": {
        "gluten": "Glutenhaltiges Getreide",
        "huhnerei": "Hühnerei und Hühnereierzeugnisse",
        "milch": "Milch und Milcherzeugnisse"
      },
      "merkmale": "",
      "naehrstoffe": "",
      "zusatzstoffe": null,
      "PrintOrder": "2",
      "CO2Value": null,
      "CO2Rating": null,
      "CO2Perc": null,
      "ClimateFriendly": null,
      "GastDesc": "Quarkbällchen",
      "date_de": "15.12.2025"
    },
    {
      "id": "4872397",
      "outlet": "cafe",
      "date": "2025-12-15",
      "CalendarWeek": "50",
      "day": "Montag",
      "mealtime": "Mittagessen",
      "IdentNr": "12025121598003",
      "itemId": "21063",
      "RecipeID": "8211",
      "ProductPrice": "0.50",
      "ProductPrice_2": null,
      "GastDesc_de": "LES ARLETTES (Französische Blätterteigkekse) Vegan",
      "GastDesc_en": "LES ARLETTES  (French Puff Pastry Cookies) Vegan",
      "MenuName": "MINIS",
      "allergene": {
        "gluten": "Glutenhaltiges Getreide"
      },
      "merkmale": {
        "vegan": "Vegan",
        "vegetarisch": "Vegetarisch"
      },
      "naehrstoffe": "",
      "zusatzstoffe": [
        {
          "de": "Farbstoff",
          "en": "Colouring Agent"
        },
        {
          "de": "Alkohol",
          "en": "Alcohol"
        }
      ],
      "PrintOrder": "3",
      "CO2Value": null,
      "CO2Rating": null,
      "CO2Perc": null,
      "ClimateFriendly": null,
      "GastDesc": "LES ARLETTES (Französische Blätterteigkekse) Vegan",
      "date_de": "15.12.2025"
    },
    {
      "id": "4872398",
      "outlet": "cafe",
      "date": "2025-12-15",
      "CalendarWeek": "50",
      "day": "Montag",
      "mealtime": "Mittagessen",
      "IdentNr": "12025121598005",
      "itemId": "21064",
      "RecipeID": "9036",
      "ProductPrice": "2.70",
      "ProductPrice_2": null,
      "GastDesc_de": "Kürbis-Bananenbrot mit Walnüssen | Zuckerfrei",
      "GastDesc_en": "Pumpkin-banana bread with walnuts | Sugar-free",
      "MenuName": "PEOPLES CHOICE",
      "allergene": {
        "gluten": "Glutenhaltiges Getreide",
        "schalenfruchte": "Schalenfrüchte und Schalenfruchterzeugnisse",
        "huhnerei": "Hühnerei und Hühnereierzeugnisse",
        "milch": "Milch und Milcherzeugnisse"
      },
      "merkmale": "",
      "naehrstoffe": "",
      "zusatzstoffe": null,
      "PrintOrder": "5",
      "CO2Value": null,
      "CO2Rating": null,
      "CO2Perc": null,
      "ClimateFriendly": null,
      "GastDesc": "Kürbis-Bananenbrot mit Walnüssen | Zuckerfrei",
      "date_de": "15.12.2025"
    },
    {
      "id": "4872399",
      "outlet": "cafe",
      "date": "2025-12-15",
      "CalendarWeek": "50",
      "day": "Montag",
      "mealtime": "Mittagessen",
      "IdentNr": "12025121598006",
      "itemId": "21061",
      "RecipeID": "8672",
      "ProductPrice": "2.60",
      "ProductPrice_2": null,
      "GastDesc_de": "Quarkstollen",
      "GastDesc_en": "Curd Stollen",
      "MenuName": "SEASON",
      "allergene": {
        "gluten": "Glutenhaltiges Getreide",
        "schalenfruchte": "Schalenfrüchte und Schalenfruchterzeugnisse",
        "huhnerei": "Hühnerei und Hühnereierzeugnisse",
        "milch": "Milch und Milcherzeugnisse"
      },
      "merkmale": "",
      "naehrstoffe": "",
      "zusatzstoffe": [
        {
          "de": "Farbstoff",
          "en": "Colouring Agent"
        },
        {
          "de": "Alkohol",
          "en": "Alcohol"
        }
      ],
      "PrintOrder": "6",
      "CO2Value": null,
      "CO2Rating": null,
      "CO2Perc": null,
      "ClimateFriendly": null,
      "GastDesc": "Quarkstollen",
      "date_de": "15.12.2025"
    },
    {
      "id": "4872400",
      "outlet": "cafe",
      "date": "2025-12-15",
      "CalendarWeek": "50",
      "day": "Montag",
      "mealtime": "Mittagessen",
      "IdentNr": "12025121598007",
      "itemId": "12776",
      "RecipeID": "9037",
      "ProductPrice": "2.50",
      "ProductPrice_2": null,
      "GastDesc_de": "Biscoff Karamell \"Apple Pie\" Cookie | Vegan",
      "GastDesc_en": "Biscoff Caramel \"Apple Pie\" Cookie | Vegan",
      "MenuName": "COOKIE",
      "allergene": {
        "gluten": "Glutenhaltiges Getreide"
      },
      "merkmale": "",
      "naehrstoffe": "",
      "zusatzstoffe": [
        {
          "de": "Farbstoff",
          "en": "Colouring Agent"
        },
        {
          "de": "Antioxidationsmittel",
          "en": "Antioxidation"
        },
        {
          "de": "Alkohol",
          "en": "Alcohol"
        }
      ],
      "PrintOrder": "7",
      "CO2Value": null,
      "CO2Rating": null,
      "CO2Perc": null,
      "ClimateFriendly": null,
      "GastDesc": "Biscoff Karamell \"Apple Pie\" Cookie | Vegan",
      "date_de": "15.12.2025"
    },
    {
      "id": "4872401",
      "outlet": "cafe",
      "date": "2025-12-15",
      "CalendarWeek": "50",
      "day": "Montag",
      "mealtime": "Mittagessen",
      "IdentNr": "12025121598009",
      "itemId": "12773",
      "RecipeID": "9066",
      "ProductPrice": "3.50",
      "ProductPrice_2": null,
      "GastDesc_de": "Opéra Schnitte",
      "GastDesc_en": "Opera cake",
      "MenuName": "CLASSICS",
      "allergene": {
        "gluten": "Glutenhaltiges Getreide",
        "schalenfruchte": "Schalenfrüchte und Schalenfruchterzeugnisse",
        "huhnerei": "Hühnerei und Hühnereierzeugnisse",
        "soja": "Soja und Sojaerzeugnisse",
        "milch": "Milch und Milcherzeugnisse"
      },
      "merkmale": "",
      "naehrstoffe": "",
      "zusatzstoffe": null,
      "PrintOrder": "9",
      "CO2Value": null,
      "CO2Rating": null,
      "CO2Perc": null,
      "ClimateFriendly": null,
      "GastDesc": "Opéra Schnitte",
      "date_de": "15.12.2025"
    },
    {
      "id": "4872402",
      "outlet": "cafe",
      "date": "2025-12-15",
      "CalendarWeek": "50",
      "day": "Montag",
      "mealtime": "Mittagessen",
      "IdentNr": "12025121598011",
      "itemId": "16256",
      "RecipeID": "8211",
      "ProductPrice": "0.50",
      "ProductPrice_2": null,
      "GastDesc_de": "LES ARLETTES (Französische Blätterteigkekse) Vegan",
      "GastDesc_en": "LES ARLETTES  (French Puff Pastry Cookies) Vegan",
      "MenuName": "VEGAN SPECIAL",
      "allergene": {
        "gluten": "Glutenhaltiges Getreide"
      },
      "merkmale": {
        "vegan": "Vegan",
        "vegetarisch": "Vegetarisch"
      },
      "naehrstoffe": "",
      "zusatzstoffe": [
        {
          "de": "Farbstoff",
          "en": "Colouring Agent"
        },
        {
          "de": "Alkohol",
          "en": "Alcohol"
        }
      ],
      "PrintOrder": "11",
      "CO2Value": null,
      "CO2Rating": null,
      "CO2Perc": null,
      "ClimateFriendly": null,
      "GastDesc": "LES ARLETTES (Französische Blätterteigkekse) Vegan",
      "date_de": "15.12.2025"
    },
    {
      "id": "4872403",
      "outlet": "cafe",
      "date": "2025-12-16",
      "CalendarWeek": "50",
      "day": "Dienstag",
      "mealtime": "Mittagessen",
      "IdentNr": "12025121698000",
      "itemId": "21060",
      "RecipeID": "8826",
      "ProductPrice": "3.50",
      "ProductPrice_2": null,
      "GastDesc_de": "Rumkugel",
      "GastDesc_en": "Rumball",
      "MenuName": "CHOCOLATE",
      "allergene": {
        "gluten": "Glutenhaltiges Getreide",
        "schalenfruchte": "Schalenfrüchte und Schalenfruchterzeugnisse",
        "huhnerei": "Hühnerei und Hühnereierzeugnisse",
        "soja": "Soja und Sojaerzeugnisse",
        "milch": "Milch und Milcherzeugnisse"
      },
      "merkmale": "",
      "naehrstoffe": "",
      "zusatzstoffe": [
        {
          "de": "Farbstoff",
          "en": "Colouring Agent"
        },
        {
          "de": "Alkohol",
          "en": "Alcohol"
        }
      ],
      "PrintOrder": "0",
      "CO2Value": null,
      "CO2Rating": null,
      "CO2Perc": null,
      "ClimateFriendly": null,
      "GastDesc": "Rumkugel",
      "date_de": "16.12.2025"
    },
    {
      "id": "4872404",
      "outlet": "cafe",
      "date": "2025-12-16",
      "CalendarWeek": "50",
      "day": "Dienstag",
      "mealtime": "Mittagessen",
      "IdentNr": "12025121698002",
      "itemId": "21062",
      "RecipeID": "8635",
      "ProductPrice": "1.50",
      "ProductPrice_2": null,
      "GastDesc_de": "Quarkbällchen",
      "GastDesc_en": "Quark balls",
      "MenuName": "FAVOURITES",
      "allergene": {
        "gluten": "Glutenhaltiges Getreide",
        "huhnerei": "Hühnerei und Hühnereierzeugnisse",
        "milch": "Milch und Milcherzeugnisse"
      },
      "merkmale": "",
      "naehrstoffe": "",
      "zusatzstoffe": null,
      "PrintOrder": "2",
      "CO2Value": null,
      "CO2Rating": null,
      "CO2Perc": null,
      "ClimateFriendly": null,
      "GastDesc": "Quarkbällchen",
      "date_de": "16.12.2025"
    },
    {
      "id": "4872405",
      "outlet": "cafe",
      "date": "2025-12-16",
      "CalendarWeek": "50",
      "day": "Dienstag",
      "mealtime": "Mittagessen",
      "IdentNr": "12025121698003",
      "itemId": "21063",
      "RecipeID": "8211",
      "ProductPrice": "0.50",
      "ProductPrice_2": null,
      "GastDesc_de": "LES ARLETTES (Französische Blätterteigkekse) Vegan",
      "GastDesc_en": "LES ARLETTES  (French Puff Pastry Cookies) Vegan",
      "MenuName": "MINIS",
      "allergene": {
        "gluten": "Glutenhaltiges Getreide"
      },
      "merkmale": {
        "vegan": "Vegan",
        "vegetarisch": "Vegetarisch"
      },
      "naehrstoffe": "",
      "zusatzstoffe": [
        {
          "de": "Farbstoff",
          "en": "Colouring Agent"
        },
        {
          "de": "Alkohol",
          "en": "Alcohol"
        }
      ],
      "PrintOrder": "3",
      "CO2Value": null,
      "CO2Rating": null,
      "CO2Perc": null,
      "ClimateFriendly": null,
      "GastDesc": "LES ARLETTES (Französische Blätterteigkekse) Vegan",
      "date_de": "16.12.2025"
    },
    {
      "id": "4872406",
      "outlet": "cafe",
      "date": "2025-12-16",
      "CalendarWeek": "50",
      "day": "Dienstag",
      "mealtime": "Mittagessen",
      "IdentNr": "12025121698005",
      "itemId": "21064",
      "RecipeID": "9036",
      "ProductPrice": "2.70",
      "ProductPrice_2": null,
      "GastDesc_de": "Kürbis-Bananenbrot mit Walnüssen | Zuckerfrei",
      "GastDesc_en": "Pumpkin-banana bread with walnuts | Sugar-free",
      "MenuName": "PEOPLES CHOICE",
      "allergene": {
        "gluten": "Glutenhaltiges Getreide",
        "schalenfruchte": "Schalenfrüchte und Schalenfruchterzeugnisse",
        "huhnerei": "Hühnerei und Hühnereierzeugnisse",
        "milch": "Milch und Milcherzeugnisse"
      },
      "merkmale": "",
      "naehrstoffe": "",
      "zusatzstoffe": null,
      "PrintOrder": "5",
      "CO2Value": null,
      "CO2Rating": null,
      "CO2Perc": null,
      "ClimateFriendly": null,
      "GastDesc": "Kürbis-Bananenbrot mit Walnüssen | Zuckerfrei",
      "date_de": "16.12.2025"
    },
    {
      "id": "4872407",
      "outlet": "cafe",
      "date": "2025-12-16",
      "CalendarWeek": "50",
      "day": "Dienstag",
      "mealtime": "Mittagessen",
      "IdentNr": "12025121698006",
      "itemId": "21061",
      "RecipeID": "8672",
      "ProductPrice": "2.60",
      "ProductPrice_2": null,
      "GastDesc_de": "Quarkstollen",
      "GastDesc_en": "Curd Stollen",
      "MenuName": "SEASON",
      "allergene": {
        "gluten": "Glutenhaltiges Getreide",
        "schalenfruchte": "Schalenfrüchte und Schalenfruchterzeugnisse",
        "huhnerei": "Hühnerei und Hühnereierzeugnisse",
        "milch": "Milch und Milcherzeugnisse"
      },
      "merkmale": "",
      "naehrstoffe": "",
      "zusatzstoffe": [
        {
          "de": "Farbstoff",
          "en": "Colouring Agent"
        },
        {
          "de": "Alkohol",
          "en": "Alcohol"
        }
      ],
      "PrintOrder": "6",
      "CO2Value": null,
      "CO2Rating": null,
      "CO2Perc": null,
      "ClimateFriendly": null,
      "GastDesc": "Quarkstollen",
      "date_de": "16.12.2025"
    },
    {
      "id": "4872408",
      "outlet": "cafe",
      "date": "2025-12-16",
      "CalendarWeek": "50",
      "day": "Dienstag",
      "mealtime": "Mittagessen",
      "IdentNr": "12025121698007",
      "itemId": "12776",
      "RecipeID": "9037",
      "ProductPrice": "2.50",
      "ProductPrice_2": null,
      "GastDesc_de": "Biscoff Karamell \"Apple Pie\" Cookie | Vegan",
      "GastDesc_en": "Biscoff Caramel \"Apple Pie\" Cookie | Vegan",
      "MenuName": "COOKIE",
      "allergene": {
        "gluten": "Glutenhaltiges Getreide"
      },
      "merkmale": "",
      "naehrstoffe": "",
      "zusatzstoffe": [
        {
          "de": "Farbstoff",
          "en": "Colouring Agent"
        },
        {
          "de": "Antioxidationsmittel",
          "en": "Antioxidation"
        },
        {
          "de": "Alkohol",
          "en": "Alcohol"
        }
      ],
      "PrintOrder": "7",
      "CO2Value": null,
      "CO2Rating": null,
      "CO2Perc": null,
      "ClimateFriendly": null,
      "GastDesc": "Biscoff Karamell \"Apple Pie\" Cookie | Vegan",
      "date_de": "16.12.2025"
    },
    {
      "id": "4872409",
      "outlet": "cafe",
      "date": "2025-12-16",
      "CalendarWeek": "50",
      "day": "Dienstag",
      "mealtime": "Mittagessen",
      "IdentNr": "12025121698009",
      "itemId": "12773",
      "RecipeID": "9066",
      "ProductPrice": "3.50",
      "ProductPrice_2": null,
      "GastDesc_de": "Opéra Schnitte",
      "GastDesc_en": "Opera cake",
      "MenuName": "CLASSICS",
      "allergene": {
        "gluten": "Glutenhaltiges Getreide",
        "schalenfruchte": "Schalenfrüchte und Schalenfruchterzeugnisse",
        "huhnerei": "Hühnerei und Hühnereierzeugnisse",
        "soja": "Soja und Sojaerzeugnisse",
        "milch": "Milch und Milcherzeugnisse"
      },
      "merkmale": "",
      "naehrstoffe": "",
      "zusatzstoffe": null,
      "PrintOrder": "9",
      "CO2Value": null,
      "CO2Rating": null,
      "CO2Perc": null,
      "ClimateFriendly": null,
      "GastDesc": "Opéra Schnitte",
      "date_de": "16.12.2025"
    },
    {
      "id": "4872410",
      "outlet": "cafe",
      "date": "2025-12-17",
      "CalendarWeek": "50",
      "day": "Mittwoch",
      "mealtime": "Mittagessen",
      "IdentNr": "12025121798000",
      "itemId": "21060",
      "RecipeID": "8826",
      "ProductPrice": "3.50",
      "ProductPrice_2": null,
      "GastDesc_de": "Rumkugel",
      "GastDesc_en": "Rumball",
      "MenuName": "CHOCOLATE",
      "allergene": {
        "gluten": "Glutenhaltiges Getreide",
        "schalenfruchte": "Schalenfrüchte und Schalenfruchterzeugnisse",
        "huhnerei": "Hühnerei und Hühnereierzeugnisse",
        "soja": "Soja und Sojaerzeugnisse",
        "milch": "Milch und Milcherzeugnisse"
      },
      "merkmale": "",
      "naehrstoffe": "",
      "zusatzstoffe": [
        {
          "de": "Farbstoff",
          "en": "Colouring Agent"
        },
        {
          "de": "Alkohol",
          "en": "Alcohol"
        }
      ],
      "PrintOrder": "0",
      "CO2Value": null,
      "CO2Rating": null,
      "CO2Perc": null,
      "ClimateFriendly": null,
      "GastDesc": "Rumkugel",
      "date_de": "17.12.2025"
    },
    {
      "id": "4872411",
      "outlet": "cafe",
      "date": "2025-12-17",
      "CalendarWeek": "50",
      "day": "Mittwoch",
      "mealtime": "Mittagessen",
      "IdentNr": "12025121798002",
      "itemId": "21062",
      "RecipeID": "8635",
      "ProductPrice": "1.50",
      "ProductPrice_2": null,
      "GastDesc_de": "Quarkbällchen",
      "GastDesc_en": "Quark balls",
      "MenuName": "FAVOURITES",
      "allergene": {
        "gluten": "Glutenhaltiges Getreide",
        "huhnerei": "Hühnerei und Hühnereierzeugnisse",
        "milch": "Milch und Milcherzeugnisse"
      },
      "merkmale": "",
      "naehrstoffe": "",
      "zusatzstoffe": null,
      "PrintOrder": "2",
      "CO2Value": null,
      "CO2Rating": null,
      "CO2Perc": null,
      "ClimateFriendly": null,
      "GastDesc": "Quarkbällchen",
      "date_de": "17.12.2025"
    },
    {
      "id": "4872412",
      "outlet": "cafe",
      "date": "2025-12-17",
      "CalendarWeek": "50",
      "day": "Mittwoch",
      "mealtime": "Mittagessen",
      "IdentNr": "12025121798003",
      "itemId": "21063",
      "RecipeID": "8211",
      "ProductPrice": "0.50",
      "ProductPrice_2": null,
      "GastDesc_de": "LES ARLETTES (Französische Blätterteigkekse) Vegan",
      "GastDesc_en": "LES ARLETTES  (French Puff Pastry Cookies) Vegan",
      "MenuName": "MINIS",
      "allergene": {
        "gluten": "Glutenhaltiges Getreide"
      },
      "merkmale": {
        "vegan": "Vegan",
        "vegetarisch": "Vegetarisch"
      },
      "naehrstoffe": "",
      "zusatzstoffe": [
        {
          "de": "Farbstoff",
          "en": "Colouring Agent"
        },
        {
          "de": "Alkohol",
          "en": "Alcohol"
        }
      ],
      "PrintOrder": "3",
      "CO2Value": null,
      "CO2Rating": null,
      "CO2Perc": null,
      "ClimateFriendly": null,
      "GastDesc": "LES ARLETTES (Französische Blätterteigkekse) Vegan",
      "date_de": "17.12.2025"
    },
    {
      "id": "4872413",
      "outlet": "cafe",
      "date": "2025-12-17",
      "CalendarWeek": "50",
      "day": "Mittwoch",
      "mealtime": "Mittagessen",
      "IdentNr": "12025121798005",
      "itemId": "21064",
      "RecipeID": "9036",
      "ProductPrice": "2.70",
      "ProductPrice_2": null,
      "GastDesc_de": "Kürbis-Bananenbrot mit Walnüssen | Zuckerfrei",
      "GastDesc_en": "Pumpkin-banana bread with walnuts | Sugar-free",
      "MenuName": "PEOPLES CHOICE",
      "allergene": {
        "gluten": "Glutenhaltiges Getreide",
        "schalenfruchte": "Schalenfrüchte und Schalenfruchterzeugnisse",
        "huhnerei": "Hühnerei und Hühnereierzeugnisse",
        "milch": "Milch und Milcherzeugnisse"
      },
      "merkmale": "",
      "naehrstoffe": "",
      "zusatzstoffe": null,
      "PrintOrder": "5",
      "CO2Value": null,
      "CO2Rating": null,
      "CO2Perc": null,
      "ClimateFriendly": null,
      "GastDesc": "Kürbis-Bananenbrot mit Walnüssen | Zuckerfrei",
      "date_de": "17.12.2025"
    },
    {
      "id": "4872414",
      "outlet": "cafe",
      "date": "2025-12-17",
      "CalendarWeek": "50",
      "day": "Mittwoch",
      "mealtime": "Mittagessen",
      "IdentNr": "12025121798006",
      "itemId": "21061",
      "RecipeID": "8672",
      "ProductPrice": "2.60",
      "ProductPrice_2": null,
      "GastDesc_de": "Quarkstollen",
      "GastDesc_en": "Curd Stollen",
      "MenuName": "SEASON",
      "allergene": {
        "gluten": "Glutenhaltiges Getreide",
        "schalenfruchte": "Schalenfrüchte und Schalenfruchterzeugnisse",
        "huhnerei": "Hühnerei und Hühnereierzeugnisse",
        "milch": "Milch und Milcherzeugnisse"
      },
      "merkmale": "",
      "naehrstoffe": "",
      "zusatzstoffe": [
        {
          "de": "Farbstoff",
          "en": "Colouring Agent"
        },
        {
          "de": "Alkohol",
          "en": "Alcohol"
        }
      ],
      "PrintOrder": "6",
      "CO2Value": null,
      "CO2Rating": null,
      "CO2Perc": null,
      "ClimateFriendly": null,
      "GastDesc": "Quarkstollen",
      "date_de": "17.12.2025"
    },
    {
      "id": "4872415",
      "outlet": "cafe",
      "date": "2025-12-17",
      "CalendarWeek": "50",
      "day": "Mittwoch",
      "mealtime": "Mittagessen",
      "IdentNr": "12025121798007",
      "itemId": "12776",
      "RecipeID": "9037",
      "ProductPrice": "2.50",
      "ProductPrice_2": null,
      "GastDesc_de": "Biscoff Karamell \"Apple Pie\" Cookie | Vegan",
      "GastDesc_en": "Biscoff Caramel \"Apple Pie\" Cookie | Vegan",
      "MenuName": "COOKIE",
      "allergene": {
        "gluten": "Glutenhaltiges Getreide"
      },
      "merkmale": "",
      "naehrstoffe": "",
      "zusatzstoffe": [
        {
          "de": "Farbstoff",
          "en": "Colouring Agent"
        },
        {
          "de": "Antioxidationsmittel",
          "en": "Antioxidation"
        },
        {
          "de": "Alkohol",
          "en": "Alcohol"
        }
      ],
      "PrintOrder": "7",
      "CO2Value": null,
      "CO2Rating": null,
      "CO2Perc": null,
      "ClimateFriendly": null,
      "GastDesc": "Biscoff Karamell \"Apple Pie\" Cookie | Vegan",
      "date_de": "17.12.2025"
    },
    {
      "id": "4872416",
      "outlet": "cafe",
      "date": "2025-12-17",
      "CalendarWeek": "50",
      "day": "Mittwoch",
      "mealtime": "Mittagessen",
      "IdentNr": "12025121798009",
      "itemId": "12773",
      "RecipeID": "9066",
      "ProductPrice": "3.50",
      "ProductPrice_2": null,
      "GastDesc_de": "Opéra Schnitte",
      "GastDesc_en": "Opera cake",
      "MenuName": "CLASSICS",
      "allergene": {
        "gluten": "Glutenhaltiges Getreide",
        "schalenfruchte": "Schalenfrüchte und Schalenfruchterzeugnisse",
        "huhnerei": "Hühnerei und Hühnereierzeugnisse",
        "soja": "Soja und Sojaerzeugnisse",
        "milch": "Milch und Milcherzeugnisse"
      },
      "merkmale": "",
      "naehrstoffe": "",
      "zusatzstoffe": null,
      "PrintOrder": "9",
      "CO2Value": null,
      "CO2Rating": null,
      "CO2Perc": null,
      "ClimateFriendly": null,
      "GastDesc": "Opéra Schnitte",
      "date_de": "17.12.2025"
    },
    {
      "id": "4872417",
      "outlet": "cafe",
      "date": "2025-12-18",
      "CalendarWeek": "50",
      "day": "Donnerstag",
      "mealtime": "Mittagessen",
      "IdentNr": "12025121898000",
      "itemId": "21060",
      "RecipeID": "8826",
      "ProductPrice": "3.50",
      "ProductPrice_2": null,
      "GastDesc_de": "Rumkugel",
      "GastDesc_en": "Rumball",
      "MenuName": "CHOCOLATE",
      "allergene": {
        "gluten": "Glutenhaltiges Getreide",
        "schalenfruchte": "Schalenfrüchte und Schalenfruchterzeugnisse",
        "huhnerei": "Hühnerei und Hühnereierzeugnisse",
        "soja": "Soja und Sojaerzeugnisse",
        "milch": "Milch und Milcherzeugnisse"
      },
      "merkmale": "",
      "naehrstoffe": "",
      "zusatzstoffe": [
        {
          "de": "Farbstoff",
          "en": "Colouring Agent"
        },
        {
          "de": "Alkohol",
          "en": "Alcohol"
        }
      ],
      "PrintOrder": "0",
      "CO2Value": null,
      "CO2Rating": null,
      "CO2Perc": null,
      "ClimateFriendly": null,
      "GastDesc": "Rumkugel",
      "date_de": "18.12.2025"
    },
    {
      "id": "4872418",
      "outlet": "cafe",
      "date": "2025-12-18",
      "CalendarWeek": "50",
      "day": "Donnerstag",
      "mealtime": "Mittagessen",
      "IdentNr": "12025121898002",
      "itemId": "21062",
      "RecipeID": "8635",
      "ProductPrice": "1.50",
      "ProductPrice_2": null,
      "GastDesc_de": "Quarkbällchen",
      "GastDesc_en": "Quark balls",
      "MenuName": "FAVOURITES",
      "allergene": {
        "gluten": "Glutenhaltiges Getreide",
        "huhnerei": "Hühnerei und Hühnereierzeugnisse",
        "milch": "Milch und Milcherzeugnisse"
      },
      "merkmale": "",
      "naehrstoffe": "",
      "zusatzstoffe": null,
      "PrintOrder": "2",
      "CO2Value": null,
      "CO2Rating": null,
      "CO2Perc": null,
      "ClimateFriendly": null,
      "GastDesc": "Quarkbällchen",
      "date_de": "18.12.2025"
    },
    {
      "id": "4872419",
      "outlet": "cafe",
      "date": "2025-12-18",
      "CalendarWeek": "50",
      "day": "Donnerstag",
      "mealtime": "Mittagessen",
      "IdentNr": "12025121898003",
      "itemId": "21063",
      "RecipeID": "8211",
      "ProductPrice": "0.50",
      "ProductPrice_2": null,
      "GastDesc_de": "LES ARLETTES (Französische Blätterteigkekse) Vegan",
      "GastDesc_en": "LES ARLETTES  (French Puff Pastry Cookies) Vegan",
      "MenuName": "MINIS",
      "allergene": {
        "gluten": "Glutenhaltiges Getreide"
      },
      "merkmale": {
        "vegan": "Vegan",
        "vegetarisch": "Vegetarisch"
      },
      "naehrstoffe": "",
      "zusatzstoffe": [
        {
          "de": "Farbstoff",
          "en": "Colouring Agent"
        },
        {
          "de": "Alkohol",
          "en": "Alcohol"
        }
      ],
      "PrintOrder": "3",
      "CO2Value": null,
      "CO2Rating": null,
      "CO2Perc": null,
      "ClimateFriendly": null,
      "GastDesc": "LES ARLETTES (Französische Blätterteigkekse) Vegan",
      "date_de": "18.12.2025"
    },
    {
      "id": "4872420",
      "outlet": "cafe",
      "date": "2025-12-18",
      "CalendarWeek": "50",
      "day": "Donnerstag",
      "mealtime": "Mittagessen",
      "IdentNr": "12025121898005",
      "itemId": "21064",
      "RecipeID": "9036",
      "ProductPrice": "2.70",
      "ProductPrice_2": null,
      "GastDesc_de": "Kürbis-Bananenbrot mit Walnüssen | Zuckerfrei",
      "GastDesc_en": "Pumpkin-banana bread with walnuts | Sugar-free",
      "MenuName": "PEOPLES CHOICE",
      "allergene": {
        "gluten": "Glutenhaltiges Getreide",
        "schalenfruchte": "Schalenfrüchte und Schalenfruchterzeugnisse",
        "huhnerei": "Hühnerei und Hühnereierzeugnisse",
        "milch": "Milch und Milcherzeugnisse"
      },
      "merkmale": "",
      "naehrstoffe": "",
      "zusatzstoffe": null,
      "PrintOrder": "5",
      "CO2Value": null,
      "CO2Rating": null,
      "CO2Perc": null,
      "ClimateFriendly": null,
      "GastDesc": "Kürbis-Bananenbrot mit Walnüssen | Zuckerfrei",
      "date_de": "18.12.2025"
    },
    {
      "id": "4872421",
      "outlet": "cafe",
      "date": "2025-12-18",
      "CalendarWeek": "50",
      "day": "Donnerstag",
      "mealtime": "Mittagessen",
      "IdentNr": "12025121898006",
      "itemId": "21061",
      "RecipeID": "8672",
      "ProductPrice": "2.60",
      "ProductPrice_2": null,
      "GastDesc_de": "Quarkstollen",
      "GastDesc_en": "Curd Stollen",
      "MenuName": "SEASON",
      "allergene": {
        "gluten": "Glutenhaltiges Getreide",
        "schalenfruchte": "Schalenfrüchte und Schalenfruchterzeugnisse",
        "huhnerei": "Hühnerei und Hühnereierzeugnisse",
        "milch": "Milch und Milcherzeugnisse"
      },
      "merkmale": "",
      "naehrstoffe": "",
      "zusatzstoffe": [
        {
          "de": "Farbstoff",
          "en": "Colouring Agent"
        },
        {
          "de": "Alkohol",
          "en": "Alcohol"
        }
      ],
      "PrintOrder": "6",
      "CO2Value": null,
      "CO2Rating": null,
      "CO2Perc": null,
      "ClimateFriendly": null,
      "GastDesc": "Quarkstollen",
      "date_de": "18.12.2025"
    },
    {
      "id": "4872422",
      "outlet": "cafe",
      "date": "2025-12-18",
      "CalendarWeek": "50",
      "day": "Donnerstag",
      "mealtime": "Mittagessen",
      "IdentNr": "12025121898007",
      "itemId": "12776",
      "RecipeID": "9037",
      "ProductPrice": "2.50",
      "ProductPrice_2": null,
      "GastDesc_de": "Biscoff Karamell \"Apple Pie\" Cookie | Vegan",
      "GastDesc_en": "Biscoff Caramel \"Apple Pie\" Cookie | Vegan",
      "MenuName": "COOKIE",
      "allergene": {
        "gluten": "Glutenhaltiges Getreide"
      },
      "merkmale": "",
      "naehrstoffe": "",
      "zusatzstoffe": [
        {
          "de": "Farbstoff",
          "en": "Colouring Agent"
        },
        {
          "de": "Antioxidationsmittel",
          "en": "Antioxidation"
        },
        {
          "de": "Alkohol",
          "en": "Alcohol"
        }
      ],
      "PrintOrder": "7",
      "CO2Value": null,
      "CO2Rating": null,
      "CO2Perc": null,
      "ClimateFriendly": null,
      "GastDesc": "Biscoff Karamell \"Apple Pie\" Cookie | Vegan",
      "date_de": "18.12.2025"
    },
    {
      "id": "4872423",
      "outlet": "cafe",
      "date": "2025-12-18",
      "CalendarWeek": "50",
      "day": "Donnerstag",
      "mealtime": "Mittagessen",
      "IdentNr": "12025121898009",
      "itemId": "12773",
      "RecipeID": "9066",
      "ProductPrice": "3.50",
      "ProductPrice_2": null,
      "GastDesc_de": "Opéra Schnitte",
      "GastDesc_en": "Opera cake",
      "MenuName": "CLASSICS",
      "allergene": {
        "gluten": "Glutenhaltiges Getreide",
        "schalenfruchte": "Schalenfrüchte und Schalenfruchterzeugnisse",
        "huhnerei": "Hühnerei und Hühnereierzeugnisse",
        "soja": "Soja und Sojaerzeugnisse",
        "milch": "Milch und Milcherzeugnisse"
      },
      "merkmale": "",
      "naehrstoffe": "",
      "zusatzstoffe": null,
      "PrintOrder": "9",
      "CO2Value": null,
      "CO2Rating": null,
      "CO2Perc": null,
      "ClimateFriendly": null,
      "GastDesc": "Opéra Schnitte",
      "date_de": "18.12.2025"
    },
    {
      "id": "4872424",
      "outlet": "cafe",
      "date": "2025-12-19",
      "CalendarWeek": "50",
      "day": "Freitag",
      "mealtime": "Mittagessen",
      "IdentNr": "12025121998000",
      "itemId": "21060",
      "RecipeID": "8826",
      "ProductPrice": "3.50",
      "ProductPrice_2": null,
      "GastDesc_de": "Rumkugel",
      "GastDesc_en": "Rumball",
      "MenuName": "CHOCOLATE",
      "allergene": {
        "gluten": "Glutenhaltiges Getreide",
        "schalenfruchte": "Schalenfrüchte und Schalenfruchterzeugnisse",
        "huhnerei": "Hühnerei und Hühnereierzeugnisse",
        "soja": "Soja und Sojaerzeugnisse",
        "milch": "Milch und Milcherzeugnisse"
      },
      "merkmale": "",
      "naehrstoffe": "",
      "zusatzstoffe": [
        {
          "de": "Farbstoff",
          "en": "Colouring Agent"
        },
        {
          "de": "Alkohol",
          "en": "Alcohol"
        }
      ],
      "PrintOrder": "0",
      "CO2Value": null,
      "CO2Rating": null,
      "CO2Perc": null,
      "ClimateFriendly": null,
      "GastDesc": "Rumkugel",
      "date_de": "19.12.2025"
    },
    {
      "id": "4872425",
      "outlet": "cafe",
      "date": "2025-12-19",
      "CalendarWeek": "50",
      "day": "Freitag",
      "mealtime": "Mittagessen",
      "IdentNr": "12025121998002",
      "itemId": "21062",
      "RecipeID": "8635",
      "ProductPrice": "1.50",
      "ProductPrice_2": null,
      "GastDesc_de": "Quarkbällchen",
      "GastDesc_en": "Quark balls",
      "MenuName": "FAVOURITES",
      "allergene": {
        "gluten": "Glutenhaltiges Getreide",
        "huhnerei": "Hühnerei und Hühnereierzeugnisse",
        "milch": "Milch und Milcherzeugnisse"
      },
      "merkmale": "",
      "naehrstoffe": "",
      "zusatzstoffe": null,
      "PrintOrder": "2",
      "CO2Value": null,
      "CO2Rating": null,
      "CO2Perc": null,
      "ClimateFriendly": null,
      "GastDesc": "Quarkbällchen",
      "date_de": "19.12.2025"
    },
    {
      "id": "4872426",
      "outlet": "cafe",
      "date": "2025-12-19",
      "CalendarWeek": "50",
      "day": "Freitag",
      "mealtime": "Mittagessen",
      "IdentNr": "12025121998003",
      "itemId": "21063",
      "RecipeID": "8211",
      "ProductPrice": "0.50",
      "ProductPrice_2": null,
      "GastDesc_de": "LES ARLETTES (Französische Blätterteigkekse) Vegan",
      "GastDesc_en": "LES ARLETTES  (French Puff Pastry Cookies) Vegan",
      "MenuName": "MINIS",
      "allergene": {
        "gluten": "Glutenhaltiges Getreide"
      },
      "merkmale": {
        "vegan": "Vegan",
        "vegetarisch": "Vegetarisch"
      },
      "naehrstoffe": "",
      "zusatzstoffe": [
        {
          "de": "Farbstoff",
          "en": "Colouring Agent"
        },
        {
          "de": "Alkohol",
          "en": "Alcohol"
        }
      ],
      "PrintOrder": "3",
      "CO2Value": null,
      "CO2Rating": null,
      "CO2Perc": null,
      "ClimateFriendly": null,
      "GastDesc": "LES ARLETTES (Französische Blätterteigkekse) Vegan",
      "date_de": "19.12.2025"
    },
    {
      "id": "4872427",
      "outlet": "cafe",
      "date": "2025-12-19",
      "CalendarWeek": "50",
      "day": "Freitag",
      "mealtime": "Mittagessen",
      "IdentNr": "12025121998005",
      "itemId": "21064",
      "RecipeID": "9036",
      "ProductPrice": "2.70",
      "ProductPrice_2": null,
      "GastDesc_de": "Kürbis-Bananenbrot mit Walnüssen | Zuckerfrei",
      "GastDesc_en": "Pumpkin-banana bread with walnuts | Sugar-free",
      "MenuName": "PEOPLES CHOICE",
      "allergene": {
        "gluten": "Glutenhaltiges Getreide",
        "schalenfruchte": "Schalenfrüchte und Schalenfruchterzeugnisse",
        "huhnerei": "Hühnerei und Hühnereierzeugnisse",
        "milch": "Milch und Milcherzeugnisse"
      },
      "merkmale": "",
      "naehrstoffe": "",
      "zusatzstoffe": null,
      "PrintOrder": "5",
      "CO2Value": null,
      "CO2Rating": null,
      "CO2Perc": null,
      "ClimateFriendly": null,
      "GastDesc": "Kürbis-Bananenbrot mit Walnüssen | Zuckerfrei",
      "date_de": "19.12.2025"
    },
    {
      "id": "4872428",
      "outlet": "cafe",
      "date": "2025-12-19",
      "CalendarWeek": "50",
      "day": "Freitag",
      "mealtime": "Mittagessen",
      "IdentNr": "12025121998006",
      "itemId": "21061",
      "RecipeID": "8672",
      "ProductPrice": "2.60",
      "ProductPrice_2": null,
      "GastDesc_de": "Quarkstollen",
      "GastDesc_en": "Curd Stollen",
      "MenuName": "SEASON",
      "allergene": {
        "gluten": "Glutenhaltiges Getreide",
        "schalenfruchte": "Schalenfrüchte und Schalenfruchterzeugnisse",
        "huhnerei": "Hühnerei und Hühnereierzeugnisse",
        "milch": "Milch und Milcherzeugnisse"
      },
      "merkmale": "",
      "naehrstoffe": "",
      "zusatzstoffe": [
        {
          "de": "Farbstoff",
          "en": "Colouring Agent"
        },
        {
          "de": "Alkohol",
          "en": "Alcohol"
        }
      ],
      "PrintOrder": "6",
      "CO2Value": null,
      "CO2Rating": null,
      "CO2Perc": null,
      "ClimateFriendly": null,
      "GastDesc": "Quarkstollen",
      "date_de": "19.12.2025"
    },
    {
      "id": "4872429",
      "outlet": "cafe",
      "date": "2025-12-19",
      "CalendarWeek": "50",
      "day": "Freitag",
      "mealtime": "Mittagessen",
      "IdentNr": "12025121998007",
      "itemId": "12776",
      "RecipeID": "9037",
      "ProductPrice": "2.50",
      "ProductPrice_2": null,
      "GastDesc_de": "Biscoff Karamell \"Apple Pie\" Cookie | Vegan",
      "GastDesc_en": "Biscoff Caramel \"Apple Pie\" Cookie | Vegan",
      "MenuName": "COOKIE",
      "allergene": {
        "gluten": "Glutenhaltiges Getreide"
      },
      "merkmale": "",
      "naehrstoffe": "",
      "zusatzstoffe": [
        {
          "de": "Farbstoff",
          "en": "Colouring Agent"
        },
        {
          "de": "Antioxidationsmittel",
          "en": "Antioxidation"
        },
        {
          "de": "Alkohol",
          "en": "Alcohol"
        }
      ],
      "PrintOrder": "7",
      "CO2Value": null,
      "CO2Rating": null,
      "CO2Perc": null,
      "ClimateFriendly": null,
      "GastDesc": "Biscoff Karamell \"Apple Pie\" Cookie | Vegan",
      "date_de": "19.12.2025"
    },
    {
      "id": "4872430",
      "outlet": "cafe",
      "date": "2025-12-19",
      "CalendarWeek": "50",
      "day": "Freitag",
      "mealtime": "Mittagessen",
      "IdentNr": "12025121998009",
      "itemId": "12773",
      "RecipeID": "9066",
      "ProductPrice": "3.50",
      "ProductPrice_2": null,
      "GastDesc_de": "Opéra Schnitte",
      "GastDesc_en": "Opera cake",
      "MenuName": "CLASSICS",
      "allergene": {
        "gluten": "Glutenhaltiges Getreide",
        "schalenfruchte": "Schalenfrüchte und Schalenfruchterzeugnisse",
        "huhnerei": "Hühnerei und Hühnereierzeugnisse",
        "soja": "Soja und Sojaerzeugnisse",
        "milch": "Milch und Milcherzeugnisse"
      },
      "merkmale": "",
      "naehrstoffe": "",
      "zusatzstoffe": null,
      "PrintOrder": "9",
      "CO2Value": null,
      "CO2Rating": null,
      "CO2Perc": null,
      "ClimateFriendly": null,
      "GastDesc": "Opéra Schnitte",
      "date_de": "19.12.2025"
    },
    {
      "id": "4803904",
      "outlet": "canteen",
      "date": "2025-12-06",
      "CalendarWeek": "49",
      "day": "Samstag",
      "mealtime": "Abendessen",
      "IdentNr": "12025120698013",
      "itemId": "17562",
      "RecipeID": "7881",
      "ProductPrice": "11.00",
      "ProductPrice_2": null,
      "GastDesc_de": "Pute | Gyros | Tzatziki",
      "GastDesc_en": "Turkey | Gyros | Tzatziki",
      "MenuName": "DINNER Classic_17:00-19:00",
      "allergene": {
        "milch": "Milch und Milcherzeugnisse",
        "sellerie": "Sellerie und Sellerieerzeugnisse",
        "schwefel": "Schwefeldioxid und Sulfide"
      },
      "merkmale": "",
      "naehrstoffe": "",
      "zusatzstoffe": [
        {
          "de": "geschwärzt",
          "en": "Blacked Out"
        },
        {
          "de": "Antioxidationsmittel",
          "en": "Antioxidation"
        }
      ],
      "PrintOrder": "13",
      "CO2Value": "1833.00",
      "CO2Rating": "C",
      "CO2Perc": "100.00",
      "ClimateFriendly": null,
      "GastDesc": "Pute | Gyros | Tzatziki",
      "date_de": "06.12.2025"
    },
    {
      "id": "4803906",
      "outlet": "canteen",
      "date": "2025-12-06",
      "CalendarWeek": "49",
      "day": "Samstag",
      "mealtime": "Abendessen",
      "IdentNr": "12025120698014",
      "itemId": "17563",
      "RecipeID": "4865",
      "ProductPrice": "12.00",
      "ProductPrice_2": null,
      "GastDesc_de": "Rinderschmorbraten | Blaukraut | Spätzle",
      "GastDesc_en": "Braised Beef | Red cabbage | Spätzle",
      "MenuName": "LUNCH Meat_",
      "allergene": {
        "gluten": "Glutenhaltiges Getreide",
        "huhnerei": "Hühnerei und Hühnereierzeugnisse",
        "milch": "Milch und Milcherzeugnisse",
        "sellerie": "Sellerie und Sellerieerzeugnisse",
        "schwefel": "Schwefeldioxid und Sulfide"
      },
      "merkmale": "",
      "naehrstoffe": "",
      "zusatzstoffe": [
        {
          "de": "Alkohol",
          "en": "Alcohol"
        }
      ],
      "PrintOrder": "14",
      "CO2Value": "7035.00",
      "CO2Rating": "E",
      "CO2Perc": "100.00",
      "ClimateFriendly": null,
      "GastDesc": "Rinderschmorbraten | Blaukraut | Spätzle",
      "date_de": "06.12.2025"
    },
    {
      "id": "4803908",
      "outlet": "canteen",
      "date": "2025-12-06",
      "CalendarWeek": "49",
      "day": "Samstag",
      "mealtime": "Abendessen",
      "IdentNr": "12025120698016",
      "itemId": "17565",
      "RecipeID": "4327",
      "ProductPrice": "9.50",
      "ProductPrice_2": null,
      "GastDesc_de": "Curry von roten Linsen | Kürbis | Limettenjoghurt",
      "GastDesc_en": "Red Lentil Curry | Pumpkin | Lime Yoghurt",
      "MenuName": "LUNCH Vegi/Vegan_",
      "allergene": {
        "gluten": "Glutenhaltiges Getreide",
        "milch": "Milch und Milcherzeugnisse",
        "erdnuss": "Erdnüsse und Erdnusserzeugnisse",
        "sellerie": "Sellerie und Sellerieerzeugnisse"
      },
      "merkmale": {
        "vegan": "Vegan",
        "vegetarisch": "Vegetarisch"
      },
      "naehrstoffe": "",
      "zusatzstoffe": null,
      "PrintOrder": "16",
      "CO2Value": "580.00",
      "CO2Rating": "B",
      "CO2Perc": "100.00",
      "ClimateFriendly": null,
      "GastDesc": "Curry von roten Linsen | Kürbis | Limettenjoghurt",
      "date_de": "06.12.2025"
    },
    {
      "id": "4803910",
      "outlet": "canteen",
      "date": "2025-12-07",
      "CalendarWeek": "49",
      "day": "Sonntag",
      "mealtime": "Abendessen",
      "IdentNr": "12025120798018",
      "itemId": "17864",
      "RecipeID": "6296",
      "ProductPrice": "12.00",
      "ProductPrice_2": null,
      "GastDesc_de": "Bratwurst | Sauerkraut | Majoranjus",
      "GastDesc_en": "Bratwurst | Sauerkraut | Marjoram Jus",
      "MenuName": "DINNER Meat _|",
      "allergene": {
        "milch": "Milch und Milcherzeugnisse",
        "sellerie": "Sellerie und Sellerieerzeugnisse",
        "senf": "Senf und Senferzeugnisse",
        "schwefel": "Schwefeldioxid und Sulfide"
      },
      "merkmale": "",
      "naehrstoffe": "",
      "zusatzstoffe": [
        {
          "de": "Phosphat",
          "en": "Phosphate"
        },
        {
          "de": "Alkohol",
          "en": "Alcohol"
        }
      ],
      "PrintOrder": "18",
      "CO2Value": "830.00",
      "CO2Rating": "B",
      "CO2Perc": "100.00",
      "ClimateFriendly": null,
      "GastDesc": "Bratwurst | Sauerkraut | Majoranjus",
      "date_de": "07.12.2025"
    },
    {
      "id": "4803911",
      "outlet": "canteen",
      "date": "2025-12-07",
      "CalendarWeek": "49",
      "day": "Sonntag",
      "mealtime": "Mittagessen",
      "IdentNr": "12025120798018",
      "itemId": "17864",
      "RecipeID": "6296",
      "ProductPrice": "12.00",
      "ProductPrice_2": null,
      "GastDesc_de": "Bratwurst | Sauerkraut | Majoranjus",
      "GastDesc_en": "Bratwurst | Sauerkraut | Marjoram Jus",
      "MenuName": "DINNER Meat _|",
      "allergene": {
        "milch": "Milch und Milcherzeugnisse",
        "sellerie": "Sellerie und Sellerieerzeugnisse",
        "senf": "Senf und Senferzeugnisse",
        "schwefel": "Schwefeldioxid und Sulfide"
      },
      "merkmale": "",
      "naehrstoffe": "",
      "zusatzstoffe": [
        {
          "de": "Phosphat",
          "en": "Phosphate"
        },
        {
          "de": "Alkohol",
          "en": "Alcohol"
        }
      ],
      "PrintOrder": "18",
      "CO2Value": "830.00",
      "CO2Rating": "B",
      "CO2Perc": "100.00",
      "ClimateFriendly": null,
      "GastDesc": "Bratwurst | Sauerkraut | Majoranjus",
      "date_de": "07.12.2025"
    },
    {
      "id": "4803913",
      "outlet": "canteen",
      "date": "2025-12-07",
      "CalendarWeek": "49",
      "day": "Sonntag",
      "mealtime": "Abendessen",
      "IdentNr": "12025120798019",
      "itemId": "17865",
      "RecipeID": "8854",
      "ProductPrice": "12.00",
      "ProductPrice_2": null,
      "GastDesc_de": "Hokifilet | Reisnudel | Rote Bete | Fenchel",
      "GastDesc_en": "Hoki | Rice Noodle | Beetroot | Fennel",
      "MenuName": "DINNER Fish _|",
      "allergene": {
        "fisch": "Fisch und Fischerzeugnisse",
        "milch": "Milch und Milcherzeugnisse",
        "sellerie": "Sellerie und Sellerieerzeugnisse",
        "schwefel": "Schwefeldioxid und Sulfide"
      },
      "merkmale": "",
      "naehrstoffe": "",
      "zusatzstoffe": [
        {
          "de": "Süßungsmittel",
          "en": "Sweetener"
        },
        {
          "de": "Antioxidationsmittel",
          "en": "Antioxidation"
        },
        {
          "de": "Alkohol",
          "en": "Alcohol"
        }
      ],
      "PrintOrder": "19",
      "CO2Value": "1429.00",
      "CO2Rating": "C",
      "CO2Perc": "100.00",
      "ClimateFriendly": null,
      "GastDesc": "Hokifilet | Reisnudel | Rote Bete | Fenchel",
      "date_de": "07.12.2025"
    },
    {
      "id": "4803914",
      "outlet": "canteen",
      "date": "2025-12-07",
      "CalendarWeek": "49",
      "day": "Sonntag",
      "mealtime": "Mittagessen",
      "IdentNr": "12025120798019",
      "itemId": "17865",
      "RecipeID": "8854",
      "ProductPrice": "12.00",
      "ProductPrice_2": null,
      "GastDesc_de": "Hokifilet | Reisnudel | Rote Bete | Fenchel",
      "GastDesc_en": "Hoki | Rice Noodle | Beetroot | Fennel",
      "MenuName": "DINNER Fish _|",
      "allergene": {
        "fisch": "Fisch und Fischerzeugnisse",
        "milch": "Milch und Milcherzeugnisse",
        "sellerie": "Sellerie und Sellerieerzeugnisse",
        "schwefel": "Schwefeldioxid und Sulfide"
      },
      "merkmale": "",
      "naehrstoffe": "",
      "zusatzstoffe": [
        {
          "de": "Süßungsmittel",
          "en": "Sweetener"
        },
        {
          "de": "Antioxidationsmittel",
          "en": "Antioxidation"
        },
        {
          "de": "Alkohol",
          "en": "Alcohol"
        }
      ],
      "PrintOrder": "19",
      "CO2Value": "1429.00",
      "CO2Rating": "C",
      "CO2Perc": "100.00",
      "ClimateFriendly": null,
      "GastDesc": "Hokifilet | Reisnudel | Rote Bete | Fenchel",
      "date_de": "07.12.2025"
    },
    {
      "id": "4803916",
      "outlet": "canteen",
      "date": "2025-12-07",
      "CalendarWeek": "49",
      "day": "Sonntag",
      "mealtime": "Abendessen",
      "IdentNr": "12025120798020",
      "itemId": "17866",
      "RecipeID": "7979",
      "ProductPrice": "9.50",
      "ProductPrice_2": null,
      "GastDesc_de": "Süßkartoffelgnocchi | Pilzrahm | Rucola",
      "GastDesc_en": "Sweet Potato Gnocchi | Creamed Mushrooms | Arugula",
      "MenuName": "DINNER Vegi / Vegan_|",
      "allergene": {
        "gluten": "Glutenhaltiges Getreide",
        "schwefel": "Schwefeldioxid und Sulfide"
      },
      "merkmale": {
        "vegan": "Vegan",
        "vegetarisch": "Vegetarisch"
      },
      "naehrstoffe": "",
      "zusatzstoffe": [
        {
          "de": "Alkohol",
          "en": "Alcohol"
        }
      ],
      "PrintOrder": "20",
      "CO2Value": "449.00",
      "CO2Rating": "B",
      "CO2Perc": "100.00",
      "ClimateFriendly": null,
      "GastDesc": "Süßkartoffelgnocchi | Pilzrahm | Rucola",
      "date_de": "07.12.2025"
    },
    {
      "id": "4803917",
      "outlet": "canteen",
      "date": "2025-12-07",
      "CalendarWeek": "49",
      "day": "Sonntag",
      "mealtime": "Mittagessen",
      "IdentNr": "12025120798020",
      "itemId": "17866",
      "RecipeID": "7979",
      "ProductPrice": "9.50",
      "ProductPrice_2": null,
      "GastDesc_de": "Süßkartoffelgnocchi | Pilzrahm | Rucola",
      "GastDesc_en": "Sweet Potato Gnocchi | Creamed Mushrooms | Arugula",
      "MenuName": "DINNER Vegi / Vegan_|",
      "allergene": {
        "gluten": "Glutenhaltiges Getreide",
        "schwefel": "Schwefeldioxid und Sulfide"
      },
      "merkmale": {
        "vegan": "Vegan",
        "vegetarisch": "Vegetarisch"
      },
      "naehrstoffe": "",
      "zusatzstoffe": [
        {
          "de": "Alkohol",
          "en": "Alcohol"
        }
      ],
      "PrintOrder": "20",
      "CO2Value": "449.00",
      "CO2Rating": "B",
      "CO2Perc": "100.00",
      "ClimateFriendly": null,
      "GastDesc": "Süßkartoffelgnocchi | Pilzrahm | Rucola",
      "date_de": "07.12.2025"
    },
    {
      "id": "4803919",
      "outlet": "canteen",
      "date": "2025-12-08",
      "CalendarWeek": "49",
      "day": "Montag",
      "mealtime": "Mittagessen",
      "IdentNr": "12025120898000",
      "itemId": "17549",
      "RecipeID": "8273",
      "ProductPrice": "12.00",
      "ProductPrice_2": null,
      "GastDesc_de": "Planted Chicken | Udon | Scharfe Kokossauce",
      "GastDesc_en": "Planted Chicken | Udon | Spicy Coconut Sauce",
      "MenuName": "COUNTER 1.1 Bowls_",
      "allergene": {
        "gluten": "Glutenhaltiges Getreide",
        "senf": "Senf und Senferzeugnisse",
        "sesam": "Sesamsamen und Sesamsamenerzeugnisse"
      },
      "merkmale": {
        "vegan": "Vegan",
        "vegetarisch": "Vegetarisch"
      },
      "naehrstoffe": "",
      "zusatzstoffe": [
        {
          "de": "Geschmacksverstärker",
          "en": "Flavor Enhancer"
        },
        {
          "de": "Konservierungsstoff",
          "en": "Preservatives"
        }
      ],
      "PrintOrder": "0",
      "CO2Value": "471.00",
      "CO2Rating": "A",
      "CO2Perc": "100.00",
      "ClimateFriendly": "1",
      "GastDesc": "Planted Chicken | Udon | Scharfe Kokossauce",
      "date_de": "08.12.2025"
    },
    {
      "id": "4803920",
      "outlet": "canteen",
      "date": "2025-12-08",
      "CalendarWeek": "49",
      "day": "Montag",
      "mealtime": "Mittagessen",
      "IdentNr": "12025120898001",
      "itemId": "17550",
      "RecipeID": "2883",
      "ProductPrice": "12.00",
      "ProductPrice_2": null,
      "GastDesc_de": "Schweinefilet | Bohnenragout | Pancetta",
      "GastDesc_en": "Pork Fillet | Mixed Bean Ragout | Pancetta",
      "MenuName": "COUNTER 2.1 Meat",
      "allergene": {
        "gluten": "Glutenhaltiges Getreide",
        "milch": "Milch und Milcherzeugnisse",
        "sellerie": "Sellerie und Sellerieerzeugnisse",
        "schwefel": "Schwefeldioxid und Sulfide"
      },
      "merkmale": "",
      "naehrstoffe": "",
      "zusatzstoffe": [
        {
          "de": "Antioxidationsmittel",
          "en": "Antioxidation"
        },
        {
          "de": "Konservierungsstoff",
          "en": "Preservatives"
        },
        {
          "de": "Alkohol",
          "en": "Alcohol"
        }
      ],
      "PrintOrder": "1",
      "CO2Value": "3665.00",
      "CO2Rating": "D",
      "CO2Perc": "100.00",
      "ClimateFriendly": null,
      "GastDesc": "Schweinefilet | Bohnenragout | Pancetta",
      "date_de": "08.12.2025"
    },
    {
      "id": "4803921",
      "outlet": "canteen",
      "date": "2025-12-08",
      "CalendarWeek": "49",
      "day": "Montag",
      "mealtime": "Mittagessen",
      "IdentNr": "12025120898003",
      "itemId": "17552",
      "RecipeID": "6088",
      "ProductPrice": "12.00",
      "ProductPrice_2": null,
      "GastDesc_de": "Zanderfilet | Kartoffel-Erbsenpüree | Schmortomaten",
      "GastDesc_en": "Pike Perch | Potato Pea Püree | Roasted Tomato",
      "MenuName": "COUNTER 3.1 Fish",
      "allergene": {
        "fisch": "Fisch und Fischerzeugnisse",
        "milch": "Milch und Milcherzeugnisse",
        "sellerie": "Sellerie und Sellerieerzeugnisse"
      },
      "merkmale": "",
      "naehrstoffe": "",
      "zusatzstoffe": null,
      "PrintOrder": "3",
      "CO2Value": "721.00",
      "CO2Rating": "B",
      "CO2Perc": "100.00",
      "ClimateFriendly": null,
      "GastDesc": "Zanderfilet | Kartoffel-Erbsenpüree | Schmortomaten",
      "date_de": "08.12.2025"
    },
    {
      "id": "4803922",
      "outlet": "canteen",
      "date": "2025-12-08",
      "CalendarWeek": "49",
      "day": "Montag",
      "mealtime": "Mittagessen",
      "IdentNr": "12025120898005",
      "itemId": "17554",
      "RecipeID": "2999",
      "ProductPrice": "9.50",
      "ProductPrice_2": null,
      "GastDesc_de": "Süßkartoffel | Linsen | Mangold",
      "GastDesc_en": "Sweet Potato | Lentils | Chard",
      "MenuName": "COUNTER 4.1 Vegi",
      "allergene": {
        "sellerie": "Sellerie und Sellerieerzeugnisse"
      },
      "merkmale": {
        "vegan": "Vegan",
        "vegetarisch": "Vegetarisch"
      },
      "naehrstoffe": "",
      "zusatzstoffe": null,
      "PrintOrder": "5",
      "CO2Value": "560.00",
      "CO2Rating": "A",
      "CO2Perc": "100.00",
      "ClimateFriendly": "1",
      "GastDesc": "Süßkartoffel | Linsen | Mangold",
      "date_de": "08.12.2025"
    },
    {
      "id": "4803923",
      "outlet": "canteen",
      "date": "2025-12-08",
      "CalendarWeek": "49",
      "day": "Montag",
      "mealtime": "Abendessen",
      "IdentNr": "12025120898009",
      "itemId": "17558",
      "RecipeID": "8273",
      "ProductPrice": "12.00",
      "ProductPrice_2": null,
      "GastDesc_de": "Planted Chicken | Udon | Scharfe Kokossauce",
      "GastDesc_en": "Planted Chicken | Udon | Spicy Coconut Sauce",
      "MenuName": "DINNER BOWL_",
      "allergene": {
        "gluten": "Glutenhaltiges Getreide",
        "senf": "Senf und Senferzeugnisse",
        "sesam": "Sesamsamen und Sesamsamenerzeugnisse"
      },
      "merkmale": {
        "vegan": "Vegan",
        "vegetarisch": "Vegetarisch"
      },
      "naehrstoffe": "",
      "zusatzstoffe": [
        {
          "de": "Geschmacksverstärker",
          "en": "Flavor Enhancer"
        },
        {
          "de": "Konservierungsstoff",
          "en": "Preservatives"
        }
      ],
      "PrintOrder": "9",
      "CO2Value": "471.00",
      "CO2Rating": "A",
      "CO2Perc": "100.00",
      "ClimateFriendly": "1",
      "GastDesc": "Planted Chicken | Udon | Scharfe Kokossauce",
      "date_de": "08.12.2025"
    },
    {
      "id": "4803925",
      "outlet": "canteen",
      "date": "2025-12-08",
      "CalendarWeek": "49",
      "day": "Montag",
      "mealtime": "Abendessen",
      "IdentNr": "12025120898010",
      "itemId": "17559",
      "RecipeID": "2883",
      "ProductPrice": "12.00",
      "ProductPrice_2": null,
      "GastDesc_de": "Schweinefilet | Bohnenragout | Pancetta",
      "GastDesc_en": "Pork Fillet | Mixed Bean Ragout | Pancetta",
      "MenuName": "DINNER Meat_17:00-19:00",
      "allergene": {
        "gluten": "Glutenhaltiges Getreide",
        "milch": "Milch und Milcherzeugnisse",
        "sellerie": "Sellerie und Sellerieerzeugnisse",
        "schwefel": "Schwefeldioxid und Sulfide"
      },
      "merkmale": "",
      "naehrstoffe": "",
      "zusatzstoffe": [
        {
          "de": "Antioxidationsmittel",
          "en": "Antioxidation"
        },
        {
          "de": "Konservierungsstoff",
          "en": "Preservatives"
        },
        {
          "de": "Alkohol",
          "en": "Alcohol"
        }
      ],
      "PrintOrder": "10",
      "CO2Value": "3665.00",
      "CO2Rating": "D",
      "CO2Perc": "100.00",
      "ClimateFriendly": null,
      "GastDesc": "Schweinefilet | Bohnenragout | Pancetta",
      "date_de": "08.12.2025"
    },
    {
      "id": "4803927",
      "outlet": "canteen",
      "date": "2025-12-08",
      "CalendarWeek": "49",
      "day": "Montag",
      "mealtime": "Abendessen",
      "IdentNr": "12025120898012",
      "itemId": "17561",
      "RecipeID": "2999",
      "ProductPrice": "9.50",
      "ProductPrice_2": null,
      "GastDesc_de": "Süßkartoffel | Linsen | Mangold",
      "GastDesc_en": "Sweet Potato | Lentils | Chard",
      "MenuName": "DINNER Vegi/Vegan_17:00-19:00",
      "allergene": {
        "sellerie": "Sellerie und Sellerieerzeugnisse"
      },
      "merkmale": {
        "vegan": "Vegan",
        "vegetarisch": "Vegetarisch"
      },
      "naehrstoffe": "",
      "zusatzstoffe": null,
      "PrintOrder": "12",
      "CO2Value": "560.00",
      "CO2Rating": "A",
      "CO2Perc": "100.00",
      "ClimateFriendly": "1",
      "GastDesc": "Süßkartoffel | Linsen | Mangold",
      "date_de": "08.12.2025"
    },
    {
      "id": "4824164",
      "outlet": "canteen",
      "date": "2025-12-09",
      "CalendarWeek": "50",
      "day": "Dienstag",
      "mealtime": "Mittagessen",
      "IdentNr": "12025120998000",
      "itemId": "17549",
      "RecipeID": "5059",
      "ProductPrice": "11.00",
      "ProductPrice_2": null,
      "GastDesc_de": "Weiße Bohnen | Putenbrust | Tomaten-Pesto",
      "GastDesc_en": "White Beans | Turkey breast | Tomato Pesto",
      "MenuName": "COUNTER 1.1 Bowls_",
      "allergene": {
        "schalenfruchte": "Schalenfrüchte und Schalenfruchterzeugnisse",
        "schwefel": "Schwefeldioxid und Sulfide"
      },
      "merkmale": "",
      "naehrstoffe": "",
      "zusatzstoffe": [
        {
          "de": "Antioxidationsmittel",
          "en": "Antioxidation"
        },
        {
          "de": "Konservierungsstoff",
          "en": "Preservatives"
        }
      ],
      "PrintOrder": "0",
      "CO2Value": "1239.00",
      "CO2Rating": "C",
      "CO2Perc": "50.00",
      "ClimateFriendly": null,
      "GastDesc": "Weiße Bohnen | Putenbrust | Tomaten-Pesto",
      "date_de": "09.12.2025"
    },
    {
      "id": "4824165",
      "outlet": "canteen",
      "date": "2025-12-09",
      "CalendarWeek": "50",
      "day": "Dienstag",
      "mealtime": "Mittagessen",
      "IdentNr": "12025120998001",
      "itemId": "17550",
      "RecipeID": "2883",
      "ProductPrice": "12.00",
      "ProductPrice_2": null,
      "GastDesc_de": "Schweinefilet | Bohnenragout | Pancetta",
      "GastDesc_en": "Pork Fillet | Mixed Bean Ragout | Pancetta",
      "MenuName": "COUNTER 2.1 Meat",
      "allergene": {
        "gluten": "Glutenhaltiges Getreide",
        "milch": "Milch und Milcherzeugnisse",
        "sellerie": "Sellerie und Sellerieerzeugnisse",
        "schwefel": "Schwefeldioxid und Sulfide"
      },
      "merkmale": "",
      "naehrstoffe": "",
      "zusatzstoffe": [
        {
          "de": "Antioxidationsmittel",
          "en": "Antioxidation"
        },
        {
          "de": "Konservierungsstoff",
          "en": "Preservatives"
        },
        {
          "de": "Alkohol",
          "en": "Alcohol"
        }
      ],
      "PrintOrder": "1",
      "CO2Value": "3665.00",
      "CO2Rating": "D",
      "CO2Perc": "100.00",
      "ClimateFriendly": null,
      "GastDesc": "Schweinefilet | Bohnenragout | Pancetta",
      "date_de": "09.12.2025"
    },
    {
      "id": "4824166",
      "outlet": "canteen",
      "date": "2025-12-09",
      "CalendarWeek": "50",
      "day": "Dienstag",
      "mealtime": "Mittagessen",
      "IdentNr": "12025120998003",
      "itemId": "17552",
      "RecipeID": "6088",
      "ProductPrice": "12.00",
      "ProductPrice_2": null,
      "GastDesc_de": "Zanderfilet | Kartoffel-Erbsenpüree | Schmortomaten",
      "GastDesc_en": "Pike Perch | Potato Pea Püree | Roasted Tomato",
      "MenuName": "COUNTER 3.1 Fish",
      "allergene": {
        "fisch": "Fisch und Fischerzeugnisse",
        "milch": "Milch und Milcherzeugnisse",
        "sellerie": "Sellerie und Sellerieerzeugnisse"
      },
      "merkmale": "",
      "naehrstoffe": "",
      "zusatzstoffe": null,
      "PrintOrder": "3",
      "CO2Value": "721.00",
      "CO2Rating": "B",
      "CO2Perc": "100.00",
      "ClimateFriendly": null,
      "GastDesc": "Zanderfilet | Kartoffel-Erbsenpüree | Schmortomaten",
      "date_de": "09.12.2025"
    },
    {
      "id": "4824167",
      "outlet": "canteen",
      "date": "2025-12-09",
      "CalendarWeek": "50",
      "day": "Dienstag",
      "mealtime": "Mittagessen",
      "IdentNr": "12025120998005",
      "itemId": "17554",
      "RecipeID": "8212",
      "ProductPrice": "9.50",
      "ProductPrice_2": null,
      "GastDesc_de": "Szechuan-Aubergine | Jasmin Reis | Chili-Erdnüsse",
      "GastDesc_en": "Szechuan Aubergine | Jasmin Rice | Chili Peanuts",
      "MenuName": "COUNTER 4.1 Vegi",
      "allergene": {
        "gluten": "Glutenhaltiges Getreide",
        "soja": "Soja und Sojaerzeugnisse",
        "erdnuss": "Erdnüsse und Erdnusserzeugnisse",
        "sellerie": "Sellerie und Sellerieerzeugnisse"
      },
      "merkmale": {
        "vegan": "Vegan",
        "vegetarisch": "Vegetarisch"
      },
      "naehrstoffe": "",
      "zusatzstoffe": [
        {
          "de": "Süßungsmittel",
          "en": "Sweetener"
        },
        {
          "de": "Phenylalaninquelle",
          "en": "Phenylalanine"
        },
        {
          "de": "Geschmacksverstärker",
          "en": "Flavor Enhancer"
        },
        {
          "de": "Konservierungsstoff",
          "en": "Preservatives"
        }
      ],
      "PrintOrder": "5",
      "CO2Value": "757.00",
      "CO2Rating": "B",
      "CO2Perc": "100.00",
      "ClimateFriendly": null,
      "GastDesc": "Szechuan-Aubergine | Jasmin Reis | Chili-Erdnüsse",
      "date_de": "09.12.2025"
    },
    {
      "id": "4824168",
      "outlet": "canteen",
      "date": "2025-12-09",
      "CalendarWeek": "50",
      "day": "Dienstag",
      "mealtime": "Abendessen",
      "IdentNr": "12025120998009",
      "itemId": "17558",
      "RecipeID": "5059",
      "ProductPrice": "11.00",
      "ProductPrice_2": null,
      "GastDesc_de": "Weiße Bohnen | Putenbrust | Tomaten-Pesto",
      "GastDesc_en": "White Beans | Turkey breast | Tomato Pesto",
      "MenuName": "DINNER BOWL_",
      "allergene": {
        "schalenfruchte": "Schalenfrüchte und Schalenfruchterzeugnisse",
        "schwefel": "Schwefeldioxid und Sulfide"
      },
      "merkmale": "",
      "naehrstoffe": "",
      "zusatzstoffe": [
        {
          "de": "Antioxidationsmittel",
          "en": "Antioxidation"
        },
        {
          "de": "Konservierungsstoff",
          "en": "Preservatives"
        }
      ],
      "PrintOrder": "9",
      "CO2Value": "1239.00",
      "CO2Rating": "C",
      "CO2Perc": "50.00",
      "ClimateFriendly": null,
      "GastDesc": "Weiße Bohnen | Putenbrust | Tomaten-Pesto",
      "date_de": "09.12.2025"
    },
    {
      "id": "4824170",
      "outlet": "canteen",
      "date": "2025-12-09",
      "CalendarWeek": "50",
      "day": "Dienstag",
      "mealtime": "Abendessen",
      "IdentNr": "12025120998011",
      "itemId": "17560",
      "RecipeID": "8788",
      "ProductPrice": "12.00",
      "ProductPrice_2": null,
      "GastDesc_de": "Seelachs | Zwiebel-Pesto | Tomaten | Kartoffelpüree",
      "GastDesc_en": "coalfish | onion pesto | tomato| mashed potatoes",
      "MenuName": "DINNER Fish_17:00-19:00",
      "allergene": {
        "schalenfruchte": "Schalenfrüchte und Schalenfruchterzeugnisse",
        "fisch": "Fisch und Fischerzeugnisse",
        "milch": "Milch und Milcherzeugnisse",
        "sellerie": "Sellerie und Sellerieerzeugnisse"
      },
      "merkmale": "",
      "naehrstoffe": "",
      "zusatzstoffe": [
        {
          "de": "Antioxidationsmittel",
          "en": "Antioxidation"
        }
      ],
      "PrintOrder": "11",
      "CO2Value": "1338.00",
      "CO2Rating": "C",
      "CO2Perc": "100.00",
      "ClimateFriendly": null,
      "GastDesc": "Seelachs | Zwiebel-Pesto | Tomaten | Kartoffelpüree",
      "date_de": "09.12.2025"
    },
    {
      "id": "4824172",
      "outlet": "canteen",
      "date": "2025-12-09",
      "CalendarWeek": "50",
      "day": "Dienstag",
      "mealtime": "Abendessen",
      "IdentNr": "12025120998012",
      "itemId": "17561",
      "RecipeID": "8212",
      "ProductPrice": "9.50",
      "ProductPrice_2": null,
      "GastDesc_de": "Szechuan-Aubergine | Jasmin Reis | Chili-Erdnüsse",
      "GastDesc_en": "Szechuan Aubergine | Jasmin Rice | Chili Peanuts",
      "MenuName": "DINNER Vegi/Vegan_17:00-19:00",
      "allergene": {
        "gluten": "Glutenhaltiges Getreide",
        "soja": "Soja und Sojaerzeugnisse",
        "erdnuss": "Erdnüsse und Erdnusserzeugnisse",
        "sellerie": "Sellerie und Sellerieerzeugnisse"
      },
      "merkmale": {
        "vegan": "Vegan",
        "vegetarisch": "Vegetarisch"
      },
      "naehrstoffe": "",
      "zusatzstoffe": [
        {
          "de": "Süßungsmittel",
          "en": "Sweetener"
        },
        {
          "de": "Phenylalaninquelle",
          "en": "Phenylalanine"
        },
        {
          "de": "Geschmacksverstärker",
          "en": "Flavor Enhancer"
        },
        {
          "de": "Konservierungsstoff",
          "en": "Preservatives"
        }
      ],
      "PrintOrder": "12",
      "CO2Value": "757.00",
      "CO2Rating": "B",
      "CO2Perc": "100.00",
      "ClimateFriendly": null,
      "GastDesc": "Szechuan-Aubergine | Jasmin Reis | Chili-Erdnüsse",
      "date_de": "09.12.2025"
    },
    {
      "id": "4841776",
      "outlet": "canteen",
      "date": "2025-12-10",
      "CalendarWeek": "50",
      "day": "Mittwoch",
      "mealtime": "Mittagessen",
      "IdentNr": "12025121098000",
      "itemId": "17549",
      "RecipeID": "4907",
      "ProductPrice": "9.50",
      "ProductPrice_2": null,
      "GastDesc_de": "Gerösterter Blumenkohl | Honigkarotte | Rosenkohl",
      "GastDesc_en": "Roasted Cauliflower Tabouleh | Honey Carrots | Brussel Sprouts",
      "MenuName": "COUNTER 1.1 Bowls_",
      "allergene": {
        "gluten": "Glutenhaltiges Getreide",
        "schalenfruchte": "Schalenfrüchte und Schalenfruchterzeugnisse",
        "soja": "Soja und Sojaerzeugnisse",
        "erdnuss": "Erdnüsse und Erdnusserzeugnisse",
        "sellerie": "Sellerie und Sellerieerzeugnisse"
      },
      "merkmale": {
        "vegan": "Vegan",
        "vegetarisch": "Vegetarisch"
      },
      "naehrstoffe": "",
      "zusatzstoffe": null,
      "PrintOrder": "0",
      "CO2Value": "300.00",
      "CO2Rating": "A",
      "CO2Perc": "100.00",
      "ClimateFriendly": "1",
      "GastDesc": "Gerösterter Blumenkohl | Honigkarotte | Rosenkohl",
      "date_de": "10.12.2025"
    },
    {
      "id": "4841777",
      "outlet": "canteen",
      "date": "2025-12-10",
      "CalendarWeek": "50",
      "day": "Mittwoch",
      "mealtime": "Mittagessen",
      "IdentNr": "12025121098001",
      "itemId": "17550",
      "RecipeID": "5727",
      "ProductPrice": "12.00",
      "ProductPrice_2": null,
      "GastDesc_de": "Kalbsbolognese | Penne | Parmesan",
      "GastDesc_en": "Veal bolognese | Penne | Parmesan",
      "MenuName": "COUNTER 2.1 Meat",
      "allergene": {
        "gluten": "Glutenhaltiges Getreide",
        "schalenfruchte": "Schalenfrüchte und Schalenfruchterzeugnisse",
        "milch": "Milch und Milcherzeugnisse",
        "sellerie": "Sellerie und Sellerieerzeugnisse",
        "schwefel": "Schwefeldioxid und Sulfide"
      },
      "merkmale": "",
      "naehrstoffe": "",
      "zusatzstoffe": [
        {
          "de": "Konservierungsstoff",
          "en": "Preservatives"
        },
        {
          "de": "Alkohol",
          "en": "Alcohol"
        }
      ],
      "PrintOrder": "1",
      "CO2Value": "2746.00",
      "CO2Rating": "C",
      "CO2Perc": "100.00",
      "ClimateFriendly": null,
      "GastDesc": "Kalbsbolognese | Penne | Parmesan",
      "date_de": "10.12.2025"
    },
    {
      "id": "4841778",
      "outlet": "canteen",
      "date": "2025-12-10",
      "CalendarWeek": "50",
      "day": "Mittwoch",
      "mealtime": "Mittagessen",
      "IdentNr": "12025121098003",
      "itemId": "17552",
      "RecipeID": "6088",
      "ProductPrice": "12.00",
      "ProductPrice_2": null,
      "GastDesc_de": "Zanderfilet | Kartoffel-Erbsenpüree | Schmortomaten",
      "GastDesc_en": "Pike Perch | Potato Pea Püree | Roasted Tomato",
      "MenuName": "COUNTER 3.1 Fish",
      "allergene": {
        "fisch": "Fisch und Fischerzeugnisse",
        "milch": "Milch und Milcherzeugnisse",
        "sellerie": "Sellerie und Sellerieerzeugnisse"
      },
      "merkmale": "",
      "naehrstoffe": "",
      "zusatzstoffe": null,
      "PrintOrder": "3",
      "CO2Value": "721.00",
      "CO2Rating": "B",
      "CO2Perc": "100.00",
      "ClimateFriendly": null,
      "GastDesc": "Zanderfilet | Kartoffel-Erbsenpüree | Schmortomaten",
      "date_de": "10.12.2025"
    },
    {
      "id": "4841779",
      "outlet": "canteen",
      "date": "2025-12-10",
      "CalendarWeek": "50",
      "day": "Mittwoch",
      "mealtime": "Mittagessen",
      "IdentNr": "12025121098005",
      "itemId": "17554",
      "RecipeID": "4713",
      "ProductPrice": "10.00",
      "ProductPrice_2": null,
      "GastDesc_de": "Schwarze Gnocchi | Pesto | Gegrilltes Gemüse",
      "GastDesc_en": "Black Gnocchi | Pesto | Grilled Vegetables",
      "MenuName": "COUNTER 4.1 Vegi",
      "allergene": {
        "gluten": "Glutenhaltiges Getreide",
        "schalenfruchte": "Schalenfrüchte und Schalenfruchterzeugnisse",
        "huhnerei": "Hühnerei und Hühnereierzeugnisse",
        "milch": "Milch und Milcherzeugnisse",
        "schwefel": "Schwefeldioxid und Sulfide"
      },
      "merkmale": {
        "vegan": "Vegan",
        "vegetarisch": "Vegetarisch"
      },
      "naehrstoffe": "",
      "zusatzstoffe": [
        {
          "de": "Farbstoff",
          "en": "Colouring Agent"
        },
        {
          "de": "Konservierungsstoff",
          "en": "Preservatives"
        }
      ],
      "PrintOrder": "5",
      "CO2Value": "719.00",
      "CO2Rating": "B",
      "CO2Perc": "100.00",
      "ClimateFriendly": null,
      "GastDesc": "Schwarze Gnocchi | Pesto | Gegrilltes Gemüse",
      "date_de": "10.12.2025"
    },
    {
      "id": "4841780",
      "outlet": "canteen",
      "date": "2025-12-10",
      "CalendarWeek": "50",
      "day": "Mittwoch",
      "mealtime": "Abendessen",
      "IdentNr": "12025121098009",
      "itemId": "17558",
      "RecipeID": "4907",
      "ProductPrice": "9.50",
      "ProductPrice_2": null,
      "GastDesc_de": "Gerösterter Blumenkohl | Honigkarotte | Rosenkohl",
      "GastDesc_en": "Roasted Cauliflower Tabouleh | Honey Carrots | Brussel Sprouts",
      "MenuName": "DINNER BOWL_",
      "allergene": {
        "gluten": "Glutenhaltiges Getreide",
        "schalenfruchte": "Schalenfrüchte und Schalenfruchterzeugnisse",
        "soja": "Soja und Sojaerzeugnisse",
        "erdnuss": "Erdnüsse und Erdnusserzeugnisse",
        "sellerie": "Sellerie und Sellerieerzeugnisse"
      },
      "merkmale": {
        "vegan": "Vegan",
        "vegetarisch": "Vegetarisch"
      },
      "naehrstoffe": "",
      "zusatzstoffe": null,
      "PrintOrder": "9",
      "CO2Value": "300.00",
      "CO2Rating": "A",
      "CO2Perc": "100.00",
      "ClimateFriendly": "1",
      "GastDesc": "Gerösterter Blumenkohl | Honigkarotte | Rosenkohl",
      "date_de": "10.12.2025"
    },
    {
      "id": "4841782",
      "outlet": "canteen",
      "date": "2025-12-10",
      "CalendarWeek": "50",
      "day": "Mittwoch",
      "mealtime": "Abendessen",
      "IdentNr": "12025121098010",
      "itemId": "17559",
      "RecipeID": "5727",
      "ProductPrice": "12.00",
      "ProductPrice_2": null,
      "GastDesc_de": "Kalbsbolognese | Penne | Parmesan",
      "GastDesc_en": "Veal bolognese | Penne | Parmesan",
      "MenuName": "DINNER Meat_17:00-19:00",
      "allergene": {
        "gluten": "Glutenhaltiges Getreide",
        "schalenfruchte": "Schalenfrüchte und Schalenfruchterzeugnisse",
        "milch": "Milch und Milcherzeugnisse",
        "sellerie": "Sellerie und Sellerieerzeugnisse",
        "schwefel": "Schwefeldioxid und Sulfide"
      },
      "merkmale": "",
      "naehrstoffe": "",
      "zusatzstoffe": [
        {
          "de": "Konservierungsstoff",
          "en": "Preservatives"
        },
        {
          "de": "Alkohol",
          "en": "Alcohol"
        }
      ],
      "PrintOrder": "10",
      "CO2Value": "2746.00",
      "CO2Rating": "C",
      "CO2Perc": "100.00",
      "ClimateFriendly": null,
      "GastDesc": "Kalbsbolognese | Penne | Parmesan",
      "date_de": "10.12.2025"
    },
    {
      "id": "4841784",
      "outlet": "canteen",
      "date": "2025-12-10",
      "CalendarWeek": "50",
      "day": "Mittwoch",
      "mealtime": "Abendessen",
      "IdentNr": "12025121098012",
      "itemId": "17561",
      "RecipeID": "4713",
      "ProductPrice": "10.00",
      "ProductPrice_2": null,
      "GastDesc_de": "Schwarze Gnocchi | Pesto | Gegrilltes Gemüse",
      "GastDesc_en": "Black Gnocchi | Pesto | Grilled Vegetables",
      "MenuName": "DINNER Vegi/Vegan_17:00-19:00",
      "allergene": {
        "gluten": "Glutenhaltiges Getreide",
        "schalenfruchte": "Schalenfrüchte und Schalenfruchterzeugnisse",
        "huhnerei": "Hühnerei und Hühnereierzeugnisse",
        "milch": "Milch und Milcherzeugnisse",
        "schwefel": "Schwefeldioxid und Sulfide"
      },
      "merkmale": {
        "vegan": "Vegan",
        "vegetarisch": "Vegetarisch"
      },
      "naehrstoffe": "",
      "zusatzstoffe": [
        {
          "de": "Farbstoff",
          "en": "Colouring Agent"
        },
        {
          "de": "Konservierungsstoff",
          "en": "Preservatives"
        }
      ],
      "PrintOrder": "12",
      "CO2Value": "719.00",
      "CO2Rating": "B",
      "CO2Perc": "100.00",
      "ClimateFriendly": null,
      "GastDesc": "Schwarze Gnocchi | Pesto | Gegrilltes Gemüse",
      "date_de": "10.12.2025"
    },
    {
      "id": "4857188",
      "outlet": "canteen",
      "date": "2025-12-11",
      "CalendarWeek": "50",
      "day": "Donnerstag",
      "mealtime": "Mittagessen",
      "IdentNr": "12025121198000",
      "itemId": "17549",
      "RecipeID": "5060",
      "ProductPrice": "11.00",
      "ProductPrice_2": null,
      "GastDesc_de": "Couscous | Ofen-Paprika | Kräuterfeta",
      "GastDesc_en": "Couscous | Oven peppers | Herb feta",
      "MenuName": "COUNTER 1.1 Bowls_",
      "allergene": {
        "gluten": "Glutenhaltiges Getreide",
        "schalenfruchte": "Schalenfrüchte und Schalenfruchterzeugnisse",
        "milch": "Milch und Milcherzeugnisse"
      },
      "merkmale": {
        "vegetarisch": "Vegetarisch"
      },
      "naehrstoffe": "",
      "zusatzstoffe": [
        {
          "de": "geschwärzt",
          "en": "Blacked Out"
        }
      ],
      "PrintOrder": "0",
      "CO2Value": "1488.00",
      "CO2Rating": "C",
      "CO2Perc": "100.00",
      "ClimateFriendly": null,
      "GastDesc": "Couscous | Ofen-Paprika | Kräuterfeta",
      "date_de": "11.12.2025"
    },
    {
      "id": "4857189",
      "outlet": "canteen",
      "date": "2025-12-11",
      "CalendarWeek": "50",
      "day": "Donnerstag",
      "mealtime": "Mittagessen",
      "IdentNr": "12025121198001",
      "itemId": "17550",
      "RecipeID": "5727",
      "ProductPrice": "12.00",
      "ProductPrice_2": null,
      "GastDesc_de": "Kalbsbolognese | Penne | Parmesan",
      "GastDesc_en": "Veal bolognese | Penne | Parmesan",
      "MenuName": "COUNTER 2.1 Meat",
      "allergene": {
        "gluten": "Glutenhaltiges Getreide",
        "schalenfruchte": "Schalenfrüchte und Schalenfruchterzeugnisse",
        "milch": "Milch und Milcherzeugnisse",
        "sellerie": "Sellerie und Sellerieerzeugnisse",
        "schwefel": "Schwefeldioxid und Sulfide"
      },
      "merkmale": "",
      "naehrstoffe": "",
      "zusatzstoffe": [
        {
          "de": "Konservierungsstoff",
          "en": "Preservatives"
        },
        {
          "de": "Alkohol",
          "en": "Alcohol"
        }
      ],
      "PrintOrder": "1",
      "CO2Value": "2746.00",
      "CO2Rating": "C",
      "CO2Perc": "100.00",
      "ClimateFriendly": null,
      "GastDesc": "Kalbsbolognese | Penne | Parmesan",
      "date_de": "11.12.2025"
    },
    {
      "id": "4857190",
      "outlet": "canteen",
      "date": "2025-12-11",
      "CalendarWeek": "50",
      "day": "Donnerstag",
      "mealtime": "Mittagessen",
      "IdentNr": "12025121198005",
      "itemId": "17554",
      "RecipeID": "2987",
      "ProductPrice": "9.50",
      "ProductPrice_2": null,
      "GastDesc_de": "Gemüsecurry | Kohlrabi | Romanesco*",
      "GastDesc_en": "Vegetable Curry | Cabbage | Romanesco *",
      "MenuName": "COUNTER 4.1 Vegi",
      "allergene": {
        "sellerie": "Sellerie und Sellerieerzeugnisse"
      },
      "merkmale": {
        "vegan": "Vegan",
        "vegetarisch": "Vegetarisch"
      },
      "naehrstoffe": "",
      "zusatzstoffe": [
        {
          "de": "Süßungsmittel",
          "en": "Sweetener"
        },
        {
          "de": "Phenylalaninquelle",
          "en": "Phenylalanine"
        },
        {
          "de": "Konservierungsstoff",
          "en": "Preservatives"
        }
      ],
      "PrintOrder": "5",
      "CO2Value": "609.00",
      "CO2Rating": "B",
      "CO2Perc": "100.00",
      "ClimateFriendly": null,
      "GastDesc": "Gemüsecurry | Kohlrabi | Romanesco*",
      "date_de": "11.12.2025"
    },
    {
      "id": "4872304",
      "outlet": "canteen",
      "date": "2025-12-13",
      "CalendarWeek": "50",
      "day": "Samstag",
      "mealtime": "Abendessen",
      "IdentNr": "12025121398014",
      "itemId": "17563",
      "RecipeID": "9000",
      "ProductPrice": "12.00",
      "ProductPrice_2": null,
      "GastDesc_de": "Currywurst | Fritten | Salat",
      "GastDesc_en": "Curry Sausage | Steakhouse Chips | Salad",
      "MenuName": "LUNCH Meat_",
      "allergene": {
        "huhnerei": "Hühnerei und Hühnereierzeugnisse",
        "sellerie": "Sellerie und Sellerieerzeugnisse",
        "senf": "Senf und Senferzeugnisse",
        "schwefel": "Schwefeldioxid und Sulfide"
      },
      "merkmale": "",
      "naehrstoffe": "",
      "zusatzstoffe": [
        {
          "de": "Süßungsmittel",
          "en": "Sweetener"
        },
        {
          "de": "Phosphat",
          "en": "Phosphate"
        },
        {
          "de": "Farbstoff",
          "en": "Colouring Agent"
        },
        {
          "de": "Antioxidationsmittel",
          "en": "Antioxidation"
        },
        {
          "de": "Konservierungsstoff",
          "en": "Preservatives"
        }
      ],
      "PrintOrder": "14",
      "CO2Value": "1002.00",
      "CO2Rating": "B",
      "CO2Perc": "100.00",
      "ClimateFriendly": null,
      "GastDesc": "Currywurst | Fritten | Salat",
      "date_de": "13.12.2025"
    },
    {
      "id": "4872306",
      "outlet": "canteen",
      "date": "2025-12-13",
      "CalendarWeek": "50",
      "day": "Samstag",
      "mealtime": "Abendessen",
      "IdentNr": "12025121398015",
      "itemId": "17564",
      "RecipeID": "5058",
      "ProductPrice": "10.00",
      "ProductPrice_2": null,
      "GastDesc_de": "Bulgur | Garam Masala | Hähnchen",
      "GastDesc_en": "Bulgur | Garam Masala | Roast Chicken",
      "MenuName": "LUNCH Fish_",
      "allergene": {
        "gluten": "Glutenhaltiges Getreide",
        "soja": "Soja und Sojaerzeugnisse",
        "sesam": "Sesamsamen und Sesamsamenerzeugnisse"
      },
      "merkmale": "",
      "naehrstoffe": "",
      "zusatzstoffe": [
        {
          "de": "Alkohol",
          "en": "Alcohol"
        }
      ],
      "PrintOrder": "15",
      "CO2Value": "864.00",
      "CO2Rating": "B",
      "CO2Perc": "100.00",
      "ClimateFriendly": null,
      "GastDesc": "Bulgur | Garam Masala | Hähnchen",
      "date_de": "13.12.2025"
    },
    {
      "id": "4872308",
      "outlet": "canteen",
      "date": "2025-12-13",
      "CalendarWeek": "50",
      "day": "Samstag",
      "mealtime": "Abendessen",
      "IdentNr": "12025121398016",
      "itemId": "17565",
      "RecipeID": "9081",
      "ProductPrice": "11.00",
      "ProductPrice_2": null,
      "GastDesc_de": "Planted.Chicken | Gnocchi | Champignons",
      "GastDesc_en": "Planted.Chicken | Gnocchi | Champignons",
      "MenuName": "LUNCH Vegi/Vegan_",
      "allergene": {
        "gluten": "Glutenhaltiges Getreide",
        "schwefel": "Schwefeldioxid und Sulfide"
      },
      "merkmale": {
        "vegan": "Vegan",
        "vegetarisch": "Vegetarisch"
      },
      "naehrstoffe": "",
      "zusatzstoffe": [
        {
          "de": "Alkohol",
          "en": "Alcohol"
        }
      ],
      "PrintOrder": "16",
      "CO2Value": "480.00",
      "CO2Rating": "A",
      "CO2Perc": "100.00",
      "ClimateFriendly": "1",
      "GastDesc": "Planted.Chicken | Gnocchi | Champignons",
      "date_de": "13.12.2025"
    },
    {
      "id": "4872310",
      "outlet": "canteen",
      "date": "2025-12-14",
      "CalendarWeek": "50",
      "day": "Sonntag",
      "mealtime": "Abendessen",
      "IdentNr": "12025121498018",
      "itemId": "17864",
      "RecipeID": "4490",
      "ProductPrice": "12.00",
      "ProductPrice_2": null,
      "GastDesc_de": "Hühnerfrikassee | Reis | Salat",
      "GastDesc_en": "Chicken Fricassee | Rice | Salad",
      "MenuName": "DINNER Meat _|",
      "allergene": {
        "gluten": "Glutenhaltiges Getreide",
        "milch": "Milch und Milcherzeugnisse",
        "sellerie": "Sellerie und Sellerieerzeugnisse",
        "senf": "Senf und Senferzeugnisse",
        "schwefel": "Schwefeldioxid und Sulfide"
      },
      "merkmale": "",
      "naehrstoffe": "",
      "zusatzstoffe": [
        {
          "de": "Konservierungsstoff",
          "en": "Preservatives"
        },
        {
          "de": "Alkohol",
          "en": "Alcohol"
        }
      ],
      "PrintOrder": "18",
      "CO2Value": "1323.00",
      "CO2Rating": "C",
      "CO2Perc": "100.00",
      "ClimateFriendly": null,
      "GastDesc": "Hühnerfrikassee | Reis | Salat",
      "date_de": "14.12.2025"
    },
    {
      "id": "4872311",
