{
  "daySelector": [
    {
      "date": "2025-12-09",
      "day": "Dienstag",
      "CalendarWeek": "50",
      "date_de": "09.12.2025"
    },
    {
      "date": "2025-12-10",
      "day": "Mittwoch",
      "CalendarWeek": "50",
      "date_de": "10.12.2025"
    },
    {
      "date": "2025-12-11",
      "day": "Donnerstag",
      "CalendarWeek": "50",
      "date_de": "11.12.2025"
    },
    {
      "date": "2025-12-12",
      "day": "Freitag",
      "CalendarWeek": "50",
      "date_de": "12.12.2025"
    },
    {
      "date": "2025-12-13",
      "day": "Samstag",
      "CalendarWeek": "50",
      "date_de": "13.12.2025"
    },
    {
      "date": "2025-12-14",
      "day": "Sonntag",
      "CalendarWeek": "50",
      "date_de": "14.12.2025"
    },
    {
      "date": "2025-12-15",
      "day": "Montag",
      "CalendarWeek": "51",
      "date_de": "15.12.2025"
    },
    {
      "date": "2025-12-16",
      "day": "Dienstag",
      "CalendarWeek": "51",
      "date_de": "16.12.2025"
    },
    {
      "date": "2025-12-17",
      "day": "Mittwoch",
      "CalendarWeek": "51",
      "date_de": "17.12.2025"
    },
    {
      "date": "2025-12-18",
      "day": "Donnerstag",
      "CalendarWeek": "51",
      "date_de": "18.12.2025"
    },
    {
      "date": "2025-12-19",
      "day": "Freitag",
      "CalendarWeek": "51",
      "date_de": "19.12.2025"
    },
    {
      "date": "2025-12-20",
      "day": "Samstag",
      "CalendarWeek": "51",
      "date_de": "20.12.2025"
    },
    {
      "date": "2025-12-21",
      "day": "Sonntag",
      "CalendarWeek": "51",
      "date_de": "21.12.2025"
    },
    {
      "date": "2025-12-22",
      "day": "Montag",
      "CalendarWeek": "51",
      "date_de": "22.12.2025"
    },
    {
      "date": "2025-12-23",
      "day": "Dienstag",
      "CalendarWeek": "51",
      "date_de": "23.12.2025"
    },
    {
      "date": "2025-12-26",
      "day": "Freitag",
      "CalendarWeek": "51",
      "date_de": "26.12.2025"
    },
    {
      "date": "2025-12-27",
      "day": "Samstag",
      "CalendarWeek": "51",
      "date_de": "27.12.2025"
    },
    {
      "date": "2025-12-28",
      "day": "Sonntag",
      "CalendarWeek": "51",
      "date_de": "28.12.2025"
    },
    {
      "date": "2025-12-29",
      "day": "Montag",
      "CalendarWeek": "51",
      "date_de": "29.12.2025"
    }
  ],
  "data": [
    {
      "id": "4824272",
      "outlet": "cafe",
      "date": "2025-12-09",
      "CalendarWeek": "50",
      "day": "Dienstag",
      "mealtime": "Mittagessen",
      "IdentNr": "12025120998003",
      "itemId": "21063",
      "RecipeID": "8211",
      "ProductPrice": "0.50",
      "ProductPrice_2": null,
      "GastDesc_de": "LES ARLETTES (Französische Blätterteigkekse) Vegan",
      "GastDesc_en": "LES ARLETTES  (French Puff Pastry Cookies) Vegan",
      "MenuName": "MINIS",
      "allergene": {
        "gluten": "Glutenhaltiges Getreide"
      },
      "merkmale": {
        "vegan": "Vegan",
        "vegetarisch": "Vegetarisch"
      },
      "naehrstoffe": "",
      "zusatzstoffe": [
        {
          "de": "Farbstoff",
          "en": "Colouring Agent"
        },
        {
          "de": "Alkohol",
          "en": "Alcohol"
        }
      ],
      "PrintOrder": "3",
      "CO2Value": null,
      "CO2Rating": null,
      "CO2Perc": null,
      "ClimateFriendly": null,
      "GastDesc": "LES ARLETTES (Französische Blätterteigkekse) Vegan",
      "date_de": "09.12.2025"
    },
    {
      "id": "4824273",
      "outlet": "cafe",
      "date": "2025-12-09",
      "CalendarWeek": "50",
      "day": "Dienstag",
      "mealtime": "Mittagessen",
      "IdentNr": "12025120998004",
      "itemId": "21058",
      "RecipeID": "9066",
      "ProductPrice": "3.50",
      "ProductPrice_2": null,
      "GastDesc_de": "Opéra Schnitte",
      "GastDesc_en": "Opera cake",
      "MenuName": "OPEN",
      "allergene": {
        "gluten": "Glutenhaltiges Getreide",
        "schalenfruchte": "Schalenfrüchte und Schalenfruchterzeugnisse",
        "huhnerei": "Hühnerei und Hühnereierzeugnisse",
        "soja": "Soja und Sojaerzeugnisse",
        "milch": "Milch und Milcherzeugnisse"
      },
      "merkmale": "",
      "naehrstoffe": "",
      "zusatzstoffe": null,
      "PrintOrder": "4",
      "CO2Value": null,
      "CO2Rating": null,
      "CO2Perc": null,
      "ClimateFriendly": null,
      "GastDesc": "Opéra Schnitte",
      "date_de": "09.12.2025"
    },
    {
      "id": "4824274",
      "outlet": "cafe",
      "date": "2025-12-09",
      "CalendarWeek": "50",
      "day": "Dienstag",
      "mealtime": "Mittagessen",
      "IdentNr": "12025120998005",
      "itemId": "21064",
      "RecipeID": "8330",
      "ProductPrice": "1.50",
      "ProductPrice_2": null,
      "GastDesc_de": "Saftige Brownie-Bananen-Cookies | Zuckerfrei",
      "GastDesc_en": "Fudgy Brownie Banana Cookies | Sugar-Free",
      "MenuName": "PEOPLES CHOICE",
      "allergene": {
        "erdnuss": "Erdnüsse und Erdnusserzeugnisse"
      },
      "merkmale": {
        "ohne_zucker": "Ohne_Zucker",
        "vegan": "Vegan",
        "vegetarisch": "Vegetarisch"
      },
      "naehrstoffe": "",
      "zusatzstoffe": null,
      "PrintOrder": "5",
      "CO2Value": null,
      "CO2Rating": null,
      "CO2Perc": null,
      "ClimateFriendly": null,
      "GastDesc": "Saftige Brownie-Bananen-Cookies | Zuckerfrei",
      "date_de": "09.12.2025"
    },
    {
      "id": "4824275",
      "outlet": "cafe",
      "date": "2025-12-09",
      "CalendarWeek": "50",
      "day": "Dienstag",
      "mealtime": "Mittagessen",
      "IdentNr": "12025120998006",
      "itemId": "21061",
      "RecipeID": "8672",
      "ProductPrice": "2.60",
      "ProductPrice_2": null,
      "GastDesc_de": "Quarkstollen",
      "GastDesc_en": "Curd Stollen",
      "MenuName": "SEASON",
      "allergene": {
        "gluten": "Glutenhaltiges Getreide",
        "schalenfruchte": "Schalenfrüchte und Schalenfruchterzeugnisse",
        "huhnerei": "Hühnerei und Hühnereierzeugnisse",
        "milch": "Milch und Milcherzeugnisse"
      },
      "merkmale": "",
      "naehrstoffe": "",
      "zusatzstoffe": [
        {
          "de": "Farbstoff",
          "en": "Colouring Agent"
        },
        {
          "de": "Alkohol",
          "en": "Alcohol"
        }
      ],
      "PrintOrder": "6",
      "CO2Value": null,
      "CO2Rating": null,
      "CO2Perc": null,
      "ClimateFriendly": null,
      "GastDesc": "Quarkstollen",
      "date_de": "09.12.2025"
    },
    {
      "id": "4824276",
      "outlet": "cafe",
      "date": "2025-12-09",
      "CalendarWeek": "50",
      "day": "Dienstag",
      "mealtime": "Mittagessen",
      "IdentNr": "12025120998009",
      "itemId": "12773",
      "RecipeID": "9037",
      "ProductPrice": "2.50",
      "ProductPrice_2": null,
      "GastDesc_de": "Biscoff Karamell \"Apple Pie\" Cookie | Vegan",
      "GastDesc_en": "Biscoff Caramel \"Apple Pie\" Cookie | Vegan",
      "MenuName": "CLASSICS",
      "allergene": {
        "gluten": "Glutenhaltiges Getreide"
      },
      "merkmale": "",
      "naehrstoffe": "",
      "zusatzstoffe": [
        {
          "de": "Farbstoff",
          "en": "Colouring Agent"
        },
        {
          "de": "Antioxidationsmittel",
          "en": "Antioxidation"
        },
        {
          "de": "Alkohol",
          "en": "Alcohol"
        }
      ],
      "PrintOrder": "9",
      "CO2Value": null,
      "CO2Rating": null,
      "CO2Perc": null,
      "ClimateFriendly": null,
      "GastDesc": "Biscoff Karamell \"Apple Pie\" Cookie | Vegan",
      "date_de": "09.12.2025"
    },
    {
      "id": "4824277",
      "outlet": "cafe",
      "date": "2025-12-09",
      "CalendarWeek": "50",
      "day": "Dienstag",
      "mealtime": "Mittagessen",
      "IdentNr": "12025120998010",
      "itemId": "12778",
      "RecipeID": "7093",
      "ProductPrice": "1.70",
      "ProductPrice_2": null,
      "GastDesc_de": "Brownies Miniatur",
      "GastDesc_en": "Miniature Brownies",
      "MenuName": "BROWNIE, BROOKIE UND BLONDIE DAY",
      "allergene": {
        "gluten": "Glutenhaltiges Getreide",
        "schalenfruchte": "Schalenfrüchte und Schalenfruchterzeugnisse",
        "huhnerei": "Hühnerei und Hühnereierzeugnisse",
        "soja": "Soja und Sojaerzeugnisse",
        "milch": "Milch und Milcherzeugnisse"
      },
      "merkmale": "",
      "naehrstoffe": "",
      "zusatzstoffe": null,
      "PrintOrder": "10",
      "CO2Value": null,
      "CO2Rating": null,
      "CO2Perc": null,
      "ClimateFriendly": null,
      "GastDesc": "Brownies Miniatur",
      "date_de": "09.12.2025"
    },
    {
      "id": "4824278",
      "outlet": "cafe",
      "date": "2025-12-09",
      "CalendarWeek": "50",
      "day": "Dienstag",
      "mealtime": "Mittagessen",
      "IdentNr": "12025120998011",
      "itemId": "16256",
      "RecipeID": "8775",
      "ProductPrice": "1.50",
      "ProductPrice_2": null,
      "GastDesc_de": "Schwedische Haferkekse | Vegan",
      "GastDesc_en": "Swedish Style Oatmeal Cookies | Vegan",
      "MenuName": "VEGAN SPECIAL",
      "allergene": {
        "gluten": "Glutenhaltiges Getreide"
      },
      "merkmale": {
        "vegan": "Vegan",
        "vegetarisch": "Vegetarisch"
      },
      "naehrstoffe": "",
      "zusatzstoffe": [
        {
          "de": "Farbstoff",
          "en": "Colouring Agent"
        },
        {
          "de": "Antioxidationsmittel",
          "en": "Antioxidation"
        },
        {
          "de": "Alkohol",
          "en": "Alcohol"
        }
      ],
      "PrintOrder": "11",
      "CO2Value": null,
      "CO2Rating": null,
      "CO2Perc": null,
      "ClimateFriendly": null,
      "GastDesc": "Schwedische Haferkekse | Vegan",
      "date_de": "09.12.2025"
    },
    {
      "id": "4824279",
      "outlet": "cafe",
      "date": "2025-12-09",
      "CalendarWeek": "50",
      "day": "Dienstag",
      "mealtime": "Mittagessen",
      "IdentNr": "12025120998012",
      "itemId": "16257",
      "RecipeID": "9067",
      "ProductPrice": "4.50",
      "ProductPrice_2": null,
      "GastDesc_de": "Crepes mit Zimt-Zucker und Apfelmus",
      "GastDesc_en": "Crepe with Apple Sauce and Cinammon Sugar",
      "MenuName": "KLASSIKER",
      "allergene": {
        "gluten": "Glutenhaltiges Getreide",
        "huhnerei": "Hühnerei und Hühnereierzeugnisse",
        "milch": "Milch und Milcherzeugnisse"
      },
      "merkmale": "",
      "naehrstoffe": "",
      "zusatzstoffe": [
        {
          "de": "Antioxidationsmittel",
          "en": "Antioxidation"
        }
      ],
      "PrintOrder": "12",
      "CO2Value": null,
      "CO2Rating": null,
      "CO2Perc": null,
      "ClimateFriendly": null,
      "GastDesc": "Crepes mit Zimt-Zucker und Apfelmus",
      "date_de": "09.12.2025"
    },
    {
      "id": "4841874",
      "outlet": "cafe",
      "date": "2025-12-10",
      "CalendarWeek": "50",
      "day": "Mittwoch",
      "mealtime": "Mittagessen",
      "IdentNr": "12025121098003",
      "itemId": "21063",
      "RecipeID": "8211",
      "ProductPrice": "0.50",
      "ProductPrice_2": null,
      "GastDesc_de": "LES ARLETTES (Französische Blätterteigkekse) Vegan",
      "GastDesc_en": "LES ARLETTES  (French Puff Pastry Cookies) Vegan",
      "MenuName": "MINIS",
      "allergene": {
        "gluten": "Glutenhaltiges Getreide"
      },
      "merkmale": {
        "vegan": "Vegan",
        "vegetarisch": "Vegetarisch"
      },
      "naehrstoffe": "",
      "zusatzstoffe": [
        {
          "de": "Farbstoff",
          "en": "Colouring Agent"
        },
        {
          "de": "Alkohol",
          "en": "Alcohol"
        }
      ],
      "PrintOrder": "3",
      "CO2Value": null,
      "CO2Rating": null,
      "CO2Perc": null,
      "ClimateFriendly": null,
      "GastDesc": "LES ARLETTES (Französische Blätterteigkekse) Vegan",
      "date_de": "10.12.2025"
    },
    {
      "id": "4841875",
      "outlet": "cafe",
      "date": "2025-12-10",
      "CalendarWeek": "50",
      "day": "Mittwoch",
      "mealtime": "Mittagessen",
      "IdentNr": "12025121098004",
      "itemId": "21058",
      "RecipeID": "9066",
      "ProductPrice": "3.50",
      "ProductPrice_2": null,
      "GastDesc_de": "Opéra Schnitte",
      "GastDesc_en": "Opera cake",
      "MenuName": "OPEN",
      "allergene": {
        "gluten": "Glutenhaltiges Getreide",
        "schalenfruchte": "Schalenfrüchte und Schalenfruchterzeugnisse",
        "huhnerei": "Hühnerei und Hühnereierzeugnisse",
        "soja": "Soja und Sojaerzeugnisse",
        "milch": "Milch und Milcherzeugnisse"
      },
      "merkmale": "",
      "naehrstoffe": "",
      "zusatzstoffe": null,
      "PrintOrder": "4",
      "CO2Value": null,
      "CO2Rating": null,
      "CO2Perc": null,
      "ClimateFriendly": null,
      "GastDesc": "Opéra Schnitte",
      "date_de": "10.12.2025"
    },
    {
      "id": "4841876",
      "outlet": "cafe",
      "date": "2025-12-10",
      "CalendarWeek": "50",
      "day": "Mittwoch",
      "mealtime": "Mittagessen",
      "IdentNr": "12025121098005",
      "itemId": "21064",
      "RecipeID": "8330",
      "ProductPrice": "1.50",
      "ProductPrice_2": null,
      "GastDesc_de": "Saftige Brownie-Bananen-Cookies | Zuckerfrei",
      "GastDesc_en": "Fudgy Brownie Banana Cookies | Sugar-Free",
      "MenuName": "PEOPLES CHOICE",
      "allergene": {
        "erdnuss": "Erdnüsse und Erdnusserzeugnisse"
      },
      "merkmale": {
        "ohne_zucker": "Ohne_Zucker",
        "vegan": "Vegan",
        "vegetarisch": "Vegetarisch"
      },
      "naehrstoffe": "",
      "zusatzstoffe": null,
      "PrintOrder": "5",
      "CO2Value": null,
      "CO2Rating": null,
      "CO2Perc": null,
      "ClimateFriendly": null,
      "GastDesc": "Saftige Brownie-Bananen-Cookies | Zuckerfrei",
      "date_de": "10.12.2025"
    },
    {
      "id": "4841877",
      "outlet": "cafe",
      "date": "2025-12-10",
      "CalendarWeek": "50",
      "day": "Mittwoch",
      "mealtime": "Mittagessen",
      "IdentNr": "12025121098006",
      "itemId": "21061",
      "RecipeID": "8672",
      "ProductPrice": "2.60",
      "ProductPrice_2": null,
      "GastDesc_de": "Quarkstollen",
      "GastDesc_en": "Curd Stollen",
      "MenuName": "SEASON",
      "allergene": {
        "gluten": "Glutenhaltiges Getreide",
        "schalenfruchte": "Schalenfrüchte und Schalenfruchterzeugnisse",
        "huhnerei": "Hühnerei und Hühnereierzeugnisse",
        "milch": "Milch und Milcherzeugnisse"
      },
      "merkmale": "",
      "naehrstoffe": "",
      "zusatzstoffe": [
        {
          "de": "Farbstoff",
          "en": "Colouring Agent"
        },
        {
          "de": "Alkohol",
          "en": "Alcohol"
        }
      ],
      "PrintOrder": "6",
      "CO2Value": null,
      "CO2Rating": null,
      "CO2Perc": null,
      "ClimateFriendly": null,
      "GastDesc": "Quarkstollen",
      "date_de": "10.12.2025"
    },
    {
      "id": "4841878",
      "outlet": "cafe",
      "date": "2025-12-10",
      "CalendarWeek": "50",
      "day": "Mittwoch",
      "mealtime": "Mittagessen",
      "IdentNr": "12025121098009",
      "itemId": "12773",
      "RecipeID": "9037",
      "ProductPrice": "2.50",
      "ProductPrice_2": null,
      "GastDesc_de": "Biscoff Karamell \"Apple Pie\" Cookie | Vegan",
      "GastDesc_en": "Biscoff Caramel \"Apple Pie\" Cookie | Vegan",
      "MenuName": "CLASSICS",
      "allergene": {
        "gluten": "Glutenhaltiges Getreide"
      },
      "merkmale": "",
      "naehrstoffe": "",
      "zusatzstoffe": [
        {
          "de": "Farbstoff",
          "en": "Colouring Agent"
        },
        {
          "de": "Antioxidationsmittel",
          "en": "Antioxidation"
        },
        {
          "de": "Alkohol",
          "en": "Alcohol"
        }
      ],
      "PrintOrder": "9",
      "CO2Value": null,
      "CO2Rating": null,
      "CO2Perc": null,
      "ClimateFriendly": null,
      "GastDesc": "Biscoff Karamell \"Apple Pie\" Cookie | Vegan",
      "date_de": "10.12.2025"
    },
    {
      "id": "4841879",
      "outlet": "cafe",
      "date": "2025-12-10",
      "CalendarWeek": "50",
      "day": "Mittwoch",
      "mealtime": "Mittagessen",
      "IdentNr": "12025121098010",
      "itemId": "12778",
      "RecipeID": "7093",
      "ProductPrice": "1.70",
      "ProductPrice_2": null,
      "GastDesc_de": "Brownies Miniatur",
      "GastDesc_en": "Miniature Brownies",
      "MenuName": "BROWNIE, BROOKIE UND BLONDIE DAY",
      "allergene": {
        "gluten": "Glutenhaltiges Getreide",
        "schalenfruchte": "Schalenfrüchte und Schalenfruchterzeugnisse",
        "huhnerei": "Hühnerei und Hühnereierzeugnisse",
        "soja": "Soja und Sojaerzeugnisse",
        "milch": "Milch und Milcherzeugnisse"
      },
      "merkmale": "",
      "naehrstoffe": "",
      "zusatzstoffe": null,
      "PrintOrder": "10",
      "CO2Value": null,
      "CO2Rating": null,
      "CO2Perc": null,
      "ClimateFriendly": null,
      "GastDesc": "Brownies Miniatur",
      "date_de": "10.12.2025"
    },
    {
      "id": "4841880",
      "outlet": "cafe",
      "date": "2025-12-10",
      "CalendarWeek": "50",
      "day": "Mittwoch",
      "mealtime": "Mittagessen",
      "IdentNr": "12025121098011",
      "itemId": "16256",
      "RecipeID": "8775",
      "ProductPrice": "1.50",
      "ProductPrice_2": null,
      "GastDesc_de": "Schwedische Haferkekse | Vegan",
      "GastDesc_en": "Swedish Style Oatmeal Cookies | Vegan",
      "MenuName": "VEGAN SPECIAL",
      "allergene": {
        "gluten": "Glutenhaltiges Getreide"
      },
      "merkmale": {
        "vegan": "Vegan",
        "vegetarisch": "Vegetarisch"
      },
      "naehrstoffe": "",
      "zusatzstoffe": [
        {
          "de": "Farbstoff",
          "en": "Colouring Agent"
        },
        {
          "de": "Antioxidationsmittel",
          "en": "Antioxidation"
        },
        {
          "de": "Alkohol",
          "en": "Alcohol"
        }
      ],
      "PrintOrder": "11",
      "CO2Value": null,
      "CO2Rating": null,
      "CO2Perc": null,
      "ClimateFriendly": null,
      "GastDesc": "Schwedische Haferkekse | Vegan",
      "date_de": "10.12.2025"
    },
    {
      "id": "4888442",
      "outlet": "cafe",
      "date": "2025-12-15",
      "CalendarWeek": "51",
      "day": "Montag",
      "mealtime": "Mittagessen",
      "IdentNr": "12025121598000",
      "itemId": "21060",
      "RecipeID": "8826",
      "ProductPrice": "3.50",
      "ProductPrice_2": null,
      "GastDesc_de": "Rumkugel",
      "GastDesc_en": "Rum Ball",
      "MenuName": "CHOCOLATE",
      "allergene": {
        "gluten": "Glutenhaltiges Getreide",
        "schalenfruchte": "Schalenfrüchte und Schalenfruchterzeugnisse",
        "huhnerei": "Hühnerei und Hühnereierzeugnisse",
        "soja": "Soja und Sojaerzeugnisse",
        "milch": "Milch und Milcherzeugnisse"
      },
      "merkmale": "",
      "naehrstoffe": "",
      "zusatzstoffe": [
        {
          "de": "Farbstoff",
          "en": "Colouring Agent"
        },
        {
          "de": "Alkohol",
          "en": "Alcohol"
        }
      ],
      "PrintOrder": "0",
      "CO2Value": null,
      "CO2Rating": null,
      "CO2Perc": null,
      "ClimateFriendly": null,
      "GastDesc": "Rumkugel",
      "date_de": "15.12.2025"
    },
    {
      "id": "4888443",
      "outlet": "cafe",
      "date": "2025-12-15",
      "CalendarWeek": "51",
      "day": "Montag",
      "mealtime": "Mittagessen",
      "IdentNr": "12025121598002",
      "itemId": "21062",
      "RecipeID": "8635",
      "ProductPrice": "1.50",
      "ProductPrice_2": null,
      "GastDesc_de": "Quarkbällchen",
      "GastDesc_en": "Curd Dough Balls",
      "MenuName": "FAVOURITES",
      "allergene": {
        "gluten": "Glutenhaltiges Getreide",
        "huhnerei": "Hühnerei und Hühnereierzeugnisse",
        "milch": "Milch und Milcherzeugnisse"
      },
      "merkmale": "",
      "naehrstoffe": "",
      "zusatzstoffe": null,
      "PrintOrder": "2",
      "CO2Value": null,
      "CO2Rating": null,
      "CO2Perc": null,
      "ClimateFriendly": null,
      "GastDesc": "Quarkbällchen",
      "date_de": "15.12.2025"
    },
    {
      "id": "4888444",
      "outlet": "cafe",
      "date": "2025-12-15",
      "CalendarWeek": "51",
      "day": "Montag",
      "mealtime": "Mittagessen",
      "IdentNr": "12025121598003",
      "itemId": "21063",
      "RecipeID": "8211",
      "ProductPrice": "0.50",
      "ProductPrice_2": null,
      "GastDesc_de": "LES ARLETTES (Französische Blätterteigkekse) Vegan",
      "GastDesc_en": "LES ARLETTES  (French Puff Pastry Cookies) Vegan",
      "MenuName": "MINIS",
      "allergene": {
        "gluten": "Glutenhaltiges Getreide"
      },
      "merkmale": {
        "vegan": "Vegan",
        "vegetarisch": "Vegetarisch"
      },
      "naehrstoffe": "",
      "zusatzstoffe": [
        {
          "de": "Farbstoff",
          "en": "Colouring Agent"
        },
        {
          "de": "Alkohol",
          "en": "Alcohol"
        }
      ],
      "PrintOrder": "3",
      "CO2Value": null,
      "CO2Rating": null,
      "CO2Perc": null,
      "ClimateFriendly": null,
      "GastDesc": "LES ARLETTES (Französische Blätterteigkekse) Vegan",
      "date_de": "15.12.2025"
    },
    {
      "id": "4888445",
      "outlet": "cafe",
      "date": "2025-12-15",
      "CalendarWeek": "51",
      "day": "Montag",
      "mealtime": "Mittagessen",
      "IdentNr": "12025121598005",
      "itemId": "21064",
      "RecipeID": "9036",
      "ProductPrice": "2.70",
      "ProductPrice_2": null,
      "GastDesc_de": "Kürbis-Bananenbrot mit Walnüssen | Zuckerfrei",
      "GastDesc_en": "Pumpkin-banana bread with walnuts | Sugar-free",
      "MenuName": "PEOPLES CHOICE",
      "allergene": {
        "gluten": "Glutenhaltiges Getreide",
        "schalenfruchte": "Schalenfrüchte und Schalenfruchterzeugnisse",
        "huhnerei": "Hühnerei und Hühnereierzeugnisse",
        "milch": "Milch und Milcherzeugnisse"
      },
      "merkmale": "",
      "naehrstoffe": "",
      "zusatzstoffe": null,
      "PrintOrder": "5",
      "CO2Value": null,
      "CO2Rating": null,
      "CO2Perc": null,
      "ClimateFriendly": null,
      "GastDesc": "Kürbis-Bananenbrot mit Walnüssen | Zuckerfrei",
      "date_de": "15.12.2025"
    },
    {
      "id": "4888446",
      "outlet": "cafe",
      "date": "2025-12-15",
      "CalendarWeek": "51",
      "day": "Montag",
      "mealtime": "Mittagessen",
      "IdentNr": "12025121598006",
      "itemId": "21061",
      "RecipeID": "8672",
      "ProductPrice": "2.60",
      "ProductPrice_2": null,
      "GastDesc_de": "Quarkstollen",
      "GastDesc_en": "Curd Stollen",
      "MenuName": "SEASON",
      "allergene": {
        "gluten": "Glutenhaltiges Getreide",
        "schalenfruchte": "Schalenfrüchte und Schalenfruchterzeugnisse",
        "huhnerei": "Hühnerei und Hühnereierzeugnisse",
        "milch": "Milch und Milcherzeugnisse"
      },
      "merkmale": "",
      "naehrstoffe": "",
      "zusatzstoffe": [
        {
          "de": "Farbstoff",
          "en": "Colouring Agent"
        },
        {
          "de": "Alkohol",
          "en": "Alcohol"
        }
      ],
      "PrintOrder": "6",
      "CO2Value": null,
      "CO2Rating": null,
      "CO2Perc": null,
      "ClimateFriendly": null,
      "GastDesc": "Quarkstollen",
      "date_de": "15.12.2025"
    },
    {
      "id": "4888447",
      "outlet": "cafe",
      "date": "2025-12-15",
      "CalendarWeek": "51",
      "day": "Montag",
      "mealtime": "Mittagessen",
      "IdentNr": "12025121598007",
      "itemId": "12776",
      "RecipeID": "9037",
      "ProductPrice": "2.50",
      "ProductPrice_2": null,
      "GastDesc_de": "Biscoff Karamell \"Apple Pie\" Cookie | Vegan",
      "GastDesc_en": "Biscoff Caramel \"Apple Pie\" Cookie | Vegan",
      "MenuName": "COOKIE",
      "allergene": {
        "gluten": "Glutenhaltiges Getreide"
      },
      "merkmale": "",
      "naehrstoffe": "",
      "zusatzstoffe": [
        {
          "de": "Farbstoff",
          "en": "Colouring Agent"
        },
        {
          "de": "Antioxidationsmittel",
          "en": "Antioxidation"
        },
        {
          "de": "Alkohol",
          "en": "Alcohol"
        }
      ],
      "PrintOrder": "7",
      "CO2Value": null,
      "CO2Rating": null,
      "CO2Perc": null,
      "ClimateFriendly": null,
      "GastDesc": "Biscoff Karamell \"Apple Pie\" Cookie | Vegan",
      "date_de": "15.12.2025"
    },
    {
      "id": "4888448",
      "outlet": "cafe",
      "date": "2025-12-15",
      "CalendarWeek": "51",
      "day": "Montag",
      "mealtime": "Mittagessen",
      "IdentNr": "12025121598009",
      "itemId": "12773",
      "RecipeID": "9066",
      "ProductPrice": "3.50",
      "ProductPrice_2": null,
      "GastDesc_de": "Opéra Schnitte",
      "GastDesc_en": "Opera cake",
      "MenuName": "CLASSICS",
      "allergene": {
        "gluten": "Glutenhaltiges Getreide",
        "schalenfruchte": "Schalenfrüchte und Schalenfruchterzeugnisse",
        "huhnerei": "Hühnerei und Hühnereierzeugnisse",
        "soja": "Soja und Sojaerzeugnisse",
        "milch": "Milch und Milcherzeugnisse"
      },
      "merkmale": "",
      "naehrstoffe": "",
      "zusatzstoffe": null,
      "PrintOrder": "9",
      "CO2Value": null,
      "CO2Rating": null,
      "CO2Perc": null,
      "ClimateFriendly": null,
      "GastDesc": "Opéra Schnitte",
      "date_de": "15.12.2025"
    },
    {
      "id": "4888449",
      "outlet": "cafe",
      "date": "2025-12-15",
      "CalendarWeek": "51",
      "day": "Montag",
      "mealtime": "Mittagessen",
      "IdentNr": "12025121598011",
      "itemId": "16256",
      "RecipeID": "8211",
      "ProductPrice": "0.50",
      "ProductPrice_2": null,
      "GastDesc_de": "LES ARLETTES (Französische Blätterteigkekse) Vegan",
      "GastDesc_en": "LES ARLETTES  (French Puff Pastry Cookies) Vegan",
      "MenuName": "VEGAN SPECIAL",
      "allergene": {
        "gluten": "Glutenhaltiges Getreide"
      },
      "merkmale": {
        "vegan": "Vegan",
        "vegetarisch": "Vegetarisch"
      },
      "naehrstoffe": "",
      "zusatzstoffe": [
        {
          "de": "Farbstoff",
          "en": "Colouring Agent"
        },
        {
          "de": "Alkohol",
          "en": "Alcohol"
        }
      ],
      "PrintOrder": "11",
      "CO2Value": null,
      "CO2Rating": null,
      "CO2Perc": null,
      "ClimateFriendly": null,
      "GastDesc": "LES ARLETTES (Französische Blätterteigkekse) Vegan",
      "date_de": "15.12.2025"
    },
    {
      "id": "4888450",
      "outlet": "cafe",
      "date": "2025-12-16",
      "CalendarWeek": "51",
      "day": "Dienstag",
      "mealtime": "Mittagessen",
      "IdentNr": "12025121698000",
      "itemId": "21060",
      "RecipeID": "8826",
      "ProductPrice": "3.50",
      "ProductPrice_2": null,
      "GastDesc_de": "Rumkugel",
      "GastDesc_en": "Rum Ball",
      "MenuName": "CHOCOLATE",
      "allergene": {
        "gluten": "Glutenhaltiges Getreide",
        "schalenfruchte": "Schalenfrüchte und Schalenfruchterzeugnisse",
        "huhnerei": "Hühnerei und Hühnereierzeugnisse",
        "soja": "Soja und Sojaerzeugnisse",
        "milch": "Milch und Milcherzeugnisse"
      },
      "merkmale": "",
      "naehrstoffe": "",
      "zusatzstoffe": [
        {
          "de": "Farbstoff",
          "en": "Colouring Agent"
        },
        {
          "de": "Alkohol",
          "en": "Alcohol"
        }
      ],
      "PrintOrder": "0",
      "CO2Value": null,
      "CO2Rating": null,
      "CO2Perc": null,
      "ClimateFriendly": null,
      "GastDesc": "Rumkugel",
      "date_de": "16.12.2025"
    },
    {
      "id": "4888451",
      "outlet": "cafe",
      "date": "2025-12-16",
      "CalendarWeek": "51",
      "day": "Dienstag",
      "mealtime": "Mittagessen",
      "IdentNr": "12025121698002",
      "itemId": "21062",
      "RecipeID": "8635",
      "ProductPrice": "1.50",
      "ProductPrice_2": null,
      "GastDesc_de": "Quarkbällchen",
      "GastDesc_en": "Curd Dough Balls",
      "MenuName": "FAVOURITES",
      "allergene": {
        "gluten": "Glutenhaltiges Getreide",
        "huhnerei": "Hühnerei und Hühnereierzeugnisse",
        "milch": "Milch und Milcherzeugnisse"
      },
      "merkmale": "",
      "naehrstoffe": "",
      "zusatzstoffe": null,
      "PrintOrder": "2",
      "CO2Value": null,
      "CO2Rating": null,
      "CO2Perc": null,
      "ClimateFriendly": null,
      "GastDesc": "Quarkbällchen",
      "date_de": "16.12.2025"
    },
    {
      "id": "4888452",
      "outlet": "cafe",
      "date": "2025-12-16",
      "CalendarWeek": "51",
      "day": "Dienstag",
      "mealtime": "Mittagessen",
      "IdentNr": "12025121698003",
      "itemId": "21063",
      "RecipeID": "8211",
      "ProductPrice": "0.50",
      "ProductPrice_2": null,
      "GastDesc_de": "LES ARLETTES (Französische Blätterteigkekse) Vegan",
      "GastDesc_en": "LES ARLETTES  (French Puff Pastry Cookies) Vegan",
      "MenuName": "MINIS",
      "allergene": {
        "gluten": "Glutenhaltiges Getreide"
      },
      "merkmale": {
        "vegan": "Vegan",
        "vegetarisch": "Vegetarisch"
      },
      "naehrstoffe": "",
      "zusatzstoffe": [
        {
          "de": "Farbstoff",
          "en": "Colouring Agent"
        },
        {
          "de": "Alkohol",
          "en": "Alcohol"
        }
      ],
      "PrintOrder": "3",
      "CO2Value": null,
      "CO2Rating": null,
      "CO2Perc": null,
      "ClimateFriendly": null,
      "GastDesc": "LES ARLETTES (Französische Blätterteigkekse) Vegan",
      "date_de": "16.12.2025"
    },
    {
      "id": "4888453",
      "outlet": "cafe",
      "date": "2025-12-16",
      "CalendarWeek": "51",
      "day": "Dienstag",
      "mealtime": "Mittagessen",
      "IdentNr": "12025121698005",
      "itemId": "21064",
      "RecipeID": "9036",
      "ProductPrice": "2.70",
      "ProductPrice_2": null,
      "GastDesc_de": "Kürbis-Bananenbrot mit Walnüssen | Zuckerfrei",
      "GastDesc_en": "Pumpkin-banana bread with walnuts | Sugar-free",
      "MenuName": "PEOPLES CHOICE",
      "allergene": {
        "gluten": "Glutenhaltiges Getreide",
        "schalenfruchte": "Schalenfrüchte und Schalenfruchterzeugnisse",
        "huhnerei": "Hühnerei und Hühnereierzeugnisse",
        "milch": "Milch und Milcherzeugnisse"
      },
      "merkmale": "",
      "naehrstoffe": "",
      "zusatzstoffe": null,
      "PrintOrder": "5",
      "CO2Value": null,
      "CO2Rating": null,
      "CO2Perc": null,
      "ClimateFriendly": null,
      "GastDesc": "Kürbis-Bananenbrot mit Walnüssen | Zuckerfrei",
      "date_de": "16.12.2025"
    },
    {
      "id": "4888454",
      "outlet": "cafe",
      "date": "2025-12-16",
      "CalendarWeek": "51",
      "day": "Dienstag",
      "mealtime": "Mittagessen",
      "IdentNr": "12025121698006",
      "itemId": "21061",
      "RecipeID": "8672",
      "ProductPrice": "2.60",
      "ProductPrice_2": null,
      "GastDesc_de": "Quarkstollen",
      "GastDesc_en": "Curd Stollen",
      "MenuName": "SEASON",
      "allergene": {
        "gluten": "Glutenhaltiges Getreide",
        "schalenfruchte": "Schalenfrüchte und Schalenfruchterzeugnisse",
        "huhnerei": "Hühnerei und Hühnereierzeugnisse",
        "milch": "Milch und Milcherzeugnisse"
      },
      "merkmale": "",
      "naehrstoffe": "",
      "zusatzstoffe": [
        {
          "de": "Farbstoff",
          "en": "Colouring Agent"
        },
        {
          "de": "Alkohol",
          "en": "Alcohol"
        }
      ],
      "PrintOrder": "6",
      "CO2Value": null,
      "CO2Rating": null,
      "CO2Perc": null,
      "ClimateFriendly": null,
      "GastDesc": "Quarkstollen",
      "date_de": "16.12.2025"
    },
    {
      "id": "4888455",
      "outlet": "cafe",
      "date": "2025-12-16",
      "CalendarWeek": "51",
      "day": "Dienstag",
      "mealtime": "Mittagessen",
      "IdentNr": "12025121698007",
      "itemId": "12776",
      "RecipeID": "9037",
      "ProductPrice": "2.50",
      "ProductPrice_2": null,
      "GastDesc_de": "Biscoff Karamell \"Apple Pie\" Cookie | Vegan",
      "GastDesc_en": "Biscoff Caramel \"Apple Pie\" Cookie | Vegan",
      "MenuName": "COOKIE",
      "allergene": {
        "gluten": "Glutenhaltiges Getreide"
      },
      "merkmale": "",
      "naehrstoffe": "",
      "zusatzstoffe": [
        {
          "de": "Farbstoff",
          "en": "Colouring Agent"
        },
        {
          "de": "Antioxidationsmittel",
          "en": "Antioxidation"
        },
        {
          "de": "Alkohol",
          "en": "Alcohol"
        }
      ],
      "PrintOrder": "7",
      "CO2Value": null,
      "CO2Rating": null,
      "CO2Perc": null,
      "ClimateFriendly": null,
      "GastDesc": "Biscoff Karamell \"Apple Pie\" Cookie | Vegan",
      "date_de": "16.12.2025"
    },
    {
      "id": "4888456",
      "outlet": "cafe",
      "date": "2025-12-16",
      "CalendarWeek": "51",
      "day": "Dienstag",
      "mealtime": "Mittagessen",
      "IdentNr": "12025121698009",
      "itemId": "12773",
      "RecipeID": "9066",
      "ProductPrice": "3.50",
      "ProductPrice_2": null,
      "GastDesc_de": "Opéra Schnitte",
      "GastDesc_en": "Opera cake",
      "MenuName": "CLASSICS",
      "allergene": {
        "gluten": "Glutenhaltiges Getreide",
        "schalenfruchte": "Schalenfrüchte und Schalenfruchterzeugnisse",
        "huhnerei": "Hühnerei und Hühnereierzeugnisse",
        "soja": "Soja und Sojaerzeugnisse",
        "milch": "Milch und Milcherzeugnisse"
      },
      "merkmale": "",
      "naehrstoffe": "",
      "zusatzstoffe": null,
      "PrintOrder": "9",
      "CO2Value": null,
      "CO2Rating": null,
      "CO2Perc": null,
      "ClimateFriendly": null,
      "GastDesc": "Opéra Schnitte",
      "date_de": "16.12.2025"
    },
    {
      "id": "4888457",
      "outlet": "cafe",
      "date": "2025-12-17",
      "CalendarWeek": "51",
      "day": "Mittwoch",
      "mealtime": "Mittagessen",
      "IdentNr": "12025121798000",
      "itemId": "21060",
      "RecipeID": "8826",
      "ProductPrice": "3.50",
      "ProductPrice_2": null,
      "GastDesc_de": "Rumkugel",
      "GastDesc_en": "Rum Ball",
      "MenuName": "CHOCOLATE",
      "allergene": {
        "gluten": "Glutenhaltiges Getreide",
        "schalenfruchte": "Schalenfrüchte und Schalenfruchterzeugnisse",
        "huhnerei": "Hühnerei und Hühnereierzeugnisse",
        "soja": "Soja und Sojaerzeugnisse",
        "milch": "Milch und Milcherzeugnisse"
      },
      "merkmale": "",
      "naehrstoffe": "",
      "zusatzstoffe": [
        {
          "de": "Farbstoff",
          "en": "Colouring Agent"
        },
        {
          "de": "Alkohol",
          "en": "Alcohol"
        }
      ],
      "PrintOrder": "0",
      "CO2Value": null,
      "CO2Rating": null,
      "CO2Perc": null,
      "ClimateFriendly": null,
      "GastDesc": "Rumkugel",
      "date_de": "17.12.2025"
    },
    {
      "id": "4888458",
      "outlet": "cafe",
      "date": "2025-12-17",
      "CalendarWeek": "51",
      "day": "Mittwoch",
      "mealtime": "Mittagessen",
      "IdentNr": "12025121798002",
      "itemId": "21062",
      "RecipeID": "8635",
      "ProductPrice": "1.50",
      "ProductPrice_2": null,
      "GastDesc_de": "Quarkbällchen",
      "GastDesc_en": "Curd Dough Balls",
      "MenuName": "FAVOURITES",
      "allergene": {
        "gluten": "Glutenhaltiges Getreide",
        "huhnerei": "Hühnerei und Hühnereierzeugnisse",
        "milch": "Milch und Milcherzeugnisse"
      },
      "merkmale": "",
      "naehrstoffe": "",
      "zusatzstoffe": null,
      "PrintOrder": "2",
      "CO2Value": null,
      "CO2Rating": null,
      "CO2Perc": null,
      "ClimateFriendly": null,
      "GastDesc": "Quarkbällchen",
      "date_de": "17.12.2025"
    },
    {
      "id": "4888459",
      "outlet": "cafe",
      "date": "2025-12-17",
      "CalendarWeek": "51",
      "day": "Mittwoch",
      "mealtime": "Mittagessen",
      "IdentNr": "12025121798003",
      "itemId": "21063",
      "RecipeID": "8211",
      "ProductPrice": "0.50",
      "ProductPrice_2": null,
      "GastDesc_de": "LES ARLETTES (Französische Blätterteigkekse) Vegan",
      "GastDesc_en": "LES ARLETTES  (French Puff Pastry Cookies) Vegan",
      "MenuName": "MINIS",
      "allergene": {
        "gluten": "Glutenhaltiges Getreide"
      },
      "merkmale": {
        "vegan": "Vegan",
        "vegetarisch": "Vegetarisch"
      },
      "naehrstoffe": "",
      "zusatzstoffe": [
        {
          "de": "Farbstoff",
          "en": "Colouring Agent"
        },
        {
          "de": "Alkohol",
          "en": "Alcohol"
        }
      ],
      "PrintOrder": "3",
      "CO2Value": null,
      "CO2Rating": null,
      "CO2Perc": null,
      "ClimateFriendly": null,
      "GastDesc": "LES ARLETTES (Französische Blätterteigkekse) Vegan",
      "date_de": "17.12.2025"
    },
    {
      "id": "4888460",
      "outlet": "cafe",
      "date": "2025-12-17",
      "CalendarWeek": "51",
      "day": "Mittwoch",
      "mealtime": "Mittagessen",
      "IdentNr": "12025121798005",
      "itemId": "21064",
      "RecipeID": "9036",
      "ProductPrice": "2.70",
      "ProductPrice_2": null,
      "GastDesc_de": "Kürbis-Bananenbrot mit Walnüssen | Zuckerfrei",
      "GastDesc_en": "Pumpkin-banana bread with walnuts | Sugar-free",
      "MenuName": "PEOPLES CHOICE",
      "allergene": {
        "gluten": "Glutenhaltiges Getreide",
        "schalenfruchte": "Schalenfrüchte und Schalenfruchterzeugnisse",
        "huhnerei": "Hühnerei und Hühnereierzeugnisse",
        "milch": "Milch und Milcherzeugnisse"
      },
      "merkmale": "",
      "naehrstoffe": "",
      "zusatzstoffe": null,
      "PrintOrder": "5",
      "CO2Value": null,
      "CO2Rating": null,
      "CO2Perc": null,
      "ClimateFriendly": null,
      "GastDesc": "Kürbis-Bananenbrot mit Walnüssen | Zuckerfrei",
      "date_de": "17.12.2025"
    },
    {
      "id": "4888461",
      "outlet": "cafe",
      "date": "2025-12-17",
      "CalendarWeek": "51",
      "day": "Mittwoch",
      "mealtime": "Mittagessen",
      "IdentNr": "12025121798006",
      "itemId": "21061",
      "RecipeID": "8672",
      "ProductPrice": "2.60",
      "ProductPrice_2": null,
      "GastDesc_de": "Quarkstollen",
      "GastDesc_en": "Curd Stollen",
      "MenuName": "SEASON",
      "allergene": {
        "gluten": "Glutenhaltiges Getreide",
        "schalenfruchte": "Schalenfrüchte und Schalenfruchterzeugnisse",
        "huhnerei": "Hühnerei und Hühnereierzeugnisse",
        "milch": "Milch und Milcherzeugnisse"
      },
      "merkmale": "",
      "naehrstoffe": "",
      "zusatzstoffe": [
        {
          "de": "Farbstoff",
          "en": "Colouring Agent"
        },
        {
          "de": "Alkohol",
          "en": "Alcohol"
        }
      ],
      "PrintOrder": "6",
      "CO2Value": null,
      "CO2Rating": null,
      "CO2Perc": null,
      "ClimateFriendly": null,
      "GastDesc": "Quarkstollen",
      "date_de": "17.12.2025"
    },
    {
      "id": "4888462",
      "outlet": "cafe",
      "date": "2025-12-17",
      "CalendarWeek": "51",
      "day": "Mittwoch",
      "mealtime": "Mittagessen",
      "IdentNr": "12025121798007",
      "itemId": "12776",
      "RecipeID": "9037",
      "ProductPrice": "2.50",
      "ProductPrice_2": null,
      "GastDesc_de": "Biscoff Karamell \"Apple Pie\" Cookie | Vegan",
      "GastDesc_en": "Biscoff Caramel \"Apple Pie\" Cookie | Vegan",
      "MenuName": "COOKIE",
      "allergene": {
        "gluten": "Glutenhaltiges Getreide"
      },
      "merkmale": "",
      "naehrstoffe": "",
      "zusatzstoffe": [
        {
          "de": "Farbstoff",
          "en": "Colouring Agent"
        },
        {
          "de": "Antioxidationsmittel",
          "en": "Antioxidation"
        },
        {
          "de": "Alkohol",
          "en": "Alcohol"
        }
      ],
      "PrintOrder": "7",
      "CO2Value": null,
      "CO2Rating": null,
      "CO2Perc": null,
      "ClimateFriendly": null,
      "GastDesc": "Biscoff Karamell \"Apple Pie\" Cookie | Vegan",
      "date_de": "17.12.2025"
    },
    {
      "id": "4888463",
      "outlet": "cafe",
      "date": "2025-12-17",
      "CalendarWeek": "51",
      "day": "Mittwoch",
      "mealtime": "Mittagessen",
      "IdentNr": "12025121798009",
      "itemId": "12773",
      "RecipeID": "9066",
      "ProductPrice": "3.50",
      "ProductPrice_2": null,
      "GastDesc_de": "Opéra Schnitte",
      "GastDesc_en": "Opera cake",
      "MenuName": "CLASSICS",
      "allergene": {
        "gluten": "Glutenhaltiges Getreide",
        "schalenfruchte": "Schalenfrüchte und Schalenfruchterzeugnisse",
        "huhnerei": "Hühnerei und Hühnereierzeugnisse",
        "soja": "Soja und Sojaerzeugnisse",
        "milch": "Milch und Milcherzeugnisse"
      },
      "merkmale": "",
      "naehrstoffe": "",
      "zusatzstoffe": null,
      "PrintOrder": "9",
      "CO2Value": null,
      "CO2Rating": null,
      "CO2Perc": null,
      "ClimateFriendly": null,
      "GastDesc": "Opéra Schnitte",
      "date_de": "17.12.2025"
    },
    {
      "id": "4888464",
      "outlet": "cafe",
      "date": "2025-12-18",
      "CalendarWeek": "51",
      "day": "Donnerstag",
      "mealtime": "Mittagessen",
      "IdentNr": "12025121898000",
      "itemId": "21060",
      "RecipeID": "8826",
      "ProductPrice": "3.50",
      "ProductPrice_2": null,
      "GastDesc_de": "Rumkugel",
      "GastDesc_en": "Rum Ball",
      "MenuName": "CHOCOLATE",
      "allergene": {
        "gluten": "Glutenhaltiges Getreide",
        "schalenfruchte": "Schalenfrüchte und Schalenfruchterzeugnisse",
        "huhnerei": "Hühnerei und Hühnereierzeugnisse",
        "soja": "Soja und Sojaerzeugnisse",
        "milch": "Milch und Milcherzeugnisse"
      },
      "merkmale": "",
      "naehrstoffe": "",
      "zusatzstoffe": [
        {
          "de": "Farbstoff",
          "en": "Colouring Agent"
        },
        {
          "de": "Alkohol",
          "en": "Alcohol"
        }
      ],
      "PrintOrder": "0",
      "CO2Value": null,
      "CO2Rating": null,
      "CO2Perc": null,
      "ClimateFriendly": null,
      "GastDesc": "Rumkugel",
      "date_de": "18.12.2025"
    },
    {
      "id": "4888465",
      "outlet": "cafe",
      "date": "2025-12-18",
      "CalendarWeek": "51",
      "day": "Donnerstag",
      "mealtime": "Mittagessen",
      "IdentNr": "12025121898002",
      "itemId": "21062",
      "RecipeID": "8635",
      "ProductPrice": "1.50",
      "ProductPrice_2": null,
      "GastDesc_de": "Quarkbällchen",
      "GastDesc_en": "Curd Dough Balls",
      "MenuName": "FAVOURITES",
      "allergene": {
        "gluten": "Glutenhaltiges Getreide",
        "huhnerei": "Hühnerei und Hühnereierzeugnisse",
        "milch": "Milch und Milcherzeugnisse"
      },
      "merkmale": "",
      "naehrstoffe": "",
      "zusatzstoffe": null,
      "PrintOrder": "2",
      "CO2Value": null,
      "CO2Rating": null,
      "CO2Perc": null,
      "ClimateFriendly": null,
      "GastDesc": "Quarkbällchen",
      "date_de": "18.12.2025"
    },
    {
      "id": "4888466",
      "outlet": "cafe",
      "date": "2025-12-18",
      "CalendarWeek": "51",
      "day": "Donnerstag",
      "mealtime": "Mittagessen",
      "IdentNr": "12025121898003",
      "itemId": "21063",
      "RecipeID": "8211",
      "ProductPrice": "0.50",
      "ProductPrice_2": null,
      "GastDesc_de": "LES ARLETTES (Französische Blätterteigkekse) Vegan",
      "GastDesc_en": "LES ARLETTES  (French Puff Pastry Cookies) Vegan",
      "MenuName": "MINIS",
      "allergene": {
        "gluten": "Glutenhaltiges Getreide"
      },
      "merkmale": {
        "vegan": "Vegan",
        "vegetarisch": "Vegetarisch"
      },
      "naehrstoffe": "",
      "zusatzstoffe": [
        {
          "de": "Farbstoff",
          "en": "Colouring Agent"
        },
        {
          "de": "Alkohol",
          "en": "Alcohol"
        }
      ],
      "PrintOrder": "3",
      "CO2Value": null,
      "CO2Rating": null,
      "CO2Perc": null,
      "ClimateFriendly": null,
      "GastDesc": "LES ARLETTES (Französische Blätterteigkekse) Vegan",
      "date_de": "18.12.2025"
    },
    {
      "id": "4888467",
      "outlet": "cafe",
      "date": "2025-12-18",
      "CalendarWeek": "51",
      "day": "Donnerstag",
      "mealtime": "Mittagessen",
      "IdentNr": "12025121898005",
      "itemId": "21064",
      "RecipeID": "9036",
      "ProductPrice": "2.70",
      "ProductPrice_2": null,
      "GastDesc_de": "Kürbis-Bananenbrot mit Walnüssen | Zuckerfrei",
      "GastDesc_en": "Pumpkin-banana bread with walnuts | Sugar-free",
      "MenuName": "PEOPLES CHOICE",
      "allergene": {
        "gluten": "Glutenhaltiges Getreide",
        "schalenfruchte": "Schalenfrüchte und Schalenfruchterzeugnisse",
        "huhnerei": "Hühnerei und Hühnereierzeugnisse",
        "milch": "Milch und Milcherzeugnisse"
      },
      "merkmale": "",
      "naehrstoffe": "",
      "zusatzstoffe": null,
      "PrintOrder": "5",
      "CO2Value": null,
      "CO2Rating": null,
      "CO2Perc": null,
      "ClimateFriendly": null,
      "GastDesc": "Kürbis-Bananenbrot mit Walnüssen | Zuckerfrei",
      "date_de": "18.12.2025"
    },
    {
      "id": "4888468",
      "outlet": "cafe",
      "date": "2025-12-18",
      "CalendarWeek": "51",
      "day": "Donnerstag",
      "mealtime": "Mittagessen",
      "IdentNr": "12025121898006",
      "itemId": "21061",
      "RecipeID": "8672",
      "ProductPrice": "2.60",
      "ProductPrice_2": null,
      "GastDesc_de": "Quarkstollen",
      "GastDesc_en": "Curd Stollen",
      "MenuName": "SEASON",
      "allergene": {
        "gluten": "Glutenhaltiges Getreide",
        "schalenfruchte": "Schalenfrüchte und Schalenfruchterzeugnisse",
        "huhnerei": "Hühnerei und Hühnereierzeugnisse",
        "milch": "Milch und Milcherzeugnisse"
      },
      "merkmale": "",
      "naehrstoffe": "",
      "zusatzstoffe": [
        {
          "de": "Farbstoff",
          "en": "Colouring Agent"
        },
        {
          "de": "Alkohol",
          "en": "Alcohol"
        }
      ],
      "PrintOrder": "6",
      "CO2Value": null,
      "CO2Rating": null,
      "CO2Perc": null,
      "ClimateFriendly": null,
      "GastDesc": "Quarkstollen",
      "date_de": "18.12.2025"
    },
    {
      "id": "4888469",
      "outlet": "cafe",
      "date": "2025-12-18",
      "CalendarWeek": "51",
      "day": "Donnerstag",
      "mealtime": "Mittagessen",
      "IdentNr": "12025121898007",
      "itemId": "12776",
      "RecipeID": "9037",
      "ProductPrice": "2.50",
      "ProductPrice_2": null,
      "GastDesc_de": "Biscoff Karamell \"Apple Pie\" Cookie | Vegan",
      "GastDesc_en": "Biscoff Caramel \"Apple Pie\" Cookie | Vegan",
      "MenuName": "COOKIE",
      "allergene": {
        "gluten": "Glutenhaltiges Getreide"
      },
      "merkmale": "",
      "naehrstoffe": "",
      "zusatzstoffe": [
        {
          "de": "Farbstoff",
          "en": "Colouring Agent"
        },
        {
          "de": "Antioxidationsmittel",
          "en": "Antioxidation"
        },
        {
          "de": "Alkohol",
          "en": "Alcohol"
        }
      ],
      "PrintOrder": "7",
      "CO2Value": null,
      "CO2Rating": null,
      "CO2Perc": null,
      "ClimateFriendly": null,
      "GastDesc": "Biscoff Karamell \"Apple Pie\" Cookie | Vegan",
      "date_de": "18.12.2025"
    },
    {
      "id": "4888470",
      "outlet": "cafe",
      "date": "2025-12-18",
      "CalendarWeek": "51",
      "day": "Donnerstag",
      "mealtime": "Mittagessen",
      "IdentNr": "12025121898009",
      "itemId": "12773",
      "RecipeID": "9066",
      "ProductPrice": "3.50",
      "ProductPrice_2": null,
      "GastDesc_de": "Opéra Schnitte",
      "GastDesc_en": "Opera cake",
      "MenuName": "CLASSICS",
      "allergene": {
        "gluten": "Glutenhaltiges Getreide",
        "schalenfruchte": "Schalenfrüchte und Schalenfruchterzeugnisse",
        "huhnerei": "Hühnerei und Hühnereierzeugnisse",
        "soja": "Soja und Sojaerzeugnisse",
        "milch": "Milch und Milcherzeugnisse"
      },
      "merkmale": "",
      "naehrstoffe": "",
      "zusatzstoffe": null,
      "PrintOrder": "9",
      "CO2Value": null,
      "CO2Rating": null,
      "CO2Perc": null,
      "ClimateFriendly": null,
      "GastDesc": "Opéra Schnitte",
      "date_de": "18.12.2025"
    },
    {
      "id": "4888471",
      "outlet": "cafe",
      "date": "2025-12-19",
      "CalendarWeek": "51",
      "day": "Freitag",
      "mealtime": "Mittagessen",
      "IdentNr": "12025121998000",
      "itemId": "21060",
      "RecipeID": "8826",
      "ProductPrice": "3.50",
      "ProductPrice_2": null,
      "GastDesc_de": "Rumkugel",
      "GastDesc_en": "Rum Ball",
      "MenuName": "CHOCOLATE",
      "allergene": {
        "gluten": "Glutenhaltiges Getreide",
        "schalenfruchte": "Schalenfrüchte und Schalenfruchterzeugnisse",
        "huhnerei": "Hühnerei und Hühnereierzeugnisse",
        "soja": "Soja und Sojaerzeugnisse",
        "milch": "Milch und Milcherzeugnisse"
      },
      "merkmale": "",
      "naehrstoffe": "",
      "zusatzstoffe": [
        {
          "de": "Farbstoff",
          "en": "Colouring Agent"
        },
        {
          "de": "Alkohol",
          "en": "Alcohol"
        }
      ],
      "PrintOrder": "0",
      "CO2Value": null,
      "CO2Rating": null,
      "CO2Perc": null,
      "ClimateFriendly": null,
      "GastDesc": "Rumkugel",
      "date_de": "19.12.2025"
    },
    {
      "id": "4888472",
      "outlet": "cafe",
      "date": "2025-12-19",
      "CalendarWeek": "51",
      "day": "Freitag",
      "mealtime": "Mittagessen",
      "IdentNr": "12025121998002",
      "itemId": "21062",
      "RecipeID": "8635",
      "ProductPrice": "1.50",
      "ProductPrice_2": null,
      "GastDesc_de": "Quarkbällchen",
      "GastDesc_en": "Curd Dough Balls",
      "MenuName": "FAVOURITES",
      "allergene": {
        "gluten": "Glutenhaltiges Getreide",
        "huhnerei": "Hühnerei und Hühnereierzeugnisse",
        "milch": "Milch und Milcherzeugnisse"
      },
      "merkmale": "",
      "naehrstoffe": "",
      "zusatzstoffe": null,
      "PrintOrder": "2",
      "CO2Value": null,
      "CO2Rating": null,
      "CO2Perc": null,
      "ClimateFriendly": null,
      "GastDesc": "Quarkbällchen",
      "date_de": "19.12.2025"
    },
    {
      "id": "4888473",
      "outlet": "cafe",
      "date": "2025-12-19",
      "CalendarWeek": "51",
      "day": "Freitag",
      "mealtime": "Mittagessen",
      "IdentNr": "12025121998003",
      "itemId": "21063",
      "RecipeID": "8211",
      "ProductPrice": "0.50",
      "ProductPrice_2": null,
      "GastDesc_de": "LES ARLETTES (Französische Blätterteigkekse) Vegan",
      "GastDesc_en": "LES ARLETTES  (French Puff Pastry Cookies) Vegan",
      "MenuName": "MINIS",
      "allergene": {
        "gluten": "Glutenhaltiges Getreide"
      },
      "merkmale": {
        "vegan": "Vegan",
        "vegetarisch": "Vegetarisch"
      },
      "naehrstoffe": "",
      "zusatzstoffe": [
        {
          "de": "Farbstoff",
          "en": "Colouring Agent"
        },
        {
          "de": "Alkohol",
          "en": "Alcohol"
        }
      ],
      "PrintOrder": "3",
      "CO2Value": null,
      "CO2Rating": null,
      "CO2Perc": null,
      "ClimateFriendly": null,
      "GastDesc": "LES ARLETTES (Französische Blätterteigkekse) Vegan",
      "date_de": "19.12.2025"
    },
    {
      "id": "4888474",
      "outlet": "cafe",
      "date": "2025-12-19",
      "CalendarWeek": "51",
      "day": "Freitag",
      "mealtime": "Mittagessen",
      "IdentNr": "12025121998005",
      "itemId": "21064",
      "RecipeID": "9036",
      "ProductPrice": "2.70",
      "ProductPrice_2": null,
      "GastDesc_de": "Kürbis-Bananenbrot mit Walnüssen | Zuckerfrei",
      "GastDesc_en": "Pumpkin-banana bread with walnuts | Sugar-free",
      "MenuName": "PEOPLES CHOICE",
      "allergene": {
        "gluten": "Glutenhaltiges Getreide",
        "schalenfruchte": "Schalenfrüchte und Schalenfruchterzeugnisse",
        "huhnerei": "Hühnerei und Hühnereierzeugnisse",
        "milch": "Milch und Milcherzeugnisse"
      },
      "merkmale": "",
      "naehrstoffe": "",
      "zusatzstoffe": null,
      "PrintOrder": "5",
      "CO2Value": null,
      "CO2Rating": null,
      "CO2Perc": null,
      "ClimateFriendly": null,
      "GastDesc": "Kürbis-Bananenbrot mit Walnüssen | Zuckerfrei",
      "date_de": "19.12.2025"
    },
    {
      "id": "4888475",
      "outlet": "cafe",
      "date": "2025-12-19",
      "CalendarWeek": "51",
      "day": "Freitag",
      "mealtime": "Mittagessen",
      "IdentNr": "12025121998006",
      "itemId": "21061",
      "RecipeID": "8672",
      "ProductPrice": "2.60",
      "ProductPrice_2": null,
      "GastDesc_de": "Quarkstollen",
      "GastDesc_en": "Curd Stollen",
      "MenuName": "SEASON",
      "allergene": {
        "gluten": "Glutenhaltiges Getreide",
        "schalenfruchte": "Schalenfrüchte und Schalenfruchterzeugnisse",
        "huhnerei": "Hühnerei und Hühnereierzeugnisse",
        "milch": "Milch und Milcherzeugnisse"
      },
      "merkmale": "",
      "naehrstoffe": "",
      "zusatzstoffe": [
        {
          "de": "Farbstoff",
          "en": "Colouring Agent"
        },
        {
          "de": "Alkohol",
          "en": "Alcohol"
        }
      ],
      "PrintOrder": "6",
      "CO2Value": null,
      "CO2Rating": null,
      "CO2Perc": null,
      "ClimateFriendly": null,
      "GastDesc": "Quarkstollen",
      "date_de": "19.12.2025"
    },
    {
      "id": "4888476",
      "outlet": "cafe",
      "date": "2025-12-19",
      "CalendarWeek": "51",
      "day": "Freitag",
      "mealtime": "Mittagessen",
      "IdentNr": "12025121998007",
      "itemId": "12776",
      "RecipeID": "9037",
      "ProductPrice": "2.50",
      "ProductPrice_2": null,
      "GastDesc_de": "Biscoff Karamell \"Apple Pie\" Cookie | Vegan",
      "GastDesc_en": "Biscoff Caramel \"Apple Pie\" Cookie | Vegan",
      "MenuName": "COOKIE",
      "allergene": {
        "gluten": "Glutenhaltiges Getreide"
      },
      "merkmale": "",
      "naehrstoffe": "",
      "zusatzstoffe": [
        {
          "de": "Farbstoff",
          "en": "Colouring Agent"
        },
        {
          "de": "Antioxidationsmittel",
          "en": "Antioxidation"
        },
        {
          "de": "Alkohol",
          "en": "Alcohol"
        }
      ],
      "PrintOrder": "7",
      "CO2Value": null,
      "CO2Rating": null,
      "CO2Perc": null,
      "ClimateFriendly": null,
      "GastDesc": "Biscoff Karamell \"Apple Pie\" Cookie | Vegan",
      "date_de": "19.12.2025"
    },
    {
      "id": "4888477",
      "outlet": "cafe",
      "date": "2025-12-19",
      "CalendarWeek": "51",
      "day": "Freitag",
      "mealtime": "Mittagessen",
      "IdentNr": "12025121998009",
      "itemId": "12773",
      "RecipeID": "9066",
      "ProductPrice": "3.50",
      "ProductPrice_2": null,
      "GastDesc_de": "Opéra Schnitte",
      "GastDesc_en": "Opera cake",
      "MenuName": "CLASSICS",
      "allergene": {
        "gluten": "Glutenhaltiges Getreide",
        "schalenfruchte": "Schalenfrüchte und Schalenfruchterzeugnisse",
        "huhnerei": "Hühnerei und Hühnereierzeugnisse",
        "soja": "Soja und Sojaerzeugnisse",
        "milch": "Milch und Milcherzeugnisse"
      },
      "merkmale": "",
      "naehrstoffe": "",
      "zusatzstoffe": null,
      "PrintOrder": "9",
      "CO2Value": null,
      "CO2Rating": null,
      "CO2Perc": null,
      "ClimateFriendly": null,
      "GastDesc": "Opéra Schnitte",
      "date_de": "19.12.2025"
    },
    {
      "id": "4824164",
      "outlet": "canteen",
      "date": "2025-12-09",
      "CalendarWeek": "50",
      "day": "Dienstag",
      "mealtime": "Mittagessen",
      "IdentNr": "12025120998000",
      "itemId": "17549",
      "RecipeID": "5059",
      "ProductPrice": "11.00",
      "ProductPrice_2": null,
      "GastDesc_de": "Weiße Bohnen | Putenbrust | Tomaten-Pesto",
      "GastDesc_en": "White Beans | Turkey breast | Tomato Pesto",
      "MenuName": "COUNTER 1.1 Bowls_",
      "allergene": {
        "schalenfruchte": "Schalenfrüchte und Schalenfruchterzeugnisse",
        "schwefel": "Schwefeldioxid und Sulfide"
      },
      "merkmale": "",
      "naehrstoffe": "",
      "zusatzstoffe": [
        {
          "de": "Antioxidationsmittel",
          "en": "Antioxidation"
        },
        {
          "de": "Konservierungsstoff",
          "en": "Preservatives"
        }
      ],
      "PrintOrder": "0",
      "CO2Value": "1239.00",
      "CO2Rating": "C",
      "CO2Perc": "50.00",
      "ClimateFriendly": null,
      "GastDesc": "Weiße Bohnen | Putenbrust | Tomaten-Pesto",
      "date_de": "09.12.2025"
    },
    {
      "id": "4824165",
      "outlet": "canteen",
      "date": "2025-12-09",
      "CalendarWeek": "50",
      "day": "Dienstag",
      "mealtime": "Mittagessen",
      "IdentNr": "12025120998001",
      "itemId": "17550",
      "RecipeID": "2883",
      "ProductPrice": "12.00",
      "ProductPrice_2": null,
      "GastDesc_de": "Schweinefilet | Bohnenragout | Pancetta",
      "GastDesc_en": "Pork Fillet | Mixed Bean Ragout | Pancetta",
      "MenuName": "COUNTER 2.1 Meat",
      "allergene": {
        "gluten": "Glutenhaltiges Getreide",
        "milch": "Milch und Milcherzeugnisse",
        "sellerie": "Sellerie und Sellerieerzeugnisse",
        "schwefel": "Schwefeldioxid und Sulfide"
      },
      "merkmale": "",
      "naehrstoffe": "",
      "zusatzstoffe": [
        {
          "de": "Antioxidationsmittel",
          "en": "Antioxidation"
        },
        {
          "de": "Konservierungsstoff",
          "en": "Preservatives"
        },
        {
          "de": "Alkohol",
          "en": "Alcohol"
        }
      ],
      "PrintOrder": "1",
      "CO2Value": "3666.00",
      "CO2Rating": "D",
      "CO2Perc": "100.00",
      "ClimateFriendly": null,
      "GastDesc": "Schweinefilet | Bohnenragout | Pancetta",
      "date_de": "09.12.2025"
    },
    {
      "id": "4824166",
      "outlet": "canteen",
      "date": "2025-12-09",
      "CalendarWeek": "50",
      "day": "Dienstag",
      "mealtime": "Mittagessen",
      "IdentNr": "12025120998003",
      "itemId": "17552",
      "RecipeID": "6088",
      "ProductPrice": "12.00",
      "ProductPrice_2": null,
      "GastDesc_de": "Zanderfilet | Kartoffel-Erbsenpüree | Schmortomaten",
      "GastDesc_en": "Pike Perch | Potato Pea Püree | Roasted Tomato",
      "MenuName": "COUNTER 3.1 Fish",
      "allergene": {
        "fisch": "Fisch und Fischerzeugnisse",
        "milch": "Milch und Milcherzeugnisse",
        "sellerie": "Sellerie und Sellerieerzeugnisse"
      },
      "merkmale": "",
      "naehrstoffe": "",
      "zusatzstoffe": null,
      "PrintOrder": "3",
      "CO2Value": "721.00",
      "CO2Rating": "B",
      "CO2Perc": "100.00",
      "ClimateFriendly": null,
      "GastDesc": "Zanderfilet | Kartoffel-Erbsenpüree | Schmortomaten",
      "date_de": "09.12.2025"
    },
    {
      "id": "4824167",
      "outlet": "canteen",
      "date": "2025-12-09",
      "CalendarWeek": "50",
      "day": "Dienstag",
      "mealtime": "Mittagessen",
      "IdentNr": "12025120998005",
      "itemId": "17554",
      "RecipeID": "8212",
      "ProductPrice": "9.50",
      "ProductPrice_2": null,
      "GastDesc_de": "Szechuan-Aubergine | Jasmin Reis | Chili-Erdnüsse",
      "GastDesc_en": "Szechuan Aubergine | Jasmin Rice | Chili Peanuts",
      "MenuName": "COUNTER 4.1 Vegi",
      "allergene": {
        "gluten": "Glutenhaltiges Getreide",
        "soja": "Soja und Sojaerzeugnisse",
        "erdnuss": "Erdnüsse und Erdnusserzeugnisse",
        "sellerie": "Sellerie und Sellerieerzeugnisse"
      },
      "merkmale": {
        "vegan": "Vegan",
        "vegetarisch": "Vegetarisch"
      },
      "naehrstoffe": "",
      "zusatzstoffe": [
        {
          "de": "Süßungsmittel",
          "en": "Sweetener"
        },
        {
          "de": "Phenylalaninquelle",
          "en": "Phenylalanine"
        },
        {
          "de": "Geschmacksverstärker",
          "en": "Flavor Enhancer"
        },
        {
          "de": "Konservierungsstoff",
          "en": "Preservatives"
        }
      ],
      "PrintOrder": "5",
      "CO2Value": "757.00",
      "CO2Rating": "B",
      "CO2Perc": "100.00",
      "ClimateFriendly": null,
      "GastDesc": "Szechuan-Aubergine | Jasmin Reis | Chili-Erdnüsse",
      "date_de": "09.12.2025"
    },
    {
      "id": "4824168",
      "outlet": "canteen",
      "date": "2025-12-09",
      "CalendarWeek": "50",
      "day": "Dienstag",
      "mealtime": "Abendessen",
      "IdentNr": "12025120998009",
      "itemId": "17558",
      "RecipeID": "5059",
      "ProductPrice": "11.00",
      "ProductPrice_2": null,
      "GastDesc_de": "Weiße Bohnen | Putenbrust | Tomaten-Pesto",
      "GastDesc_en": "White Beans | Turkey breast | Tomato Pesto",
      "MenuName": "DINNER BOWL_",
      "allergene": {
        "schalenfruchte": "Schalenfrüchte und Schalenfruchterzeugnisse",
        "schwefel": "Schwefeldioxid und Sulfide"
      },
      "merkmale": "",
      "naehrstoffe": "",
      "zusatzstoffe": [
        {
          "de": "Antioxidationsmittel",
          "en": "Antioxidation"
        },
        {
          "de": "Konservierungsstoff",
          "en": "Preservatives"
        }
      ],
      "PrintOrder": "9",
      "CO2Value": "1239.00",
      "CO2Rating": "C",
      "CO2Perc": "50.00",
      "ClimateFriendly": null,
      "GastDesc": "Weiße Bohnen | Putenbrust | Tomaten-Pesto",
      "date_de": "09.12.2025"
    },
    {
      "id": "4824170",
      "outlet": "canteen",
      "date": "2025-12-09",
      "CalendarWeek": "50",
      "day": "Dienstag",
      "mealtime": "Abendessen",
      "IdentNr": "12025120998011",
      "itemId": "17560",
      "RecipeID": "8788",
      "ProductPrice": "12.00",
      "ProductPrice_2": null,
      "GastDesc_de": "Seelachs | Zwiebel-Pesto | Tomaten | Kartoffelpüree",
      "GastDesc_en": "coalfish | onion pesto | tomato| mashed potatoes",
      "MenuName": "DINNER Fish_17:00-19:00",
      "allergene": {
        "schalenfruchte": "Schalenfrüchte und Schalenfruchterzeugnisse",
        "fisch": "Fisch und Fischerzeugnisse",
        "milch": "Milch und Milcherzeugnisse",
        "sellerie": "Sellerie und Sellerieerzeugnisse"
      },
      "merkmale": "",
      "naehrstoffe": "",
      "zusatzstoffe": [
        {
          "de": "Antioxidationsmittel",
          "en": "Antioxidation"
        }
      ],
      "PrintOrder": "11",
      "CO2Value": "1338.00",
      "CO2Rating": "C",
      "CO2Perc": "100.00",
      "ClimateFriendly": null,
      "GastDesc": "Seelachs | Zwiebel-Pesto | Tomaten | Kartoffelpüree",
      "date_de": "09.12.2025"
    },
    {
      "id": "4824172",
      "outlet": "canteen",
      "date": "2025-12-09",
      "CalendarWeek": "50",
      "day": "Dienstag",
      "mealtime": "Abendessen",
      "IdentNr": "12025120998012",
      "itemId": "17561",
      "RecipeID": "8212",
      "ProductPrice": "9.50",
      "ProductPrice_2": null,
      "GastDesc_de": "Szechuan-Aubergine | Jasmin Reis | Chili-Erdnüsse",
      "GastDesc_en": "Szechuan Aubergine | Jasmin Rice | Chili Peanuts",
      "MenuName": "DINNER Vegi/Vegan_17:00-19:00",
      "allergene": {
        "gluten": "Glutenhaltiges Getreide",
        "soja": "Soja und Sojaerzeugnisse",
        "erdnuss": "Erdnüsse und Erdnusserzeugnisse",
        "sellerie": "Sellerie und Sellerieerzeugnisse"
      },
      "merkmale": {
        "vegan": "Vegan",
        "vegetarisch": "Vegetarisch"
      },
      "naehrstoffe": "",
      "zusatzstoffe": [
        {
          "de": "Süßungsmittel",
          "en": "Sweetener"
        },
        {
          "de": "Phenylalaninquelle",
          "en": "Phenylalanine"
        },
        {
          "de": "Geschmacksverstärker",
          "en": "Flavor Enhancer"
        },
        {
          "de": "Konservierungsstoff",
          "en": "Preservatives"
        }
      ],
      "PrintOrder": "12",
      "CO2Value": "757.00",
      "CO2Rating": "B",
      "CO2Perc": "100.00",
      "ClimateFriendly": null,
      "GastDesc": "Szechuan-Aubergine | Jasmin Reis | Chili-Erdnüsse",
      "date_de": "09.12.2025"
    },
    {
      "id": "4841776",
      "outlet": "canteen",
      "date": "2025-12-10",
      "CalendarWeek": "50",
      "day": "Mittwoch",
      "mealtime": "Mittagessen",
      "IdentNr": "12025121098000",
      "itemId": "17549",
      "RecipeID": "4907",
      "ProductPrice": "9.50",
      "ProductPrice_2": null,
      "GastDesc_de": "Gerösterter Blumenkohl | Honigkarotte | Rosenkohl",
      "GastDesc_en": "Roasted Cauliflower Tabouleh | Honey Carrots | Brussel Sprouts",
      "MenuName": "COUNTER 1.1 Bowls_",
      "allergene": {
        "gluten": "Glutenhaltiges Getreide",
        "schalenfruchte": "Schalenfrüchte und Schalenfruchterzeugnisse",
        "soja": "Soja und Sojaerzeugnisse",
        "erdnuss": "Erdnüsse und Erdnusserzeugnisse",
        "sellerie": "Sellerie und Sellerieerzeugnisse"
      },
      "merkmale": {
        "vegan": "Vegan",
        "vegetarisch": "Vegetarisch"
      },
      "naehrstoffe": "",
      "zusatzstoffe": null,
      "PrintOrder": "0",
      "CO2Value": "300.00",
      "CO2Rating": "A",
      "CO2Perc": "100.00",
      "ClimateFriendly": "1",
      "GastDesc": "Gerösterter Blumenkohl | Honigkarotte | Rosenkohl",
      "date_de": "10.12.2025"
    },
    {
      "id": "4841777",
      "outlet": "canteen",
      "date": "2025-12-10",
      "CalendarWeek": "50",
      "day": "Mittwoch",
      "mealtime": "Mittagessen",
      "IdentNr": "12025121098001",
      "itemId": "17550",
      "RecipeID": "5727",
      "ProductPrice": "12.00",
      "ProductPrice_2": null,
      "GastDesc_de": "Kalbsbolognese | Penne | Parmesan",
      "GastDesc_en": "Veal bolognese | Penne | Parmesan",
      "MenuName": "COUNTER 2.1 Meat",
      "allergene": {
        "gluten": "Glutenhaltiges Getreide",
        "schalenfruchte": "Schalenfrüchte und Schalenfruchterzeugnisse",
        "milch": "Milch und Milcherzeugnisse",
        "sellerie": "Sellerie und Sellerieerzeugnisse",
        "schwefel": "Schwefeldioxid und Sulfide"
      },
      "merkmale": "",
      "naehrstoffe": "",
      "zusatzstoffe": [
        {
          "de": "Konservierungsstoff",
          "en": "Preservatives"
        },
        {
          "de": "Alkohol",
          "en": "Alcohol"
        }
      ],
      "PrintOrder": "1",
      "CO2Value": "2748.00",
      "CO2Rating": "C",
      "CO2Perc": "100.00",
      "ClimateFriendly": null,
      "GastDesc": "Kalbsbolognese | Penne | Parmesan",
      "date_de": "10.12.2025"
    },
    {
      "id": "4841778",
      "outlet": "canteen",
      "date": "2025-12-10",
      "CalendarWeek": "50",
      "day": "Mittwoch",
      "mealtime": "Mittagessen",
      "IdentNr": "12025121098003",
      "itemId": "17552",
      "RecipeID": "6088",
      "ProductPrice": "12.00",
      "ProductPrice_2": null,
      "GastDesc_de": "Zanderfilet | Kartoffel-Erbsenpüree | Schmortomaten",
      "GastDesc_en": "Pike Perch | Potato Pea Püree | Roasted Tomato",
      "MenuName": "COUNTER 3.1 Fish",
      "allergene": {
        "fisch": "Fisch und Fischerzeugnisse",
        "milch": "Milch und Milcherzeugnisse",
        "sellerie": "Sellerie und Sellerieerzeugnisse"
      },
      "merkmale": "",
      "naehrstoffe": "",
      "zusatzstoffe": null,
      "PrintOrder": "3",
      "CO2Value": "721.00",
      "CO2Rating": "B",
      "CO2Perc": "100.00",
      "ClimateFriendly": null,
      "GastDesc": "Zanderfilet | Kartoffel-Erbsenpüree | Schmortomaten",
      "date_de": "10.12.2025"
    },
    {
      "id": "4841779",
      "outlet": "canteen",
      "date": "2025-12-10",
      "CalendarWeek": "50",
      "day": "Mittwoch",
      "mealtime": "Mittagessen",
      "IdentNr": "12025121098005",
      "itemId": "17554",
      "RecipeID": "4713",
      "ProductPrice": "10.00",
      "ProductPrice_2": null,
      "GastDesc_de": "Schwarze Gnocchi | Pesto | Gegrilltes Gemüse",
      "GastDesc_en": "Black Gnocchi | Pesto | Grilled Vegetables",
      "MenuName": "COUNTER 4.1 Vegi",
      "allergene": {
        "gluten": "Glutenhaltiges Getreide",
        "schalenfruchte": "Schalenfrüchte und Schalenfruchterzeugnisse",
        "huhnerei": "Hühnerei und Hühnereierzeugnisse",
        "milch": "Milch und Milcherzeugnisse",
        "schwefel": "Schwefeldioxid und Sulfide"
      },
      "merkmale": {
        "vegan": "Vegan",
        "vegetarisch": "Vegetarisch"
      },
      "naehrstoffe": "",
      "zusatzstoffe": [
        {
          "de": "Farbstoff",
          "en": "Colouring Agent"
        },
        {
          "de": "Konservierungsstoff",
          "en": "Preservatives"
        }
      ],
      "PrintOrder": "5",
      "CO2Value": "719.00",
      "CO2Rating": "B",
      "CO2Perc": "100.00",
      "ClimateFriendly": null,
      "GastDesc": "Schwarze Gnocchi | Pesto | Gegrilltes Gemüse",
      "date_de": "10.12.2025"
    },
    {
      "id": "4841780",
      "outlet": "canteen",
      "date": "2025-12-10",
      "CalendarWeek": "50",
      "day": "Mittwoch",
      "mealtime": "Abendessen",
      "IdentNr": "12025121098009",
      "itemId": "17558",
      "RecipeID": "4907",
      "ProductPrice": "9.50",
      "ProductPrice_2": null,
      "GastDesc_de": "Gerösterter Blumenkohl | Honigkarotte | Rosenkohl",
      "GastDesc_en": "Roasted Cauliflower Tabouleh | Honey Carrots | Brussel Sprouts",
      "MenuName": "DINNER BOWL_",
      "allergene": {
        "gluten": "Glutenhaltiges Getreide",
        "schalenfruchte": "Schalenfrüchte und Schalenfruchterzeugnisse",
        "soja": "Soja und Sojaerzeugnisse",
        "erdnuss": "Erdnüsse und Erdnusserzeugnisse",
        "sellerie": "Sellerie und Sellerieerzeugnisse"
      },
      "merkmale": {
        "vegan": "Vegan",
        "vegetarisch": "Vegetarisch"
      },
      "naehrstoffe": "",
      "zusatzstoffe": null,
      "PrintOrder": "9",
      "CO2Value": "300.00",
      "CO2Rating": "A",
      "CO2Perc": "100.00",
      "ClimateFriendly": "1",
      "GastDesc": "Gerösterter Blumenkohl | Honigkarotte | Rosenkohl",
      "date_de": "10.12.2025"
    },
    {
      "id": "4841782",
      "outlet": "canteen",
      "date": "2025-12-10",
      "CalendarWeek": "50",
      "day": "Mittwoch",
      "mealtime": "Abendessen",
      "IdentNr": "12025121098010",
      "itemId": "17559",
      "RecipeID": "5727",
      "ProductPrice": "12.00",
      "ProductPrice_2": null,
      "GastDesc_de": "Kalbsbolognese | Penne | Parmesan",
      "GastDesc_en": "Veal bolognese | Penne | Parmesan",
      "MenuName": "DINNER Meat_17:00-19:00",
      "allergene": {
        "gluten": "Glutenhaltiges Getreide",
        "schalenfruchte": "Schalenfrüchte und Schalenfruchterzeugnisse",
        "milch": "Milch und Milcherzeugnisse",
        "sellerie": "Sellerie und Sellerieerzeugnisse",
        "schwefel": "Schwefeldioxid und Sulfide"
      },
      "merkmale": "",
      "naehrstoffe": "",
      "zusatzstoffe": [
        {
          "de": "Konservierungsstoff",
          "en": "Preservatives"
        },
        {
          "de": "Alkohol",
          "en": "Alcohol"
        }
      ],
      "PrintOrder": "10",
      "CO2Value": "2748.00",
      "CO2Rating": "C",
      "CO2Perc": "100.00",
      "ClimateFriendly": null,
      "GastDesc": "Kalbsbolognese | Penne | Parmesan",
      "date_de": "10.12.2025"
    },
    {
      "id": "4841784",
      "outlet": "canteen",
      "date": "2025-12-10",
      "CalendarWeek": "50",
      "day": "Mittwoch",
      "mealtime": "Abendessen",
      "IdentNr": "12025121098012",
      "itemId": "17561",
      "RecipeID": "4713",
      "ProductPrice": "10.00",
      "ProductPrice_2": null,
      "GastDesc_de": "Schwarze Gnocchi | Pesto | Gegrilltes Gemüse",
      "GastDesc_en": "Black Gnocchi | Pesto | Grilled Vegetables",
      "MenuName": "DINNER Vegi/Vegan_17:00-19:00",
      "allergene": {
        "gluten": "Glutenhaltiges Getreide",
        "schalenfruchte": "Schalenfrüchte und Schalenfruchterzeugnisse",
        "huhnerei": "Hühnerei und Hühnereierzeugnisse",
        "milch": "Milch und Milcherzeugnisse",
        "schwefel": "Schwefeldioxid und Sulfide"
      },
      "merkmale": {
        "vegan": "Vegan",
        "vegetarisch": "Vegetarisch"
      },
      "naehrstoffe": "",
      "zusatzstoffe": [
        {
          "de": "Farbstoff",
          "en": "Colouring Agent"
        },
        {
          "de": "Konservierungsstoff",
          "en": "Preservatives"
        }
      ],
      "PrintOrder": "12",
      "CO2Value": "719.00",
      "CO2Rating": "B",
      "CO2Perc": "100.00",
      "ClimateFriendly": null,
      "GastDesc": "Schwarze Gnocchi | Pesto | Gegrilltes Gemüse",
      "date_de": "10.12.2025"
    },
    {
      "id": "4857188",
      "outlet": "canteen",
      "date": "2025-12-11",
      "CalendarWeek": "50",
      "day": "Donnerstag",
      "mealtime": "Mittagessen",
      "IdentNr": "12025121198000",
      "itemId": "17549",
      "RecipeID": "5060",
      "ProductPrice": "11.00",
      "ProductPrice_2": null,
      "GastDesc_de": "Couscous | Ofen-Paprika | Kräuterfeta",
      "GastDesc_en": "Couscous | Oven peppers | Herb feta",
      "MenuName": "COUNTER 1.1 Bowls_",
      "allergene": {
        "gluten": "Glutenhaltiges Getreide",
        "schalenfruchte": "Schalenfrüchte und Schalenfruchterzeugnisse",
        "milch": "Milch und Milcherzeugnisse"
      },
      "merkmale": {
        "vegetarisch": "Vegetarisch"
      },
      "naehrstoffe": "",
      "zusatzstoffe": [
        {
          "de": "geschwärzt",
          "en": "Blacked Out"
        }
      ],
      "PrintOrder": "0",
      "CO2Value": "1488.00",
      "CO2Rating": "C",
      "CO2Perc": "100.00",
      "ClimateFriendly": null,
      "GastDesc": "Couscous | Ofen-Paprika | Kräuterfeta",
      "date_de": "11.12.2025"
    },
    {
      "id": "4857189",
      "outlet": "canteen",
      "date": "2025-12-11",
      "CalendarWeek": "50",
      "day": "Donnerstag",
      "mealtime": "Mittagessen",
      "IdentNr": "12025121198001",
      "itemId": "17550",
      "RecipeID": "5727",
      "ProductPrice": "12.00",
      "ProductPrice_2": null,
      "GastDesc_de": "Kalbsbolognese | Penne | Parmesan",
      "GastDesc_en": "Veal bolognese | Penne | Parmesan",
      "MenuName": "COUNTER 2.1 Meat",
      "allergene": {
        "gluten": "Glutenhaltiges Getreide",
        "schalenfruchte": "Schalenfrüchte und Schalenfruchterzeugnisse",
        "milch": "Milch und Milcherzeugnisse",
        "sellerie": "Sellerie und Sellerieerzeugnisse",
        "schwefel": "Schwefeldioxid und Sulfide"
      },
      "merkmale": "",
      "naehrstoffe": "",
      "zusatzstoffe": [
        {
          "de": "Konservierungsstoff",
          "en": "Preservatives"
        },
        {
          "de": "Alkohol",
          "en": "Alcohol"
        }
      ],
      "PrintOrder": "1",
      "CO2Value": "2748.00",
      "CO2Rating": "C",
      "CO2Perc": "100.00",
      "ClimateFriendly": null,
      "GastDesc": "Kalbsbolognese | Penne | Parmesan",
      "date_de": "11.12.2025"
    },
    {
      "id": "4857190",
      "outlet": "canteen",
      "date": "2025-12-11",
      "CalendarWeek": "50",
      "day": "Donnerstag",
      "mealtime": "Mittagessen",
      "IdentNr": "12025121198005",
      "itemId": "17554",
      "RecipeID": "2987",
      "ProductPrice": "9.50",
      "ProductPrice_2": null,
      "GastDesc_de": "Gemüsecurry | Kohlrabi | Romanesco*",
      "GastDesc_en": "Vegetable Curry | Cabbage | Romanesco *",
      "MenuName": "COUNTER 4.1 Vegi",
      "allergene": {
        "sellerie": "Sellerie und Sellerieerzeugnisse"
      },
      "merkmale": {
        "vegan": "Vegan",
        "vegetarisch": "Vegetarisch"
      },
      "naehrstoffe": "",
      "zusatzstoffe": [
        {
          "de": "Süßungsmittel",
          "en": "Sweetener"
        },
        {
          "de": "Phenylalaninquelle",
          "en": "Phenylalanine"
        },
        {
          "de": "Konservierungsstoff",
          "en": "Preservatives"
        }
      ],
      "PrintOrder": "5",
      "CO2Value": "638.00",
      "CO2Rating": "C",
      "CO2Perc": "100.00",
      "ClimateFriendly": null,
      "GastDesc": "Gemüsecurry | Kohlrabi | Romanesco*",
      "date_de": "11.12.2025"
    },
    {
      "id": "4872304",
      "outlet": "canteen",
      "date": "2025-12-13",
      "CalendarWeek": "50",
      "day": "Samstag",
      "mealtime": "Abendessen",
      "IdentNr": "12025121398014",
      "itemId": "17563",
      "RecipeID": "9000",
      "ProductPrice": "12.00",
      "ProductPrice_2": null,
      "GastDesc_de": "Currywurst | Fritten | Salat",
      "GastDesc_en": "Curry Sausage | Steakhouse Chips | Salad",
      "MenuName": "LUNCH Meat_",
      "allergene": {
        "huhnerei": "Hühnerei und Hühnereierzeugnisse",
        "sellerie": "Sellerie und Sellerieerzeugnisse",
        "senf": "Senf und Senferzeugnisse",
        "schwefel": "Schwefeldioxid und Sulfide"
      },
      "merkmale": "",
      "naehrstoffe": "",
      "zusatzstoffe": [
        {
          "de": "Süßungsmittel",
          "en": "Sweetener"
        },
        {
          "de": "Phosphat",
          "en": "Phosphate"
        },
        {
          "de": "Farbstoff",
          "en": "Colouring Agent"
        },
        {
          "de": "Antioxidationsmittel",
          "en": "Antioxidation"
        },
        {
          "de": "Konservierungsstoff",
          "en": "Preservatives"
        }
      ],
      "PrintOrder": "14",
      "CO2Value": "1002.00",
      "CO2Rating": "B",
      "CO2Perc": "100.00",
      "ClimateFriendly": null,
      "GastDesc": "Currywurst | Fritten | Salat",
      "date_de": "13.12.2025"
    },
    {
      "id": "4872306",
      "outlet": "canteen",
      "date": "2025-12-13",
      "CalendarWeek": "50",
      "day": "Samstag",
      "mealtime": "Abendessen",
      "IdentNr": "12025121398015",
      "itemId": "17564",
      "RecipeID": "5058",
      "ProductPrice": "10.00",
      "ProductPrice_2": null,
      "GastDesc_de": "Bulgur | Garam Masala | Hähnchen",
      "GastDesc_en": "Bulgur | Garam Masala | Roast Chicken",
      "MenuName": "LUNCH Fish_",
      "allergene": {
        "gluten": "Glutenhaltiges Getreide",
        "soja": "Soja und Sojaerzeugnisse",
        "sesam": "Sesamsamen und Sesamsamenerzeugnisse"
      },
      "merkmale": "",
      "naehrstoffe": "",
      "zusatzstoffe": [
        {
          "de": "Alkohol",
          "en": "Alcohol"
        }
      ],
      "PrintOrder": "15",
      "CO2Value": "864.00",
      "CO2Rating": "B",
      "CO2Perc": "100.00",
      "ClimateFriendly": null,
      "GastDesc": "Bulgur | Garam Masala | Hähnchen",
      "date_de": "13.12.2025"
    },
    {
      "id": "4872308",
      "outlet": "canteen",
      "date": "2025-12-13",
      "CalendarWeek": "50",
      "day": "Samstag",
      "mealtime": "Abendessen",
      "IdentNr": "12025121398016",
      "itemId": "17565",
      "RecipeID": "9081",
      "ProductPrice": "11.00",
      "ProductPrice_2": null,
      "GastDesc_de": "Planted.Chicken | Gnocchi | Champignons",
      "GastDesc_en": "Planted.Chicken | Gnocchi | Champignons",
      "MenuName": "LUNCH Vegi/Vegan_",
      "allergene": {
        "gluten": "Glutenhaltiges Getreide",
        "schwefel": "Schwefeldioxid und Sulfide"
      },
      "merkmale": {
        "vegan": "Vegan",
        "vegetarisch": "Vegetarisch"
      },
      "naehrstoffe": "",
      "zusatzstoffe": [
        {
          "de": "Alkohol",
          "en": "Alcohol"
        }
      ],
      "PrintOrder": "16",
      "CO2Value": "480.00",
      "CO2Rating": "A",
      "CO2Perc": "100.00",
      "ClimateFriendly": "1",
      "GastDesc": "Planted.Chicken | Gnocchi | Champignons",
      "date_de": "13.12.2025"
    },
    {
      "id": "4872310",
      "outlet": "canteen",
      "date": "2025-12-14",
      "CalendarWeek": "50",
      "day": "Sonntag",
      "mealtime": "Abendessen",
      "IdentNr": "12025121498018",
      "itemId": "17864",
      "RecipeID": "4490",
      "ProductPrice": "12.00",
      "ProductPrice_2": null,
      "GastDesc_de": "Hühnerfrikassee | Reis | Salat",
      "GastDesc_en": "Chicken Fricassee | Rice | Salad",
      "MenuName": "DINNER Meat _|",
      "allergene": {
        "gluten": "Glutenhaltiges Getreide",
        "milch": "Milch und Milcherzeugnisse",
        "sellerie": "Sellerie und Sellerieerzeugnisse",
        "senf": "Senf und Senferzeugnisse",
        "schwefel": "Schwefeldioxid und Sulfide"
      },
      "merkmale": "",
      "naehrstoffe": "",
      "zusatzstoffe": [
        {
          "de": "Konservierungsstoff",
          "en": "Preservatives"
        },
        {
          "de": "Alkohol",
          "en": "Alcohol"
        }
      ],
      "PrintOrder": "18",
      "CO2Value": "1323.00",
      "CO2Rating": "C",
      "CO2Perc": "100.00",
      "ClimateFriendly": null,
      "GastDesc": "Hühnerfrikassee | Reis | Salat",
      "date_de": "14.12.2025"
    },
    {
      "id": "4872311",
      "outlet": "canteen",
      "date": "2025-12-14",
      "CalendarWeek": "50",
      "day": "Sonntag",
      "mealtime": "Mittagessen",
      "IdentNr": "12025121498018",
      "itemId": "17864",
      "RecipeID": "4490",
      "ProductPrice": "12.00",
      "ProductPrice_2": null,
      "GastDesc_de": "Hühnerfrikassee | Reis | Salat",
      "GastDesc_en": "Chicken Fricassee | Rice | Salad",
      "MenuName": "DINNER Meat _|",
      "allergene": {
        "gluten": "Glutenhaltiges Getreide",
        "milch": "Milch und Milcherzeugnisse",
        "sellerie": "Sellerie und Sellerieerzeugnisse",
        "senf": "Senf und Senferzeugnisse",
        "schwefel": "Schwefeldioxid und Sulfide"
      },
      "merkmale": "",
      "naehrstoffe": "",
      "zusatzstoffe": [
        {
          "de": "Konservierungsstoff",
          "en": "Preservatives"
        },
        {
          "de": "Alkohol",
          "en": "Alcohol"
        }
      ],
      "PrintOrder": "18",
      "CO2Value": "1323.00",
      "CO2Rating": "C",
      "CO2Perc": "100.00",
      "ClimateFriendly": null,
      "GastDesc": "Hühnerfrikassee | Reis | Salat",
      "date_de": "14.12.2025"
    },
    {
      "id": "4872313",
      "outlet": "canteen",
      "date": "2025-12-14",
      "CalendarWeek": "50",
      "day": "Sonntag",
      "mealtime": "Abendessen",
      "IdentNr": "12025121498019",
      "itemId": "17865",
      "RecipeID": "6241",
      "ProductPrice": "12.00",
      "ProductPrice_2": null,
      "GastDesc_de": "Lachsfilet | Olivenölschaum | provenzalisches Gemüse",
      "GastDesc_en": "Salmon | Olive Oil foam | Provencal Vegetables",
      "MenuName": "DINNER Fish _|",
      "allergene": {
        "fisch": "Fisch und Fischerzeugnisse",
        "milch": "Milch und Milcherzeugnisse",
        "sellerie": "Sellerie und Sellerieerzeugnisse"
      },
      "merkmale": "",
      "naehrstoffe": "",
      "zusatzstoffe": null,
      "PrintOrder": "19",
      "CO2Value": "1252.00",
      "CO2Rating": "B",
      "CO2Perc": "100.00",
      "ClimateFriendly": null,
      "GastDesc": "Lachsfilet | Olivenölschaum | provenzalisches Gemüse",
      "date_de": "14.12.2025"
    },
    {
      "id": "4872314",
      "outlet": "canteen",
      "date": "2025-12-14",
      "CalendarWeek": "50",
      "day": "Sonntag",
      "mealtime": "Mittagessen",
      "IdentNr": "12025121498019",
      "itemId": "17865",
      "RecipeID": "6241",
      "ProductPrice": "12.00",
      "ProductPrice_2": null,
      "GastDesc_de": "Lachsfilet | Olivenölschaum | provenzalisches Gemüse",
      "GastDesc_en": "Salmon | Olive Oil foam | Provencal Vegetables",
      "MenuName": "DINNER Fish _|",
      "allergene": {
        "fisch": "Fisch und Fischerzeugnisse",
        "milch": "Milch und Milcherzeugnisse",
        "sellerie": "Sellerie und Sellerieerzeugnisse"
      },
      "merkmale": "",
      "naehrstoffe": "",
      "zusatzstoffe": null,
      "PrintOrder": "19",
      "CO2Value": "1252.00",
      "CO2Rating": "B",
      "CO2Perc": "100.00",
      "ClimateFriendly": null,
      "GastDesc": "Lachsfilet | Olivenölschaum | provenzalisches Gemüse",
      "date_de": "14.12.2025"
    },
    {
      "id": "4872316",
      "outlet": "canteen",
      "date": "2025-12-14",
      "CalendarWeek": "50",
      "day": "Sonntag",
      "mealtime": "Abendessen",
      "IdentNr": "12025121498020",
      "itemId": "17866",
      "RecipeID": "7851",
      "ProductPrice": "10.00",
      "ProductPrice_2": null,
      "GastDesc_de": "Edamame Falafel | Gelber Paprika-Hummus | Kräuterjoghurt",
      "GastDesc_en": "Edamame Falafel | Yellow Pepper Hummus | Herbs Yoghurt",
      "MenuName": "DINNER Vegi / Vegan_|",
      "allergene": {
        "gluten": "Glutenhaltiges Getreide",
        "schalenfruchte": "Schalenfrüchte und Schalenfruchterzeugnisse",
        "soja": "Soja und Sojaerzeugnisse",
        "sesam": "Sesamsamen und Sesamsamenerzeugnisse"
      },
      "merkmale": {
        "vegan": "Vegan",
        "vegetarisch": "Vegetarisch"
      },
      "naehrstoffe": "",
      "zusatzstoffe": null,
      "PrintOrder": "20",
      "CO2Value": "402.00",
      "CO2Rating": "A",
      "CO2Perc": "100.00",
      "ClimateFriendly": "1",
      "GastDesc": "Edamame Falafel | Gelber Paprika-Hummus | Kräuterjoghurt",
      "date_de": "14.12.2025"
    },
    {
      "id": "4872317",
      "outlet": "canteen",
      "date": "2025-12-14",
      "CalendarWeek": "50",
      "day": "Sonntag",
      "mealtime": "Mittagessen",
      "IdentNr": "12025121498020",
      "itemId": "17866",
      "RecipeID": "7851",
      "ProductPrice": "10.00",
      "ProductPrice_2": null,
      "GastDesc_de": "Edamame Falafel | Gelber Paprika-Hummus | Kräuterjoghurt",
      "GastDesc_en": "Edamame Falafel | Yellow Pepper Hummus | Herbs Yoghurt",
      "MenuName": "DINNER Vegi / Vegan_|",
      "allergene": {
        "gluten": "Glutenhaltiges Getreide",
        "schalenfruchte": "Schalenfrüchte und Schalenfruchterzeugnisse",
        "soja": "Soja und Sojaerzeugnisse",
        "sesam": "Sesamsamen und Sesamsamenerzeugnisse"
      },
      "merkmale": {
        "vegan": "Vegan",
        "vegetarisch": "Vegetarisch"
      },
      "naehrstoffe": "",
      "zusatzstoffe": null,
      "PrintOrder": "20",
      "CO2Value": "402.00",
      "CO2Rating": "A",
      "CO2Perc": "100.00",
      "ClimateFriendly": "1",
      "GastDesc": "Edamame Falafel | Gelber Paprika-Hummus | Kräuterjoghurt",
      "date_de": "14.12.2025"
    },
    {
      "id": "4888326",
      "outlet": "canteen",
      "date": "2025-12-15",
      "CalendarWeek": "51",
      "day": "Montag",
      "mealtime": "Mittagessen",
      "IdentNr": "12025121598000",
      "itemId": "17549",
      "RecipeID": "4472",
      "ProductPrice": "10.00",
      "ProductPrice_2": null,
      "GastDesc_de": "Bunter Quinoa | Süßkartoffel | Feldsalat",
      "GastDesc_en": "Assorted Quinoa | Sweet Potato | Lamb's lettuce",
      "MenuName": "COUNTER 1.1 Bowls_",
      "allergene": {
        "gluten": "Glutenhaltiges Getreide",
        "soja": "Soja und Sojaerzeugnisse",
        "sesam": "Sesamsamen und Sesamsamenerzeugnisse"
      },
      "merkmale": {
        "vegan": "Vegan",
        "vegetarisch": "Vegetarisch"
      },
      "naehrstoffe": "",
      "zusatzstoffe": null,
      "PrintOrder": "0",
      "CO2Value": "392.00",
      "CO2Rating": "A",
      "CO2Perc": "100.00",
      "ClimateFriendly": "1",
      "GastDesc": "Bunter Quinoa | Süßkartoffel | Feldsalat",
      "date_de": "15.12.2025"
    },
    {
      "id": "4888327",
      "outlet": "canteen",
      "date": "2025-12-15",
      "CalendarWeek": "51",
      "day": "Montag",
      "mealtime": "Mittagessen",
      "IdentNr": "12025121598001",
      "itemId": "17550",
      "RecipeID": "9083",
      "ProductPrice": "12.00",
      "ProductPrice_2": null,
      "GastDesc_de": "Putenbraten | Gnocchi | Buttergemüse",
      "GastDesc_en": "Turkey Roast | Gnocchi | Butter Vegetables",
      "MenuName": "COUNTER 2.1 Meat",
      "allergene": {
        "gluten": "Glutenhaltiges Getreide",
        "milch": "Milch und Milcherzeugnisse",
        "sellerie": "Sellerie und Sellerieerzeugnisse",
        "schwefel": "Schwefeldioxid und Sulfide"
      },
      "merkmale": "",
      "naehrstoffe": "",
      "zusatzstoffe": [
        {
          "de": "Alkohol",
          "en": "Alcohol"
        }
      ],
      "PrintOrder": "1",
      "CO2Value": "1702.00",
      "CO2Rating": "C",
      "CO2Perc": "100.00",
      "ClimateFriendly": null,
      "GastDesc": "Putenbraten | Gnocchi | Buttergemüse",
      "date_de": "15.12.2025"
    },
    {
      "id": "4888328",
      "outlet": "canteen",
      "date": "2025-12-15",
      "CalendarWeek": "51",
      "day": "Montag",
      "mealtime": "Mittagessen",
      "IdentNr": "12025121598003",
      "itemId": "17552",
      "RecipeID": "7316",
      "ProductPrice": "12.00",
      "ProductPrice_2": null,
      "GastDesc_de": "Forellenfilet | Petersilienkartoffel | Salat",
      "GastDesc_en": "Trout | Parsley Potatoes | Salad",
      "MenuName": "COUNTER 3.1 Fish",
      "allergene": {
        "fisch": "Fisch und Fischerzeugnisse",
        "milch": "Milch und Milcherzeugnisse",
        "schwefel": "Schwefeldioxid und Sulfide"
      },
      "merkmale": "",
      "naehrstoffe": "",
      "zusatzstoffe": null,
      "PrintOrder": "3",
      "CO2Value": "1522.00",
      "CO2Rating": "B",
      "CO2Perc": "100.00",
      "ClimateFriendly": null,
      "GastDesc": "Forellenfilet | Petersilienkartoffel | Salat",
      "date_de": "15.12.2025"
    },
    {
      "id": "4888329",
      "outlet": "canteen",
      "date": "2025-12-15",
      "CalendarWeek": "51",
      "day": "Montag",
      "mealtime": "Mittagessen",
      "IdentNr": "12025121598005",
      "itemId": "17554",
      "RecipeID": "9061",
      "ProductPrice": "9.50",
      "ProductPrice_2": null,
      "GastDesc_de": "Cappeletti | Kräuterschaum | Grana Padano",
      "GastDesc_en": "Cappeletti | Herb Sauce | Grana Padano",
      "MenuName": "COUNTER 4.1 Vegi",
      "allergene": {
        "gluten": "Glutenhaltiges Getreide",
        "huhnerei": "Hühnerei und Hühnereierzeugnisse",
        "milch": "Milch und Milcherzeugnisse",
        "sellerie": "Sellerie und Sellerieerzeugnisse"
      },
      "merkmale": {
        "vegetarisch": "Vegetarisch"
      },
      "naehrstoffe": "",
      "zusatzstoffe": null,
      "PrintOrder": "5",
      "CO2Value": "1228.00",
      "CO2Rating": "B",
      "CO2Perc": "100.00",
      "ClimateFriendly": null,
      "GastDesc": "Cappeletti | Kräuterschaum | Grana Padano",
      "date_de": "15.12.2025"
    },
    {
      "id": "4888330",
      "outlet": "canteen",
      "date": "2025-12-15",
      "CalendarWeek": "51",
      "day": "Montag",
      "mealtime": "Abendessen",
      "IdentNr": "12025121598009",
      "itemId": "17558",
      "RecipeID": "4472",
      "ProductPrice": "10.00",
      "ProductPrice_2": null,
      "GastDesc_de": "Bunter Quinoa | Süßkartoffel | Feldsalat",
      "GastDesc_en": "Assorted Quinoa | Sweet Potato | Lamb's lettuce",
      "MenuName": "DINNER BOWL_",
      "allergene": {
        "gluten": "Glutenhaltiges Getreide",
        "soja": "Soja und Sojaerzeugnisse",
        "sesam": "Sesamsamen und Sesamsamenerzeugnisse"
      },
      "merkmale": {
        "vegan": "Vegan",
        "vegetarisch": "Vegetarisch"
      },
      "naehrstoffe": "",
      "zusatzstoffe": null,
      "PrintOrder": "9",
      "CO2Value": "392.00",
      "CO2Rating": "A",
      "CO2Perc": "100.00",
      "ClimateFriendly": "1",
      "GastDesc": "Bunter Quinoa | Süßkartoffel | Feldsalat",
      "date_de": "15.12.2025"
    },
    {
      "id": "4888332",
      "outlet": "canteen",
      "date": "2025-12-15",
      "CalendarWeek": "51",
      "day": "Montag",
      "mealtime": "Abendessen",
      "IdentNr": "12025121598010",
      "itemId": "17559",
      "RecipeID": "8650",
      "ProductPrice": "12.00",
      "ProductPrice_2": null,
      "GastDesc_de": "Putenbraten | Gnocchi | Buttergemüse",
      "GastDesc_en": "Turkey Roast | Gnocchi | Butter Vegetables",
      "MenuName": "DINNER Meat_17:00-19:00",
      "allergene": {
        "gluten": "Glutenhaltiges Getreide",
        "milch": "Milch und Milcherzeugnisse",
        "sellerie": "Sellerie und Sellerieerzeugnisse",
        "schwefel": "Schwefeldioxid und Sulfide"
      },
      "merkmale": "",
      "naehrstoffe": "",
      "zusatzstoffe": [
        {
          "de": "Alkohol",
          "en": "Alcohol"
        }
      ],
      "PrintOrder": "10",
      "CO2Value": "1702.00",
      "CO2Rating": "C",
      "CO2Perc": "100.00",
      "ClimateFriendly": null,
      "GastDesc": "Putenbraten | Gnocchi | Buttergemüse",
      "date_de": "15.12.2025"
    },
    {
      "id": "4888334",
      "outlet": "canteen",
      "date": "2025-12-15",
      "CalendarWeek": "51",
      "day": "Montag",
      "mealtime": "Abendessen",
      "IdentNr": "12025121598012",
      "itemId": "17561",
      "RecipeID": "9061",
      "ProductPrice": "9.50",
      "ProductPrice_2": null,
      "GastDesc_de": "Cappeletti | Kräuterschaum | Grana Padano",
      "GastDesc_en": "Cappeletti | Herb Sauce | Grana Padano",
      "MenuName": "DINNER Vegi/Vegan_17:00-19:00",
      "allergene": {
        "gluten": "Glutenhaltiges Getreide",
        "huhnerei": "Hühnerei und Hühnereierzeugnisse",
        "milch": "Milch und Milcherzeugnisse",
        "sellerie": "Sellerie und Sellerieerzeugnisse"
      },
      "merkmale": {
        "vegetarisch": "Vegetarisch"
      },
      "naehrstoffe": "",
      "zusatzstoffe": null,
      "PrintOrder": "12",
      "CO2Value": "1228.00",
      "CO2Rating": "B",
      "CO2Perc": "100.00",
      "ClimateFriendly": null,
      "GastDesc": "Cappeletti | Kräuterschaum | Grana Padano",
      "date_de": "15.12.2025"
    },
    {
      "id": "4888336",
      "outlet": "canteen",
      "date": "2025-12-16",
      "CalendarWeek": "51",
      "day": "Dienstag",
      "mealtime": "Mittagessen",
      "IdentNr": "12025121698000",
      "itemId": "17549",
      "RecipeID": "8765",
      "ProductPrice": "11.00",
      "ProductPrice_2": null,
      "GastDesc_de": "Blumenkohlreis | Tahini Hähnchen | Oliven Joghurt",
      "GastDesc_en": "Cauliflower Rice | Tahini-Herb Chicken | Olive Yoghurt",
      "MenuName": "COUNTER 1.1 Bowls_",
      "allergene": {
        "milch": "Milch und Milcherzeugnisse",
        "sesam": "Sesamsamen und Sesamsamenerzeugnisse"
      },
      "merkmale": "",
      "naehrstoffe": "",
      "zusatzstoffe": null,
      "PrintOrder": "0",
      "CO2Value": "875.00",
      "CO2Rating": "B",
      "CO2Perc": "100.00",
      "ClimateFriendly": null,
      "GastDesc": "Blumenkohlreis | Tahini Hähnchen | Oliven Joghurt",
      "date_de": "16.12.2025"
    },
    {
      "id": "4888337",
      "outlet": "canteen",
      "date": "2025-12-16",
      "CalendarWeek": "51",
      "day": "Dienstag",
      "mealtime": "Mittagessen",
      "IdentNr": "12025121698001",
      "itemId": "17550",
      "RecipeID": "9083",
      "ProductPrice": "12.00",
      "ProductPrice_2": null,
      "GastDesc_de": "Putenbraten | Gnocchi | Buttergemüse",
      "GastDesc_en": "Turkey Roast | Gnocchi | Butter Vegetables",
      "MenuName": "COUNTER 2.1 Meat",
      "allergene": {
        "gluten": "Glutenhaltiges Getreide",
        "milch": "Milch und Milcherzeugnisse",
        "sellerie": "Sellerie und Sellerieerzeugnisse",
        "schwefel": "Schwefeldioxid und Sulfide"
      },
      "merkmale": "",
      "naehrstoffe": "",
      "zusatzstoffe": [
        {
          "de": "Alkohol",
          "en": "Alcohol"
        }
      ],
      "PrintOrder": "1",
      "CO2Value": "1702.00",
      "CO2Rating": "C",
      "CO2Perc": "100.00",
      "ClimateFriendly": null,
      "GastDesc": "Putenbraten | Gnocchi | Buttergemüse",
      "date_de": "16.12.2025"
    },
    {
      "id": "4888338",
      "outlet": "canteen",
      "date": "2025-12-16",
      "CalendarWeek": "51",
      "day": "Dienstag",
      "mealtime": "Mittagessen",
      "IdentNr": "12025121698003",
      "itemId": "17552",
      "RecipeID": "7316",
      "ProductPrice": "12.00",
      "ProductPrice_2": null,
      "GastDesc_de": "Forellenfilet | Petersilienkartoffel | Salat",
      "GastDesc_en": "Trout | Parsley Potatoes | Salad",
      "MenuName": "COUNTER 3.1 Fish",
      "allergene": {
        "fisch": "Fisch und Fischerzeugnisse",
        "milch": "Milch und Milcherzeugnisse",
        "schwefel": "Schwefeldioxid und Sulfide"
      },
      "merkmale": "",
      "naehrstoffe": "",
      "zusatzstoffe": null,
      "PrintOrder": "3",
      "CO2Value": "1522.00",
      "CO2Rating": "B",
      "CO2Perc": "100.00",
      "ClimateFriendly": null,
      "GastDesc": "Forellenfilet | Petersilienkartoffel | Salat",
      "date_de": "16.12.2025"
    },
    {
      "id": "4888339",
      "outlet": "canteen",
      "date": "2025-12-16",
      "CalendarWeek": "51",
      "day": "Dienstag",
      "mealtime": "Mittagessen",
      "IdentNr": "12025121698005",
      "itemId": "17554",
      "RecipeID": "8219",
      "ProductPrice": "9.50",
      "ProductPrice_2": null,
      "GastDesc_de": "BBQ-Sellerie | Coleslaw | Chilistampf",
      "GastDesc_en": "Barbecued Celery | Slaw | Chili-Infused Potato Purée",
      "MenuName": "COUNTER 4.1 Vegi",
      "allergene": {
        "gluten": "Glutenhaltiges Getreide",
        "sellerie": "Sellerie und Sellerieerzeugnisse",
        "senf": "Senf und Senferzeugnisse",
        "schwefel": "Schwefeldioxid und Sulfide"
      },
      "merkmale": {
        "vegan": "Vegan",
        "vegetarisch": "Vegetarisch"
      },
      "naehrstoffe": "",
      "zusatzstoffe": [
        {
          "de": "Antioxidationsmittel",
          "en": "Antioxidation"
        },
        {
          "de": "Alkohol",
          "en": "Alcohol"
        }
      ],
      "PrintOrder": "5",
      "CO2Value": "461.00",
      "CO2Rating": "A",
      "CO2Perc": "100.00",
      "ClimateFriendly": "1",
      "GastDesc": "BBQ-Sellerie | Coleslaw | Chilistampf",
      "date_de": "16.12.2025"
    },
    {
      "id": "4888340",
      "outlet": "canteen",
      "date": "2025-12-16",
      "CalendarWeek": "51",
      "day": "Dienstag",
      "mealtime": "Abendessen",
      "IdentNr": "12025121698009",
      "itemId": "17558",
      "RecipeID": "8765",
      "ProductPrice": "11.00",
      "ProductPrice_2": null,
      "GastDesc_de": "Blumenkohlreis | Tahini Hähnchen | Oliven Joghurt",
      "GastDesc_en": "Cauliflower Rice | Tahini-Herb Chicken | Olive Yoghurt",
      "MenuName": "DINNER BOWL_",
      "allergene": {
        "milch": "Milch und Milcherzeugnisse",
        "sesam": "Sesamsamen und Sesamsamenerzeugnisse"
      },
      "merkmale": "",
      "naehrstoffe": "",
      "zusatzstoffe": null,
      "PrintOrder": "9",
      "CO2Value": "875.00",
      "CO2Rating": "B",
      "CO2Perc": "100.00",
      "ClimateFriendly": null,
