{
  "daySelector": [
    {
      "date": "2025-11-24",
      "day": "Montag",
      "CalendarWeek": "48",
      "date_de": "24.11.2025"
    },
    {
      "date": "2025-11-25",
      "day": "Dienstag",
      "CalendarWeek": "48",
      "date_de": "25.11.2025"
    },
    {
      "date": "2025-11-26",
      "day": "Mittwoch",
      "CalendarWeek": "48",
      "date_de": "26.11.2025"
    },
    {
      "date": "2025-11-27",
      "day": "Donnerstag",
      "CalendarWeek": "48",
      "date_de": "27.11.2025"
    },
    {
      "date": "2025-11-28",
      "day": "Freitag",
      "CalendarWeek": "48",
      "date_de": "28.11.2025"
    },
    {
      "date": "2025-11-29",
      "day": "Samstag",
      "CalendarWeek": "48",
      "date_de": "29.11.2025"
    },
    {
      "date": "2025-11-30",
      "day": "Sonntag",
      "CalendarWeek": "48",
      "date_de": "30.11.2025"
    },
    {
      "date": "2025-12-01",
      "day": "Montag",
      "CalendarWeek": "48",
      "date_de": "01.12.2025"
    },
    {
      "date": "2025-12-02",
      "day": "Dienstag",
      "CalendarWeek": "48",
      "date_de": "02.12.2025"
    },
    {
      "date": "2025-12-03",
      "day": "Mittwoch",
      "CalendarWeek": "48",
      "date_de": "03.12.2025"
    },
    {
      "date": "2025-12-04",
      "day": "Donnerstag",
      "CalendarWeek": "48",
      "date_de": "04.12.2025"
    },
    {
      "date": "2025-12-05",
      "day": "Freitag",
      "CalendarWeek": "48",
      "date_de": "05.12.2025"
    },
    {
      "date": "2025-12-06",
      "day": "Samstag",
      "CalendarWeek": "48",
      "date_de": "06.12.2025"
    },
    {
      "date": "2025-12-07",
      "day": "Sonntag",
      "CalendarWeek": "48",
      "date_de": "07.12.2025"
    },
    {
      "date": "2025-12-08",
      "day": "Montag",
      "CalendarWeek": "48",
      "date_de": "08.12.2025"
    },
    {
      "date": "2025-12-09",
      "day": "Dienstag",
      "CalendarWeek": "48",
      "date_de": "09.12.2025"
    },
    {
      "date": "2025-12-10",
      "day": "Mittwoch",
      "CalendarWeek": "48",
      "date_de": "10.12.2025"
    },
    {
      "date": "2025-12-11",
      "day": "Donnerstag",
      "CalendarWeek": "48",
      "date_de": "11.12.2025"
    },
    {
      "date": "2025-12-12",
      "day": "Freitag",
      "CalendarWeek": "48",
      "date_de": "12.12.2025"
    }
  ],
  "data": [
    {
      "id": "4591306",
      "outlet": "cafe",
      "date": "2025-11-24",
      "CalendarWeek": "48",
      "day": "Montag",
      "mealtime": "Mittagessen",
      "IdentNr": "12025112498000",
      "itemId": "21060",
      "RecipeID": "9038",
      "ProductPrice": "3.00",
      "ProductPrice_2": null,
      "GastDesc_de": "Schoko-Zimt-Knoten | Vegan",
      "GastDesc_en": "Chocolate-cinnamon pastry knot | vegan",
      "MenuName": "CHOCOLATE",
      "allergene": {
        "gluten": "Glutenhaltiges Getreide",
        "schalenfruchte": "Schalenfrüchte und Schalenfruchterzeugnisse",
        "soja": "Soja und Sojaerzeugnisse",
        "sesam": "Sesamsamen und Sesamsamenerzeugnisse"
      },
      "merkmale": "",
      "naehrstoffe": "",
      "zusatzstoffe": null,
      "PrintOrder": "0",
      "CO2Value": null,
      "CO2Rating": null,
      "CO2Perc": null,
      "ClimateFriendly": null,
      "GastDesc": "Schoko-Zimt-Knoten | Vegan",
      "date_de": "24.11.2025"
    },
    {
      "id": "4591307",
      "outlet": "cafe",
      "date": "2025-11-24",
      "CalendarWeek": "48",
      "day": "Montag",
      "mealtime": "Mittagessen",
      "IdentNr": "12025112498002",
      "itemId": "21062",
      "RecipeID": "9052",
      "ProductPrice": "3.60",
      "ProductPrice_2": null,
      "GastDesc_de": "Baskischer Cheesecake mit Johannisbeer - Birnen Kompott",
      "GastDesc_en": "Basque-style Cheesecake with Blackcurrant - Pear   Compote",
      "MenuName": "FAVOURITES",
      "allergene": {
        "huhnerei": "Hühnerei und Hühnereierzeugnisse",
        "milch": "Milch und Milcherzeugnisse"
      },
      "merkmale": "",
      "naehrstoffe": "",
      "zusatzstoffe": [
        {
          "de": "Farbstoff",
          "en": "Colouring Agent"
        },
        {
          "de": "Alkohol",
          "en": "Alcohol"
        }
      ],
      "PrintOrder": "2",
      "CO2Value": null,
      "CO2Rating": null,
      "CO2Perc": null,
      "ClimateFriendly": null,
      "GastDesc": "Baskischer Cheesecake mit Johannisbeer - Birnen Kompott",
      "date_de": "24.11.2025"
    },
    {
      "id": "4591308",
      "outlet": "cafe",
      "date": "2025-11-24",
      "CalendarWeek": "48",
      "day": "Montag",
      "mealtime": "Mittagessen",
      "IdentNr": "12025112498003",
      "itemId": "21063",
      "RecipeID": "8211",
      "ProductPrice": "0.50",
      "ProductPrice_2": null,
      "GastDesc_de": "LES ARLETTES (Französische Blätterteigkekse) Vegan",
      "GastDesc_en": "LES ARLETTES  (French Puff Pastry Cookies) Vegan",
      "MenuName": "MINIS",
      "allergene": {
        "gluten": "Glutenhaltiges Getreide"
      },
      "merkmale": {
        "vegan": "Vegan",
        "vegetarisch": "Vegetarisch"
      },
      "naehrstoffe": "",
      "zusatzstoffe": [
        {
          "de": "Farbstoff",
          "en": "Colouring Agent"
        },
        {
          "de": "Alkohol",
          "en": "Alcohol"
        }
      ],
      "PrintOrder": "3",
      "CO2Value": null,
      "CO2Rating": null,
      "CO2Perc": null,
      "ClimateFriendly": null,
      "GastDesc": "LES ARLETTES (Französische Blätterteigkekse) Vegan",
      "date_de": "24.11.2025"
    },
    {
      "id": "4591309",
      "outlet": "cafe",
      "date": "2025-11-24",
      "CalendarWeek": "48",
      "day": "Montag",
      "mealtime": "Mittagessen",
      "IdentNr": "12025112498004",
      "itemId": "21058",
      "RecipeID": "9062",
      "ProductPrice": "3.10",
      "ProductPrice_2": null,
      "GastDesc_de": "Black Velvet Cake",
      "GastDesc_en": "Black Velvet Cake",
      "MenuName": "OPEN",
      "allergene": {
        "gluten": "Glutenhaltiges Getreide",
        "huhnerei": "Hühnerei und Hühnereierzeugnisse",
        "milch": "Milch und Milcherzeugnisse",
        "schwefel": "Schwefeldioxid und Sulfide"
      },
      "merkmale": "",
      "naehrstoffe": "",
      "zusatzstoffe": [
        {
          "de": "Farbstoff",
          "en": "Colouring Agent"
        },
        {
          "de": "Antioxidationsmittel",
          "en": "Antioxidation"
        },
        {
          "de": "Alkohol",
          "en": "Alcohol"
        }
      ],
      "PrintOrder": "4",
      "CO2Value": null,
      "CO2Rating": null,
      "CO2Perc": null,
      "ClimateFriendly": null,
      "GastDesc": "Black Velvet Cake",
      "date_de": "24.11.2025"
    },
    {
      "id": "4591310",
      "outlet": "cafe",
      "date": "2025-11-24",
      "CalendarWeek": "48",
      "day": "Montag",
      "mealtime": "Mittagessen",
      "IdentNr": "12025112498005",
      "itemId": "21064",
      "RecipeID": "8330",
      "ProductPrice": "1.50",
      "ProductPrice_2": null,
      "GastDesc_de": "Saftige Brownie-Bananen-Cookies | Zuckerfrei",
      "GastDesc_en": "Fudgy Brownie Banana Cookies | Sugar-Free",
      "MenuName": "PEOPLES CHOICE",
      "allergene": {
        "erdnuss": "Erdnüsse und Erdnusserzeugnisse"
      },
      "merkmale": {
        "ohne_zucker": "Ohne_Zucker",
        "vegan": "Vegan",
        "vegetarisch": "Vegetarisch"
      },
      "naehrstoffe": "",
      "zusatzstoffe": null,
      "PrintOrder": "5",
      "CO2Value": null,
      "CO2Rating": null,
      "CO2Perc": null,
      "ClimateFriendly": null,
      "GastDesc": "Saftige Brownie-Bananen-Cookies | Zuckerfrei",
      "date_de": "24.11.2025"
    },
    {
      "id": "4591311",
      "outlet": "cafe",
      "date": "2025-11-24",
      "CalendarWeek": "48",
      "day": "Montag",
      "mealtime": "Mittagessen",
      "IdentNr": "12025112498006",
      "itemId": "21061",
      "RecipeID": "9036",
      "ProductPrice": "2.70",
      "ProductPrice_2": null,
      "GastDesc_de": "Kürbis-Bananenbrot mit Walnüssen | Zuckerfrei",
      "GastDesc_en": "Pumpkin-banana bread with walnuts | Sugar-free",
      "MenuName": "SEASON",
      "allergene": {
        "gluten": "Glutenhaltiges Getreide",
        "schalenfruchte": "Schalenfrüchte und Schalenfruchterzeugnisse",
        "huhnerei": "Hühnerei und Hühnereierzeugnisse",
        "milch": "Milch und Milcherzeugnisse"
      },
      "merkmale": "",
      "naehrstoffe": "",
      "zusatzstoffe": null,
      "PrintOrder": "6",
      "CO2Value": null,
      "CO2Rating": null,
      "CO2Perc": null,
      "ClimateFriendly": null,
      "GastDesc": "Kürbis-Bananenbrot mit Walnüssen | Zuckerfrei",
      "date_de": "24.11.2025"
    },
    {
      "id": "4591312",
      "outlet": "cafe",
      "date": "2025-11-24",
      "CalendarWeek": "48",
      "day": "Montag",
      "mealtime": "Mittagessen",
      "IdentNr": "12025112498007",
      "itemId": "12776",
      "RecipeID": "9037",
      "ProductPrice": "2.50",
      "ProductPrice_2": null,
      "GastDesc_de": "Biscoff Karamell \"Apple Pie\" Cookie | Vegan",
      "GastDesc_en": "Biscoff Caramel \"Apple Pie\" Cookie | Vegan",
      "MenuName": "COOKIE",
      "allergene": {
        "gluten": "Glutenhaltiges Getreide"
      },
      "merkmale": "",
      "naehrstoffe": "",
      "zusatzstoffe": [
        {
          "de": "Farbstoff",
          "en": "Colouring Agent"
        },
        {
          "de": "Antioxidationsmittel",
          "en": "Antioxidation"
        },
        {
          "de": "Alkohol",
          "en": "Alcohol"
        }
      ],
      "PrintOrder": "7",
      "CO2Value": null,
      "CO2Rating": null,
      "CO2Perc": null,
      "ClimateFriendly": null,
      "GastDesc": "Biscoff Karamell \"Apple Pie\" Cookie | Vegan",
      "date_de": "24.11.2025"
    },
    {
      "id": "4591313",
      "outlet": "cafe",
      "date": "2025-11-24",
      "CalendarWeek": "48",
      "day": "Montag",
      "mealtime": "Mittagessen",
      "IdentNr": "12025112498009",
      "itemId": "12773",
      "RecipeID": "9043",
      "ProductPrice": "3.00",
      "ProductPrice_2": null,
      "GastDesc_de": "Schwedischer Mandelkuchen",
      "GastDesc_en": "Traditional Swedish almond cake",
      "MenuName": "CLASSICS",
      "allergene": {
        "schalenfruchte": "Schalenfrüchte und Schalenfruchterzeugnisse",
        "huhnerei": "Hühnerei und Hühnereierzeugnisse",
        "milch": "Milch und Milcherzeugnisse"
      },
      "merkmale": "",
      "naehrstoffe": "",
      "zusatzstoffe": null,
      "PrintOrder": "9",
      "CO2Value": null,
      "CO2Rating": null,
      "CO2Perc": null,
      "ClimateFriendly": null,
      "GastDesc": "Schwedischer Mandelkuchen",
      "date_de": "24.11.2025"
    },
    {
      "id": "4591314",
      "outlet": "cafe",
      "date": "2025-11-24",
      "CalendarWeek": "48",
      "day": "Montag",
      "mealtime": "Mittagessen",
      "IdentNr": "12025112498011",
      "itemId": "16256",
      "RecipeID": "8775",
      "ProductPrice": "1.50",
      "ProductPrice_2": null,
      "GastDesc_de": "Schwedische Haferkekse | Vegan",
      "GastDesc_en": "Swedish Style Oatmeal Cookies | Vegan",
      "MenuName": "VEGAN SPECIAL",
      "allergene": {
        "gluten": "Glutenhaltiges Getreide"
      },
      "merkmale": {
        "vegan": "Vegan",
        "vegetarisch": "Vegetarisch"
      },
      "naehrstoffe": "",
      "zusatzstoffe": [
        {
          "de": "Farbstoff",
          "en": "Colouring Agent"
        },
        {
          "de": "Antioxidationsmittel",
          "en": "Antioxidation"
        },
        {
          "de": "Alkohol",
          "en": "Alcohol"
        }
      ],
      "PrintOrder": "11",
      "CO2Value": null,
      "CO2Rating": null,
      "CO2Perc": null,
      "ClimateFriendly": null,
      "GastDesc": "Schwedische Haferkekse | Vegan",
      "date_de": "24.11.2025"
    },
    {
      "id": "4615653",
      "outlet": "cafe",
      "date": "2025-11-25",
      "CalendarWeek": "48",
      "day": "Dienstag",
      "mealtime": "Mittagessen",
      "IdentNr": "12025112598000",
      "itemId": "21060",
      "RecipeID": "9038",
      "ProductPrice": "3.00",
      "ProductPrice_2": null,
      "GastDesc_de": "Schoko-Zimt-Knoten | Vegan",
      "GastDesc_en": "Chocolate-cinnamon pastry knot | vegan",
      "MenuName": "CHOCOLATE",
      "allergene": {
        "gluten": "Glutenhaltiges Getreide",
        "schalenfruchte": "Schalenfrüchte und Schalenfruchterzeugnisse",
        "soja": "Soja und Sojaerzeugnisse",
        "sesam": "Sesamsamen und Sesamsamenerzeugnisse"
      },
      "merkmale": "",
      "naehrstoffe": "",
      "zusatzstoffe": null,
      "PrintOrder": "0",
      "CO2Value": null,
      "CO2Rating": null,
      "CO2Perc": null,
      "ClimateFriendly": null,
      "GastDesc": "Schoko-Zimt-Knoten | Vegan",
      "date_de": "25.11.2025"
    },
    {
      "id": "4615654",
      "outlet": "cafe",
      "date": "2025-11-25",
      "CalendarWeek": "48",
      "day": "Dienstag",
      "mealtime": "Mittagessen",
      "IdentNr": "12025112598002",
      "itemId": "21062",
      "RecipeID": "9052",
      "ProductPrice": "3.60",
      "ProductPrice_2": null,
      "GastDesc_de": "Baskischer Cheesecake mit Johannisbeer - Birnen Kompott",
      "GastDesc_en": "Basque-style Cheesecake with Blackcurrant - Pear   Compote",
      "MenuName": "FAVOURITES",
      "allergene": {
        "huhnerei": "Hühnerei und Hühnereierzeugnisse",
        "milch": "Milch und Milcherzeugnisse"
      },
      "merkmale": "",
      "naehrstoffe": "",
      "zusatzstoffe": [
        {
          "de": "Farbstoff",
          "en": "Colouring Agent"
        },
        {
          "de": "Alkohol",
          "en": "Alcohol"
        }
      ],
      "PrintOrder": "2",
      "CO2Value": null,
      "CO2Rating": null,
      "CO2Perc": null,
      "ClimateFriendly": null,
      "GastDesc": "Baskischer Cheesecake mit Johannisbeer - Birnen Kompott",
      "date_de": "25.11.2025"
    },
    {
      "id": "4615655",
      "outlet": "cafe",
      "date": "2025-11-25",
      "CalendarWeek": "48",
      "day": "Dienstag",
      "mealtime": "Mittagessen",
      "IdentNr": "12025112598003",
      "itemId": "21063",
      "RecipeID": "8211",
      "ProductPrice": "0.50",
      "ProductPrice_2": null,
      "GastDesc_de": "LES ARLETTES (Französische Blätterteigkekse) Vegan",
      "GastDesc_en": "LES ARLETTES  (French Puff Pastry Cookies) Vegan",
      "MenuName": "MINIS",
      "allergene": {
        "gluten": "Glutenhaltiges Getreide"
      },
      "merkmale": {
        "vegan": "Vegan",
        "vegetarisch": "Vegetarisch"
      },
      "naehrstoffe": "",
      "zusatzstoffe": [
        {
          "de": "Farbstoff",
          "en": "Colouring Agent"
        },
        {
          "de": "Alkohol",
          "en": "Alcohol"
        }
      ],
      "PrintOrder": "3",
      "CO2Value": null,
      "CO2Rating": null,
      "CO2Perc": null,
      "ClimateFriendly": null,
      "GastDesc": "LES ARLETTES (Französische Blätterteigkekse) Vegan",
      "date_de": "25.11.2025"
    },
    {
      "id": "4615656",
      "outlet": "cafe",
      "date": "2025-11-25",
      "CalendarWeek": "48",
      "day": "Dienstag",
      "mealtime": "Mittagessen",
      "IdentNr": "12025112598004",
      "itemId": "21058",
      "RecipeID": "9062",
      "ProductPrice": "3.10",
      "ProductPrice_2": null,
      "GastDesc_de": "Black Velvet Cake",
      "GastDesc_en": "Black Velvet Cake",
      "MenuName": "OPEN",
      "allergene": {
        "gluten": "Glutenhaltiges Getreide",
        "huhnerei": "Hühnerei und Hühnereierzeugnisse",
        "milch": "Milch und Milcherzeugnisse",
        "schwefel": "Schwefeldioxid und Sulfide"
      },
      "merkmale": "",
      "naehrstoffe": "",
      "zusatzstoffe": [
        {
          "de": "Farbstoff",
          "en": "Colouring Agent"
        },
        {
          "de": "Antioxidationsmittel",
          "en": "Antioxidation"
        },
        {
          "de": "Alkohol",
          "en": "Alcohol"
        }
      ],
      "PrintOrder": "4",
      "CO2Value": null,
      "CO2Rating": null,
      "CO2Perc": null,
      "ClimateFriendly": null,
      "GastDesc": "Black Velvet Cake",
      "date_de": "25.11.2025"
    },
    {
      "id": "4615657",
      "outlet": "cafe",
      "date": "2025-11-25",
      "CalendarWeek": "48",
      "day": "Dienstag",
      "mealtime": "Mittagessen",
      "IdentNr": "12025112598005",
      "itemId": "21064",
      "RecipeID": "8330",
      "ProductPrice": "1.50",
      "ProductPrice_2": null,
      "GastDesc_de": "Saftige Brownie-Bananen-Cookies | Zuckerfrei",
      "GastDesc_en": "Fudgy Brownie Banana Cookies | Sugar-Free",
      "MenuName": "PEOPLES CHOICE",
      "allergene": {
        "erdnuss": "Erdnüsse und Erdnusserzeugnisse"
      },
      "merkmale": {
        "ohne_zucker": "Ohne_Zucker",
        "vegan": "Vegan",
        "vegetarisch": "Vegetarisch"
      },
      "naehrstoffe": "",
      "zusatzstoffe": null,
      "PrintOrder": "5",
      "CO2Value": null,
      "CO2Rating": null,
      "CO2Perc": null,
      "ClimateFriendly": null,
      "GastDesc": "Saftige Brownie-Bananen-Cookies | Zuckerfrei",
      "date_de": "25.11.2025"
    },
    {
      "id": "4615658",
      "outlet": "cafe",
      "date": "2025-11-25",
      "CalendarWeek": "48",
      "day": "Dienstag",
      "mealtime": "Mittagessen",
      "IdentNr": "12025112598006",
      "itemId": "21061",
      "RecipeID": "9036",
      "ProductPrice": "2.70",
      "ProductPrice_2": null,
      "GastDesc_de": "Kürbis-Bananenbrot mit Walnüssen | Zuckerfrei",
      "GastDesc_en": "Pumpkin-banana bread with walnuts | Sugar-free",
      "MenuName": "SEASON",
      "allergene": {
        "gluten": "Glutenhaltiges Getreide",
        "schalenfruchte": "Schalenfrüchte und Schalenfruchterzeugnisse",
        "huhnerei": "Hühnerei und Hühnereierzeugnisse",
        "milch": "Milch und Milcherzeugnisse"
      },
      "merkmale": "",
      "naehrstoffe": "",
      "zusatzstoffe": null,
      "PrintOrder": "6",
      "CO2Value": null,
      "CO2Rating": null,
      "CO2Perc": null,
      "ClimateFriendly": null,
      "GastDesc": "Kürbis-Bananenbrot mit Walnüssen | Zuckerfrei",
      "date_de": "25.11.2025"
    },
    {
      "id": "4615659",
      "outlet": "cafe",
      "date": "2025-11-25",
      "CalendarWeek": "48",
      "day": "Dienstag",
      "mealtime": "Mittagessen",
      "IdentNr": "12025112598007",
      "itemId": "12776",
      "RecipeID": "9037",
      "ProductPrice": "2.50",
      "ProductPrice_2": null,
      "GastDesc_de": "Biscoff Karamell \"Apple Pie\" Cookie | Vegan",
      "GastDesc_en": "Biscoff Caramel \"Apple Pie\" Cookie | Vegan",
      "MenuName": "COOKIE",
      "allergene": {
        "gluten": "Glutenhaltiges Getreide"
      },
      "merkmale": "",
      "naehrstoffe": "",
      "zusatzstoffe": [
        {
          "de": "Farbstoff",
          "en": "Colouring Agent"
        },
        {
          "de": "Antioxidationsmittel",
          "en": "Antioxidation"
        },
        {
          "de": "Alkohol",
          "en": "Alcohol"
        }
      ],
      "PrintOrder": "7",
      "CO2Value": null,
      "CO2Rating": null,
      "CO2Perc": null,
      "ClimateFriendly": null,
      "GastDesc": "Biscoff Karamell \"Apple Pie\" Cookie | Vegan",
      "date_de": "25.11.2025"
    },
    {
      "id": "4615660",
      "outlet": "cafe",
      "date": "2025-11-25",
      "CalendarWeek": "48",
      "day": "Dienstag",
      "mealtime": "Mittagessen",
      "IdentNr": "12025112598009",
      "itemId": "12773",
      "RecipeID": "9043",
      "ProductPrice": "3.00",
      "ProductPrice_2": null,
      "GastDesc_de": "Schwedischer Mandelkuchen",
      "GastDesc_en": "Traditional Swedish almond cake",
      "MenuName": "CLASSICS",
      "allergene": {
        "schalenfruchte": "Schalenfrüchte und Schalenfruchterzeugnisse",
        "huhnerei": "Hühnerei und Hühnereierzeugnisse",
        "milch": "Milch und Milcherzeugnisse"
      },
      "merkmale": "",
      "naehrstoffe": "",
      "zusatzstoffe": null,
      "PrintOrder": "9",
      "CO2Value": null,
      "CO2Rating": null,
      "CO2Perc": null,
      "ClimateFriendly": null,
      "GastDesc": "Schwedischer Mandelkuchen",
      "date_de": "25.11.2025"
    },
    {
      "id": "4615661",
      "outlet": "cafe",
      "date": "2025-11-25",
      "CalendarWeek": "48",
      "day": "Dienstag",
      "mealtime": "Mittagessen",
      "IdentNr": "12025112598011",
      "itemId": "16256",
      "RecipeID": "8775",
      "ProductPrice": "1.50",
      "ProductPrice_2": null,
      "GastDesc_de": "Schwedische Haferkekse | Vegan",
      "GastDesc_en": "Swedish Style Oatmeal Cookies | Vegan",
      "MenuName": "VEGAN SPECIAL",
      "allergene": {
        "gluten": "Glutenhaltiges Getreide"
      },
      "merkmale": {
        "vegan": "Vegan",
        "vegetarisch": "Vegetarisch"
      },
      "naehrstoffe": "",
      "zusatzstoffe": [
        {
          "de": "Farbstoff",
          "en": "Colouring Agent"
        },
        {
          "de": "Antioxidationsmittel",
          "en": "Antioxidation"
        },
        {
          "de": "Alkohol",
          "en": "Alcohol"
        }
      ],
      "PrintOrder": "11",
      "CO2Value": null,
      "CO2Rating": null,
      "CO2Perc": null,
      "ClimateFriendly": null,
      "GastDesc": "Schwedische Haferkekse | Vegan",
      "date_de": "25.11.2025"
    },
    {
      "id": "4639667",
      "outlet": "cafe",
      "date": "2025-11-26",
      "CalendarWeek": "48",
      "day": "Mittwoch",
      "mealtime": "Mittagessen",
      "IdentNr": "12025112698000",
      "itemId": "21060",
      "RecipeID": "9038",
      "ProductPrice": "3.00",
      "ProductPrice_2": null,
      "GastDesc_de": "Schoko-Zimt-Knoten | Vegan",
      "GastDesc_en": "Chocolate-cinnamon pastry knot | vegan",
      "MenuName": "CHOCOLATE",
      "allergene": {
        "gluten": "Glutenhaltiges Getreide",
        "schalenfruchte": "Schalenfrüchte und Schalenfruchterzeugnisse",
        "soja": "Soja und Sojaerzeugnisse",
        "sesam": "Sesamsamen und Sesamsamenerzeugnisse"
      },
      "merkmale": "",
      "naehrstoffe": "",
      "zusatzstoffe": null,
      "PrintOrder": "0",
      "CO2Value": null,
      "CO2Rating": null,
      "CO2Perc": null,
      "ClimateFriendly": null,
      "GastDesc": "Schoko-Zimt-Knoten | Vegan",
      "date_de": "26.11.2025"
    },
    {
      "id": "4639668",
      "outlet": "cafe",
      "date": "2025-11-26",
      "CalendarWeek": "48",
      "day": "Mittwoch",
      "mealtime": "Mittagessen",
      "IdentNr": "12025112698002",
      "itemId": "21062",
      "RecipeID": "9052",
      "ProductPrice": "3.60",
      "ProductPrice_2": null,
      "GastDesc_de": "Baskischer Cheesecake mit Johannisbeer - Birnen Kompott",
      "GastDesc_en": "Basque-style Cheesecake with Blackcurrant - Pear   Compote",
      "MenuName": "FAVOURITES",
      "allergene": {
        "huhnerei": "Hühnerei und Hühnereierzeugnisse",
        "milch": "Milch und Milcherzeugnisse"
      },
      "merkmale": "",
      "naehrstoffe": "",
      "zusatzstoffe": [
        {
          "de": "Farbstoff",
          "en": "Colouring Agent"
        },
        {
          "de": "Alkohol",
          "en": "Alcohol"
        }
      ],
      "PrintOrder": "2",
      "CO2Value": null,
      "CO2Rating": null,
      "CO2Perc": null,
      "ClimateFriendly": null,
      "GastDesc": "Baskischer Cheesecake mit Johannisbeer - Birnen Kompott",
      "date_de": "26.11.2025"
    },
    {
      "id": "4639669",
      "outlet": "cafe",
      "date": "2025-11-26",
      "CalendarWeek": "48",
      "day": "Mittwoch",
      "mealtime": "Mittagessen",
      "IdentNr": "12025112698003",
      "itemId": "21063",
      "RecipeID": "8211",
      "ProductPrice": "0.50",
      "ProductPrice_2": null,
      "GastDesc_de": "LES ARLETTES (Französische Blätterteigkekse) Vegan",
      "GastDesc_en": "LES ARLETTES  (French Puff Pastry Cookies) Vegan",
      "MenuName": "MINIS",
      "allergene": {
        "gluten": "Glutenhaltiges Getreide"
      },
      "merkmale": {
        "vegan": "Vegan",
        "vegetarisch": "Vegetarisch"
      },
      "naehrstoffe": "",
      "zusatzstoffe": [
        {
          "de": "Farbstoff",
          "en": "Colouring Agent"
        },
        {
          "de": "Alkohol",
          "en": "Alcohol"
        }
      ],
      "PrintOrder": "3",
      "CO2Value": null,
      "CO2Rating": null,
      "CO2Perc": null,
      "ClimateFriendly": null,
      "GastDesc": "LES ARLETTES (Französische Blätterteigkekse) Vegan",
      "date_de": "26.11.2025"
    },
    {
      "id": "4639670",
      "outlet": "cafe",
      "date": "2025-11-26",
      "CalendarWeek": "48",
      "day": "Mittwoch",
      "mealtime": "Mittagessen",
      "IdentNr": "12025112698004",
      "itemId": "21058",
      "RecipeID": "9062",
      "ProductPrice": "3.10",
      "ProductPrice_2": null,
      "GastDesc_de": "Black Velvet Cake",
      "GastDesc_en": "Black Velvet Cake",
      "MenuName": "OPEN",
      "allergene": {
        "gluten": "Glutenhaltiges Getreide",
        "huhnerei": "Hühnerei und Hühnereierzeugnisse",
        "milch": "Milch und Milcherzeugnisse",
        "schwefel": "Schwefeldioxid und Sulfide"
      },
      "merkmale": "",
      "naehrstoffe": "",
      "zusatzstoffe": [
        {
          "de": "Farbstoff",
          "en": "Colouring Agent"
        },
        {
          "de": "Antioxidationsmittel",
          "en": "Antioxidation"
        },
        {
          "de": "Alkohol",
          "en": "Alcohol"
        }
      ],
      "PrintOrder": "4",
      "CO2Value": null,
      "CO2Rating": null,
      "CO2Perc": null,
      "ClimateFriendly": null,
      "GastDesc": "Black Velvet Cake",
      "date_de": "26.11.2025"
    },
    {
      "id": "4639671",
      "outlet": "cafe",
      "date": "2025-11-26",
      "CalendarWeek": "48",
      "day": "Mittwoch",
      "mealtime": "Mittagessen",
      "IdentNr": "12025112698005",
      "itemId": "21064",
      "RecipeID": "8330",
      "ProductPrice": "1.50",
      "ProductPrice_2": null,
      "GastDesc_de": "Saftige Brownie-Bananen-Cookies | Zuckerfrei",
      "GastDesc_en": "Fudgy Brownie Banana Cookies | Sugar-Free",
      "MenuName": "PEOPLES CHOICE",
      "allergene": {
        "erdnuss": "Erdnüsse und Erdnusserzeugnisse"
      },
      "merkmale": {
        "ohne_zucker": "Ohne_Zucker",
        "vegan": "Vegan",
        "vegetarisch": "Vegetarisch"
      },
      "naehrstoffe": "",
      "zusatzstoffe": null,
      "PrintOrder": "5",
      "CO2Value": null,
      "CO2Rating": null,
      "CO2Perc": null,
      "ClimateFriendly": null,
      "GastDesc": "Saftige Brownie-Bananen-Cookies | Zuckerfrei",
      "date_de": "26.11.2025"
    },
    {
      "id": "4639672",
      "outlet": "cafe",
      "date": "2025-11-26",
      "CalendarWeek": "48",
      "day": "Mittwoch",
      "mealtime": "Mittagessen",
      "IdentNr": "12025112698006",
      "itemId": "21061",
      "RecipeID": "9036",
      "ProductPrice": "2.70",
      "ProductPrice_2": null,
      "GastDesc_de": "Kürbis-Bananenbrot mit Walnüssen | Zuckerfrei",
      "GastDesc_en": "Pumpkin-banana bread with walnuts | Sugar-free",
      "MenuName": "SEASON",
      "allergene": {
        "gluten": "Glutenhaltiges Getreide",
        "schalenfruchte": "Schalenfrüchte und Schalenfruchterzeugnisse",
        "huhnerei": "Hühnerei und Hühnereierzeugnisse",
        "milch": "Milch und Milcherzeugnisse"
      },
      "merkmale": "",
      "naehrstoffe": "",
      "zusatzstoffe": null,
      "PrintOrder": "6",
      "CO2Value": null,
      "CO2Rating": null,
      "CO2Perc": null,
      "ClimateFriendly": null,
      "GastDesc": "Kürbis-Bananenbrot mit Walnüssen | Zuckerfrei",
      "date_de": "26.11.2025"
    },
    {
      "id": "4639673",
      "outlet": "cafe",
      "date": "2025-11-26",
      "CalendarWeek": "48",
      "day": "Mittwoch",
      "mealtime": "Mittagessen",
      "IdentNr": "12025112698007",
      "itemId": "12776",
      "RecipeID": "9037",
      "ProductPrice": "2.50",
      "ProductPrice_2": null,
      "GastDesc_de": "Biscoff Karamell \"Apple Pie\" Cookie | Vegan",
      "GastDesc_en": "Biscoff Caramel \"Apple Pie\" Cookie | Vegan",
      "MenuName": "COOKIE",
      "allergene": {
        "gluten": "Glutenhaltiges Getreide"
      },
      "merkmale": "",
      "naehrstoffe": "",
      "zusatzstoffe": [
        {
          "de": "Farbstoff",
          "en": "Colouring Agent"
        },
        {
          "de": "Antioxidationsmittel",
          "en": "Antioxidation"
        },
        {
          "de": "Alkohol",
          "en": "Alcohol"
        }
      ],
      "PrintOrder": "7",
      "CO2Value": null,
      "CO2Rating": null,
      "CO2Perc": null,
      "ClimateFriendly": null,
      "GastDesc": "Biscoff Karamell \"Apple Pie\" Cookie | Vegan",
      "date_de": "26.11.2025"
    },
    {
      "id": "4639674",
      "outlet": "cafe",
      "date": "2025-11-26",
      "CalendarWeek": "48",
      "day": "Mittwoch",
      "mealtime": "Mittagessen",
      "IdentNr": "12025112698009",
      "itemId": "12773",
      "RecipeID": "9043",
      "ProductPrice": "3.00",
      "ProductPrice_2": null,
      "GastDesc_de": "Schwedischer Mandelkuchen",
      "GastDesc_en": "Traditional Swedish almond cake",
      "MenuName": "CLASSICS",
      "allergene": {
        "schalenfruchte": "Schalenfrüchte und Schalenfruchterzeugnisse",
        "huhnerei": "Hühnerei und Hühnereierzeugnisse",
        "milch": "Milch und Milcherzeugnisse"
      },
      "merkmale": "",
      "naehrstoffe": "",
      "zusatzstoffe": null,
      "PrintOrder": "9",
      "CO2Value": null,
      "CO2Rating": null,
      "CO2Perc": null,
      "ClimateFriendly": null,
      "GastDesc": "Schwedischer Mandelkuchen",
      "date_de": "26.11.2025"
    },
    {
      "id": "4639675",
      "outlet": "cafe",
      "date": "2025-11-26",
      "CalendarWeek": "48",
      "day": "Mittwoch",
      "mealtime": "Mittagessen",
      "IdentNr": "12025112698011",
      "itemId": "16256",
      "RecipeID": "8775",
      "ProductPrice": "1.50",
      "ProductPrice_2": null,
      "GastDesc_de": "Schwedische Haferkekse | Vegan",
      "GastDesc_en": "Swedish Style Oatmeal Cookies | Vegan",
      "MenuName": "VEGAN SPECIAL",
      "allergene": {
        "gluten": "Glutenhaltiges Getreide"
      },
      "merkmale": {
        "vegan": "Vegan",
        "vegetarisch": "Vegetarisch"
      },
      "naehrstoffe": "",
      "zusatzstoffe": [
        {
          "de": "Farbstoff",
          "en": "Colouring Agent"
        },
        {
          "de": "Antioxidationsmittel",
          "en": "Antioxidation"
        },
        {
          "de": "Alkohol",
          "en": "Alcohol"
        }
      ],
      "PrintOrder": "11",
      "CO2Value": null,
      "CO2Rating": null,
      "CO2Perc": null,
      "ClimateFriendly": null,
      "GastDesc": "Schwedische Haferkekse | Vegan",
      "date_de": "26.11.2025"
    },
    {
      "id": "4663436",
      "outlet": "cafe",
      "date": "2025-11-27",
      "CalendarWeek": "48",
      "day": "Donnerstag",
      "mealtime": "Mittagessen",
      "IdentNr": "12025112798000",
      "itemId": "21060",
      "RecipeID": "9038",
      "ProductPrice": "3.00",
      "ProductPrice_2": null,
      "GastDesc_de": "Schoko-Zimt-Knoten | Vegan",
      "GastDesc_en": "Chocolate-cinnamon pastry knot | vegan",
      "MenuName": "CHOCOLATE",
      "allergene": {
        "gluten": "Glutenhaltiges Getreide",
        "schalenfruchte": "Schalenfrüchte und Schalenfruchterzeugnisse",
        "soja": "Soja und Sojaerzeugnisse",
        "sesam": "Sesamsamen und Sesamsamenerzeugnisse"
      },
      "merkmale": "",
      "naehrstoffe": "",
      "zusatzstoffe": null,
      "PrintOrder": "0",
      "CO2Value": null,
      "CO2Rating": null,
      "CO2Perc": null,
      "ClimateFriendly": null,
      "GastDesc": "Schoko-Zimt-Knoten | Vegan",
      "date_de": "27.11.2025"
    },
    {
      "id": "4663437",
      "outlet": "cafe",
      "date": "2025-11-27",
      "CalendarWeek": "48",
      "day": "Donnerstag",
      "mealtime": "Mittagessen",
      "IdentNr": "12025112798002",
      "itemId": "21062",
      "RecipeID": "9052",
      "ProductPrice": "3.60",
      "ProductPrice_2": null,
      "GastDesc_de": "Baskischer Cheesecake mit Johannisbeer - Birnen Kompott",
      "GastDesc_en": "Basque-style Cheesecake with Blackcurrant - Pear   Compote",
      "MenuName": "FAVOURITES",
      "allergene": {
        "huhnerei": "Hühnerei und Hühnereierzeugnisse",
        "milch": "Milch und Milcherzeugnisse"
      },
      "merkmale": "",
      "naehrstoffe": "",
      "zusatzstoffe": [
        {
          "de": "Farbstoff",
          "en": "Colouring Agent"
        },
        {
          "de": "Alkohol",
          "en": "Alcohol"
        }
      ],
      "PrintOrder": "2",
      "CO2Value": null,
      "CO2Rating": null,
      "CO2Perc": null,
      "ClimateFriendly": null,
      "GastDesc": "Baskischer Cheesecake mit Johannisbeer - Birnen Kompott",
      "date_de": "27.11.2025"
    },
    {
      "id": "4663438",
      "outlet": "cafe",
      "date": "2025-11-27",
      "CalendarWeek": "48",
      "day": "Donnerstag",
      "mealtime": "Mittagessen",
      "IdentNr": "12025112798003",
      "itemId": "21063",
      "RecipeID": "8211",
      "ProductPrice": "0.50",
      "ProductPrice_2": null,
      "GastDesc_de": "LES ARLETTES (Französische Blätterteigkekse) Vegan",
      "GastDesc_en": "LES ARLETTES  (French Puff Pastry Cookies) Vegan",
      "MenuName": "MINIS",
      "allergene": {
        "gluten": "Glutenhaltiges Getreide"
      },
      "merkmale": {
        "vegan": "Vegan",
        "vegetarisch": "Vegetarisch"
      },
      "naehrstoffe": "",
      "zusatzstoffe": [
        {
          "de": "Farbstoff",
          "en": "Colouring Agent"
        },
        {
          "de": "Alkohol",
          "en": "Alcohol"
        }
      ],
      "PrintOrder": "3",
      "CO2Value": null,
      "CO2Rating": null,
      "CO2Perc": null,
      "ClimateFriendly": null,
      "GastDesc": "LES ARLETTES (Französische Blätterteigkekse) Vegan",
      "date_de": "27.11.2025"
    },
    {
      "id": "4663439",
      "outlet": "cafe",
      "date": "2025-11-27",
      "CalendarWeek": "48",
      "day": "Donnerstag",
      "mealtime": "Mittagessen",
      "IdentNr": "12025112798004",
      "itemId": "21058",
      "RecipeID": "9062",
      "ProductPrice": "3.10",
      "ProductPrice_2": null,
      "GastDesc_de": "Black Velvet Cake",
      "GastDesc_en": "Black Velvet Cake",
      "MenuName": "OPEN",
      "allergene": {
        "gluten": "Glutenhaltiges Getreide",
        "huhnerei": "Hühnerei und Hühnereierzeugnisse",
        "milch": "Milch und Milcherzeugnisse",
        "schwefel": "Schwefeldioxid und Sulfide"
      },
      "merkmale": "",
      "naehrstoffe": "",
      "zusatzstoffe": [
        {
          "de": "Farbstoff",
          "en": "Colouring Agent"
        },
        {
          "de": "Antioxidationsmittel",
          "en": "Antioxidation"
        },
        {
          "de": "Alkohol",
          "en": "Alcohol"
        }
      ],
      "PrintOrder": "4",
      "CO2Value": null,
      "CO2Rating": null,
      "CO2Perc": null,
      "ClimateFriendly": null,
      "GastDesc": "Black Velvet Cake",
      "date_de": "27.11.2025"
    },
    {
      "id": "4663440",
      "outlet": "cafe",
      "date": "2025-11-27",
      "CalendarWeek": "48",
      "day": "Donnerstag",
      "mealtime": "Mittagessen",
      "IdentNr": "12025112798005",
      "itemId": "21064",
      "RecipeID": "8330",
      "ProductPrice": "1.50",
      "ProductPrice_2": null,
      "GastDesc_de": "Saftige Brownie-Bananen-Cookies | Zuckerfrei",
      "GastDesc_en": "Fudgy Brownie Banana Cookies | Sugar-Free",
      "MenuName": "PEOPLES CHOICE",
      "allergene": {
        "erdnuss": "Erdnüsse und Erdnusserzeugnisse"
      },
      "merkmale": {
        "ohne_zucker": "Ohne_Zucker",
        "vegan": "Vegan",
        "vegetarisch": "Vegetarisch"
      },
      "naehrstoffe": "",
      "zusatzstoffe": null,
      "PrintOrder": "5",
      "CO2Value": null,
      "CO2Rating": null,
      "CO2Perc": null,
      "ClimateFriendly": null,
      "GastDesc": "Saftige Brownie-Bananen-Cookies | Zuckerfrei",
      "date_de": "27.11.2025"
    },
    {
      "id": "4663441",
      "outlet": "cafe",
      "date": "2025-11-27",
      "CalendarWeek": "48",
      "day": "Donnerstag",
      "mealtime": "Mittagessen",
      "IdentNr": "12025112798006",
      "itemId": "21061",
      "RecipeID": "9036",
      "ProductPrice": "2.70",
      "ProductPrice_2": null,
      "GastDesc_de": "Kürbis-Bananenbrot mit Walnüssen | Zuckerfrei",
      "GastDesc_en": "Pumpkin-banana bread with walnuts | Sugar-free",
      "MenuName": "SEASON",
      "allergene": {
        "gluten": "Glutenhaltiges Getreide",
        "schalenfruchte": "Schalenfrüchte und Schalenfruchterzeugnisse",
        "huhnerei": "Hühnerei und Hühnereierzeugnisse",
        "milch": "Milch und Milcherzeugnisse"
      },
      "merkmale": "",
      "naehrstoffe": "",
      "zusatzstoffe": null,
      "PrintOrder": "6",
      "CO2Value": null,
      "CO2Rating": null,
      "CO2Perc": null,
      "ClimateFriendly": null,
      "GastDesc": "Kürbis-Bananenbrot mit Walnüssen | Zuckerfrei",
      "date_de": "27.11.2025"
    },
    {
      "id": "4663442",
      "outlet": "cafe",
      "date": "2025-11-27",
      "CalendarWeek": "48",
      "day": "Donnerstag",
      "mealtime": "Mittagessen",
      "IdentNr": "12025112798007",
      "itemId": "12776",
      "RecipeID": "9037",
      "ProductPrice": "2.50",
      "ProductPrice_2": null,
      "GastDesc_de": "Biscoff Karamell \"Apple Pie\" Cookie | Vegan",
      "GastDesc_en": "Biscoff Caramel \"Apple Pie\" Cookie | Vegan",
      "MenuName": "COOKIE",
      "allergene": {
        "gluten": "Glutenhaltiges Getreide"
      },
      "merkmale": "",
      "naehrstoffe": "",
      "zusatzstoffe": [
        {
          "de": "Farbstoff",
          "en": "Colouring Agent"
        },
        {
          "de": "Antioxidationsmittel",
          "en": "Antioxidation"
        },
        {
          "de": "Alkohol",
          "en": "Alcohol"
        }
      ],
      "PrintOrder": "7",
      "CO2Value": null,
      "CO2Rating": null,
      "CO2Perc": null,
      "ClimateFriendly": null,
      "GastDesc": "Biscoff Karamell \"Apple Pie\" Cookie | Vegan",
      "date_de": "27.11.2025"
    },
    {
      "id": "4663443",
      "outlet": "cafe",
      "date": "2025-11-27",
      "CalendarWeek": "48",
      "day": "Donnerstag",
      "mealtime": "Mittagessen",
      "IdentNr": "12025112798009",
      "itemId": "12773",
      "RecipeID": "9043",
      "ProductPrice": "3.00",
      "ProductPrice_2": null,
      "GastDesc_de": "Schwedischer Mandelkuchen",
      "GastDesc_en": "Traditional Swedish almond cake",
      "MenuName": "CLASSICS",
      "allergene": {
        "schalenfruchte": "Schalenfrüchte und Schalenfruchterzeugnisse",
        "huhnerei": "Hühnerei und Hühnereierzeugnisse",
        "milch": "Milch und Milcherzeugnisse"
      },
      "merkmale": "",
      "naehrstoffe": "",
      "zusatzstoffe": null,
      "PrintOrder": "9",
      "CO2Value": null,
      "CO2Rating": null,
      "CO2Perc": null,
      "ClimateFriendly": null,
      "GastDesc": "Schwedischer Mandelkuchen",
      "date_de": "27.11.2025"
    },
    {
      "id": "4663444",
      "outlet": "cafe",
      "date": "2025-11-27",
      "CalendarWeek": "48",
      "day": "Donnerstag",
      "mealtime": "Mittagessen",
      "IdentNr": "12025112798011",
      "itemId": "16256",
      "RecipeID": "8775",
      "ProductPrice": "1.50",
      "ProductPrice_2": null,
      "GastDesc_de": "Schwedische Haferkekse | Vegan",
      "GastDesc_en": "Swedish Style Oatmeal Cookies | Vegan",
      "MenuName": "VEGAN SPECIAL",
      "allergene": {
        "gluten": "Glutenhaltiges Getreide"
      },
      "merkmale": {
        "vegan": "Vegan",
        "vegetarisch": "Vegetarisch"
      },
      "naehrstoffe": "",
      "zusatzstoffe": [
        {
          "de": "Farbstoff",
          "en": "Colouring Agent"
        },
        {
          "de": "Antioxidationsmittel",
          "en": "Antioxidation"
        },
        {
          "de": "Alkohol",
          "en": "Alcohol"
        }
      ],
      "PrintOrder": "11",
      "CO2Value": null,
      "CO2Rating": null,
      "CO2Perc": null,
      "ClimateFriendly": null,
      "GastDesc": "Schwedische Haferkekse | Vegan",
      "date_de": "27.11.2025"
    },
    {
      "id": "4688481",
      "outlet": "cafe",
      "date": "2025-11-28",
      "CalendarWeek": "48",
      "day": "Freitag",
      "mealtime": "Mittagessen",
      "IdentNr": "12025112898000",
      "itemId": "21060",
      "RecipeID": "9038",
      "ProductPrice": "3.00",
      "ProductPrice_2": null,
      "GastDesc_de": "Schoko-Zimt-Knoten | Vegan",
      "GastDesc_en": "Chocolate-cinnamon pastry knot | vegan",
      "MenuName": "CHOCOLATE",
      "allergene": {
        "gluten": "Glutenhaltiges Getreide",
        "schalenfruchte": "Schalenfrüchte und Schalenfruchterzeugnisse",
        "soja": "Soja und Sojaerzeugnisse",
        "sesam": "Sesamsamen und Sesamsamenerzeugnisse"
      },
      "merkmale": "",
      "naehrstoffe": "",
      "zusatzstoffe": null,
      "PrintOrder": "0",
      "CO2Value": null,
      "CO2Rating": null,
      "CO2Perc": null,
      "ClimateFriendly": null,
      "GastDesc": "Schoko-Zimt-Knoten | Vegan",
      "date_de": "28.11.2025"
    },
    {
      "id": "4688482",
      "outlet": "cafe",
      "date": "2025-11-28",
      "CalendarWeek": "48",
      "day": "Freitag",
      "mealtime": "Mittagessen",
      "IdentNr": "12025112898002",
      "itemId": "21062",
      "RecipeID": "9052",
      "ProductPrice": "3.60",
      "ProductPrice_2": null,
      "GastDesc_de": "Baskischer Cheesecake mit Johannisbeer - Birnen Kompott",
      "GastDesc_en": "Basque-style Cheesecake with Blackcurrant - Pear   Compote",
      "MenuName": "FAVOURITES",
      "allergene": {
        "huhnerei": "Hühnerei und Hühnereierzeugnisse",
        "milch": "Milch und Milcherzeugnisse"
      },
      "merkmale": "",
      "naehrstoffe": "",
      "zusatzstoffe": [
        {
          "de": "Farbstoff",
          "en": "Colouring Agent"
        },
        {
          "de": "Alkohol",
          "en": "Alcohol"
        }
      ],
      "PrintOrder": "2",
      "CO2Value": null,
      "CO2Rating": null,
      "CO2Perc": null,
      "ClimateFriendly": null,
      "GastDesc": "Baskischer Cheesecake mit Johannisbeer - Birnen Kompott",
      "date_de": "28.11.2025"
    },
    {
      "id": "4688483",
      "outlet": "cafe",
      "date": "2025-11-28",
      "CalendarWeek": "48",
      "day": "Freitag",
      "mealtime": "Mittagessen",
      "IdentNr": "12025112898003",
      "itemId": "21063",
      "RecipeID": "8211",
      "ProductPrice": "0.50",
      "ProductPrice_2": null,
      "GastDesc_de": "LES ARLETTES (Französische Blätterteigkekse) Vegan",
      "GastDesc_en": "LES ARLETTES  (French Puff Pastry Cookies) Vegan",
      "MenuName": "MINIS",
      "allergene": {
        "gluten": "Glutenhaltiges Getreide"
      },
      "merkmale": {
        "vegan": "Vegan",
        "vegetarisch": "Vegetarisch"
      },
      "naehrstoffe": "",
      "zusatzstoffe": [
        {
          "de": "Farbstoff",
          "en": "Colouring Agent"
        },
        {
          "de": "Alkohol",
          "en": "Alcohol"
        }
      ],
      "PrintOrder": "3",
      "CO2Value": null,
      "CO2Rating": null,
      "CO2Perc": null,
      "ClimateFriendly": null,
      "GastDesc": "LES ARLETTES (Französische Blätterteigkekse) Vegan",
      "date_de": "28.11.2025"
    },
    {
      "id": "4688484",
      "outlet": "cafe",
      "date": "2025-11-28",
      "CalendarWeek": "48",
      "day": "Freitag",
      "mealtime": "Mittagessen",
      "IdentNr": "12025112898004",
      "itemId": "21058",
      "RecipeID": "9062",
      "ProductPrice": "3.10",
      "ProductPrice_2": null,
      "GastDesc_de": "Black Velvet Cake",
      "GastDesc_en": "Black Velvet Cake",
      "MenuName": "OPEN",
      "allergene": {
        "gluten": "Glutenhaltiges Getreide",
        "huhnerei": "Hühnerei und Hühnereierzeugnisse",
        "milch": "Milch und Milcherzeugnisse",
        "schwefel": "Schwefeldioxid und Sulfide"
      },
      "merkmale": "",
      "naehrstoffe": "",
      "zusatzstoffe": [
        {
          "de": "Farbstoff",
          "en": "Colouring Agent"
        },
        {
          "de": "Antioxidationsmittel",
          "en": "Antioxidation"
        },
        {
          "de": "Alkohol",
          "en": "Alcohol"
        }
      ],
      "PrintOrder": "4",
      "CO2Value": null,
      "CO2Rating": null,
      "CO2Perc": null,
      "ClimateFriendly": null,
      "GastDesc": "Black Velvet Cake",
      "date_de": "28.11.2025"
    },
    {
      "id": "4688485",
      "outlet": "cafe",
      "date": "2025-11-28",
      "CalendarWeek": "48",
      "day": "Freitag",
      "mealtime": "Mittagessen",
      "IdentNr": "12025112898005",
      "itemId": "21064",
      "RecipeID": "8330",
      "ProductPrice": "1.50",
      "ProductPrice_2": null,
      "GastDesc_de": "Saftige Brownie-Bananen-Cookies | Zuckerfrei",
      "GastDesc_en": "Fudgy Brownie Banana Cookies | Sugar-Free",
      "MenuName": "PEOPLES CHOICE",
      "allergene": {
        "erdnuss": "Erdnüsse und Erdnusserzeugnisse"
      },
      "merkmale": {
        "ohne_zucker": "Ohne_Zucker",
        "vegan": "Vegan",
        "vegetarisch": "Vegetarisch"
      },
      "naehrstoffe": "",
      "zusatzstoffe": null,
      "PrintOrder": "5",
      "CO2Value": null,
      "CO2Rating": null,
      "CO2Perc": null,
      "ClimateFriendly": null,
      "GastDesc": "Saftige Brownie-Bananen-Cookies | Zuckerfrei",
      "date_de": "28.11.2025"
    },
    {
      "id": "4688486",
      "outlet": "cafe",
      "date": "2025-11-28",
      "CalendarWeek": "48",
      "day": "Freitag",
      "mealtime": "Mittagessen",
      "IdentNr": "12025112898006",
      "itemId": "21061",
      "RecipeID": "9036",
      "ProductPrice": "2.70",
      "ProductPrice_2": null,
      "GastDesc_de": "Kürbis-Bananenbrot mit Walnüssen | Zuckerfrei",
      "GastDesc_en": "Pumpkin-banana bread with walnuts | Sugar-free",
      "MenuName": "SEASON",
      "allergene": {
        "gluten": "Glutenhaltiges Getreide",
        "schalenfruchte": "Schalenfrüchte und Schalenfruchterzeugnisse",
        "huhnerei": "Hühnerei und Hühnereierzeugnisse",
        "milch": "Milch und Milcherzeugnisse"
      },
      "merkmale": "",
      "naehrstoffe": "",
      "zusatzstoffe": null,
      "PrintOrder": "6",
      "CO2Value": null,
      "CO2Rating": null,
      "CO2Perc": null,
      "ClimateFriendly": null,
      "GastDesc": "Kürbis-Bananenbrot mit Walnüssen | Zuckerfrei",
      "date_de": "28.11.2025"
    },
    {
      "id": "4688487",
      "outlet": "cafe",
      "date": "2025-11-28",
      "CalendarWeek": "48",
      "day": "Freitag",
      "mealtime": "Mittagessen",
      "IdentNr": "12025112898007",
      "itemId": "12776",
      "RecipeID": "9037",
      "ProductPrice": "2.50",
      "ProductPrice_2": null,
      "GastDesc_de": "Biscoff Karamell \"Apple Pie\" Cookie | Vegan",
      "GastDesc_en": "Biscoff Caramel \"Apple Pie\" Cookie | Vegan",
      "MenuName": "COOKIE",
      "allergene": {
        "gluten": "Glutenhaltiges Getreide"
      },
      "merkmale": "",
      "naehrstoffe": "",
      "zusatzstoffe": [
        {
          "de": "Farbstoff",
          "en": "Colouring Agent"
        },
        {
          "de": "Antioxidationsmittel",
          "en": "Antioxidation"
        },
        {
          "de": "Alkohol",
          "en": "Alcohol"
        }
      ],
      "PrintOrder": "7",
      "CO2Value": null,
      "CO2Rating": null,
      "CO2Perc": null,
      "ClimateFriendly": null,
      "GastDesc": "Biscoff Karamell \"Apple Pie\" Cookie | Vegan",
      "date_de": "28.11.2025"
    },
    {
      "id": "4688488",
      "outlet": "cafe",
      "date": "2025-11-28",
      "CalendarWeek": "48",
      "day": "Freitag",
      "mealtime": "Mittagessen",
      "IdentNr": "12025112898009",
      "itemId": "12773",
      "RecipeID": "9043",
      "ProductPrice": "3.00",
      "ProductPrice_2": null,
      "GastDesc_de": "Schwedischer Mandelkuchen",
      "GastDesc_en": "Traditional Swedish almond cake",
      "MenuName": "CLASSICS",
      "allergene": {
        "schalenfruchte": "Schalenfrüchte und Schalenfruchterzeugnisse",
        "huhnerei": "Hühnerei und Hühnereierzeugnisse",
        "milch": "Milch und Milcherzeugnisse"
      },
      "merkmale": "",
      "naehrstoffe": "",
      "zusatzstoffe": null,
      "PrintOrder": "9",
      "CO2Value": null,
      "CO2Rating": null,
      "CO2Perc": null,
      "ClimateFriendly": null,
      "GastDesc": "Schwedischer Mandelkuchen",
      "date_de": "28.11.2025"
    },
    {
      "id": "4688489",
      "outlet": "cafe",
      "date": "2025-11-28",
      "CalendarWeek": "48",
      "day": "Freitag",
      "mealtime": "Mittagessen",
      "IdentNr": "12025112898011",
      "itemId": "16256",
      "RecipeID": "8775",
      "ProductPrice": "1.50",
      "ProductPrice_2": null,
      "GastDesc_de": "Schwedische Haferkekse | Vegan",
      "GastDesc_en": "Swedish Style Oatmeal Cookies | Vegan",
      "MenuName": "VEGAN SPECIAL",
      "allergene": {
        "gluten": "Glutenhaltiges Getreide"
      },
      "merkmale": {
        "vegan": "Vegan",
        "vegetarisch": "Vegetarisch"
      },
      "naehrstoffe": "",
      "zusatzstoffe": [
        {
          "de": "Farbstoff",
          "en": "Colouring Agent"
        },
        {
          "de": "Antioxidationsmittel",
          "en": "Antioxidation"
        },
        {
          "de": "Alkohol",
          "en": "Alcohol"
        }
      ],
      "PrintOrder": "11",
      "CO2Value": null,
      "CO2Rating": null,
      "CO2Perc": null,
      "ClimateFriendly": null,
      "GastDesc": "Schwedische Haferkekse | Vegan",
      "date_de": "28.11.2025"
    },
    {
      "id": "4688490",
      "outlet": "cafe",
      "date": "2025-12-01",
      "CalendarWeek": "48",
      "day": "Montag",
      "mealtime": "Mittagessen",
      "IdentNr": "12025120198003",
      "itemId": "21063",
      "RecipeID": "8211",
      "ProductPrice": "0.50",
      "ProductPrice_2": null,
      "GastDesc_de": "LES ARLETTES (Französische Blätterteigkekse) Vegan",
      "GastDesc_en": "LES ARLETTES  (French Puff Pastry Cookies) Vegan",
      "MenuName": "MINIS",
      "allergene": {
        "gluten": "Glutenhaltiges Getreide"
      },
      "merkmale": {
        "vegan": "Vegan",
        "vegetarisch": "Vegetarisch"
      },
      "naehrstoffe": "",
      "zusatzstoffe": [
        {
          "de": "Farbstoff",
          "en": "Colouring Agent"
        },
        {
          "de": "Alkohol",
          "en": "Alcohol"
        }
      ],
      "PrintOrder": "3",
      "CO2Value": null,
      "CO2Rating": null,
      "CO2Perc": null,
      "ClimateFriendly": null,
      "GastDesc": "LES ARLETTES (Französische Blätterteigkekse) Vegan",
      "date_de": "01.12.2025"
    },
    {
      "id": "4688491",
      "outlet": "cafe",
      "date": "2025-12-01",
      "CalendarWeek": "48",
      "day": "Montag",
      "mealtime": "Mittagessen",
      "IdentNr": "12025120198004",
      "itemId": "21058",
      "RecipeID": "9066",
      "ProductPrice": "3.50",
      "ProductPrice_2": null,
      "GastDesc_de": "Operaschnitte",
      "GastDesc_en": "Opera cake",
      "MenuName": "OPEN",
      "allergene": null,
      "merkmale": "",
      "naehrstoffe": "",
      "zusatzstoffe": null,
      "PrintOrder": "4",
      "CO2Value": null,
      "CO2Rating": null,
      "CO2Perc": null,
      "ClimateFriendly": null,
      "GastDesc": "Operaschnitte",
      "date_de": "01.12.2025"
    },
    {
      "id": "4688492",
      "outlet": "cafe",
      "date": "2025-12-01",
      "CalendarWeek": "48",
      "day": "Montag",
      "mealtime": "Mittagessen",
      "IdentNr": "12025120198005",
      "itemId": "21064",
      "RecipeID": "8330",
      "ProductPrice": "1.50",
      "ProductPrice_2": null,
      "GastDesc_de": "Saftige Brownie-Bananen-Cookies | Zuckerfrei",
      "GastDesc_en": "Fudgy Brownie Banana Cookies | Sugar-Free",
      "MenuName": "PEOPLES CHOICE",
      "allergene": {
        "erdnuss": "Erdnüsse und Erdnusserzeugnisse"
      },
      "merkmale": {
        "ohne_zucker": "Ohne_Zucker",
        "vegan": "Vegan",
        "vegetarisch": "Vegetarisch"
      },
      "naehrstoffe": "",
      "zusatzstoffe": null,
      "PrintOrder": "5",
      "CO2Value": null,
      "CO2Rating": null,
      "CO2Perc": null,
      "ClimateFriendly": null,
      "GastDesc": "Saftige Brownie-Bananen-Cookies | Zuckerfrei",
      "date_de": "01.12.2025"
    },
    {
      "id": "4688493",
      "outlet": "cafe",
      "date": "2025-12-01",
      "CalendarWeek": "48",
      "day": "Montag",
      "mealtime": "Mittagessen",
      "IdentNr": "12025120198006",
      "itemId": "21061",
      "RecipeID": "8672",
      "ProductPrice": "2.60",
      "ProductPrice_2": null,
      "GastDesc_de": "Quarkstollen",
      "GastDesc_en": "curd stollen",
      "MenuName": "SEASON",
      "allergene": {
        "gluten": "Glutenhaltiges Getreide",
        "schalenfruchte": "Schalenfrüchte und Schalenfruchterzeugnisse",
        "huhnerei": "Hühnerei und Hühnereierzeugnisse",
        "milch": "Milch und Milcherzeugnisse"
      },
      "merkmale": "",
      "naehrstoffe": "",
      "zusatzstoffe": [
        {
          "de": "Farbstoff",
          "en": "Colouring Agent"
        },
        {
          "de": "Alkohol",
          "en": "Alcohol"
        }
      ],
      "PrintOrder": "6",
      "CO2Value": null,
      "CO2Rating": null,
      "CO2Perc": null,
      "ClimateFriendly": null,
      "GastDesc": "Quarkstollen",
      "date_de": "01.12.2025"
    },
    {
      "id": "4688494",
      "outlet": "cafe",
      "date": "2025-12-01",
      "CalendarWeek": "48",
      "day": "Montag",
      "mealtime": "Mittagessen",
      "IdentNr": "12025120198009",
      "itemId": "12773",
      "RecipeID": "9037",
      "ProductPrice": "2.50",
      "ProductPrice_2": null,
      "GastDesc_de": "Biscoff Karamell \"Apple Pie\" Cookie | Vegan",
      "GastDesc_en": "Biscoff Caramel \"Apple Pie\" Cookie | Vegan",
      "MenuName": "CLASSICS",
      "allergene": {
        "gluten": "Glutenhaltiges Getreide"
      },
      "merkmale": "",
      "naehrstoffe": "",
      "zusatzstoffe": [
        {
          "de": "Farbstoff",
          "en": "Colouring Agent"
        },
        {
          "de": "Antioxidationsmittel",
          "en": "Antioxidation"
        },
        {
          "de": "Alkohol",
          "en": "Alcohol"
        }
      ],
      "PrintOrder": "9",
      "CO2Value": null,
      "CO2Rating": null,
      "CO2Perc": null,
      "ClimateFriendly": null,
      "GastDesc": "Biscoff Karamell \"Apple Pie\" Cookie | Vegan",
      "date_de": "01.12.2025"
    },
    {
      "id": "4688495",
      "outlet": "cafe",
      "date": "2025-12-01",
      "CalendarWeek": "48",
      "day": "Montag",
      "mealtime": "Mittagessen",
      "IdentNr": "12025120198010",
      "itemId": "12778",
      "RecipeID": "7093",
      "ProductPrice": "1.70",
      "ProductPrice_2": null,
      "GastDesc_de": "Brownies Miniatur",
      "GastDesc_en": "Miniature Brownies",
      "MenuName": "BROWNIE, BROOKIE UND BLONDIE DAY",
      "allergene": {
        "gluten": "Glutenhaltiges Getreide",
        "schalenfruchte": "Schalenfrüchte und Schalenfruchterzeugnisse",
        "huhnerei": "Hühnerei und Hühnereierzeugnisse",
        "soja": "Soja und Sojaerzeugnisse",
        "milch": "Milch und Milcherzeugnisse"
      },
      "merkmale": "",
      "naehrstoffe": "",
      "zusatzstoffe": null,
      "PrintOrder": "10",
      "CO2Value": null,
      "CO2Rating": null,
      "CO2Perc": null,
      "ClimateFriendly": null,
      "GastDesc": "Brownies Miniatur",
      "date_de": "01.12.2025"
    },
    {
      "id": "4688496",
      "outlet": "cafe",
      "date": "2025-12-01",
      "CalendarWeek": "48",
      "day": "Montag",
      "mealtime": "Mittagessen",
      "IdentNr": "12025120198011",
      "itemId": "16256",
      "RecipeID": "8775",
      "ProductPrice": "1.50",
      "ProductPrice_2": null,
      "GastDesc_de": "Schwedische Haferkekse | Vegan",
      "GastDesc_en": "Swedish Style Oatmeal Cookies | Vegan",
      "MenuName": "VEGAN SPECIAL",
      "allergene": {
        "gluten": "Glutenhaltiges Getreide"
      },
      "merkmale": {
        "vegan": "Vegan",
        "vegetarisch": "Vegetarisch"
      },
      "naehrstoffe": "",
      "zusatzstoffe": [
        {
          "de": "Farbstoff",
          "en": "Colouring Agent"
        },
        {
          "de": "Antioxidationsmittel",
          "en": "Antioxidation"
        },
        {
          "de": "Alkohol",
          "en": "Alcohol"
        }
      ],
      "PrintOrder": "11",
      "CO2Value": null,
      "CO2Rating": null,
      "CO2Perc": null,
      "ClimateFriendly": null,
      "GastDesc": "Schwedische Haferkekse | Vegan",
      "date_de": "01.12.2025"
    },
    {
      "id": "4688497",
      "outlet": "cafe",
      "date": "2025-12-02",
      "CalendarWeek": "48",
      "day": "Dienstag",
      "mealtime": "Mittagessen",
      "IdentNr": "12025120298003",
      "itemId": "21063",
      "RecipeID": "8211",
      "ProductPrice": "0.50",
      "ProductPrice_2": null,
      "GastDesc_de": "LES ARLETTES (Französische Blätterteigkekse) Vegan",
      "GastDesc_en": "LES ARLETTES  (French Puff Pastry Cookies) Vegan",
      "MenuName": "MINIS",
      "allergene": {
        "gluten": "Glutenhaltiges Getreide"
      },
      "merkmale": {
        "vegan": "Vegan",
        "vegetarisch": "Vegetarisch"
      },
      "naehrstoffe": "",
      "zusatzstoffe": [
        {
          "de": "Farbstoff",
          "en": "Colouring Agent"
        },
        {
          "de": "Alkohol",
          "en": "Alcohol"
        }
      ],
      "PrintOrder": "3",
      "CO2Value": null,
      "CO2Rating": null,
      "CO2Perc": null,
      "ClimateFriendly": null,
      "GastDesc": "LES ARLETTES (Französische Blätterteigkekse) Vegan",
      "date_de": "02.12.2025"
    },
    {
      "id": "4688498",
      "outlet": "cafe",
      "date": "2025-12-02",
      "CalendarWeek": "48",
      "day": "Dienstag",
      "mealtime": "Mittagessen",
      "IdentNr": "12025120298004",
      "itemId": "21058",
      "RecipeID": "9066",
      "ProductPrice": "3.50",
      "ProductPrice_2": null,
      "GastDesc_de": "Operaschnitte",
      "GastDesc_en": "Opera cake",
      "MenuName": "OPEN",
      "allergene": null,
      "merkmale": "",
      "naehrstoffe": "",
      "zusatzstoffe": null,
      "PrintOrder": "4",
      "CO2Value": null,
      "CO2Rating": null,
      "CO2Perc": null,
      "ClimateFriendly": null,
      "GastDesc": "Operaschnitte",
      "date_de": "02.12.2025"
    },
    {
      "id": "4688499",
      "outlet": "cafe",
      "date": "2025-12-02",
      "CalendarWeek": "48",
      "day": "Dienstag",
      "mealtime": "Mittagessen",
      "IdentNr": "12025120298005",
      "itemId": "21064",
      "RecipeID": "8330",
      "ProductPrice": "1.50",
      "ProductPrice_2": null,
      "GastDesc_de": "Saftige Brownie-Bananen-Cookies | Zuckerfrei",
      "GastDesc_en": "Fudgy Brownie Banana Cookies | Sugar-Free",
      "MenuName": "PEOPLES CHOICE",
      "allergene": {
        "erdnuss": "Erdnüsse und Erdnusserzeugnisse"
      },
      "merkmale": {
        "ohne_zucker": "Ohne_Zucker",
        "vegan": "Vegan",
        "vegetarisch": "Vegetarisch"
      },
      "naehrstoffe": "",
      "zusatzstoffe": null,
      "PrintOrder": "5",
      "CO2Value": null,
      "CO2Rating": null,
      "CO2Perc": null,
      "ClimateFriendly": null,
      "GastDesc": "Saftige Brownie-Bananen-Cookies | Zuckerfrei",
      "date_de": "02.12.2025"
    },
    {
      "id": "4688500",
      "outlet": "cafe",
      "date": "2025-12-02",
      "CalendarWeek": "48",
      "day": "Dienstag",
      "mealtime": "Mittagessen",
      "IdentNr": "12025120298006",
      "itemId": "21061",
      "RecipeID": "8672",
      "ProductPrice": "2.60",
      "ProductPrice_2": null,
      "GastDesc_de": "Quarkstollen",
      "GastDesc_en": "curd stollen",
      "MenuName": "SEASON",
      "allergene": {
        "gluten": "Glutenhaltiges Getreide",
        "schalenfruchte": "Schalenfrüchte und Schalenfruchterzeugnisse",
        "huhnerei": "Hühnerei und Hühnereierzeugnisse",
        "milch": "Milch und Milcherzeugnisse"
      },
      "merkmale": "",
      "naehrstoffe": "",
      "zusatzstoffe": [
        {
          "de": "Farbstoff",
          "en": "Colouring Agent"
        },
        {
          "de": "Alkohol",
          "en": "Alcohol"
        }
      ],
      "PrintOrder": "6",
      "CO2Value": null,
      "CO2Rating": null,
      "CO2Perc": null,
      "ClimateFriendly": null,
      "GastDesc": "Quarkstollen",
      "date_de": "02.12.2025"
    },
    {
      "id": "4688501",
      "outlet": "cafe",
      "date": "2025-12-02",
      "CalendarWeek": "48",
      "day": "Dienstag",
      "mealtime": "Mittagessen",
      "IdentNr": "12025120298009",
      "itemId": "12773",
      "RecipeID": "9037",
      "ProductPrice": "2.50",
      "ProductPrice_2": null,
      "GastDesc_de": "Biscoff Karamell \"Apple Pie\" Cookie | Vegan",
      "GastDesc_en": "Biscoff Caramel \"Apple Pie\" Cookie | Vegan",
      "MenuName": "CLASSICS",
      "allergene": {
        "gluten": "Glutenhaltiges Getreide"
      },
      "merkmale": "",
      "naehrstoffe": "",
      "zusatzstoffe": [
        {
          "de": "Farbstoff",
          "en": "Colouring Agent"
        },
        {
          "de": "Antioxidationsmittel",
          "en": "Antioxidation"
        },
        {
          "de": "Alkohol",
          "en": "Alcohol"
        }
      ],
      "PrintOrder": "9",
      "CO2Value": null,
      "CO2Rating": null,
      "CO2Perc": null,
      "ClimateFriendly": null,
      "GastDesc": "Biscoff Karamell \"Apple Pie\" Cookie | Vegan",
      "date_de": "02.12.2025"
    },
    {
      "id": "4688502",
      "outlet": "cafe",
      "date": "2025-12-02",
      "CalendarWeek": "48",
      "day": "Dienstag",
      "mealtime": "Mittagessen",
      "IdentNr": "12025120298010",
      "itemId": "12778",
      "RecipeID": "7093",
      "ProductPrice": "1.70",
      "ProductPrice_2": null,
      "GastDesc_de": "Brownies Miniatur",
      "GastDesc_en": "Miniature Brownies",
      "MenuName": "BROWNIE, BROOKIE UND BLONDIE DAY",
      "allergene": {
        "gluten": "Glutenhaltiges Getreide",
        "schalenfruchte": "Schalenfrüchte und Schalenfruchterzeugnisse",
        "huhnerei": "Hühnerei und Hühnereierzeugnisse",
        "soja": "Soja und Sojaerzeugnisse",
        "milch": "Milch und Milcherzeugnisse"
      },
      "merkmale": "",
      "naehrstoffe": "",
      "zusatzstoffe": null,
      "PrintOrder": "10",
      "CO2Value": null,
      "CO2Rating": null,
      "CO2Perc": null,
      "ClimateFriendly": null,
      "GastDesc": "Brownies Miniatur",
      "date_de": "02.12.2025"
    },
    {
      "id": "4688503",
      "outlet": "cafe",
      "date": "2025-12-02",
      "CalendarWeek": "48",
      "day": "Dienstag",
      "mealtime": "Mittagessen",
      "IdentNr": "12025120298011",
      "itemId": "16256",
      "RecipeID": "8775",
      "ProductPrice": "1.50",
      "ProductPrice_2": null,
      "GastDesc_de": "Schwedische Haferkekse | Vegan",
      "GastDesc_en": "Swedish Style Oatmeal Cookies | Vegan",
      "MenuName": "VEGAN SPECIAL",
      "allergene": {
        "gluten": "Glutenhaltiges Getreide"
      },
      "merkmale": {
        "vegan": "Vegan",
        "vegetarisch": "Vegetarisch"
      },
      "naehrstoffe": "",
      "zusatzstoffe": [
        {
          "de": "Farbstoff",
          "en": "Colouring Agent"
        },
        {
          "de": "Antioxidationsmittel",
          "en": "Antioxidation"
        },
        {
          "de": "Alkohol",
          "en": "Alcohol"
        }
      ],
      "PrintOrder": "11",
      "CO2Value": null,
      "CO2Rating": null,
      "CO2Perc": null,
      "ClimateFriendly": null,
      "GastDesc": "Schwedische Haferkekse | Vegan",
      "date_de": "02.12.2025"
    },
    {
      "id": "4688504",
      "outlet": "cafe",
      "date": "2025-12-03",
      "CalendarWeek": "48",
      "day": "Mittwoch",
      "mealtime": "Mittagessen",
      "IdentNr": "12025120398003",
      "itemId": "21063",
      "RecipeID": "8211",
      "ProductPrice": "0.50",
      "ProductPrice_2": null,
      "GastDesc_de": "LES ARLETTES (Französische Blätterteigkekse) Vegan",
      "GastDesc_en": "LES ARLETTES  (French Puff Pastry Cookies) Vegan",
      "MenuName": "MINIS",
      "allergene": {
        "gluten": "Glutenhaltiges Getreide"
      },
      "merkmale": {
        "vegan": "Vegan",
        "vegetarisch": "Vegetarisch"
      },
      "naehrstoffe": "",
      "zusatzstoffe": [
        {
          "de": "Farbstoff",
          "en": "Colouring Agent"
        },
        {
          "de": "Alkohol",
          "en": "Alcohol"
        }
      ],
      "PrintOrder": "3",
      "CO2Value": null,
      "CO2Rating": null,
      "CO2Perc": null,
      "ClimateFriendly": null,
      "GastDesc": "LES ARLETTES (Französische Blätterteigkekse) Vegan",
      "date_de": "03.12.2025"
    },
    {
      "id": "4688505",
      "outlet": "cafe",
      "date": "2025-12-03",
      "CalendarWeek": "48",
      "day": "Mittwoch",
      "mealtime": "Mittagessen",
      "IdentNr": "12025120398004",
      "itemId": "21058",
      "RecipeID": "9066",
      "ProductPrice": "3.50",
      "ProductPrice_2": null,
      "GastDesc_de": "Operaschnitte",
      "GastDesc_en": "Opera cake",
      "MenuName": "OPEN",
      "allergene": null,
      "merkmale": "",
      "naehrstoffe": "",
      "zusatzstoffe": null,
      "PrintOrder": "4",
      "CO2Value": null,
      "CO2Rating": null,
      "CO2Perc": null,
      "ClimateFriendly": null,
      "GastDesc": "Operaschnitte",
      "date_de": "03.12.2025"
    },
    {
      "id": "4688506",
      "outlet": "cafe",
      "date": "2025-12-03",
      "CalendarWeek": "48",
      "day": "Mittwoch",
      "mealtime": "Mittagessen",
      "IdentNr": "12025120398005",
      "itemId": "21064",
      "RecipeID": "8330",
      "ProductPrice": "1.50",
      "ProductPrice_2": null,
      "GastDesc_de": "Saftige Brownie-Bananen-Cookies | Zuckerfrei",
      "GastDesc_en": "Fudgy Brownie Banana Cookies | Sugar-Free",
      "MenuName": "PEOPLES CHOICE",
      "allergene": {
        "erdnuss": "Erdnüsse und Erdnusserzeugnisse"
      },
      "merkmale": {
        "ohne_zucker": "Ohne_Zucker",
        "vegan": "Vegan",
        "vegetarisch": "Vegetarisch"
      },
      "naehrstoffe": "",
      "zusatzstoffe": null,
      "PrintOrder": "5",
      "CO2Value": null,
      "CO2Rating": null,
      "CO2Perc": null,
      "ClimateFriendly": null,
      "GastDesc": "Saftige Brownie-Bananen-Cookies | Zuckerfrei",
      "date_de": "03.12.2025"
    },
    {
      "id": "4688507",
      "outlet": "cafe",
      "date": "2025-12-03",
      "CalendarWeek": "48",
      "day": "Mittwoch",
      "mealtime": "Mittagessen",
      "IdentNr": "12025120398006",
      "itemId": "21061",
      "RecipeID": "8672",
      "ProductPrice": "2.60",
      "ProductPrice_2": null,
      "GastDesc_de": "Quarkstollen",
      "GastDesc_en": "curd stollen",
      "MenuName": "SEASON",
      "allergene": {
        "gluten": "Glutenhaltiges Getreide",
        "schalenfruchte": "Schalenfrüchte und Schalenfruchterzeugnisse",
        "huhnerei": "Hühnerei und Hühnereierzeugnisse",
        "milch": "Milch und Milcherzeugnisse"
      },
      "merkmale": "",
      "naehrstoffe": "",
      "zusatzstoffe": [
        {
          "de": "Farbstoff",
          "en": "Colouring Agent"
        },
        {
          "de": "Alkohol",
          "en": "Alcohol"
        }
      ],
      "PrintOrder": "6",
      "CO2Value": null,
      "CO2Rating": null,
      "CO2Perc": null,
      "ClimateFriendly": null,
      "GastDesc": "Quarkstollen",
      "date_de": "03.12.2025"
    },
    {
      "id": "4688508",
      "outlet": "cafe",
      "date": "2025-12-03",
      "CalendarWeek": "48",
      "day": "Mittwoch",
      "mealtime": "Mittagessen",
      "IdentNr": "12025120398009",
      "itemId": "12773",
      "RecipeID": "9037",
      "ProductPrice": "2.50",
      "ProductPrice_2": null,
      "GastDesc_de": "Biscoff Karamell \"Apple Pie\" Cookie | Vegan",
      "GastDesc_en": "Biscoff Caramel \"Apple Pie\" Cookie | Vegan",
      "MenuName": "CLASSICS",
      "allergene": {
        "gluten": "Glutenhaltiges Getreide"
      },
      "merkmale": "",
      "naehrstoffe": "",
      "zusatzstoffe": [
        {
          "de": "Farbstoff",
          "en": "Colouring Agent"
        },
        {
          "de": "Antioxidationsmittel",
          "en": "Antioxidation"
        },
        {
          "de": "Alkohol",
          "en": "Alcohol"
        }
      ],
      "PrintOrder": "9",
      "CO2Value": null,
      "CO2Rating": null,
      "CO2Perc": null,
      "ClimateFriendly": null,
      "GastDesc": "Biscoff Karamell \"Apple Pie\" Cookie | Vegan",
      "date_de": "03.12.2025"
    },
    {
      "id": "4688509",
      "outlet": "cafe",
      "date": "2025-12-03",
      "CalendarWeek": "48",
      "day": "Mittwoch",
      "mealtime": "Mittagessen",
      "IdentNr": "12025120398010",
      "itemId": "12778",
      "RecipeID": "7093",
      "ProductPrice": "1.70",
      "ProductPrice_2": null,
      "GastDesc_de": "Brownies Miniatur",
      "GastDesc_en": "Miniature Brownies",
      "MenuName": "BROWNIE, BROOKIE UND BLONDIE DAY",
      "allergene": {
        "gluten": "Glutenhaltiges Getreide",
        "schalenfruchte": "Schalenfrüchte und Schalenfruchterzeugnisse",
        "huhnerei": "Hühnerei und Hühnereierzeugnisse",
        "soja": "Soja und Sojaerzeugnisse",
        "milch": "Milch und Milcherzeugnisse"
      },
      "merkmale": "",
      "naehrstoffe": "",
      "zusatzstoffe": null,
      "PrintOrder": "10",
      "CO2Value": null,
      "CO2Rating": null,
      "CO2Perc": null,
      "ClimateFriendly": null,
      "GastDesc": "Brownies Miniatur",
      "date_de": "03.12.2025"
    },
    {
      "id": "4688510",
      "outlet": "cafe",
      "date": "2025-12-03",
      "CalendarWeek": "48",
      "day": "Mittwoch",
      "mealtime": "Mittagessen",
      "IdentNr": "12025120398011",
      "itemId": "16256",
      "RecipeID": "8775",
      "ProductPrice": "1.50",
      "ProductPrice_2": null,
      "GastDesc_de": "Schwedische Haferkekse | Vegan",
      "GastDesc_en": "Swedish Style Oatmeal Cookies | Vegan",
      "MenuName": "VEGAN SPECIAL",
      "allergene": {
        "gluten": "Glutenhaltiges Getreide"
      },
      "merkmale": {
        "vegan": "Vegan",
        "vegetarisch": "Vegetarisch"
      },
      "naehrstoffe": "",
      "zusatzstoffe": [
        {
          "de": "Farbstoff",
          "en": "Colouring Agent"
        },
        {
          "de": "Antioxidationsmittel",
          "en": "Antioxidation"
        },
        {
          "de": "Alkohol",
          "en": "Alcohol"
        }
      ],
      "PrintOrder": "11",
      "CO2Value": null,
      "CO2Rating": null,
      "CO2Perc": null,
      "ClimateFriendly": null,
      "GastDesc": "Schwedische Haferkekse | Vegan",
      "date_de": "03.12.2025"
    },
    {
      "id": "4688511",
      "outlet": "cafe",
      "date": "2025-12-04",
      "CalendarWeek": "48",
      "day": "Donnerstag",
      "mealtime": "Mittagessen",
      "IdentNr": "12025120498003",
      "itemId": "21063",
      "RecipeID": "8211",
      "ProductPrice": "0.50",
      "ProductPrice_2": null,
      "GastDesc_de": "LES ARLETTES (Französische Blätterteigkekse) Vegan",
      "GastDesc_en": "LES ARLETTES  (French Puff Pastry Cookies) Vegan",
      "MenuName": "MINIS",
      "allergene": {
        "gluten": "Glutenhaltiges Getreide"
      },
      "merkmale": {
        "vegan": "Vegan",
        "vegetarisch": "Vegetarisch"
      },
      "naehrstoffe": "",
      "zusatzstoffe": [
        {
          "de": "Farbstoff",
          "en": "Colouring Agent"
        },
        {
          "de": "Alkohol",
          "en": "Alcohol"
        }
      ],
      "PrintOrder": "3",
      "CO2Value": null,
      "CO2Rating": null,
      "CO2Perc": null,
      "ClimateFriendly": null,
      "GastDesc": "LES ARLETTES (Französische Blätterteigkekse) Vegan",
      "date_de": "04.12.2025"
    },
    {
      "id": "4688512",
      "outlet": "cafe",
      "date": "2025-12-04",
      "CalendarWeek": "48",
      "day": "Donnerstag",
      "mealtime": "Mittagessen",
      "IdentNr": "12025120498004",
      "itemId": "21058",
      "RecipeID": "9066",
      "ProductPrice": "3.50",
      "ProductPrice_2": null,
      "GastDesc_de": "Operaschnitte",
      "GastDesc_en": "Opera cake",
      "MenuName": "OPEN",
      "allergene": null,
      "merkmale": "",
      "naehrstoffe": "",
      "zusatzstoffe": null,
      "PrintOrder": "4",
      "CO2Value": null,
      "CO2Rating": null,
      "CO2Perc": null,
      "ClimateFriendly": null,
      "GastDesc": "Operaschnitte",
      "date_de": "04.12.2025"
    },
    {
      "id": "4688513",
      "outlet": "cafe",
      "date": "2025-12-04",
      "CalendarWeek": "48",
      "day": "Donnerstag",
      "mealtime": "Mittagessen",
      "IdentNr": "12025120498005",
      "itemId": "21064",
      "RecipeID": "8330",
      "ProductPrice": "1.50",
      "ProductPrice_2": null,
      "GastDesc_de": "Saftige Brownie-Bananen-Cookies | Zuckerfrei",
      "GastDesc_en": "Fudgy Brownie Banana Cookies | Sugar-Free",
      "MenuName": "PEOPLES CHOICE",
      "allergene": {
        "erdnuss": "Erdnüsse und Erdnusserzeugnisse"
      },
      "merkmale": {
        "ohne_zucker": "Ohne_Zucker",
        "vegan": "Vegan",
        "vegetarisch": "Vegetarisch"
      },
      "naehrstoffe": "",
      "zusatzstoffe": null,
      "PrintOrder": "5",
      "CO2Value": null,
      "CO2Rating": null,
      "CO2Perc": null,
      "ClimateFriendly": null,
      "GastDesc": "Saftige Brownie-Bananen-Cookies | Zuckerfrei",
      "date_de": "04.12.2025"
    },
    {
      "id": "4688514",
      "outlet": "cafe",
      "date": "2025-12-04",
      "CalendarWeek": "48",
      "day": "Donnerstag",
      "mealtime": "Mittagessen",
      "IdentNr": "12025120498006",
      "itemId": "21061",
      "RecipeID": "8672",
      "ProductPrice": "2.60",
      "ProductPrice_2": null,
      "GastDesc_de": "Quarkstollen",
      "GastDesc_en": "curd stollen",
      "MenuName": "SEASON",
      "allergene": {
        "gluten": "Glutenhaltiges Getreide",
        "schalenfruchte": "Schalenfrüchte und Schalenfruchterzeugnisse",
        "huhnerei": "Hühnerei und Hühnereierzeugnisse",
        "milch": "Milch und Milcherzeugnisse"
      },
      "merkmale": "",
      "naehrstoffe": "",
      "zusatzstoffe": [
        {
          "de": "Farbstoff",
          "en": "Colouring Agent"
        },
        {
          "de": "Alkohol",
          "en": "Alcohol"
        }
      ],
      "PrintOrder": "6",
      "CO2Value": null,
      "CO2Rating": null,
      "CO2Perc": null,
      "ClimateFriendly": null,
      "GastDesc": "Quarkstollen",
      "date_de": "04.12.2025"
    },
    {
      "id": "4688515",
      "outlet": "cafe",
      "date": "2025-12-04",
      "CalendarWeek": "48",
      "day": "Donnerstag",
      "mealtime": "Mittagessen",
      "IdentNr": "12025120498009",
      "itemId": "12773",
      "RecipeID": "9037",
      "ProductPrice": "2.50",
      "ProductPrice_2": null,
      "GastDesc_de": "Biscoff Karamell \"Apple Pie\" Cookie | Vegan",
      "GastDesc_en": "Biscoff Caramel \"Apple Pie\" Cookie | Vegan",
      "MenuName": "CLASSICS",
      "allergene": {
        "gluten": "Glutenhaltiges Getreide"
      },
      "merkmale": "",
      "naehrstoffe": "",
      "zusatzstoffe": [
        {
          "de": "Farbstoff",
          "en": "Colouring Agent"
        },
        {
          "de": "Antioxidationsmittel",
          "en": "Antioxidation"
        },
        {
          "de": "Alkohol",
          "en": "Alcohol"
        }
      ],
      "PrintOrder": "9",
      "CO2Value": null,
      "CO2Rating": null,
      "CO2Perc": null,
      "ClimateFriendly": null,
      "GastDesc": "Biscoff Karamell \"Apple Pie\" Cookie | Vegan",
      "date_de": "04.12.2025"
    },
    {
      "id": "4688516",
      "outlet": "cafe",
      "date": "2025-12-04",
      "CalendarWeek": "48",
      "day": "Donnerstag",
      "mealtime": "Mittagessen",
      "IdentNr": "12025120498010",
      "itemId": "12778",
      "RecipeID": "7093",
      "ProductPrice": "1.70",
      "ProductPrice_2": null,
      "GastDesc_de": "Brownies Miniatur",
      "GastDesc_en": "Miniature Brownies",
      "MenuName": "BROWNIE, BROOKIE UND BLONDIE DAY",
      "allergene": {
        "gluten": "Glutenhaltiges Getreide",
        "schalenfruchte": "Schalenfrüchte und Schalenfruchterzeugnisse",
        "huhnerei": "Hühnerei und Hühnereierzeugnisse",
        "soja": "Soja und Sojaerzeugnisse",
        "milch": "Milch und Milcherzeugnisse"
      },
      "merkmale": "",
      "naehrstoffe": "",
      "zusatzstoffe": null,
      "PrintOrder": "10",
      "CO2Value": null,
      "CO2Rating": null,
      "CO2Perc": null,
      "ClimateFriendly": null,
      "GastDesc": "Brownies Miniatur",
      "date_de": "04.12.2025"
    },
    {
      "id": "4688517",
      "outlet": "cafe",
      "date": "2025-12-04",
      "CalendarWeek": "48",
      "day": "Donnerstag",
      "mealtime": "Mittagessen",
      "IdentNr": "12025120498011",
      "itemId": "16256",
      "RecipeID": "8775",
      "ProductPrice": "1.50",
      "ProductPrice_2": null,
      "GastDesc_de": "Schwedische Haferkekse | Vegan",
      "GastDesc_en": "Swedish Style Oatmeal Cookies | Vegan",
      "MenuName": "VEGAN SPECIAL",
      "allergene": {
        "gluten": "Glutenhaltiges Getreide"
      },
      "merkmale": {
        "vegan": "Vegan",
        "vegetarisch": "Vegetarisch"
      },
      "naehrstoffe": "",
      "zusatzstoffe": [
        {
          "de": "Farbstoff",
          "en": "Colouring Agent"
        },
        {
          "de": "Antioxidationsmittel",
          "en": "Antioxidation"
        },
        {
          "de": "Alkohol",
          "en": "Alcohol"
        }
      ],
      "PrintOrder": "11",
      "CO2Value": null,
      "CO2Rating": null,
      "CO2Perc": null,
      "ClimateFriendly": null,
      "GastDesc": "Schwedische Haferkekse | Vegan",
      "date_de": "04.12.2025"
    },
    {
      "id": "4688518",
      "outlet": "cafe",
      "date": "2025-12-05",
      "CalendarWeek": "48",
      "day": "Freitag",
      "mealtime": "Mittagessen",
      "IdentNr": "12025120598003",
      "itemId": "21063",
      "RecipeID": "8211",
      "ProductPrice": "0.50",
      "ProductPrice_2": null,
      "GastDesc_de": "LES ARLETTES (Französische Blätterteigkekse) Vegan",
      "GastDesc_en": "LES ARLETTES  (French Puff Pastry Cookies) Vegan",
      "MenuName": "MINIS",
      "allergene": {
        "gluten": "Glutenhaltiges Getreide"
      },
      "merkmale": {
        "vegan": "Vegan",
        "vegetarisch": "Vegetarisch"
      },
      "naehrstoffe": "",
      "zusatzstoffe": [
        {
          "de": "Farbstoff",
          "en": "Colouring Agent"
        },
        {
          "de": "Alkohol",
          "en": "Alcohol"
        }
      ],
      "PrintOrder": "3",
      "CO2Value": null,
      "CO2Rating": null,
      "CO2Perc": null,
      "ClimateFriendly": null,
      "GastDesc": "LES ARLETTES (Französische Blätterteigkekse) Vegan",
      "date_de": "05.12.2025"
    },
    {
      "id": "4688519",
      "outlet": "cafe",
      "date": "2025-12-05",
      "CalendarWeek": "48",
      "day": "Freitag",
      "mealtime": "Mittagessen",
      "IdentNr": "12025120598004",
      "itemId": "21058",
      "RecipeID": "9066",
      "ProductPrice": "3.50",
      "ProductPrice_2": null,
      "GastDesc_de": "Operaschnitte",
      "GastDesc_en": "Opera cake",
      "MenuName": "OPEN",
      "allergene": null,
      "merkmale": "",
      "naehrstoffe": "",
      "zusatzstoffe": null,
      "PrintOrder": "4",
      "CO2Value": null,
      "CO2Rating": null,
      "CO2Perc": null,
      "ClimateFriendly": null,
      "GastDesc": "Operaschnitte",
      "date_de": "05.12.2025"
    },
    {
      "id": "4688520",
      "outlet": "cafe",
      "date": "2025-12-05",
      "CalendarWeek": "48",
      "day": "Freitag",
      "mealtime": "Mittagessen",
      "IdentNr": "12025120598005",
      "itemId": "21064",
      "RecipeID": "8330",
      "ProductPrice": "1.50",
      "ProductPrice_2": null,
      "GastDesc_de": "Saftige Brownie-Bananen-Cookies | Zuckerfrei",
      "GastDesc_en": "Fudgy Brownie Banana Cookies | Sugar-Free",
      "MenuName": "PEOPLES CHOICE",
      "allergene": {
        "erdnuss": "Erdnüsse und Erdnusserzeugnisse"
      },
      "merkmale": {
        "ohne_zucker": "Ohne_Zucker",
        "vegan": "Vegan",
        "vegetarisch": "Vegetarisch"
      },
      "naehrstoffe": "",
      "zusatzstoffe": null,
      "PrintOrder": "5",
      "CO2Value": null,
      "CO2Rating": null,
      "CO2Perc": null,
      "ClimateFriendly": null,
      "GastDesc": "Saftige Brownie-Bananen-Cookies | Zuckerfrei",
      "date_de": "05.12.2025"
    },
    {
      "id": "4688521",
      "outlet": "cafe",
      "date": "2025-12-05",
      "CalendarWeek": "48",
      "day": "Freitag",
      "mealtime": "Mittagessen",
      "IdentNr": "12025120598006",
      "itemId": "21061",
      "RecipeID": "8672",
      "ProductPrice": "2.60",
      "ProductPrice_2": null,
      "GastDesc_de": "Quarkstollen",
      "GastDesc_en": "curd stollen",
      "MenuName": "SEASON",
      "allergene": {
        "gluten": "Glutenhaltiges Getreide",
        "schalenfruchte": "Schalenfrüchte und Schalenfruchterzeugnisse",
        "huhnerei": "Hühnerei und Hühnereierzeugnisse",
        "milch": "Milch und Milcherzeugnisse"
      },
      "merkmale": "",
      "naehrstoffe": "",
      "zusatzstoffe": [
        {
          "de": "Farbstoff",
          "en": "Colouring Agent"
        },
        {
          "de": "Alkohol",
          "en": "Alcohol"
        }
      ],
      "PrintOrder": "6",
      "CO2Value": null,
      "CO2Rating": null,
      "CO2Perc": null,
      "ClimateFriendly": null,
      "GastDesc": "Quarkstollen",
      "date_de": "05.12.2025"
    },
    {
      "id": "4688522",
      "outlet": "cafe",
      "date": "2025-12-05",
      "CalendarWeek": "48",
      "day": "Freitag",
      "mealtime": "Mittagessen",
      "IdentNr": "12025120598009",
      "itemId": "12773",
      "RecipeID": "9037",
      "ProductPrice": "2.50",
      "ProductPrice_2": null,
      "GastDesc_de": "Biscoff Karamell \"Apple Pie\" Cookie | Vegan",
      "GastDesc_en": "Biscoff Caramel \"Apple Pie\" Cookie | Vegan",
      "MenuName": "CLASSICS",
      "allergene": {
        "gluten": "Glutenhaltiges Getreide"
      },
      "merkmale": "",
      "naehrstoffe": "",
      "zusatzstoffe": [
        {
          "de": "Farbstoff",
          "en": "Colouring Agent"
        },
        {
          "de": "Antioxidationsmittel",
          "en": "Antioxidation"
        },
        {
          "de": "Alkohol",
          "en": "Alcohol"
        }
      ],
      "PrintOrder": "9",
      "CO2Value": null,
      "CO2Rating": null,
      "CO2Perc": null,
      "ClimateFriendly": null,
      "GastDesc": "Biscoff Karamell \"Apple Pie\" Cookie | Vegan",
      "date_de": "05.12.2025"
    },
    {
      "id": "4688523",
      "outlet": "cafe",
      "date": "2025-12-05",
      "CalendarWeek": "48",
      "day": "Freitag",
      "mealtime": "Mittagessen",
      "IdentNr": "12025120598010",
      "itemId": "12778",
      "RecipeID": "7093",
      "ProductPrice": "1.70",
      "ProductPrice_2": null,
      "GastDesc_de": "Brownies Miniatur",
      "GastDesc_en": "Miniature Brownies",
      "MenuName": "BROWNIE, BROOKIE UND BLONDIE DAY",
      "allergene": {
        "gluten": "Glutenhaltiges Getreide",
        "schalenfruchte": "Schalenfrüchte und Schalenfruchterzeugnisse",
        "huhnerei": "Hühnerei und Hühnereierzeugnisse",
        "soja": "Soja und Sojaerzeugnisse",
        "milch": "Milch und Milcherzeugnisse"
      },
      "merkmale": "",
      "naehrstoffe": "",
      "zusatzstoffe": null,
      "PrintOrder": "10",
      "CO2Value": null,
      "CO2Rating": null,
      "CO2Perc": null,
      "ClimateFriendly": null,
      "GastDesc": "Brownies Miniatur",
      "date_de": "05.12.2025"
    },
    {
      "id": "4688524",
      "outlet": "cafe",
      "date": "2025-12-05",
      "CalendarWeek": "48",
      "day": "Freitag",
      "mealtime": "Mittagessen",
      "IdentNr": "12025120598011",
      "itemId": "16256",
      "RecipeID": "8775",
      "ProductPrice": "1.50",
      "ProductPrice_2": null,
      "GastDesc_de": "Schwedische Haferkekse | Vegan",
      "GastDesc_en": "Swedish Style Oatmeal Cookies | Vegan",
      "MenuName": "VEGAN SPECIAL",
      "allergene": {
        "gluten": "Glutenhaltiges Getreide"
      },
      "merkmale": {
        "vegan": "Vegan",
        "vegetarisch": "Vegetarisch"
      },
      "naehrstoffe": "",
      "zusatzstoffe": [
        {
          "de": "Farbstoff",
          "en": "Colouring Agent"
        },
        {
          "de": "Antioxidationsmittel",
          "en": "Antioxidation"
        },
        {
          "de": "Alkohol",
          "en": "Alcohol"
        }
      ],
      "PrintOrder": "11",
      "CO2Value": null,
      "CO2Rating": null,
      "CO2Perc": null,
      "ClimateFriendly": null,
      "GastDesc": "Schwedische Haferkekse | Vegan",
      "date_de": "05.12.2025"
    },
    {
      "id": "4591182",
      "outlet": "canteen",
      "date": "2025-11-24",
      "CalendarWeek": "48",
      "day": "Montag",
      "mealtime": "Mittagessen",
      "IdentNr": "12025112498000",
      "itemId": "17549",
      "RecipeID": "8384",
      "ProductPrice": "11.00",
      "ProductPrice_2": null,
      "GastDesc_de": "Blumenkohl-Falafel | Spicy-Curry-Hummus | Quinoa",
      "GastDesc_en": "Cauliflower falafel | Spicy curry hummus | Quinoa",
      "MenuName": "COUNTER 1.1 Bowls_",
      "allergene": {
        "gluten": "Glutenhaltiges Getreide",
        "schalenfruchte": "Schalenfrüchte und Schalenfruchterzeugnisse",
        "sellerie": "Sellerie und Sellerieerzeugnisse",
        "sesam": "Sesamsamen und Sesamsamenerzeugnisse"
      },
      "merkmale": {
        "vegan": "Vegan",
        "vegetarisch": "Vegetarisch"
      },
      "naehrstoffe": "",
      "zusatzstoffe": [
        {
          "de": "Antioxidationsmittel",
          "en": "Antioxidation"
        }
      ],
      "PrintOrder": "0",
      "CO2Value": "289.00",
      "CO2Rating": "A",
      "CO2Perc": "100.00",
      "ClimateFriendly": "1",
      "GastDesc": "Blumenkohl-Falafel | Spicy-Curry-Hummus | Quinoa",
      "date_de": "24.11.2025"
    },
    {
      "id": "4591183",
      "outlet": "canteen",
      "date": "2025-11-24",
      "CalendarWeek": "48",
      "day": "Montag",
      "mealtime": "Mittagessen",
      "IdentNr": "12025112498001",
      "itemId": "17550",
      "RecipeID": "8012",
      "ProductPrice": "12.00",
      "ProductPrice_2": null,
      "GastDesc_de": "Mac'n'Cheese | Salsiccia | Grünkohl",
      "GastDesc_en": "Mac'n'Cheese | Salsiccia | Kale",
      "MenuName": "COUNTER 2.1 Meat",
      "allergene": {
        "gluten": "Glutenhaltiges Getreide",
        "huhnerei": "Hühnerei und Hühnereierzeugnisse",
        "milch": "Milch und Milcherzeugnisse",
        "sellerie": "Sellerie und Sellerieerzeugnisse"
      },
      "merkmale": {
        "schwein": "Schwein"
      },
      "naehrstoffe": "",
      "zusatzstoffe": null,
      "PrintOrder": "1",
      "CO2Value": "1081.00",
      "CO2Rating": "B",
      "CO2Perc": "100.00",
      "ClimateFriendly": null,
      "GastDesc": "Mac'n'Cheese | Salsiccia | Grünkohl",
      "date_de": "24.11.2025"
    },
    {
      "id": "4591184",
      "outlet": "canteen",
      "date": "2025-11-24",
      "CalendarWeek": "48",
      "day": "Montag",
      "mealtime": "Mittagessen",
      "IdentNr": "12025112498003",
      "itemId": "17552",
      "RecipeID": "9065",
      "ProductPrice": "12.00",
      "ProductPrice_2": null,
      "GastDesc_de": "Schellfisch | Steckrübe | Szechuanpfeffer",
      "GastDesc_en": "Haddock | Turnip | Szechuan Pepper",
      "MenuName": "COUNTER 3.1 Fish",
      "allergene": {
        "fisch": "Fisch und Fischerzeugnisse",
        "milch": "Milch und Milcherzeugnisse",
        "sellerie": "Sellerie und Sellerieerzeugnisse",
        "schwefel": "Schwefeldioxid und Sulfide"
      },
      "merkmale": "",
      "naehrstoffe": "",
      "zusatzstoffe": [
        {
          "de": "Antioxidationsmittel",
          "en": "Antioxidation"
        },
        {
          "de": "Alkohol",
          "en": "Alcohol"
        }
      ],
      "PrintOrder": "3",
      "CO2Value": "1108.00",
      "CO2Rating": "B",
      "CO2Perc": "100.00",
      "ClimateFriendly": null,
      "GastDesc": "Schellfisch | Steckrübe | Szechuanpfeffer",
      "date_de": "24.11.2025"
    },
    {
      "id": "4591185",
      "outlet": "canteen",
      "date": "2025-11-24",
      "CalendarWeek": "48",
      "day": "Montag",
      "mealtime": "Mittagessen",
      "IdentNr": "12025112498005",
      "itemId": "17554",
      "RecipeID": "4026",
      "ProductPrice": "9.50",
      "ProductPrice_2": null,
      "GastDesc_de": "Rote-Bete-Gnocchi | Champignons | Mangold",
      "GastDesc_en": "Beetroot Gnocchi | Mushrooms | Chard",
      "MenuName": "COUNTER 4.1 Vegi",
      "allergene": {
        "gluten": "Glutenhaltiges Getreide",
        "milch": "Milch und Milcherzeugnisse",
        "sellerie": "Sellerie und Sellerieerzeugnisse"
      },
      "merkmale": {
        "vegan": "Vegan",
        "vegetarisch": "Vegetarisch"
      },
      "naehrstoffe": "",
      "zusatzstoffe": [
        {
          "de": "Farbstoff",
          "en": "Colouring Agent"
        }
      ],
      "PrintOrder": "5",
      "CO2Value": "579.00",
      "CO2Rating": "C",
      "CO2Perc": "100.00",
      "ClimateFriendly": null,
      "GastDesc": "Rote-Bete-Gnocchi | Champignons | Mangold",
      "date_de": "24.11.2025"
    },
    {
      "id": "4591186",
      "outlet": "canteen",
      "date": "2025-11-24",
      "CalendarWeek": "48",
      "day": "Montag",
      "mealtime": "Abendessen",
      "IdentNr": "12025112498009",
      "itemId": "17558",
      "RecipeID": "8384",
      "ProductPrice": "11.00",
      "ProductPrice_2": null,
      "GastDesc_de": "Blumenkohl-Falafel | Spicy Curry Hummus | Quinoa",
      "GastDesc_en": "Cauliflower falafel | spicy curry hummus | quinoa",
      "MenuName": "DINNER BOWL_",
      "allergene": {
        "gluten": "Glutenhaltiges Getreide",
        "schalenfruchte": "Schalenfrüchte und Schalenfruchterzeugnisse",
        "sellerie": "Sellerie und Sellerieerzeugnisse",
        "sesam": "Sesamsamen und Sesamsamenerzeugnisse"
      },
      "merkmale": {
        "vegan": "Vegan",
        "vegetarisch": "Vegetarisch"
      },
      "naehrstoffe": "",
      "zusatzstoffe": [
        {
          "de": "Antioxidationsmittel",
          "en": "Antioxidation"
        }
      ],
      "PrintOrder": "9",
      "CO2Value": "289.00",
      "CO2Rating": "A",
      "CO2Perc": "100.00",
      "ClimateFriendly": "1",
      "GastDesc": "Blumenkohl-Falafel | Spicy Curry Hummus | Quinoa",
      "date_de": "24.11.2025"
    },
    {
      "id": "4591188",
      "outlet": "canteen",
      "date": "2025-11-24",
      "CalendarWeek": "48",
      "day": "Montag",
      "mealtime": "Abendessen",
      "IdentNr": "12025112498010",
      "itemId": "17559",
      "RecipeID": "8012",
      "ProductPrice": "12.00",
      "ProductPrice_2": null,
      "GastDesc_de": "Mac'n'Cheese | Salsiccia | Grünkohl",
      "GastDesc_en": "Mac'n'Cheese | Salsiccia | Kale",
      "MenuName": "DINNER Meat_17:00-19:00",
      "allergene": {
        "gluten": "Glutenhaltiges Getreide",
        "huhnerei": "Hühnerei und Hühnereierzeugnisse",
        "milch": "Milch und Milcherzeugnisse",
        "sellerie": "Sellerie und Sellerieerzeugnisse"
      },
      "merkmale": {
        "schwein": "Schwein"
      },
      "naehrstoffe": "",
      "zusatzstoffe": null,
      "PrintOrder": "10",
      "CO2Value": "1081.00",
      "CO2Rating": "B",
      "CO2Perc": "100.00",
      "ClimateFriendly": null,
      "GastDesc": "Mac'n'Cheese | Salsiccia | Grünkohl",
      "date_de": "24.11.2025"
    },
    {
      "id": "4591190",
      "outlet": "canteen",
      "date": "2025-11-24",
      "CalendarWeek": "48",
      "day": "Montag",
      "mealtime": "Abendessen",
      "IdentNr": "12025112498012",
      "itemId": "17561",
      "RecipeID": "4026",
      "ProductPrice": "9.50",
      "ProductPrice_2": null,
      "GastDesc_de": "Rote-Bete-Gnocchi | Champignons | Mangold",
      "GastDesc_en": "Beetroot Gnocchi | Mushrooms | Chard",
      "MenuName": "DINNER Vegi/Vegan_17:00-19:00",
      "allergene": {
        "gluten": "Glutenhaltiges Getreide",
        "milch": "Milch und Milcherzeugnisse",
        "sellerie": "Sellerie und Sellerieerzeugnisse"
      },
      "merkmale": {
        "vegan": "Vegan",
        "vegetarisch": "Vegetarisch"
      },
      "naehrstoffe": "",
      "zusatzstoffe": [
        {
          "de": "Farbstoff",
          "en": "Colouring Agent"
        }
      ],
      "PrintOrder": "12",
      "CO2Value": "579.00",
      "CO2Rating": "C",
      "CO2Perc": "100.00",
      "ClimateFriendly": null,
      "GastDesc": "Rote-Bete-Gnocchi | Champignons | Mangold",
      "date_de": "24.11.2025"
    },
    {
      "id": "4615529",
      "outlet": "canteen",
      "date": "2025-11-25",
      "CalendarWeek": "48",
      "day": "Dienstag",
      "mealtime": "Mittagessen",
      "IdentNr": "12025112598000",
      "itemId": "17549",
      "RecipeID": "5008",
      "ProductPrice": "11.00",
      "ProductPrice_2": null,
      "GastDesc_de": "Hoi Sin | Champignon | Bulgur",
      "GastDesc_en": "Hoi Sin | Mushroom | Bulgur",
      "MenuName": "COUNTER 1.1 Bowls_",
      "allergene": {
        "gluten": "Glutenhaltiges Getreide",
        "soja": "Soja und Sojaerzeugnisse",
        "sellerie": "Sellerie und Sellerieerzeugnisse",
        "sesam": "Sesamsamen und Sesamsamenerzeugnisse",
        "schwefel": "Schwefeldioxid und Sulfide"
      },
      "merkmale": {
        "vegan": "Vegan",
        "vegetarisch": "Vegetarisch"
      },
      "naehrstoffe": "",
      "zusatzstoffe": [
        {
          "de": "geschwefelt",
          "en": "Sulphurous"
        },
        {
          "de": "Farbstoff",
          "en": "Colouring Agent"
        },
        {
          "de": "Antioxidationsmittel",
          "en": "Antioxidation"
        },
        {
          "de": "Alkohol",
          "en": "Alcohol"
        }
      ],
      "PrintOrder": "0",
      "CO2Value": "664.00",
      "CO2Rating": "B",
      "CO2Perc": "100.00",
      "ClimateFriendly": null,
      "GastDesc": "Hoi Sin | Champignon | Bulgur",
      "date_de": "25.11.2025"
    },
    {
      "id": "4615530",
      "outlet": "canteen",
      "date": "2025-11-25",
      "CalendarWeek": "48",
      "day": "Dienstag",
      "mealtime": "Mittagessen",
      "IdentNr": "12025112598001",
      "itemId": "17550",
      "RecipeID": "8012",
      "ProductPrice": "12.00",
      "ProductPrice_2": null,
      "GastDesc_de": "Mac'n'Cheese | Salsiccia | Grünkohl",
      "GastDesc_en": "Mac'n'Cheese | Salsiccia | Kale",
      "MenuName": "COUNTER 2.1 Meat",
      "allergene": {
        "gluten": "Glutenhaltiges Getreide",
        "huhnerei": "Hühnerei und Hühnereierzeugnisse",
        "milch": "Milch und Milcherzeugnisse",
        "sellerie": "Sellerie und Sellerieerzeugnisse"
      },
      "merkmale": {
        "schwein": "Schwein"
      },
      "naehrstoffe": "",
      "zusatzstoffe": null,
      "PrintOrder": "1",
      "CO2Value": "1081.00",
      "CO2Rating": "B",
      "CO2Perc": "100.00",
      "ClimateFriendly": null,
      "GastDesc": "Mac'n'Cheese | Salsiccia | Grünkohl",
      "date_de": "25.11.2025"
    },
    {
      "id": "4615531",
      "outlet": "canteen",
      "date": "2025-11-25",
      "CalendarWeek": "48",
      "day": "Dienstag",
      "mealtime": "Mittagessen",
      "IdentNr": "12025112598003",
      "itemId": "17552",
      "RecipeID": "9065",
      "ProductPrice": "12.00",
      "ProductPrice_2": null,
      "GastDesc_de": "Schellfisch | Steckrübe | Szechuanpfeffer",
      "GastDesc_en": "Haddock | Turnip | Szechuan Pepper",
      "MenuName": "COUNTER 3.1 Fish",
      "allergene": {
        "fisch": "Fisch und Fischerzeugnisse",
        "milch": "Milch und Milcherzeugnisse",
        "sellerie": "Sellerie und Sellerieerzeugnisse",
        "schwefel": "Schwefeldioxid und Sulfide"
      },
      "merkmale": "",
      "naehrstoffe": "",
      "zusatzstoffe": [
        {
          "de": "Antioxidationsmittel",
          "en": "Antioxidation"
        },
        {
          "de": "Alkohol",
          "en": "Alcohol"
        }
      ],
      "PrintOrder": "3",
      "CO2Value": "1108.00",
      "CO2Rating": "B",
      "CO2Perc": "100.00",
      "ClimateFriendly": null,
      "GastDesc": "Schellfisch | Steckrübe | Szechuanpfeffer",
      "date_de": "25.11.2025"
    },
    {
      "id": "4615532",
      "outlet": "canteen",
      "date": "2025-11-25",
      "CalendarWeek": "48",
      "day": "Dienstag",
      "mealtime": "Mittagessen",
      "IdentNr": "12025112598005",
      "itemId": "17554",
      "RecipeID": "4913",
      "ProductPrice": "9.50",
      "ProductPrice_2": null,
      "GastDesc_de": "Ravioli | Spinat | Ricotta",
      "GastDesc_en": "Ravioli | Spinach | Ricotta",
      "MenuName": "COUNTER 4.1 Vegi",
      "allergene": {
        "gluten": "Glutenhaltiges Getreide",
        "huhnerei": "Hühnerei und Hühnereierzeugnisse",
        "milch": "Milch und Milcherzeugnisse",
        "sellerie": "Sellerie und Sellerieerzeugnisse",
        "schwefel": "Schwefeldioxid und Sulfide"
      },
      "merkmale": "",
      "naehrstoffe": "",
      "zusatzstoffe": null,
      "PrintOrder": "5",
      "CO2Value": "829.00",
      "CO2Rating": "B",
      "CO2Perc": "100.00",
      "ClimateFriendly": null,
      "GastDesc": "Ravioli | Spinat | Ricotta",
      "date_de": "25.11.2025"
    },
    {
      "id": "4615533",
      "outlet": "canteen",
      "date": "2025-11-25",
      "CalendarWeek": "48",
      "day": "Dienstag",
      "mealtime": "Abendessen",
      "IdentNr": "12025112598009",
      "itemId": "17558",
      "RecipeID": "5008",
      "ProductPrice": "11.00",
      "ProductPrice_2": null,
      "GastDesc_de": "Hoi Sin | Champignon | Bulgur",
      "GastDesc_en": "Hoi Sin | Mushroom | Bulgur",
      "MenuName": "DINNER BOWL_",
      "allergene": {
        "gluten": "Glutenhaltiges Getreide",
        "soja": "Soja und Sojaerzeugnisse",
        "sellerie": "Sellerie und Sellerieerzeugnisse",
        "sesam": "Sesamsamen und Sesamsamenerzeugnisse",
