{
  "daySelector": [
    {
      "date": "2025-12-20",
      "day": "Samstag",
      "CalendarWeek": "51",
      "date_de": "20.12.2025"
    },
    {
      "date": "2025-12-21",
      "day": "Sonntag",
      "CalendarWeek": "51",
      "date_de": "21.12.2025"
    },
    {
      "date": "2025-12-22",
      "day": "Montag",
      "CalendarWeek": "52",
      "date_de": "22.12.2025"
    },
    {
      "date": "2025-12-23",
      "day": "Dienstag",
      "CalendarWeek": "52",
      "date_de": "23.12.2025"
    },
    {
      "date": "2025-12-26",
      "day": "Freitag",
      "CalendarWeek": "52",
      "date_de": "26.12.2025"
    },
    {
      "date": "2025-12-27",
      "day": "Samstag",
      "CalendarWeek": "52",
      "date_de": "27.12.2025"
    },
    {
      "date": "2025-12-28",
      "day": "Sonntag",
      "CalendarWeek": "52",
      "date_de": "28.12.2025"
    },
    {
      "date": "2025-12-29",
      "day": "Montag",
      "CalendarWeek": "52",
      "date_de": "29.12.2025"
    },
    {
      "date": "2025-12-30",
      "day": "Dienstag",
      "CalendarWeek": "52",
      "date_de": "30.12.2025"
    },
    {
      "date": "2026-01-01",
      "day": "Donnerstag",
      "CalendarWeek": "52",
      "date_de": "01.01.2026"
    },
    {
      "date": "2026-01-02",
      "day": "Freitag",
      "CalendarWeek": "52",
      "date_de": "02.01.2026"
    },
    {
      "date": "2026-01-03",
      "day": "Samstag",
      "CalendarWeek": "52",
      "date_de": "03.01.2026"
    },
    {
      "date": "2026-01-04",
      "day": "Sonntag",
      "CalendarWeek": "52",
      "date_de": "04.01.2026"
    },
    {
      "date": "2026-01-05",
      "day": "Montag",
      "CalendarWeek": "52",
      "date_de": "05.01.2026"
    },
    {
      "date": "2026-01-06",
      "day": "Dienstag",
      "CalendarWeek": "52",
      "date_de": "06.01.2026"
    },
    {
      "date": "2026-01-07",
      "day": "Mittwoch",
      "CalendarWeek": "52",
      "date_de": "07.01.2026"
    },
    {
      "date": "2026-01-08",
      "day": "Donnerstag",
      "CalendarWeek": "52",
      "date_de": "08.01.2026"
    },
    {
      "date": "2026-01-09",
      "day": "Freitag",
      "CalendarWeek": "52",
      "date_de": "09.01.2026"
    }
  ],
  "data": [
    {
      "id": "4932897",
      "outlet": "canteen",
      "date": "2025-12-20",
      "CalendarWeek": "51",
      "day": "Samstag",
      "mealtime": "Abendessen",
      "IdentNr": "12025122098014",
      "itemId": "17563",
      "RecipeID": "5727",
      "ProductPrice": "12.00",
      "ProductPrice_2": null,
      "GastDesc_de": "Kalbsbolognese | Tagliatelle | Parmesan",
      "GastDesc_en": "Veal bolognese | Tagliatelle | Parmesan",
      "MenuName": "LUNCH Meat_",
      "allergene": {
        "gluten": "Glutenhaltiges Getreide",
        "schalenfruchte": "Schalenfrüchte und Schalenfruchterzeugnisse",
        "milch": "Milch und Milcherzeugnisse",
        "sellerie": "Sellerie und Sellerieerzeugnisse",
        "schwefel": "Schwefeldioxid und Sulfide"
      },
      "merkmale": "",
      "naehrstoffe": "",
      "zusatzstoffe": [
        {
          "de": "Konservierungsstoff",
          "en": "Preservatives"
        },
        {
          "de": "Alkohol",
          "en": "Alcohol"
        }
      ],
      "PrintOrder": "14",
      "CO2Value": "2748.00",
      "CO2Rating": "C",
      "CO2Perc": "100.00",
      "ClimateFriendly": null,
      "GastDesc": "Kalbsbolognese | Tagliatelle | Parmesan",
      "date_de": "20.12.2025"
    },
    {
      "id": "4932899",
      "outlet": "canteen",
      "date": "2025-12-20",
      "CalendarWeek": "51",
      "day": "Samstag",
      "mealtime": "Abendessen",
      "IdentNr": "12025122098015",
      "itemId": "17564",
      "RecipeID": "9086",
      "ProductPrice": "12.00",
      "ProductPrice_2": null,
      "GastDesc_de": "Lammkeule | Gremolata | Paprika | Sesamstampf",
      "GastDesc_en": "Leg of Lamb | Gremolata | Sesame Mash",
      "MenuName": "LUNCH Fish_",
      "allergene": {
        "milch": "Milch und Milcherzeugnisse",
        "sesam": "Sesamsamen und Sesamsamenerzeugnisse"
      },
      "merkmale": "",
      "naehrstoffe": "",
      "zusatzstoffe": null,
      "PrintOrder": "15",
      "CO2Value": "9598.00",
      "CO2Rating": "E",
      "CO2Perc": "100.00",
      "ClimateFriendly": null,
      "GastDesc": "Lammkeule | Gremolata | Paprika | Sesamstampf",
      "date_de": "20.12.2025"
    },
    {
      "id": "4932901",
      "outlet": "canteen",
      "date": "2025-12-20",
      "CalendarWeek": "51",
      "day": "Samstag",
      "mealtime": "Abendessen",
      "IdentNr": "12025122098016",
      "itemId": "17565",
      "RecipeID": "8739",
      "ProductPrice": "9.50",
      "ProductPrice_2": null,
      "GastDesc_de": "Texas-Bohnen | BBQ-Sauce | Rosmarin Kartoffeln",
      "GastDesc_en": "Texas Beans | BBQ Sauce | Rosmary Potatoes",
      "MenuName": "LUNCH Vegi/Vegan_",
      "allergene": {
        "gluten": "Glutenhaltiges Getreide",
        "schalenfruchte": "Schalenfrüchte und Schalenfruchterzeugnisse",
        "soja": "Soja und Sojaerzeugnisse"
      },
      "merkmale": {
        "vegan": "Vegan",
        "vegetarisch": "Vegetarisch"
      },
      "naehrstoffe": "",
      "zusatzstoffe": [
        {
          "de": "Konservierungsstoff",
          "en": "Preservatives"
        }
      ],
      "PrintOrder": "16",
      "CO2Value": "352.00",
      "CO2Rating": "A",
      "CO2Perc": "100.00",
      "ClimateFriendly": "1",
      "GastDesc": "Texas-Bohnen | BBQ-Sauce | Rosmarin Kartoffeln",
      "date_de": "20.12.2025"
    },
    {
      "id": "4932903",
      "outlet": "canteen",
      "date": "2025-12-21",
      "CalendarWeek": "51",
      "day": "Sonntag",
      "mealtime": "Abendessen",
      "IdentNr": "12025122198018",
      "itemId": "17864",
      "RecipeID": "2883",
      "ProductPrice": "12.00",
      "ProductPrice_2": null,
      "GastDesc_de": "Schweinefilet | Bohnenragout | Pancetta",
      "GastDesc_en": "Pork Fillet | Mixed Bean Ragout | Pancetta",
      "MenuName": "DINNER Meat _|",
      "allergene": {
        "gluten": "Glutenhaltiges Getreide",
        "milch": "Milch und Milcherzeugnisse",
        "sellerie": "Sellerie und Sellerieerzeugnisse",
        "schwefel": "Schwefeldioxid und Sulfide"
      },
      "merkmale": "",
      "naehrstoffe": "",
      "zusatzstoffe": [
        {
          "de": "Antioxidationsmittel",
          "en": "Antioxidation"
        },
        {
          "de": "Konservierungsstoff",
          "en": "Preservatives"
        },
        {
          "de": "Alkohol",
          "en": "Alcohol"
        }
      ],
      "PrintOrder": "18",
      "CO2Value": "3666.00",
      "CO2Rating": "D",
      "CO2Perc": "100.00",
      "ClimateFriendly": null,
      "GastDesc": "Schweinefilet | Bohnenragout | Pancetta",
      "date_de": "21.12.2025"
    },
    {
      "id": "4932904",
      "outlet": "canteen",
      "date": "2025-12-21",
      "CalendarWeek": "51",
      "day": "Sonntag",
      "mealtime": "Mittagessen",
      "IdentNr": "12025122198018",
      "itemId": "17864",
      "RecipeID": "2883",
      "ProductPrice": "12.00",
      "ProductPrice_2": null,
      "GastDesc_de": "Schweinefilet | Bohnenragout | Pancetta",
      "GastDesc_en": "Pork Fillet | Mixed Bean Ragout | Pancetta",
      "MenuName": "DINNER Meat _|",
      "allergene": {
        "gluten": "Glutenhaltiges Getreide",
        "milch": "Milch und Milcherzeugnisse",
        "sellerie": "Sellerie und Sellerieerzeugnisse",
        "schwefel": "Schwefeldioxid und Sulfide"
      },
      "merkmale": "",
      "naehrstoffe": "",
      "zusatzstoffe": [
        {
          "de": "Antioxidationsmittel",
          "en": "Antioxidation"
        },
        {
          "de": "Konservierungsstoff",
          "en": "Preservatives"
        },
        {
          "de": "Alkohol",
          "en": "Alcohol"
        }
      ],
      "PrintOrder": "18",
      "CO2Value": "3666.00",
      "CO2Rating": "D",
      "CO2Perc": "100.00",
      "ClimateFriendly": null,
      "GastDesc": "Schweinefilet | Bohnenragout | Pancetta",
      "date_de": "21.12.2025"
    },
    {
      "id": "4932906",
      "outlet": "canteen",
      "date": "2025-12-21",
      "CalendarWeek": "51",
      "day": "Sonntag",
      "mealtime": "Abendessen",
      "IdentNr": "12025122198019",
      "itemId": "17865",
      "RecipeID": "8733",
      "ProductPrice": "12.00",
      "ProductPrice_2": null,
      "GastDesc_de": "Kabeljau | Bandnudeln | Zitrussauce",
      "GastDesc_en": "Cod Loin | Tagliatelle | Citrus Sauce",
      "MenuName": "DINNER Fish _|",
      "allergene": {
        "gluten": "Glutenhaltiges Getreide",
        "fisch": "Fisch und Fischerzeugnisse",
        "milch": "Milch und Milcherzeugnisse",
        "sellerie": "Sellerie und Sellerieerzeugnisse"
      },
      "merkmale": "",
      "naehrstoffe": "",
      "zusatzstoffe": null,
      "PrintOrder": "19",
      "CO2Value": "1285.00",
      "CO2Rating": "C",
      "CO2Perc": "50.00",
      "ClimateFriendly": null,
      "GastDesc": "Kabeljau | Bandnudeln | Zitrussauce",
      "date_de": "21.12.2025"
    },
    {
      "id": "4932907",
      "outlet": "canteen",
      "date": "2025-12-21",
      "CalendarWeek": "51",
      "day": "Sonntag",
      "mealtime": "Mittagessen",
      "IdentNr": "12025122198019",
      "itemId": "17865",
      "RecipeID": "8733",
      "ProductPrice": "12.00",
      "ProductPrice_2": null,
      "GastDesc_de": "Kabeljau | Bandnudeln | Zitrussauce",
      "GastDesc_en": "Cod Loin | Tagliatelle | Citrus Sauce",
      "MenuName": "DINNER Fish _|",
      "allergene": {
        "gluten": "Glutenhaltiges Getreide",
        "fisch": "Fisch und Fischerzeugnisse",
        "milch": "Milch und Milcherzeugnisse",
        "sellerie": "Sellerie und Sellerieerzeugnisse"
      },
      "merkmale": "",
      "naehrstoffe": "",
      "zusatzstoffe": null,
      "PrintOrder": "19",
      "CO2Value": "1285.00",
      "CO2Rating": "C",
      "CO2Perc": "50.00",
      "ClimateFriendly": null,
      "GastDesc": "Kabeljau | Bandnudeln | Zitrussauce",
      "date_de": "21.12.2025"
    },
    {
      "id": "4932909",
      "outlet": "canteen",
      "date": "2025-12-21",
      "CalendarWeek": "51",
      "day": "Sonntag",
      "mealtime": "Abendessen",
      "IdentNr": "12025122198020",
      "itemId": "17866",
      "RecipeID": "2987",
      "ProductPrice": "9.50",
      "ProductPrice_2": null,
      "GastDesc_de": "Gemüsecurry | Kohlrabi | Romanesco*",
      "GastDesc_en": "Vegetable Curry | Cabbage | Romanesco *",
      "MenuName": "DINNER Vegi / Vegan_|",
      "allergene": {
        "sellerie": "Sellerie und Sellerieerzeugnisse"
      },
      "merkmale": {
        "veganuary": "Veganuary"
      },
      "naehrstoffe": "",
      "zusatzstoffe": [
        {
          "de": "Süßungsmittel",
          "en": "Sweetener"
        },
        {
          "de": "Phenylalaninquelle",
          "en": "Phenylalanine"
        },
        {
          "de": "Konservierungsstoff",
          "en": "Preservatives"
        }
      ],
      "PrintOrder": "20",
      "CO2Value": "672.00",
      "CO2Rating": "C",
      "CO2Perc": "100.00",
      "ClimateFriendly": null,
      "GastDesc": "Gemüsecurry | Kohlrabi | Romanesco*",
      "date_de": "21.12.2025"
    },
    {
      "id": "4932910",
      "outlet": "canteen",
      "date": "2025-12-21",
      "CalendarWeek": "51",
      "day": "Sonntag",
      "mealtime": "Mittagessen",
      "IdentNr": "12025122198020",
      "itemId": "17866",
      "RecipeID": "2987",
      "ProductPrice": "9.50",
      "ProductPrice_2": null,
      "GastDesc_de": "Gemüsecurry | Kohlrabi | Romanesco*",
      "GastDesc_en": "Vegetable Curry | Cabbage | Romanesco *",
      "MenuName": "DINNER Vegi / Vegan_|",
      "allergene": {
        "sellerie": "Sellerie und Sellerieerzeugnisse"
      },
      "merkmale": {
        "veganuary": "Veganuary"
      },
      "naehrstoffe": "",
      "zusatzstoffe": [
        {
          "de": "Süßungsmittel",
          "en": "Sweetener"
        },
        {
          "de": "Phenylalaninquelle",
          "en": "Phenylalanine"
        },
        {
          "de": "Konservierungsstoff",
          "en": "Preservatives"
        }
      ],
      "PrintOrder": "20",
      "CO2Value": "672.00",
      "CO2Rating": "C",
      "CO2Perc": "100.00",
      "ClimateFriendly": null,
      "GastDesc": "Gemüsecurry | Kohlrabi | Romanesco*",
      "date_de": "21.12.2025"
    },
    {
      "id": "4940121",
      "outlet": "canteen",
      "date": "2025-12-22",
      "CalendarWeek": "52",
      "day": "Montag",
      "mealtime": "Mittagessen",
      "IdentNr": "12025122298000",
      "itemId": "17549",
      "RecipeID": "5164",
      "ProductPrice": "10.00",
      "ProductPrice_2": null,
      "GastDesc_de": "Tikka Gemüse | Kokos | Sesam",
      "GastDesc_en": "Tikka Vegetables | Coconut | Sesame",
      "MenuName": "COUNTER 1.1 Bowls_",
      "allergene": {
        "sesam": "Sesamsamen und Sesamsamenerzeugnisse"
      },
      "merkmale": {
        "vegan": "Vegan",
        "vegetarisch": "Vegetarisch"
      },
      "naehrstoffe": "",
      "zusatzstoffe": null,
      "PrintOrder": "0",
      "CO2Value": "487.00",
      "CO2Rating": "B",
      "CO2Perc": "100.00",
      "ClimateFriendly": null,
      "GastDesc": "Tikka Gemüse | Kokos | Sesam",
      "date_de": "22.12.2025"
    },
    {
      "id": "4940122",
      "outlet": "canteen",
      "date": "2025-12-22",
      "CalendarWeek": "52",
      "day": "Montag",
      "mealtime": "Mittagessen",
      "IdentNr": "12025122298001",
      "itemId": "17550",
      "RecipeID": "7553",
      "ProductPrice": "12.00",
      "ProductPrice_2": null,
      "GastDesc_de": "Ente | Rotkohl | Klöße",
      "GastDesc_en": "Duck | Red Cabbage | Dumplings",
      "MenuName": "COUNTER 2.1 Meat",
      "allergene": {
        "schalenfruchte": "Schalenfrüchte und Schalenfruchterzeugnisse",
        "huhnerei": "Hühnerei und Hühnereierzeugnisse",
        "milch": "Milch und Milcherzeugnisse",
        "sellerie": "Sellerie und Sellerieerzeugnisse",
        "schwefel": "Schwefeldioxid und Sulfide"
      },
      "merkmale": "",
      "naehrstoffe": "",
      "zusatzstoffe": [
        {
          "de": "Süßungsmittel",
          "en": "Sweetener"
        },
        {
          "de": "Antioxidationsmittel",
          "en": "Antioxidation"
        },
        {
          "de": "Alkohol",
          "en": "Alcohol"
        }
      ],
      "PrintOrder": "1",
      "CO2Value": "1288.00",
      "CO2Rating": "B",
      "CO2Perc": "100.00",
      "ClimateFriendly": null,
      "GastDesc": "Ente | Rotkohl | Klöße",
      "date_de": "22.12.2025"
    },
    {
      "id": "4940123",
      "outlet": "canteen",
      "date": "2025-12-22",
      "CalendarWeek": "52",
      "day": "Montag",
      "mealtime": "Mittagessen",
      "IdentNr": "12025122298003",
      "itemId": "17552",
      "RecipeID": "5068",
      "ProductPrice": "12.00",
      "ProductPrice_2": null,
      "GastDesc_de": "Lachsfilet | Spekulatius | Wintergemüse",
      "GastDesc_en": "Salmon Fillet | Speculoos | Winter Vegetables",
      "MenuName": "COUNTER 3.1 Fish",
      "allergene": {
        "gluten": "Glutenhaltiges Getreide",
        "fisch": "Fisch und Fischerzeugnisse",
        "milch": "Milch und Milcherzeugnisse",
        "sellerie": "Sellerie und Sellerieerzeugnisse"
      },
      "merkmale": "",
      "naehrstoffe": "",
      "zusatzstoffe": null,
      "PrintOrder": "3",
      "CO2Value": "1170.00",
      "CO2Rating": "B",
      "CO2Perc": "100.00",
      "ClimateFriendly": null,
      "GastDesc": "Lachsfilet | Spekulatius | Wintergemüse",
      "date_de": "22.12.2025"
    },
    {
      "id": "4940124",
      "outlet": "canteen",
      "date": "2025-12-22",
      "CalendarWeek": "52",
      "day": "Montag",
      "mealtime": "Mittagessen",
      "IdentNr": "12025122298005",
      "itemId": "17554",
      "RecipeID": "7558",
      "ProductPrice": "9.50",
      "ProductPrice_2": null,
      "GastDesc_de": "Chili-Tofu | Pilze | Basmati | Szechuan",
      "GastDesc_en": "Chilli tofu | mushrooms | basmati | Szechuan",
      "MenuName": "COUNTER 4.1 Vegi",
      "allergene": {
        "gluten": "Glutenhaltiges Getreide",
        "soja": "Soja und Sojaerzeugnisse",
        "sellerie": "Sellerie und Sellerieerzeugnisse",
        "sesam": "Sesamsamen und Sesamsamenerzeugnisse"
      },
      "merkmale": {
        "vegan": "Vegan",
        "vegetarisch": "Vegetarisch"
      },
      "naehrstoffe": "",
      "zusatzstoffe": [
        {
          "de": "Geschmacksverstärker",
          "en": "Flavor Enhancer"
        },
        {
          "de": "Konservierungsstoff",
          "en": "Preservatives"
        }
      ],
      "PrintOrder": "5",
      "CO2Value": "747.00",
      "CO2Rating": "B",
      "CO2Perc": "100.00",
      "ClimateFriendly": null,
      "GastDesc": "Chili-Tofu | Pilze | Basmati | Szechuan",
      "date_de": "22.12.2025"
    },
    {
      "id": "4940125",
      "outlet": "canteen",
      "date": "2025-12-22",
      "CalendarWeek": "52",
      "day": "Montag",
      "mealtime": "Abendessen",
      "IdentNr": "12025122298009",
      "itemId": "17558",
      "RecipeID": "5164",
      "ProductPrice": "10.00",
      "ProductPrice_2": null,
      "GastDesc_de": "Tikka Gemüse | Kokos | Sesam",
      "GastDesc_en": "Tikka Vegetables | Coconut | Sesame",
      "MenuName": "DINNER BOWL_",
      "allergene": {
        "sesam": "Sesamsamen und Sesamsamenerzeugnisse"
      },
      "merkmale": {
        "vegan": "Vegan",
        "vegetarisch": "Vegetarisch"
      },
      "naehrstoffe": "",
      "zusatzstoffe": null,
      "PrintOrder": "9",
      "CO2Value": "487.00",
      "CO2Rating": "B",
      "CO2Perc": "100.00",
      "ClimateFriendly": null,
      "GastDesc": "Tikka Gemüse | Kokos | Sesam",
      "date_de": "22.12.2025"
    },
    {
      "id": "4940127",
      "outlet": "canteen",
      "date": "2025-12-22",
      "CalendarWeek": "52",
      "day": "Montag",
      "mealtime": "Abendessen",
      "IdentNr": "12025122298010",
      "itemId": "17559",
      "RecipeID": "7553",
      "ProductPrice": "12.00",
      "ProductPrice_2": null,
      "GastDesc_de": "Ente | Rotkohl | Klöße",
      "GastDesc_en": "Duck | Red Cabbage | Dumplings",
      "MenuName": "DINNER Meat_17:00-19:00",
      "allergene": {
        "schalenfruchte": "Schalenfrüchte und Schalenfruchterzeugnisse",
        "huhnerei": "Hühnerei und Hühnereierzeugnisse",
        "milch": "Milch und Milcherzeugnisse",
        "sellerie": "Sellerie und Sellerieerzeugnisse",
        "schwefel": "Schwefeldioxid und Sulfide"
      },
      "merkmale": "",
      "naehrstoffe": "",
      "zusatzstoffe": [
        {
          "de": "Süßungsmittel",
          "en": "Sweetener"
        },
        {
          "de": "Antioxidationsmittel",
          "en": "Antioxidation"
        },
        {
          "de": "Alkohol",
          "en": "Alcohol"
        }
      ],
      "PrintOrder": "10",
      "CO2Value": "1288.00",
      "CO2Rating": "B",
      "CO2Perc": "100.00",
      "ClimateFriendly": null,
      "GastDesc": "Ente | Rotkohl | Klöße",
      "date_de": "22.12.2025"
    },
    {
      "id": "4940129",
      "outlet": "canteen",
      "date": "2025-12-22",
      "CalendarWeek": "52",
      "day": "Montag",
      "mealtime": "Abendessen",
      "IdentNr": "12025122298012",
      "itemId": "17561",
      "RecipeID": "7558",
      "ProductPrice": "9.50",
      "ProductPrice_2": null,
      "GastDesc_de": "Chili-Tofu | Pilze | Basmati | Szechuan",
      "GastDesc_en": "Chilli tofu | mushrooms | basmati | Szechuan",
      "MenuName": "DINNER Vegi/Vegan_17:00-19:00",
      "allergene": {
        "gluten": "Glutenhaltiges Getreide",
        "soja": "Soja und Sojaerzeugnisse",
        "sellerie": "Sellerie und Sellerieerzeugnisse",
        "sesam": "Sesamsamen und Sesamsamenerzeugnisse"
      },
      "merkmale": {
        "vegan": "Vegan",
        "vegetarisch": "Vegetarisch"
      },
      "naehrstoffe": "",
      "zusatzstoffe": [
        {
          "de": "Geschmacksverstärker",
          "en": "Flavor Enhancer"
        },
        {
          "de": "Konservierungsstoff",
          "en": "Preservatives"
        }
      ],
      "PrintOrder": "12",
      "CO2Value": "747.00",
      "CO2Rating": "B",
      "CO2Perc": "100.00",
      "ClimateFriendly": null,
      "GastDesc": "Chili-Tofu | Pilze | Basmati | Szechuan",
      "date_de": "22.12.2025"
    },
    {
      "id": "4948443",
      "outlet": "canteen",
      "date": "2025-12-23",
      "CalendarWeek": "52",
      "day": "Dienstag",
      "mealtime": "Mittagessen",
      "IdentNr": "12025122398000",
      "itemId": "17549",
      "RecipeID": "8722",
      "ProductPrice": "12.00",
      "ProductPrice_2": null,
      "GastDesc_de": "Hähnchen Kimchi Gyoza | Soja | Glasnudeln",
      "GastDesc_en": "Chicken kimchi Gyoza | soy | glass noodles",
      "MenuName": "COUNTER 1.1 Bowls_",
      "allergene": {
        "gluten": "Glutenhaltiges Getreide",
        "fisch": "Fisch und Fischerzeugnisse",
        "soja": "Soja und Sojaerzeugnisse",
        "erdnuss": "Erdnüsse und Erdnusserzeugnisse",
        "sesam": "Sesamsamen und Sesamsamenerzeugnisse"
      },
      "merkmale": "",
      "naehrstoffe": "",
      "zusatzstoffe": null,
      "PrintOrder": "0",
      "CO2Value": "495.00",
      "CO2Rating": "B",
      "CO2Perc": "100.00",
      "ClimateFriendly": null,
      "GastDesc": "Hähnchen Kimchi Gyoza | Soja | Glasnudeln",
      "date_de": "23.12.2025"
    },
    {
      "id": "4948444",
      "outlet": "canteen",
      "date": "2025-12-23",
      "CalendarWeek": "52",
      "day": "Dienstag",
      "mealtime": "Mittagessen",
      "IdentNr": "12025122398001",
      "itemId": "17550",
      "RecipeID": "7553",
      "ProductPrice": "12.00",
      "ProductPrice_2": null,
      "GastDesc_de": "Ente | Rotkohl | Klöße",
      "GastDesc_en": "Duck | Red Cabbage | Dumplings",
      "MenuName": "COUNTER 2.1 Meat",
      "allergene": {
        "schalenfruchte": "Schalenfrüchte und Schalenfruchterzeugnisse",
        "huhnerei": "Hühnerei und Hühnereierzeugnisse",
        "milch": "Milch und Milcherzeugnisse",
        "sellerie": "Sellerie und Sellerieerzeugnisse",
        "schwefel": "Schwefeldioxid und Sulfide"
      },
      "merkmale": "",
      "naehrstoffe": "",
      "zusatzstoffe": [
        {
          "de": "Süßungsmittel",
          "en": "Sweetener"
        },
        {
          "de": "Antioxidationsmittel",
          "en": "Antioxidation"
        },
        {
          "de": "Alkohol",
          "en": "Alcohol"
        }
      ],
      "PrintOrder": "1",
      "CO2Value": "1288.00",
      "CO2Rating": "B",
      "CO2Perc": "100.00",
      "ClimateFriendly": null,
      "GastDesc": "Ente | Rotkohl | Klöße",
      "date_de": "23.12.2025"
    },
    {
      "id": "4948445",
      "outlet": "canteen",
      "date": "2025-12-23",
      "CalendarWeek": "52",
      "day": "Dienstag",
      "mealtime": "Mittagessen",
      "IdentNr": "12025122398003",
      "itemId": "17552",
      "RecipeID": "5068",
      "ProductPrice": "12.00",
      "ProductPrice_2": null,
      "GastDesc_de": "Lachsfilet | Spekulatius | Wintergemüse",
      "GastDesc_en": "Salmon Fillet | Speculoos | Winter Vegetables",
      "MenuName": "COUNTER 3.1 Fish",
      "allergene": {
        "gluten": "Glutenhaltiges Getreide",
        "fisch": "Fisch und Fischerzeugnisse",
        "milch": "Milch und Milcherzeugnisse",
        "sellerie": "Sellerie und Sellerieerzeugnisse"
      },
      "merkmale": "",
      "naehrstoffe": "",
      "zusatzstoffe": null,
      "PrintOrder": "3",
      "CO2Value": "1170.00",
      "CO2Rating": "B",
      "CO2Perc": "100.00",
      "ClimateFriendly": null,
      "GastDesc": "Lachsfilet | Spekulatius | Wintergemüse",
      "date_de": "23.12.2025"
    },
    {
      "id": "4948446",
      "outlet": "canteen",
      "date": "2025-12-23",
      "CalendarWeek": "52",
      "day": "Dienstag",
      "mealtime": "Mittagessen",
      "IdentNr": "12025122398005",
      "itemId": "17554",
      "RecipeID": "6460",
      "ProductPrice": "9.50",
      "ProductPrice_2": null,
      "GastDesc_de": "Bombay Burrito | Koriander-Minz-Chutney | Eingelegte Zwiebeln",
      "GastDesc_en": "Bombay Burrito | Cilantro Mint Chutney | Pickled Onions",
      "MenuName": "COUNTER 4.1 Vegi",
      "allergene": {
        "gluten": "Glutenhaltiges Getreide",
        "schalenfruchte": "Schalenfrüchte und Schalenfruchterzeugnisse",
        "schwefel": "Schwefeldioxid und Sulfide"
      },
      "merkmale": {
        "vegan": "Vegan",
        "vegetarisch": "Vegetarisch"
      },
      "naehrstoffe": "",
      "zusatzstoffe": [
        {
          "de": "Antioxidationsmittel",
          "en": "Antioxidation"
        },
        {
          "de": "Alkohol",
          "en": "Alcohol"
        }
      ],
      "PrintOrder": "5",
      "CO2Value": "296.00",
      "CO2Rating": "A",
      "CO2Perc": "100.00",
      "ClimateFriendly": "1",
      "GastDesc": "Bombay Burrito | Koriander-Minz-Chutney | Eingelegte Zwiebeln",
      "date_de": "23.12.2025"
    },
    {
      "id": "4948447",
      "outlet": "canteen",
      "date": "2025-12-23",
      "CalendarWeek": "52",
      "day": "Dienstag",
      "mealtime": "Abendessen",
      "IdentNr": "12025122398009",
      "itemId": "17558",
      "RecipeID": "8722",
      "ProductPrice": "12.00",
      "ProductPrice_2": null,
      "GastDesc_de": "Hähnchen Kimchi Gyoza | Soja | Glasnudeln",
      "GastDesc_en": "Chicken kimchi Gyoza | soy | glass noodles",
      "MenuName": "DINNER BOWL_",
      "allergene": {
        "gluten": "Glutenhaltiges Getreide",
        "fisch": "Fisch und Fischerzeugnisse",
        "soja": "Soja und Sojaerzeugnisse",
        "erdnuss": "Erdnüsse und Erdnusserzeugnisse",
        "sesam": "Sesamsamen und Sesamsamenerzeugnisse"
      },
      "merkmale": "",
      "naehrstoffe": "",
      "zusatzstoffe": null,
      "PrintOrder": "9",
      "CO2Value": "495.00",
      "CO2Rating": "B",
      "CO2Perc": "100.00",
      "ClimateFriendly": null,
      "GastDesc": "Hähnchen Kimchi Gyoza | Soja | Glasnudeln",
      "date_de": "23.12.2025"
    },
    {
      "id": "4948449",
      "outlet": "canteen",
      "date": "2025-12-23",
      "CalendarWeek": "52",
      "day": "Dienstag",
      "mealtime": "Abendessen",
      "IdentNr": "12025122398011",
      "itemId": "17560",
      "RecipeID": "5068",
      "ProductPrice": "12.00",
      "ProductPrice_2": null,
      "GastDesc_de": "Lachsfilet | Spekulatius | Wintergemüse",
      "GastDesc_en": "Salmon Fillet | Speculoos | Winter Vegetables",
      "MenuName": "DINNER Fish_17:00-19:00",
      "allergene": {
        "gluten": "Glutenhaltiges Getreide",
        "fisch": "Fisch und Fischerzeugnisse",
        "milch": "Milch und Milcherzeugnisse",
        "sellerie": "Sellerie und Sellerieerzeugnisse"
      },
      "merkmale": "",
      "naehrstoffe": "",
      "zusatzstoffe": null,
      "PrintOrder": "11",
      "CO2Value": "1170.00",
      "CO2Rating": "B",
      "CO2Perc": "100.00",
      "ClimateFriendly": null,
      "GastDesc": "Lachsfilet | Spekulatius | Wintergemüse",
      "date_de": "23.12.2025"
    },
    {
      "id": "4948451",
      "outlet": "canteen",
      "date": "2025-12-23",
      "CalendarWeek": "52",
      "day": "Dienstag",
      "mealtime": "Abendessen",
      "IdentNr": "12025122398012",
      "itemId": "17561",
      "RecipeID": "6460",
      "ProductPrice": "9.50",
      "ProductPrice_2": null,
      "GastDesc_de": "Bombay Burrito | Koriander-Minz-Chutney | Eingelegte Zwiebeln",
      "GastDesc_en": "Bombay Burrito | Cilantro Mint Chutney | Pickled Onions",
      "MenuName": "DINNER Vegi/Vegan_17:00-19:00",
      "allergene": {
        "gluten": "Glutenhaltiges Getreide",
        "schalenfruchte": "Schalenfrüchte und Schalenfruchterzeugnisse",
        "schwefel": "Schwefeldioxid und Sulfide"
      },
      "merkmale": {
        "vegan": "Vegan",
        "vegetarisch": "Vegetarisch"
      },
      "naehrstoffe": "",
      "zusatzstoffe": [
        {
          "de": "Antioxidationsmittel",
          "en": "Antioxidation"
        },
        {
          "de": "Alkohol",
          "en": "Alcohol"
        }
      ],
      "PrintOrder": "12",
      "CO2Value": "296.00",
      "CO2Rating": "A",
      "CO2Perc": "100.00",
      "ClimateFriendly": "1",
      "GastDesc": "Bombay Burrito | Koriander-Minz-Chutney | Eingelegte Zwiebeln",
      "date_de": "23.12.2025"
    },
    {
      "id": "4981930",
      "outlet": "canteen",
      "date": "2025-12-26",
      "CalendarWeek": "52",
      "day": "Freitag",
      "mealtime": "Abendessen",
      "IdentNr": "12025122698018",
      "itemId": "17864",
      "RecipeID": "7384",
      "ProductPrice": "12.00",
      "ProductPrice_2": null,
      "GastDesc_de": "Chili con Carne | Reis | Sauerrahm",
      "GastDesc_en": "Chili con Carne I Rice | Sour Creme |",
      "MenuName": "DINNER Meat _|",
      "allergene": {
        "milch": "Milch und Milcherzeugnisse",
        "sellerie": "Sellerie und Sellerieerzeugnisse",
        "schwefel": "Schwefeldioxid und Sulfide"
      },
      "merkmale": "",
      "naehrstoffe": "",
      "zusatzstoffe": null,
      "PrintOrder": "18",
      "CO2Value": "1870.00",
      "CO2Rating": "C",
      "CO2Perc": "100.00",
      "ClimateFriendly": null,
      "GastDesc": "Chili con Carne | Reis | Sauerrahm",
      "date_de": "26.12.2025"
    },
    {
      "id": "4981932",
      "outlet": "canteen",
      "date": "2025-12-26",
      "CalendarWeek": "52",
      "day": "Freitag",
      "mealtime": "Abendessen",
      "IdentNr": "12025122698019",
      "itemId": "17865",
      "RecipeID": "7262",
      "ProductPrice": "12.00",
      "ProductPrice_2": null,
      "GastDesc_de": "Backfisch | Kartoffelsalat | Zitronenmayo",
      "GastDesc_en": "Fried Fish | Potato Salad | Lemon Mayo",
      "MenuName": "DINNER Fish _|",
      "allergene": {
        "gluten": "Glutenhaltiges Getreide",
        "huhnerei": "Hühnerei und Hühnereierzeugnisse",
        "fisch": "Fisch und Fischerzeugnisse",
        "senf": "Senf und Senferzeugnisse"
      },
      "merkmale": "",
      "naehrstoffe": "",
      "zusatzstoffe": [
        {
          "de": "Süßungsmittel",
          "en": "Sweetener"
        },
        {
          "de": "Farbstoff",
          "en": "Colouring Agent"
        },
        {
          "de": "Antioxidationsmittel",
          "en": "Antioxidation"
        },
        {
          "de": "Konservierungsstoff",
          "en": "Preservatives"
        }
      ],
      "PrintOrder": "19",
      "CO2Value": "876.00",
      "CO2Rating": "B",
      "CO2Perc": "100.00",
      "ClimateFriendly": null,
      "GastDesc": "Backfisch | Kartoffelsalat | Zitronenmayo",
      "date_de": "26.12.2025"
    },
    {
      "id": "4981934",
      "outlet": "canteen",
      "date": "2025-12-26",
      "CalendarWeek": "52",
      "day": "Freitag",
      "mealtime": "Abendessen",
      "IdentNr": "12025122698020",
      "itemId": "17866",
      "RecipeID": "4980",
      "ProductPrice": "9.50",
      "ProductPrice_2": null,
      "GastDesc_de": "Linsenbolognese | Tagliatelle | Basilikum",
      "GastDesc_en": "Lentil Bolognese | Tagliatelle | Basil",
      "MenuName": "DINNER Vegi / Vegan_|",
      "allergene": {
        "gluten": "Glutenhaltiges Getreide",
        "huhnerei": "Hühnerei und Hühnereierzeugnisse",
        "milch": "Milch und Milcherzeugnisse",
        "sellerie": "Sellerie und Sellerieerzeugnisse"
      },
      "merkmale": {
        "vegan": "Vegan",
        "vegetarisch": "Vegetarisch"
      },
      "naehrstoffe": "",
      "zusatzstoffe": null,
      "PrintOrder": "20",
      "CO2Value": "475.00",
      "CO2Rating": "A",
      "CO2Perc": "100.00",
      "ClimateFriendly": "1",
      "GastDesc": "Linsenbolognese | Tagliatelle | Basilikum",
      "date_de": "26.12.2025"
    },
    {
      "id": "4981936",
      "outlet": "canteen",
      "date": "2025-12-27",
      "CalendarWeek": "52",
      "day": "Samstag",
      "mealtime": "Abendessen",
      "IdentNr": "12025122798014",
      "itemId": "17563",
      "RecipeID": "6296",
      "ProductPrice": "12.00",
      "ProductPrice_2": null,
      "GastDesc_de": "Bratwurst | Sauerkraut | Majoranjus",
      "GastDesc_en": "Bratwurst | Sauerkraut | Marjoram Jus",
      "MenuName": "LUNCH Meat_",
      "allergene": {
        "milch": "Milch und Milcherzeugnisse",
        "sellerie": "Sellerie und Sellerieerzeugnisse",
        "senf": "Senf und Senferzeugnisse",
        "schwefel": "Schwefeldioxid und Sulfide"
      },
      "merkmale": "",
      "naehrstoffe": "",
      "zusatzstoffe": [
        {
          "de": "Phosphat",
          "en": "Phosphate"
        },
        {
          "de": "Alkohol",
          "en": "Alcohol"
        }
      ],
      "PrintOrder": "14",
      "CO2Value": "830.00",
      "CO2Rating": "B",
      "CO2Perc": "100.00",
      "ClimateFriendly": null,
      "GastDesc": "Bratwurst | Sauerkraut | Majoranjus",
      "date_de": "27.12.2025"
    },
    {
      "id": "4981938",
      "outlet": "canteen",
      "date": "2025-12-27",
      "CalendarWeek": "52",
      "day": "Samstag",
      "mealtime": "Abendessen",
      "IdentNr": "12025122798015",
      "itemId": "17564",
      "RecipeID": "3813",
      "ProductPrice": "12.00",
      "ProductPrice_2": null,
      "GastDesc_de": "Zander | Bunte Linsen | Basilikumschaum",
      "GastDesc_en": "Pike Perch | Lentils | Basil foam",
      "MenuName": "LUNCH Fish_",
      "allergene": {
        "fisch": "Fisch und Fischerzeugnisse",
        "milch": "Milch und Milcherzeugnisse",
        "sellerie": "Sellerie und Sellerieerzeugnisse",
        "schwefel": "Schwefeldioxid und Sulfide"
      },
      "merkmale": "",
      "naehrstoffe": "",
      "zusatzstoffe": [
        {
          "de": "Konservierungsstoff",
          "en": "Preservatives"
        }
      ],
      "PrintOrder": "15",
      "CO2Value": "528.00",
      "CO2Rating": "A",
      "CO2Perc": "100.00",
      "ClimateFriendly": "1",
      "GastDesc": "Zander | Bunte Linsen | Basilikumschaum",
      "date_de": "27.12.2025"
    },
    {
      "id": "4981940",
      "outlet": "canteen",
      "date": "2025-12-27",
      "CalendarWeek": "52",
      "day": "Samstag",
      "mealtime": "Abendessen",
      "IdentNr": "12025122798016",
      "itemId": "17565",
      "RecipeID": "7979",
      "ProductPrice": "9.50",
      "ProductPrice_2": null,
      "GastDesc_de": "Süßkartoffelgnocchi | Pilzrahm | Rucola",
      "GastDesc_en": "Sweet Potato Gnocchi | Creamed Mushrooms | Arugula",
      "MenuName": "LUNCH Vegi/Vegan_",
      "allergene": {
        "gluten": "Glutenhaltiges Getreide",
        "schwefel": "Schwefeldioxid und Sulfide"
      },
      "merkmale": {
        "vegan": "Vegan",
        "vegetarisch": "Vegetarisch"
      },
      "naehrstoffe": "",
      "zusatzstoffe": [
        {
          "de": "Alkohol",
          "en": "Alcohol"
        }
      ],
      "PrintOrder": "16",
      "CO2Value": "470.00",
      "CO2Rating": "B",
      "CO2Perc": "100.00",
      "ClimateFriendly": null,
      "GastDesc": "Süßkartoffelgnocchi | Pilzrahm | Rucola",
      "date_de": "27.12.2025"
    },
    {
      "id": "4981942",
      "outlet": "canteen",
      "date": "2025-12-28",
      "CalendarWeek": "52",
      "day": "Sonntag",
      "mealtime": "Abendessen",
      "IdentNr": "12025122898018",
      "itemId": "17864",
      "RecipeID": "6327",
      "ProductPrice": "12.00",
      "ProductPrice_2": null,
      "GastDesc_de": "Prager Schinken | Weißkrautsalat | Salzkartoffeln",
      "GastDesc_en": "Gammon | Cabbage | Boiled Potatoes",
      "MenuName": "DINNER Meat _|",
      "allergene": {
        "milch": "Milch und Milcherzeugnisse",
        "sellerie": "Sellerie und Sellerieerzeugnisse",
        "schwefel": "Schwefeldioxid und Sulfide"
      },
      "merkmale": {
        "schwein": "Schwein"
      },
      "naehrstoffe": "",
      "zusatzstoffe": [
        {
          "de": "Alkohol",
          "en": "Alcohol"
        }
      ],
      "PrintOrder": "18",
      "CO2Value": "1188.00",
      "CO2Rating": "B",
      "CO2Perc": "100.00",
      "ClimateFriendly": null,
      "GastDesc": "Prager Schinken | Weißkrautsalat | Salzkartoffeln",
      "date_de": "28.12.2025"
    },
    {
      "id": "4981943",
      "outlet": "canteen",
      "date": "2025-12-28",
      "CalendarWeek": "52",
      "day": "Sonntag",
      "mealtime": "Mittagessen",
      "IdentNr": "12025122898018",
      "itemId": "17864",
      "RecipeID": "6327",
      "ProductPrice": "12.00",
      "ProductPrice_2": null,
      "GastDesc_de": "Prager Schinken | Weißkrautsalat | Salzkartoffeln",
      "GastDesc_en": "Gammon | Cabbage | Boiled Potatoes",
      "MenuName": "DINNER Meat _|",
      "allergene": {
        "milch": "Milch und Milcherzeugnisse",
        "sellerie": "Sellerie und Sellerieerzeugnisse",
        "schwefel": "Schwefeldioxid und Sulfide"
      },
      "merkmale": {
        "schwein": "Schwein"
      },
      "naehrstoffe": "",
      "zusatzstoffe": [
        {
          "de": "Alkohol",
          "en": "Alcohol"
        }
      ],
      "PrintOrder": "18",
      "CO2Value": "1188.00",
      "CO2Rating": "B",
      "CO2Perc": "100.00",
      "ClimateFriendly": null,
      "GastDesc": "Prager Schinken | Weißkrautsalat | Salzkartoffeln",
      "date_de": "28.12.2025"
    },
    {
      "id": "4981945",
      "outlet": "canteen",
      "date": "2025-12-28",
      "CalendarWeek": "52",
      "day": "Sonntag",
      "mealtime": "Abendessen",
      "IdentNr": "12025122898019",
      "itemId": "17865",
      "RecipeID": "2972",
      "ProductPrice": "12.00",
      "ProductPrice_2": null,
      "GastDesc_de": "Lachsfilet | Arbequina-Olivenöl  | provenzalisches Gemüse",
      "GastDesc_en": "Salmon fillet | Arbequina olive oil | Provençal vegetables",
      "MenuName": "DINNER Fish _|",
      "allergene": {
        "gluten": "Glutenhaltiges Getreide",
        "fisch": "Fisch und Fischerzeugnisse"
      },
      "merkmale": "",
      "naehrstoffe": "",
      "zusatzstoffe": null,
      "PrintOrder": "19",
      "CO2Value": "1168.00",
      "CO2Rating": "B",
      "CO2Perc": "100.00",
      "ClimateFriendly": null,
      "GastDesc": "Lachsfilet | Arbequina-Olivenöl  | provenzalisches Gemüse",
      "date_de": "28.12.2025"
    },
    {
      "id": "4981946",
      "outlet": "canteen",
      "date": "2025-12-28",
      "CalendarWeek": "52",
      "day": "Sonntag",
      "mealtime": "Mittagessen",
      "IdentNr": "12025122898019",
      "itemId": "17865",
      "RecipeID": "2972",
      "ProductPrice": "12.00",
      "ProductPrice_2": null,
      "GastDesc_de": "Lachsfilet | Arbequina-Olivenöl  | provenzalisches Gemüse",
      "GastDesc_en": "Salmon fillet | Arbequina olive oil | Provençal vegetables",
      "MenuName": "DINNER Fish _|",
      "allergene": {
        "gluten": "Glutenhaltiges Getreide",
        "fisch": "Fisch und Fischerzeugnisse"
      },
      "merkmale": "",
      "naehrstoffe": "",
      "zusatzstoffe": null,
      "PrintOrder": "19",
      "CO2Value": "1168.00",
      "CO2Rating": "B",
      "CO2Perc": "100.00",
      "ClimateFriendly": null,
      "GastDesc": "Lachsfilet | Arbequina-Olivenöl  | provenzalisches Gemüse",
      "date_de": "28.12.2025"
    },
    {
      "id": "4981948",
      "outlet": "canteen",
      "date": "2025-12-28",
      "CalendarWeek": "52",
      "day": "Sonntag",
      "mealtime": "Abendessen",
      "IdentNr": "12025122898020",
      "itemId": "17866",
      "RecipeID": "4564",
      "ProductPrice": "9.50",
      "ProductPrice_2": null,
      "GastDesc_de": "Kichererbsen-Masala | Basmati | Papadam",
      "GastDesc_en": "Chickpea Masala | Basmati Rice | Papadam",
      "MenuName": "DINNER Vegi / Vegan_|",
      "allergene": {
        "sellerie": "Sellerie und Sellerieerzeugnisse"
      },
      "merkmale": {
        "vegan": "Vegan",
        "vegetarisch": "Vegetarisch"
      },
      "naehrstoffe": "",
      "zusatzstoffe": [
        {
          "de": "Süßungsmittel",
          "en": "Sweetener"
        },
        {
          "de": "Phenylalaninquelle",
          "en": "Phenylalanine"
        },
        {
          "de": "Konservierungsstoff",
          "en": "Preservatives"
        }
      ],
      "PrintOrder": "20",
      "CO2Value": "532.00",
      "CO2Rating": "A",
      "CO2Perc": "100.00",
      "ClimateFriendly": "1",
      "GastDesc": "Kichererbsen-Masala | Basmati | Papadam",
      "date_de": "28.12.2025"
    },
    {
      "id": "4981949",
      "outlet": "canteen",
      "date": "2025-12-28",
      "CalendarWeek": "52",
      "day": "Sonntag",
      "mealtime": "Mittagessen",
      "IdentNr": "12025122898020",
      "itemId": "17866",
      "RecipeID": "4564",
      "ProductPrice": "9.50",
      "ProductPrice_2": null,
      "GastDesc_de": "Kichererbsen-Masala | Basmati | Papadam",
      "GastDesc_en": "Chickpea Masala | Basmati Rice | Papadam",
      "MenuName": "DINNER Vegi / Vegan_|",
      "allergene": {
        "sellerie": "Sellerie und Sellerieerzeugnisse"
      },
      "merkmale": {
        "vegan": "Vegan",
        "vegetarisch": "Vegetarisch"
      },
      "naehrstoffe": "",
      "zusatzstoffe": [
        {
          "de": "Süßungsmittel",
          "en": "Sweetener"
        },
        {
          "de": "Phenylalaninquelle",
          "en": "Phenylalanine"
        },
        {
          "de": "Konservierungsstoff",
          "en": "Preservatives"
        }
      ],
      "PrintOrder": "20",
      "CO2Value": "532.00",
      "CO2Rating": "A",
      "CO2Perc": "100.00",
      "ClimateFriendly": "1",
      "GastDesc": "Kichererbsen-Masala | Basmati | Papadam",
      "date_de": "28.12.2025"
    },
    {
      "id": "4981951",
      "outlet": "canteen",
      "date": "2025-12-29",
      "CalendarWeek": "52",
      "day": "Montag",
      "mealtime": "Mittagessen",
      "IdentNr": "12025122998000",
      "itemId": "17549",
      "RecipeID": "5651",
      "ProductPrice": "10.00",
      "ProductPrice_2": null,
      "GastDesc_de": "Rote-Bete-Falafel | Römersalat | Joghurt",
      "GastDesc_en": "Beetroot falafel | Romaine lettuce | Yogurt",
      "MenuName": "COUNTER 1.1 Bowls_",
      "allergene": {
        "gluten": "Glutenhaltiges Getreide",
        "schalenfruchte": "Schalenfrüchte und Schalenfruchterzeugnisse",
        "milch": "Milch und Milcherzeugnisse",
        "schwefel": "Schwefeldioxid und Sulfide"
      },
      "merkmale": {
        "veganuary": "Veganuary"
      },
      "naehrstoffe": "",
      "zusatzstoffe": [
        {
          "de": "Antioxidationsmittel",
          "en": "Antioxidation"
        },
        {
          "de": "Alkohol",
          "en": "Alcohol"
        }
      ],
      "PrintOrder": "0",
      "CO2Value": "380.00",
      "CO2Rating": "A",
      "CO2Perc": "100.00",
      "ClimateFriendly": "1",
      "GastDesc": "Rote-Bete-Falafel | Römersalat | Joghurt",
      "date_de": "29.12.2025"
    },
    {
      "id": "4981952",
      "outlet": "canteen",
      "date": "2025-12-29",
      "CalendarWeek": "52",
      "day": "Montag",
      "mealtime": "Mittagessen",
      "IdentNr": "12025122998001",
      "itemId": "17550",
      "RecipeID": "8841",
      "ProductPrice": "12.00",
      "ProductPrice_2": null,
      "GastDesc_de": "Jamaican-Pork-Curry | Erbsen | Butterreis",
      "GastDesc_en": "Jamaican pork curry | Green Peas | Butter Rice",
      "MenuName": "COUNTER 2.1 Meat",
      "allergene": {
        "milch": "Milch und Milcherzeugnisse",
        "sellerie": "Sellerie und Sellerieerzeugnisse"
      },
      "merkmale": {
        "schwein": "Schwein"
      },
      "naehrstoffe": "",
      "zusatzstoffe": null,
      "PrintOrder": "1",
      "CO2Value": "2439.00",
      "CO2Rating": "C",
      "CO2Perc": "100.00",
      "ClimateFriendly": null,
      "GastDesc": "Jamaican-Pork-Curry | Erbsen | Butterreis",
      "date_de": "29.12.2025"
    },
    {
      "id": "4981953",
      "outlet": "canteen",
      "date": "2025-12-29",
      "CalendarWeek": "52",
      "day": "Montag",
      "mealtime": "Mittagessen",
      "IdentNr": "12025122998003",
      "itemId": "17552",
      "RecipeID": "8538",
      "ProductPrice": "12.00",
      "ProductPrice_2": null,
      "GastDesc_de": "Rotbarsch | Süßkartoffel | Harissa",
      "GastDesc_en": "Redfish | Sweet Potato | Spicy Harissa",
      "MenuName": "COUNTER 3.1 Fish",
      "allergene": {
        "fisch": "Fisch und Fischerzeugnisse",
        "milch": "Milch und Milcherzeugnisse",
        "sellerie": "Sellerie und Sellerieerzeugnisse"
      },
      "merkmale": "",
      "naehrstoffe": "",
      "zusatzstoffe": null,
      "PrintOrder": "3",
      "CO2Value": "1021.00",
      "CO2Rating": "C",
      "CO2Perc": "100.00",
      "ClimateFriendly": null,
      "GastDesc": "Rotbarsch | Süßkartoffel | Harissa",
      "date_de": "29.12.2025"
    },
    {
      "id": "4981954",
      "outlet": "canteen",
      "date": "2025-12-29",
      "CalendarWeek": "52",
      "day": "Montag",
      "mealtime": "Mittagessen",
      "IdentNr": "12025122998005",
      "itemId": "17554",
      "RecipeID": "4449",
      "ProductPrice": "10.00",
      "ProductPrice_2": null,
      "GastDesc_de": "Fagottini | Pomodori | Basilikum",
      "GastDesc_en": "Fagottini | Pomodori | Basil",
      "MenuName": "COUNTER 4.1 Vegi",
      "allergene": {
        "gluten": "Glutenhaltiges Getreide",
        "schwefel": "Schwefeldioxid und Sulfide"
      },
      "merkmale": {
        "vegan": "Vegan",
        "vegetarisch": "Vegetarisch"
      },
      "naehrstoffe": "",
      "zusatzstoffe": null,
      "PrintOrder": "5",
      "CO2Value": "417.00",
      "CO2Rating": "A",
      "CO2Perc": "100.00",
      "ClimateFriendly": "1",
      "GastDesc": "Fagottini | Pomodori | Basilikum",
      "date_de": "29.12.2025"
    },
    {
      "id": "4981955",
      "outlet": "canteen",
      "date": "2025-12-30",
      "CalendarWeek": "52",
      "day": "Dienstag",
      "mealtime": "Mittagessen",
      "IdentNr": "12025123098000",
      "itemId": "17549",
      "RecipeID": "5008",
      "ProductPrice": "11.00",
      "ProductPrice_2": null,
      "GastDesc_de": "Hoi Sin | Champignon | Bulgur",
      "GastDesc_en": "Hoi Sin | Mushroom | Bulgur",
      "MenuName": "COUNTER 1.1 Bowls_",
      "allergene": {
        "gluten": "Glutenhaltiges Getreide",
        "soja": "Soja und Sojaerzeugnisse",
        "sellerie": "Sellerie und Sellerieerzeugnisse",
        "sesam": "Sesamsamen und Sesamsamenerzeugnisse",
        "schwefel": "Schwefeldioxid und Sulfide"
      },
      "merkmale": {
        "vegan": "Vegan",
        "vegetarisch": "Vegetarisch"
      },
      "naehrstoffe": "",
      "zusatzstoffe": [
        {
          "de": "geschwefelt",
          "en": "Sulphurous"
        },
        {
          "de": "Farbstoff",
          "en": "Colouring Agent"
        },
        {
          "de": "Antioxidationsmittel",
          "en": "Antioxidation"
        },
        {
          "de": "Alkohol",
          "en": "Alcohol"
        }
      ],
      "PrintOrder": "0",
      "CO2Value": "712.00",
      "CO2Rating": "B",
      "CO2Perc": "100.00",
      "ClimateFriendly": null,
      "GastDesc": "Hoi Sin | Champignon | Bulgur",
      "date_de": "30.12.2025"
    },
    {
      "id": "4981956",
      "outlet": "canteen",
      "date": "2025-12-30",
      "CalendarWeek": "52",
      "day": "Dienstag",
      "mealtime": "Mittagessen",
      "IdentNr": "12025123098001",
      "itemId": "17550",
      "RecipeID": "8841",
      "ProductPrice": "12.00",
      "ProductPrice_2": null,
      "GastDesc_de": "Jamaican-Pork-Curry | Erbsen | Butterreis",
      "GastDesc_en": "Jamaican pork curry | Green Peas | Butter Rice",
      "MenuName": "COUNTER 2.1 Meat",
      "allergene": {
        "milch": "Milch und Milcherzeugnisse",
        "sellerie": "Sellerie und Sellerieerzeugnisse"
      },
      "merkmale": {
        "schwein": "Schwein"
      },
      "naehrstoffe": "",
      "zusatzstoffe": null,
      "PrintOrder": "1",
      "CO2Value": "2439.00",
      "CO2Rating": "C",
      "CO2Perc": "100.00",
      "ClimateFriendly": null,
      "GastDesc": "Jamaican-Pork-Curry | Erbsen | Butterreis",
      "date_de": "30.12.2025"
    },
    {
      "id": "4981957",
      "outlet": "canteen",
      "date": "2025-12-30",
      "CalendarWeek": "52",
      "day": "Dienstag",
      "mealtime": "Mittagessen",
      "IdentNr": "12025123098003",
      "itemId": "17552",
      "RecipeID": "8538",
      "ProductPrice": "12.00",
      "ProductPrice_2": null,
      "GastDesc_de": "Rotbarsch | Süßkartoffel | Harissa",
      "GastDesc_en": "Redfish | Sweet Potato | Spicy Harissa",
      "MenuName": "COUNTER 3.1 Fish",
      "allergene": {
        "fisch": "Fisch und Fischerzeugnisse",
        "milch": "Milch und Milcherzeugnisse",
        "sellerie": "Sellerie und Sellerieerzeugnisse"
      },
      "merkmale": "",
      "naehrstoffe": "",
      "zusatzstoffe": null,
      "PrintOrder": "3",
      "CO2Value": "1021.00",
      "CO2Rating": "C",
      "CO2Perc": "100.00",
      "ClimateFriendly": null,
      "GastDesc": "Rotbarsch | Süßkartoffel | Harissa",
      "date_de": "30.12.2025"
    },
    {
      "id": "4981958",
      "outlet": "canteen",
      "date": "2025-12-30",
      "CalendarWeek": "52",
      "day": "Dienstag",
      "mealtime": "Mittagessen",
      "IdentNr": "12025123098005",
      "itemId": "17554",
      "RecipeID": "2840",
      "ProductPrice": "9.50",
      "ProductPrice_2": null,
      "GastDesc_de": "Grenaille Kartoffeln | Kräuterquark | Leinöl | Wildkräutersalat",
      "GastDesc_en": "Baby Potatoes I Herb curd I Linseed Oil I Wild herb salad",
      "MenuName": "COUNTER 4.1 Vegi",
      "allergene": {
        "milch": "Milch und Milcherzeugnisse"
      },
      "merkmale": {
        "vegetarisch": "Vegetarisch"
      },
      "naehrstoffe": "",
      "zusatzstoffe": null,
      "PrintOrder": "5",
      "CO2Value": "1162.00",
      "CO2Rating": "B",
      "CO2Perc": "100.00",
      "ClimateFriendly": null,
      "GastDesc": "Grenaille Kartoffeln | Kräuterquark | Leinöl | Wildkräutersalat",
      "date_de": "30.12.2025"
    },
    {
      "id": "4981959",
      "outlet": "canteen",
      "date": "2026-01-01",
      "CalendarWeek": "52",
      "day": "Donnerstag",
      "mealtime": "Abendessen",
      "IdentNr": "12026010198018",
      "itemId": "17864",
      "RecipeID": "9000",
      "ProductPrice": "12.00",
      "ProductPrice_2": null,
      "GastDesc_de": "Currywurst | Fritten | Salat",
      "GastDesc_en": "Curry Sausage | Steakhouse Chips | Salad",
      "MenuName": "DINNER Meat _|",
      "allergene": {
        "huhnerei": "Hühnerei und Hühnereierzeugnisse",
        "sellerie": "Sellerie und Sellerieerzeugnisse",
        "senf": "Senf und Senferzeugnisse",
        "schwefel": "Schwefeldioxid und Sulfide"
      },
      "merkmale": "",
      "naehrstoffe": "",
      "zusatzstoffe": [
        {
          "de": "Süßungsmittel",
          "en": "Sweetener"
        },
        {
          "de": "Phosphat",
          "en": "Phosphate"
        },
        {
          "de": "Farbstoff",
          "en": "Colouring Agent"
        },
        {
          "de": "Antioxidationsmittel",
          "en": "Antioxidation"
        },
        {
          "de": "Konservierungsstoff",
          "en": "Preservatives"
        }
      ],
      "PrintOrder": "18",
      "CO2Value": "1038.00",
      "CO2Rating": "B",
      "CO2Perc": "100.00",
      "ClimateFriendly": null,
      "GastDesc": "Currywurst | Fritten | Salat",
      "date_de": "01.01.2026"
    },
    {
      "id": "4981961",
      "outlet": "canteen",
      "date": "2026-01-01",
      "CalendarWeek": "52",
      "day": "Donnerstag",
      "mealtime": "Abendessen",
      "IdentNr": "12026010198019",
      "itemId": "17865",
      "RecipeID": "8795",
      "ProductPrice": "12.00",
      "ProductPrice_2": null,
      "GastDesc_de": "Seelachs | Apfel | Gurke | Rahm",
      "GastDesc_en": "Coalfish | Apple | Cucumber | Cream",
      "MenuName": "DINNER Fish _|",
      "allergene": {
        "huhnerei": "Hühnerei und Hühnereierzeugnisse",
        "fisch": "Fisch und Fischerzeugnisse",
        "milch": "Milch und Milcherzeugnisse",
        "senf": "Senf und Senferzeugnisse",
        "schwefel": "Schwefeldioxid und Sulfide"
      },
      "merkmale": "",
      "naehrstoffe": "",
      "zusatzstoffe": [
        {
          "de": "Süßungsmittel",
          "en": "Sweetener"
        },
        {
          "de": "Farbstoff",
          "en": "Colouring Agent"
        },
        {
          "de": "Antioxidationsmittel",
          "en": "Antioxidation"
        },
        {
          "de": "Alkohol",
          "en": "Alcohol"
        }
      ],
      "PrintOrder": "19",
      "CO2Value": "1564.00",
      "CO2Rating": "C",
      "CO2Perc": "100.00",
      "ClimateFriendly": null,
      "GastDesc": "Seelachs | Apfel | Gurke | Rahm",
      "date_de": "01.01.2026"
    },
    {
      "id": "4981963",
      "outlet": "canteen",
      "date": "2026-01-01",
      "CalendarWeek": "52",
      "day": "Donnerstag",
      "mealtime": "Abendessen",
      "IdentNr": "12026010198020",
      "itemId": "17866",
      "RecipeID": "6410",
      "ProductPrice": "9.50",
      "ProductPrice_2": null,
      "GastDesc_de": "Linguine | Kürbis | Zuckerschote",
      "GastDesc_en": "Linguine | Pumpkin | Sweet Peas",
      "MenuName": "DINNER Vegi / Vegan_|",
      "allergene": {
        "gluten": "Glutenhaltiges Getreide"
      },
      "merkmale": {
        "vegan": "Vegan",
        "vegetarisch": "Vegetarisch"
      },
      "naehrstoffe": "",
      "zusatzstoffe": null,
      "PrintOrder": "20",
      "CO2Value": "303.00",
      "CO2Rating": "A",
      "CO2Perc": "100.00",
      "ClimateFriendly": "1",
      "GastDesc": "Linguine | Kürbis | Zuckerschote",
      "date_de": "01.01.2026"
    },
    {
      "id": "4981965",
      "outlet": "canteen",
      "date": "2026-01-02",
      "CalendarWeek": "52",
      "day": "Freitag",
      "mealtime": "Mittagessen",
      "IdentNr": "12026010298000",
      "itemId": "17549",
      "RecipeID": "5060",
      "ProductPrice": "11.00",
      "ProductPrice_2": null,
      "GastDesc_de": "Couscous | Ofen-Paprika | Kräuterfeta",
      "GastDesc_en": "Couscous | Oven peppers | Herb feta",
      "MenuName": "COUNTER 1.1 Bowls_",
      "allergene": {
        "gluten": "Glutenhaltiges Getreide",
        "schalenfruchte": "Schalenfrüchte und Schalenfruchterzeugnisse",
        "milch": "Milch und Milcherzeugnisse"
      },
      "merkmale": {
        "vegetarisch": "Vegetarisch"
      },
      "naehrstoffe": "",
      "zusatzstoffe": [
        {
          "de": "geschwärzt",
          "en": "Blacked Out"
        }
      ],
      "PrintOrder": "0",
      "CO2Value": "1638.00",
      "CO2Rating": "C",
      "CO2Perc": "100.00",
      "ClimateFriendly": null,
      "GastDesc": "Couscous | Ofen-Paprika | Kräuterfeta",
      "date_de": "02.01.2026"
    },
    {
      "id": "4981966",
      "outlet": "canteen",
      "date": "2026-01-02",
      "CalendarWeek": "52",
      "day": "Freitag",
      "mealtime": "Mittagessen",
      "IdentNr": "12026010298001",
      "itemId": "17550",
      "RecipeID": "5118",
      "ProductPrice": "12.00",
      "ProductPrice_2": null,
      "GastDesc_de": "Maishähnchen | Ebli | Strauchtomaten | Minzayran",
      "GastDesc_en": "Corn fed Chicken | Ebli | Tomato | Mint Ayran",
      "MenuName": "COUNTER 2.1 Meat",
      "allergene": {
        "gluten": "Glutenhaltiges Getreide",
        "milch": "Milch und Milcherzeugnisse",
        "sellerie": "Sellerie und Sellerieerzeugnisse"
      },
      "merkmale": "",
      "naehrstoffe": "",
      "zusatzstoffe": null,
      "PrintOrder": "1",
      "CO2Value": "1387.00",
      "CO2Rating": "C",
      "CO2Perc": "100.00",
      "ClimateFriendly": null,
      "GastDesc": "Maishähnchen | Ebli | Strauchtomaten | Minzayran",
      "date_de": "02.01.2026"
    },
    {
      "id": "4981967",
      "outlet": "canteen",
      "date": "2026-01-02",
      "CalendarWeek": "52",
      "day": "Freitag",
      "mealtime": "Mittagessen",
      "IdentNr": "12026010298003",
      "itemId": "17552",
      "RecipeID": "2931",
      "ProductPrice": "12.00",
      "ProductPrice_2": null,
      "GastDesc_de": "Zander | Kohlrabi-Gemüse | Kapernsauce",
      "GastDesc_en": "Pike perch | Kohlrabi | Capers",
      "MenuName": "COUNTER 3.1 Fish",
      "allergene": {
        "gluten": "Glutenhaltiges Getreide",
        "fisch": "Fisch und Fischerzeugnisse",
        "milch": "Milch und Milcherzeugnisse",
        "sellerie": "Sellerie und Sellerieerzeugnisse"
      },
      "merkmale": "",
      "naehrstoffe": "",
      "zusatzstoffe": null,
      "PrintOrder": "3",
      "CO2Value": "646.00",
      "CO2Rating": "B",
      "CO2Perc": "100.00",
      "ClimateFriendly": null,
      "GastDesc": "Zander | Kohlrabi-Gemüse | Kapernsauce",
      "date_de": "02.01.2026"
    },
    {
      "id": "4981968",
      "outlet": "canteen",
      "date": "2026-01-02",
      "CalendarWeek": "52",
      "day": "Freitag",
      "mealtime": "Mittagessen",
      "IdentNr": "12026010298005",
      "itemId": "17554",
      "RecipeID": "5077",
      "ProductPrice": "9.50",
      "ProductPrice_2": null,
      "GastDesc_de": "Soja-Frikasee | Reis | Wildkräuter",
      "GastDesc_en": "Soya Frikasee | Rice | Wild Herbs",
      "MenuName": "COUNTER 4.1 Vegi",
      "allergene": {
        "soja": "Soja und Sojaerzeugnisse",
        "sellerie": "Sellerie und Sellerieerzeugnisse",
        "schwefel": "Schwefeldioxid und Sulfide"
      },
      "merkmale": {
        "vegan": "Vegan",
        "vegetarisch": "Vegetarisch"
      },
      "naehrstoffe": "",
      "zusatzstoffe": [
        {
          "de": "Antioxidationsmittel",
          "en": "Antioxidation"
        },
        {
          "de": "Alkohol",
          "en": "Alcohol"
        }
      ],
      "PrintOrder": "5",
      "CO2Value": "528.00",
      "CO2Rating": "A",
      "CO2Perc": "100.00",
      "ClimateFriendly": "1",
      "GastDesc": "Soja-Frikasee | Reis | Wildkräuter",
      "date_de": "02.01.2026"
    },
    {
      "id": "4981969",
      "outlet": "canteen",
      "date": "2026-01-03",
      "CalendarWeek": "52",
      "day": "Samstag",
      "mealtime": "Abendessen",
      "IdentNr": "12026010398014",
      "itemId": "17563",
      "RecipeID": "7944",
      "ProductPrice": "12.00",
      "ProductPrice_2": null,
      "GastDesc_de": "Leberkäse | Kartoffelsalat | Blattsalat | Spiegelei",
      "GastDesc_en": "Traditional Leberkäse | Vinegar Potato Salad | Leafy Salad | Fried Egg",
      "MenuName": "LUNCH Meat_",
      "allergene": {
        "huhnerei": "Hühnerei und Hühnereierzeugnisse",
        "milch": "Milch und Milcherzeugnisse",
        "sellerie": "Sellerie und Sellerieerzeugnisse",
        "senf": "Senf und Senferzeugnisse",
        "schwefel": "Schwefeldioxid und Sulfide"
      },
      "merkmale": {
        "schwein": "Schwein"
      },
      "naehrstoffe": "",
      "zusatzstoffe": [
        {
          "de": "Phosphat",
          "en": "Phosphate"
        },
        {
          "de": "Antioxidationsmittel",
          "en": "Antioxidation"
        },
        {
          "de": "Konservierungsstoff",
          "en": "Preservatives"
        },
        {
          "de": "Alkohol",
          "en": "Alcohol"
        }
      ],
      "PrintOrder": "14",
      "CO2Value": "1083.00",
      "CO2Rating": "B",
      "CO2Perc": "100.00",
      "ClimateFriendly": null,
      "GastDesc": "Leberkäse | Kartoffelsalat | Blattsalat | Spiegelei",
      "date_de": "03.01.2026"
    },
    {
      "id": "4981971",
      "outlet": "canteen",
      "date": "2026-01-03",
      "CalendarWeek": "52",
      "day": "Samstag",
      "mealtime": "Abendessen",
      "IdentNr": "12026010398015",
      "itemId": "17564",
      "RecipeID": "2904",
      "ProductPrice": "12.00",
      "ProductPrice_2": null,
      "GastDesc_de": "Schellfisch | Kartoffel-Endivienstampf | Dijon-Senf",
      "GastDesc_en": "Haddock | Potato Endive Mash | Dijon Mustard",
      "MenuName": "LUNCH Fish_",
      "allergene": {
        "fisch": "Fisch und Fischerzeugnisse",
        "milch": "Milch und Milcherzeugnisse",
        "sellerie": "Sellerie und Sellerieerzeugnisse",
        "senf": "Senf und Senferzeugnisse",
        "schwefel": "Schwefeldioxid und Sulfide"
      },
      "merkmale": "",
      "naehrstoffe": "",
      "zusatzstoffe": null,
      "PrintOrder": "15",
      "CO2Value": "1129.00",
      "CO2Rating": "C",
      "CO2Perc": "100.00",
      "ClimateFriendly": null,
      "GastDesc": "Schellfisch | Kartoffel-Endivienstampf | Dijon-Senf",
      "date_de": "03.01.2026"
    },
    {
      "id": "4981973",
      "outlet": "canteen",
      "date": "2026-01-03",
      "CalendarWeek": "52",
      "day": "Samstag",
      "mealtime": "Abendessen",
      "IdentNr": "12026010398016",
      "itemId": "17565",
      "RecipeID": "6418",
      "ProductPrice": "9.50",
      "ProductPrice_2": null,
      "GastDesc_de": "Muschelnudeln | Gemüseragout | Basilikumöl",
      "GastDesc_en": "Castellane | Vegetableragout | Basil oil",
      "MenuName": "LUNCH Vegi/Vegan_",
      "allergene": {
        "gluten": "Glutenhaltiges Getreide"
      },
      "merkmale": {
        "vegan": "Vegan",
        "vegetarisch": "Vegetarisch"
      },
      "naehrstoffe": "",
      "zusatzstoffe": null,
      "PrintOrder": "16",
      "CO2Value": "546.00",
      "CO2Rating": "B",
      "CO2Perc": "100.00",
      "ClimateFriendly": null,
      "GastDesc": "Muschelnudeln | Gemüseragout | Basilikumöl",
      "date_de": "03.01.2026"
    },
    {
      "id": "4981975",
      "outlet": "canteen",
      "date": "2026-01-04",
      "CalendarWeek": "52",
      "day": "Sonntag",
      "mealtime": "Abendessen",
      "IdentNr": "12026010498018",
      "itemId": "17864",
      "RecipeID": "8851",
      "ProductPrice": "12.00",
      "ProductPrice_2": null,
      "GastDesc_de": "Enten-Chop-Suey | Ingwer-Reis | Kroepoek",
      "GastDesc_en": "Duck Chop Suey | Ginger Rice | Prawn Crackers",
      "MenuName": "DINNER Meat _|",
      "allergene": {
        "gluten": "Glutenhaltiges Getreide",
        "soja": "Soja und Sojaerzeugnisse",
        "krebstier": "Krebstiere und Krebstiererzeugnisse",
        "sellerie": "Sellerie und Sellerieerzeugnisse",
        "sesam": "Sesamsamen und Sesamsamenerzeugnisse",
        "weichtier": "Weichtier und Weichtiererzeugnisse"
      },
      "merkmale": "",
      "naehrstoffe": "",
      "zusatzstoffe": [
        {
          "de": "Farbstoff",
          "en": "Colouring Agent"
        },
        {
          "de": "Geschmacksverstärker",
          "en": "Flavor Enhancer"
        }
      ],
      "PrintOrder": "18",
      "CO2Value": "1446.00",
      "CO2Rating": "B",
      "CO2Perc": "100.00",
      "ClimateFriendly": null,
      "GastDesc": "Enten-Chop-Suey | Ingwer-Reis | Kroepoek",
      "date_de": "04.01.2026"
    },
    {
      "id": "4981976",
      "outlet": "canteen",
      "date": "2026-01-04",
      "CalendarWeek": "52",
      "day": "Sonntag",
      "mealtime": "Mittagessen",
      "IdentNr": "12026010498018",
      "itemId": "17864",
      "RecipeID": "8851",
      "ProductPrice": "12.00",
      "ProductPrice_2": null,
      "GastDesc_de": "Enten-Chop-Suey | Ingwer-Reis | Kroepoek",
      "GastDesc_en": "Duck Chop Suey | Ginger Rice | Prawn Crackers",
      "MenuName": "DINNER Meat _|",
      "allergene": {
        "gluten": "Glutenhaltiges Getreide",
        "soja": "Soja und Sojaerzeugnisse",
        "krebstier": "Krebstiere und Krebstiererzeugnisse",
        "sellerie": "Sellerie und Sellerieerzeugnisse",
        "sesam": "Sesamsamen und Sesamsamenerzeugnisse",
        "weichtier": "Weichtier und Weichtiererzeugnisse"
      },
      "merkmale": "",
      "naehrstoffe": "",
      "zusatzstoffe": [
        {
          "de": "Farbstoff",
          "en": "Colouring Agent"
        },
        {
          "de": "Geschmacksverstärker",
          "en": "Flavor Enhancer"
        }
      ],
      "PrintOrder": "18",
      "CO2Value": "1446.00",
      "CO2Rating": "B",
      "CO2Perc": "100.00",
      "ClimateFriendly": null,
      "GastDesc": "Enten-Chop-Suey | Ingwer-Reis | Kroepoek",
      "date_de": "04.01.2026"
    },
    {
      "id": "4981978",
      "outlet": "canteen",
      "date": "2026-01-04",
      "CalendarWeek": "52",
      "day": "Sonntag",
      "mealtime": "Abendessen",
      "IdentNr": "12026010498019",
      "itemId": "17865",
      "RecipeID": "7315",
      "ProductPrice": "12.00",
      "ProductPrice_2": null,
      "GastDesc_de": "Forellenfilet | Erbsen | Kartoffel-Frikassee",
      "GastDesc_en": "Trout fillet | peas | potato fricassee",
      "MenuName": "DINNER Fish _|",
      "allergene": {
        "fisch": "Fisch und Fischerzeugnisse",
        "soja": "Soja und Sojaerzeugnisse",
        "milch": "Milch und Milcherzeugnisse",
        "sellerie": "Sellerie und Sellerieerzeugnisse",
        "schwefel": "Schwefeldioxid und Sulfide"
      },
      "merkmale": {
        "schwein": "Schwein"
      },
      "naehrstoffe": "",
      "zusatzstoffe": [
        {
          "de": "Phosphat",
          "en": "Phosphate"
        },
        {
          "de": "Antioxidationsmittel",
          "en": "Antioxidation"
        },
        {
          "de": "Konservierungsstoff",
          "en": "Preservatives"
        },
        {
          "de": "Alkohol",
          "en": "Alcohol"
        }
      ],
      "PrintOrder": "19",
      "CO2Value": "1071.00",
      "CO2Rating": "B",
      "CO2Perc": "100.00",
      "ClimateFriendly": null,
      "GastDesc": "Forellenfilet | Erbsen | Kartoffel-Frikassee",
      "date_de": "04.01.2026"
    },
    {
      "id": "4981979",
      "outlet": "canteen",
      "date": "2026-01-04",
      "CalendarWeek": "52",
      "day": "Sonntag",
      "mealtime": "Mittagessen",
      "IdentNr": "12026010498019",
      "itemId": "17865",
      "RecipeID": "7315",
      "ProductPrice": "12.00",
      "ProductPrice_2": null,
      "GastDesc_de": "Forellenfilet | Erbsen | Kartoffel-Frikassee",
      "GastDesc_en": "Trout fillet | peas | potato fricassee",
      "MenuName": "DINNER Fish _|",
      "allergene": {
        "fisch": "Fisch und Fischerzeugnisse",
        "soja": "Soja und Sojaerzeugnisse",
        "milch": "Milch und Milcherzeugnisse",
        "sellerie": "Sellerie und Sellerieerzeugnisse",
        "schwefel": "Schwefeldioxid und Sulfide"
      },
      "merkmale": {
        "schwein": "Schwein"
      },
      "naehrstoffe": "",
      "zusatzstoffe": [
        {
          "de": "Phosphat",
          "en": "Phosphate"
        },
        {
          "de": "Antioxidationsmittel",
          "en": "Antioxidation"
        },
        {
          "de": "Konservierungsstoff",
          "en": "Preservatives"
        },
        {
          "de": "Alkohol",
          "en": "Alcohol"
        }
      ],
      "PrintOrder": "19",
      "CO2Value": "1071.00",
      "CO2Rating": "B",
      "CO2Perc": "100.00",
      "ClimateFriendly": null,
      "GastDesc": "Forellenfilet | Erbsen | Kartoffel-Frikassee",
      "date_de": "04.01.2026"
    },
    {
      "id": "4981981",
      "outlet": "canteen",
      "date": "2026-01-04",
      "CalendarWeek": "52",
      "day": "Sonntag",
      "mealtime": "Abendessen",
      "IdentNr": "12026010498020",
      "itemId": "17866",
      "RecipeID": "4327",
      "ProductPrice": "9.50",
      "ProductPrice_2": null,
      "GastDesc_de": "Curry von roten Linsen | Kürbis | Limettenjoghurt",
      "GastDesc_en": "Red Lentil Curry | Pumpkin | Lime Yoghurt",
      "MenuName": "DINNER Vegi / Vegan_|",
      "allergene": {
        "gluten": "Glutenhaltiges Getreide",
        "milch": "Milch und Milcherzeugnisse",
        "erdnuss": "Erdnüsse und Erdnusserzeugnisse",
        "sellerie": "Sellerie und Sellerieerzeugnisse"
      },
      "merkmale": {
        "vegan": "Vegan",
        "vegetarisch": "Vegetarisch"
      },
      "naehrstoffe": "",
      "zusatzstoffe": null,
      "PrintOrder": "20",
      "CO2Value": "580.00",
      "CO2Rating": "B",
      "CO2Perc": "100.00",
      "ClimateFriendly": null,
      "GastDesc": "Curry von roten Linsen | Kürbis | Limettenjoghurt",
      "date_de": "04.01.2026"
    },
    {
      "id": "4981982",
      "outlet": "canteen",
      "date": "2026-01-04",
      "CalendarWeek": "52",
      "day": "Sonntag",
      "mealtime": "Mittagessen",
      "IdentNr": "12026010498020",
      "itemId": "17866",
      "RecipeID": "4327",
      "ProductPrice": "9.50",
      "ProductPrice_2": null,
      "GastDesc_de": "Curry von roten Linsen | Kürbis | Limettenjoghurt",
      "GastDesc_en": "Red Lentil Curry | Pumpkin | Lime Yoghurt",
      "MenuName": "DINNER Vegi / Vegan_|",
      "allergene": {
        "gluten": "Glutenhaltiges Getreide",
        "milch": "Milch und Milcherzeugnisse",
        "erdnuss": "Erdnüsse und Erdnusserzeugnisse",
        "sellerie": "Sellerie und Sellerieerzeugnisse"
      },
      "merkmale": {
        "vegan": "Vegan",
        "vegetarisch": "Vegetarisch"
      },
      "naehrstoffe": "",
      "zusatzstoffe": null,
      "PrintOrder": "20",
      "CO2Value": "580.00",
      "CO2Rating": "B",
      "CO2Perc": "100.00",
      "ClimateFriendly": null,
      "GastDesc": "Curry von roten Linsen | Kürbis | Limettenjoghurt",
      "date_de": "04.01.2026"
    },
    {
      "id": "4981984",
      "outlet": "canteen",
      "date": "2026-01-05",
      "CalendarWeek": "52",
      "day": "Montag",
      "mealtime": "Mittagessen",
      "IdentNr": "12026010598000",
      "itemId": "17549",
      "RecipeID": "4412",
      "ProductPrice": "10.00",
      "ProductPrice_2": null,
      "GastDesc_de": "Couscous | Brokkoli | Spinat-Hummus",
      "GastDesc_en": "Couscous | Broccoli | Spinach Hummus",
      "MenuName": "COUNTER 1.1 Bowls_",
      "allergene": {
        "gluten": "Glutenhaltiges Getreide",
        "sellerie": "Sellerie und Sellerieerzeugnisse",
        "sesam": "Sesamsamen und Sesamsamenerzeugnisse",
        "schwefel": "Schwefeldioxid und Sulfide"
      },
      "merkmale": {
        "veganuary": "Veganuary"
      },
      "naehrstoffe": "",
      "zusatzstoffe": [
        {
          "de": "Süßungsmittel",
          "en": "Sweetener"
        },
        {
          "de": "Phenylalaninquelle",
          "en": "Phenylalanine"
        },
        {
          "de": "Konservierungsstoff",
          "en": "Preservatives"
        }
      ],
      "PrintOrder": "0",
      "CO2Value": "508.00",
      "CO2Rating": "A",
      "CO2Perc": "100.00",
      "ClimateFriendly": "1",
      "GastDesc": "Couscous | Brokkoli | Spinat-Hummus",
      "date_de": "05.01.2026"
    },
    {
      "id": "4981985",
      "outlet": "canteen",
      "date": "2026-01-05",
      "CalendarWeek": "52",
      "day": "Montag",
      "mealtime": "Mittagessen",
      "IdentNr": "12026010598001",
      "itemId": "17550",
      "RecipeID": "4865",
      "ProductPrice": "12.00",
      "ProductPrice_2": null,
      "GastDesc_de": "Rinderschmorbraten | Blaukraut | Spätzle",
      "GastDesc_en": "Braised Beef | Red cabbage | Spätzle",
      "MenuName": "COUNTER 2.1 Meat",
      "allergene": {
        "gluten": "Glutenhaltiges Getreide",
        "huhnerei": "Hühnerei und Hühnereierzeugnisse",
        "milch": "Milch und Milcherzeugnisse",
        "sellerie": "Sellerie und Sellerieerzeugnisse",
        "schwefel": "Schwefeldioxid und Sulfide"
      },
      "merkmale": "",
      "naehrstoffe": "",
      "zusatzstoffe": [
        {
          "de": "Alkohol",
          "en": "Alcohol"
        }
      ],
      "PrintOrder": "1",
      "CO2Value": "7035.00",
      "CO2Rating": "E",
      "CO2Perc": "100.00",
      "ClimateFriendly": null,
      "GastDesc": "Rinderschmorbraten | Blaukraut | Spätzle",
      "date_de": "05.01.2026"
    },
    {
      "id": "4981986",
      "outlet": "canteen",
      "date": "2026-01-05",
      "CalendarWeek": "52",
      "day": "Montag",
      "mealtime": "Mittagessen",
      "IdentNr": "12026010598003",
      "itemId": "17552",
      "RecipeID": "8972",
      "ProductPrice": "12.00",
      "ProductPrice_2": null,
      "GastDesc_de": "Rotbarschfilet | Kartoffel-Blumenkohlpüree | Safranschaum",
      "GastDesc_en": "Redfish | Potato and Cauliflower Purée | Saffron Foam",
      "MenuName": "COUNTER 3.1 Fish",
      "allergene": {
        "fisch": "Fisch und Fischerzeugnisse",
        "milch": "Milch und Milcherzeugnisse",
        "sellerie": "Sellerie und Sellerieerzeugnisse",
        "schwefel": "Schwefeldioxid und Sulfide"
      },
      "merkmale": "",
      "naehrstoffe": "",
      "zusatzstoffe": null,
      "PrintOrder": "3",
      "CO2Value": "1162.00",
      "CO2Rating": "C",
      "CO2Perc": "100.00",
      "ClimateFriendly": null,
      "GastDesc": "Rotbarschfilet | Kartoffel-Blumenkohlpüree | Safranschaum",
      "date_de": "05.01.2026"
    },
    {
      "id": "4981987",
      "outlet": "canteen",
      "date": "2026-01-05",
      "CalendarWeek": "52",
      "day": "Montag",
      "mealtime": "Mittagessen",
      "IdentNr": "12026010598005",
      "itemId": "17554",
      "RecipeID": "2987",
      "ProductPrice": "9.50",
      "ProductPrice_2": null,
      "GastDesc_de": "Gemüsecurry | Kohlrabi | Romanesco*",
      "GastDesc_en": "Vegetable Curry | Cabbage | Romanesco *",
      "MenuName": "COUNTER 4.1 Vegi",
      "allergene": {
        "sellerie": "Sellerie und Sellerieerzeugnisse"
      },
      "merkmale": {
        "veganuary": "Veganuary"
      },
      "naehrstoffe": "",
      "zusatzstoffe": [
        {
          "de": "Süßungsmittel",
          "en": "Sweetener"
        },
        {
          "de": "Phenylalaninquelle",
          "en": "Phenylalanine"
        },
        {
          "de": "Konservierungsstoff",
          "en": "Preservatives"
        }
      ],
      "PrintOrder": "5",
      "CO2Value": "672.00",
      "CO2Rating": "C",
      "CO2Perc": "100.00",
      "ClimateFriendly": null,
      "GastDesc": "Gemüsecurry | Kohlrabi | Romanesco*",
      "date_de": "05.01.2026"
    },
    {
      "id": "4981988",
      "outlet": "canteen",
      "date": "2026-01-05",
      "CalendarWeek": "52",
      "day": "Montag",
      "mealtime": "Abendessen",
      "IdentNr": "12026010598009",
      "itemId": "17558",
      "RecipeID": "4412",
      "ProductPrice": "10.00",
      "ProductPrice_2": null,
      "GastDesc_de": "Couscous | Brokkoli | Spinat-Hummus",
      "GastDesc_en": "Couscous | Broccoli | Spinach Hummus",
      "MenuName": "DINNER BOWL_",
      "allergene": {
        "gluten": "Glutenhaltiges Getreide",
        "sellerie": "Sellerie und Sellerieerzeugnisse",
        "sesam": "Sesamsamen und Sesamsamenerzeugnisse",
        "schwefel": "Schwefeldioxid und Sulfide"
      },
      "merkmale": {
        "veganuary": "Veganuary"
      },
      "naehrstoffe": "",
      "zusatzstoffe": [
        {
          "de": "Süßungsmittel",
          "en": "Sweetener"
        },
        {
          "de": "Phenylalaninquelle",
          "en": "Phenylalanine"
        },
        {
          "de": "Konservierungsstoff",
          "en": "Preservatives"
        }
      ],
      "PrintOrder": "9",
      "CO2Value": "508.00",
      "CO2Rating": "A",
      "CO2Perc": "100.00",
      "ClimateFriendly": "1",
      "GastDesc": "Couscous | Brokkoli | Spinat-Hummus",
      "date_de": "05.01.2026"
    },
    {
      "id": "4981990",
      "outlet": "canteen",
      "date": "2026-01-05",
      "CalendarWeek": "52",
      "day": "Montag",
      "mealtime": "Abendessen",
      "IdentNr": "12026010598010",
      "itemId": "17559",
      "RecipeID": "4865",
      "ProductPrice": "12.00",
      "ProductPrice_2": null,
      "GastDesc_de": "Rinderschmorbraten | Blaukraut | Spätzle",
      "GastDesc_en": "Braised Beef | Red cabbage | Spätzle",
      "MenuName": "DINNER Meat_17:00-19:00",
      "allergene": {
        "gluten": "Glutenhaltiges Getreide",
        "huhnerei": "Hühnerei und Hühnereierzeugnisse",
        "milch": "Milch und Milcherzeugnisse",
        "sellerie": "Sellerie und Sellerieerzeugnisse",
        "schwefel": "Schwefeldioxid und Sulfide"
      },
      "merkmale": "",
      "naehrstoffe": "",
      "zusatzstoffe": [
        {
          "de": "Alkohol",
          "en": "Alcohol"
        }
      ],
      "PrintOrder": "10",
      "CO2Value": "7035.00",
      "CO2Rating": "E",
      "CO2Perc": "100.00",
      "ClimateFriendly": null,
      "GastDesc": "Rinderschmorbraten | Blaukraut | Spätzle",
      "date_de": "05.01.2026"
    },
    {
      "id": "4981992",
      "outlet": "canteen",
      "date": "2026-01-05",
      "CalendarWeek": "52",
      "day": "Montag",
      "mealtime": "Abendessen",
      "IdentNr": "12026010598012",
      "itemId": "17561",
      "RecipeID": "2987",
      "ProductPrice": "9.50",
      "ProductPrice_2": null,
      "GastDesc_de": "Gemüsecurry | Kohlrabi | Romanesco*",
      "GastDesc_en": "Vegetable Curry | Cabbage | Romanesco *",
      "MenuName": "DINNER Vegi/Vegan_17:00-19:00",
      "allergene": {
        "sellerie": "Sellerie und Sellerieerzeugnisse"
      },
      "merkmale": {
        "veganuary": "Veganuary"
      },
      "naehrstoffe": "",
      "zusatzstoffe": [
        {
          "de": "Süßungsmittel",
          "en": "Sweetener"
        },
        {
          "de": "Phenylalaninquelle",
          "en": "Phenylalanine"
        },
        {
          "de": "Konservierungsstoff",
          "en": "Preservatives"
        }
      ],
      "PrintOrder": "12",
      "CO2Value": "672.00",
      "CO2Rating": "C",
      "CO2Perc": "100.00",
      "ClimateFriendly": null,
      "GastDesc": "Gemüsecurry | Kohlrabi | Romanesco*",
      "date_de": "05.01.2026"
    },
    {
      "id": "4981994",
      "outlet": "canteen",
      "date": "2026-01-06",
      "CalendarWeek": "52",
      "day": "Dienstag",
      "mealtime": "Mittagessen",
      "IdentNr": "12026010698000",
      "itemId": "17549",
      "RecipeID": "7575",
      "ProductPrice": "10.00",
      "ProductPrice_2": null,
      "GastDesc_de": "Chili-Pilze | Sesamgurken | Miso-Dressing",
      "GastDesc_en": "Chili mushrooms | Sesame cucumbers | Miso dressing",
      "MenuName": "COUNTER 1.1 Bowls_",
      "allergene": {
        "gluten": "Glutenhaltiges Getreide",
        "soja": "Soja und Sojaerzeugnisse",
        "senf": "Senf und Senferzeugnisse",
        "sesam": "Sesamsamen und Sesamsamenerzeugnisse"
      },
      "merkmale": {
        "veganuary": "Veganuary"
      },
      "naehrstoffe": "",
      "zusatzstoffe": [
        {
          "de": "Geschmacksverstärker",
          "en": "Flavor Enhancer"
        },
        {
          "de": "Konservierungsstoff",
          "en": "Preservatives"
        }
      ],
      "PrintOrder": "0",
      "CO2Value": "773.00",
      "CO2Rating": "B",
      "CO2Perc": "100.00",
      "ClimateFriendly": null,
      "GastDesc": "Chili-Pilze | Sesamgurken | Miso-Dressing",
      "date_de": "06.01.2026"
    },
    {
      "id": "4981995",
      "outlet": "canteen",
      "date": "2026-01-06",
      "CalendarWeek": "52",
      "day": "Dienstag",
      "mealtime": "Mittagessen",
      "IdentNr": "12026010698001",
      "itemId": "17550",
      "RecipeID": "4865",
      "ProductPrice": "12.00",
      "ProductPrice_2": null,
      "GastDesc_de": "Rinderschmorbraten | Blaukraut | Spätzle",
      "GastDesc_en": "Braised Beef | Red cabbage | Spätzle",
      "MenuName": "COUNTER 2.1 Meat",
      "allergene": {
        "gluten": "Glutenhaltiges Getreide",
        "huhnerei": "Hühnerei und Hühnereierzeugnisse",
        "milch": "Milch und Milcherzeugnisse",
        "sellerie": "Sellerie und Sellerieerzeugnisse",
        "schwefel": "Schwefeldioxid und Sulfide"
      },
      "merkmale": "",
      "naehrstoffe": "",
      "zusatzstoffe": [
        {
          "de": "Alkohol",
          "en": "Alcohol"
        }
      ],
      "PrintOrder": "1",
      "CO2Value": "7035.00",
      "CO2Rating": "E",
      "CO2Perc": "100.00",
      "ClimateFriendly": null,
      "GastDesc": "Rinderschmorbraten | Blaukraut | Spätzle",
      "date_de": "06.01.2026"
    },
    {
      "id": "4981996",
      "outlet": "canteen",
      "date": "2026-01-06",
      "CalendarWeek": "52",
      "day": "Dienstag",
      "mealtime": "Mittagessen",
      "IdentNr": "12026010698003",
      "itemId": "17552",
      "RecipeID": "8972",
      "ProductPrice": "12.00",
      "ProductPrice_2": null,
      "GastDesc_de": "Rotbarschfilet | Kartoffel-Blumenkohlpüree | Safranschaum",
      "GastDesc_en": "Redfish | Potato and Cauliflower Purée | Saffron Foam",
      "MenuName": "COUNTER 3.1 Fish",
      "allergene": {
        "fisch": "Fisch und Fischerzeugnisse",
        "milch": "Milch und Milcherzeugnisse",
        "sellerie": "Sellerie und Sellerieerzeugnisse",
        "schwefel": "Schwefeldioxid und Sulfide"
      },
      "merkmale": "",
      "naehrstoffe": "",
      "zusatzstoffe": null,
      "PrintOrder": "3",
      "CO2Value": "1162.00",
      "CO2Rating": "C",
      "CO2Perc": "100.00",
      "ClimateFriendly": null,
      "GastDesc": "Rotbarschfilet | Kartoffel-Blumenkohlpüree | Safranschaum",
      "date_de": "06.01.2026"
    },
    {
      "id": "4981997",
      "outlet": "canteen",
      "date": "2026-01-06",
      "CalendarWeek": "52",
      "day": "Dienstag",
      "mealtime": "Mittagessen",
      "IdentNr": "12026010698005",
      "itemId": "17554",
      "RecipeID": "9089",
      "ProductPrice": "9.50",
      "ProductPrice_2": null,
      "GastDesc_de": "Maple Miso Süßkartoffel | Tofu | Grünkohl",
      "GastDesc_en": "Maple Miso Sweet Potatoes | Tofu | Kale",
      "MenuName": "COUNTER 4.1 Vegi",
      "allergene": {
        "soja": "Soja und Sojaerzeugnisse",
        "sellerie": "Sellerie und Sellerieerzeugnisse",
        "senf": "Senf und Senferzeugnisse",
        "schwefel": "Schwefeldioxid und Sulfide"
      },
      "merkmale": {
        "veganuary": "Veganuary"
      },
      "naehrstoffe": "",
      "zusatzstoffe": null,
      "PrintOrder": "5",
      "CO2Value": "354.00",
      "CO2Rating": "A",
      "CO2Perc": "100.00",
      "ClimateFriendly": "1",
      "GastDesc": "Maple Miso Süßkartoffel | Tofu | Grünkohl",
      "date_de": "06.01.2026"
    },
    {
      "id": "4981998",
      "outlet": "canteen",
      "date": "2026-01-06",
      "CalendarWeek": "52",
      "day": "Dienstag",
      "mealtime": "Abendessen",
      "IdentNr": "12026010698009",
      "itemId": "17558",
      "RecipeID": "7575",
      "ProductPrice": "10.00",
      "ProductPrice_2": null,
      "GastDesc_de": "Chili-Pilze | Sesamgurken | Miso-Dressing",
      "GastDesc_en": "Chili mushrooms | Sesame cucumbers | Miso dressing",
      "MenuName": "DINNER BOWL_",
      "allergene": {
        "gluten": "Glutenhaltiges Getreide",
        "soja": "Soja und Sojaerzeugnisse",
        "senf": "Senf und Senferzeugnisse",
        "sesam": "Sesamsamen und Sesamsamenerzeugnisse"
      },
      "merkmale": {
        "veganuary": "Veganuary"
      },
      "naehrstoffe": "",
      "zusatzstoffe": [
        {
          "de": "Geschmacksverstärker",
          "en": "Flavor Enhancer"
        },
        {
          "de": "Konservierungsstoff",
          "en": "Preservatives"
        }
      ],
      "PrintOrder": "9",
      "CO2Value": "773.00",
      "CO2Rating": "B",
      "CO2Perc": "100.00",
      "ClimateFriendly": null,
      "GastDesc": "Chili-Pilze | Sesamgurken | Miso-Dressing",
      "date_de": "06.01.2026"
    },
    {
      "id": "4982000",
      "outlet": "canteen",
      "date": "2026-01-06",
      "CalendarWeek": "52",
      "day": "Dienstag",
      "mealtime": "Abendessen",
      "IdentNr": "12026010698011",
      "itemId": "17560",
      "RecipeID": "8972",
      "ProductPrice": "12.00",
      "ProductPrice_2": null,
      "GastDesc_de": "Rotbarschfilet | Kartoffel-Blumenkohlpüree | Safranschaum",
      "GastDesc_en": "Redfish | Potato and Cauliflower Purée | Saffron Foam",
      "MenuName": "DINNER Fish_17:00-19:00",
      "allergene": {
        "fisch": "Fisch und Fischerzeugnisse",
        "milch": "Milch und Milcherzeugnisse",
        "sellerie": "Sellerie und Sellerieerzeugnisse",
        "schwefel": "Schwefeldioxid und Sulfide"
      },
      "merkmale": "",
      "naehrstoffe": "",
      "zusatzstoffe": null,
      "PrintOrder": "11",
      "CO2Value": "1162.00",
      "CO2Rating": "C",
      "CO2Perc": "100.00",
      "ClimateFriendly": null,
      "GastDesc": "Rotbarschfilet | Kartoffel-Blumenkohlpüree | Safranschaum",
      "date_de": "06.01.2026"
    },
    {
      "id": "4982002",
      "outlet": "canteen",
      "date": "2026-01-06",
      "CalendarWeek": "52",
      "day": "Dienstag",
      "mealtime": "Abendessen",
      "IdentNr": "12026010698012",
      "itemId": "17561",
      "RecipeID": "9089",
      "ProductPrice": "9.50",
      "ProductPrice_2": null,
      "GastDesc_de": "Maple Miso Süßkartoffel | Tofu | Grünkohl",
      "GastDesc_en": "Maple Miso Sweet Potatoes | Tofu | Kale",
      "MenuName": "DINNER Vegi/Vegan_17:00-19:00",
      "allergene": {
        "soja": "Soja und Sojaerzeugnisse",
        "sellerie": "Sellerie und Sellerieerzeugnisse",
        "senf": "Senf und Senferzeugnisse",
        "schwefel": "Schwefeldioxid und Sulfide"
      },
      "merkmale": {
        "veganuary": "Veganuary"
      },
      "naehrstoffe": "",
      "zusatzstoffe": null,
      "PrintOrder": "12",
      "CO2Value": "354.00",
      "CO2Rating": "A",
      "CO2Perc": "100.00",
      "ClimateFriendly": "1",
      "GastDesc": "Maple Miso Süßkartoffel | Tofu | Grünkohl",
      "date_de": "06.01.2026"
    },
    {
      "id": "4982004",
      "outlet": "canteen",
      "date": "2026-01-07",
      "CalendarWeek": "52",
      "day": "Mittwoch",
      "mealtime": "Mittagessen",
      "IdentNr": "12026010798000",
      "itemId": "17549",
      "RecipeID": "4250",
      "ProductPrice": "10.00",
      "ProductPrice_2": null,
      "GastDesc_de": "Falafel | Mandeln | Couscous",
      "GastDesc_en": "Falafel | Almonds | Couscous",
      "MenuName": "COUNTER 1.1 Bowls_",
      "allergene": {
        "gluten": "Glutenhaltiges Getreide",
        "schalenfruchte": "Schalenfrüchte und Schalenfruchterzeugnisse",
        "milch": "Milch und Milcherzeugnisse",
        "sellerie": "Sellerie und Sellerieerzeugnisse",
        "schwefel": "Schwefeldioxid und Sulfide"
      },
      "merkmale": {
        "veganuary": "Veganuary"
      },
      "naehrstoffe": "",
      "zusatzstoffe": [
        {
          "de": "Antioxidationsmittel",
          "en": "Antioxidation"
        },
        {
          "de": "Alkohol",
          "en": "Alcohol"
        }
      ],
      "PrintOrder": "0",
      "CO2Value": "454.00",
      "CO2Rating": "B",
      "CO2Perc": "100.00",
      "ClimateFriendly": null,
      "GastDesc": "Falafel | Mandeln | Couscous",
      "date_de": "07.01.2026"
    },
    {
      "id": "4982005",
      "outlet": "canteen",
      "date": "2026-01-07",
      "CalendarWeek": "52",
      "day": "Mittwoch",
      "mealtime": "Mittagessen",
      "IdentNr": "12026010798001",
      "itemId": "17550",
      "RecipeID": "4865",
      "ProductPrice": "12.00",
      "ProductPrice_2": null,
      "GastDesc_de": "Rinderschmorbraten | Blaukraut | Spätzle",
      "GastDesc_en": "Braised Beef | Red cabbage | Spätzle",
      "MenuName": "COUNTER 2.1 Meat",
      "allergene": {
        "gluten": "Glutenhaltiges Getreide",
        "huhnerei": "Hühnerei und Hühnereierzeugnisse",
        "milch": "Milch und Milcherzeugnisse",
        "sellerie": "Sellerie und Sellerieerzeugnisse",
        "schwefel": "Schwefeldioxid und Sulfide"
      },
      "merkmale": "",
      "naehrstoffe": "",
      "zusatzstoffe": [
        {
          "de": "Alkohol",
          "en": "Alcohol"
        }
      ],
      "PrintOrder": "1",
      "CO2Value": "7035.00",
      "CO2Rating": "E",
      "CO2Perc": "100.00",
      "ClimateFriendly": null,
      "GastDesc": "Rinderschmorbraten | Blaukraut | Spätzle",
      "date_de": "07.01.2026"
    },
    {
      "id": "4982006",
      "outlet": "canteen",
      "date": "2026-01-07",
      "CalendarWeek": "52",
      "day": "Mittwoch",
      "mealtime": "Mittagessen",
      "IdentNr": "12026010798003",
      "itemId": "17552",
      "RecipeID": "7576",
      "ProductPrice": "12.00",
      "ProductPrice_2": null,
      "GastDesc_de": "Lachs | Reisnudeln | Rote Bete | Fenchel",
      "GastDesc_en": "Salmon | Rice Noodles | Beetroot | Fennel",
      "MenuName": "COUNTER 3.1 Fish",
      "allergene": {
        "gluten": "Glutenhaltiges Getreide",
        "fisch": "Fisch und Fischerzeugnisse",
        "milch": "Milch und Milcherzeugnisse",
        "sellerie": "Sellerie und Sellerieerzeugnisse",
        "schwefel": "Schwefeldioxid und Sulfide"
      },
      "merkmale": "",
      "naehrstoffe": "",
      "zusatzstoffe": [
        {
          "de": "Antioxidationsmittel",
          "en": "Antioxidation"
        },
        {
          "de": "Alkohol",
          "en": "Alcohol"
        }
      ],
      "PrintOrder": "3",
      "CO2Value": "1193.00",
      "CO2Rating": "B",
      "CO2Perc": "100.00",
      "ClimateFriendly": null,
      "GastDesc": "Lachs | Reisnudeln | Rote Bete | Fenchel",
      "date_de": "07.01.2026"
    },
    {
      "id": "4982007",
      "outlet": "canteen",
      "date": "2026-01-07",
      "CalendarWeek": "52",
      "day": "Mittwoch",
      "mealtime": "Mittagessen",
      "IdentNr": "12026010798005",
      "itemId": "17554",
      "RecipeID": "7035",
      "ProductPrice": "9.50",
      "ProductPrice_2": null,
      "GastDesc_de": "Tortellini Verdura | Tomate | Basilikum",
      "GastDesc_en": "Tortellini Verdura | Tomato | Basil",
      "MenuName": "COUNTER 4.1 Vegi",
      "allergene": {
        "gluten": "Glutenhaltiges Getreide",
        "milch": "Milch und Milcherzeugnisse",
        "sellerie": "Sellerie und Sellerieerzeugnisse"
      },
      "merkmale": {
        "veganuary": "Veganuary"
      },
      "naehrstoffe": "",
      "zusatzstoffe": null,
      "PrintOrder": "5",
      "CO2Value": "248.00",
      "CO2Rating": "A",
      "CO2Perc": "100.00",
      "ClimateFriendly": "1",
      "GastDesc": "Tortellini Verdura | Tomate | Basilikum",
      "date_de": "07.01.2026"
    },
    {
      "id": "4982008",
      "outlet": "canteen",
      "date": "2026-01-07",
      "CalendarWeek": "52",
      "day": "Mittwoch",
      "mealtime": "Abendessen",
      "IdentNr": "12026010798009",
      "itemId": "17558",
      "RecipeID": "4250",
      "ProductPrice": "10.00",
      "ProductPrice_2": null,
      "GastDesc_de": "Falafel | Mandeln | Couscous",
      "GastDesc_en": "Falafel | Almonds | Couscous",
      "MenuName": "DINNER BOWL_",
      "allergene": {
        "gluten": "Glutenhaltiges Getreide",
        "schalenfruchte": "Schalenfrüchte und Schalenfruchterzeugnisse",
        "milch": "Milch und Milcherzeugnisse",
        "sellerie": "Sellerie und Sellerieerzeugnisse",
        "schwefel": "Schwefeldioxid und Sulfide"
      },
      "merkmale": {
        "veganuary": "Veganuary"
      },
      "naehrstoffe": "",
      "zusatzstoffe": [
        {
          "de": "Antioxidationsmittel",
          "en": "Antioxidation"
        },
        {
          "de": "Alkohol",
          "en": "Alcohol"
        }
      ],
      "PrintOrder": "9",
      "CO2Value": "454.00",
      "CO2Rating": "B",
      "CO2Perc": "100.00",
      "ClimateFriendly": null,
      "GastDesc": "Falafel | Mandeln | Couscous",
      "date_de": "07.01.2026"
    },
    {
      "id": "4982010",
      "outlet": "canteen",
      "date": "2026-01-07",
      "CalendarWeek": "52",
      "day": "Mittwoch",
      "mealtime": "Abendessen",
      "IdentNr": "12026010798010",
      "itemId": "17559",
      "RecipeID": "4865",
      "ProductPrice": "12.00",
      "ProductPrice_2": null,
      "GastDesc_de": "Rinderschmorbraten | Blaukraut | Spätzle",
      "GastDesc_en": "Braised Beef | Red cabbage | Spätzle",
      "MenuName": "DINNER Meat_17:00-19:00",
      "allergene": {
        "gluten": "Glutenhaltiges Getreide",
        "huhnerei": "Hühnerei und Hühnereierzeugnisse",
        "milch": "Milch und Milcherzeugnisse",
        "sellerie": "Sellerie und Sellerieerzeugnisse",
        "schwefel": "Schwefeldioxid und Sulfide"
      },
      "merkmale": "",
      "naehrstoffe": "",
      "zusatzstoffe": [
        {
          "de": "Alkohol",
          "en": "Alcohol"
        }
      ],
      "PrintOrder": "10",
      "CO2Value": "7035.00",
      "CO2Rating": "E",
      "CO2Perc": "100.00",
      "ClimateFriendly": null,
      "GastDesc": "Rinderschmorbraten | Blaukraut | Spätzle",
      "date_de": "07.01.2026"
    },
    {
      "id": "4982012",
      "outlet": "canteen",
      "date": "2026-01-07",
      "CalendarWeek": "52",
      "day": "Mittwoch",
      "mealtime": "Abendessen",
      "IdentNr": "12026010798012",
      "itemId": "17561",
      "RecipeID": "7035",
      "ProductPrice": "9.50",
      "ProductPrice_2": null,
      "GastDesc_de": "Tortellini Verdura | Tomate | Basilikum",
      "GastDesc_en": "Tortellini Verdura | Tomato | Basil",
      "MenuName": "DINNER Vegi/Vegan_17:00-19:00",
      "allergene": {
        "gluten": "Glutenhaltiges Getreide",
        "milch": "Milch und Milcherzeugnisse",
        "sellerie": "Sellerie und Sellerieerzeugnisse"
      },
      "merkmale": {
        "veganuary": "Veganuary"
      },
      "naehrstoffe": "",
      "zusatzstoffe": null,
      "PrintOrder": "12",
      "CO2Value": "248.00",
      "CO2Rating": "A",
      "CO2Perc": "100.00",
      "ClimateFriendly": "1",
      "GastDesc": "Tortellini Verdura | Tomate | Basilikum",
      "date_de": "07.01.2026"
    },
    {
      "id": "4982014",
      "outlet": "canteen",
      "date": "2026-01-08",
      "CalendarWeek": "52",
      "day": "Donnerstag",
      "mealtime": "Mittagessen",
      "IdentNr": "12026010898000",
      "itemId": "17549",
      "RecipeID": "8703",
      "ProductPrice": "11.00",
      "ProductPrice_2": null,
      "GastDesc_de": "Vegane Bibimbap | Sojasprossen | Zucchini",
      "GastDesc_en": "Vegan Bibimbap | Beansprouts | Courgette",
      "MenuName": "COUNTER 1.1 Bowls_",
      "allergene": {
        "gluten": "Glutenhaltiges Getreide",
        "soja": "Soja und Sojaerzeugnisse",
        "sesam": "Sesamsamen und Sesamsamenerzeugnisse",
        "schwefel": "Schwefeldioxid und Sulfide"
      },
      "merkmale": {
        "veganuary": "Veganuary"
      },
      "naehrstoffe": "",
      "zusatzstoffe": [
        {
          "de": "Süßungsmittel",
          "en": "Sweetener"
        },
        {
          "de": "Phenylalaninquelle",
          "en": "Phenylalanine"
        },
        {
          "de": "Konservierungsstoff",
          "en": "Preservatives"
        },
        {
          "de": "Alkohol",
          "en": "Alcohol"
        }
      ],
      "PrintOrder": "0",
      "CO2Value": "828.00",
      "CO2Rating": "A",
      "CO2Perc": "100.00",
      "ClimateFriendly": "1",
      "GastDesc": "Vegane Bibimbap | Sojasprossen | Zucchini",
      "date_de": "08.01.2026"
    },
    {
      "id": "4982015",
      "outlet": "canteen",
      "date": "2026-01-08",
      "CalendarWeek": "52",
      "day": "Donnerstag",
      "mealtime": "Mittagessen",
      "IdentNr": "12026010898001",
      "itemId": "17550",
      "RecipeID": "8438",
      "ProductPrice": "12.00",
      "ProductPrice_2": null,
      "GastDesc_de": "Lammhüfte | Maispolenta | Peperonate | Rosmarin",
      "GastDesc_en": "Lamb Rump | corn polenta | peperonata | rosemary",
      "MenuName": "COUNTER 2.1 Meat",
      "allergene": {
        "huhnerei": "Hühnerei und Hühnereierzeugnisse",
        "milch": "Milch und Milcherzeugnisse",
        "sellerie": "Sellerie und Sellerieerzeugnisse",
        "schwefel": "Schwefeldioxid und Sulfide"
      },
      "merkmale": "",
      "naehrstoffe": "",
      "zusatzstoffe": [
        {
          "de": "Alkohol",
          "en": "Alcohol"
        }
      ],
      "PrintOrder": "1",
      "CO2Value": "6757.00",
      "CO2Rating": "E",
      "CO2Perc": "100.00",
      "ClimateFriendly": null,
      "GastDesc": "Lammhüfte | Maispolenta | Peperonate | Rosmarin",
      "date_de": "08.01.2026"
    },
    {
      "id": "4982016",
      "outlet": "canteen",
      "date": "2026-01-08",
      "CalendarWeek": "52",
      "day": "Donnerstag",
      "mealtime": "Mittagessen",
      "IdentNr": "12026010898003",
      "itemId": "17552",
      "RecipeID": "7576",
      "ProductPrice": "12.00",
      "ProductPrice_2": null,
      "GastDesc_de": "Lachs | Reisnudeln | Rote Bete | Fenchel",
      "GastDesc_en": "Salmon | Rice Noodles | Beetroot | Fennel",
      "MenuName": "COUNTER 3.1 Fish",
      "allergene": {
        "gluten": "Glutenhaltiges Getreide",
        "fisch": "Fisch und Fischerzeugnisse",
        "milch": "Milch und Milcherzeugnisse",
        "sellerie": "Sellerie und Sellerieerzeugnisse",
        "schwefel": "Schwefeldioxid und Sulfide"
      },
      "merkmale": "",
      "naehrstoffe": "",
      "zusatzstoffe": [
        {
          "de": "Antioxidationsmittel",
          "en": "Antioxidation"
        },
        {
          "de": "Alkohol",
          "en": "Alcohol"
        }
      ],
      "PrintOrder": "3",
      "CO2Value": "1193.00",
      "CO2Rating": "B",
      "CO2Perc": "100.00",
      "ClimateFriendly": null,
      "GastDesc": "Lachs | Reisnudeln | Rote Bete | Fenchel",
      "date_de": "08.01.2026"
    },
    {
      "id": "4982017",
      "outlet": "canteen",
      "date": "2026-01-08",
      "CalendarWeek": "52",
      "day": "Donnerstag",
      "mealtime": "Mittagessen",
      "IdentNr": "12026010898005",
      "itemId": "17554",
      "RecipeID": "6758",
      "ProductPrice": "10.00",
      "ProductPrice_2": null,
      "GastDesc_de": "Süßkartoffel | Avocado | Tzatziki",
      "GastDesc_en": "Sweet Potato | Avocado | Tzatziki",
      "MenuName": "COUNTER 4.1 Vegi",
      "allergene": {
        "schwefel": "Schwefeldioxid und Sulfide"
      },
      "merkmale": {
        "vegan": "Vegan",
        "vegetarisch": "Vegetarisch"
      },
      "naehrstoffe": "",
      "zusatzstoffe": null,
      "PrintOrder": "5",
      "CO2Value": "434.00",
      "CO2Rating": "A",
      "CO2Perc": "100.00",
      "ClimateFriendly": "1",
      "GastDesc": "Süßkartoffel | Avocado | Tzatziki",
      "date_de": "08.01.2026"
    },
    {
      "id": "4982018",
      "outlet": "canteen",
      "date": "2026-01-08",
      "CalendarWeek": "52",
      "day": "Donnerstag",
      "mealtime": "Abendessen",
      "IdentNr": "12026010898009",
      "itemId": "17558",
      "RecipeID": "8703",
      "ProductPrice": "11.00",
      "ProductPrice_2": null,
      "GastDesc_de": "Vegane Bibimbap | Sojasprossen | Zucchini",
      "GastDesc_en": "Vegan Bibimbap | Beansprouts | Courgette",
      "MenuName": "DINNER BOWL_",
      "allergene": {
        "gluten": "Glutenhaltiges Getreide",
        "soja": "Soja und Sojaerzeugnisse",
        "sesam": "Sesamsamen und Sesamsamenerzeugnisse",
        "schwefel": "Schwefeldioxid und Sulfide"
      },
      "merkmale": {
        "veganuary": "Veganuary"
      },
      "naehrstoffe": "",
      "zusatzstoffe": [
        {
          "de": "Süßungsmittel",
          "en": "Sweetener"
        },
        {
          "de": "Phenylalaninquelle",
          "en": "Phenylalanine"
        },
        {
