{
  "daySelector": [
    {
      "date": "2025-11-03",
      "day": "Montag",
      "CalendarWeek": "45",
      "date_de": "03.11.2025"
    },
    {
      "date": "2025-11-04",
      "day": "Dienstag",
      "CalendarWeek": "45",
      "date_de": "04.11.2025"
    },
    {
      "date": "2025-11-05",
      "day": "Mittwoch",
      "CalendarWeek": "45",
      "date_de": "05.11.2025"
    },
    {
      "date": "2025-11-06",
      "day": "Donnerstag",
      "CalendarWeek": "45",
      "date_de": "06.11.2025"
    },
    {
      "date": "2025-11-07",
      "day": "Freitag",
      "CalendarWeek": "45",
      "date_de": "07.11.2025"
    },
    {
      "date": "2025-11-08",
      "day": "Samstag",
      "CalendarWeek": "45",
      "date_de": "08.11.2025"
    },
    {
      "date": "2025-11-09",
      "day": "Sonntag",
      "CalendarWeek": "45",
      "date_de": "09.11.2025"
    },
    {
      "date": "2025-11-10",
      "day": "Montag",
      "CalendarWeek": "45",
      "date_de": "10.11.2025"
    },
    {
      "date": "2025-11-11",
      "day": "Dienstag",
      "CalendarWeek": "45",
      "date_de": "11.11.2025"
    },
    {
      "date": "2025-11-12",
      "day": "Mittwoch",
      "CalendarWeek": "45",
      "date_de": "12.11.2025"
    },
    {
      "date": "2025-11-13",
      "day": "Donnerstag",
      "CalendarWeek": "45",
      "date_de": "13.11.2025"
    },
    {
      "date": "2025-11-14",
      "day": "Freitag",
      "CalendarWeek": "45",
      "date_de": "14.11.2025"
    }
  ],
  "data": [
    {
      "id": "4296406",
      "outlet": "cafe",
      "date": "2025-11-03",
      "CalendarWeek": "45",
      "day": "Montag",
      "mealtime": "Mittagessen",
      "IdentNr": "12025110398000",
      "itemId": "21060",
      "RecipeID": "9038",
      "ProductPrice": "3.00",
      "ProductPrice_2": null,
      "GastDesc_de": "Schoko-Zimt-Knoten | Vegan",
      "GastDesc_en": "Chocolate-cinnamon pastry knot | vegan",
      "MenuName": "CHOCOLATE",
      "allergene": {
        "gluten": "Glutenhaltiges Getreide",
        "schalenfruchte": "Schalenfrüchte und Schalenfruchterzeugnisse",
        "soja": "Soja und Sojaerzeugnisse",
        "sesam": "Sesamsamen und Sesamsamenerzeugnisse"
      },
      "merkmale": "",
      "naehrstoffe": "",
      "zusatzstoffe": null,
      "PrintOrder": "0",
      "CO2Value": null,
      "CO2Rating": null,
      "CO2Perc": null,
      "ClimateFriendly": null,
      "GastDesc": "Schoko-Zimt-Knoten | Vegan",
      "date_de": "03.11.2025"
    },
    {
      "id": "4296407",
      "outlet": "cafe",
      "date": "2025-11-03",
      "CalendarWeek": "45",
      "day": "Montag",
      "mealtime": "Mittagessen",
      "IdentNr": "12025110398002",
      "itemId": "21062",
      "RecipeID": "8871",
      "ProductPrice": "3.60",
      "ProductPrice_2": null,
      "GastDesc_de": "Baskischer Cheesecake mit Birnenkompott",
      "GastDesc_en": "Basque cheesecake with Pear Compote",
      "MenuName": "FAVOURITES",
      "allergene": {
        "huhnerei": "Hühnerei und Hühnereierzeugnisse",
        "milch": "Milch und Milcherzeugnisse"
      },
      "merkmale": "",
      "naehrstoffe": "",
      "zusatzstoffe": [
        {
          "de": "Farbstoff",
          "en": "Colouring Agent"
        },
        {
          "de": "Alkohol",
          "en": "Alcohol"
        }
      ],
      "PrintOrder": "2",
      "CO2Value": null,
      "CO2Rating": null,
      "CO2Perc": null,
      "ClimateFriendly": null,
      "GastDesc": "Baskischer Cheesecake mit Birnenkompott",
      "date_de": "03.11.2025"
    },
    {
      "id": "4296408",
      "outlet": "cafe",
      "date": "2025-11-03",
      "CalendarWeek": "45",
      "day": "Montag",
      "mealtime": "Mittagessen",
      "IdentNr": "12025110398003",
      "itemId": "21063",
      "RecipeID": "8211",
      "ProductPrice": "0.50",
      "ProductPrice_2": null,
      "GastDesc_de": "LES ARLETTES (Französische Blätterteigkekse) Vegan",
      "GastDesc_en": "LES ARLETTES  (French Puff Pastry Cookies) Vegan",
      "MenuName": "MINIS",
      "allergene": {
        "gluten": "Glutenhaltiges Getreide"
      },
      "merkmale": {
        "vegan": "Vegan",
        "vegetarisch": "Vegetarisch"
      },
      "naehrstoffe": "",
      "zusatzstoffe": [
        {
          "de": "Farbstoff",
          "en": "Colouring Agent"
        },
        {
          "de": "Alkohol",
          "en": "Alcohol"
        }
      ],
      "PrintOrder": "3",
      "CO2Value": null,
      "CO2Rating": null,
      "CO2Perc": null,
      "ClimateFriendly": null,
      "GastDesc": "LES ARLETTES (Französische Blätterteigkekse) Vegan",
      "date_de": "03.11.2025"
    },
    {
      "id": "4296409",
      "outlet": "cafe",
      "date": "2025-11-03",
      "CalendarWeek": "45",
      "day": "Montag",
      "mealtime": "Mittagessen",
      "IdentNr": "12025110398004",
      "itemId": "21058",
      "RecipeID": "7719",
      "ProductPrice": "3.10",
      "ProductPrice_2": null,
      "GastDesc_de": "Red Velvet Cupcake mit Cream Cheese Frosting",
      "GastDesc_en": "Red Velvet Cupcake with Cream Cheese Frosting",
      "MenuName": "OPEN",
      "allergene": {
        "gluten": "Glutenhaltiges Getreide",
        "huhnerei": "Hühnerei und Hühnereierzeugnisse",
        "milch": "Milch und Milcherzeugnisse"
      },
      "merkmale": "",
      "naehrstoffe": "",
      "zusatzstoffe": [
        {
          "de": "Farbstoff",
          "en": "Colouring Agent"
        },
        {
          "de": "Alkohol",
          "en": "Alcohol"
        }
      ],
      "PrintOrder": "4",
      "CO2Value": null,
      "CO2Rating": null,
      "CO2Perc": null,
      "ClimateFriendly": null,
      "GastDesc": "Red Velvet Cupcake mit Cream Cheese Frosting",
      "date_de": "03.11.2025"
    },
    {
      "id": "4296410",
      "outlet": "cafe",
      "date": "2025-11-03",
      "CalendarWeek": "45",
      "day": "Montag",
      "mealtime": "Mittagessen",
      "IdentNr": "12025110398005",
      "itemId": "21064",
      "RecipeID": "8330",
      "ProductPrice": "1.50",
      "ProductPrice_2": null,
      "GastDesc_de": "Saftige Brownie-Bananen-Cookies | Zuckerfrei",
      "GastDesc_en": "Fudgy Brownie Banana Cookies | Sugar-Free",
      "MenuName": "PEOPLES CHOICE",
      "allergene": {
        "erdnuss": "Erdnüsse und Erdnusserzeugnisse"
      },
      "merkmale": {
        "ohne_zucker": "Ohne_Zucker",
        "vegan": "Vegan",
        "vegetarisch": "Vegetarisch"
      },
      "naehrstoffe": "",
      "zusatzstoffe": null,
      "PrintOrder": "5",
      "CO2Value": null,
      "CO2Rating": null,
      "CO2Perc": null,
      "ClimateFriendly": null,
      "GastDesc": "Saftige Brownie-Bananen-Cookies | Zuckerfrei",
      "date_de": "03.11.2025"
    },
    {
      "id": "4296411",
      "outlet": "cafe",
      "date": "2025-11-03",
      "CalendarWeek": "45",
      "day": "Montag",
      "mealtime": "Mittagessen",
      "IdentNr": "12025110398006",
      "itemId": "21061",
      "RecipeID": "9036",
      "ProductPrice": "2.70",
      "ProductPrice_2": null,
      "GastDesc_de": "Kürbis-Bananenbrot mit Walnüssen | Zuckerfrei",
      "GastDesc_en": "Pumpkin-banana bread with walnuts | Sugar-free",
      "MenuName": "SEASON",
      "allergene": {
        "gluten": "Glutenhaltiges Getreide",
        "schalenfruchte": "Schalenfrüchte und Schalenfruchterzeugnisse",
        "huhnerei": "Hühnerei und Hühnereierzeugnisse",
        "milch": "Milch und Milcherzeugnisse"
      },
      "merkmale": "",
      "naehrstoffe": "",
      "zusatzstoffe": null,
      "PrintOrder": "6",
      "CO2Value": null,
      "CO2Rating": null,
      "CO2Perc": null,
      "ClimateFriendly": null,
      "GastDesc": "Kürbis-Bananenbrot mit Walnüssen | Zuckerfrei",
      "date_de": "03.11.2025"
    },
    {
      "id": "4296412",
      "outlet": "cafe",
      "date": "2025-11-03",
      "CalendarWeek": "45",
      "day": "Montag",
      "mealtime": "Mittagessen",
      "IdentNr": "12025110398007",
      "itemId": "12776",
      "RecipeID": "9037",
      "ProductPrice": "2.50",
      "ProductPrice_2": null,
      "GastDesc_de": "Biscoff Karamell \"Apple Pie\" Cookie | Vegan",
      "GastDesc_en": "Biscoff Caramel \"Apple Pie\" Cookie | Vegan",
      "MenuName": "COOKIE",
      "allergene": {
        "gluten": "Glutenhaltiges Getreide"
      },
      "merkmale": "",
      "naehrstoffe": "",
      "zusatzstoffe": [
        {
          "de": "Farbstoff",
          "en": "Colouring Agent"
        },
        {
          "de": "Antioxidationsmittel",
          "en": "Antioxidation"
        },
        {
          "de": "Alkohol",
          "en": "Alcohol"
        }
      ],
      "PrintOrder": "7",
      "CO2Value": null,
      "CO2Rating": null,
      "CO2Perc": null,
      "ClimateFriendly": null,
      "GastDesc": "Biscoff Karamell \"Apple Pie\" Cookie | Vegan",
      "date_de": "03.11.2025"
    },
    {
      "id": "4296413",
      "outlet": "cafe",
      "date": "2025-11-03",
      "CalendarWeek": "45",
      "day": "Montag",
      "mealtime": "Mittagessen",
      "IdentNr": "12025110398009",
      "itemId": "12773",
      "RecipeID": "9043",
      "ProductPrice": "3.00",
      "ProductPrice_2": null,
      "GastDesc_de": "Schwedischer Mandelkuchen",
      "GastDesc_en": "Traditional Swedish almond cake",
      "MenuName": "CLASSICS",
      "allergene": {
        "schalenfruchte": "Schalenfrüchte und Schalenfruchterzeugnisse",
        "huhnerei": "Hühnerei und Hühnereierzeugnisse",
        "milch": "Milch und Milcherzeugnisse"
      },
      "merkmale": "",
      "naehrstoffe": "",
      "zusatzstoffe": null,
      "PrintOrder": "9",
      "CO2Value": null,
      "CO2Rating": null,
      "CO2Perc": null,
      "ClimateFriendly": null,
      "GastDesc": "Schwedischer Mandelkuchen",
      "date_de": "03.11.2025"
    },
    {
      "id": "4296414",
      "outlet": "cafe",
      "date": "2025-11-03",
      "CalendarWeek": "45",
      "day": "Montag",
      "mealtime": "Mittagessen",
      "IdentNr": "12025110398011",
      "itemId": "16256",
      "RecipeID": "8775",
      "ProductPrice": "1.50",
      "ProductPrice_2": null,
      "GastDesc_de": "Schwedische Haferkekse | Vegan",
      "GastDesc_en": "Swedish Style Oatmeal Cookies | Vegan",
      "MenuName": "VEGAN SPECIAL",
      "allergene": {
        "gluten": "Glutenhaltiges Getreide"
      },
      "merkmale": {
        "vegan": "Vegan",
        "vegetarisch": "Vegetarisch"
      },
      "naehrstoffe": "",
      "zusatzstoffe": [
        {
          "de": "Farbstoff",
          "en": "Colouring Agent"
        },
        {
          "de": "Antioxidationsmittel",
          "en": "Antioxidation"
        },
        {
          "de": "Alkohol",
          "en": "Alcohol"
        }
      ],
      "PrintOrder": "11",
      "CO2Value": null,
      "CO2Rating": null,
      "CO2Perc": null,
      "ClimateFriendly": null,
      "GastDesc": "Schwedische Haferkekse | Vegan",
      "date_de": "03.11.2025"
    },
    {
      "id": "4311151",
      "outlet": "cafe",
      "date": "2025-11-04",
      "CalendarWeek": "45",
      "day": "Dienstag",
      "mealtime": "Mittagessen",
      "IdentNr": "12025110498000",
      "itemId": "21060",
      "RecipeID": "9038",
      "ProductPrice": "3.00",
      "ProductPrice_2": null,
      "GastDesc_de": "Schoko-Zimt-Knoten | Vegan",
      "GastDesc_en": "Chocolate-cinnamon pastry knot | vegan",
      "MenuName": "CHOCOLATE",
      "allergene": {
        "gluten": "Glutenhaltiges Getreide",
        "schalenfruchte": "Schalenfrüchte und Schalenfruchterzeugnisse",
        "soja": "Soja und Sojaerzeugnisse",
        "sesam": "Sesamsamen und Sesamsamenerzeugnisse"
      },
      "merkmale": "",
      "naehrstoffe": "",
      "zusatzstoffe": null,
      "PrintOrder": "0",
      "CO2Value": null,
      "CO2Rating": null,
      "CO2Perc": null,
      "ClimateFriendly": null,
      "GastDesc": "Schoko-Zimt-Knoten | Vegan",
      "date_de": "04.11.2025"
    },
    {
      "id": "4311152",
      "outlet": "cafe",
      "date": "2025-11-04",
      "CalendarWeek": "45",
      "day": "Dienstag",
      "mealtime": "Mittagessen",
      "IdentNr": "12025110498002",
      "itemId": "21062",
      "RecipeID": "8871",
      "ProductPrice": "3.60",
      "ProductPrice_2": null,
      "GastDesc_de": "Baskischer Cheesecake mit Birnenkompott",
      "GastDesc_en": "Basque cheesecake with Pear Compote",
      "MenuName": "FAVOURITES",
      "allergene": {
        "huhnerei": "Hühnerei und Hühnereierzeugnisse",
        "milch": "Milch und Milcherzeugnisse"
      },
      "merkmale": "",
      "naehrstoffe": "",
      "zusatzstoffe": [
        {
          "de": "Farbstoff",
          "en": "Colouring Agent"
        },
        {
          "de": "Alkohol",
          "en": "Alcohol"
        }
      ],
      "PrintOrder": "2",
      "CO2Value": null,
      "CO2Rating": null,
      "CO2Perc": null,
      "ClimateFriendly": null,
      "GastDesc": "Baskischer Cheesecake mit Birnenkompott",
      "date_de": "04.11.2025"
    },
    {
      "id": "4311153",
      "outlet": "cafe",
      "date": "2025-11-04",
      "CalendarWeek": "45",
      "day": "Dienstag",
      "mealtime": "Mittagessen",
      "IdentNr": "12025110498003",
      "itemId": "21063",
      "RecipeID": "8211",
      "ProductPrice": "0.50",
      "ProductPrice_2": null,
      "GastDesc_de": "LES ARLETTES (Französische Blätterteigkekse) Vegan",
      "GastDesc_en": "LES ARLETTES  (French Puff Pastry Cookies) Vegan",
      "MenuName": "MINIS",
      "allergene": {
        "gluten": "Glutenhaltiges Getreide"
      },
      "merkmale": {
        "vegan": "Vegan",
        "vegetarisch": "Vegetarisch"
      },
      "naehrstoffe": "",
      "zusatzstoffe": [
        {
          "de": "Farbstoff",
          "en": "Colouring Agent"
        },
        {
          "de": "Alkohol",
          "en": "Alcohol"
        }
      ],
      "PrintOrder": "3",
      "CO2Value": null,
      "CO2Rating": null,
      "CO2Perc": null,
      "ClimateFriendly": null,
      "GastDesc": "LES ARLETTES (Französische Blätterteigkekse) Vegan",
      "date_de": "04.11.2025"
    },
    {
      "id": "4311154",
      "outlet": "cafe",
      "date": "2025-11-04",
      "CalendarWeek": "45",
      "day": "Dienstag",
      "mealtime": "Mittagessen",
      "IdentNr": "12025110498004",
      "itemId": "21058",
      "RecipeID": "7719",
      "ProductPrice": "3.10",
      "ProductPrice_2": null,
      "GastDesc_de": "Red Velvet Cupcake mit Cream Cheese Frosting",
      "GastDesc_en": "Red Velvet Cupcake with Cream Cheese Frosting",
      "MenuName": "OPEN",
      "allergene": {
        "gluten": "Glutenhaltiges Getreide",
        "huhnerei": "Hühnerei und Hühnereierzeugnisse",
        "milch": "Milch und Milcherzeugnisse"
      },
      "merkmale": "",
      "naehrstoffe": "",
      "zusatzstoffe": [
        {
          "de": "Farbstoff",
          "en": "Colouring Agent"
        },
        {
          "de": "Alkohol",
          "en": "Alcohol"
        }
      ],
      "PrintOrder": "4",
      "CO2Value": null,
      "CO2Rating": null,
      "CO2Perc": null,
      "ClimateFriendly": null,
      "GastDesc": "Red Velvet Cupcake mit Cream Cheese Frosting",
      "date_de": "04.11.2025"
    },
    {
      "id": "4311155",
      "outlet": "cafe",
      "date": "2025-11-04",
      "CalendarWeek": "45",
      "day": "Dienstag",
      "mealtime": "Mittagessen",
      "IdentNr": "12025110498005",
      "itemId": "21064",
      "RecipeID": "8330",
      "ProductPrice": "1.50",
      "ProductPrice_2": null,
      "GastDesc_de": "Saftige Brownie-Bananen-Cookies | Zuckerfrei",
      "GastDesc_en": "Fudgy Brownie Banana Cookies | Sugar-Free",
      "MenuName": "PEOPLES CHOICE",
      "allergene": {
        "erdnuss": "Erdnüsse und Erdnusserzeugnisse"
      },
      "merkmale": {
        "ohne_zucker": "Ohne_Zucker",
        "vegan": "Vegan",
        "vegetarisch": "Vegetarisch"
      },
      "naehrstoffe": "",
      "zusatzstoffe": null,
      "PrintOrder": "5",
      "CO2Value": null,
      "CO2Rating": null,
      "CO2Perc": null,
      "ClimateFriendly": null,
      "GastDesc": "Saftige Brownie-Bananen-Cookies | Zuckerfrei",
      "date_de": "04.11.2025"
    },
    {
      "id": "4311156",
      "outlet": "cafe",
      "date": "2025-11-04",
      "CalendarWeek": "45",
      "day": "Dienstag",
      "mealtime": "Mittagessen",
      "IdentNr": "12025110498006",
      "itemId": "21061",
      "RecipeID": "9036",
      "ProductPrice": "2.70",
      "ProductPrice_2": null,
      "GastDesc_de": "Kürbis-Bananenbrot mit Walnüssen | Zuckerfrei",
      "GastDesc_en": "Pumpkin-banana bread with walnuts | Sugar-free",
      "MenuName": "SEASON",
      "allergene": {
        "gluten": "Glutenhaltiges Getreide",
        "schalenfruchte": "Schalenfrüchte und Schalenfruchterzeugnisse",
        "huhnerei": "Hühnerei und Hühnereierzeugnisse",
        "milch": "Milch und Milcherzeugnisse"
      },
      "merkmale": "",
      "naehrstoffe": "",
      "zusatzstoffe": null,
      "PrintOrder": "6",
      "CO2Value": null,
      "CO2Rating": null,
      "CO2Perc": null,
      "ClimateFriendly": null,
      "GastDesc": "Kürbis-Bananenbrot mit Walnüssen | Zuckerfrei",
      "date_de": "04.11.2025"
    },
    {
      "id": "4311157",
      "outlet": "cafe",
      "date": "2025-11-04",
      "CalendarWeek": "45",
      "day": "Dienstag",
      "mealtime": "Mittagessen",
      "IdentNr": "12025110498007",
      "itemId": "12776",
      "RecipeID": "9037",
      "ProductPrice": "2.50",
      "ProductPrice_2": null,
      "GastDesc_de": "Biscoff Karamell \"Apple Pie\" Cookie Vegan",
      "GastDesc_en": "Biscoff Caramel \"Apple Pie\" Cookie | Vegan",
      "MenuName": "COOKIE",
      "allergene": {
        "gluten": "Glutenhaltiges Getreide"
      },
      "merkmale": "",
      "naehrstoffe": "",
      "zusatzstoffe": [
        {
          "de": "Farbstoff",
          "en": "Colouring Agent"
        },
        {
          "de": "Antioxidationsmittel",
          "en": "Antioxidation"
        },
        {
          "de": "Alkohol",
          "en": "Alcohol"
        }
      ],
      "PrintOrder": "7",
      "CO2Value": null,
      "CO2Rating": null,
      "CO2Perc": null,
      "ClimateFriendly": null,
      "GastDesc": "Biscoff Karamell \"Apple Pie\" Cookie Vegan",
      "date_de": "04.11.2025"
    },
    {
      "id": "4311158",
      "outlet": "cafe",
      "date": "2025-11-04",
      "CalendarWeek": "45",
      "day": "Dienstag",
      "mealtime": "Mittagessen",
      "IdentNr": "12025110498009",
      "itemId": "12773",
      "RecipeID": "9043",
      "ProductPrice": "3.00",
      "ProductPrice_2": null,
      "GastDesc_de": "Schwedischer Mandelkuchen",
      "GastDesc_en": "Traditional Swedish almond cake",
      "MenuName": "CLASSICS",
      "allergene": {
        "schalenfruchte": "Schalenfrüchte und Schalenfruchterzeugnisse",
        "huhnerei": "Hühnerei und Hühnereierzeugnisse",
        "milch": "Milch und Milcherzeugnisse"
      },
      "merkmale": "",
      "naehrstoffe": "",
      "zusatzstoffe": null,
      "PrintOrder": "9",
      "CO2Value": null,
      "CO2Rating": null,
      "CO2Perc": null,
      "ClimateFriendly": null,
      "GastDesc": "Schwedischer Mandelkuchen",
      "date_de": "04.11.2025"
    },
    {
      "id": "4311159",
      "outlet": "cafe",
      "date": "2025-11-04",
      "CalendarWeek": "45",
      "day": "Dienstag",
      "mealtime": "Mittagessen",
      "IdentNr": "12025110498011",
      "itemId": "16256",
      "RecipeID": "8775",
      "ProductPrice": "1.50",
      "ProductPrice_2": null,
      "GastDesc_de": "Schwedische Haferkekse | Vegan",
      "GastDesc_en": "Swedish Style Oatmeal Cookies | Vegan",
      "MenuName": "VEGAN SPECIAL",
      "allergene": {
        "gluten": "Glutenhaltiges Getreide"
      },
      "merkmale": {
        "vegan": "Vegan",
        "vegetarisch": "Vegetarisch"
      },
      "naehrstoffe": "",
      "zusatzstoffe": [
        {
          "de": "Farbstoff",
          "en": "Colouring Agent"
        },
        {
          "de": "Antioxidationsmittel",
          "en": "Antioxidation"
        },
        {
          "de": "Alkohol",
          "en": "Alcohol"
        }
      ],
      "PrintOrder": "11",
      "CO2Value": null,
      "CO2Rating": null,
      "CO2Perc": null,
      "ClimateFriendly": null,
      "GastDesc": "Schwedische Haferkekse | Vegan",
      "date_de": "04.11.2025"
    },
    {
      "id": "4325239",
      "outlet": "cafe",
      "date": "2025-11-05",
      "CalendarWeek": "45",
      "day": "Mittwoch",
      "mealtime": "Mittagessen",
      "IdentNr": "12025110598000",
      "itemId": "21060",
      "RecipeID": "9038",
      "ProductPrice": "3.00",
      "ProductPrice_2": null,
      "GastDesc_de": "Schoko-Zimt-Knoten | Vegan",
      "GastDesc_en": "Chocolate-cinnamon pastry knot | vegan",
      "MenuName": "CHOCOLATE",
      "allergene": {
        "gluten": "Glutenhaltiges Getreide",
        "schalenfruchte": "Schalenfrüchte und Schalenfruchterzeugnisse",
        "soja": "Soja und Sojaerzeugnisse",
        "sesam": "Sesamsamen und Sesamsamenerzeugnisse"
      },
      "merkmale": "",
      "naehrstoffe": "",
      "zusatzstoffe": null,
      "PrintOrder": "0",
      "CO2Value": null,
      "CO2Rating": null,
      "CO2Perc": null,
      "ClimateFriendly": null,
      "GastDesc": "Schoko-Zimt-Knoten | Vegan",
      "date_de": "05.11.2025"
    },
    {
      "id": "4325240",
      "outlet": "cafe",
      "date": "2025-11-05",
      "CalendarWeek": "45",
      "day": "Mittwoch",
      "mealtime": "Mittagessen",
      "IdentNr": "12025110598002",
      "itemId": "21062",
      "RecipeID": "8871",
      "ProductPrice": "3.60",
      "ProductPrice_2": null,
      "GastDesc_de": "Baskischer Cheesecake mit Birnenkompott",
      "GastDesc_en": "Basque cheesecake with Pear Compote",
      "MenuName": "FAVOURITES",
      "allergene": {
        "huhnerei": "Hühnerei und Hühnereierzeugnisse",
        "milch": "Milch und Milcherzeugnisse"
      },
      "merkmale": "",
      "naehrstoffe": "",
      "zusatzstoffe": [
        {
          "de": "Farbstoff",
          "en": "Colouring Agent"
        },
        {
          "de": "Alkohol",
          "en": "Alcohol"
        }
      ],
      "PrintOrder": "2",
      "CO2Value": null,
      "CO2Rating": null,
      "CO2Perc": null,
      "ClimateFriendly": null,
      "GastDesc": "Baskischer Cheesecake mit Birnenkompott",
      "date_de": "05.11.2025"
    },
    {
      "id": "4325241",
      "outlet": "cafe",
      "date": "2025-11-05",
      "CalendarWeek": "45",
      "day": "Mittwoch",
      "mealtime": "Mittagessen",
      "IdentNr": "12025110598003",
      "itemId": "21063",
      "RecipeID": "8211",
      "ProductPrice": "0.50",
      "ProductPrice_2": null,
      "GastDesc_de": "LES ARLETTES (Französische Blätterteigkekse) Vegan",
      "GastDesc_en": "LES ARLETTES  (French Puff Pastry Cookies) Vegan",
      "MenuName": "MINIS",
      "allergene": {
        "gluten": "Glutenhaltiges Getreide"
      },
      "merkmale": {
        "vegan": "Vegan",
        "vegetarisch": "Vegetarisch"
      },
      "naehrstoffe": "",
      "zusatzstoffe": [
        {
          "de": "Farbstoff",
          "en": "Colouring Agent"
        },
        {
          "de": "Alkohol",
          "en": "Alcohol"
        }
      ],
      "PrintOrder": "3",
      "CO2Value": null,
      "CO2Rating": null,
      "CO2Perc": null,
      "ClimateFriendly": null,
      "GastDesc": "LES ARLETTES (Französische Blätterteigkekse) Vegan",
      "date_de": "05.11.2025"
    },
    {
      "id": "4325242",
      "outlet": "cafe",
      "date": "2025-11-05",
      "CalendarWeek": "45",
      "day": "Mittwoch",
      "mealtime": "Mittagessen",
      "IdentNr": "12025110598004",
      "itemId": "21058",
      "RecipeID": "7719",
      "ProductPrice": "3.10",
      "ProductPrice_2": null,
      "GastDesc_de": "Red Velvet Cupcake mit Cream Cheese Frosting",
      "GastDesc_en": "Red Velvet Cupcake with Cream Cheese Frosting",
      "MenuName": "OPEN",
      "allergene": {
        "gluten": "Glutenhaltiges Getreide",
        "huhnerei": "Hühnerei und Hühnereierzeugnisse",
        "milch": "Milch und Milcherzeugnisse"
      },
      "merkmale": "",
      "naehrstoffe": "",
      "zusatzstoffe": [
        {
          "de": "Farbstoff",
          "en": "Colouring Agent"
        },
        {
          "de": "Alkohol",
          "en": "Alcohol"
        }
      ],
      "PrintOrder": "4",
      "CO2Value": null,
      "CO2Rating": null,
      "CO2Perc": null,
      "ClimateFriendly": null,
      "GastDesc": "Red Velvet Cupcake mit Cream Cheese Frosting",
      "date_de": "05.11.2025"
    },
    {
      "id": "4325243",
      "outlet": "cafe",
      "date": "2025-11-05",
      "CalendarWeek": "45",
      "day": "Mittwoch",
      "mealtime": "Mittagessen",
      "IdentNr": "12025110598005",
      "itemId": "21064",
      "RecipeID": "8330",
      "ProductPrice": "1.50",
      "ProductPrice_2": null,
      "GastDesc_de": "Saftige Brownie-Bananen-Cookies | Zuckerfrei",
      "GastDesc_en": "Fudgy Brownie Banana Cookies | Sugar-Free",
      "MenuName": "PEOPLES CHOICE",
      "allergene": {
        "erdnuss": "Erdnüsse und Erdnusserzeugnisse"
      },
      "merkmale": {
        "ohne_zucker": "Ohne_Zucker",
        "vegan": "Vegan",
        "vegetarisch": "Vegetarisch"
      },
      "naehrstoffe": "",
      "zusatzstoffe": null,
      "PrintOrder": "5",
      "CO2Value": null,
      "CO2Rating": null,
      "CO2Perc": null,
      "ClimateFriendly": null,
      "GastDesc": "Saftige Brownie-Bananen-Cookies | Zuckerfrei",
      "date_de": "05.11.2025"
    },
    {
      "id": "4325244",
      "outlet": "cafe",
      "date": "2025-11-05",
      "CalendarWeek": "45",
      "day": "Mittwoch",
      "mealtime": "Mittagessen",
      "IdentNr": "12025110598006",
      "itemId": "21061",
      "RecipeID": "9036",
      "ProductPrice": "2.70",
      "ProductPrice_2": null,
      "GastDesc_de": "Kürbis-Bananenbrot mit Walnüssen | Zuckerfrei",
      "GastDesc_en": "Pumpkin-banana bread with walnuts | Sugar-free",
      "MenuName": "SEASON",
      "allergene": {
        "gluten": "Glutenhaltiges Getreide",
        "schalenfruchte": "Schalenfrüchte und Schalenfruchterzeugnisse",
        "huhnerei": "Hühnerei und Hühnereierzeugnisse",
        "milch": "Milch und Milcherzeugnisse"
      },
      "merkmale": "",
      "naehrstoffe": "",
      "zusatzstoffe": null,
      "PrintOrder": "6",
      "CO2Value": null,
      "CO2Rating": null,
      "CO2Perc": null,
      "ClimateFriendly": null,
      "GastDesc": "Kürbis-Bananenbrot mit Walnüssen | Zuckerfrei",
      "date_de": "05.11.2025"
    },
    {
      "id": "4325245",
      "outlet": "cafe",
      "date": "2025-11-05",
      "CalendarWeek": "45",
      "day": "Mittwoch",
      "mealtime": "Mittagessen",
      "IdentNr": "12025110598007",
      "itemId": "12776",
      "RecipeID": "9037",
      "ProductPrice": "2.50",
      "ProductPrice_2": null,
      "GastDesc_de": "Biscoff Karamell \"Apple Pie\" Cookie Vegan",
      "GastDesc_en": "Biscoff Caramel \"Apple Pie\" Cookie | Vegan",
      "MenuName": "COOKIE",
      "allergene": {
        "gluten": "Glutenhaltiges Getreide"
      },
      "merkmale": "",
      "naehrstoffe": "",
      "zusatzstoffe": [
        {
          "de": "Farbstoff",
          "en": "Colouring Agent"
        },
        {
          "de": "Antioxidationsmittel",
          "en": "Antioxidation"
        },
        {
          "de": "Alkohol",
          "en": "Alcohol"
        }
      ],
      "PrintOrder": "7",
      "CO2Value": null,
      "CO2Rating": null,
      "CO2Perc": null,
      "ClimateFriendly": null,
      "GastDesc": "Biscoff Karamell \"Apple Pie\" Cookie Vegan",
      "date_de": "05.11.2025"
    },
    {
      "id": "4325246",
      "outlet": "cafe",
      "date": "2025-11-05",
      "CalendarWeek": "45",
      "day": "Mittwoch",
      "mealtime": "Mittagessen",
      "IdentNr": "12025110598009",
      "itemId": "12773",
      "RecipeID": "9043",
      "ProductPrice": "3.00",
      "ProductPrice_2": null,
      "GastDesc_de": "Schwedischer Mandelkuchen",
      "GastDesc_en": "Traditional Swedish almond cake",
      "MenuName": "CLASSICS",
      "allergene": {
        "schalenfruchte": "Schalenfrüchte und Schalenfruchterzeugnisse",
        "huhnerei": "Hühnerei und Hühnereierzeugnisse",
        "milch": "Milch und Milcherzeugnisse"
      },
      "merkmale": "",
      "naehrstoffe": "",
      "zusatzstoffe": null,
      "PrintOrder": "9",
      "CO2Value": null,
      "CO2Rating": null,
      "CO2Perc": null,
      "ClimateFriendly": null,
      "GastDesc": "Schwedischer Mandelkuchen",
      "date_de": "05.11.2025"
    },
    {
      "id": "4325247",
      "outlet": "cafe",
      "date": "2025-11-05",
      "CalendarWeek": "45",
      "day": "Mittwoch",
      "mealtime": "Mittagessen",
      "IdentNr": "12025110598011",
      "itemId": "16256",
      "RecipeID": "8775",
      "ProductPrice": "1.50",
      "ProductPrice_2": null,
      "GastDesc_de": "Schwedische Haferkekse | Vegan",
      "GastDesc_en": "Swedish Style Oatmeal Cookies | Vegan",
      "MenuName": "VEGAN SPECIAL",
      "allergene": {
        "gluten": "Glutenhaltiges Getreide"
      },
      "merkmale": {
        "vegan": "Vegan",
        "vegetarisch": "Vegetarisch"
      },
      "naehrstoffe": "",
      "zusatzstoffe": [
        {
          "de": "Farbstoff",
          "en": "Colouring Agent"
        },
        {
          "de": "Antioxidationsmittel",
          "en": "Antioxidation"
        },
        {
          "de": "Alkohol",
          "en": "Alcohol"
        }
      ],
      "PrintOrder": "11",
      "CO2Value": null,
      "CO2Rating": null,
      "CO2Perc": null,
      "ClimateFriendly": null,
      "GastDesc": "Schwedische Haferkekse | Vegan",
      "date_de": "05.11.2025"
    },
    {
      "id": "4339040",
      "outlet": "cafe",
      "date": "2025-11-06",
      "CalendarWeek": "45",
      "day": "Donnerstag",
      "mealtime": "Mittagessen",
      "IdentNr": "12025110698000",
      "itemId": "21060",
      "RecipeID": "9038",
      "ProductPrice": "3.00",
      "ProductPrice_2": null,
      "GastDesc_de": "Schoko-Zimt-Knoten | Vegan",
      "GastDesc_en": "Chocolate-cinnamon pastry knot | vegan",
      "MenuName": "CHOCOLATE",
      "allergene": {
        "gluten": "Glutenhaltiges Getreide",
        "schalenfruchte": "Schalenfrüchte und Schalenfruchterzeugnisse",
        "soja": "Soja und Sojaerzeugnisse",
        "sesam": "Sesamsamen und Sesamsamenerzeugnisse"
      },
      "merkmale": "",
      "naehrstoffe": "",
      "zusatzstoffe": null,
      "PrintOrder": "0",
      "CO2Value": null,
      "CO2Rating": null,
      "CO2Perc": null,
      "ClimateFriendly": null,
      "GastDesc": "Schoko-Zimt-Knoten | Vegan",
      "date_de": "06.11.2025"
    },
    {
      "id": "4339041",
      "outlet": "cafe",
      "date": "2025-11-06",
      "CalendarWeek": "45",
      "day": "Donnerstag",
      "mealtime": "Mittagessen",
      "IdentNr": "12025110698002",
      "itemId": "21062",
      "RecipeID": "8871",
      "ProductPrice": "3.60",
      "ProductPrice_2": null,
      "GastDesc_de": "Baskischer Cheesecake mit Birnenkompott",
      "GastDesc_en": "Basque cheesecake with Pear Compote",
      "MenuName": "FAVOURITES",
      "allergene": {
        "huhnerei": "Hühnerei und Hühnereierzeugnisse",
        "milch": "Milch und Milcherzeugnisse"
      },
      "merkmale": "",
      "naehrstoffe": "",
      "zusatzstoffe": [
        {
          "de": "Farbstoff",
          "en": "Colouring Agent"
        },
        {
          "de": "Alkohol",
          "en": "Alcohol"
        }
      ],
      "PrintOrder": "2",
      "CO2Value": null,
      "CO2Rating": null,
      "CO2Perc": null,
      "ClimateFriendly": null,
      "GastDesc": "Baskischer Cheesecake mit Birnenkompott",
      "date_de": "06.11.2025"
    },
    {
      "id": "4339042",
      "outlet": "cafe",
      "date": "2025-11-06",
      "CalendarWeek": "45",
      "day": "Donnerstag",
      "mealtime": "Mittagessen",
      "IdentNr": "12025110698003",
      "itemId": "21063",
      "RecipeID": "8211",
      "ProductPrice": "0.50",
      "ProductPrice_2": null,
      "GastDesc_de": "LES ARLETTES (Französische Blätterteigkekse) Vegan",
      "GastDesc_en": "LES ARLETTES  (French Puff Pastry Cookies) Vegan",
      "MenuName": "MINIS",
      "allergene": {
        "gluten": "Glutenhaltiges Getreide"
      },
      "merkmale": {
        "vegan": "Vegan",
        "vegetarisch": "Vegetarisch"
      },
      "naehrstoffe": "",
      "zusatzstoffe": [
        {
          "de": "Farbstoff",
          "en": "Colouring Agent"
        },
        {
          "de": "Alkohol",
          "en": "Alcohol"
        }
      ],
      "PrintOrder": "3",
      "CO2Value": null,
      "CO2Rating": null,
      "CO2Perc": null,
      "ClimateFriendly": null,
      "GastDesc": "LES ARLETTES (Französische Blätterteigkekse) Vegan",
      "date_de": "06.11.2025"
    },
    {
      "id": "4339043",
      "outlet": "cafe",
      "date": "2025-11-06",
      "CalendarWeek": "45",
      "day": "Donnerstag",
      "mealtime": "Mittagessen",
      "IdentNr": "12025110698004",
      "itemId": "21058",
      "RecipeID": "7719",
      "ProductPrice": "3.10",
      "ProductPrice_2": null,
      "GastDesc_de": "Red Velvet Cupcake mit Cream Cheese Frosting",
      "GastDesc_en": "Red Velvet Cupcake with Cream Cheese Frosting",
      "MenuName": "OPEN",
      "allergene": {
        "gluten": "Glutenhaltiges Getreide",
        "huhnerei": "Hühnerei und Hühnereierzeugnisse",
        "milch": "Milch und Milcherzeugnisse"
      },
      "merkmale": "",
      "naehrstoffe": "",
      "zusatzstoffe": [
        {
          "de": "Farbstoff",
          "en": "Colouring Agent"
        },
        {
          "de": "Alkohol",
          "en": "Alcohol"
        }
      ],
      "PrintOrder": "4",
      "CO2Value": null,
      "CO2Rating": null,
      "CO2Perc": null,
      "ClimateFriendly": null,
      "GastDesc": "Red Velvet Cupcake mit Cream Cheese Frosting",
      "date_de": "06.11.2025"
    },
    {
      "id": "4339044",
      "outlet": "cafe",
      "date": "2025-11-06",
      "CalendarWeek": "45",
      "day": "Donnerstag",
      "mealtime": "Mittagessen",
      "IdentNr": "12025110698005",
      "itemId": "21064",
      "RecipeID": "8330",
      "ProductPrice": "1.50",
      "ProductPrice_2": null,
      "GastDesc_de": "Saftige Brownie-Bananen-Cookies | Zuckerfrei",
      "GastDesc_en": "Fudgy Brownie Banana Cookies | Sugar-Free",
      "MenuName": "PEOPLES CHOICE",
      "allergene": {
        "erdnuss": "Erdnüsse und Erdnusserzeugnisse"
      },
      "merkmale": {
        "ohne_zucker": "Ohne_Zucker",
        "vegan": "Vegan",
        "vegetarisch": "Vegetarisch"
      },
      "naehrstoffe": "",
      "zusatzstoffe": null,
      "PrintOrder": "5",
      "CO2Value": null,
      "CO2Rating": null,
      "CO2Perc": null,
      "ClimateFriendly": null,
      "GastDesc": "Saftige Brownie-Bananen-Cookies | Zuckerfrei",
      "date_de": "06.11.2025"
    },
    {
      "id": "4339045",
      "outlet": "cafe",
      "date": "2025-11-06",
      "CalendarWeek": "45",
      "day": "Donnerstag",
      "mealtime": "Mittagessen",
      "IdentNr": "12025110698006",
      "itemId": "21061",
      "RecipeID": "9036",
      "ProductPrice": "2.70",
      "ProductPrice_2": null,
      "GastDesc_de": "Kürbis-Bananenbrot mit Walnüssen | Zuckerfrei",
      "GastDesc_en": "Pumpkin-banana bread with walnuts | Sugar-free",
      "MenuName": "SEASON",
      "allergene": {
        "gluten": "Glutenhaltiges Getreide",
        "schalenfruchte": "Schalenfrüchte und Schalenfruchterzeugnisse",
        "huhnerei": "Hühnerei und Hühnereierzeugnisse",
        "milch": "Milch und Milcherzeugnisse"
      },
      "merkmale": "",
      "naehrstoffe": "",
      "zusatzstoffe": null,
      "PrintOrder": "6",
      "CO2Value": null,
      "CO2Rating": null,
      "CO2Perc": null,
      "ClimateFriendly": null,
      "GastDesc": "Kürbis-Bananenbrot mit Walnüssen | Zuckerfrei",
      "date_de": "06.11.2025"
    },
    {
      "id": "4339046",
      "outlet": "cafe",
      "date": "2025-11-06",
      "CalendarWeek": "45",
      "day": "Donnerstag",
      "mealtime": "Mittagessen",
      "IdentNr": "12025110698007",
      "itemId": "12776",
      "RecipeID": "9037",
      "ProductPrice": "2.50",
      "ProductPrice_2": null,
      "GastDesc_de": "Biscoff Karamell \"Apple Pie\" Cookie Vegan",
      "GastDesc_en": "Biscoff Caramel \"Apple Pie\" Cookie | Vegan",
      "MenuName": "COOKIE",
      "allergene": {
        "gluten": "Glutenhaltiges Getreide"
      },
      "merkmale": "",
      "naehrstoffe": "",
      "zusatzstoffe": [
        {
          "de": "Farbstoff",
          "en": "Colouring Agent"
        },
        {
          "de": "Antioxidationsmittel",
          "en": "Antioxidation"
        },
        {
          "de": "Alkohol",
          "en": "Alcohol"
        }
      ],
      "PrintOrder": "7",
      "CO2Value": null,
      "CO2Rating": null,
      "CO2Perc": null,
      "ClimateFriendly": null,
      "GastDesc": "Biscoff Karamell \"Apple Pie\" Cookie Vegan",
      "date_de": "06.11.2025"
    },
    {
      "id": "4339047",
      "outlet": "cafe",
      "date": "2025-11-06",
      "CalendarWeek": "45",
      "day": "Donnerstag",
      "mealtime": "Mittagessen",
      "IdentNr": "12025110698009",
      "itemId": "12773",
      "RecipeID": "9043",
      "ProductPrice": "3.00",
      "ProductPrice_2": null,
      "GastDesc_de": "Schwedischer Mandelkuchen",
      "GastDesc_en": "Traditional Swedish almond cake",
      "MenuName": "CLASSICS",
      "allergene": {
        "schalenfruchte": "Schalenfrüchte und Schalenfruchterzeugnisse",
        "huhnerei": "Hühnerei und Hühnereierzeugnisse",
        "milch": "Milch und Milcherzeugnisse"
      },
      "merkmale": "",
      "naehrstoffe": "",
      "zusatzstoffe": null,
      "PrintOrder": "9",
      "CO2Value": null,
      "CO2Rating": null,
      "CO2Perc": null,
      "ClimateFriendly": null,
      "GastDesc": "Schwedischer Mandelkuchen",
      "date_de": "06.11.2025"
    },
    {
      "id": "4339048",
      "outlet": "cafe",
      "date": "2025-11-06",
      "CalendarWeek": "45",
      "day": "Donnerstag",
      "mealtime": "Mittagessen",
      "IdentNr": "12025110698011",
      "itemId": "16256",
      "RecipeID": "8775",
      "ProductPrice": "1.50",
      "ProductPrice_2": null,
      "GastDesc_de": "Schwedische Haferkekse | Vegan",
      "GastDesc_en": "Swedish Style Oatmeal Cookies | Vegan",
      "MenuName": "VEGAN SPECIAL",
      "allergene": {
        "gluten": "Glutenhaltiges Getreide"
      },
      "merkmale": {
        "vegan": "Vegan",
        "vegetarisch": "Vegetarisch"
      },
      "naehrstoffe": "",
      "zusatzstoffe": [
        {
          "de": "Farbstoff",
          "en": "Colouring Agent"
        },
        {
          "de": "Antioxidationsmittel",
          "en": "Antioxidation"
        },
        {
          "de": "Alkohol",
          "en": "Alcohol"
        }
      ],
      "PrintOrder": "11",
      "CO2Value": null,
      "CO2Rating": null,
      "CO2Perc": null,
      "ClimateFriendly": null,
      "GastDesc": "Schwedische Haferkekse | Vegan",
      "date_de": "06.11.2025"
    },
    {
      "id": "4352052",
      "outlet": "cafe",
      "date": "2025-11-07",
      "CalendarWeek": "45",
      "day": "Freitag",
      "mealtime": "Mittagessen",
      "IdentNr": "12025110798000",
      "itemId": "21060",
      "RecipeID": "9038",
      "ProductPrice": "3.00",
      "ProductPrice_2": null,
      "GastDesc_de": "Schoko-Zimt-Knoten | Vegan",
      "GastDesc_en": "Chocolate-cinnamon pastry knot | vegan",
      "MenuName": "CHOCOLATE",
      "allergene": {
        "gluten": "Glutenhaltiges Getreide",
        "schalenfruchte": "Schalenfrüchte und Schalenfruchterzeugnisse",
        "soja": "Soja und Sojaerzeugnisse",
        "sesam": "Sesamsamen und Sesamsamenerzeugnisse"
      },
      "merkmale": "",
      "naehrstoffe": "",
      "zusatzstoffe": null,
      "PrintOrder": "0",
      "CO2Value": null,
      "CO2Rating": null,
      "CO2Perc": null,
      "ClimateFriendly": null,
      "GastDesc": "Schoko-Zimt-Knoten | Vegan",
      "date_de": "07.11.2025"
    },
    {
      "id": "4352053",
      "outlet": "cafe",
      "date": "2025-11-07",
      "CalendarWeek": "45",
      "day": "Freitag",
      "mealtime": "Mittagessen",
      "IdentNr": "12025110798002",
      "itemId": "21062",
      "RecipeID": "8871",
      "ProductPrice": "3.60",
      "ProductPrice_2": null,
      "GastDesc_de": "Baskischer Cheesecake mit Birnenkompott",
      "GastDesc_en": "Basque cheesecake with Pear Compote",
      "MenuName": "FAVOURITES",
      "allergene": {
        "huhnerei": "Hühnerei und Hühnereierzeugnisse",
        "milch": "Milch und Milcherzeugnisse"
      },
      "merkmale": "",
      "naehrstoffe": "",
      "zusatzstoffe": [
        {
          "de": "Farbstoff",
          "en": "Colouring Agent"
        },
        {
          "de": "Alkohol",
          "en": "Alcohol"
        }
      ],
      "PrintOrder": "2",
      "CO2Value": null,
      "CO2Rating": null,
      "CO2Perc": null,
      "ClimateFriendly": null,
      "GastDesc": "Baskischer Cheesecake mit Birnenkompott",
      "date_de": "07.11.2025"
    },
    {
      "id": "4352054",
      "outlet": "cafe",
      "date": "2025-11-07",
      "CalendarWeek": "45",
      "day": "Freitag",
      "mealtime": "Mittagessen",
      "IdentNr": "12025110798003",
      "itemId": "21063",
      "RecipeID": "8211",
      "ProductPrice": "0.50",
      "ProductPrice_2": null,
      "GastDesc_de": "LES ARLETTES (Französische Blätterteigkekse) Vegan",
      "GastDesc_en": "LES ARLETTES  (French Puff Pastry Cookies) Vegan",
      "MenuName": "MINIS",
      "allergene": {
        "gluten": "Glutenhaltiges Getreide"
      },
      "merkmale": {
        "vegan": "Vegan",
        "vegetarisch": "Vegetarisch"
      },
      "naehrstoffe": "",
      "zusatzstoffe": [
        {
          "de": "Farbstoff",
          "en": "Colouring Agent"
        },
        {
          "de": "Alkohol",
          "en": "Alcohol"
        }
      ],
      "PrintOrder": "3",
      "CO2Value": null,
      "CO2Rating": null,
      "CO2Perc": null,
      "ClimateFriendly": null,
      "GastDesc": "LES ARLETTES (Französische Blätterteigkekse) Vegan",
      "date_de": "07.11.2025"
    },
    {
      "id": "4352055",
      "outlet": "cafe",
      "date": "2025-11-07",
      "CalendarWeek": "45",
      "day": "Freitag",
      "mealtime": "Mittagessen",
      "IdentNr": "12025110798004",
      "itemId": "21058",
      "RecipeID": "7719",
      "ProductPrice": "3.10",
      "ProductPrice_2": null,
      "GastDesc_de": "Red Velvet Cupcake mit Cream Cheese Frosting",
      "GastDesc_en": "Red Velvet Cupcake with Cream Cheese Frosting",
      "MenuName": "OPEN",
      "allergene": {
        "gluten": "Glutenhaltiges Getreide",
        "huhnerei": "Hühnerei und Hühnereierzeugnisse",
        "milch": "Milch und Milcherzeugnisse"
      },
      "merkmale": "",
      "naehrstoffe": "",
      "zusatzstoffe": [
        {
          "de": "Farbstoff",
          "en": "Colouring Agent"
        },
        {
          "de": "Alkohol",
          "en": "Alcohol"
        }
      ],
      "PrintOrder": "4",
      "CO2Value": null,
      "CO2Rating": null,
      "CO2Perc": null,
      "ClimateFriendly": null,
      "GastDesc": "Red Velvet Cupcake mit Cream Cheese Frosting",
      "date_de": "07.11.2025"
    },
    {
      "id": "4352056",
      "outlet": "cafe",
      "date": "2025-11-07",
      "CalendarWeek": "45",
      "day": "Freitag",
      "mealtime": "Mittagessen",
      "IdentNr": "12025110798005",
      "itemId": "21064",
      "RecipeID": "8330",
      "ProductPrice": "1.50",
      "ProductPrice_2": null,
      "GastDesc_de": "Saftige Brownie-Bananen-Cookies | Zuckerfrei",
      "GastDesc_en": "Fudgy Brownie Banana Cookies | Sugar-Free",
      "MenuName": "PEOPLES CHOICE",
      "allergene": {
        "erdnuss": "Erdnüsse und Erdnusserzeugnisse"
      },
      "merkmale": {
        "ohne_zucker": "Ohne_Zucker",
        "vegan": "Vegan",
        "vegetarisch": "Vegetarisch"
      },
      "naehrstoffe": "",
      "zusatzstoffe": null,
      "PrintOrder": "5",
      "CO2Value": null,
      "CO2Rating": null,
      "CO2Perc": null,
      "ClimateFriendly": null,
      "GastDesc": "Saftige Brownie-Bananen-Cookies | Zuckerfrei",
      "date_de": "07.11.2025"
    },
    {
      "id": "4352057",
      "outlet": "cafe",
      "date": "2025-11-07",
      "CalendarWeek": "45",
      "day": "Freitag",
      "mealtime": "Mittagessen",
      "IdentNr": "12025110798006",
      "itemId": "21061",
      "RecipeID": "9036",
      "ProductPrice": "2.70",
      "ProductPrice_2": null,
      "GastDesc_de": "Kürbis-Bananenbrot mit Walnüssen | Zuckerfrei",
      "GastDesc_en": "Pumpkin-banana bread with walnuts | Sugar-free",
      "MenuName": "SEASON",
      "allergene": {
        "gluten": "Glutenhaltiges Getreide",
        "schalenfruchte": "Schalenfrüchte und Schalenfruchterzeugnisse",
        "huhnerei": "Hühnerei und Hühnereierzeugnisse",
        "milch": "Milch und Milcherzeugnisse"
      },
      "merkmale": "",
      "naehrstoffe": "",
      "zusatzstoffe": null,
      "PrintOrder": "6",
      "CO2Value": null,
      "CO2Rating": null,
      "CO2Perc": null,
      "ClimateFriendly": null,
      "GastDesc": "Kürbis-Bananenbrot mit Walnüssen | Zuckerfrei",
      "date_de": "07.11.2025"
    },
    {
      "id": "4352058",
      "outlet": "cafe",
      "date": "2025-11-07",
      "CalendarWeek": "45",
      "day": "Freitag",
      "mealtime": "Mittagessen",
      "IdentNr": "12025110798007",
      "itemId": "12776",
      "RecipeID": "9037",
      "ProductPrice": "2.50",
      "ProductPrice_2": null,
      "GastDesc_de": "Biscoff Karamell \"Apple Pie\" Cookie Vegan",
      "GastDesc_en": "Biscoff Caramel \"Apple Pie\" Cookie | Vegan",
      "MenuName": "COOKIE",
      "allergene": {
        "gluten": "Glutenhaltiges Getreide"
      },
      "merkmale": "",
      "naehrstoffe": "",
      "zusatzstoffe": [
        {
          "de": "Farbstoff",
          "en": "Colouring Agent"
        },
        {
          "de": "Antioxidationsmittel",
          "en": "Antioxidation"
        },
        {
          "de": "Alkohol",
          "en": "Alcohol"
        }
      ],
      "PrintOrder": "7",
      "CO2Value": null,
      "CO2Rating": null,
      "CO2Perc": null,
      "ClimateFriendly": null,
      "GastDesc": "Biscoff Karamell \"Apple Pie\" Cookie Vegan",
      "date_de": "07.11.2025"
    },
    {
      "id": "4352059",
      "outlet": "cafe",
      "date": "2025-11-07",
      "CalendarWeek": "45",
      "day": "Freitag",
      "mealtime": "Mittagessen",
      "IdentNr": "12025110798009",
      "itemId": "12773",
      "RecipeID": "9043",
      "ProductPrice": "3.00",
      "ProductPrice_2": null,
      "GastDesc_de": "Schwedischer Mandelkuchen",
      "GastDesc_en": "Traditional Swedish almond cake",
      "MenuName": "CLASSICS",
      "allergene": {
        "schalenfruchte": "Schalenfrüchte und Schalenfruchterzeugnisse",
        "huhnerei": "Hühnerei und Hühnereierzeugnisse",
        "milch": "Milch und Milcherzeugnisse"
      },
      "merkmale": "",
      "naehrstoffe": "",
      "zusatzstoffe": null,
      "PrintOrder": "9",
      "CO2Value": null,
      "CO2Rating": null,
      "CO2Perc": null,
      "ClimateFriendly": null,
      "GastDesc": "Schwedischer Mandelkuchen",
      "date_de": "07.11.2025"
    },
    {
      "id": "4352060",
      "outlet": "cafe",
      "date": "2025-11-07",
      "CalendarWeek": "45",
      "day": "Freitag",
      "mealtime": "Mittagessen",
      "IdentNr": "12025110798011",
      "itemId": "16256",
      "RecipeID": "8775",
      "ProductPrice": "1.50",
      "ProductPrice_2": null,
      "GastDesc_de": "Schwedische Haferkekse | Vegan",
      "GastDesc_en": "Swedish Style Oatmeal Cookies | Vegan",
      "MenuName": "VEGAN SPECIAL",
      "allergene": {
        "gluten": "Glutenhaltiges Getreide"
      },
      "merkmale": {
        "vegan": "Vegan",
        "vegetarisch": "Vegetarisch"
      },
      "naehrstoffe": "",
      "zusatzstoffe": [
        {
          "de": "Farbstoff",
          "en": "Colouring Agent"
        },
        {
          "de": "Antioxidationsmittel",
          "en": "Antioxidation"
        },
        {
          "de": "Alkohol",
          "en": "Alcohol"
        }
      ],
      "PrintOrder": "11",
      "CO2Value": null,
      "CO2Rating": null,
      "CO2Perc": null,
      "ClimateFriendly": null,
      "GastDesc": "Schwedische Haferkekse | Vegan",
      "date_de": "07.11.2025"
    },
    {
      "id": "4352061",
      "outlet": "cafe",
      "date": "2025-11-10",
      "CalendarWeek": "45",
      "day": "Montag",
      "mealtime": "Mittagessen",
      "IdentNr": "12025111098000",
      "itemId": "21060",
      "RecipeID": "9038",
      "ProductPrice": "3.00",
      "ProductPrice_2": null,
      "GastDesc_de": "Schoko-Zimt-Knoten | Vegan",
      "GastDesc_en": "Chocolate-cinnamon pastry knot | vegan",
      "MenuName": "CHOCOLATE",
      "allergene": {
        "gluten": "Glutenhaltiges Getreide",
        "schalenfruchte": "Schalenfrüchte und Schalenfruchterzeugnisse",
        "soja": "Soja und Sojaerzeugnisse",
        "sesam": "Sesamsamen und Sesamsamenerzeugnisse"
      },
      "merkmale": "",
      "naehrstoffe": "",
      "zusatzstoffe": null,
      "PrintOrder": "0",
      "CO2Value": null,
      "CO2Rating": null,
      "CO2Perc": null,
      "ClimateFriendly": null,
      "GastDesc": "Schoko-Zimt-Knoten | Vegan",
      "date_de": "10.11.2025"
    },
    {
      "id": "4352062",
      "outlet": "cafe",
      "date": "2025-11-10",
      "CalendarWeek": "45",
      "day": "Montag",
      "mealtime": "Mittagessen",
      "IdentNr": "12025111098002",
      "itemId": "21062",
      "RecipeID": "8871",
      "ProductPrice": "3.60",
      "ProductPrice_2": null,
      "GastDesc_de": "Baskischer Cheesecake mit Apfelkompott",
      "GastDesc_en": "Basque cheesecake with Apple Compote",
      "MenuName": "FAVOURITES",
      "allergene": {
        "huhnerei": "Hühnerei und Hühnereierzeugnisse",
        "milch": "Milch und Milcherzeugnisse"
      },
      "merkmale": "",
      "naehrstoffe": "",
      "zusatzstoffe": [
        {
          "de": "Farbstoff",
          "en": "Colouring Agent"
        },
        {
          "de": "Alkohol",
          "en": "Alcohol"
        }
      ],
      "PrintOrder": "2",
      "CO2Value": null,
      "CO2Rating": null,
      "CO2Perc": null,
      "ClimateFriendly": null,
      "GastDesc": "Baskischer Cheesecake mit Apfelkompott",
      "date_de": "10.11.2025"
    },
    {
      "id": "4352063",
      "outlet": "cafe",
      "date": "2025-11-10",
      "CalendarWeek": "45",
      "day": "Montag",
      "mealtime": "Mittagessen",
      "IdentNr": "12025111098003",
      "itemId": "21063",
      "RecipeID": "8211",
      "ProductPrice": "0.50",
      "ProductPrice_2": null,
      "GastDesc_de": "LES ARLETTES (Französische Blätterteigkekse) Vegan",
      "GastDesc_en": "LES ARLETTES  (French Puff Pastry Cookies) Vegan",
      "MenuName": "MINIS",
      "allergene": {
        "gluten": "Glutenhaltiges Getreide"
      },
      "merkmale": {
        "vegan": "Vegan",
        "vegetarisch": "Vegetarisch"
      },
      "naehrstoffe": "",
      "zusatzstoffe": [
        {
          "de": "Farbstoff",
          "en": "Colouring Agent"
        },
        {
          "de": "Alkohol",
          "en": "Alcohol"
        }
      ],
      "PrintOrder": "3",
      "CO2Value": null,
      "CO2Rating": null,
      "CO2Perc": null,
      "ClimateFriendly": null,
      "GastDesc": "LES ARLETTES (Französische Blätterteigkekse) Vegan",
      "date_de": "10.11.2025"
    },
    {
      "id": "4352064",
      "outlet": "cafe",
      "date": "2025-11-10",
      "CalendarWeek": "45",
      "day": "Montag",
      "mealtime": "Mittagessen",
      "IdentNr": "12025111098004",
      "itemId": "21058",
      "RecipeID": "7719",
      "ProductPrice": "3.10",
      "ProductPrice_2": null,
      "GastDesc_de": "Red Velvet Cupcake mit Cream Cheese Frosting",
      "GastDesc_en": "Red Velvet Cupcake with Cream Cheese Frosting",
      "MenuName": "OPEN",
      "allergene": {
        "gluten": "Glutenhaltiges Getreide",
        "huhnerei": "Hühnerei und Hühnereierzeugnisse",
        "milch": "Milch und Milcherzeugnisse"
      },
      "merkmale": "",
      "naehrstoffe": "",
      "zusatzstoffe": [
        {
          "de": "Farbstoff",
          "en": "Colouring Agent"
        },
        {
          "de": "Alkohol",
          "en": "Alcohol"
        }
      ],
      "PrintOrder": "4",
      "CO2Value": null,
      "CO2Rating": null,
      "CO2Perc": null,
      "ClimateFriendly": null,
      "GastDesc": "Red Velvet Cupcake mit Cream Cheese Frosting",
      "date_de": "10.11.2025"
    },
    {
      "id": "4352065",
      "outlet": "cafe",
      "date": "2025-11-10",
      "CalendarWeek": "45",
      "day": "Montag",
      "mealtime": "Mittagessen",
      "IdentNr": "12025111098005",
      "itemId": "21064",
      "RecipeID": "8330",
      "ProductPrice": "1.50",
      "ProductPrice_2": null,
      "GastDesc_de": "Saftige Brownie-Bananen-Cookies | Zuckerfrei",
      "GastDesc_en": "Fudgy Brownie Banana Cookies | Sugar-Free",
      "MenuName": "PEOPLES CHOICE",
      "allergene": {
        "erdnuss": "Erdnüsse und Erdnusserzeugnisse"
      },
      "merkmale": {
        "ohne_zucker": "Ohne_Zucker",
        "vegan": "Vegan",
        "vegetarisch": "Vegetarisch"
      },
      "naehrstoffe": "",
      "zusatzstoffe": null,
      "PrintOrder": "5",
      "CO2Value": null,
      "CO2Rating": null,
      "CO2Perc": null,
      "ClimateFriendly": null,
      "GastDesc": "Saftige Brownie-Bananen-Cookies | Zuckerfrei",
      "date_de": "10.11.2025"
    },
    {
      "id": "4352066",
      "outlet": "cafe",
      "date": "2025-11-10",
      "CalendarWeek": "45",
      "day": "Montag",
      "mealtime": "Mittagessen",
      "IdentNr": "12025111098006",
      "itemId": "21061",
      "RecipeID": "9036",
      "ProductPrice": "2.70",
      "ProductPrice_2": null,
      "GastDesc_de": "Kürbis-Bananenbrot mit Walnüssen | Zuckerfrei",
      "GastDesc_en": "Pumpkin-banana bread with walnuts | Sugar-free",
      "MenuName": "SEASON",
      "allergene": {
        "gluten": "Glutenhaltiges Getreide",
        "schalenfruchte": "Schalenfrüchte und Schalenfruchterzeugnisse",
        "huhnerei": "Hühnerei und Hühnereierzeugnisse",
        "milch": "Milch und Milcherzeugnisse"
      },
      "merkmale": "",
      "naehrstoffe": "",
      "zusatzstoffe": null,
      "PrintOrder": "6",
      "CO2Value": null,
      "CO2Rating": null,
      "CO2Perc": null,
      "ClimateFriendly": null,
      "GastDesc": "Kürbis-Bananenbrot mit Walnüssen | Zuckerfrei",
      "date_de": "10.11.2025"
    },
    {
      "id": "4352067",
      "outlet": "cafe",
      "date": "2025-11-10",
      "CalendarWeek": "45",
      "day": "Montag",
      "mealtime": "Mittagessen",
      "IdentNr": "12025111098007",
      "itemId": "12776",
      "RecipeID": "9037",
      "ProductPrice": "2.50",
      "ProductPrice_2": null,
      "GastDesc_de": "Biscoff Karamell \"Apple Pie\" Cookie | Vegan",
      "GastDesc_en": "Biscoff Caramel \"Apple Pie\" Cookie | Vegan",
      "MenuName": "COOKIE",
      "allergene": {
        "gluten": "Glutenhaltiges Getreide"
      },
      "merkmale": "",
      "naehrstoffe": "",
      "zusatzstoffe": [
        {
          "de": "Farbstoff",
          "en": "Colouring Agent"
        },
        {
          "de": "Antioxidationsmittel",
          "en": "Antioxidation"
        },
        {
          "de": "Alkohol",
          "en": "Alcohol"
        }
      ],
      "PrintOrder": "7",
      "CO2Value": null,
      "CO2Rating": null,
      "CO2Perc": null,
      "ClimateFriendly": null,
      "GastDesc": "Biscoff Karamell \"Apple Pie\" Cookie | Vegan",
      "date_de": "10.11.2025"
    },
    {
      "id": "4352068",
      "outlet": "cafe",
      "date": "2025-11-10",
      "CalendarWeek": "45",
      "day": "Montag",
      "mealtime": "Mittagessen",
      "IdentNr": "12025111098009",
      "itemId": "12773",
      "RecipeID": "9043",
      "ProductPrice": "3.00",
      "ProductPrice_2": null,
      "GastDesc_de": "Schwedischer Mandelkuchen",
      "GastDesc_en": "Traditional Swedish almond cake",
      "MenuName": "CLASSICS",
      "allergene": {
        "schalenfruchte": "Schalenfrüchte und Schalenfruchterzeugnisse",
        "huhnerei": "Hühnerei und Hühnereierzeugnisse",
        "milch": "Milch und Milcherzeugnisse"
      },
      "merkmale": "",
      "naehrstoffe": "",
      "zusatzstoffe": null,
      "PrintOrder": "9",
      "CO2Value": null,
      "CO2Rating": null,
      "CO2Perc": null,
      "ClimateFriendly": null,
      "GastDesc": "Schwedischer Mandelkuchen",
      "date_de": "10.11.2025"
    },
    {
      "id": "4352069",
      "outlet": "cafe",
      "date": "2025-11-10",
      "CalendarWeek": "45",
      "day": "Montag",
      "mealtime": "Mittagessen",
      "IdentNr": "12025111098011",
      "itemId": "16256",
      "RecipeID": "8775",
      "ProductPrice": "1.50",
      "ProductPrice_2": null,
      "GastDesc_de": "Schwedische Haferkekse | Vegan",
      "GastDesc_en": "Swedish Style Oatmeal Cookies | Vegan",
      "MenuName": "VEGAN SPECIAL",
      "allergene": {
        "gluten": "Glutenhaltiges Getreide"
      },
      "merkmale": {
        "vegan": "Vegan",
        "vegetarisch": "Vegetarisch"
      },
      "naehrstoffe": "",
      "zusatzstoffe": [
        {
          "de": "Farbstoff",
          "en": "Colouring Agent"
        },
        {
          "de": "Antioxidationsmittel",
          "en": "Antioxidation"
        },
        {
          "de": "Alkohol",
          "en": "Alcohol"
        }
      ],
      "PrintOrder": "11",
      "CO2Value": null,
      "CO2Rating": null,
      "CO2Perc": null,
      "ClimateFriendly": null,
      "GastDesc": "Schwedische Haferkekse | Vegan",
      "date_de": "10.11.2025"
    },
    {
      "id": "4352070",
      "outlet": "cafe",
      "date": "2025-11-11",
      "CalendarWeek": "45",
      "day": "Dienstag",
      "mealtime": "Mittagessen",
      "IdentNr": "12025111198000",
      "itemId": "21060",
      "RecipeID": "9038",
      "ProductPrice": "3.00",
      "ProductPrice_2": null,
      "GastDesc_de": "Schoko-Zimt-Knoten | Vegan",
      "GastDesc_en": "Chocolate-cinnamon pastry knot | vegan",
      "MenuName": "CHOCOLATE",
      "allergene": {
        "gluten": "Glutenhaltiges Getreide",
        "schalenfruchte": "Schalenfrüchte und Schalenfruchterzeugnisse",
        "soja": "Soja und Sojaerzeugnisse",
        "sesam": "Sesamsamen und Sesamsamenerzeugnisse"
      },
      "merkmale": "",
      "naehrstoffe": "",
      "zusatzstoffe": null,
      "PrintOrder": "0",
      "CO2Value": null,
      "CO2Rating": null,
      "CO2Perc": null,
      "ClimateFriendly": null,
      "GastDesc": "Schoko-Zimt-Knoten | Vegan",
      "date_de": "11.11.2025"
    },
    {
      "id": "4352071",
      "outlet": "cafe",
      "date": "2025-11-11",
      "CalendarWeek": "45",
      "day": "Dienstag",
      "mealtime": "Mittagessen",
      "IdentNr": "12025111198002",
      "itemId": "21062",
      "RecipeID": "8871",
      "ProductPrice": "3.60",
      "ProductPrice_2": null,
      "GastDesc_de": "Baskischer Cheesecake mit Birnenkompott",
      "GastDesc_en": "Basque cheesecake with Pear Compote",
      "MenuName": "FAVOURITES",
      "allergene": {
        "huhnerei": "Hühnerei und Hühnereierzeugnisse",
        "milch": "Milch und Milcherzeugnisse"
      },
      "merkmale": "",
      "naehrstoffe": "",
      "zusatzstoffe": [
        {
          "de": "Farbstoff",
          "en": "Colouring Agent"
        },
        {
          "de": "Alkohol",
          "en": "Alcohol"
        }
      ],
      "PrintOrder": "2",
      "CO2Value": null,
      "CO2Rating": null,
      "CO2Perc": null,
      "ClimateFriendly": null,
      "GastDesc": "Baskischer Cheesecake mit Birnenkompott",
      "date_de": "11.11.2025"
    },
    {
      "id": "4352072",
      "outlet": "cafe",
      "date": "2025-11-11",
      "CalendarWeek": "45",
      "day": "Dienstag",
      "mealtime": "Mittagessen",
      "IdentNr": "12025111198003",
      "itemId": "21063",
      "RecipeID": "8211",
      "ProductPrice": "0.50",
      "ProductPrice_2": null,
      "GastDesc_de": "LES ARLETTES (Französische Blätterteigkekse) Vegan",
      "GastDesc_en": "LES ARLETTES  (French Puff Pastry Cookies) Vegan",
      "MenuName": "MINIS",
      "allergene": {
        "gluten": "Glutenhaltiges Getreide"
      },
      "merkmale": {
        "vegan": "Vegan",
        "vegetarisch": "Vegetarisch"
      },
      "naehrstoffe": "",
      "zusatzstoffe": [
        {
          "de": "Farbstoff",
          "en": "Colouring Agent"
        },
        {
          "de": "Alkohol",
          "en": "Alcohol"
        }
      ],
      "PrintOrder": "3",
      "CO2Value": null,
      "CO2Rating": null,
      "CO2Perc": null,
      "ClimateFriendly": null,
      "GastDesc": "LES ARLETTES (Französische Blätterteigkekse) Vegan",
      "date_de": "11.11.2025"
    },
    {
      "id": "4352073",
      "outlet": "cafe",
      "date": "2025-11-11",
      "CalendarWeek": "45",
      "day": "Dienstag",
      "mealtime": "Mittagessen",
      "IdentNr": "12025111198005",
      "itemId": "21064",
      "RecipeID": "8330",
      "ProductPrice": "1.50",
      "ProductPrice_2": null,
      "GastDesc_de": "Saftige Brownie-Bananen-Cookies | Zuckerfrei",
      "GastDesc_en": "Fudgy Brownie Banana Cookies | Sugar-Free",
      "MenuName": "PEOPLES CHOICE",
      "allergene": {
        "erdnuss": "Erdnüsse und Erdnusserzeugnisse"
      },
      "merkmale": {
        "ohne_zucker": "Ohne_Zucker",
        "vegan": "Vegan",
        "vegetarisch": "Vegetarisch"
      },
      "naehrstoffe": "",
      "zusatzstoffe": null,
      "PrintOrder": "5",
      "CO2Value": null,
      "CO2Rating": null,
      "CO2Perc": null,
      "ClimateFriendly": null,
      "GastDesc": "Saftige Brownie-Bananen-Cookies | Zuckerfrei",
      "date_de": "11.11.2025"
    },
    {
      "id": "4352074",
      "outlet": "cafe",
      "date": "2025-11-11",
      "CalendarWeek": "45",
      "day": "Dienstag",
      "mealtime": "Mittagessen",
      "IdentNr": "12025111198006",
      "itemId": "21061",
      "RecipeID": "9036",
      "ProductPrice": "2.70",
      "ProductPrice_2": null,
      "GastDesc_de": "Kürbis-Bananenbrot mit Walnüssen | Zuckerfrei",
      "GastDesc_en": "Pumpkin-banana bread with walnuts | Sugar-free",
      "MenuName": "SEASON",
      "allergene": {
        "gluten": "Glutenhaltiges Getreide",
        "schalenfruchte": "Schalenfrüchte und Schalenfruchterzeugnisse",
        "huhnerei": "Hühnerei und Hühnereierzeugnisse",
        "milch": "Milch und Milcherzeugnisse"
      },
      "merkmale": "",
      "naehrstoffe": "",
      "zusatzstoffe": null,
      "PrintOrder": "6",
      "CO2Value": null,
      "CO2Rating": null,
      "CO2Perc": null,
      "ClimateFriendly": null,
      "GastDesc": "Kürbis-Bananenbrot mit Walnüssen | Zuckerfrei",
      "date_de": "11.11.2025"
    },
    {
      "id": "4352075",
      "outlet": "cafe",
      "date": "2025-11-11",
      "CalendarWeek": "45",
      "day": "Dienstag",
      "mealtime": "Mittagessen",
      "IdentNr": "12025111198007",
      "itemId": "12776",
      "RecipeID": "9037",
      "ProductPrice": "2.50",
      "ProductPrice_2": null,
      "GastDesc_de": "Biscoff Karamell \"Apple Pie\" Cookie | Vegan",
      "GastDesc_en": "Biscoff Caramel \"Apple Pie\" Cookie | Vegan",
      "MenuName": "COOKIE",
      "allergene": {
        "gluten": "Glutenhaltiges Getreide"
      },
      "merkmale": "",
      "naehrstoffe": "",
      "zusatzstoffe": [
        {
          "de": "Farbstoff",
          "en": "Colouring Agent"
        },
        {
          "de": "Antioxidationsmittel",
          "en": "Antioxidation"
        },
        {
          "de": "Alkohol",
          "en": "Alcohol"
        }
      ],
      "PrintOrder": "7",
      "CO2Value": null,
      "CO2Rating": null,
      "CO2Perc": null,
      "ClimateFriendly": null,
      "GastDesc": "Biscoff Karamell \"Apple Pie\" Cookie | Vegan",
      "date_de": "11.11.2025"
    },
    {
      "id": "4352076",
      "outlet": "cafe",
      "date": "2025-11-11",
      "CalendarWeek": "45",
      "day": "Dienstag",
      "mealtime": "Mittagessen",
      "IdentNr": "12025111198009",
      "itemId": "12773",
      "RecipeID": "9043",
      "ProductPrice": "3.00",
      "ProductPrice_2": null,
      "GastDesc_de": "Schwedischer Mandelkuchen",
      "GastDesc_en": "Traditional Swedish almond cake",
      "MenuName": "CLASSICS",
      "allergene": {
        "schalenfruchte": "Schalenfrüchte und Schalenfruchterzeugnisse",
        "huhnerei": "Hühnerei und Hühnereierzeugnisse",
        "milch": "Milch und Milcherzeugnisse"
      },
      "merkmale": "",
      "naehrstoffe": "",
      "zusatzstoffe": null,
      "PrintOrder": "9",
      "CO2Value": null,
      "CO2Rating": null,
      "CO2Perc": null,
      "ClimateFriendly": null,
      "GastDesc": "Schwedischer Mandelkuchen",
      "date_de": "11.11.2025"
    },
    {
      "id": "4352077",
      "outlet": "cafe",
      "date": "2025-11-11",
      "CalendarWeek": "45",
      "day": "Dienstag",
      "mealtime": "Mittagessen",
      "IdentNr": "12025111198011",
      "itemId": "16256",
      "RecipeID": "8775",
      "ProductPrice": "1.50",
      "ProductPrice_2": null,
      "GastDesc_de": "Schwedische Haferkekse | Vegan",
      "GastDesc_en": "Swedish Style Oatmeal Cookies | Vegan",
      "MenuName": "VEGAN SPECIAL",
      "allergene": {
        "gluten": "Glutenhaltiges Getreide"
      },
      "merkmale": {
        "vegan": "Vegan",
        "vegetarisch": "Vegetarisch"
      },
      "naehrstoffe": "",
      "zusatzstoffe": [
        {
          "de": "Farbstoff",
          "en": "Colouring Agent"
        },
        {
          "de": "Antioxidationsmittel",
          "en": "Antioxidation"
        },
        {
          "de": "Alkohol",
          "en": "Alcohol"
        }
      ],
      "PrintOrder": "11",
      "CO2Value": null,
      "CO2Rating": null,
      "CO2Perc": null,
      "ClimateFriendly": null,
      "GastDesc": "Schwedische Haferkekse | Vegan",
      "date_de": "11.11.2025"
    },
    {
      "id": "4352078",
      "outlet": "cafe",
      "date": "2025-11-12",
      "CalendarWeek": "45",
      "day": "Mittwoch",
      "mealtime": "Mittagessen",
      "IdentNr": "12025111298000",
      "itemId": "21060",
      "RecipeID": "9038",
      "ProductPrice": "3.00",
      "ProductPrice_2": null,
      "GastDesc_de": "Schoko-Zimt-Knoten | Vegan",
      "GastDesc_en": "Chocolate-cinnamon pastry knot | vegan",
      "MenuName": "CHOCOLATE",
      "allergene": {
        "gluten": "Glutenhaltiges Getreide",
        "schalenfruchte": "Schalenfrüchte und Schalenfruchterzeugnisse",
        "soja": "Soja und Sojaerzeugnisse",
        "sesam": "Sesamsamen und Sesamsamenerzeugnisse"
      },
      "merkmale": "",
      "naehrstoffe": "",
      "zusatzstoffe": null,
      "PrintOrder": "0",
      "CO2Value": null,
      "CO2Rating": null,
      "CO2Perc": null,
      "ClimateFriendly": null,
      "GastDesc": "Schoko-Zimt-Knoten | Vegan",
      "date_de": "12.11.2025"
    },
    {
      "id": "4352079",
      "outlet": "cafe",
      "date": "2025-11-12",
      "CalendarWeek": "45",
      "day": "Mittwoch",
      "mealtime": "Mittagessen",
      "IdentNr": "12025111298002",
      "itemId": "21062",
      "RecipeID": "8871",
      "ProductPrice": "3.60",
      "ProductPrice_2": null,
      "GastDesc_de": "Baskischer Cheesecake mit Birnenkompott",
      "GastDesc_en": "Basque cheesecake with Pear Compote",
      "MenuName": "FAVOURITES",
      "allergene": {
        "huhnerei": "Hühnerei und Hühnereierzeugnisse",
        "milch": "Milch und Milcherzeugnisse"
      },
      "merkmale": "",
      "naehrstoffe": "",
      "zusatzstoffe": [
        {
          "de": "Farbstoff",
          "en": "Colouring Agent"
        },
        {
          "de": "Alkohol",
          "en": "Alcohol"
        }
      ],
      "PrintOrder": "2",
      "CO2Value": null,
      "CO2Rating": null,
      "CO2Perc": null,
      "ClimateFriendly": null,
      "GastDesc": "Baskischer Cheesecake mit Birnenkompott",
      "date_de": "12.11.2025"
    },
    {
      "id": "4352080",
      "outlet": "cafe",
      "date": "2025-11-12",
      "CalendarWeek": "45",
      "day": "Mittwoch",
      "mealtime": "Mittagessen",
      "IdentNr": "12025111298003",
      "itemId": "21063",
      "RecipeID": "8211",
      "ProductPrice": "0.50",
      "ProductPrice_2": null,
      "GastDesc_de": "LES ARLETTES (Französische Blätterteigkekse) Vegan",
      "GastDesc_en": "LES ARLETTES  (French Puff Pastry Cookies) Vegan",
      "MenuName": "MINIS",
      "allergene": {
        "gluten": "Glutenhaltiges Getreide"
      },
      "merkmale": {
        "vegan": "Vegan",
        "vegetarisch": "Vegetarisch"
      },
      "naehrstoffe": "",
      "zusatzstoffe": [
        {
          "de": "Farbstoff",
          "en": "Colouring Agent"
        },
        {
          "de": "Alkohol",
          "en": "Alcohol"
        }
      ],
      "PrintOrder": "3",
      "CO2Value": null,
      "CO2Rating": null,
      "CO2Perc": null,
      "ClimateFriendly": null,
      "GastDesc": "LES ARLETTES (Französische Blätterteigkekse) Vegan",
      "date_de": "12.11.2025"
    },
    {
      "id": "4352081",
      "outlet": "cafe",
      "date": "2025-11-12",
      "CalendarWeek": "45",
      "day": "Mittwoch",
      "mealtime": "Mittagessen",
      "IdentNr": "12025111298005",
      "itemId": "21064",
      "RecipeID": "8330",
      "ProductPrice": "1.50",
      "ProductPrice_2": null,
      "GastDesc_de": "Saftige Brownie-Bananen-Cookies | Zuckerfrei",
      "GastDesc_en": "Fudgy Brownie Banana Cookies | Sugar-Free",
      "MenuName": "PEOPLES CHOICE",
      "allergene": {
        "erdnuss": "Erdnüsse und Erdnusserzeugnisse"
      },
      "merkmale": {
        "ohne_zucker": "Ohne_Zucker",
        "vegan": "Vegan",
        "vegetarisch": "Vegetarisch"
      },
      "naehrstoffe": "",
      "zusatzstoffe": null,
      "PrintOrder": "5",
      "CO2Value": null,
      "CO2Rating": null,
      "CO2Perc": null,
      "ClimateFriendly": null,
      "GastDesc": "Saftige Brownie-Bananen-Cookies | Zuckerfrei",
      "date_de": "12.11.2025"
    },
    {
      "id": "4352082",
      "outlet": "cafe",
      "date": "2025-11-12",
      "CalendarWeek": "45",
      "day": "Mittwoch",
      "mealtime": "Mittagessen",
      "IdentNr": "12025111298006",
      "itemId": "21061",
      "RecipeID": "9036",
      "ProductPrice": "2.70",
      "ProductPrice_2": null,
      "GastDesc_de": "Kürbis-Bananenbrot mit Walnüssen | Zuckerfrei",
      "GastDesc_en": "Pumpkin-banana bread with walnuts | Sugar-free",
      "MenuName": "SEASON",
      "allergene": {
        "gluten": "Glutenhaltiges Getreide",
        "schalenfruchte": "Schalenfrüchte und Schalenfruchterzeugnisse",
        "huhnerei": "Hühnerei und Hühnereierzeugnisse",
        "milch": "Milch und Milcherzeugnisse"
      },
      "merkmale": "",
      "naehrstoffe": "",
      "zusatzstoffe": null,
      "PrintOrder": "6",
      "CO2Value": null,
      "CO2Rating": null,
      "CO2Perc": null,
      "ClimateFriendly": null,
      "GastDesc": "Kürbis-Bananenbrot mit Walnüssen | Zuckerfrei",
      "date_de": "12.11.2025"
    },
    {
      "id": "4352083",
      "outlet": "cafe",
      "date": "2025-11-12",
      "CalendarWeek": "45",
      "day": "Mittwoch",
      "mealtime": "Mittagessen",
      "IdentNr": "12025111298007",
      "itemId": "12776",
      "RecipeID": "9037",
      "ProductPrice": "2.50",
      "ProductPrice_2": null,
      "GastDesc_de": "Biscoff Karamell \"Apple Pie\" Cookie | Vegan",
      "GastDesc_en": "Biscoff Caramel \"Apple Pie\" Cookie | Vegan",
      "MenuName": "COOKIE",
      "allergene": {
        "gluten": "Glutenhaltiges Getreide"
      },
      "merkmale": "",
      "naehrstoffe": "",
      "zusatzstoffe": [
        {
          "de": "Farbstoff",
          "en": "Colouring Agent"
        },
        {
          "de": "Antioxidationsmittel",
          "en": "Antioxidation"
        },
        {
          "de": "Alkohol",
          "en": "Alcohol"
        }
      ],
      "PrintOrder": "7",
      "CO2Value": null,
      "CO2Rating": null,
      "CO2Perc": null,
      "ClimateFriendly": null,
      "GastDesc": "Biscoff Karamell \"Apple Pie\" Cookie | Vegan",
      "date_de": "12.11.2025"
    },
    {
      "id": "4352084",
      "outlet": "cafe",
      "date": "2025-11-12",
      "CalendarWeek": "45",
      "day": "Mittwoch",
      "mealtime": "Mittagessen",
      "IdentNr": "12025111298009",
      "itemId": "12773",
      "RecipeID": "9043",
      "ProductPrice": "3.00",
      "ProductPrice_2": null,
      "GastDesc_de": "Schwedischer Mandelkuchen",
      "GastDesc_en": "Traditional Swedish almond cake",
      "MenuName": "CLASSICS",
      "allergene": {
        "schalenfruchte": "Schalenfrüchte und Schalenfruchterzeugnisse",
        "huhnerei": "Hühnerei und Hühnereierzeugnisse",
        "milch": "Milch und Milcherzeugnisse"
      },
      "merkmale": "",
      "naehrstoffe": "",
      "zusatzstoffe": null,
      "PrintOrder": "9",
      "CO2Value": null,
      "CO2Rating": null,
      "CO2Perc": null,
      "ClimateFriendly": null,
      "GastDesc": "Schwedischer Mandelkuchen",
      "date_de": "12.11.2025"
    },
    {
      "id": "4352085",
      "outlet": "cafe",
      "date": "2025-11-12",
      "CalendarWeek": "45",
      "day": "Mittwoch",
      "mealtime": "Mittagessen",
      "IdentNr": "12025111298011",
      "itemId": "16256",
      "RecipeID": "8775",
      "ProductPrice": "1.50",
      "ProductPrice_2": null,
      "GastDesc_de": "Schwedische Haferkekse | Vegan",
      "GastDesc_en": "Swedish Style Oatmeal Cookies | Vegan",
      "MenuName": "VEGAN SPECIAL",
      "allergene": {
        "gluten": "Glutenhaltiges Getreide"
      },
      "merkmale": {
        "vegan": "Vegan",
        "vegetarisch": "Vegetarisch"
      },
      "naehrstoffe": "",
      "zusatzstoffe": [
        {
          "de": "Farbstoff",
          "en": "Colouring Agent"
        },
        {
          "de": "Antioxidationsmittel",
          "en": "Antioxidation"
        },
        {
          "de": "Alkohol",
          "en": "Alcohol"
        }
      ],
      "PrintOrder": "11",
      "CO2Value": null,
      "CO2Rating": null,
      "CO2Perc": null,
      "ClimateFriendly": null,
      "GastDesc": "Schwedische Haferkekse | Vegan",
      "date_de": "12.11.2025"
    },
    {
      "id": "4352086",
      "outlet": "cafe",
      "date": "2025-11-13",
      "CalendarWeek": "45",
      "day": "Donnerstag",
      "mealtime": "Mittagessen",
      "IdentNr": "12025111398000",
      "itemId": "21060",
      "RecipeID": "9038",
      "ProductPrice": "3.00",
      "ProductPrice_2": null,
      "GastDesc_de": "Schoko-Zimt-Knoten | Vegan",
      "GastDesc_en": "Chocolate-cinnamon pastry knot | vegan",
      "MenuName": "CHOCOLATE",
      "allergene": {
        "gluten": "Glutenhaltiges Getreide",
        "schalenfruchte": "Schalenfrüchte und Schalenfruchterzeugnisse",
        "soja": "Soja und Sojaerzeugnisse",
        "sesam": "Sesamsamen und Sesamsamenerzeugnisse"
      },
      "merkmale": "",
      "naehrstoffe": "",
      "zusatzstoffe": null,
      "PrintOrder": "0",
      "CO2Value": null,
      "CO2Rating": null,
      "CO2Perc": null,
      "ClimateFriendly": null,
      "GastDesc": "Schoko-Zimt-Knoten | Vegan",
      "date_de": "13.11.2025"
    },
    {
      "id": "4352087",
      "outlet": "cafe",
      "date": "2025-11-13",
      "CalendarWeek": "45",
      "day": "Donnerstag",
      "mealtime": "Mittagessen",
      "IdentNr": "12025111398002",
      "itemId": "21062",
      "RecipeID": "8871",
      "ProductPrice": "3.60",
      "ProductPrice_2": null,
      "GastDesc_de": "Baskischer Cheesecake mit Birnenkompott",
      "GastDesc_en": "Basque cheesecake with Pear Compote",
      "MenuName": "FAVOURITES",
      "allergene": {
        "huhnerei": "Hühnerei und Hühnereierzeugnisse",
        "milch": "Milch und Milcherzeugnisse"
      },
      "merkmale": "",
      "naehrstoffe": "",
      "zusatzstoffe": [
        {
          "de": "Farbstoff",
          "en": "Colouring Agent"
        },
        {
          "de": "Alkohol",
          "en": "Alcohol"
        }
      ],
      "PrintOrder": "2",
      "CO2Value": null,
      "CO2Rating": null,
      "CO2Perc": null,
      "ClimateFriendly": null,
      "GastDesc": "Baskischer Cheesecake mit Birnenkompott",
      "date_de": "13.11.2025"
    },
    {
      "id": "4352088",
      "outlet": "cafe",
      "date": "2025-11-13",
      "CalendarWeek": "45",
      "day": "Donnerstag",
      "mealtime": "Mittagessen",
      "IdentNr": "12025111398003",
      "itemId": "21063",
      "RecipeID": "8211",
      "ProductPrice": "0.50",
      "ProductPrice_2": null,
      "GastDesc_de": "LES ARLETTES (Französische Blätterteigkekse) Vegan",
      "GastDesc_en": "LES ARLETTES  (French Puff Pastry Cookies) Vegan",
      "MenuName": "MINIS",
      "allergene": {
        "gluten": "Glutenhaltiges Getreide"
      },
      "merkmale": {
        "vegan": "Vegan",
        "vegetarisch": "Vegetarisch"
      },
      "naehrstoffe": "",
      "zusatzstoffe": [
        {
          "de": "Farbstoff",
          "en": "Colouring Agent"
        },
        {
          "de": "Alkohol",
          "en": "Alcohol"
        }
      ],
      "PrintOrder": "3",
      "CO2Value": null,
      "CO2Rating": null,
      "CO2Perc": null,
      "ClimateFriendly": null,
      "GastDesc": "LES ARLETTES (Französische Blätterteigkekse) Vegan",
      "date_de": "13.11.2025"
    },
    {
      "id": "4352089",
      "outlet": "cafe",
      "date": "2025-11-13",
      "CalendarWeek": "45",
      "day": "Donnerstag",
      "mealtime": "Mittagessen",
      "IdentNr": "12025111398005",
      "itemId": "21064",
      "RecipeID": "8330",
      "ProductPrice": "1.50",
      "ProductPrice_2": null,
      "GastDesc_de": "Saftige Brownie-Bananen-Cookies | Zuckerfrei",
      "GastDesc_en": "Fudgy Brownie Banana Cookies | Sugar-Free",
      "MenuName": "PEOPLES CHOICE",
      "allergene": {
        "erdnuss": "Erdnüsse und Erdnusserzeugnisse"
      },
      "merkmale": {
        "ohne_zucker": "Ohne_Zucker",
        "vegan": "Vegan",
        "vegetarisch": "Vegetarisch"
      },
      "naehrstoffe": "",
      "zusatzstoffe": null,
      "PrintOrder": "5",
      "CO2Value": null,
      "CO2Rating": null,
      "CO2Perc": null,
      "ClimateFriendly": null,
      "GastDesc": "Saftige Brownie-Bananen-Cookies | Zuckerfrei",
      "date_de": "13.11.2025"
    },
    {
      "id": "4352090",
      "outlet": "cafe",
      "date": "2025-11-13",
      "CalendarWeek": "45",
      "day": "Donnerstag",
      "mealtime": "Mittagessen",
      "IdentNr": "12025111398006",
      "itemId": "21061",
      "RecipeID": "9036",
      "ProductPrice": "2.70",
      "ProductPrice_2": null,
      "GastDesc_de": "Kürbis-Bananenbrot mit Walnüssen | Zuckerfrei",
      "GastDesc_en": "Pumpkin-banana bread with walnuts | Sugar-free",
      "MenuName": "SEASON",
      "allergene": {
        "gluten": "Glutenhaltiges Getreide",
        "schalenfruchte": "Schalenfrüchte und Schalenfruchterzeugnisse",
        "huhnerei": "Hühnerei und Hühnereierzeugnisse",
        "milch": "Milch und Milcherzeugnisse"
      },
      "merkmale": "",
      "naehrstoffe": "",
      "zusatzstoffe": null,
      "PrintOrder": "6",
      "CO2Value": null,
      "CO2Rating": null,
      "CO2Perc": null,
      "ClimateFriendly": null,
      "GastDesc": "Kürbis-Bananenbrot mit Walnüssen | Zuckerfrei",
      "date_de": "13.11.2025"
    },
    {
      "id": "4352091",
      "outlet": "cafe",
      "date": "2025-11-13",
      "CalendarWeek": "45",
      "day": "Donnerstag",
      "mealtime": "Mittagessen",
      "IdentNr": "12025111398007",
      "itemId": "12776",
      "RecipeID": "9037",
      "ProductPrice": "2.50",
      "ProductPrice_2": null,
      "GastDesc_de": "Biscoff Karamell \"Apple Pie\" Cookie | Vegan",
      "GastDesc_en": "Biscoff Caramel \"Apple Pie\" Cookie | Vegan",
      "MenuName": "COOKIE",
      "allergene": {
        "gluten": "Glutenhaltiges Getreide"
      },
      "merkmale": "",
      "naehrstoffe": "",
      "zusatzstoffe": [
        {
          "de": "Farbstoff",
          "en": "Colouring Agent"
        },
        {
          "de": "Antioxidationsmittel",
          "en": "Antioxidation"
        },
        {
          "de": "Alkohol",
          "en": "Alcohol"
        }
      ],
      "PrintOrder": "7",
      "CO2Value": null,
      "CO2Rating": null,
      "CO2Perc": null,
      "ClimateFriendly": null,
      "GastDesc": "Biscoff Karamell \"Apple Pie\" Cookie | Vegan",
      "date_de": "13.11.2025"
    },
    {
      "id": "4352092",
      "outlet": "cafe",
      "date": "2025-11-13",
      "CalendarWeek": "45",
      "day": "Donnerstag",
      "mealtime": "Mittagessen",
      "IdentNr": "12025111398009",
      "itemId": "12773",
      "RecipeID": "9043",
      "ProductPrice": "3.00",
      "ProductPrice_2": null,
      "GastDesc_de": "Schwedischer Mandelkuchen",
      "GastDesc_en": "Traditional Swedish almond cake",
      "MenuName": "CLASSICS",
      "allergene": {
        "schalenfruchte": "Schalenfrüchte und Schalenfruchterzeugnisse",
        "huhnerei": "Hühnerei und Hühnereierzeugnisse",
        "milch": "Milch und Milcherzeugnisse"
      },
      "merkmale": "",
      "naehrstoffe": "",
      "zusatzstoffe": null,
      "PrintOrder": "9",
      "CO2Value": null,
      "CO2Rating": null,
      "CO2Perc": null,
      "ClimateFriendly": null,
      "GastDesc": "Schwedischer Mandelkuchen",
      "date_de": "13.11.2025"
    },
    {
      "id": "4352093",
      "outlet": "cafe",
      "date": "2025-11-13",
      "CalendarWeek": "45",
      "day": "Donnerstag",
      "mealtime": "Mittagessen",
      "IdentNr": "12025111398011",
      "itemId": "16256",
      "RecipeID": "8775",
      "ProductPrice": "1.50",
      "ProductPrice_2": null,
      "GastDesc_de": "Schwedische Haferkekse | Vegan",
      "GastDesc_en": "Swedish Style Oatmeal Cookies | Vegan",
      "MenuName": "VEGAN SPECIAL",
      "allergene": {
        "gluten": "Glutenhaltiges Getreide"
      },
      "merkmale": {
        "vegan": "Vegan",
        "vegetarisch": "Vegetarisch"
      },
      "naehrstoffe": "",
      "zusatzstoffe": [
        {
          "de": "Farbstoff",
          "en": "Colouring Agent"
        },
        {
          "de": "Antioxidationsmittel",
          "en": "Antioxidation"
        },
        {
          "de": "Alkohol",
          "en": "Alcohol"
        }
      ],
      "PrintOrder": "11",
      "CO2Value": null,
      "CO2Rating": null,
      "CO2Perc": null,
      "ClimateFriendly": null,
      "GastDesc": "Schwedische Haferkekse | Vegan",
      "date_de": "13.11.2025"
    },
    {
      "id": "4352094",
      "outlet": "cafe",
      "date": "2025-11-14",
      "CalendarWeek": "45",
      "day": "Freitag",
      "mealtime": "Mittagessen",
      "IdentNr": "12025111498000",
      "itemId": "21060",
      "RecipeID": "9038",
      "ProductPrice": "3.00",
      "ProductPrice_2": null,
      "GastDesc_de": "Schoko-Zimt-Knoten | Vegan",
      "GastDesc_en": "Chocolate-cinnamon pastry knot | vegan",
      "MenuName": "CHOCOLATE",
      "allergene": {
        "gluten": "Glutenhaltiges Getreide",
        "schalenfruchte": "Schalenfrüchte und Schalenfruchterzeugnisse",
        "soja": "Soja und Sojaerzeugnisse",
        "sesam": "Sesamsamen und Sesamsamenerzeugnisse"
      },
      "merkmale": "",
      "naehrstoffe": "",
      "zusatzstoffe": null,
      "PrintOrder": "0",
      "CO2Value": null,
      "CO2Rating": null,
      "CO2Perc": null,
      "ClimateFriendly": null,
      "GastDesc": "Schoko-Zimt-Knoten | Vegan",
      "date_de": "14.11.2025"
    },
    {
      "id": "4352095",
      "outlet": "cafe",
      "date": "2025-11-14",
      "CalendarWeek": "45",
      "day": "Freitag",
      "mealtime": "Mittagessen",
      "IdentNr": "12025111498002",
      "itemId": "21062",
      "RecipeID": "8871",
      "ProductPrice": "3.60",
      "ProductPrice_2": null,
      "GastDesc_de": "Baskischer Cheesecake mit Birnenkompott",
      "GastDesc_en": "Basque cheesecake with Pear Compote",
      "MenuName": "FAVOURITES",
      "allergene": {
        "huhnerei": "Hühnerei und Hühnereierzeugnisse",
        "milch": "Milch und Milcherzeugnisse"
      },
      "merkmale": "",
      "naehrstoffe": "",
      "zusatzstoffe": [
        {
          "de": "Farbstoff",
          "en": "Colouring Agent"
        },
        {
          "de": "Alkohol",
          "en": "Alcohol"
        }
      ],
      "PrintOrder": "2",
      "CO2Value": null,
      "CO2Rating": null,
      "CO2Perc": null,
      "ClimateFriendly": null,
      "GastDesc": "Baskischer Cheesecake mit Birnenkompott",
      "date_de": "14.11.2025"
    },
    {
      "id": "4352096",
      "outlet": "cafe",
      "date": "2025-11-14",
      "CalendarWeek": "45",
      "day": "Freitag",
      "mealtime": "Mittagessen",
      "IdentNr": "12025111498003",
      "itemId": "21063",
      "RecipeID": "8211",
      "ProductPrice": "0.50",
      "ProductPrice_2": null,
      "GastDesc_de": "LES ARLETTES (Französische Blätterteigkekse) Vegan",
      "GastDesc_en": "LES ARLETTES  (French Puff Pastry Cookies) Vegan",
      "MenuName": "MINIS",
      "allergene": {
        "gluten": "Glutenhaltiges Getreide"
      },
      "merkmale": {
        "vegan": "Vegan",
        "vegetarisch": "Vegetarisch"
      },
      "naehrstoffe": "",
      "zusatzstoffe": [
        {
          "de": "Farbstoff",
          "en": "Colouring Agent"
        },
        {
          "de": "Alkohol",
          "en": "Alcohol"
        }
      ],
      "PrintOrder": "3",
      "CO2Value": null,
      "CO2Rating": null,
      "CO2Perc": null,
      "ClimateFriendly": null,
      "GastDesc": "LES ARLETTES (Französische Blätterteigkekse) Vegan",
      "date_de": "14.11.2025"
    },
    {
      "id": "4352097",
      "outlet": "cafe",
      "date": "2025-11-14",
      "CalendarWeek": "45",
      "day": "Freitag",
      "mealtime": "Mittagessen",
      "IdentNr": "12025111498005",
      "itemId": "21064",
      "RecipeID": "8330",
      "ProductPrice": "1.50",
      "ProductPrice_2": null,
      "GastDesc_de": "Saftige Brownie-Bananen-Cookies | Zuckerfrei",
      "GastDesc_en": "Fudgy Brownie Banana Cookies | Sugar-Free",
      "MenuName": "PEOPLES CHOICE",
      "allergene": {
        "erdnuss": "Erdnüsse und Erdnusserzeugnisse"
      },
      "merkmale": {
        "ohne_zucker": "Ohne_Zucker",
        "vegan": "Vegan",
        "vegetarisch": "Vegetarisch"
      },
      "naehrstoffe": "",
      "zusatzstoffe": null,
      "PrintOrder": "5",
      "CO2Value": null,
      "CO2Rating": null,
      "CO2Perc": null,
      "ClimateFriendly": null,
      "GastDesc": "Saftige Brownie-Bananen-Cookies | Zuckerfrei",
      "date_de": "14.11.2025"
    },
    {
      "id": "4352098",
      "outlet": "cafe",
      "date": "2025-11-14",
      "CalendarWeek": "45",
      "day": "Freitag",
      "mealtime": "Mittagessen",
      "IdentNr": "12025111498006",
      "itemId": "21061",
      "RecipeID": "9036",
      "ProductPrice": "2.70",
      "ProductPrice_2": null,
      "GastDesc_de": "Kürbis-Bananenbrot mit Walnüssen | Zuckerfrei",
      "GastDesc_en": "Pumpkin-banana bread with walnuts | Sugar-free",
      "MenuName": "SEASON",
      "allergene": {
        "gluten": "Glutenhaltiges Getreide",
        "schalenfruchte": "Schalenfrüchte und Schalenfruchterzeugnisse",
        "huhnerei": "Hühnerei und Hühnereierzeugnisse",
        "milch": "Milch und Milcherzeugnisse"
      },
      "merkmale": "",
      "naehrstoffe": "",
      "zusatzstoffe": null,
      "PrintOrder": "6",
      "CO2Value": null,
      "CO2Rating": null,
      "CO2Perc": null,
      "ClimateFriendly": null,
      "GastDesc": "Kürbis-Bananenbrot mit Walnüssen | Zuckerfrei",
      "date_de": "14.11.2025"
    },
    {
      "id": "4352099",
      "outlet": "cafe",
      "date": "2025-11-14",
      "CalendarWeek": "45",
      "day": "Freitag",
      "mealtime": "Mittagessen",
      "IdentNr": "12025111498007",
      "itemId": "12776",
      "RecipeID": "9037",
      "ProductPrice": "2.50",
      "ProductPrice_2": null,
      "GastDesc_de": "Biscoff Karamell \"Apple Pie\" Cookie | Vegan",
      "GastDesc_en": "Biscoff Caramel \"Apple Pie\" Cookie | Vegan",
      "MenuName": "COOKIE",
      "allergene": {
        "gluten": "Glutenhaltiges Getreide"
      },
      "merkmale": "",
      "naehrstoffe": "",
      "zusatzstoffe": [
        {
          "de": "Farbstoff",
          "en": "Colouring Agent"
        },
        {
          "de": "Antioxidationsmittel",
          "en": "Antioxidation"
        },
        {
          "de": "Alkohol",
          "en": "Alcohol"
        }
      ],
      "PrintOrder": "7",
      "CO2Value": null,
      "CO2Rating": null,
      "CO2Perc": null,
      "ClimateFriendly": null,
      "GastDesc": "Biscoff Karamell \"Apple Pie\" Cookie | Vegan",
      "date_de": "14.11.2025"
    },
    {
      "id": "4352100",
      "outlet": "cafe",
      "date": "2025-11-14",
      "CalendarWeek": "45",
      "day": "Freitag",
      "mealtime": "Mittagessen",
      "IdentNr": "12025111498009",
      "itemId": "12773",
      "RecipeID": "9043",
      "ProductPrice": "3.00",
      "ProductPrice_2": null,
      "GastDesc_de": "Schwedischer Mandelkuchen",
      "GastDesc_en": "Traditional Swedish almond cake",
      "MenuName": "CLASSICS",
      "allergene": {
        "schalenfruchte": "Schalenfrüchte und Schalenfruchterzeugnisse",
        "huhnerei": "Hühnerei und Hühnereierzeugnisse",
        "milch": "Milch und Milcherzeugnisse"
      },
      "merkmale": "",
      "naehrstoffe": "",
      "zusatzstoffe": null,
      "PrintOrder": "9",
      "CO2Value": null,
      "CO2Rating": null,
      "CO2Perc": null,
      "ClimateFriendly": null,
      "GastDesc": "Schwedischer Mandelkuchen",
      "date_de": "14.11.2025"
    },
    {
      "id": "4352101",
      "outlet": "cafe",
      "date": "2025-11-14",
      "CalendarWeek": "45",
      "day": "Freitag",
      "mealtime": "Mittagessen",
      "IdentNr": "12025111498011",
      "itemId": "16256",
      "RecipeID": "8775",
      "ProductPrice": "1.50",
      "ProductPrice_2": null,
      "GastDesc_de": "Schwedische Haferkekse | Vegan",
      "GastDesc_en": "Swedish Style Oatmeal Cookies | Vegan",
      "MenuName": "VEGAN SPECIAL",
      "allergene": {
        "gluten": "Glutenhaltiges Getreide"
      },
      "merkmale": {
        "vegan": "Vegan",
        "vegetarisch": "Vegetarisch"
      },
      "naehrstoffe": "",
      "zusatzstoffe": [
        {
          "de": "Farbstoff",
          "en": "Colouring Agent"
        },
        {
          "de": "Antioxidationsmittel",
          "en": "Antioxidation"
        },
        {
          "de": "Alkohol",
          "en": "Alcohol"
        }
      ],
      "PrintOrder": "11",
      "CO2Value": null,
      "CO2Rating": null,
      "CO2Perc": null,
      "ClimateFriendly": null,
      "GastDesc": "Schwedische Haferkekse | Vegan",
      "date_de": "14.11.2025"
    },
    {
      "id": "4296334",
      "outlet": "canteen",
      "date": "2025-11-03",
      "CalendarWeek": "45",
      "day": "Montag",
      "mealtime": "Mittagessen",
      "IdentNr": "12025110398000",
      "itemId": "17549",
      "RecipeID": "4053",
      "ProductPrice": "10.00",
      "ProductPrice_2": null,
      "GastDesc_de": "Bulgur-Salat | Feta | Karotte",
      "GastDesc_en": "Bulgur salad | Feta | Carrot",
      "MenuName": "COUNTER 1.1 Bowls_",
      "allergene": {
        "gluten": "Glutenhaltiges Getreide",
        "schalenfruchte": "Schalenfrüchte und Schalenfruchterzeugnisse",
        "milch": "Milch und Milcherzeugnisse"
      },
      "merkmale": {
        "vegetarisch": "Vegetarisch"
      },
      "naehrstoffe": "",
      "zusatzstoffe": [
        {
          "de": "geschwefelt",
          "en": "Sulphurous"
        },
        {
          "de": "Antioxidationsmittel",
          "en": "Antioxidation"
        },
        {
          "de": "Alkohol",
          "en": "Alcohol"
        }
      ],
      "PrintOrder": "0",
      "CO2Value": "1031.00",
      "CO2Rating": "B",
      "CO2Perc": "100.00",
      "ClimateFriendly": null,
      "GastDesc": "Bulgur-Salat | Feta | Karotte",
      "date_de": "03.11.2025"
    },
    {
      "id": "4296335",
      "outlet": "canteen",
      "date": "2025-11-03",
      "CalendarWeek": "45",
      "day": "Montag",
      "mealtime": "Mittagessen",
      "IdentNr": "12025110398001",
      "itemId": "17550",
      "RecipeID": "4419",
      "ProductPrice": "12.00",
      "ProductPrice_2": null,
      "GastDesc_de": "Maishähnchenbrust | Ebly | Strauchtomaten | Minzayran",
      "GastDesc_en": "Corn-Fed Chicken Breast | Ebly Wheat | Vine Tomatoes | Mint Ayran",
      "MenuName": "COUNTER 2.1 Meat",
      "allergene": {
        "gluten": "Glutenhaltiges Getreide",
        "milch": "Milch und Milcherzeugnisse",
        "sellerie": "Sellerie und Sellerieerzeugnisse"
      },
      "merkmale": "",
      "naehrstoffe": "",
      "zusatzstoffe": null,
      "PrintOrder": "1",
      "CO2Value": "665.00",
      "CO2Rating": "B",
      "CO2Perc": "100.00",
      "ClimateFriendly": null,
      "GastDesc": "Maishähnchenbrust | Ebly | Strauchtomaten | Minzayran",
      "date_de": "03.11.2025"
    },
    {
      "id": "4296336",
      "outlet": "canteen",
      "date": "2025-11-03",
      "CalendarWeek": "45",
      "day": "Montag",
      "mealtime": "Mittagessen",
      "IdentNr": "12025110398003",
      "itemId": "17552",
      "RecipeID": "9049",
      "ProductPrice": "12.00",
      "ProductPrice_2": null,
      "GastDesc_de": "Kartoffel-Kürbis-Risotto | Rotbarsch | Estragon-Senfschaum",
      "GastDesc_en": "Potato and Pumpkin Risotto | Redfish | Tarragon Mustard Foam",
      "MenuName": "COUNTER 3.1 Fish",
      "allergene": {
        "huhnerei": "Hühnerei und Hühnereierzeugnisse",
        "fisch": "Fisch und Fischerzeugnisse",
        "milch": "Milch und Milcherzeugnisse",
        "sellerie": "Sellerie und Sellerieerzeugnisse",
        "senf": "Senf und Senferzeugnisse",
        "schwefel": "Schwefeldioxid und Sulfide"
      },
      "merkmale": "",
      "naehrstoffe": "",
      "zusatzstoffe": [
        {
          "de": "Alkohol",
          "en": "Alcohol"
        }
      ],
      "PrintOrder": "3",
      "CO2Value": "1066.00",
      "CO2Rating": "B",
      "CO2Perc": "100.00",
      "ClimateFriendly": null,
      "GastDesc": "Kartoffel-Kürbis-Risotto | Rotbarsch | Estragon-Senfschaum",
      "date_de": "03.11.2025"
    },
    {
      "id": "4296337",
      "outlet": "canteen",
      "date": "2025-11-03",
      "CalendarWeek": "45",
      "day": "Montag",
      "mealtime": "Mittagessen",
      "IdentNr": "12025110398005",
      "itemId": "17554",
      "RecipeID": "4564",
      "ProductPrice": "9.50",
      "ProductPrice_2": null,
      "GastDesc_de": "Kichererbsen-Masala | Basmati | Papadam",
      "GastDesc_en": "Chickpea Masala | Basmati Rice | Papadam",
      "MenuName": "COUNTER 4.1 Vegi",
      "allergene": {
        "sellerie": "Sellerie und Sellerieerzeugnisse"
      },
      "merkmale": {
        "vegan": "Vegan",
        "vegetarisch": "Vegetarisch"
      },
      "naehrstoffe": "",
      "zusatzstoffe": [
        {
          "de": "Süßungsmittel",
          "en": "Sweetener"
        },
        {
          "de": "Phenylalaninquelle",
          "en": "Phenylalanine"
        },
        {
          "de": "Konservierungsstoff",
          "en": "Preservatives"
        }
      ],
      "PrintOrder": "5",
      "CO2Value": "532.00",
      "CO2Rating": "A",
      "CO2Perc": "100.00",
      "ClimateFriendly": "1",
      "GastDesc": "Kichererbsen-Masala | Basmati | Papadam",
      "date_de": "03.11.2025"
    },
    {
      "id": "4296338",
      "outlet": "canteen",
      "date": "2025-11-03",
      "CalendarWeek": "45",
      "day": "Montag",
      "mealtime": "Abendessen",
      "IdentNr": "12025110398009",
      "itemId": "17558",
      "RecipeID": "4053",
      "ProductPrice": "10.00",
      "ProductPrice_2": null,
      "GastDesc_de": "Bulgur-Salat | Feta | Karotte",
      "GastDesc_en": "Bulgur salad | Feta | Carrot",
      "MenuName": "DINNER BOWL_",
      "allergene": {
        "gluten": "Glutenhaltiges Getreide",
        "schalenfruchte": "Schalenfrüchte und Schalenfruchterzeugnisse",
        "milch": "Milch und Milcherzeugnisse"
      },
      "merkmale": {
        "vegetarisch": "Vegetarisch"
      },
      "naehrstoffe": "",
      "zusatzstoffe": [
        {
          "de": "geschwefelt",
          "en": "Sulphurous"
        },
        {
          "de": "Antioxidationsmittel",
          "en": "Antioxidation"
        },
        {
          "de": "Alkohol",
          "en": "Alcohol"
        }
      ],
      "PrintOrder": "9",
      "CO2Value": "1031.00",
      "CO2Rating": "B",
      "CO2Perc": "100.00",
      "ClimateFriendly": null,
      "GastDesc": "Bulgur-Salat | Feta | Karotte",
      "date_de": "03.11.2025"
    },
    {
      "id": "4296340",
      "outlet": "canteen",
      "date": "2025-11-03",
      "CalendarWeek": "45",
      "day": "Montag",
      "mealtime": "Abendessen",
      "IdentNr": "12025110398010",
      "itemId": "17559",
      "RecipeID": "4419",
      "ProductPrice": "12.00",
      "ProductPrice_2": null,
      "GastDesc_de": "Maishähnchenbrust | Ebly | Strauchtomaten | Minzayran",
      "GastDesc_en": "Corn-Fed Chicken Breast | Ebly Wheat | Vine Tomatoes | Mint Ayran",
      "MenuName": "DINNER Meat_17:00-19:00",
      "allergene": {
        "gluten": "Glutenhaltiges Getreide",
        "milch": "Milch und Milcherzeugnisse",
        "sellerie": "Sellerie und Sellerieerzeugnisse"
      },
      "merkmale": "",
      "naehrstoffe": "",
      "zusatzstoffe": null,
      "PrintOrder": "10",
      "CO2Value": "665.00",
      "CO2Rating": "B",
      "CO2Perc": "100.00",
      "ClimateFriendly": null,
      "GastDesc": "Maishähnchenbrust | Ebly | Strauchtomaten | Minzayran",
      "date_de": "03.11.2025"
    },
    {
      "id": "4296342",
      "outlet": "canteen",
      "date": "2025-11-03",
      "CalendarWeek": "45",
      "day": "Montag",
      "mealtime": "Abendessen",
      "IdentNr": "12025110398012",
      "itemId": "17561",
      "RecipeID": "4564",
      "ProductPrice": "9.50",
      "ProductPrice_2": null,
      "GastDesc_de": "Kichererbsen-Masala | Basmati | Papadam",
      "GastDesc_en": "Chickpea Masala | Basmati Rice | Papadam",
      "MenuName": "DINNER Vegi/Vegan_17:00-19:00",
      "allergene": {
        "sellerie": "Sellerie und Sellerieerzeugnisse"
      },
      "merkmale": {
        "vegan": "Vegan",
        "vegetarisch": "Vegetarisch"
      },
      "naehrstoffe": "",
      "zusatzstoffe": [
        {
          "de": "Süßungsmittel",
