{
  "daySelector": [
    {
      "date": "2026-02-07",
      "day": "Samstag",
      "CalendarWeek": "6",
      "date_de": "07.02.2026"
    },
    {
      "date": "2026-02-08",
      "day": "Sonntag",
      "CalendarWeek": "6",
      "date_de": "08.02.2026"
    },
    {
      "date": "2026-02-09",
      "day": "Montag",
      "CalendarWeek": "7",
      "date_de": "09.02.2026"
    },
    {
      "date": "2026-02-10",
      "day": "Dienstag",
      "CalendarWeek": "7",
      "date_de": "10.02.2026"
    },
    {
      "date": "2026-02-11",
      "day": "Mittwoch",
      "CalendarWeek": "7",
      "date_de": "11.02.2026"
    },
    {
      "date": "2026-02-12",
      "day": "Donnerstag",
      "CalendarWeek": "7",
      "date_de": "12.02.2026"
    },
    {
      "date": "2026-02-13",
      "day": "Freitag",
      "CalendarWeek": "7",
      "date_de": "13.02.2026"
    },
    {
      "date": "2026-02-14",
      "day": "Samstag",
      "CalendarWeek": "7",
      "date_de": "14.02.2026"
    },
    {
      "date": "2026-02-15",
      "day": "Sonntag",
      "CalendarWeek": "7",
      "date_de": "15.02.2026"
    },
    {
      "date": "2026-02-16",
      "day": "Montag",
      "CalendarWeek": "7",
      "date_de": "16.02.2026"
    },
    {
      "date": "2026-02-17",
      "day": "Dienstag",
      "CalendarWeek": "7",
      "date_de": "17.02.2026"
    },
    {
      "date": "2026-02-18",
      "day": "Mittwoch",
      "CalendarWeek": "7",
      "date_de": "18.02.2026"
    },
    {
      "date": "2026-02-19",
      "day": "Donnerstag",
      "CalendarWeek": "7",
      "date_de": "19.02.2026"
    },
    {
      "date": "2026-02-20",
      "day": "Freitag",
      "CalendarWeek": "7",
      "date_de": "20.02.2026"
    },
    {
      "date": "2026-02-21",
      "day": "Samstag",
      "CalendarWeek": "7",
      "date_de": "21.02.2026"
    },
    {
      "date": "2026-02-22",
      "day": "Sonntag",
      "CalendarWeek": "7",
      "date_de": "22.02.2026"
    },
    {
      "date": "2026-02-23",
      "day": "Montag",
      "CalendarWeek": "7",
      "date_de": "23.02.2026"
    },
    {
      "date": "2026-02-24",
      "day": "Dienstag",
      "CalendarWeek": "7",
      "date_de": "24.02.2026"
    },
    {
      "date": "2026-02-25",
      "day": "Mittwoch",
      "CalendarWeek": "7",
      "date_de": "25.02.2026"
    },
    {
      "date": "2026-02-26",
      "day": "Donnerstag",
      "CalendarWeek": "7",
      "date_de": "26.02.2026"
    },
    {
      "date": "2026-02-27",
      "day": "Freitag",
      "CalendarWeek": "7",
      "date_de": "27.02.2026"
    }
  ],
  "data": [
    {
      "id": "5687687",
      "outlet": "cafe",
      "date": "2026-02-09",
      "CalendarWeek": "7",
      "day": "Montag",
      "mealtime": "Mittagessen",
      "IdentNr": "12026020998001",
      "itemId": "21059",
      "RecipeID": "8054",
      "ProductPrice": "3.20",
      "ProductPrice_2": null,
      "GastDesc_de": "Pflaumenmus-Croffin mit Vanilleschmand",
      "GastDesc_en": "Plum Jam Croffin with Vanilla Sour Cream",
      "MenuName": "CROFFIN",
      "allergene": {
        "gluten": "Glutenhaltiges Getreide",
        "schalenfruchte": "Schalenfrüchte und Schalenfruchterzeugnisse",
        "huhnerei": "Hühnerei und Hühnereierzeugnisse",
        "soja": "Soja und Sojaerzeugnisse",
        "milch": "Milch und Milcherzeugnisse"
      },
      "merkmale": "",
      "naehrstoffe": "",
      "zusatzstoffe": [
        {
          "de": "Farbstoff",
          "en": "Colouring Agent"
        },
        {
          "de": "Alkohol",
          "en": "Alcohol"
        }
      ],
      "PrintOrder": "1",
      "CO2Value": null,
      "CO2Rating": null,
      "CO2Perc": null,
      "ClimateFriendly": null,
      "GastDesc": "Pflaumenmus-Croffin mit Vanilleschmand",
      "date_de": "09.02.2026"
    },
    {
      "id": "5687688",
      "outlet": "cafe",
      "date": "2026-02-09",
      "CalendarWeek": "7",
      "day": "Montag",
      "mealtime": "Mittagessen",
      "IdentNr": "12026020998002",
      "itemId": "21062",
      "RecipeID": "8871",
      "ProductPrice": "3.60",
      "ProductPrice_2": null,
      "GastDesc_de": "Baskischer Cheesecake mit Marillenkompott",
      "GastDesc_en": "Basque-style Cheesecake with Apricot Compote",
      "MenuName": "FAVOURITES",
      "allergene": {
        "huhnerei": "Hühnerei und Hühnereierzeugnisse",
        "milch": "Milch und Milcherzeugnisse"
      },
      "merkmale": "",
      "naehrstoffe": "",
      "zusatzstoffe": [
        {
          "de": "Farbstoff",
          "en": "Colouring Agent"
        },
        {
          "de": "Alkohol",
          "en": "Alcohol"
        }
      ],
      "PrintOrder": "2",
      "CO2Value": null,
      "CO2Rating": null,
      "CO2Perc": null,
      "ClimateFriendly": null,
      "GastDesc": "Baskischer Cheesecake mit Marillenkompott",
      "date_de": "09.02.2026"
    },
    {
      "id": "5687689",
      "outlet": "cafe",
      "date": "2026-02-09",
      "CalendarWeek": "7",
      "day": "Montag",
      "mealtime": "Mittagessen",
      "IdentNr": "12026020998003",
      "itemId": "21063",
      "RecipeID": "8211",
      "ProductPrice": "0.50",
      "ProductPrice_2": null,
      "GastDesc_de": "LES ARLETTES (Französische Blätterteigkekse) Vegan",
      "GastDesc_en": "LES ARLETTES  (French Puff Pastry Cookies) Vegan",
      "MenuName": "MINIS",
      "allergene": {
        "gluten": "Glutenhaltiges Getreide"
      },
      "merkmale": {
        "vegan": "Vegan",
        "vegetarisch": "Vegetarisch"
      },
      "naehrstoffe": "",
      "zusatzstoffe": [
        {
          "de": "Farbstoff",
          "en": "Colouring Agent"
        },
        {
          "de": "Alkohol",
          "en": "Alcohol"
        }
      ],
      "PrintOrder": "3",
      "CO2Value": null,
      "CO2Rating": null,
      "CO2Perc": null,
      "ClimateFriendly": null,
      "GastDesc": "LES ARLETTES (Französische Blätterteigkekse) Vegan",
      "date_de": "09.02.2026"
    },
    {
      "id": "5687690",
      "outlet": "cafe",
      "date": "2026-02-09",
      "CalendarWeek": "7",
      "day": "Montag",
      "mealtime": "Mittagessen",
      "IdentNr": "12026020998005",
      "itemId": "21064",
      "RecipeID": "8330",
      "ProductPrice": "1.50",
      "ProductPrice_2": null,
      "GastDesc_de": "Saftige Brownie-Bananen-Cookies | Zuckerfrei",
      "GastDesc_en": "Fudgy Brownie Banana Cookies | Sugar-Free",
      "MenuName": "PEOPLES CHOICE",
      "allergene": {
        "erdnuss": "Erdnüsse und Erdnusserzeugnisse"
      },
      "merkmale": {
        "ohne_zucker": "Ohne_Zucker",
        "vegan": "Vegan",
        "vegetarisch": "Vegetarisch"
      },
      "naehrstoffe": "",
      "zusatzstoffe": null,
      "PrintOrder": "5",
      "CO2Value": null,
      "CO2Rating": null,
      "CO2Perc": null,
      "ClimateFriendly": null,
      "GastDesc": "Saftige Brownie-Bananen-Cookies | Zuckerfrei",
      "date_de": "09.02.2026"
    },
    {
      "id": "5687691",
      "outlet": "cafe",
      "date": "2026-02-09",
      "CalendarWeek": "7",
      "day": "Montag",
      "mealtime": "Mittagessen",
      "IdentNr": "12026020998006",
      "itemId": "21061",
      "RecipeID": "8697",
      "ProductPrice": "2.50",
      "ProductPrice_2": null,
      "GastDesc_de": "Erdnussbutter-Cookie mit Schokolade und Salzkaramell | Vegan",
      "GastDesc_en": "Peanutbutter Cookie with Chocolate Salty Caramel | Vegan",
      "MenuName": "SEASON",
      "allergene": {
        "gluten": "Glutenhaltiges Getreide",
        "soja": "Soja und Sojaerzeugnisse",
        "erdnuss": "Erdnüsse und Erdnusserzeugnisse"
      },
      "merkmale": "",
      "naehrstoffe": "",
      "zusatzstoffe": [
        {
          "de": "Farbstoff",
          "en": "Colouring Agent"
        },
        {
          "de": "Antioxidationsmittel",
          "en": "Antioxidation"
        },
        {
          "de": "Alkohol",
          "en": "Alcohol"
        }
      ],
      "PrintOrder": "6",
      "CO2Value": null,
      "CO2Rating": null,
      "CO2Perc": null,
      "ClimateFriendly": null,
      "GastDesc": "Erdnussbutter-Cookie mit Schokolade und Salzkaramell | Vegan",
      "date_de": "09.02.2026"
    },
    {
      "id": "5687692",
      "outlet": "cafe",
      "date": "2026-02-09",
      "CalendarWeek": "7",
      "day": "Montag",
      "mealtime": "Mittagessen",
      "IdentNr": "12026020998007",
      "itemId": "12776",
      "RecipeID": "8453",
      "ProductPrice": "2.50",
      "ProductPrice_2": null,
      "GastDesc_de": "Oreo-Cheesecake-Cookies",
      "GastDesc_en": "Oreo Cheesecake Cookies",
      "MenuName": "COOKIE",
      "allergene": {
        "gluten": "Glutenhaltiges Getreide",
        "huhnerei": "Hühnerei und Hühnereierzeugnisse",
        "milch": "Milch und Milcherzeugnisse"
      },
      "merkmale": "",
      "naehrstoffe": "",
      "zusatzstoffe": [
        {
          "de": "Farbstoff",
          "en": "Colouring Agent"
        },
        {
          "de": "Alkohol",
          "en": "Alcohol"
        }
      ],
      "PrintOrder": "7",
      "CO2Value": null,
      "CO2Rating": null,
      "CO2Perc": null,
      "ClimateFriendly": null,
      "GastDesc": "Oreo-Cheesecake-Cookies",
      "date_de": "09.02.2026"
    },
    {
      "id": "5687693",
      "outlet": "cafe",
      "date": "2026-02-09",
      "CalendarWeek": "7",
      "day": "Montag",
      "mealtime": "Mittagessen",
      "IdentNr": "12026020998008",
      "itemId": "12777",
      "RecipeID": "9121",
      "ProductPrice": "2.50",
      "ProductPrice_2": null,
      "GastDesc_de": "Carrotcake  Bananenbrot | Zuckerfrei",
      "GastDesc_en": "Carrot Cake Banana Bread | Sugar-Free",
      "MenuName": "TAG des KASTENKUCHENS",
      "allergene": {
        "gluten": "Glutenhaltiges Getreide",
        "huhnerei": "Hühnerei und Hühnereierzeugnisse",
        "milch": "Milch und Milcherzeugnisse",
        "schwefel": "Schwefeldioxid und Sulfide"
      },
      "merkmale": "",
      "naehrstoffe": "",
      "zusatzstoffe": [
        {
          "de": "Farbstoff",
          "en": "Colouring Agent"
        }
      ],
      "PrintOrder": "8",
      "CO2Value": null,
      "CO2Rating": null,
      "CO2Perc": null,
      "ClimateFriendly": null,
      "GastDesc": "Carrotcake  Bananenbrot | Zuckerfrei",
      "date_de": "09.02.2026"
    },
    {
      "id": "5687694",
      "outlet": "cafe",
      "date": "2026-02-09",
      "CalendarWeek": "7",
      "day": "Montag",
      "mealtime": "Mittagessen",
      "IdentNr": "12026020998011",
      "itemId": "16256",
      "RecipeID": "9122",
      "ProductPrice": "2.50",
      "ProductPrice_2": null,
      "GastDesc_de": "Sesam-Keks | Mehlfrei | Vegan",
      "GastDesc_en": "Sesame Cookie | Flour-Free | Vegan",
      "MenuName": "VEGAN SPECIAL",
      "allergene": {
        "schalenfruchte": "Schalenfrüchte und Schalenfruchterzeugnisse",
        "sesam": "Sesamsamen und Sesamsamenerzeugnisse"
      },
      "merkmale": "",
      "naehrstoffe": "",
      "zusatzstoffe": [
        {
          "de": "Farbstoff",
          "en": "Colouring Agent"
        },
        {
          "de": "Antioxidationsmittel",
          "en": "Antioxidation"
        },
        {
          "de": "Alkohol",
          "en": "Alcohol"
        }
      ],
      "PrintOrder": "11",
      "CO2Value": null,
      "CO2Rating": null,
      "CO2Perc": null,
      "ClimateFriendly": null,
      "GastDesc": "Sesam-Keks | Mehlfrei | Vegan",
      "date_de": "09.02.2026"
    },
    {
      "id": "5712162",
      "outlet": "cafe",
      "date": "2026-02-10",
      "CalendarWeek": "7",
      "day": "Dienstag",
      "mealtime": "Mittagessen",
      "IdentNr": "12026021098001",
      "itemId": "21059",
      "RecipeID": "8054",
      "ProductPrice": "3.20",
      "ProductPrice_2": null,
      "GastDesc_de": "Pflaumenmus-Croffin mit Vanilleschmand",
      "GastDesc_en": "Plum Jam Croffin with Vanilla Sour Cream",
      "MenuName": "CROFFIN",
      "allergene": {
        "gluten": "Glutenhaltiges Getreide",
        "schalenfruchte": "Schalenfrüchte und Schalenfruchterzeugnisse",
        "huhnerei": "Hühnerei und Hühnereierzeugnisse",
        "soja": "Soja und Sojaerzeugnisse",
        "milch": "Milch und Milcherzeugnisse"
      },
      "merkmale": "",
      "naehrstoffe": "",
      "zusatzstoffe": [
        {
          "de": "Farbstoff",
          "en": "Colouring Agent"
        },
        {
          "de": "Alkohol",
          "en": "Alcohol"
        }
      ],
      "PrintOrder": "1",
      "CO2Value": null,
      "CO2Rating": null,
      "CO2Perc": null,
      "ClimateFriendly": null,
      "GastDesc": "Pflaumenmus-Croffin mit Vanilleschmand",
      "date_de": "10.02.2026"
    },
    {
      "id": "5712163",
      "outlet": "cafe",
      "date": "2026-02-10",
      "CalendarWeek": "7",
      "day": "Dienstag",
      "mealtime": "Mittagessen",
      "IdentNr": "12026021098002",
      "itemId": "21062",
      "RecipeID": "8871",
      "ProductPrice": "3.60",
      "ProductPrice_2": null,
      "GastDesc_de": "Baskischer Cheesecake mit Marillenkompott",
      "GastDesc_en": "Basque-style Cheesecake with Apricot Compote",
      "MenuName": "FAVOURITES",
      "allergene": {
        "huhnerei": "Hühnerei und Hühnereierzeugnisse",
        "milch": "Milch und Milcherzeugnisse"
      },
      "merkmale": "",
      "naehrstoffe": "",
      "zusatzstoffe": [
        {
          "de": "Farbstoff",
          "en": "Colouring Agent"
        },
        {
          "de": "Alkohol",
          "en": "Alcohol"
        }
      ],
      "PrintOrder": "2",
      "CO2Value": null,
      "CO2Rating": null,
      "CO2Perc": null,
      "ClimateFriendly": null,
      "GastDesc": "Baskischer Cheesecake mit Marillenkompott",
      "date_de": "10.02.2026"
    },
    {
      "id": "5712164",
      "outlet": "cafe",
      "date": "2026-02-10",
      "CalendarWeek": "7",
      "day": "Dienstag",
      "mealtime": "Mittagessen",
      "IdentNr": "12026021098003",
      "itemId": "21063",
      "RecipeID": "8211",
      "ProductPrice": "0.50",
      "ProductPrice_2": null,
      "GastDesc_de": "LES ARLETTES (Französische Blätterteigkekse) Vegan",
      "GastDesc_en": "LES ARLETTES  (French Puff Pastry Cookies) Vegan",
      "MenuName": "MINIS",
      "allergene": {
        "gluten": "Glutenhaltiges Getreide"
      },
      "merkmale": {
        "vegan": "Vegan",
        "vegetarisch": "Vegetarisch"
      },
      "naehrstoffe": "",
      "zusatzstoffe": [
        {
          "de": "Farbstoff",
          "en": "Colouring Agent"
        },
        {
          "de": "Alkohol",
          "en": "Alcohol"
        }
      ],
      "PrintOrder": "3",
      "CO2Value": null,
      "CO2Rating": null,
      "CO2Perc": null,
      "ClimateFriendly": null,
      "GastDesc": "LES ARLETTES (Französische Blätterteigkekse) Vegan",
      "date_de": "10.02.2026"
    },
    {
      "id": "5712165",
      "outlet": "cafe",
      "date": "2026-02-10",
      "CalendarWeek": "7",
      "day": "Dienstag",
      "mealtime": "Mittagessen",
      "IdentNr": "12026021098005",
      "itemId": "21064",
      "RecipeID": "8330",
      "ProductPrice": "1.50",
      "ProductPrice_2": null,
      "GastDesc_de": "Saftige Brownie-Bananen-Cookies | Zuckerfrei",
      "GastDesc_en": "Fudgy Brownie Banana Cookies | Sugar-Free",
      "MenuName": "PEOPLES CHOICE",
      "allergene": {
        "erdnuss": "Erdnüsse und Erdnusserzeugnisse"
      },
      "merkmale": {
        "ohne_zucker": "Ohne_Zucker",
        "vegan": "Vegan",
        "vegetarisch": "Vegetarisch"
      },
      "naehrstoffe": "",
      "zusatzstoffe": null,
      "PrintOrder": "5",
      "CO2Value": null,
      "CO2Rating": null,
      "CO2Perc": null,
      "ClimateFriendly": null,
      "GastDesc": "Saftige Brownie-Bananen-Cookies | Zuckerfrei",
      "date_de": "10.02.2026"
    },
    {
      "id": "5712166",
      "outlet": "cafe",
      "date": "2026-02-10",
      "CalendarWeek": "7",
      "day": "Dienstag",
      "mealtime": "Mittagessen",
      "IdentNr": "12026021098006",
      "itemId": "21061",
      "RecipeID": "8697",
      "ProductPrice": "2.50",
      "ProductPrice_2": null,
      "GastDesc_de": "Erdnussbutter-Cookie mit Schokolade und Salzkaramell | Vegan",
      "GastDesc_en": "Peanutbutter Cookie with Chocolate Salty Caramel | Vegan",
      "MenuName": "SEASON",
      "allergene": {
        "gluten": "Glutenhaltiges Getreide",
        "soja": "Soja und Sojaerzeugnisse",
        "erdnuss": "Erdnüsse und Erdnusserzeugnisse"
      },
      "merkmale": "",
      "naehrstoffe": "",
      "zusatzstoffe": [
        {
          "de": "Farbstoff",
          "en": "Colouring Agent"
        },
        {
          "de": "Antioxidationsmittel",
          "en": "Antioxidation"
        },
        {
          "de": "Alkohol",
          "en": "Alcohol"
        }
      ],
      "PrintOrder": "6",
      "CO2Value": null,
      "CO2Rating": null,
      "CO2Perc": null,
      "ClimateFriendly": null,
      "GastDesc": "Erdnussbutter-Cookie mit Schokolade und Salzkaramell | Vegan",
      "date_de": "10.02.2026"
    },
    {
      "id": "5712167",
      "outlet": "cafe",
      "date": "2026-02-10",
      "CalendarWeek": "7",
      "day": "Dienstag",
      "mealtime": "Mittagessen",
      "IdentNr": "12026021098007",
      "itemId": "12776",
      "RecipeID": "8453",
      "ProductPrice": "2.50",
      "ProductPrice_2": null,
      "GastDesc_de": "Oreo-Cheesecake-Cookies",
      "GastDesc_en": "Oreo Cheesecake Cookies",
      "MenuName": "COOKIE",
      "allergene": {
        "gluten": "Glutenhaltiges Getreide",
        "huhnerei": "Hühnerei und Hühnereierzeugnisse",
        "milch": "Milch und Milcherzeugnisse"
      },
      "merkmale": "",
      "naehrstoffe": "",
      "zusatzstoffe": [
        {
          "de": "Farbstoff",
          "en": "Colouring Agent"
        },
        {
          "de": "Alkohol",
          "en": "Alcohol"
        }
      ],
      "PrintOrder": "7",
      "CO2Value": null,
      "CO2Rating": null,
      "CO2Perc": null,
      "ClimateFriendly": null,
      "GastDesc": "Oreo-Cheesecake-Cookies",
      "date_de": "10.02.2026"
    },
    {
      "id": "5712168",
      "outlet": "cafe",
      "date": "2026-02-10",
      "CalendarWeek": "7",
      "day": "Dienstag",
      "mealtime": "Mittagessen",
      "IdentNr": "12026021098008",
      "itemId": "12777",
      "RecipeID": "9121",
      "ProductPrice": "2.50",
      "ProductPrice_2": null,
      "GastDesc_de": "Carrotcake  Bananenbrot | Zuckerfrei",
      "GastDesc_en": "Carrot Cake Banana Bread | Sugar-Free",
      "MenuName": "TAG des KASTENKUCHENS",
      "allergene": {
        "gluten": "Glutenhaltiges Getreide",
        "huhnerei": "Hühnerei und Hühnereierzeugnisse",
        "milch": "Milch und Milcherzeugnisse",
        "schwefel": "Schwefeldioxid und Sulfide"
      },
      "merkmale": "",
      "naehrstoffe": "",
      "zusatzstoffe": [
        {
          "de": "Farbstoff",
          "en": "Colouring Agent"
        }
      ],
      "PrintOrder": "8",
      "CO2Value": null,
      "CO2Rating": null,
      "CO2Perc": null,
      "ClimateFriendly": null,
      "GastDesc": "Carrotcake  Bananenbrot | Zuckerfrei",
      "date_de": "10.02.2026"
    },
    {
      "id": "5712169",
      "outlet": "cafe",
      "date": "2026-02-10",
      "CalendarWeek": "7",
      "day": "Dienstag",
      "mealtime": "Mittagessen",
      "IdentNr": "12026021098011",
      "itemId": "16256",
      "RecipeID": "9122",
      "ProductPrice": "2.50",
      "ProductPrice_2": null,
      "GastDesc_de": "Sesam-Keks | Mehlfrei | Vegan",
      "GastDesc_en": "Sesame Cookie | Flour-Free | Vegan",
      "MenuName": "VEGAN SPECIAL",
      "allergene": {
        "schalenfruchte": "Schalenfrüchte und Schalenfruchterzeugnisse",
        "sesam": "Sesamsamen und Sesamsamenerzeugnisse"
      },
      "merkmale": "",
      "naehrstoffe": "",
      "zusatzstoffe": [
        {
          "de": "Farbstoff",
          "en": "Colouring Agent"
        },
        {
          "de": "Antioxidationsmittel",
          "en": "Antioxidation"
        },
        {
          "de": "Alkohol",
          "en": "Alcohol"
        }
      ],
      "PrintOrder": "11",
      "CO2Value": null,
      "CO2Rating": null,
      "CO2Perc": null,
      "ClimateFriendly": null,
      "GastDesc": "Sesam-Keks | Mehlfrei | Vegan",
      "date_de": "10.02.2026"
    },
    {
      "id": "5736771",
      "outlet": "cafe",
      "date": "2026-02-11",
      "CalendarWeek": "7",
      "day": "Mittwoch",
      "mealtime": "Mittagessen",
      "IdentNr": "12026021198001",
      "itemId": "21059",
      "RecipeID": "8054",
      "ProductPrice": "3.20",
      "ProductPrice_2": null,
      "GastDesc_de": "Pflaumenmus-Croffin mit Vanilleschmand",
      "GastDesc_en": "Plum Jam Croffin with Vanilla Sour Cream",
      "MenuName": "CROFFIN",
      "allergene": {
        "gluten": "Glutenhaltiges Getreide",
        "schalenfruchte": "Schalenfrüchte und Schalenfruchterzeugnisse",
        "huhnerei": "Hühnerei und Hühnereierzeugnisse",
        "soja": "Soja und Sojaerzeugnisse",
        "milch": "Milch und Milcherzeugnisse"
      },
      "merkmale": "",
      "naehrstoffe": "",
      "zusatzstoffe": [
        {
          "de": "Farbstoff",
          "en": "Colouring Agent"
        },
        {
          "de": "Alkohol",
          "en": "Alcohol"
        }
      ],
      "PrintOrder": "1",
      "CO2Value": null,
      "CO2Rating": null,
      "CO2Perc": null,
      "ClimateFriendly": null,
      "GastDesc": "Pflaumenmus-Croffin mit Vanilleschmand",
      "date_de": "11.02.2026"
    },
    {
      "id": "5736772",
      "outlet": "cafe",
      "date": "2026-02-11",
      "CalendarWeek": "7",
      "day": "Mittwoch",
      "mealtime": "Mittagessen",
      "IdentNr": "12026021198002",
      "itemId": "21062",
      "RecipeID": "8871",
      "ProductPrice": "3.60",
      "ProductPrice_2": null,
      "GastDesc_de": "Baskischer Cheesecake mit Marillenkompott",
      "GastDesc_en": "Basque-style Cheesecake with Apricot Compote",
      "MenuName": "FAVOURITES",
      "allergene": {
        "huhnerei": "Hühnerei und Hühnereierzeugnisse",
        "milch": "Milch und Milcherzeugnisse"
      },
      "merkmale": "",
      "naehrstoffe": "",
      "zusatzstoffe": [
        {
          "de": "Farbstoff",
          "en": "Colouring Agent"
        },
        {
          "de": "Alkohol",
          "en": "Alcohol"
        }
      ],
      "PrintOrder": "2",
      "CO2Value": null,
      "CO2Rating": null,
      "CO2Perc": null,
      "ClimateFriendly": null,
      "GastDesc": "Baskischer Cheesecake mit Marillenkompott",
      "date_de": "11.02.2026"
    },
    {
      "id": "5736773",
      "outlet": "cafe",
      "date": "2026-02-11",
      "CalendarWeek": "7",
      "day": "Mittwoch",
      "mealtime": "Mittagessen",
      "IdentNr": "12026021198003",
      "itemId": "21063",
      "RecipeID": "8211",
      "ProductPrice": "0.50",
      "ProductPrice_2": null,
      "GastDesc_de": "LES ARLETTES (Französische Blätterteigkekse) Vegan",
      "GastDesc_en": "LES ARLETTES  (French Puff Pastry Cookies) Vegan",
      "MenuName": "MINIS",
      "allergene": {
        "gluten": "Glutenhaltiges Getreide"
      },
      "merkmale": {
        "vegan": "Vegan",
        "vegetarisch": "Vegetarisch"
      },
      "naehrstoffe": "",
      "zusatzstoffe": [
        {
          "de": "Farbstoff",
          "en": "Colouring Agent"
        },
        {
          "de": "Alkohol",
          "en": "Alcohol"
        }
      ],
      "PrintOrder": "3",
      "CO2Value": null,
      "CO2Rating": null,
      "CO2Perc": null,
      "ClimateFriendly": null,
      "GastDesc": "LES ARLETTES (Französische Blätterteigkekse) Vegan",
      "date_de": "11.02.2026"
    },
    {
      "id": "5736774",
      "outlet": "cafe",
      "date": "2026-02-11",
      "CalendarWeek": "7",
      "day": "Mittwoch",
      "mealtime": "Mittagessen",
      "IdentNr": "12026021198005",
      "itemId": "21064",
      "RecipeID": "8330",
      "ProductPrice": "1.50",
      "ProductPrice_2": null,
      "GastDesc_de": "Saftige Brownie-Bananen-Cookies | Zuckerfrei",
      "GastDesc_en": "Fudgy Brownie Banana Cookies | Sugar-Free",
      "MenuName": "PEOPLES CHOICE",
      "allergene": {
        "erdnuss": "Erdnüsse und Erdnusserzeugnisse"
      },
      "merkmale": {
        "ohne_zucker": "Ohne_Zucker",
        "vegan": "Vegan",
        "vegetarisch": "Vegetarisch"
      },
      "naehrstoffe": "",
      "zusatzstoffe": null,
      "PrintOrder": "5",
      "CO2Value": null,
      "CO2Rating": null,
      "CO2Perc": null,
      "ClimateFriendly": null,
      "GastDesc": "Saftige Brownie-Bananen-Cookies | Zuckerfrei",
      "date_de": "11.02.2026"
    },
    {
      "id": "5736775",
      "outlet": "cafe",
      "date": "2026-02-11",
      "CalendarWeek": "7",
      "day": "Mittwoch",
      "mealtime": "Mittagessen",
      "IdentNr": "12026021198006",
      "itemId": "21061",
      "RecipeID": "8697",
      "ProductPrice": "2.50",
      "ProductPrice_2": null,
      "GastDesc_de": "Erdnussbutter-Cookie mit Schokolade und Salzkaramell | Vegan",
      "GastDesc_en": "Peanutbutter Cookie with Chocolate Salty Caramel | Vegan",
      "MenuName": "SEASON",
      "allergene": {
        "gluten": "Glutenhaltiges Getreide",
        "soja": "Soja und Sojaerzeugnisse",
        "erdnuss": "Erdnüsse und Erdnusserzeugnisse"
      },
      "merkmale": "",
      "naehrstoffe": "",
      "zusatzstoffe": [
        {
          "de": "Farbstoff",
          "en": "Colouring Agent"
        },
        {
          "de": "Antioxidationsmittel",
          "en": "Antioxidation"
        },
        {
          "de": "Alkohol",
          "en": "Alcohol"
        }
      ],
      "PrintOrder": "6",
      "CO2Value": null,
      "CO2Rating": null,
      "CO2Perc": null,
      "ClimateFriendly": null,
      "GastDesc": "Erdnussbutter-Cookie mit Schokolade und Salzkaramell | Vegan",
      "date_de": "11.02.2026"
    },
    {
      "id": "5736776",
      "outlet": "cafe",
      "date": "2026-02-11",
      "CalendarWeek": "7",
      "day": "Mittwoch",
      "mealtime": "Mittagessen",
      "IdentNr": "12026021198007",
      "itemId": "12776",
      "RecipeID": "8453",
      "ProductPrice": "2.50",
      "ProductPrice_2": null,
      "GastDesc_de": "Oreo-Cheesecake-Cookies",
      "GastDesc_en": "Oreo Cheesecake Cookies",
      "MenuName": "COOKIE",
      "allergene": {
        "gluten": "Glutenhaltiges Getreide",
        "huhnerei": "Hühnerei und Hühnereierzeugnisse",
        "milch": "Milch und Milcherzeugnisse"
      },
      "merkmale": "",
      "naehrstoffe": "",
      "zusatzstoffe": [
        {
          "de": "Farbstoff",
          "en": "Colouring Agent"
        },
        {
          "de": "Alkohol",
          "en": "Alcohol"
        }
      ],
      "PrintOrder": "7",
      "CO2Value": null,
      "CO2Rating": null,
      "CO2Perc": null,
      "ClimateFriendly": null,
      "GastDesc": "Oreo-Cheesecake-Cookies",
      "date_de": "11.02.2026"
    },
    {
      "id": "5736777",
      "outlet": "cafe",
      "date": "2026-02-11",
      "CalendarWeek": "7",
      "day": "Mittwoch",
      "mealtime": "Mittagessen",
      "IdentNr": "12026021198008",
      "itemId": "12777",
      "RecipeID": "9121",
      "ProductPrice": "2.50",
      "ProductPrice_2": null,
      "GastDesc_de": "Carrotcake  Bananenbrot | Zuckerfrei",
      "GastDesc_en": "Carrot Cake Banana Bread | Sugar-Free",
      "MenuName": "TAG des KASTENKUCHENS",
      "allergene": {
        "gluten": "Glutenhaltiges Getreide",
        "huhnerei": "Hühnerei und Hühnereierzeugnisse",
        "milch": "Milch und Milcherzeugnisse",
        "schwefel": "Schwefeldioxid und Sulfide"
      },
      "merkmale": "",
      "naehrstoffe": "",
      "zusatzstoffe": [
        {
          "de": "Farbstoff",
          "en": "Colouring Agent"
        }
      ],
      "PrintOrder": "8",
      "CO2Value": null,
      "CO2Rating": null,
      "CO2Perc": null,
      "ClimateFriendly": null,
      "GastDesc": "Carrotcake  Bananenbrot | Zuckerfrei",
      "date_de": "11.02.2026"
    },
    {
      "id": "5736778",
      "outlet": "cafe",
      "date": "2026-02-11",
      "CalendarWeek": "7",
      "day": "Mittwoch",
      "mealtime": "Mittagessen",
      "IdentNr": "12026021198011",
      "itemId": "16256",
      "RecipeID": "9122",
      "ProductPrice": "2.50",
      "ProductPrice_2": null,
      "GastDesc_de": "Sesam-Keks | Mehlfrei | Vegan",
      "GastDesc_en": "Sesame Cookie | Flour-Free | Vegan",
      "MenuName": "VEGAN SPECIAL",
      "allergene": {
        "schalenfruchte": "Schalenfrüchte und Schalenfruchterzeugnisse",
        "sesam": "Sesamsamen und Sesamsamenerzeugnisse"
      },
      "merkmale": "",
      "naehrstoffe": "",
      "zusatzstoffe": [
        {
          "de": "Farbstoff",
          "en": "Colouring Agent"
        },
        {
          "de": "Antioxidationsmittel",
          "en": "Antioxidation"
        },
        {
          "de": "Alkohol",
          "en": "Alcohol"
        }
      ],
      "PrintOrder": "11",
      "CO2Value": null,
      "CO2Rating": null,
      "CO2Perc": null,
      "ClimateFriendly": null,
      "GastDesc": "Sesam-Keks | Mehlfrei | Vegan",
      "date_de": "11.02.2026"
    },
    {
      "id": "5761343",
      "outlet": "cafe",
      "date": "2026-02-12",
      "CalendarWeek": "7",
      "day": "Donnerstag",
      "mealtime": "Mittagessen",
      "IdentNr": "12026021298001",
      "itemId": "21059",
      "RecipeID": "8054",
      "ProductPrice": "3.20",
      "ProductPrice_2": null,
      "GastDesc_de": "Pflaumenmus-Croffin mit Vanilleschmand",
      "GastDesc_en": "Plum Jam Croffin with Vanilla Sour Cream",
      "MenuName": "CROFFIN",
      "allergene": {
        "gluten": "Glutenhaltiges Getreide",
        "schalenfruchte": "Schalenfrüchte und Schalenfruchterzeugnisse",
        "huhnerei": "Hühnerei und Hühnereierzeugnisse",
        "soja": "Soja und Sojaerzeugnisse",
        "milch": "Milch und Milcherzeugnisse"
      },
      "merkmale": "",
      "naehrstoffe": "",
      "zusatzstoffe": [
        {
          "de": "Farbstoff",
          "en": "Colouring Agent"
        },
        {
          "de": "Alkohol",
          "en": "Alcohol"
        }
      ],
      "PrintOrder": "1",
      "CO2Value": null,
      "CO2Rating": null,
      "CO2Perc": null,
      "ClimateFriendly": null,
      "GastDesc": "Pflaumenmus-Croffin mit Vanilleschmand",
      "date_de": "12.02.2026"
    },
    {
      "id": "5761344",
      "outlet": "cafe",
      "date": "2026-02-12",
      "CalendarWeek": "7",
      "day": "Donnerstag",
      "mealtime": "Mittagessen",
      "IdentNr": "12026021298002",
      "itemId": "21062",
      "RecipeID": "8871",
      "ProductPrice": "3.60",
      "ProductPrice_2": null,
      "GastDesc_de": "Baskischer Cheesecake mit Marillenkompott",
      "GastDesc_en": "Basque-style Cheesecake with Apricot Compote",
      "MenuName": "FAVOURITES",
      "allergene": {
        "huhnerei": "Hühnerei und Hühnereierzeugnisse",
        "milch": "Milch und Milcherzeugnisse"
      },
      "merkmale": "",
      "naehrstoffe": "",
      "zusatzstoffe": [
        {
          "de": "Farbstoff",
          "en": "Colouring Agent"
        },
        {
          "de": "Alkohol",
          "en": "Alcohol"
        }
      ],
      "PrintOrder": "2",
      "CO2Value": null,
      "CO2Rating": null,
      "CO2Perc": null,
      "ClimateFriendly": null,
      "GastDesc": "Baskischer Cheesecake mit Marillenkompott",
      "date_de": "12.02.2026"
    },
    {
      "id": "5761345",
      "outlet": "cafe",
      "date": "2026-02-12",
      "CalendarWeek": "7",
      "day": "Donnerstag",
      "mealtime": "Mittagessen",
      "IdentNr": "12026021298003",
      "itemId": "21063",
      "RecipeID": "8211",
      "ProductPrice": "0.50",
      "ProductPrice_2": null,
      "GastDesc_de": "LES ARLETTES (Französische Blätterteigkekse) Vegan",
      "GastDesc_en": "LES ARLETTES  (French Puff Pastry Cookies) Vegan",
      "MenuName": "MINIS",
      "allergene": {
        "gluten": "Glutenhaltiges Getreide"
      },
      "merkmale": {
        "vegan": "Vegan",
        "vegetarisch": "Vegetarisch"
      },
      "naehrstoffe": "",
      "zusatzstoffe": [
        {
          "de": "Farbstoff",
          "en": "Colouring Agent"
        },
        {
          "de": "Alkohol",
          "en": "Alcohol"
        }
      ],
      "PrintOrder": "3",
      "CO2Value": null,
      "CO2Rating": null,
      "CO2Perc": null,
      "ClimateFriendly": null,
      "GastDesc": "LES ARLETTES (Französische Blätterteigkekse) Vegan",
      "date_de": "12.02.2026"
    },
    {
      "id": "5761346",
      "outlet": "cafe",
      "date": "2026-02-12",
      "CalendarWeek": "7",
      "day": "Donnerstag",
      "mealtime": "Mittagessen",
      "IdentNr": "12026021298005",
      "itemId": "21064",
      "RecipeID": "8330",
      "ProductPrice": "1.50",
      "ProductPrice_2": null,
      "GastDesc_de": "Saftige Brownie-Bananen-Cookies | Zuckerfrei",
      "GastDesc_en": "Fudgy Brownie Banana Cookies | Sugar-Free",
      "MenuName": "PEOPLES CHOICE",
      "allergene": {
        "erdnuss": "Erdnüsse und Erdnusserzeugnisse"
      },
      "merkmale": {
        "ohne_zucker": "Ohne_Zucker",
        "vegan": "Vegan",
        "vegetarisch": "Vegetarisch"
      },
      "naehrstoffe": "",
      "zusatzstoffe": null,
      "PrintOrder": "5",
      "CO2Value": null,
      "CO2Rating": null,
      "CO2Perc": null,
      "ClimateFriendly": null,
      "GastDesc": "Saftige Brownie-Bananen-Cookies | Zuckerfrei",
      "date_de": "12.02.2026"
    },
    {
      "id": "5761347",
      "outlet": "cafe",
      "date": "2026-02-12",
      "CalendarWeek": "7",
      "day": "Donnerstag",
      "mealtime": "Mittagessen",
      "IdentNr": "12026021298006",
      "itemId": "21061",
      "RecipeID": "8697",
      "ProductPrice": "2.50",
      "ProductPrice_2": null,
      "GastDesc_de": "Erdnussbutter-Cookie mit Schokolade und Salzkaramell | Vegan",
      "GastDesc_en": "Peanutbutter Cookie with Chocolate Salty Caramel | Vegan",
      "MenuName": "SEASON",
      "allergene": {
        "gluten": "Glutenhaltiges Getreide",
        "soja": "Soja und Sojaerzeugnisse",
        "erdnuss": "Erdnüsse und Erdnusserzeugnisse"
      },
      "merkmale": "",
      "naehrstoffe": "",
      "zusatzstoffe": [
        {
          "de": "Farbstoff",
          "en": "Colouring Agent"
        },
        {
          "de": "Antioxidationsmittel",
          "en": "Antioxidation"
        },
        {
          "de": "Alkohol",
          "en": "Alcohol"
        }
      ],
      "PrintOrder": "6",
      "CO2Value": null,
      "CO2Rating": null,
      "CO2Perc": null,
      "ClimateFriendly": null,
      "GastDesc": "Erdnussbutter-Cookie mit Schokolade und Salzkaramell | Vegan",
      "date_de": "12.02.2026"
    },
    {
      "id": "5761348",
      "outlet": "cafe",
      "date": "2026-02-12",
      "CalendarWeek": "7",
      "day": "Donnerstag",
      "mealtime": "Mittagessen",
      "IdentNr": "12026021298007",
      "itemId": "12776",
      "RecipeID": "8453",
      "ProductPrice": "2.50",
      "ProductPrice_2": null,
      "GastDesc_de": "Oreo-Cheesecake-Cookies",
      "GastDesc_en": "Oreo Cheesecake Cookies",
      "MenuName": "COOKIE",
      "allergene": {
        "gluten": "Glutenhaltiges Getreide",
        "huhnerei": "Hühnerei und Hühnereierzeugnisse",
        "milch": "Milch und Milcherzeugnisse"
      },
      "merkmale": "",
      "naehrstoffe": "",
      "zusatzstoffe": [
        {
          "de": "Farbstoff",
          "en": "Colouring Agent"
        },
        {
          "de": "Alkohol",
          "en": "Alcohol"
        }
      ],
      "PrintOrder": "7",
      "CO2Value": null,
      "CO2Rating": null,
      "CO2Perc": null,
      "ClimateFriendly": null,
      "GastDesc": "Oreo-Cheesecake-Cookies",
      "date_de": "12.02.2026"
    },
    {
      "id": "5761349",
      "outlet": "cafe",
      "date": "2026-02-12",
      "CalendarWeek": "7",
      "day": "Donnerstag",
      "mealtime": "Mittagessen",
      "IdentNr": "12026021298008",
      "itemId": "12777",
      "RecipeID": "9121",
      "ProductPrice": "2.50",
      "ProductPrice_2": null,
      "GastDesc_de": "Carrotcake  Bananenbrot | Zuckerfrei",
      "GastDesc_en": "Carrot Cake Banana Bread | Sugar-Free",
      "MenuName": "TAG des KASTENKUCHENS",
      "allergene": {
        "gluten": "Glutenhaltiges Getreide",
        "huhnerei": "Hühnerei und Hühnereierzeugnisse",
        "milch": "Milch und Milcherzeugnisse",
        "schwefel": "Schwefeldioxid und Sulfide"
      },
      "merkmale": "",
      "naehrstoffe": "",
      "zusatzstoffe": [
        {
          "de": "Farbstoff",
          "en": "Colouring Agent"
        }
      ],
      "PrintOrder": "8",
      "CO2Value": null,
      "CO2Rating": null,
      "CO2Perc": null,
      "ClimateFriendly": null,
      "GastDesc": "Carrotcake  Bananenbrot | Zuckerfrei",
      "date_de": "12.02.2026"
    },
    {
      "id": "5761350",
      "outlet": "cafe",
      "date": "2026-02-12",
      "CalendarWeek": "7",
      "day": "Donnerstag",
      "mealtime": "Mittagessen",
      "IdentNr": "12026021298011",
      "itemId": "16256",
      "RecipeID": "9122",
      "ProductPrice": "2.50",
      "ProductPrice_2": null,
      "GastDesc_de": "Sesam-Keks | Mehlfrei | Vegan",
      "GastDesc_en": "Sesame Cookie | Flour-Free | Vegan",
      "MenuName": "VEGAN SPECIAL",
      "allergene": {
        "schalenfruchte": "Schalenfrüchte und Schalenfruchterzeugnisse",
        "sesam": "Sesamsamen und Sesamsamenerzeugnisse"
      },
      "merkmale": "",
      "naehrstoffe": "",
      "zusatzstoffe": [
        {
          "de": "Farbstoff",
          "en": "Colouring Agent"
        },
        {
          "de": "Antioxidationsmittel",
          "en": "Antioxidation"
        },
        {
          "de": "Alkohol",
          "en": "Alcohol"
        }
      ],
      "PrintOrder": "11",
      "CO2Value": null,
      "CO2Rating": null,
      "CO2Perc": null,
      "ClimateFriendly": null,
      "GastDesc": "Sesam-Keks | Mehlfrei | Vegan",
      "date_de": "12.02.2026"
    },
    {
      "id": "5787801",
      "outlet": "cafe",
      "date": "2026-02-13",
      "CalendarWeek": "7",
      "day": "Freitag",
      "mealtime": "Mittagessen",
      "IdentNr": "12026021398002",
      "itemId": "21062",
      "RecipeID": "8871",
      "ProductPrice": "3.60",
      "ProductPrice_2": null,
      "GastDesc_de": "Baskischer Cheesecake mit Marillenkompott",
      "GastDesc_en": "Basque-style Cheesecake with Apricot Compote",
      "MenuName": "FAVOURITES",
      "allergene": {
        "huhnerei": "Hühnerei und Hühnereierzeugnisse",
        "milch": "Milch und Milcherzeugnisse"
      },
      "merkmale": "",
      "naehrstoffe": "",
      "zusatzstoffe": [
        {
          "de": "Farbstoff",
          "en": "Colouring Agent"
        },
        {
          "de": "Alkohol",
          "en": "Alcohol"
        }
      ],
      "PrintOrder": "2",
      "CO2Value": null,
      "CO2Rating": null,
      "CO2Perc": null,
      "ClimateFriendly": null,
      "GastDesc": "Baskischer Cheesecake mit Marillenkompott",
      "date_de": "13.02.2026"
    },
    {
      "id": "5787802",
      "outlet": "cafe",
      "date": "2026-02-13",
      "CalendarWeek": "7",
      "day": "Freitag",
      "mealtime": "Mittagessen",
      "IdentNr": "12026021398003",
      "itemId": "21063",
      "RecipeID": "8211",
      "ProductPrice": "0.50",
      "ProductPrice_2": null,
      "GastDesc_de": "LES ARLETTES (Französische Blätterteigkekse) Vegan",
      "GastDesc_en": "LES ARLETTES  (French Puff Pastry Cookies) Vegan",
      "MenuName": "MINIS",
      "allergene": {
        "gluten": "Glutenhaltiges Getreide"
      },
      "merkmale": {
        "vegan": "Vegan",
        "vegetarisch": "Vegetarisch"
      },
      "naehrstoffe": "",
      "zusatzstoffe": [
        {
          "de": "Farbstoff",
          "en": "Colouring Agent"
        },
        {
          "de": "Alkohol",
          "en": "Alcohol"
        }
      ],
      "PrintOrder": "3",
      "CO2Value": null,
      "CO2Rating": null,
      "CO2Perc": null,
      "ClimateFriendly": null,
      "GastDesc": "LES ARLETTES (Französische Blätterteigkekse) Vegan",
      "date_de": "13.02.2026"
    },
    {
      "id": "5787803",
      "outlet": "cafe",
      "date": "2026-02-13",
      "CalendarWeek": "7",
      "day": "Freitag",
      "mealtime": "Mittagessen",
      "IdentNr": "12026021398005",
      "itemId": "21064",
      "RecipeID": "8330",
      "ProductPrice": "1.50",
      "ProductPrice_2": null,
      "GastDesc_de": "Saftige Brownie-Bananen-Cookies | Zuckerfrei",
      "GastDesc_en": "Fudgy Brownie Banana Cookies | Sugar-Free",
      "MenuName": "PEOPLES CHOICE",
      "allergene": {
        "erdnuss": "Erdnüsse und Erdnusserzeugnisse"
      },
      "merkmale": {
        "ohne_zucker": "Ohne_Zucker",
        "vegan": "Vegan",
        "vegetarisch": "Vegetarisch"
      },
      "naehrstoffe": "",
      "zusatzstoffe": null,
      "PrintOrder": "5",
      "CO2Value": null,
      "CO2Rating": null,
      "CO2Perc": null,
      "ClimateFriendly": null,
      "GastDesc": "Saftige Brownie-Bananen-Cookies | Zuckerfrei",
      "date_de": "13.02.2026"
    },
    {
      "id": "5787804",
      "outlet": "cafe",
      "date": "2026-02-13",
      "CalendarWeek": "7",
      "day": "Freitag",
      "mealtime": "Mittagessen",
      "IdentNr": "12026021398006",
      "itemId": "21061",
      "RecipeID": "8697",
      "ProductPrice": "2.50",
      "ProductPrice_2": null,
      "GastDesc_de": "Erdnussbutter-Cookie mit Schokolade und Salzkaramell | Vegan",
      "GastDesc_en": "Peanutbutter Cookie with Chocolate Salty Caramel | Vegan",
      "MenuName": "SEASON",
      "allergene": {
        "gluten": "Glutenhaltiges Getreide",
        "soja": "Soja und Sojaerzeugnisse",
        "erdnuss": "Erdnüsse und Erdnusserzeugnisse"
      },
      "merkmale": "",
      "naehrstoffe": "",
      "zusatzstoffe": [
        {
          "de": "Farbstoff",
          "en": "Colouring Agent"
        },
        {
          "de": "Antioxidationsmittel",
          "en": "Antioxidation"
        },
        {
          "de": "Alkohol",
          "en": "Alcohol"
        }
      ],
      "PrintOrder": "6",
      "CO2Value": null,
      "CO2Rating": null,
      "CO2Perc": null,
      "ClimateFriendly": null,
      "GastDesc": "Erdnussbutter-Cookie mit Schokolade und Salzkaramell | Vegan",
      "date_de": "13.02.2026"
    },
    {
      "id": "5787805",
      "outlet": "cafe",
      "date": "2026-02-13",
      "CalendarWeek": "7",
      "day": "Freitag",
      "mealtime": "Mittagessen",
      "IdentNr": "12026021398007",
      "itemId": "12776",
      "RecipeID": "8453",
      "ProductPrice": "2.50",
      "ProductPrice_2": null,
      "GastDesc_de": "Oreo-Cheesecake-Cookies",
      "GastDesc_en": "Oreo Cheesecake Cookies",
      "MenuName": "COOKIE",
      "allergene": {
        "gluten": "Glutenhaltiges Getreide",
        "huhnerei": "Hühnerei und Hühnereierzeugnisse",
        "milch": "Milch und Milcherzeugnisse"
      },
      "merkmale": "",
      "naehrstoffe": "",
      "zusatzstoffe": [
        {
          "de": "Farbstoff",
          "en": "Colouring Agent"
        },
        {
          "de": "Alkohol",
          "en": "Alcohol"
        }
      ],
      "PrintOrder": "7",
      "CO2Value": null,
      "CO2Rating": null,
      "CO2Perc": null,
      "ClimateFriendly": null,
      "GastDesc": "Oreo-Cheesecake-Cookies",
      "date_de": "13.02.2026"
    },
    {
      "id": "5787806",
      "outlet": "cafe",
      "date": "2026-02-13",
      "CalendarWeek": "7",
      "day": "Freitag",
      "mealtime": "Mittagessen",
      "IdentNr": "12026021398008",
      "itemId": "12777",
      "RecipeID": "9121",
      "ProductPrice": "2.50",
      "ProductPrice_2": null,
      "GastDesc_de": "Carrotcake  Bananenbrot | Zuckerfrei",
      "GastDesc_en": "Carrot Cake Banana Bread | Sugar-Free",
      "MenuName": "TAG des KASTENKUCHENS",
      "allergene": {
        "gluten": "Glutenhaltiges Getreide",
        "huhnerei": "Hühnerei und Hühnereierzeugnisse",
        "milch": "Milch und Milcherzeugnisse",
        "schwefel": "Schwefeldioxid und Sulfide"
      },
      "merkmale": "",
      "naehrstoffe": "",
      "zusatzstoffe": [
        {
          "de": "Farbstoff",
          "en": "Colouring Agent"
        }
      ],
      "PrintOrder": "8",
      "CO2Value": null,
      "CO2Rating": null,
      "CO2Perc": null,
      "ClimateFriendly": null,
      "GastDesc": "Carrotcake  Bananenbrot | Zuckerfrei",
      "date_de": "13.02.2026"
    },
    {
      "id": "5787807",
      "outlet": "cafe",
      "date": "2026-02-13",
      "CalendarWeek": "7",
      "day": "Freitag",
      "mealtime": "Mittagessen",
      "IdentNr": "12026021398011",
      "itemId": "16256",
      "RecipeID": "9122",
      "ProductPrice": "2.50",
      "ProductPrice_2": null,
      "GastDesc_de": "Sesam-Keks | Mehlfrei | Vegan",
      "GastDesc_en": "Sesame Cookie | Flour-Free | Vegan",
      "MenuName": "VEGAN SPECIAL",
      "allergene": {
        "schalenfruchte": "Schalenfrüchte und Schalenfruchterzeugnisse",
        "sesam": "Sesamsamen und Sesamsamenerzeugnisse"
      },
      "merkmale": "",
      "naehrstoffe": "",
      "zusatzstoffe": [
        {
          "de": "Farbstoff",
          "en": "Colouring Agent"
        },
        {
          "de": "Antioxidationsmittel",
          "en": "Antioxidation"
        },
        {
          "de": "Alkohol",
          "en": "Alcohol"
        }
      ],
      "PrintOrder": "11",
      "CO2Value": null,
      "CO2Rating": null,
      "CO2Perc": null,
      "ClimateFriendly": null,
      "GastDesc": "Sesam-Keks | Mehlfrei | Vegan",
      "date_de": "13.02.2026"
    },
    {
      "id": "5787808",
      "outlet": "cafe",
      "date": "2026-02-16",
      "CalendarWeek": "7",
      "day": "Montag",
      "mealtime": "Mittagessen",
      "IdentNr": "12026021698001",
      "itemId": "21059",
      "RecipeID": "8054",
      "ProductPrice": "3.20",
      "ProductPrice_2": null,
      "GastDesc_de": "Pflaumenmus-Croffin mit Vanilleschmand",
      "GastDesc_en": "Plum Jam Croffin with Vanilla Sour Cream",
      "MenuName": "CROFFIN",
      "allergene": {
        "gluten": "Glutenhaltiges Getreide",
        "schalenfruchte": "Schalenfrüchte und Schalenfruchterzeugnisse",
        "huhnerei": "Hühnerei und Hühnereierzeugnisse",
        "soja": "Soja und Sojaerzeugnisse",
        "milch": "Milch und Milcherzeugnisse"
      },
      "merkmale": "",
      "naehrstoffe": "",
      "zusatzstoffe": [
        {
          "de": "Farbstoff",
          "en": "Colouring Agent"
        },
        {
          "de": "Alkohol",
          "en": "Alcohol"
        }
      ],
      "PrintOrder": "1",
      "CO2Value": null,
      "CO2Rating": null,
      "CO2Perc": null,
      "ClimateFriendly": null,
      "GastDesc": "Pflaumenmus-Croffin mit Vanilleschmand",
      "date_de": "16.02.2026"
    },
    {
      "id": "5787809",
      "outlet": "cafe",
      "date": "2026-02-16",
      "CalendarWeek": "7",
      "day": "Montag",
      "mealtime": "Mittagessen",
      "IdentNr": "12026021698002",
      "itemId": "21062",
      "RecipeID": "8871",
      "ProductPrice": "3.60",
      "ProductPrice_2": null,
      "GastDesc_de": "Baskischer Cheesecake mit Marillenkompott",
      "GastDesc_en": "Basque-style Cheesecake with Apricot Compote",
      "MenuName": "FAVOURITES",
      "allergene": {
        "huhnerei": "Hühnerei und Hühnereierzeugnisse",
        "milch": "Milch und Milcherzeugnisse"
      },
      "merkmale": "",
      "naehrstoffe": "",
      "zusatzstoffe": [
        {
          "de": "Farbstoff",
          "en": "Colouring Agent"
        },
        {
          "de": "Alkohol",
          "en": "Alcohol"
        }
      ],
      "PrintOrder": "2",
      "CO2Value": null,
      "CO2Rating": null,
      "CO2Perc": null,
      "ClimateFriendly": null,
      "GastDesc": "Baskischer Cheesecake mit Marillenkompott",
      "date_de": "16.02.2026"
    },
    {
      "id": "5787810",
      "outlet": "cafe",
      "date": "2026-02-16",
      "CalendarWeek": "7",
      "day": "Montag",
      "mealtime": "Mittagessen",
      "IdentNr": "12026021698003",
      "itemId": "21063",
      "RecipeID": "8211",
      "ProductPrice": "0.50",
      "ProductPrice_2": null,
      "GastDesc_de": "LES ARLETTES (Französische Blätterteigkekse) Vegan",
      "GastDesc_en": "LES ARLETTES  (French Puff Pastry Cookies) Vegan",
      "MenuName": "MINIS",
      "allergene": {
        "gluten": "Glutenhaltiges Getreide"
      },
      "merkmale": {
        "vegan": "Vegan",
        "vegetarisch": "Vegetarisch"
      },
      "naehrstoffe": "",
      "zusatzstoffe": [
        {
          "de": "Farbstoff",
          "en": "Colouring Agent"
        },
        {
          "de": "Alkohol",
          "en": "Alcohol"
        }
      ],
      "PrintOrder": "3",
      "CO2Value": null,
      "CO2Rating": null,
      "CO2Perc": null,
      "ClimateFriendly": null,
      "GastDesc": "LES ARLETTES (Französische Blätterteigkekse) Vegan",
      "date_de": "16.02.2026"
    },
    {
      "id": "5787811",
      "outlet": "cafe",
      "date": "2026-02-16",
      "CalendarWeek": "7",
      "day": "Montag",
      "mealtime": "Mittagessen",
      "IdentNr": "12026021698005",
      "itemId": "21064",
      "RecipeID": "8330",
      "ProductPrice": "1.50",
      "ProductPrice_2": null,
      "GastDesc_de": "Saftige Brownie-Bananen-Cookies | Zuckerfrei",
      "GastDesc_en": "Fudgy Brownie Banana Cookies | Sugar-Free",
      "MenuName": "PEOPLES CHOICE",
      "allergene": {
        "erdnuss": "Erdnüsse und Erdnusserzeugnisse"
      },
      "merkmale": {
        "ohne_zucker": "Ohne_Zucker",
        "vegan": "Vegan",
        "vegetarisch": "Vegetarisch"
      },
      "naehrstoffe": "",
      "zusatzstoffe": null,
      "PrintOrder": "5",
      "CO2Value": null,
      "CO2Rating": null,
      "CO2Perc": null,
      "ClimateFriendly": null,
      "GastDesc": "Saftige Brownie-Bananen-Cookies | Zuckerfrei",
      "date_de": "16.02.2026"
    },
    {
      "id": "5787812",
      "outlet": "cafe",
      "date": "2026-02-16",
      "CalendarWeek": "7",
      "day": "Montag",
      "mealtime": "Mittagessen",
      "IdentNr": "12026021698006",
      "itemId": "21061",
      "RecipeID": "8697",
      "ProductPrice": "2.50",
      "ProductPrice_2": null,
      "GastDesc_de": "Erdnussbutter-Cookie mit Schokolade und Salzkaramell | Vegan",
      "GastDesc_en": "Peanutbutter Cookie with Chocolate Salty Caramel | Vegan",
      "MenuName": "SEASON",
      "allergene": {
        "gluten": "Glutenhaltiges Getreide",
        "soja": "Soja und Sojaerzeugnisse",
        "erdnuss": "Erdnüsse und Erdnusserzeugnisse"
      },
      "merkmale": "",
      "naehrstoffe": "",
      "zusatzstoffe": [
        {
          "de": "Farbstoff",
          "en": "Colouring Agent"
        },
        {
          "de": "Antioxidationsmittel",
          "en": "Antioxidation"
        },
        {
          "de": "Alkohol",
          "en": "Alcohol"
        }
      ],
      "PrintOrder": "6",
      "CO2Value": null,
      "CO2Rating": null,
      "CO2Perc": null,
      "ClimateFriendly": null,
      "GastDesc": "Erdnussbutter-Cookie mit Schokolade und Salzkaramell | Vegan",
      "date_de": "16.02.2026"
    },
    {
      "id": "5787813",
      "outlet": "cafe",
      "date": "2026-02-16",
      "CalendarWeek": "7",
      "day": "Montag",
      "mealtime": "Mittagessen",
      "IdentNr": "12026021698007",
      "itemId": "12776",
      "RecipeID": "8453",
      "ProductPrice": "2.50",
      "ProductPrice_2": null,
      "GastDesc_de": "Oreo-Cheesecake-Cookies",
      "GastDesc_en": "Oreo Cheesecake Cookies",
      "MenuName": "COOKIE",
      "allergene": {
        "gluten": "Glutenhaltiges Getreide",
        "huhnerei": "Hühnerei und Hühnereierzeugnisse",
        "milch": "Milch und Milcherzeugnisse"
      },
      "merkmale": "",
      "naehrstoffe": "",
      "zusatzstoffe": [
        {
          "de": "Farbstoff",
          "en": "Colouring Agent"
        },
        {
          "de": "Alkohol",
          "en": "Alcohol"
        }
      ],
      "PrintOrder": "7",
      "CO2Value": null,
      "CO2Rating": null,
      "CO2Perc": null,
      "ClimateFriendly": null,
      "GastDesc": "Oreo-Cheesecake-Cookies",
      "date_de": "16.02.2026"
    },
    {
      "id": "5787814",
      "outlet": "cafe",
      "date": "2026-02-16",
      "CalendarWeek": "7",
      "day": "Montag",
      "mealtime": "Mittagessen",
      "IdentNr": "12026021698008",
      "itemId": "12777",
      "RecipeID": "9121",
      "ProductPrice": "2.50",
      "ProductPrice_2": null,
      "GastDesc_de": "Carrotcake  Bananenbrot | Zuckerfrei",
      "GastDesc_en": "Carrot Cake Banana Bread | Sugar-Free",
      "MenuName": "TAG des KASTENKUCHENS",
      "allergene": {
        "gluten": "Glutenhaltiges Getreide",
        "huhnerei": "Hühnerei und Hühnereierzeugnisse",
        "milch": "Milch und Milcherzeugnisse",
        "schwefel": "Schwefeldioxid und Sulfide"
      },
      "merkmale": "",
      "naehrstoffe": "",
      "zusatzstoffe": [
        {
          "de": "Farbstoff",
          "en": "Colouring Agent"
        }
      ],
      "PrintOrder": "8",
      "CO2Value": null,
      "CO2Rating": null,
      "CO2Perc": null,
      "ClimateFriendly": null,
      "GastDesc": "Carrotcake  Bananenbrot | Zuckerfrei",
      "date_de": "16.02.2026"
    },
    {
      "id": "5787815",
      "outlet": "cafe",
      "date": "2026-02-16",
      "CalendarWeek": "7",
      "day": "Montag",
      "mealtime": "Mittagessen",
      "IdentNr": "12026021698011",
      "itemId": "16256",
      "RecipeID": "9122",
      "ProductPrice": "2.50",
      "ProductPrice_2": null,
      "GastDesc_de": "Sesam-Keks | Mehlfrei | Vegan",
      "GastDesc_en": "Sesame Cookie | Flour-Free | Vegan",
      "MenuName": "VEGAN SPECIAL",
      "allergene": {
        "schalenfruchte": "Schalenfrüchte und Schalenfruchterzeugnisse",
        "sesam": "Sesamsamen und Sesamsamenerzeugnisse"
      },
      "merkmale": "",
      "naehrstoffe": "",
      "zusatzstoffe": [
        {
          "de": "Farbstoff",
          "en": "Colouring Agent"
        },
        {
          "de": "Antioxidationsmittel",
          "en": "Antioxidation"
        },
        {
          "de": "Alkohol",
          "en": "Alcohol"
        }
      ],
      "PrintOrder": "11",
      "CO2Value": null,
      "CO2Rating": null,
      "CO2Perc": null,
      "ClimateFriendly": null,
      "GastDesc": "Sesam-Keks | Mehlfrei | Vegan",
      "date_de": "16.02.2026"
    },
    {
      "id": "5787816",
      "outlet": "cafe",
      "date": "2026-02-17",
      "CalendarWeek": "7",
      "day": "Dienstag",
      "mealtime": "Mittagessen",
      "IdentNr": "12026021798001",
      "itemId": "21059",
      "RecipeID": "8054",
      "ProductPrice": "3.20",
      "ProductPrice_2": null,
      "GastDesc_de": "Pflaumenmus-Croffin mit Vanilleschmand",
      "GastDesc_en": "Plum Jam Croffin with Vanilla Sour Cream",
      "MenuName": "CROFFIN",
      "allergene": {
        "gluten": "Glutenhaltiges Getreide",
        "schalenfruchte": "Schalenfrüchte und Schalenfruchterzeugnisse",
        "huhnerei": "Hühnerei und Hühnereierzeugnisse",
        "soja": "Soja und Sojaerzeugnisse",
        "milch": "Milch und Milcherzeugnisse"
      },
      "merkmale": "",
      "naehrstoffe": "",
      "zusatzstoffe": [
        {
          "de": "Farbstoff",
          "en": "Colouring Agent"
        },
        {
          "de": "Alkohol",
          "en": "Alcohol"
        }
      ],
      "PrintOrder": "1",
      "CO2Value": null,
      "CO2Rating": null,
      "CO2Perc": null,
      "ClimateFriendly": null,
      "GastDesc": "Pflaumenmus-Croffin mit Vanilleschmand",
      "date_de": "17.02.2026"
    },
    {
      "id": "5787817",
      "outlet": "cafe",
      "date": "2026-02-17",
      "CalendarWeek": "7",
      "day": "Dienstag",
      "mealtime": "Mittagessen",
      "IdentNr": "12026021798002",
      "itemId": "21062",
      "RecipeID": "8871",
      "ProductPrice": "3.60",
      "ProductPrice_2": null,
      "GastDesc_de": "Baskischer Cheesecake mit Marillenkompott",
      "GastDesc_en": "Basque-style Cheesecake with Apricot Compote",
      "MenuName": "FAVOURITES",
      "allergene": {
        "huhnerei": "Hühnerei und Hühnereierzeugnisse",
        "milch": "Milch und Milcherzeugnisse"
      },
      "merkmale": "",
      "naehrstoffe": "",
      "zusatzstoffe": [
        {
          "de": "Farbstoff",
          "en": "Colouring Agent"
        },
        {
          "de": "Alkohol",
          "en": "Alcohol"
        }
      ],
      "PrintOrder": "2",
      "CO2Value": null,
      "CO2Rating": null,
      "CO2Perc": null,
      "ClimateFriendly": null,
      "GastDesc": "Baskischer Cheesecake mit Marillenkompott",
      "date_de": "17.02.2026"
    },
    {
      "id": "5787818",
      "outlet": "cafe",
      "date": "2026-02-17",
      "CalendarWeek": "7",
      "day": "Dienstag",
      "mealtime": "Mittagessen",
      "IdentNr": "12026021798003",
      "itemId": "21063",
      "RecipeID": "8211",
      "ProductPrice": "0.50",
      "ProductPrice_2": null,
      "GastDesc_de": "LES ARLETTES (Französische Blätterteigkekse) Vegan",
      "GastDesc_en": "LES ARLETTES  (French Puff Pastry Cookies) Vegan",
      "MenuName": "MINIS",
      "allergene": {
        "gluten": "Glutenhaltiges Getreide"
      },
      "merkmale": {
        "vegan": "Vegan",
        "vegetarisch": "Vegetarisch"
      },
      "naehrstoffe": "",
      "zusatzstoffe": [
        {
          "de": "Farbstoff",
          "en": "Colouring Agent"
        },
        {
          "de": "Alkohol",
          "en": "Alcohol"
        }
      ],
      "PrintOrder": "3",
      "CO2Value": null,
      "CO2Rating": null,
      "CO2Perc": null,
      "ClimateFriendly": null,
      "GastDesc": "LES ARLETTES (Französische Blätterteigkekse) Vegan",
      "date_de": "17.02.2026"
    },
    {
      "id": "5787819",
      "outlet": "cafe",
      "date": "2026-02-17",
      "CalendarWeek": "7",
      "day": "Dienstag",
      "mealtime": "Mittagessen",
      "IdentNr": "12026021798005",
      "itemId": "21064",
      "RecipeID": "8330",
      "ProductPrice": "1.50",
      "ProductPrice_2": null,
      "GastDesc_de": "Saftige Brownie-Bananen-Cookies | Zuckerfrei",
      "GastDesc_en": "Fudgy Brownie Banana Cookies | Sugar-Free",
      "MenuName": "PEOPLES CHOICE",
      "allergene": {
        "erdnuss": "Erdnüsse und Erdnusserzeugnisse"
      },
      "merkmale": {
        "ohne_zucker": "Ohne_Zucker",
        "vegan": "Vegan",
        "vegetarisch": "Vegetarisch"
      },
      "naehrstoffe": "",
      "zusatzstoffe": null,
      "PrintOrder": "5",
      "CO2Value": null,
      "CO2Rating": null,
      "CO2Perc": null,
      "ClimateFriendly": null,
      "GastDesc": "Saftige Brownie-Bananen-Cookies | Zuckerfrei",
      "date_de": "17.02.2026"
    },
    {
      "id": "5787820",
      "outlet": "cafe",
      "date": "2026-02-17",
      "CalendarWeek": "7",
      "day": "Dienstag",
      "mealtime": "Mittagessen",
      "IdentNr": "12026021798006",
      "itemId": "21061",
      "RecipeID": "8697",
      "ProductPrice": "2.50",
      "ProductPrice_2": null,
      "GastDesc_de": "Erdnussbutter-Cookie mit Schokolade und Salzkaramell | Vegan",
      "GastDesc_en": "Peanutbutter Cookie with Chocolate Salty Caramel | Vegan",
      "MenuName": "SEASON",
      "allergene": {
        "gluten": "Glutenhaltiges Getreide",
        "soja": "Soja und Sojaerzeugnisse",
        "erdnuss": "Erdnüsse und Erdnusserzeugnisse"
      },
      "merkmale": "",
      "naehrstoffe": "",
      "zusatzstoffe": [
        {
          "de": "Farbstoff",
          "en": "Colouring Agent"
        },
        {
          "de": "Antioxidationsmittel",
          "en": "Antioxidation"
        },
        {
          "de": "Alkohol",
          "en": "Alcohol"
        }
      ],
      "PrintOrder": "6",
      "CO2Value": null,
      "CO2Rating": null,
      "CO2Perc": null,
      "ClimateFriendly": null,
      "GastDesc": "Erdnussbutter-Cookie mit Schokolade und Salzkaramell | Vegan",
      "date_de": "17.02.2026"
    },
    {
      "id": "5787821",
      "outlet": "cafe",
      "date": "2026-02-17",
      "CalendarWeek": "7",
      "day": "Dienstag",
      "mealtime": "Mittagessen",
      "IdentNr": "12026021798007",
      "itemId": "12776",
      "RecipeID": "8453",
      "ProductPrice": "2.50",
      "ProductPrice_2": null,
      "GastDesc_de": "Oreo-Cheesecake-Cookies",
      "GastDesc_en": "Oreo Cheesecake Cookies",
      "MenuName": "COOKIE",
      "allergene": {
        "gluten": "Glutenhaltiges Getreide",
        "huhnerei": "Hühnerei und Hühnereierzeugnisse",
        "milch": "Milch und Milcherzeugnisse"
      },
      "merkmale": "",
      "naehrstoffe": "",
      "zusatzstoffe": [
        {
          "de": "Farbstoff",
          "en": "Colouring Agent"
        },
        {
          "de": "Alkohol",
          "en": "Alcohol"
        }
      ],
      "PrintOrder": "7",
      "CO2Value": null,
      "CO2Rating": null,
      "CO2Perc": null,
      "ClimateFriendly": null,
      "GastDesc": "Oreo-Cheesecake-Cookies",
      "date_de": "17.02.2026"
    },
    {
      "id": "5787822",
      "outlet": "cafe",
      "date": "2026-02-17",
      "CalendarWeek": "7",
      "day": "Dienstag",
      "mealtime": "Mittagessen",
      "IdentNr": "12026021798008",
      "itemId": "12777",
      "RecipeID": "9121",
      "ProductPrice": "2.50",
      "ProductPrice_2": null,
      "GastDesc_de": "Carrotcake  Bananenbrot | Zuckerfrei",
      "GastDesc_en": "Carrot Cake Banana Bread | Sugar-Free",
      "MenuName": "TAG des KASTENKUCHENS",
      "allergene": {
        "gluten": "Glutenhaltiges Getreide",
        "huhnerei": "Hühnerei und Hühnereierzeugnisse",
        "milch": "Milch und Milcherzeugnisse",
        "schwefel": "Schwefeldioxid und Sulfide"
      },
      "merkmale": "",
      "naehrstoffe": "",
      "zusatzstoffe": [
        {
          "de": "Farbstoff",
          "en": "Colouring Agent"
        }
      ],
      "PrintOrder": "8",
      "CO2Value": null,
      "CO2Rating": null,
      "CO2Perc": null,
      "ClimateFriendly": null,
      "GastDesc": "Carrotcake  Bananenbrot | Zuckerfrei",
      "date_de": "17.02.2026"
    },
    {
      "id": "5787823",
      "outlet": "cafe",
      "date": "2026-02-17",
      "CalendarWeek": "7",
      "day": "Dienstag",
      "mealtime": "Mittagessen",
      "IdentNr": "12026021798011",
      "itemId": "16256",
      "RecipeID": "9122",
      "ProductPrice": "2.50",
      "ProductPrice_2": null,
      "GastDesc_de": "Sesam-Keks | Mehlfrei | Vegan",
      "GastDesc_en": "Sesame Cookie | Flour-Free | Vegan",
      "MenuName": "VEGAN SPECIAL",
      "allergene": {
        "schalenfruchte": "Schalenfrüchte und Schalenfruchterzeugnisse",
        "sesam": "Sesamsamen und Sesamsamenerzeugnisse"
      },
      "merkmale": "",
      "naehrstoffe": "",
      "zusatzstoffe": [
        {
          "de": "Farbstoff",
          "en": "Colouring Agent"
        },
        {
          "de": "Antioxidationsmittel",
          "en": "Antioxidation"
        },
        {
          "de": "Alkohol",
          "en": "Alcohol"
        }
      ],
      "PrintOrder": "11",
      "CO2Value": null,
      "CO2Rating": null,
      "CO2Perc": null,
      "ClimateFriendly": null,
      "GastDesc": "Sesam-Keks | Mehlfrei | Vegan",
      "date_de": "17.02.2026"
    },
    {
      "id": "5787824",
      "outlet": "cafe",
      "date": "2026-02-18",
      "CalendarWeek": "7",
      "day": "Mittwoch",
      "mealtime": "Mittagessen",
      "IdentNr": "12026021898000",
      "itemId": "21060",
      "RecipeID": "8636",
      "ProductPrice": "2.10",
      "ProductPrice_2": null,
      "GastDesc_de": "Chocolate-Lava-Cookie",
      "GastDesc_en": "Chocolate Lava Cookies",
      "MenuName": "CHOCOLATE",
      "allergene": {
        "gluten": "Glutenhaltiges Getreide",
        "huhnerei": "Hühnerei und Hühnereierzeugnisse",
        "soja": "Soja und Sojaerzeugnisse",
        "milch": "Milch und Milcherzeugnisse"
      },
      "merkmale": "",
      "naehrstoffe": "",
      "zusatzstoffe": [
        {
          "de": "Farbstoff",
          "en": "Colouring Agent"
        },
        {
          "de": "Alkohol",
          "en": "Alcohol"
        }
      ],
      "PrintOrder": "0",
      "CO2Value": null,
      "CO2Rating": null,
      "CO2Perc": null,
      "ClimateFriendly": null,
      "GastDesc": "Chocolate-Lava-Cookie",
      "date_de": "18.02.2026"
    },
    {
      "id": "5787825",
      "outlet": "cafe",
      "date": "2026-02-18",
      "CalendarWeek": "7",
      "day": "Mittwoch",
      "mealtime": "Mittagessen",
      "IdentNr": "12026021898002",
      "itemId": "21062",
      "RecipeID": "8871",
      "ProductPrice": "3.60",
      "ProductPrice_2": null,
      "GastDesc_de": "Baskischer Cheesecake mit Marillenkompott",
      "GastDesc_en": "Basque-style Cheesecake with Apricot Compote",
      "MenuName": "FAVOURITES",
      "allergene": {
        "huhnerei": "Hühnerei und Hühnereierzeugnisse",
        "milch": "Milch und Milcherzeugnisse"
      },
      "merkmale": "",
      "naehrstoffe": "",
      "zusatzstoffe": [
        {
          "de": "Farbstoff",
          "en": "Colouring Agent"
        },
        {
          "de": "Alkohol",
          "en": "Alcohol"
        }
      ],
      "PrintOrder": "2",
      "CO2Value": null,
      "CO2Rating": null,
      "CO2Perc": null,
      "ClimateFriendly": null,
      "GastDesc": "Baskischer Cheesecake mit Marillenkompott",
      "date_de": "18.02.2026"
    },
    {
      "id": "5787826",
      "outlet": "cafe",
      "date": "2026-02-18",
      "CalendarWeek": "7",
      "day": "Mittwoch",
      "mealtime": "Mittagessen",
      "IdentNr": "12026021898003",
      "itemId": "21063",
      "RecipeID": "8211",
      "ProductPrice": "0.50",
      "ProductPrice_2": null,
      "GastDesc_de": "LES ARLETTES (Französische Blätterteigkekse) Vegan",
      "GastDesc_en": "LES ARLETTES  (French Puff Pastry Cookies) Vegan",
      "MenuName": "MINIS",
      "allergene": {
        "gluten": "Glutenhaltiges Getreide"
      },
      "merkmale": {
        "vegan": "Vegan",
        "vegetarisch": "Vegetarisch"
      },
      "naehrstoffe": "",
      "zusatzstoffe": [
        {
          "de": "Farbstoff",
          "en": "Colouring Agent"
        },
        {
          "de": "Alkohol",
          "en": "Alcohol"
        }
      ],
      "PrintOrder": "3",
      "CO2Value": null,
      "CO2Rating": null,
      "CO2Perc": null,
      "ClimateFriendly": null,
      "GastDesc": "LES ARLETTES (Französische Blätterteigkekse) Vegan",
      "date_de": "18.02.2026"
    },
    {
      "id": "5787827",
      "outlet": "cafe",
      "date": "2026-02-18",
      "CalendarWeek": "7",
      "day": "Mittwoch",
      "mealtime": "Mittagessen",
      "IdentNr": "12026021898005",
      "itemId": "21064",
      "RecipeID": "8330",
      "ProductPrice": "1.50",
      "ProductPrice_2": null,
      "GastDesc_de": "Saftige Brownie-Bananen-Cookies | Zuckerfrei",
      "GastDesc_en": "Fudgy Brownie Banana Cookies | Sugar-Free",
      "MenuName": "PEOPLES CHOICE",
      "allergene": {
        "erdnuss": "Erdnüsse und Erdnusserzeugnisse"
      },
      "merkmale": {
        "ohne_zucker": "Ohne_Zucker",
        "vegan": "Vegan",
        "vegetarisch": "Vegetarisch"
      },
      "naehrstoffe": "",
      "zusatzstoffe": null,
      "PrintOrder": "5",
      "CO2Value": null,
      "CO2Rating": null,
      "CO2Perc": null,
      "ClimateFriendly": null,
      "GastDesc": "Saftige Brownie-Bananen-Cookies | Zuckerfrei",
      "date_de": "18.02.2026"
    },
    {
      "id": "5787828",
      "outlet": "cafe",
      "date": "2026-02-18",
      "CalendarWeek": "7",
      "day": "Mittwoch",
      "mealtime": "Mittagessen",
      "IdentNr": "12026021898007",
      "itemId": "12776",
      "RecipeID": "8453",
      "ProductPrice": "2.50",
      "ProductPrice_2": null,
      "GastDesc_de": "Oreo-Cheesecake-Cookies",
      "GastDesc_en": "Oreo Cheesecake Cookies",
      "MenuName": "COOKIE",
      "allergene": {
        "gluten": "Glutenhaltiges Getreide",
        "huhnerei": "Hühnerei und Hühnereierzeugnisse",
        "milch": "Milch und Milcherzeugnisse"
      },
      "merkmale": "",
      "naehrstoffe": "",
      "zusatzstoffe": [
        {
          "de": "Farbstoff",
          "en": "Colouring Agent"
        },
        {
          "de": "Alkohol",
          "en": "Alcohol"
        }
      ],
      "PrintOrder": "7",
      "CO2Value": null,
      "CO2Rating": null,
      "CO2Perc": null,
      "ClimateFriendly": null,
      "GastDesc": "Oreo-Cheesecake-Cookies",
      "date_de": "18.02.2026"
    },
    {
      "id": "5787829",
      "outlet": "cafe",
      "date": "2026-02-18",
      "CalendarWeek": "7",
      "day": "Mittwoch",
      "mealtime": "Mittagessen",
      "IdentNr": "12026021898008",
      "itemId": "12777",
      "RecipeID": "9121",
      "ProductPrice": "2.50",
      "ProductPrice_2": null,
      "GastDesc_de": "Carrotcake  Bananenbrot | Zuckerfrei",
      "GastDesc_en": "Carrot Cake Banana Bread | Sugar-Free",
      "MenuName": "TAG des KASTENKUCHENS",
      "allergene": {
        "gluten": "Glutenhaltiges Getreide",
        "huhnerei": "Hühnerei und Hühnereierzeugnisse",
        "milch": "Milch und Milcherzeugnisse",
        "schwefel": "Schwefeldioxid und Sulfide"
      },
      "merkmale": "",
      "naehrstoffe": "",
      "zusatzstoffe": [
        {
          "de": "Farbstoff",
          "en": "Colouring Agent"
        }
      ],
      "PrintOrder": "8",
      "CO2Value": null,
      "CO2Rating": null,
      "CO2Perc": null,
      "ClimateFriendly": null,
      "GastDesc": "Carrotcake  Bananenbrot | Zuckerfrei",
      "date_de": "18.02.2026"
    },
    {
      "id": "5787830",
      "outlet": "cafe",
      "date": "2026-02-18",
      "CalendarWeek": "7",
      "day": "Mittwoch",
      "mealtime": "Mittagessen",
      "IdentNr": "12026021898011",
      "itemId": "16256",
      "RecipeID": "9122",
      "ProductPrice": "2.50",
      "ProductPrice_2": null,
      "GastDesc_de": "Sesam-Keks | Mehlfrei | Vegan",
      "GastDesc_en": "Sesame Cookie | Flour-Free | Vegan",
      "MenuName": "VEGAN SPECIAL",
      "allergene": {
        "schalenfruchte": "Schalenfrüchte und Schalenfruchterzeugnisse",
        "sesam": "Sesamsamen und Sesamsamenerzeugnisse"
      },
      "merkmale": "",
      "naehrstoffe": "",
      "zusatzstoffe": [
        {
          "de": "Farbstoff",
          "en": "Colouring Agent"
        },
        {
          "de": "Antioxidationsmittel",
          "en": "Antioxidation"
        },
        {
          "de": "Alkohol",
          "en": "Alcohol"
        }
      ],
      "PrintOrder": "11",
      "CO2Value": null,
      "CO2Rating": null,
      "CO2Perc": null,
      "ClimateFriendly": null,
      "GastDesc": "Sesam-Keks | Mehlfrei | Vegan",
      "date_de": "18.02.2026"
    },
    {
      "id": "5787831",
      "outlet": "cafe",
      "date": "2026-02-19",
      "CalendarWeek": "7",
      "day": "Donnerstag",
      "mealtime": "Mittagessen",
      "IdentNr": "12026021998000",
      "itemId": "21060",
      "RecipeID": "8636",
      "ProductPrice": "2.10",
      "ProductPrice_2": null,
      "GastDesc_de": "Chocolate-Lava-Cookie",
      "GastDesc_en": "Chocolate Lava Cookies",
      "MenuName": "CHOCOLATE",
      "allergene": {
        "gluten": "Glutenhaltiges Getreide",
        "huhnerei": "Hühnerei und Hühnereierzeugnisse",
        "soja": "Soja und Sojaerzeugnisse",
        "milch": "Milch und Milcherzeugnisse"
      },
      "merkmale": "",
      "naehrstoffe": "",
      "zusatzstoffe": [
        {
          "de": "Farbstoff",
          "en": "Colouring Agent"
        },
        {
          "de": "Alkohol",
          "en": "Alcohol"
        }
      ],
      "PrintOrder": "0",
      "CO2Value": null,
      "CO2Rating": null,
      "CO2Perc": null,
      "ClimateFriendly": null,
      "GastDesc": "Chocolate-Lava-Cookie",
      "date_de": "19.02.2026"
    },
    {
      "id": "5787832",
      "outlet": "cafe",
      "date": "2026-02-19",
      "CalendarWeek": "7",
      "day": "Donnerstag",
      "mealtime": "Mittagessen",
      "IdentNr": "12026021998002",
      "itemId": "21062",
      "RecipeID": "8871",
      "ProductPrice": "3.60",
      "ProductPrice_2": null,
      "GastDesc_de": "Baskischer Cheesecake mit Marillenkompott",
      "GastDesc_en": "Basque-style Cheesecake with Apricot Compote",
      "MenuName": "FAVOURITES",
      "allergene": {
        "huhnerei": "Hühnerei und Hühnereierzeugnisse",
        "milch": "Milch und Milcherzeugnisse"
      },
      "merkmale": "",
      "naehrstoffe": "",
      "zusatzstoffe": [
        {
          "de": "Farbstoff",
          "en": "Colouring Agent"
        },
        {
          "de": "Alkohol",
          "en": "Alcohol"
        }
      ],
      "PrintOrder": "2",
      "CO2Value": null,
      "CO2Rating": null,
      "CO2Perc": null,
      "ClimateFriendly": null,
      "GastDesc": "Baskischer Cheesecake mit Marillenkompott",
      "date_de": "19.02.2026"
    },
    {
      "id": "5787833",
      "outlet": "cafe",
      "date": "2026-02-19",
      "CalendarWeek": "7",
      "day": "Donnerstag",
      "mealtime": "Mittagessen",
      "IdentNr": "12026021998003",
      "itemId": "21063",
      "RecipeID": "8211",
      "ProductPrice": "0.50",
      "ProductPrice_2": null,
      "GastDesc_de": "LES ARLETTES (Französische Blätterteigkekse) Vegan",
      "GastDesc_en": "LES ARLETTES  (French Puff Pastry Cookies) Vegan",
      "MenuName": "MINIS",
      "allergene": {
        "gluten": "Glutenhaltiges Getreide"
      },
      "merkmale": {
        "vegan": "Vegan",
        "vegetarisch": "Vegetarisch"
      },
      "naehrstoffe": "",
      "zusatzstoffe": [
        {
          "de": "Farbstoff",
          "en": "Colouring Agent"
        },
        {
          "de": "Alkohol",
          "en": "Alcohol"
        }
      ],
      "PrintOrder": "3",
      "CO2Value": null,
      "CO2Rating": null,
      "CO2Perc": null,
      "ClimateFriendly": null,
      "GastDesc": "LES ARLETTES (Französische Blätterteigkekse) Vegan",
      "date_de": "19.02.2026"
    },
    {
      "id": "5787834",
      "outlet": "cafe",
      "date": "2026-02-19",
      "CalendarWeek": "7",
      "day": "Donnerstag",
      "mealtime": "Mittagessen",
      "IdentNr": "12026021998005",
      "itemId": "21064",
      "RecipeID": "8330",
      "ProductPrice": "1.50",
      "ProductPrice_2": null,
      "GastDesc_de": "Saftige Brownie-Bananen-Cookies | Zuckerfrei",
      "GastDesc_en": "Fudgy Brownie Banana Cookies | Sugar-Free",
      "MenuName": "PEOPLES CHOICE",
      "allergene": {
        "erdnuss": "Erdnüsse und Erdnusserzeugnisse"
      },
      "merkmale": {
        "ohne_zucker": "Ohne_Zucker",
        "vegan": "Vegan",
        "vegetarisch": "Vegetarisch"
      },
      "naehrstoffe": "",
      "zusatzstoffe": null,
      "PrintOrder": "5",
      "CO2Value": null,
      "CO2Rating": null,
      "CO2Perc": null,
      "ClimateFriendly": null,
      "GastDesc": "Saftige Brownie-Bananen-Cookies | Zuckerfrei",
      "date_de": "19.02.2026"
    },
    {
      "id": "5787835",
      "outlet": "cafe",
      "date": "2026-02-19",
      "CalendarWeek": "7",
      "day": "Donnerstag",
      "mealtime": "Mittagessen",
      "IdentNr": "12026021998007",
      "itemId": "12776",
      "RecipeID": "8453",
      "ProductPrice": "2.50",
      "ProductPrice_2": null,
      "GastDesc_de": "Oreo-Cheesecake-Cookies",
      "GastDesc_en": "Oreo Cheesecake Cookies",
      "MenuName": "COOKIE",
      "allergene": {
        "gluten": "Glutenhaltiges Getreide",
        "huhnerei": "Hühnerei und Hühnereierzeugnisse",
        "milch": "Milch und Milcherzeugnisse"
      },
      "merkmale": "",
      "naehrstoffe": "",
      "zusatzstoffe": [
        {
          "de": "Farbstoff",
          "en": "Colouring Agent"
        },
        {
          "de": "Alkohol",
          "en": "Alcohol"
        }
      ],
      "PrintOrder": "7",
      "CO2Value": null,
      "CO2Rating": null,
      "CO2Perc": null,
      "ClimateFriendly": null,
      "GastDesc": "Oreo-Cheesecake-Cookies",
      "date_de": "19.02.2026"
    },
    {
      "id": "5787836",
      "outlet": "cafe",
      "date": "2026-02-19",
      "CalendarWeek": "7",
      "day": "Donnerstag",
      "mealtime": "Mittagessen",
      "IdentNr": "12026021998008",
      "itemId": "12777",
      "RecipeID": "9121",
      "ProductPrice": "2.50",
      "ProductPrice_2": null,
      "GastDesc_de": "Carrotcake  Bananenbrot | Zuckerfrei",
      "GastDesc_en": "Carrot Cake Banana Bread | Sugar-Free",
      "MenuName": "TAG des KASTENKUCHENS",
      "allergene": {
        "gluten": "Glutenhaltiges Getreide",
        "huhnerei": "Hühnerei und Hühnereierzeugnisse",
        "milch": "Milch und Milcherzeugnisse",
        "schwefel": "Schwefeldioxid und Sulfide"
      },
      "merkmale": "",
      "naehrstoffe": "",
      "zusatzstoffe": [
        {
          "de": "Farbstoff",
          "en": "Colouring Agent"
        }
      ],
      "PrintOrder": "8",
      "CO2Value": null,
      "CO2Rating": null,
      "CO2Perc": null,
      "ClimateFriendly": null,
      "GastDesc": "Carrotcake  Bananenbrot | Zuckerfrei",
      "date_de": "19.02.2026"
    },
    {
      "id": "5787837",
      "outlet": "cafe",
      "date": "2026-02-19",
      "CalendarWeek": "7",
      "day": "Donnerstag",
      "mealtime": "Mittagessen",
      "IdentNr": "12026021998011",
      "itemId": "16256",
      "RecipeID": "9122",
      "ProductPrice": "2.50",
      "ProductPrice_2": null,
      "GastDesc_de": "Sesam-Keks | Mehlfrei | Vegan",
      "GastDesc_en": "Sesame Cookie | Flour-Free | Vegan",
      "MenuName": "VEGAN SPECIAL",
      "allergene": {
        "schalenfruchte": "Schalenfrüchte und Schalenfruchterzeugnisse",
        "sesam": "Sesamsamen und Sesamsamenerzeugnisse"
      },
      "merkmale": "",
      "naehrstoffe": "",
      "zusatzstoffe": [
        {
          "de": "Farbstoff",
          "en": "Colouring Agent"
        },
        {
          "de": "Antioxidationsmittel",
          "en": "Antioxidation"
        },
        {
          "de": "Alkohol",
          "en": "Alcohol"
        }
      ],
      "PrintOrder": "11",
      "CO2Value": null,
      "CO2Rating": null,
      "CO2Perc": null,
      "ClimateFriendly": null,
      "GastDesc": "Sesam-Keks | Mehlfrei | Vegan",
      "date_de": "19.02.2026"
    },
    {
      "id": "5787838",
      "outlet": "cafe",
      "date": "2026-02-20",
      "CalendarWeek": "7",
      "day": "Freitag",
      "mealtime": "Mittagessen",
      "IdentNr": "12026022098000",
      "itemId": "21060",
      "RecipeID": "8636",
      "ProductPrice": "2.10",
      "ProductPrice_2": null,
      "GastDesc_de": "Chocolate-Lava-Cookie",
      "GastDesc_en": "Chocolate Lava Cookies",
      "MenuName": "CHOCOLATE",
      "allergene": {
        "gluten": "Glutenhaltiges Getreide",
        "huhnerei": "Hühnerei und Hühnereierzeugnisse",
        "soja": "Soja und Sojaerzeugnisse",
        "milch": "Milch und Milcherzeugnisse"
      },
      "merkmale": "",
      "naehrstoffe": "",
      "zusatzstoffe": [
        {
          "de": "Farbstoff",
          "en": "Colouring Agent"
        },
        {
          "de": "Alkohol",
          "en": "Alcohol"
        }
      ],
      "PrintOrder": "0",
      "CO2Value": null,
      "CO2Rating": null,
      "CO2Perc": null,
      "ClimateFriendly": null,
      "GastDesc": "Chocolate-Lava-Cookie",
      "date_de": "20.02.2026"
    },
    {
      "id": "5787839",
      "outlet": "cafe",
      "date": "2026-02-20",
      "CalendarWeek": "7",
      "day": "Freitag",
      "mealtime": "Mittagessen",
      "IdentNr": "12026022098002",
      "itemId": "21062",
      "RecipeID": "8871",
      "ProductPrice": "3.60",
      "ProductPrice_2": null,
      "GastDesc_de": "Baskischer Cheesecake mit Marillenkompott",
      "GastDesc_en": "Basque-style Cheesecake with Apricot Compote",
      "MenuName": "FAVOURITES",
      "allergene": {
        "huhnerei": "Hühnerei und Hühnereierzeugnisse",
        "milch": "Milch und Milcherzeugnisse"
      },
      "merkmale": "",
      "naehrstoffe": "",
      "zusatzstoffe": [
        {
          "de": "Farbstoff",
          "en": "Colouring Agent"
        },
        {
          "de": "Alkohol",
          "en": "Alcohol"
        }
      ],
      "PrintOrder": "2",
      "CO2Value": null,
      "CO2Rating": null,
      "CO2Perc": null,
      "ClimateFriendly": null,
      "GastDesc": "Baskischer Cheesecake mit Marillenkompott",
      "date_de": "20.02.2026"
    },
    {
      "id": "5787840",
      "outlet": "cafe",
      "date": "2026-02-20",
      "CalendarWeek": "7",
      "day": "Freitag",
      "mealtime": "Mittagessen",
      "IdentNr": "12026022098003",
      "itemId": "21063",
      "RecipeID": "8211",
      "ProductPrice": "0.50",
      "ProductPrice_2": null,
      "GastDesc_de": "LES ARLETTES (Französische Blätterteigkekse) Vegan",
      "GastDesc_en": "LES ARLETTES  (French Puff Pastry Cookies) Vegan",
      "MenuName": "MINIS",
      "allergene": {
        "gluten": "Glutenhaltiges Getreide"
      },
      "merkmale": {
        "vegan": "Vegan",
        "vegetarisch": "Vegetarisch"
      },
      "naehrstoffe": "",
      "zusatzstoffe": [
        {
          "de": "Farbstoff",
          "en": "Colouring Agent"
        },
        {
          "de": "Alkohol",
          "en": "Alcohol"
        }
      ],
      "PrintOrder": "3",
      "CO2Value": null,
      "CO2Rating": null,
      "CO2Perc": null,
      "ClimateFriendly": null,
      "GastDesc": "LES ARLETTES (Französische Blätterteigkekse) Vegan",
      "date_de": "20.02.2026"
    },
    {
      "id": "5787841",
      "outlet": "cafe",
      "date": "2026-02-20",
      "CalendarWeek": "7",
      "day": "Freitag",
      "mealtime": "Mittagessen",
      "IdentNr": "12026022098005",
      "itemId": "21064",
      "RecipeID": "8330",
      "ProductPrice": "1.50",
      "ProductPrice_2": null,
      "GastDesc_de": "Saftige Brownie-Bananen-Cookies | Zuckerfrei",
      "GastDesc_en": "Fudgy Brownie Banana Cookies | Sugar-Free",
      "MenuName": "PEOPLES CHOICE",
      "allergene": {
        "erdnuss": "Erdnüsse und Erdnusserzeugnisse"
      },
      "merkmale": {
        "ohne_zucker": "Ohne_Zucker",
        "vegan": "Vegan",
        "vegetarisch": "Vegetarisch"
      },
      "naehrstoffe": "",
      "zusatzstoffe": null,
      "PrintOrder": "5",
      "CO2Value": null,
      "CO2Rating": null,
      "CO2Perc": null,
      "ClimateFriendly": null,
      "GastDesc": "Saftige Brownie-Bananen-Cookies | Zuckerfrei",
      "date_de": "20.02.2026"
    },
    {
      "id": "5787842",
      "outlet": "cafe",
      "date": "2026-02-20",
      "CalendarWeek": "7",
      "day": "Freitag",
      "mealtime": "Mittagessen",
      "IdentNr": "12026022098007",
      "itemId": "12776",
      "RecipeID": "8453",
      "ProductPrice": "2.50",
      "ProductPrice_2": null,
      "GastDesc_de": "Oreo-Cheesecake-Cookies",
      "GastDesc_en": "Oreo Cheesecake Cookies",
      "MenuName": "COOKIE",
      "allergene": {
        "gluten": "Glutenhaltiges Getreide",
        "huhnerei": "Hühnerei und Hühnereierzeugnisse",
        "milch": "Milch und Milcherzeugnisse"
      },
      "merkmale": "",
      "naehrstoffe": "",
      "zusatzstoffe": [
        {
          "de": "Farbstoff",
          "en": "Colouring Agent"
        },
        {
          "de": "Alkohol",
          "en": "Alcohol"
        }
      ],
      "PrintOrder": "7",
      "CO2Value": null,
      "CO2Rating": null,
      "CO2Perc": null,
      "ClimateFriendly": null,
      "GastDesc": "Oreo-Cheesecake-Cookies",
      "date_de": "20.02.2026"
    },
    {
      "id": "5787843",
      "outlet": "cafe",
      "date": "2026-02-20",
      "CalendarWeek": "7",
      "day": "Freitag",
      "mealtime": "Mittagessen",
      "IdentNr": "12026022098008",
      "itemId": "12777",
      "RecipeID": "9121",
      "ProductPrice": "2.50",
      "ProductPrice_2": null,
      "GastDesc_de": "Carrotcake  Bananenbrot | Zuckerfrei",
      "GastDesc_en": "Carrot Cake Banana Bread | Sugar-Free",
      "MenuName": "TAG des KASTENKUCHENS",
      "allergene": {
        "gluten": "Glutenhaltiges Getreide",
        "huhnerei": "Hühnerei und Hühnereierzeugnisse",
        "milch": "Milch und Milcherzeugnisse",
        "schwefel": "Schwefeldioxid und Sulfide"
      },
      "merkmale": "",
      "naehrstoffe": "",
      "zusatzstoffe": [
        {
          "de": "Farbstoff",
          "en": "Colouring Agent"
        }
      ],
      "PrintOrder": "8",
      "CO2Value": null,
      "CO2Rating": null,
      "CO2Perc": null,
      "ClimateFriendly": null,
      "GastDesc": "Carrotcake  Bananenbrot | Zuckerfrei",
      "date_de": "20.02.2026"
    },
    {
      "id": "5787844",
      "outlet": "cafe",
      "date": "2026-02-20",
      "CalendarWeek": "7",
      "day": "Freitag",
      "mealtime": "Mittagessen",
      "IdentNr": "12026022098011",
      "itemId": "16256",
      "RecipeID": "9122",
      "ProductPrice": "2.50",
      "ProductPrice_2": null,
      "GastDesc_de": "Sesam-Keks | Mehlfrei | Vegan",
      "GastDesc_en": "Sesame Cookie | Flour-Free | Vegan",
      "MenuName": "VEGAN SPECIAL",
      "allergene": {
        "schalenfruchte": "Schalenfrüchte und Schalenfruchterzeugnisse",
        "sesam": "Sesamsamen und Sesamsamenerzeugnisse"
      },
      "merkmale": "",
      "naehrstoffe": "",
      "zusatzstoffe": [
        {
          "de": "Farbstoff",
          "en": "Colouring Agent"
        },
        {
          "de": "Antioxidationsmittel",
          "en": "Antioxidation"
        },
        {
          "de": "Alkohol",
          "en": "Alcohol"
        }
      ],
      "PrintOrder": "11",
      "CO2Value": null,
      "CO2Rating": null,
      "CO2Perc": null,
      "ClimateFriendly": null,
      "GastDesc": "Sesam-Keks | Mehlfrei | Vegan",
      "date_de": "20.02.2026"
    },
    {
      "id": "5662392",
      "outlet": "canteen",
      "date": "2026-02-07",
      "CalendarWeek": "6",
      "day": "Samstag",
      "mealtime": "Abendessen",
      "IdentNr": "12026020798014",
      "itemId": "17563",
      "RecipeID": "6296",
      "ProductPrice": "12.00",
      "ProductPrice_2": null,
      "GastDesc_de": "Bratwurst | Sauerkraut | Majoranjus",
      "GastDesc_en": "Bratwurst | Sauerkraut | Marjoram Jus",
      "MenuName": "LUNCH Meat_",
      "allergene": {
        "milch": "Milch und Milcherzeugnisse",
        "sellerie": "Sellerie und Sellerieerzeugnisse",
        "senf": "Senf und Senferzeugnisse",
        "schwefel": "Schwefeldioxid und Sulfide"
      },
      "merkmale": "",
      "naehrstoffe": "",
      "zusatzstoffe": [
        {
          "de": "Phosphat",
          "en": "Phosphate"
        },
        {
          "de": "Alkohol",
          "en": "Alcohol"
        }
      ],
      "PrintOrder": "14",
      "CO2Value": "830.00",
      "CO2Rating": "B",
      "CO2Perc": "100.00",
      "ClimateFriendly": null,
      "GastDesc": "Bratwurst | Sauerkraut | Majoranjus",
      "date_de": "07.02.2026"
    },
    {
      "id": "5662394",
      "outlet": "canteen",
      "date": "2026-02-07",
      "CalendarWeek": "6",
      "day": "Samstag",
      "mealtime": "Abendessen",
      "IdentNr": "12026020798015",
      "itemId": "17564",
      "RecipeID": "7262",
      "ProductPrice": "12.00",
      "ProductPrice_2": null,
      "GastDesc_de": "Backfisch | Kartoffelsalat | Zitronenmayo",
      "GastDesc_en": "Fried Fish | Potato Salad | Lemon Mayo",
      "MenuName": "LUNCH Fish_",
      "allergene": {
        "gluten": "Glutenhaltiges Getreide",
        "huhnerei": "Hühnerei und Hühnereierzeugnisse",
        "fisch": "Fisch und Fischerzeugnisse",
        "senf": "Senf und Senferzeugnisse"
      },
      "merkmale": "",
      "naehrstoffe": "",
      "zusatzstoffe": [
        {
          "de": "Süßungsmittel",
          "en": "Sweetener"
        },
        {
          "de": "Farbstoff",
          "en": "Colouring Agent"
        },
        {
          "de": "Antioxidationsmittel",
          "en": "Antioxidation"
        },
        {
          "de": "Konservierungsstoff",
          "en": "Preservatives"
        }
      ],
      "PrintOrder": "15",
      "CO2Value": "886.00",
      "CO2Rating": "B",
      "CO2Perc": "100.00",
      "ClimateFriendly": null,
      "GastDesc": "Backfisch | Kartoffelsalat | Zitronenmayo",
      "date_de": "07.02.2026"
    },
    {
      "id": "5662396",
      "outlet": "canteen",
      "date": "2026-02-07",
      "CalendarWeek": "6",
      "day": "Samstag",
      "mealtime": "Abendessen",
      "IdentNr": "12026020798017",
      "itemId": "17566",
      "RecipeID": "9085",
      "ProductPrice": "9.50",
      "ProductPrice_2": null,
      "GastDesc_de": "Kürbis-Falafel | Ebly | Gewürzjoghurt",
      "GastDesc_en": "Pumpkin Falafel | Ebly | Spiced Yoghurt",
      "MenuName": "LUNCH Classic_",
      "allergene": {
        "gluten": "Glutenhaltiges Getreide",
        "schalenfruchte": "Schalenfrüchte und Schalenfruchterzeugnisse",
        "milch": "Milch und Milcherzeugnisse",
        "sellerie": "Sellerie und Sellerieerzeugnisse"
      },
      "merkmale": {
        "vegetarisch": "Vegetarisch"
      },
      "naehrstoffe": "",
      "zusatzstoffe": null,
      "PrintOrder": "17",
      "CO2Value": "329.00",
      "CO2Rating": "A",
      "CO2Perc": "100.00",
      "ClimateFriendly": "1",
      "GastDesc": "Kürbis-Falafel | Ebly | Gewürzjoghurt",
      "date_de": "07.02.2026"
    },
    {
      "id": "5662398",
      "outlet": "canteen",
      "date": "2026-02-08",
      "CalendarWeek": "6",
      "day": "Sonntag",
      "mealtime": "Abendessen",
      "IdentNr": "12026020898018",
      "itemId": "17864",
      "RecipeID": "4490",
      "ProductPrice": "12.00",
      "ProductPrice_2": null,
      "GastDesc_de": "Hühnerfrikassee | Reis | Salat",
      "GastDesc_en": "Chicken Fricassee | Rice | Salad",
      "MenuName": "DINNER Meat _|",
      "allergene": {
        "gluten": "Glutenhaltiges Getreide",
        "milch": "Milch und Milcherzeugnisse",
        "sellerie": "Sellerie und Sellerieerzeugnisse",
        "senf": "Senf und Senferzeugnisse",
        "schwefel": "Schwefeldioxid und Sulfide"
      },
      "merkmale": "",
      "naehrstoffe": "",
      "zusatzstoffe": [
        {
          "de": "Konservierungsstoff",
          "en": "Preservatives"
        },
        {
          "de": "Alkohol",
          "en": "Alcohol"
        }
      ],
      "PrintOrder": "18",
      "CO2Value": "1364.00",
      "CO2Rating": "C",
      "CO2Perc": "100.00",
      "ClimateFriendly": null,
      "GastDesc": "Hühnerfrikassee | Reis | Salat",
      "date_de": "08.02.2026"
    },
    {
      "id": "5662399",
      "outlet": "canteen",
      "date": "2026-02-08",
      "CalendarWeek": "6",
      "day": "Sonntag",
      "mealtime": "Mittagessen",
      "IdentNr": "12026020898018",
      "itemId": "17864",
      "RecipeID": "4490",
      "ProductPrice": "12.00",
      "ProductPrice_2": null,
      "GastDesc_de": "Hühnerfrikassee | Reis | Salat",
      "GastDesc_en": "Chicken Fricassee | Rice | Salad",
      "MenuName": "DINNER Meat _|",
      "allergene": {
        "gluten": "Glutenhaltiges Getreide",
        "milch": "Milch und Milcherzeugnisse",
        "sellerie": "Sellerie und Sellerieerzeugnisse",
        "senf": "Senf und Senferzeugnisse",
        "schwefel": "Schwefeldioxid und Sulfide"
      },
      "merkmale": "",
      "naehrstoffe": "",
      "zusatzstoffe": [
        {
          "de": "Konservierungsstoff",
          "en": "Preservatives"
        },
        {
          "de": "Alkohol",
          "en": "Alcohol"
        }
      ],
      "PrintOrder": "18",
      "CO2Value": "1364.00",
      "CO2Rating": "C",
      "CO2Perc": "100.00",
      "ClimateFriendly": null,
      "GastDesc": "Hühnerfrikassee | Reis | Salat",
      "date_de": "08.02.2026"
    },
    {
      "id": "5662401",
      "outlet": "canteen",
      "date": "2026-02-08",
      "CalendarWeek": "6",
      "day": "Sonntag",
      "mealtime": "Abendessen",
      "IdentNr": "12026020898019",
      "itemId": "17865",
      "RecipeID": "8806",
      "ProductPrice": "12.00",
      "ProductPrice_2": null,
      "GastDesc_de": "Pasta Fussili | Lachs | Parmesan",
      "GastDesc_en": "Pasta Fusilli | Flaked Salmon | Parmesan",
      "MenuName": "DINNER Fish _|",
      "allergene": {
        "gluten": "Glutenhaltiges Getreide",
        "fisch": "Fisch und Fischerzeugnisse",
        "milch": "Milch und Milcherzeugnisse"
      },
      "merkmale": "",
      "naehrstoffe": "",
      "zusatzstoffe": null,
      "PrintOrder": "19",
      "CO2Value": "1006.00",
      "CO2Rating": "B",
      "CO2Perc": "100.00",
      "ClimateFriendly": null,
      "GastDesc": "Pasta Fussili | Lachs | Parmesan",
      "date_de": "08.02.2026"
    },
    {
      "id": "5662402",
      "outlet": "canteen",
      "date": "2026-02-08",
      "CalendarWeek": "6",
      "day": "Sonntag",
      "mealtime": "Mittagessen",
      "IdentNr": "12026020898019",
      "itemId": "17865",
      "RecipeID": "8806",
      "ProductPrice": "12.00",
      "ProductPrice_2": null,
      "GastDesc_de": "Pasta Fussili | Lachs | Parmesan",
      "GastDesc_en": "Pasta Fusilli | Flaked Salmon | Parmesan",
      "MenuName": "DINNER Fish _|",
      "allergene": {
        "gluten": "Glutenhaltiges Getreide",
        "fisch": "Fisch und Fischerzeugnisse",
        "milch": "Milch und Milcherzeugnisse"
      },
      "merkmale": "",
      "naehrstoffe": "",
      "zusatzstoffe": null,
      "PrintOrder": "19",
      "CO2Value": "1006.00",
      "CO2Rating": "B",
      "CO2Perc": "100.00",
      "ClimateFriendly": null,
      "GastDesc": "Pasta Fussili | Lachs | Parmesan",
      "date_de": "08.02.2026"
    },
    {
      "id": "5662404",
      "outlet": "canteen",
      "date": "2026-02-08",
      "CalendarWeek": "6",
      "day": "Sonntag",
      "mealtime": "Abendessen",
      "IdentNr": "12026020898020",
      "itemId": "17866",
      "RecipeID": "8276",
      "ProductPrice": "9.50",
      "ProductPrice_2": null,
      "GastDesc_de": "Glasierte Aubergine | Junglauch | Sesam-Tofu",
      "GastDesc_en": "Glazed Aubergine | Spring Onion | Sesame Tofu",
      "MenuName": "DINNER Vegi / Vegan_|",
      "allergene": {
        "gluten": "Glutenhaltiges Getreide",
        "soja": "Soja und Sojaerzeugnisse",
        "sesam": "Sesamsamen und Sesamsamenerzeugnisse",
        "schwefel": "Schwefeldioxid und Sulfide"
      },
      "merkmale": {
        "vegan": "Vegan",
        "veganuary": "Veganuary",
        "vegetarisch": "Vegetarisch"
      },
      "naehrstoffe": "",
      "zusatzstoffe": [
        {
          "de": "geschwefelt",
          "en": "Sulphurous"
        },
        {
          "de": "Alkohol",
          "en": "Alcohol"
        }
      ],
      "PrintOrder": "20",
      "CO2Value": "968.00",
      "CO2Rating": "C",
      "CO2Perc": "100.00",
      "ClimateFriendly": null,
      "GastDesc": "Glasierte Aubergine | Junglauch | Sesam-Tofu",
      "date_de": "08.02.2026"
    },
    {
      "id": "5662405",
      "outlet": "canteen",
      "date": "2026-02-08",
      "CalendarWeek": "6",
      "day": "Sonntag",
      "mealtime": "Mittagessen",
      "IdentNr": "12026020898020",
      "itemId": "17866",
      "RecipeID": "8276",
      "ProductPrice": "9.50",
      "ProductPrice_2": null,
      "GastDesc_de": "Glasierte Aubergine | Junglauch | Sesam-Tofu",
      "GastDesc_en": "Glazed Aubergine | Spring Onion | Sesame Tofu",
      "MenuName": "DINNER Vegi / Vegan_|",
      "allergene": {
        "gluten": "Glutenhaltiges Getreide",
        "soja": "Soja und Sojaerzeugnisse",
        "sesam": "Sesamsamen und Sesamsamenerzeugnisse",
        "schwefel": "Schwefeldioxid und Sulfide"
      },
      "merkmale": {
        "vegan": "Vegan",
        "veganuary": "Veganuary",
        "vegetarisch": "Vegetarisch"
      },
      "naehrstoffe": "",
      "zusatzstoffe": [
        {
          "de": "geschwefelt",
          "en": "Sulphurous"
        },
        {
          "de": "Alkohol",
          "en": "Alcohol"
        }
      ],
      "PrintOrder": "20",
      "CO2Value": "968.00",
      "CO2Rating": "C",
      "CO2Perc": "100.00",
      "ClimateFriendly": null,
      "GastDesc": "Glasierte Aubergine | Junglauch | Sesam-Tofu",
      "date_de": "08.02.2026"
    },
    {
      "id": "5687560",
      "outlet": "canteen",
      "date": "2026-02-09",
      "CalendarWeek": "7",
      "day": "Montag",
      "mealtime": "Mittagessen",
      "IdentNr": "12026020998000",
      "itemId": "17549",
      "RecipeID": "5164",
      "ProductPrice": "10.00",
      "ProductPrice_2": null,
      "GastDesc_de": "Tikka Gemüse | Kokos | Basmati",
      "GastDesc_en": "Tikka Vegetables | Coconut | Basmati",
      "MenuName": "COUNTER 1.1 Bowls_",
      "allergene": {
        "sesam": "Sesamsamen und Sesamsamenerzeugnisse"
      },
      "merkmale": {
        "vegan": "Vegan",
        "vegetarisch": "Vegetarisch"
      },
      "naehrstoffe": "",
      "zusatzstoffe": null,
      "PrintOrder": "0",
      "CO2Value": "532.00",
      "CO2Rating": "B",
      "CO2Perc": "100.00",
      "ClimateFriendly": null,
      "GastDesc": "Tikka Gemüse | Kokos | Basmati",
      "date_de": "09.02.2026"
    },
    {
      "id": "5687561",
      "outlet": "canteen",
      "date": "2026-02-09",
      "CalendarWeek": "7",
      "day": "Montag",
      "mealtime": "Mittagessen",
      "IdentNr": "12026020998001",
      "itemId": "17550",
      "RecipeID": "8040",
      "ProductPrice": "12.00",
      "ProductPrice_2": null,
      "GastDesc_de": "Asiatischer Puten-Burger | Slaw | Fritten",
      "GastDesc_en": "Asian Turkey Burger | Slaw | Fries",
      "MenuName": "COUNTER 2.1 Meat",
      "allergene": {
        "gluten": "Glutenhaltiges Getreide",
        "huhnerei": "Hühnerei und Hühnereierzeugnisse",
        "soja": "Soja und Sojaerzeugnisse",
        "milch": "Milch und Milcherzeugnisse",
        "erdnuss": "Erdnüsse und Erdnusserzeugnisse",
        "senf": "Senf und Senferzeugnisse",
        "sesam": "Sesamsamen und Sesamsamenerzeugnisse"
      },
      "merkmale": "",
      "naehrstoffe": "",
      "zusatzstoffe": [
        {
          "de": "Süßungsmittel",
          "en": "Sweetener"
        },
        {
          "de": "Farbstoff",
          "en": "Colouring Agent"
        },
        {
          "de": "Antioxidationsmittel",
          "en": "Antioxidation"
        },
        {
          "de": "Konservierungsstoff",
          "en": "Preservatives"
        }
      ],
      "PrintOrder": "1",
      "CO2Value": "1072.00",
      "CO2Rating": "B",
      "CO2Perc": "100.00",
      "ClimateFriendly": null,
      "GastDesc": "Asiatischer Puten-Burger | Slaw | Fritten",
      "date_de": "09.02.2026"
    },
    {
      "id": "5687562",
      "outlet": "canteen",
      "date": "2026-02-09",
      "CalendarWeek": "7",
      "day": "Montag",
      "mealtime": "Mittagessen",
      "IdentNr": "12026020998003",
      "itemId": "17552",
      "RecipeID": "6381",
