{
  "daySelector": [
    {
      "date": "2026-01-08",
      "day": "Donnerstag",
      "CalendarWeek": "2",
      "date_de": "08.01.2026"
    },
    {
      "date": "2026-01-09",
      "day": "Freitag",
      "CalendarWeek": "2",
      "date_de": "09.01.2026"
    },
    {
      "date": "2026-01-10",
      "day": "Samstag",
      "CalendarWeek": "2",
      "date_de": "10.01.2026"
    },
    {
      "date": "2026-01-11",
      "day": "Sonntag",
      "CalendarWeek": "2",
      "date_de": "11.01.2026"
    },
    {
      "date": "2026-01-12",
      "day": "Montag",
      "CalendarWeek": "3",
      "date_de": "12.01.2026"
    },
    {
      "date": "2026-01-13",
      "day": "Dienstag",
      "CalendarWeek": "3",
      "date_de": "13.01.2026"
    },
    {
      "date": "2026-01-14",
      "day": "Mittwoch",
      "CalendarWeek": "3",
      "date_de": "14.01.2026"
    },
    {
      "date": "2026-01-15",
      "day": "Donnerstag",
      "CalendarWeek": "3",
      "date_de": "15.01.2026"
    },
    {
      "date": "2026-01-16",
      "day": "Freitag",
      "CalendarWeek": "3",
      "date_de": "16.01.2026"
    },
    {
      "date": "2026-01-17",
      "day": "Samstag",
      "CalendarWeek": "3",
      "date_de": "17.01.2026"
    },
    {
      "date": "2026-01-18",
      "day": "Sonntag",
      "CalendarWeek": "3",
      "date_de": "18.01.2026"
    },
    {
      "date": "2026-01-19",
      "day": "Montag",
      "CalendarWeek": "3",
      "date_de": "19.01.2026"
    },
    {
      "date": "2026-01-20",
      "day": "Dienstag",
      "CalendarWeek": "3",
      "date_de": "20.01.2026"
    },
    {
      "date": "2026-01-21",
      "day": "Mittwoch",
      "CalendarWeek": "3",
      "date_de": "21.01.2026"
    },
    {
      "date": "2026-01-22",
      "day": "Donnerstag",
      "CalendarWeek": "3",
      "date_de": "22.01.2026"
    },
    {
      "date": "2026-01-23",
      "day": "Freitag",
      "CalendarWeek": "3",
      "date_de": "23.01.2026"
    },
    {
      "date": "2026-01-26",
      "day": "Montag",
      "CalendarWeek": "3",
      "date_de": "26.01.2026"
    },
    {
      "date": "2026-01-27",
      "day": "Dienstag",
      "CalendarWeek": "3",
      "date_de": "27.01.2026"
    },
    {
      "date": "2026-01-28",
      "day": "Mittwoch",
      "CalendarWeek": "3",
      "date_de": "28.01.2026"
    }
  ],
  "data": [
    {
      "id": "5152521",
      "outlet": "cafe",
      "date": "2026-01-08",
      "CalendarWeek": "2",
      "day": "Donnerstag",
      "mealtime": "Mittagessen",
      "IdentNr": "12026010898001",
      "itemId": "21059",
      "RecipeID": "8054",
      "ProductPrice": "3.20",
      "ProductPrice_2": null,
      "GastDesc_de": "Pflaumenmus-Croffin mit Vanilleschmand",
      "GastDesc_en": "Plum Jam Croffin with Vanilla Sour Cream",
      "MenuName": "CROFFIN",
      "allergene": {
        "gluten": "Glutenhaltiges Getreide",
        "schalenfruchte": "Schalenfrüchte und Schalenfruchterzeugnisse",
        "huhnerei": "Hühnerei und Hühnereierzeugnisse",
        "soja": "Soja und Sojaerzeugnisse",
        "milch": "Milch und Milcherzeugnisse"
      },
      "merkmale": "",
      "naehrstoffe": "",
      "zusatzstoffe": [
        {
          "de": "Farbstoff",
          "en": "Colouring Agent"
        },
        {
          "de": "Alkohol",
          "en": "Alcohol"
        }
      ],
      "PrintOrder": "1",
      "CO2Value": null,
      "CO2Rating": null,
      "CO2Perc": null,
      "ClimateFriendly": null,
      "GastDesc": "Pflaumenmus-Croffin mit Vanilleschmand",
      "date_de": "08.01.2026"
    },
    {
      "id": "5152522",
      "outlet": "cafe",
      "date": "2026-01-08",
      "CalendarWeek": "2",
      "day": "Donnerstag",
      "mealtime": "Mittagessen",
      "IdentNr": "12026010898002",
      "itemId": "21062",
      "RecipeID": "8871",
      "ProductPrice": "3.60",
      "ProductPrice_2": null,
      "GastDesc_de": "Baskischer Cheesecake mit Johannisbeer-Birnenkompott",
      "GastDesc_en": "Basque-style Cheesecake with Black Currant and Pear Compote",
      "MenuName": "FAVOURITES",
      "allergene": {
        "huhnerei": "Hühnerei und Hühnereierzeugnisse",
        "milch": "Milch und Milcherzeugnisse"
      },
      "merkmale": "",
      "naehrstoffe": "",
      "zusatzstoffe": [
        {
          "de": "Farbstoff",
          "en": "Colouring Agent"
        },
        {
          "de": "Alkohol",
          "en": "Alcohol"
        }
      ],
      "PrintOrder": "2",
      "CO2Value": null,
      "CO2Rating": null,
      "CO2Perc": null,
      "ClimateFriendly": null,
      "GastDesc": "Baskischer Cheesecake mit Johannisbeer-Birnenkompott",
      "date_de": "08.01.2026"
    },
    {
      "id": "5152523",
      "outlet": "cafe",
      "date": "2026-01-08",
      "CalendarWeek": "2",
      "day": "Donnerstag",
      "mealtime": "Mittagessen",
      "IdentNr": "12026010898003",
      "itemId": "21063",
      "RecipeID": "8211",
      "ProductPrice": "0.50",
      "ProductPrice_2": null,
      "GastDesc_de": "LES ARLETTES (Französische Blätterteigkekse) Vegan",
      "GastDesc_en": "LES ARLETTES  (French Puff Pastry Cookies) Vegan",
      "MenuName": "MINIS",
      "allergene": {
        "gluten": "Glutenhaltiges Getreide"
      },
      "merkmale": {
        "vegan": "Vegan",
        "vegetarisch": "Vegetarisch"
      },
      "naehrstoffe": "",
      "zusatzstoffe": [
        {
          "de": "Farbstoff",
          "en": "Colouring Agent"
        },
        {
          "de": "Alkohol",
          "en": "Alcohol"
        }
      ],
      "PrintOrder": "3",
      "CO2Value": null,
      "CO2Rating": null,
      "CO2Perc": null,
      "ClimateFriendly": null,
      "GastDesc": "LES ARLETTES (Französische Blätterteigkekse) Vegan",
      "date_de": "08.01.2026"
    },
    {
      "id": "5152524",
      "outlet": "cafe",
      "date": "2026-01-08",
      "CalendarWeek": "2",
      "day": "Donnerstag",
      "mealtime": "Mittagessen",
      "IdentNr": "12026010898005",
      "itemId": "21064",
      "RecipeID": "8330",
      "ProductPrice": "1.50",
      "ProductPrice_2": null,
      "GastDesc_de": "Saftige Brownie-Bananen-Cookies | Zuckerfrei",
      "GastDesc_en": "Fudgy Brownie Banana Cookies | Sugar-Free",
      "MenuName": "PEOPLES CHOICE",
      "allergene": {
        "erdnuss": "Erdnüsse und Erdnusserzeugnisse"
      },
      "merkmale": {
        "ohne_zucker": "Ohne_Zucker",
        "vegan": "Vegan",
        "vegetarisch": "Vegetarisch"
      },
      "naehrstoffe": "",
      "zusatzstoffe": null,
      "PrintOrder": "5",
      "CO2Value": null,
      "CO2Rating": null,
      "CO2Perc": null,
      "ClimateFriendly": null,
      "GastDesc": "Saftige Brownie-Bananen-Cookies | Zuckerfrei",
      "date_de": "08.01.2026"
    },
    {
      "id": "5152525",
      "outlet": "cafe",
      "date": "2026-01-08",
      "CalendarWeek": "2",
      "day": "Donnerstag",
      "mealtime": "Mittagessen",
      "IdentNr": "12026010898006",
      "itemId": "21061",
      "RecipeID": "8697",
      "ProductPrice": "2.50",
      "ProductPrice_2": null,
      "GastDesc_de": "Erdnussbutter-Cookie mit Schokolade und Salzkaramell | Vegan",
      "GastDesc_en": "Peanutbutter Cookie with Chocolate Salty Caramel | Vegan",
      "MenuName": "SEASON",
      "allergene": {
        "gluten": "Glutenhaltiges Getreide",
        "soja": "Soja und Sojaerzeugnisse",
        "erdnuss": "Erdnüsse und Erdnusserzeugnisse"
      },
      "merkmale": "",
      "naehrstoffe": "",
      "zusatzstoffe": [
        {
          "de": "Farbstoff",
          "en": "Colouring Agent"
        },
        {
          "de": "Antioxidationsmittel",
          "en": "Antioxidation"
        },
        {
          "de": "Alkohol",
          "en": "Alcohol"
        }
      ],
      "PrintOrder": "6",
      "CO2Value": null,
      "CO2Rating": null,
      "CO2Perc": null,
      "ClimateFriendly": null,
      "GastDesc": "Erdnussbutter-Cookie mit Schokolade und Salzkaramell | Vegan",
      "date_de": "08.01.2026"
    },
    {
      "id": "5152526",
      "outlet": "cafe",
      "date": "2026-01-08",
      "CalendarWeek": "2",
      "day": "Donnerstag",
      "mealtime": "Mittagessen",
      "IdentNr": "12026010898007",
      "itemId": "12776",
      "RecipeID": "8453",
      "ProductPrice": "2.50",
      "ProductPrice_2": null,
      "GastDesc_de": "Oreo-Cheesecake-Cookies",
      "GastDesc_en": "Oreo Cheesecake Cookies",
      "MenuName": "COOKIE",
      "allergene": {
        "gluten": "Glutenhaltiges Getreide",
        "huhnerei": "Hühnerei und Hühnereierzeugnisse",
        "milch": "Milch und Milcherzeugnisse"
      },
      "merkmale": "",
      "naehrstoffe": "",
      "zusatzstoffe": [
        {
          "de": "Farbstoff",
          "en": "Colouring Agent"
        },
        {
          "de": "Alkohol",
          "en": "Alcohol"
        }
      ],
      "PrintOrder": "7",
      "CO2Value": null,
      "CO2Rating": null,
      "CO2Perc": null,
      "ClimateFriendly": null,
      "GastDesc": "Oreo-Cheesecake-Cookies",
      "date_de": "08.01.2026"
    },
    {
      "id": "5152527",
      "outlet": "cafe",
      "date": "2026-01-08",
      "CalendarWeek": "2",
      "day": "Donnerstag",
      "mealtime": "Mittagessen",
      "IdentNr": "12026010898008",
      "itemId": "12777",
      "RecipeID": "8349",
      "ProductPrice": "2.70",
      "ProductPrice_2": null,
      "GastDesc_de": "\"Banana Bread\" mit Blaubeeren | Zuckerfrei",
      "GastDesc_en": "\"Banana Bread\" with Blueberries | Sugar-Free",
      "MenuName": "TAG des KASTENKUCHENS",
      "allergene": {
        "gluten": "Glutenhaltiges Getreide",
        "huhnerei": "Hühnerei und Hühnereierzeugnisse",
        "milch": "Milch und Milcherzeugnisse"
      },
      "merkmale": {
        "ohne_zucker": "Ohne_Zucker"
      },
      "naehrstoffe": "",
      "zusatzstoffe": null,
      "PrintOrder": "8",
      "CO2Value": null,
      "CO2Rating": null,
      "CO2Perc": null,
      "ClimateFriendly": null,
      "GastDesc": "\"Banana Bread\" mit Blaubeeren | Zuckerfrei",
      "date_de": "08.01.2026"
    },
    {
      "id": "5152528",
      "outlet": "cafe",
      "date": "2026-01-08",
      "CalendarWeek": "2",
      "day": "Donnerstag",
      "mealtime": "Mittagessen",
      "IdentNr": "12026010898011",
      "itemId": "16256",
      "RecipeID": "8775",
      "ProductPrice": "1.50",
      "ProductPrice_2": null,
      "GastDesc_de": "Schwedische Haferkekse | Vegan",
      "GastDesc_en": "Swedish Style Oatmeal Cookies | Vegan",
      "MenuName": "VEGAN SPECIAL",
      "allergene": {
        "gluten": "Glutenhaltiges Getreide"
      },
      "merkmale": {
        "vegan": "Vegan",
        "vegetarisch": "Vegetarisch"
      },
      "naehrstoffe": "",
      "zusatzstoffe": [
        {
          "de": "Farbstoff",
          "en": "Colouring Agent"
        },
        {
          "de": "Antioxidationsmittel",
          "en": "Antioxidation"
        },
        {
          "de": "Alkohol",
          "en": "Alcohol"
        }
      ],
      "PrintOrder": "11",
      "CO2Value": null,
      "CO2Rating": null,
      "CO2Perc": null,
      "ClimateFriendly": null,
      "GastDesc": "Schwedische Haferkekse | Vegan",
      "date_de": "08.01.2026"
    },
    {
      "id": "5178008",
      "outlet": "cafe",
      "date": "2026-01-09",
      "CalendarWeek": "2",
      "day": "Freitag",
      "mealtime": "Mittagessen",
      "IdentNr": "12026010998001",
      "itemId": "21059",
      "RecipeID": "8054",
      "ProductPrice": "3.20",
      "ProductPrice_2": null,
      "GastDesc_de": "Pflaumenmus-Croffin mit Vanilleschmand",
      "GastDesc_en": "Plum Jam Croffin with Vanilla Sour Cream",
      "MenuName": "CROFFIN",
      "allergene": {
        "gluten": "Glutenhaltiges Getreide",
        "schalenfruchte": "Schalenfrüchte und Schalenfruchterzeugnisse",
        "huhnerei": "Hühnerei und Hühnereierzeugnisse",
        "soja": "Soja und Sojaerzeugnisse",
        "milch": "Milch und Milcherzeugnisse"
      },
      "merkmale": "",
      "naehrstoffe": "",
      "zusatzstoffe": [
        {
          "de": "Farbstoff",
          "en": "Colouring Agent"
        },
        {
          "de": "Alkohol",
          "en": "Alcohol"
        }
      ],
      "PrintOrder": "1",
      "CO2Value": null,
      "CO2Rating": null,
      "CO2Perc": null,
      "ClimateFriendly": null,
      "GastDesc": "Pflaumenmus-Croffin mit Vanilleschmand",
      "date_de": "09.01.2026"
    },
    {
      "id": "5178009",
      "outlet": "cafe",
      "date": "2026-01-09",
      "CalendarWeek": "2",
      "day": "Freitag",
      "mealtime": "Mittagessen",
      "IdentNr": "12026010998002",
      "itemId": "21062",
      "RecipeID": "8871",
      "ProductPrice": "3.60",
      "ProductPrice_2": null,
      "GastDesc_de": "Baskischer Cheesecake mit Johannisbeer-Birnenkompott",
      "GastDesc_en": "Basque-style Cheesecake with Black Currant and Pear Compote",
      "MenuName": "FAVOURITES",
      "allergene": {
        "huhnerei": "Hühnerei und Hühnereierzeugnisse",
        "milch": "Milch und Milcherzeugnisse"
      },
      "merkmale": "",
      "naehrstoffe": "",
      "zusatzstoffe": [
        {
          "de": "Farbstoff",
          "en": "Colouring Agent"
        },
        {
          "de": "Alkohol",
          "en": "Alcohol"
        }
      ],
      "PrintOrder": "2",
      "CO2Value": null,
      "CO2Rating": null,
      "CO2Perc": null,
      "ClimateFriendly": null,
      "GastDesc": "Baskischer Cheesecake mit Johannisbeer-Birnenkompott",
      "date_de": "09.01.2026"
    },
    {
      "id": "5178010",
      "outlet": "cafe",
      "date": "2026-01-09",
      "CalendarWeek": "2",
      "day": "Freitag",
      "mealtime": "Mittagessen",
      "IdentNr": "12026010998003",
      "itemId": "21063",
      "RecipeID": "8211",
      "ProductPrice": "0.50",
      "ProductPrice_2": null,
      "GastDesc_de": "LES ARLETTES (Französische Blätterteigkekse) Vegan",
      "GastDesc_en": "LES ARLETTES  (French Puff Pastry Cookies) Vegan",
      "MenuName": "MINIS",
      "allergene": {
        "gluten": "Glutenhaltiges Getreide"
      },
      "merkmale": {
        "vegan": "Vegan",
        "vegetarisch": "Vegetarisch"
      },
      "naehrstoffe": "",
      "zusatzstoffe": [
        {
          "de": "Farbstoff",
          "en": "Colouring Agent"
        },
        {
          "de": "Alkohol",
          "en": "Alcohol"
        }
      ],
      "PrintOrder": "3",
      "CO2Value": null,
      "CO2Rating": null,
      "CO2Perc": null,
      "ClimateFriendly": null,
      "GastDesc": "LES ARLETTES (Französische Blätterteigkekse) Vegan",
      "date_de": "09.01.2026"
    },
    {
      "id": "5178011",
      "outlet": "cafe",
      "date": "2026-01-09",
      "CalendarWeek": "2",
      "day": "Freitag",
      "mealtime": "Mittagessen",
      "IdentNr": "12026010998005",
      "itemId": "21064",
      "RecipeID": "8330",
      "ProductPrice": "1.50",
      "ProductPrice_2": null,
      "GastDesc_de": "Saftige Brownie-Bananen-Cookies | Zuckerfrei",
      "GastDesc_en": "Fudgy Brownie Banana Cookies | Sugar-Free",
      "MenuName": "PEOPLES CHOICE",
      "allergene": {
        "erdnuss": "Erdnüsse und Erdnusserzeugnisse"
      },
      "merkmale": {
        "ohne_zucker": "Ohne_Zucker",
        "vegan": "Vegan",
        "vegetarisch": "Vegetarisch"
      },
      "naehrstoffe": "",
      "zusatzstoffe": null,
      "PrintOrder": "5",
      "CO2Value": null,
      "CO2Rating": null,
      "CO2Perc": null,
      "ClimateFriendly": null,
      "GastDesc": "Saftige Brownie-Bananen-Cookies | Zuckerfrei",
      "date_de": "09.01.2026"
    },
    {
      "id": "5178012",
      "outlet": "cafe",
      "date": "2026-01-09",
      "CalendarWeek": "2",
      "day": "Freitag",
      "mealtime": "Mittagessen",
      "IdentNr": "12026010998006",
      "itemId": "21061",
      "RecipeID": "8697",
      "ProductPrice": "2.50",
      "ProductPrice_2": null,
      "GastDesc_de": "Erdnussbutter-Cookie mit Schokolade und Salzkaramell | Vegan",
      "GastDesc_en": "Peanutbutter Cookie with Chocolate Salty Caramel | Vegan",
      "MenuName": "SEASON",
      "allergene": {
        "gluten": "Glutenhaltiges Getreide",
        "soja": "Soja und Sojaerzeugnisse",
        "erdnuss": "Erdnüsse und Erdnusserzeugnisse"
      },
      "merkmale": "",
      "naehrstoffe": "",
      "zusatzstoffe": [
        {
          "de": "Farbstoff",
          "en": "Colouring Agent"
        },
        {
          "de": "Antioxidationsmittel",
          "en": "Antioxidation"
        },
        {
          "de": "Alkohol",
          "en": "Alcohol"
        }
      ],
      "PrintOrder": "6",
      "CO2Value": null,
      "CO2Rating": null,
      "CO2Perc": null,
      "ClimateFriendly": null,
      "GastDesc": "Erdnussbutter-Cookie mit Schokolade und Salzkaramell | Vegan",
      "date_de": "09.01.2026"
    },
    {
      "id": "5178013",
      "outlet": "cafe",
      "date": "2026-01-09",
      "CalendarWeek": "2",
      "day": "Freitag",
      "mealtime": "Mittagessen",
      "IdentNr": "12026010998007",
      "itemId": "12776",
      "RecipeID": "8453",
      "ProductPrice": "2.50",
      "ProductPrice_2": null,
      "GastDesc_de": "Oreo-Cheesecake-Cookies",
      "GastDesc_en": "Oreo Cheesecake Cookies",
      "MenuName": "COOKIE",
      "allergene": {
        "gluten": "Glutenhaltiges Getreide",
        "huhnerei": "Hühnerei und Hühnereierzeugnisse",
        "milch": "Milch und Milcherzeugnisse"
      },
      "merkmale": "",
      "naehrstoffe": "",
      "zusatzstoffe": [
        {
          "de": "Farbstoff",
          "en": "Colouring Agent"
        },
        {
          "de": "Alkohol",
          "en": "Alcohol"
        }
      ],
      "PrintOrder": "7",
      "CO2Value": null,
      "CO2Rating": null,
      "CO2Perc": null,
      "ClimateFriendly": null,
      "GastDesc": "Oreo-Cheesecake-Cookies",
      "date_de": "09.01.2026"
    },
    {
      "id": "5178014",
      "outlet": "cafe",
      "date": "2026-01-09",
      "CalendarWeek": "2",
      "day": "Freitag",
      "mealtime": "Mittagessen",
      "IdentNr": "12026010998008",
      "itemId": "12777",
      "RecipeID": "9036",
      "ProductPrice": "2.70",
      "ProductPrice_2": null,
      "GastDesc_de": "Kürbis-Bananenbrot mit Walnüssen | Zuckerfrei",
      "GastDesc_en": "Pumpkin-banana bread with walnuts | Sugar-free",
      "MenuName": "TAG des KASTENKUCHENS",
      "allergene": {
        "gluten": "Glutenhaltiges Getreide",
        "schalenfruchte": "Schalenfrüchte und Schalenfruchterzeugnisse",
        "huhnerei": "Hühnerei und Hühnereierzeugnisse",
        "milch": "Milch und Milcherzeugnisse"
      },
      "merkmale": "",
      "naehrstoffe": "",
      "zusatzstoffe": null,
      "PrintOrder": "8",
      "CO2Value": null,
      "CO2Rating": null,
      "CO2Perc": null,
      "ClimateFriendly": null,
      "GastDesc": "Kürbis-Bananenbrot mit Walnüssen | Zuckerfrei",
      "date_de": "09.01.2026"
    },
    {
      "id": "5178015",
      "outlet": "cafe",
      "date": "2026-01-09",
      "CalendarWeek": "2",
      "day": "Freitag",
      "mealtime": "Mittagessen",
      "IdentNr": "12026010998011",
      "itemId": "16256",
      "RecipeID": "8775",
      "ProductPrice": "1.50",
      "ProductPrice_2": null,
      "GastDesc_de": "Schwedische Haferkekse | Vegan",
      "GastDesc_en": "Swedish Style Oatmeal Cookies | Vegan",
      "MenuName": "VEGAN SPECIAL",
      "allergene": {
        "gluten": "Glutenhaltiges Getreide"
      },
      "merkmale": {
        "vegan": "Vegan",
        "vegetarisch": "Vegetarisch"
      },
      "naehrstoffe": "",
      "zusatzstoffe": [
        {
          "de": "Farbstoff",
          "en": "Colouring Agent"
        },
        {
          "de": "Antioxidationsmittel",
          "en": "Antioxidation"
        },
        {
          "de": "Alkohol",
          "en": "Alcohol"
        }
      ],
      "PrintOrder": "11",
      "CO2Value": null,
      "CO2Rating": null,
      "CO2Perc": null,
      "ClimateFriendly": null,
      "GastDesc": "Schwedische Haferkekse | Vegan",
      "date_de": "09.01.2026"
    },
    {
      "id": "5202616",
      "outlet": "cafe",
      "date": "2026-01-12",
      "CalendarWeek": "3",
      "day": "Montag",
      "mealtime": "Mittagessen",
      "IdentNr": "12026011298001",
      "itemId": "21059",
      "RecipeID": "8054",
      "ProductPrice": "3.20",
      "ProductPrice_2": null,
      "GastDesc_de": "Pflaumenmus-Croffin mit Vanilleschmand",
      "GastDesc_en": "Plum Jam Croffin with Vanilla Sour Cream",
      "MenuName": "CROFFIN",
      "allergene": {
        "gluten": "Glutenhaltiges Getreide",
        "schalenfruchte": "Schalenfrüchte und Schalenfruchterzeugnisse",
        "huhnerei": "Hühnerei und Hühnereierzeugnisse",
        "soja": "Soja und Sojaerzeugnisse",
        "milch": "Milch und Milcherzeugnisse"
      },
      "merkmale": "",
      "naehrstoffe": "",
      "zusatzstoffe": [
        {
          "de": "Farbstoff",
          "en": "Colouring Agent"
        },
        {
          "de": "Alkohol",
          "en": "Alcohol"
        }
      ],
      "PrintOrder": "1",
      "CO2Value": null,
      "CO2Rating": null,
      "CO2Perc": null,
      "ClimateFriendly": null,
      "GastDesc": "Pflaumenmus-Croffin mit Vanilleschmand",
      "date_de": "12.01.2026"
    },
    {
      "id": "5202617",
      "outlet": "cafe",
      "date": "2026-01-12",
      "CalendarWeek": "3",
      "day": "Montag",
      "mealtime": "Mittagessen",
      "IdentNr": "12026011298002",
      "itemId": "21062",
      "RecipeID": "8871",
      "ProductPrice": "3.60",
      "ProductPrice_2": null,
      "GastDesc_de": "Baskischer Cheesecake mit Johannisbeer-Birnenkompott",
      "GastDesc_en": "Basque-style Cheesecake with Black Currant and Pear Compote",
      "MenuName": "FAVOURITES",
      "allergene": {
        "huhnerei": "Hühnerei und Hühnereierzeugnisse",
        "milch": "Milch und Milcherzeugnisse"
      },
      "merkmale": "",
      "naehrstoffe": "",
      "zusatzstoffe": [
        {
          "de": "Farbstoff",
          "en": "Colouring Agent"
        },
        {
          "de": "Alkohol",
          "en": "Alcohol"
        }
      ],
      "PrintOrder": "2",
      "CO2Value": null,
      "CO2Rating": null,
      "CO2Perc": null,
      "ClimateFriendly": null,
      "GastDesc": "Baskischer Cheesecake mit Johannisbeer-Birnenkompott",
      "date_de": "12.01.2026"
    },
    {
      "id": "5202618",
      "outlet": "cafe",
      "date": "2026-01-12",
      "CalendarWeek": "3",
      "day": "Montag",
      "mealtime": "Mittagessen",
      "IdentNr": "12026011298003",
      "itemId": "21063",
      "RecipeID": "8211",
      "ProductPrice": "0.50",
      "ProductPrice_2": null,
      "GastDesc_de": "LES ARLETTES (Französische Blätterteigkekse) Vegan",
      "GastDesc_en": "LES ARLETTES  (French Puff Pastry Cookies) Vegan",
      "MenuName": "MINIS",
      "allergene": {
        "gluten": "Glutenhaltiges Getreide"
      },
      "merkmale": {
        "vegan": "Vegan",
        "vegetarisch": "Vegetarisch"
      },
      "naehrstoffe": "",
      "zusatzstoffe": [
        {
          "de": "Farbstoff",
          "en": "Colouring Agent"
        },
        {
          "de": "Alkohol",
          "en": "Alcohol"
        }
      ],
      "PrintOrder": "3",
      "CO2Value": null,
      "CO2Rating": null,
      "CO2Perc": null,
      "ClimateFriendly": null,
      "GastDesc": "LES ARLETTES (Französische Blätterteigkekse) Vegan",
      "date_de": "12.01.2026"
    },
    {
      "id": "5202619",
      "outlet": "cafe",
      "date": "2026-01-12",
      "CalendarWeek": "3",
      "day": "Montag",
      "mealtime": "Mittagessen",
      "IdentNr": "12026011298005",
      "itemId": "21064",
      "RecipeID": "8330",
      "ProductPrice": "1.50",
      "ProductPrice_2": null,
      "GastDesc_de": "Saftige Brownie-Bananen-Cookies | Zuckerfrei",
      "GastDesc_en": "Fudgy Brownie Banana Cookies | Sugar-Free",
      "MenuName": "PEOPLES CHOICE",
      "allergene": {
        "erdnuss": "Erdnüsse und Erdnusserzeugnisse"
      },
      "merkmale": {
        "ohne_zucker": "Ohne_Zucker",
        "vegan": "Vegan",
        "vegetarisch": "Vegetarisch"
      },
      "naehrstoffe": "",
      "zusatzstoffe": null,
      "PrintOrder": "5",
      "CO2Value": null,
      "CO2Rating": null,
      "CO2Perc": null,
      "ClimateFriendly": null,
      "GastDesc": "Saftige Brownie-Bananen-Cookies | Zuckerfrei",
      "date_de": "12.01.2026"
    },
    {
      "id": "5202620",
      "outlet": "cafe",
      "date": "2026-01-12",
      "CalendarWeek": "3",
      "day": "Montag",
      "mealtime": "Mittagessen",
      "IdentNr": "12026011298006",
      "itemId": "21061",
      "RecipeID": "8697",
      "ProductPrice": "2.50",
      "ProductPrice_2": null,
      "GastDesc_de": "Erdnussbutter-Cookie mit Schokolade und Salzkaramell | Vegan",
      "GastDesc_en": "Peanutbutter Cookie with Chocolate Salty Caramel | Vegan",
      "MenuName": "SEASON",
      "allergene": {
        "gluten": "Glutenhaltiges Getreide",
        "soja": "Soja und Sojaerzeugnisse",
        "erdnuss": "Erdnüsse und Erdnusserzeugnisse"
      },
      "merkmale": "",
      "naehrstoffe": "",
      "zusatzstoffe": [
        {
          "de": "Farbstoff",
          "en": "Colouring Agent"
        },
        {
          "de": "Antioxidationsmittel",
          "en": "Antioxidation"
        },
        {
          "de": "Alkohol",
          "en": "Alcohol"
        }
      ],
      "PrintOrder": "6",
      "CO2Value": null,
      "CO2Rating": null,
      "CO2Perc": null,
      "ClimateFriendly": null,
      "GastDesc": "Erdnussbutter-Cookie mit Schokolade und Salzkaramell | Vegan",
      "date_de": "12.01.2026"
    },
    {
      "id": "5202621",
      "outlet": "cafe",
      "date": "2026-01-12",
      "CalendarWeek": "3",
      "day": "Montag",
      "mealtime": "Mittagessen",
      "IdentNr": "12026011298007",
      "itemId": "12776",
      "RecipeID": "8453",
      "ProductPrice": "2.50",
      "ProductPrice_2": null,
      "GastDesc_de": "Oreo-Cheesecake-Cookies",
      "GastDesc_en": "Oreo Cheesecake Cookies",
      "MenuName": "COOKIE",
      "allergene": {
        "gluten": "Glutenhaltiges Getreide",
        "huhnerei": "Hühnerei und Hühnereierzeugnisse",
        "milch": "Milch und Milcherzeugnisse"
      },
      "merkmale": "",
      "naehrstoffe": "",
      "zusatzstoffe": [
        {
          "de": "Farbstoff",
          "en": "Colouring Agent"
        },
        {
          "de": "Alkohol",
          "en": "Alcohol"
        }
      ],
      "PrintOrder": "7",
      "CO2Value": null,
      "CO2Rating": null,
      "CO2Perc": null,
      "ClimateFriendly": null,
      "GastDesc": "Oreo-Cheesecake-Cookies",
      "date_de": "12.01.2026"
    },
    {
      "id": "5202622",
      "outlet": "cafe",
      "date": "2026-01-12",
      "CalendarWeek": "3",
      "day": "Montag",
      "mealtime": "Mittagessen",
      "IdentNr": "12026011298008",
      "itemId": "12777",
      "RecipeID": "9121",
      "ProductPrice": "2.50",
      "ProductPrice_2": null,
      "GastDesc_de": "Carrotcake  Bananenbrot | Zuckerfrei",
      "GastDesc_en": "Carrot Cake Banana Bread | Sugar-Free",
      "MenuName": "TAG des KASTENKUCHENS",
      "allergene": {
        "gluten": "Glutenhaltiges Getreide",
        "huhnerei": "Hühnerei und Hühnereierzeugnisse",
        "milch": "Milch und Milcherzeugnisse",
        "schwefel": "Schwefeldioxid und Sulfide"
      },
      "merkmale": "",
      "naehrstoffe": "",
      "zusatzstoffe": [
        {
          "de": "Farbstoff",
          "en": "Colouring Agent"
        }
      ],
      "PrintOrder": "8",
      "CO2Value": null,
      "CO2Rating": null,
      "CO2Perc": null,
      "ClimateFriendly": null,
      "GastDesc": "Carrotcake  Bananenbrot | Zuckerfrei",
      "date_de": "12.01.2026"
    },
    {
      "id": "5202623",
      "outlet": "cafe",
      "date": "2026-01-12",
      "CalendarWeek": "3",
      "day": "Montag",
      "mealtime": "Mittagessen",
      "IdentNr": "12026011298011",
      "itemId": "16256",
      "RecipeID": "9122",
      "ProductPrice": "2.50",
      "ProductPrice_2": null,
      "GastDesc_de": "Sesam-Keks | Mehlfrei | Vegan",
      "GastDesc_en": "Sesame Cookie | Flour-Free | Vegan",
      "MenuName": "VEGAN SPECIAL",
      "allergene": {
        "schalenfruchte": "Schalenfrüchte und Schalenfruchterzeugnisse",
        "sesam": "Sesamsamen und Sesamsamenerzeugnisse"
      },
      "merkmale": "",
      "naehrstoffe": "",
      "zusatzstoffe": [
        {
          "de": "Farbstoff",
          "en": "Colouring Agent"
        },
        {
          "de": "Antioxidationsmittel",
          "en": "Antioxidation"
        },
        {
          "de": "Alkohol",
          "en": "Alcohol"
        }
      ],
      "PrintOrder": "11",
      "CO2Value": null,
      "CO2Rating": null,
      "CO2Perc": null,
      "ClimateFriendly": null,
      "GastDesc": "Sesam-Keks | Mehlfrei | Vegan",
      "date_de": "12.01.2026"
    },
    {
      "id": "5226984",
      "outlet": "cafe",
      "date": "2026-01-13",
      "CalendarWeek": "3",
      "day": "Dienstag",
      "mealtime": "Mittagessen",
      "IdentNr": "12026011398001",
      "itemId": "21059",
      "RecipeID": "8054",
      "ProductPrice": "3.20",
      "ProductPrice_2": null,
      "GastDesc_de": "Pflaumenmus-Croffin mit Vanilleschmand",
      "GastDesc_en": "Plum Jam Croffin with Vanilla Sour Cream",
      "MenuName": "CROFFIN",
      "allergene": {
        "gluten": "Glutenhaltiges Getreide",
        "schalenfruchte": "Schalenfrüchte und Schalenfruchterzeugnisse",
        "huhnerei": "Hühnerei und Hühnereierzeugnisse",
        "soja": "Soja und Sojaerzeugnisse",
        "milch": "Milch und Milcherzeugnisse"
      },
      "merkmale": "",
      "naehrstoffe": "",
      "zusatzstoffe": [
        {
          "de": "Farbstoff",
          "en": "Colouring Agent"
        },
        {
          "de": "Alkohol",
          "en": "Alcohol"
        }
      ],
      "PrintOrder": "1",
      "CO2Value": null,
      "CO2Rating": null,
      "CO2Perc": null,
      "ClimateFriendly": null,
      "GastDesc": "Pflaumenmus-Croffin mit Vanilleschmand",
      "date_de": "13.01.2026"
    },
    {
      "id": "5226985",
      "outlet": "cafe",
      "date": "2026-01-13",
      "CalendarWeek": "3",
      "day": "Dienstag",
      "mealtime": "Mittagessen",
      "IdentNr": "12026011398002",
      "itemId": "21062",
      "RecipeID": "8871",
      "ProductPrice": "3.60",
      "ProductPrice_2": null,
      "GastDesc_de": "Baskischer Cheesecake mit Johannisbeer-Birnenkompott",
      "GastDesc_en": "Basque-style Cheesecake with Black Currant and Pear Compote",
      "MenuName": "FAVOURITES",
      "allergene": {
        "huhnerei": "Hühnerei und Hühnereierzeugnisse",
        "milch": "Milch und Milcherzeugnisse"
      },
      "merkmale": "",
      "naehrstoffe": "",
      "zusatzstoffe": [
        {
          "de": "Farbstoff",
          "en": "Colouring Agent"
        },
        {
          "de": "Alkohol",
          "en": "Alcohol"
        }
      ],
      "PrintOrder": "2",
      "CO2Value": null,
      "CO2Rating": null,
      "CO2Perc": null,
      "ClimateFriendly": null,
      "GastDesc": "Baskischer Cheesecake mit Johannisbeer-Birnenkompott",
      "date_de": "13.01.2026"
    },
    {
      "id": "5226986",
      "outlet": "cafe",
      "date": "2026-01-13",
      "CalendarWeek": "3",
      "day": "Dienstag",
      "mealtime": "Mittagessen",
      "IdentNr": "12026011398003",
      "itemId": "21063",
      "RecipeID": "8211",
      "ProductPrice": "0.50",
      "ProductPrice_2": null,
      "GastDesc_de": "LES ARLETTES (Französische Blätterteigkekse) Vegan",
      "GastDesc_en": "LES ARLETTES  (French Puff Pastry Cookies) Vegan",
      "MenuName": "MINIS",
      "allergene": {
        "gluten": "Glutenhaltiges Getreide"
      },
      "merkmale": {
        "vegan": "Vegan",
        "vegetarisch": "Vegetarisch"
      },
      "naehrstoffe": "",
      "zusatzstoffe": [
        {
          "de": "Farbstoff",
          "en": "Colouring Agent"
        },
        {
          "de": "Alkohol",
          "en": "Alcohol"
        }
      ],
      "PrintOrder": "3",
      "CO2Value": null,
      "CO2Rating": null,
      "CO2Perc": null,
      "ClimateFriendly": null,
      "GastDesc": "LES ARLETTES (Französische Blätterteigkekse) Vegan",
      "date_de": "13.01.2026"
    },
    {
      "id": "5226987",
      "outlet": "cafe",
      "date": "2026-01-13",
      "CalendarWeek": "3",
      "day": "Dienstag",
      "mealtime": "Mittagessen",
      "IdentNr": "12026011398005",
      "itemId": "21064",
      "RecipeID": "8330",
      "ProductPrice": "1.50",
      "ProductPrice_2": null,
      "GastDesc_de": "Saftige Brownie-Bananen-Cookies | Zuckerfrei",
      "GastDesc_en": "Fudgy Brownie Banana Cookies | Sugar-Free",
      "MenuName": "PEOPLES CHOICE",
      "allergene": {
        "erdnuss": "Erdnüsse und Erdnusserzeugnisse"
      },
      "merkmale": {
        "ohne_zucker": "Ohne_Zucker",
        "vegan": "Vegan",
        "vegetarisch": "Vegetarisch"
      },
      "naehrstoffe": "",
      "zusatzstoffe": null,
      "PrintOrder": "5",
      "CO2Value": null,
      "CO2Rating": null,
      "CO2Perc": null,
      "ClimateFriendly": null,
      "GastDesc": "Saftige Brownie-Bananen-Cookies | Zuckerfrei",
      "date_de": "13.01.2026"
    },
    {
      "id": "5226988",
      "outlet": "cafe",
      "date": "2026-01-13",
      "CalendarWeek": "3",
      "day": "Dienstag",
      "mealtime": "Mittagessen",
      "IdentNr": "12026011398006",
      "itemId": "21061",
      "RecipeID": "8697",
      "ProductPrice": "2.50",
      "ProductPrice_2": null,
      "GastDesc_de": "Erdnussbutter-Cookie mit Schokolade und Salzkaramell | Vegan",
      "GastDesc_en": "Peanutbutter Cookie with Chocolate Salty Caramel | Vegan",
      "MenuName": "SEASON",
      "allergene": {
        "gluten": "Glutenhaltiges Getreide",
        "soja": "Soja und Sojaerzeugnisse",
        "erdnuss": "Erdnüsse und Erdnusserzeugnisse"
      },
      "merkmale": "",
      "naehrstoffe": "",
      "zusatzstoffe": [
        {
          "de": "Farbstoff",
          "en": "Colouring Agent"
        },
        {
          "de": "Antioxidationsmittel",
          "en": "Antioxidation"
        },
        {
          "de": "Alkohol",
          "en": "Alcohol"
        }
      ],
      "PrintOrder": "6",
      "CO2Value": null,
      "CO2Rating": null,
      "CO2Perc": null,
      "ClimateFriendly": null,
      "GastDesc": "Erdnussbutter-Cookie mit Schokolade und Salzkaramell | Vegan",
      "date_de": "13.01.2026"
    },
    {
      "id": "5226989",
      "outlet": "cafe",
      "date": "2026-01-13",
      "CalendarWeek": "3",
      "day": "Dienstag",
      "mealtime": "Mittagessen",
      "IdentNr": "12026011398007",
      "itemId": "12776",
      "RecipeID": "8453",
      "ProductPrice": "2.50",
      "ProductPrice_2": null,
      "GastDesc_de": "Oreo-Cheesecake-Cookies",
      "GastDesc_en": "Oreo Cheesecake Cookies",
      "MenuName": "COOKIE",
      "allergene": {
        "gluten": "Glutenhaltiges Getreide",
        "huhnerei": "Hühnerei und Hühnereierzeugnisse",
        "milch": "Milch und Milcherzeugnisse"
      },
      "merkmale": "",
      "naehrstoffe": "",
      "zusatzstoffe": [
        {
          "de": "Farbstoff",
          "en": "Colouring Agent"
        },
        {
          "de": "Alkohol",
          "en": "Alcohol"
        }
      ],
      "PrintOrder": "7",
      "CO2Value": null,
      "CO2Rating": null,
      "CO2Perc": null,
      "ClimateFriendly": null,
      "GastDesc": "Oreo-Cheesecake-Cookies",
      "date_de": "13.01.2026"
    },
    {
      "id": "5226990",
      "outlet": "cafe",
      "date": "2026-01-13",
      "CalendarWeek": "3",
      "day": "Dienstag",
      "mealtime": "Mittagessen",
      "IdentNr": "12026011398008",
      "itemId": "12777",
      "RecipeID": "9121",
      "ProductPrice": "2.50",
      "ProductPrice_2": null,
      "GastDesc_de": "Carrotcake  Bananenbrot | Zuckerfrei",
      "GastDesc_en": "Carrot Cake Banana Bread | Sugar-Free",
      "MenuName": "TAG des KASTENKUCHENS",
      "allergene": {
        "gluten": "Glutenhaltiges Getreide",
        "huhnerei": "Hühnerei und Hühnereierzeugnisse",
        "milch": "Milch und Milcherzeugnisse",
        "schwefel": "Schwefeldioxid und Sulfide"
      },
      "merkmale": "",
      "naehrstoffe": "",
      "zusatzstoffe": [
        {
          "de": "Farbstoff",
          "en": "Colouring Agent"
        }
      ],
      "PrintOrder": "8",
      "CO2Value": null,
      "CO2Rating": null,
      "CO2Perc": null,
      "ClimateFriendly": null,
      "GastDesc": "Carrotcake  Bananenbrot | Zuckerfrei",
      "date_de": "13.01.2026"
    },
    {
      "id": "5226991",
      "outlet": "cafe",
      "date": "2026-01-13",
      "CalendarWeek": "3",
      "day": "Dienstag",
      "mealtime": "Mittagessen",
      "IdentNr": "12026011398011",
      "itemId": "16256",
      "RecipeID": "9122",
      "ProductPrice": "2.50",
      "ProductPrice_2": null,
      "GastDesc_de": "Sesam-Keks | Mehlfrei | Vegan",
      "GastDesc_en": "Sesame Cookie | Flour-Free | Vegan",
      "MenuName": "VEGAN SPECIAL",
      "allergene": {
        "schalenfruchte": "Schalenfrüchte und Schalenfruchterzeugnisse",
        "sesam": "Sesamsamen und Sesamsamenerzeugnisse"
      },
      "merkmale": "",
      "naehrstoffe": "",
      "zusatzstoffe": [
        {
          "de": "Farbstoff",
          "en": "Colouring Agent"
        },
        {
          "de": "Antioxidationsmittel",
          "en": "Antioxidation"
        },
        {
          "de": "Alkohol",
          "en": "Alcohol"
        }
      ],
      "PrintOrder": "11",
      "CO2Value": null,
      "CO2Rating": null,
      "CO2Perc": null,
      "ClimateFriendly": null,
      "GastDesc": "Sesam-Keks | Mehlfrei | Vegan",
      "date_de": "13.01.2026"
    },
    {
      "id": "5251389",
      "outlet": "cafe",
      "date": "2026-01-14",
      "CalendarWeek": "3",
      "day": "Mittwoch",
      "mealtime": "Mittagessen",
      "IdentNr": "12026011498001",
      "itemId": "21059",
      "RecipeID": "8054",
      "ProductPrice": "3.20",
      "ProductPrice_2": null,
      "GastDesc_de": "Pflaumenmus-Croffin mit Vanilleschmand",
      "GastDesc_en": "Plum Jam Croffin with Vanilla Sour Cream",
      "MenuName": "CROFFIN",
      "allergene": {
        "gluten": "Glutenhaltiges Getreide",
        "schalenfruchte": "Schalenfrüchte und Schalenfruchterzeugnisse",
        "huhnerei": "Hühnerei und Hühnereierzeugnisse",
        "soja": "Soja und Sojaerzeugnisse",
        "milch": "Milch und Milcherzeugnisse"
      },
      "merkmale": "",
      "naehrstoffe": "",
      "zusatzstoffe": [
        {
          "de": "Farbstoff",
          "en": "Colouring Agent"
        },
        {
          "de": "Alkohol",
          "en": "Alcohol"
        }
      ],
      "PrintOrder": "1",
      "CO2Value": null,
      "CO2Rating": null,
      "CO2Perc": null,
      "ClimateFriendly": null,
      "GastDesc": "Pflaumenmus-Croffin mit Vanilleschmand",
      "date_de": "14.01.2026"
    },
    {
      "id": "5251390",
      "outlet": "cafe",
      "date": "2026-01-14",
      "CalendarWeek": "3",
      "day": "Mittwoch",
      "mealtime": "Mittagessen",
      "IdentNr": "12026011498002",
      "itemId": "21062",
      "RecipeID": "8871",
      "ProductPrice": "3.60",
      "ProductPrice_2": null,
      "GastDesc_de": "Baskischer Cheesecake mit Johannisbeer-Birnenkompott",
      "GastDesc_en": "Basque-style Cheesecake with Black Currant and Pear Compote",
      "MenuName": "FAVOURITES",
      "allergene": {
        "huhnerei": "Hühnerei und Hühnereierzeugnisse",
        "milch": "Milch und Milcherzeugnisse"
      },
      "merkmale": "",
      "naehrstoffe": "",
      "zusatzstoffe": [
        {
          "de": "Farbstoff",
          "en": "Colouring Agent"
        },
        {
          "de": "Alkohol",
          "en": "Alcohol"
        }
      ],
      "PrintOrder": "2",
      "CO2Value": null,
      "CO2Rating": null,
      "CO2Perc": null,
      "ClimateFriendly": null,
      "GastDesc": "Baskischer Cheesecake mit Johannisbeer-Birnenkompott",
      "date_de": "14.01.2026"
    },
    {
      "id": "5251391",
      "outlet": "cafe",
      "date": "2026-01-14",
      "CalendarWeek": "3",
      "day": "Mittwoch",
      "mealtime": "Mittagessen",
      "IdentNr": "12026011498003",
      "itemId": "21063",
      "RecipeID": "8211",
      "ProductPrice": "0.50",
      "ProductPrice_2": null,
      "GastDesc_de": "LES ARLETTES (Französische Blätterteigkekse) Vegan",
      "GastDesc_en": "LES ARLETTES  (French Puff Pastry Cookies) Vegan",
      "MenuName": "MINIS",
      "allergene": {
        "gluten": "Glutenhaltiges Getreide"
      },
      "merkmale": {
        "vegan": "Vegan",
        "vegetarisch": "Vegetarisch"
      },
      "naehrstoffe": "",
      "zusatzstoffe": [
        {
          "de": "Farbstoff",
          "en": "Colouring Agent"
        },
        {
          "de": "Alkohol",
          "en": "Alcohol"
        }
      ],
      "PrintOrder": "3",
      "CO2Value": null,
      "CO2Rating": null,
      "CO2Perc": null,
      "ClimateFriendly": null,
      "GastDesc": "LES ARLETTES (Französische Blätterteigkekse) Vegan",
      "date_de": "14.01.2026"
    },
    {
      "id": "5251392",
      "outlet": "cafe",
      "date": "2026-01-14",
      "CalendarWeek": "3",
      "day": "Mittwoch",
      "mealtime": "Mittagessen",
      "IdentNr": "12026011498005",
      "itemId": "21064",
      "RecipeID": "8330",
      "ProductPrice": "1.50",
      "ProductPrice_2": null,
      "GastDesc_de": "Saftige Brownie-Bananen-Cookies | Zuckerfrei",
      "GastDesc_en": "Fudgy Brownie Banana Cookies | Sugar-Free",
      "MenuName": "PEOPLES CHOICE",
      "allergene": {
        "erdnuss": "Erdnüsse und Erdnusserzeugnisse"
      },
      "merkmale": {
        "ohne_zucker": "Ohne_Zucker",
        "vegan": "Vegan",
        "vegetarisch": "Vegetarisch"
      },
      "naehrstoffe": "",
      "zusatzstoffe": null,
      "PrintOrder": "5",
      "CO2Value": null,
      "CO2Rating": null,
      "CO2Perc": null,
      "ClimateFriendly": null,
      "GastDesc": "Saftige Brownie-Bananen-Cookies | Zuckerfrei",
      "date_de": "14.01.2026"
    },
    {
      "id": "5251393",
      "outlet": "cafe",
      "date": "2026-01-14",
      "CalendarWeek": "3",
      "day": "Mittwoch",
      "mealtime": "Mittagessen",
      "IdentNr": "12026011498006",
      "itemId": "21061",
      "RecipeID": "8697",
      "ProductPrice": "2.50",
      "ProductPrice_2": null,
      "GastDesc_de": "Erdnussbutter-Cookie mit Schokolade und Salzkaramell | Vegan",
      "GastDesc_en": "Peanutbutter Cookie with Chocolate Salty Caramel | Vegan",
      "MenuName": "SEASON",
      "allergene": {
        "gluten": "Glutenhaltiges Getreide",
        "soja": "Soja und Sojaerzeugnisse",
        "erdnuss": "Erdnüsse und Erdnusserzeugnisse"
      },
      "merkmale": "",
      "naehrstoffe": "",
      "zusatzstoffe": [
        {
          "de": "Farbstoff",
          "en": "Colouring Agent"
        },
        {
          "de": "Antioxidationsmittel",
          "en": "Antioxidation"
        },
        {
          "de": "Alkohol",
          "en": "Alcohol"
        }
      ],
      "PrintOrder": "6",
      "CO2Value": null,
      "CO2Rating": null,
      "CO2Perc": null,
      "ClimateFriendly": null,
      "GastDesc": "Erdnussbutter-Cookie mit Schokolade und Salzkaramell | Vegan",
      "date_de": "14.01.2026"
    },
    {
      "id": "5251394",
      "outlet": "cafe",
      "date": "2026-01-14",
      "CalendarWeek": "3",
      "day": "Mittwoch",
      "mealtime": "Mittagessen",
      "IdentNr": "12026011498007",
      "itemId": "12776",
      "RecipeID": "8453",
      "ProductPrice": "2.50",
      "ProductPrice_2": null,
      "GastDesc_de": "Oreo-Cheesecake-Cookies",
      "GastDesc_en": "Oreo Cheesecake Cookies",
      "MenuName": "COOKIE",
      "allergene": {
        "gluten": "Glutenhaltiges Getreide",
        "huhnerei": "Hühnerei und Hühnereierzeugnisse",
        "milch": "Milch und Milcherzeugnisse"
      },
      "merkmale": "",
      "naehrstoffe": "",
      "zusatzstoffe": [
        {
          "de": "Farbstoff",
          "en": "Colouring Agent"
        },
        {
          "de": "Alkohol",
          "en": "Alcohol"
        }
      ],
      "PrintOrder": "7",
      "CO2Value": null,
      "CO2Rating": null,
      "CO2Perc": null,
      "ClimateFriendly": null,
      "GastDesc": "Oreo-Cheesecake-Cookies",
      "date_de": "14.01.2026"
    },
    {
      "id": "5251395",
      "outlet": "cafe",
      "date": "2026-01-14",
      "CalendarWeek": "3",
      "day": "Mittwoch",
      "mealtime": "Mittagessen",
      "IdentNr": "12026011498008",
      "itemId": "12777",
      "RecipeID": "9121",
      "ProductPrice": "2.50",
      "ProductPrice_2": null,
      "GastDesc_de": "Carrotcake  Bananenbrot | Zuckerfrei",
      "GastDesc_en": "Carrot Cake Banana Bread | Sugar-Free",
      "MenuName": "TAG des KASTENKUCHENS",
      "allergene": {
        "gluten": "Glutenhaltiges Getreide",
        "huhnerei": "Hühnerei und Hühnereierzeugnisse",
        "milch": "Milch und Milcherzeugnisse",
        "schwefel": "Schwefeldioxid und Sulfide"
      },
      "merkmale": "",
      "naehrstoffe": "",
      "zusatzstoffe": [
        {
          "de": "Farbstoff",
          "en": "Colouring Agent"
        }
      ],
      "PrintOrder": "8",
      "CO2Value": null,
      "CO2Rating": null,
      "CO2Perc": null,
      "ClimateFriendly": null,
      "GastDesc": "Carrotcake  Bananenbrot | Zuckerfrei",
      "date_de": "14.01.2026"
    },
    {
      "id": "5251396",
      "outlet": "cafe",
      "date": "2026-01-14",
      "CalendarWeek": "3",
      "day": "Mittwoch",
      "mealtime": "Mittagessen",
      "IdentNr": "12026011498011",
      "itemId": "16256",
      "RecipeID": "9122",
      "ProductPrice": "2.50",
      "ProductPrice_2": null,
      "GastDesc_de": "Sesam-Keks | Mehlfrei | Vegan",
      "GastDesc_en": "Sesame Cookie | Flour-Free | Vegan",
      "MenuName": "VEGAN SPECIAL",
      "allergene": {
        "schalenfruchte": "Schalenfrüchte und Schalenfruchterzeugnisse",
        "sesam": "Sesamsamen und Sesamsamenerzeugnisse"
      },
      "merkmale": "",
      "naehrstoffe": "",
      "zusatzstoffe": [
        {
          "de": "Farbstoff",
          "en": "Colouring Agent"
        },
        {
          "de": "Antioxidationsmittel",
          "en": "Antioxidation"
        },
        {
          "de": "Alkohol",
          "en": "Alcohol"
        }
      ],
      "PrintOrder": "11",
      "CO2Value": null,
      "CO2Rating": null,
      "CO2Perc": null,
      "ClimateFriendly": null,
      "GastDesc": "Sesam-Keks | Mehlfrei | Vegan",
      "date_de": "14.01.2026"
    },
    {
      "id": "5251397",
      "outlet": "cafe",
      "date": "2026-01-15",
      "CalendarWeek": "3",
      "day": "Donnerstag",
      "mealtime": "Mittagessen",
      "IdentNr": "12026011598001",
      "itemId": "21059",
      "RecipeID": "8054",
      "ProductPrice": "3.20",
      "ProductPrice_2": null,
      "GastDesc_de": "Pflaumenmus-Croffin mit Vanilleschmand",
      "GastDesc_en": "Plum Jam Croffin with Vanilla Sour Cream",
      "MenuName": "CROFFIN",
      "allergene": {
        "gluten": "Glutenhaltiges Getreide",
        "schalenfruchte": "Schalenfrüchte und Schalenfruchterzeugnisse",
        "huhnerei": "Hühnerei und Hühnereierzeugnisse",
        "soja": "Soja und Sojaerzeugnisse",
        "milch": "Milch und Milcherzeugnisse"
      },
      "merkmale": "",
      "naehrstoffe": "",
      "zusatzstoffe": [
        {
          "de": "Farbstoff",
          "en": "Colouring Agent"
        },
        {
          "de": "Alkohol",
          "en": "Alcohol"
        }
      ],
      "PrintOrder": "1",
      "CO2Value": null,
      "CO2Rating": null,
      "CO2Perc": null,
      "ClimateFriendly": null,
      "GastDesc": "Pflaumenmus-Croffin mit Vanilleschmand",
      "date_de": "15.01.2026"
    },
    {
      "id": "5251398",
      "outlet": "cafe",
      "date": "2026-01-15",
      "CalendarWeek": "3",
      "day": "Donnerstag",
      "mealtime": "Mittagessen",
      "IdentNr": "12026011598002",
      "itemId": "21062",
      "RecipeID": "8871",
      "ProductPrice": "3.60",
      "ProductPrice_2": null,
      "GastDesc_de": "Baskischer Cheesecake mit Johannisbeer-Birnenkompott",
      "GastDesc_en": "Basque-style Cheesecake with Black Currant and Pear Compote",
      "MenuName": "FAVOURITES",
      "allergene": {
        "huhnerei": "Hühnerei und Hühnereierzeugnisse",
        "milch": "Milch und Milcherzeugnisse"
      },
      "merkmale": "",
      "naehrstoffe": "",
      "zusatzstoffe": [
        {
          "de": "Farbstoff",
          "en": "Colouring Agent"
        },
        {
          "de": "Alkohol",
          "en": "Alcohol"
        }
      ],
      "PrintOrder": "2",
      "CO2Value": null,
      "CO2Rating": null,
      "CO2Perc": null,
      "ClimateFriendly": null,
      "GastDesc": "Baskischer Cheesecake mit Johannisbeer-Birnenkompott",
      "date_de": "15.01.2026"
    },
    {
      "id": "5251399",
      "outlet": "cafe",
      "date": "2026-01-15",
      "CalendarWeek": "3",
      "day": "Donnerstag",
      "mealtime": "Mittagessen",
      "IdentNr": "12026011598003",
      "itemId": "21063",
      "RecipeID": "8211",
      "ProductPrice": "0.50",
      "ProductPrice_2": null,
      "GastDesc_de": "LES ARLETTES (Französische Blätterteigkekse) Vegan",
      "GastDesc_en": "LES ARLETTES  (French Puff Pastry Cookies) Vegan",
      "MenuName": "MINIS",
      "allergene": {
        "gluten": "Glutenhaltiges Getreide"
      },
      "merkmale": {
        "vegan": "Vegan",
        "vegetarisch": "Vegetarisch"
      },
      "naehrstoffe": "",
      "zusatzstoffe": [
        {
          "de": "Farbstoff",
          "en": "Colouring Agent"
        },
        {
          "de": "Alkohol",
          "en": "Alcohol"
        }
      ],
      "PrintOrder": "3",
      "CO2Value": null,
      "CO2Rating": null,
      "CO2Perc": null,
      "ClimateFriendly": null,
      "GastDesc": "LES ARLETTES (Französische Blätterteigkekse) Vegan",
      "date_de": "15.01.2026"
    },
    {
      "id": "5251400",
      "outlet": "cafe",
      "date": "2026-01-15",
      "CalendarWeek": "3",
      "day": "Donnerstag",
      "mealtime": "Mittagessen",
      "IdentNr": "12026011598005",
      "itemId": "21064",
      "RecipeID": "8330",
      "ProductPrice": "1.50",
      "ProductPrice_2": null,
      "GastDesc_de": "Saftige Brownie-Bananen-Cookies | Zuckerfrei",
      "GastDesc_en": "Fudgy Brownie Banana Cookies | Sugar-Free",
      "MenuName": "PEOPLES CHOICE",
      "allergene": {
        "erdnuss": "Erdnüsse und Erdnusserzeugnisse"
      },
      "merkmale": {
        "ohne_zucker": "Ohne_Zucker",
        "vegan": "Vegan",
        "vegetarisch": "Vegetarisch"
      },
      "naehrstoffe": "",
      "zusatzstoffe": null,
      "PrintOrder": "5",
      "CO2Value": null,
      "CO2Rating": null,
      "CO2Perc": null,
      "ClimateFriendly": null,
      "GastDesc": "Saftige Brownie-Bananen-Cookies | Zuckerfrei",
      "date_de": "15.01.2026"
    },
    {
      "id": "5251401",
      "outlet": "cafe",
      "date": "2026-01-15",
      "CalendarWeek": "3",
      "day": "Donnerstag",
      "mealtime": "Mittagessen",
      "IdentNr": "12026011598006",
      "itemId": "21061",
      "RecipeID": "8697",
      "ProductPrice": "2.50",
      "ProductPrice_2": null,
      "GastDesc_de": "Erdnussbutter-Cookie mit Schokolade und Salzkaramell | Vegan",
      "GastDesc_en": "Peanutbutter Cookie with Chocolate Salty Caramel | Vegan",
      "MenuName": "SEASON",
      "allergene": {
        "gluten": "Glutenhaltiges Getreide",
        "soja": "Soja und Sojaerzeugnisse",
        "erdnuss": "Erdnüsse und Erdnusserzeugnisse"
      },
      "merkmale": "",
      "naehrstoffe": "",
      "zusatzstoffe": [
        {
          "de": "Farbstoff",
          "en": "Colouring Agent"
        },
        {
          "de": "Antioxidationsmittel",
          "en": "Antioxidation"
        },
        {
          "de": "Alkohol",
          "en": "Alcohol"
        }
      ],
      "PrintOrder": "6",
      "CO2Value": null,
      "CO2Rating": null,
      "CO2Perc": null,
      "ClimateFriendly": null,
      "GastDesc": "Erdnussbutter-Cookie mit Schokolade und Salzkaramell | Vegan",
      "date_de": "15.01.2026"
    },
    {
      "id": "5251402",
      "outlet": "cafe",
      "date": "2026-01-15",
      "CalendarWeek": "3",
      "day": "Donnerstag",
      "mealtime": "Mittagessen",
      "IdentNr": "12026011598007",
      "itemId": "12776",
      "RecipeID": "8453",
      "ProductPrice": "2.50",
      "ProductPrice_2": null,
      "GastDesc_de": "Oreo-Cheesecake-Cookies",
      "GastDesc_en": "Oreo Cheesecake Cookies",
      "MenuName": "COOKIE",
      "allergene": {
        "gluten": "Glutenhaltiges Getreide",
        "huhnerei": "Hühnerei und Hühnereierzeugnisse",
        "milch": "Milch und Milcherzeugnisse"
      },
      "merkmale": "",
      "naehrstoffe": "",
      "zusatzstoffe": [
        {
          "de": "Farbstoff",
          "en": "Colouring Agent"
        },
        {
          "de": "Alkohol",
          "en": "Alcohol"
        }
      ],
      "PrintOrder": "7",
      "CO2Value": null,
      "CO2Rating": null,
      "CO2Perc": null,
      "ClimateFriendly": null,
      "GastDesc": "Oreo-Cheesecake-Cookies",
      "date_de": "15.01.2026"
    },
    {
      "id": "5251403",
      "outlet": "cafe",
      "date": "2026-01-15",
      "CalendarWeek": "3",
      "day": "Donnerstag",
      "mealtime": "Mittagessen",
      "IdentNr": "12026011598008",
      "itemId": "12777",
      "RecipeID": "9121",
      "ProductPrice": "2.50",
      "ProductPrice_2": null,
      "GastDesc_de": "Carrotcake  Bananenbrot | Zuckerfrei",
      "GastDesc_en": "Carrot Cake Banana Bread | Sugar-Free",
      "MenuName": "TAG des KASTENKUCHENS",
      "allergene": {
        "gluten": "Glutenhaltiges Getreide",
        "huhnerei": "Hühnerei und Hühnereierzeugnisse",
        "milch": "Milch und Milcherzeugnisse",
        "schwefel": "Schwefeldioxid und Sulfide"
      },
      "merkmale": "",
      "naehrstoffe": "",
      "zusatzstoffe": [
        {
          "de": "Farbstoff",
          "en": "Colouring Agent"
        }
      ],
      "PrintOrder": "8",
      "CO2Value": null,
      "CO2Rating": null,
      "CO2Perc": null,
      "ClimateFriendly": null,
      "GastDesc": "Carrotcake  Bananenbrot | Zuckerfrei",
      "date_de": "15.01.2026"
    },
    {
      "id": "5251404",
      "outlet": "cafe",
      "date": "2026-01-15",
      "CalendarWeek": "3",
      "day": "Donnerstag",
      "mealtime": "Mittagessen",
      "IdentNr": "12026011598011",
      "itemId": "16256",
      "RecipeID": "9122",
      "ProductPrice": "2.50",
      "ProductPrice_2": null,
      "GastDesc_de": "Sesam-Keks | Mehlfrei | Vegan",
      "GastDesc_en": "Sesame Cookie | Flour-Free | Vegan",
      "MenuName": "VEGAN SPECIAL",
      "allergene": {
        "schalenfruchte": "Schalenfrüchte und Schalenfruchterzeugnisse",
        "sesam": "Sesamsamen und Sesamsamenerzeugnisse"
      },
      "merkmale": "",
      "naehrstoffe": "",
      "zusatzstoffe": [
        {
          "de": "Farbstoff",
          "en": "Colouring Agent"
        },
        {
          "de": "Antioxidationsmittel",
          "en": "Antioxidation"
        },
        {
          "de": "Alkohol",
          "en": "Alcohol"
        }
      ],
      "PrintOrder": "11",
      "CO2Value": null,
      "CO2Rating": null,
      "CO2Perc": null,
      "ClimateFriendly": null,
      "GastDesc": "Sesam-Keks | Mehlfrei | Vegan",
      "date_de": "15.01.2026"
    },
    {
      "id": "5251405",
      "outlet": "cafe",
      "date": "2026-01-16",
      "CalendarWeek": "3",
      "day": "Freitag",
      "mealtime": "Mittagessen",
      "IdentNr": "12026011698002",
      "itemId": "21062",
      "RecipeID": "8871",
      "ProductPrice": "3.60",
      "ProductPrice_2": null,
      "GastDesc_de": "Baskischer Cheesecake mit Johannisbeer-Birnenkompott",
      "GastDesc_en": "Basque-style Cheesecake with Black Currant and Pear Compote",
      "MenuName": "FAVOURITES",
      "allergene": {
        "huhnerei": "Hühnerei und Hühnereierzeugnisse",
        "milch": "Milch und Milcherzeugnisse"
      },
      "merkmale": "",
      "naehrstoffe": "",
      "zusatzstoffe": [
        {
          "de": "Farbstoff",
          "en": "Colouring Agent"
        },
        {
          "de": "Alkohol",
          "en": "Alcohol"
        }
      ],
      "PrintOrder": "2",
      "CO2Value": null,
      "CO2Rating": null,
      "CO2Perc": null,
      "ClimateFriendly": null,
      "GastDesc": "Baskischer Cheesecake mit Johannisbeer-Birnenkompott",
      "date_de": "16.01.2026"
    },
    {
      "id": "5251406",
      "outlet": "cafe",
      "date": "2026-01-16",
      "CalendarWeek": "3",
      "day": "Freitag",
      "mealtime": "Mittagessen",
      "IdentNr": "12026011698003",
      "itemId": "21063",
      "RecipeID": "8211",
      "ProductPrice": "0.50",
      "ProductPrice_2": null,
      "GastDesc_de": "LES ARLETTES (Französische Blätterteigkekse) Vegan",
      "GastDesc_en": "LES ARLETTES  (French Puff Pastry Cookies) Vegan",
      "MenuName": "MINIS",
      "allergene": {
        "gluten": "Glutenhaltiges Getreide"
      },
      "merkmale": {
        "vegan": "Vegan",
        "vegetarisch": "Vegetarisch"
      },
      "naehrstoffe": "",
      "zusatzstoffe": [
        {
          "de": "Farbstoff",
          "en": "Colouring Agent"
        },
        {
          "de": "Alkohol",
          "en": "Alcohol"
        }
      ],
      "PrintOrder": "3",
      "CO2Value": null,
      "CO2Rating": null,
      "CO2Perc": null,
      "ClimateFriendly": null,
      "GastDesc": "LES ARLETTES (Französische Blätterteigkekse) Vegan",
      "date_de": "16.01.2026"
    },
    {
      "id": "5251407",
      "outlet": "cafe",
      "date": "2026-01-16",
      "CalendarWeek": "3",
      "day": "Freitag",
      "mealtime": "Mittagessen",
      "IdentNr": "12026011698005",
      "itemId": "21064",
      "RecipeID": "8330",
      "ProductPrice": "1.50",
      "ProductPrice_2": null,
      "GastDesc_de": "Saftige Brownie-Bananen-Cookies | Zuckerfrei",
      "GastDesc_en": "Fudgy Brownie Banana Cookies | Sugar-Free",
      "MenuName": "PEOPLES CHOICE",
      "allergene": {
        "erdnuss": "Erdnüsse und Erdnusserzeugnisse"
      },
      "merkmale": {
        "ohne_zucker": "Ohne_Zucker",
        "vegan": "Vegan",
        "vegetarisch": "Vegetarisch"
      },
      "naehrstoffe": "",
      "zusatzstoffe": null,
      "PrintOrder": "5",
      "CO2Value": null,
      "CO2Rating": null,
      "CO2Perc": null,
      "ClimateFriendly": null,
      "GastDesc": "Saftige Brownie-Bananen-Cookies | Zuckerfrei",
      "date_de": "16.01.2026"
    },
    {
      "id": "5251408",
      "outlet": "cafe",
      "date": "2026-01-16",
      "CalendarWeek": "3",
      "day": "Freitag",
      "mealtime": "Mittagessen",
      "IdentNr": "12026011698006",
      "itemId": "21061",
      "RecipeID": "8697",
      "ProductPrice": "2.50",
      "ProductPrice_2": null,
      "GastDesc_de": "Erdnussbutter-Cookie mit Schokolade und Salzkaramell | Vegan",
      "GastDesc_en": "Peanutbutter Cookie with Chocolate Salty Caramel | Vegan",
      "MenuName": "SEASON",
      "allergene": {
        "gluten": "Glutenhaltiges Getreide",
        "soja": "Soja und Sojaerzeugnisse",
        "erdnuss": "Erdnüsse und Erdnusserzeugnisse"
      },
      "merkmale": "",
      "naehrstoffe": "",
      "zusatzstoffe": [
        {
          "de": "Farbstoff",
          "en": "Colouring Agent"
        },
        {
          "de": "Antioxidationsmittel",
          "en": "Antioxidation"
        },
        {
          "de": "Alkohol",
          "en": "Alcohol"
        }
      ],
      "PrintOrder": "6",
      "CO2Value": null,
      "CO2Rating": null,
      "CO2Perc": null,
      "ClimateFriendly": null,
      "GastDesc": "Erdnussbutter-Cookie mit Schokolade und Salzkaramell | Vegan",
      "date_de": "16.01.2026"
    },
    {
      "id": "5251409",
      "outlet": "cafe",
      "date": "2026-01-16",
      "CalendarWeek": "3",
      "day": "Freitag",
      "mealtime": "Mittagessen",
      "IdentNr": "12026011698007",
      "itemId": "12776",
      "RecipeID": "8453",
      "ProductPrice": "2.50",
      "ProductPrice_2": null,
      "GastDesc_de": "Oreo-Cheesecake-Cookies",
      "GastDesc_en": "Oreo Cheesecake Cookies",
      "MenuName": "COOKIE",
      "allergene": {
        "gluten": "Glutenhaltiges Getreide",
        "huhnerei": "Hühnerei und Hühnereierzeugnisse",
        "milch": "Milch und Milcherzeugnisse"
      },
      "merkmale": "",
      "naehrstoffe": "",
      "zusatzstoffe": [
        {
          "de": "Farbstoff",
          "en": "Colouring Agent"
        },
        {
          "de": "Alkohol",
          "en": "Alcohol"
        }
      ],
      "PrintOrder": "7",
      "CO2Value": null,
      "CO2Rating": null,
      "CO2Perc": null,
      "ClimateFriendly": null,
      "GastDesc": "Oreo-Cheesecake-Cookies",
      "date_de": "16.01.2026"
    },
    {
      "id": "5251410",
      "outlet": "cafe",
      "date": "2026-01-16",
      "CalendarWeek": "3",
      "day": "Freitag",
      "mealtime": "Mittagessen",
      "IdentNr": "12026011698008",
      "itemId": "12777",
      "RecipeID": "9121",
      "ProductPrice": "2.50",
      "ProductPrice_2": null,
      "GastDesc_de": "Carrotcake  Bananenbrot | Zuckerfrei",
      "GastDesc_en": "Carrot Cake Banana Bread | Sugar-Free",
      "MenuName": "TAG des KASTENKUCHENS",
      "allergene": {
        "gluten": "Glutenhaltiges Getreide",
        "huhnerei": "Hühnerei und Hühnereierzeugnisse",
        "milch": "Milch und Milcherzeugnisse",
        "schwefel": "Schwefeldioxid und Sulfide"
      },
      "merkmale": "",
      "naehrstoffe": "",
      "zusatzstoffe": [
        {
          "de": "Farbstoff",
          "en": "Colouring Agent"
        }
      ],
      "PrintOrder": "8",
      "CO2Value": null,
      "CO2Rating": null,
      "CO2Perc": null,
      "ClimateFriendly": null,
      "GastDesc": "Carrotcake  Bananenbrot | Zuckerfrei",
      "date_de": "16.01.2026"
    },
    {
      "id": "5251411",
      "outlet": "cafe",
      "date": "2026-01-16",
      "CalendarWeek": "3",
      "day": "Freitag",
      "mealtime": "Mittagessen",
      "IdentNr": "12026011698011",
      "itemId": "16256",
      "RecipeID": "9122",
      "ProductPrice": "2.50",
      "ProductPrice_2": null,
      "GastDesc_de": "Sesam-Keks | Mehlfrei | Vegan",
      "GastDesc_en": "Sesame Cookie | Flour-Free | Vegan",
      "MenuName": "VEGAN SPECIAL",
      "allergene": {
        "schalenfruchte": "Schalenfrüchte und Schalenfruchterzeugnisse",
        "sesam": "Sesamsamen und Sesamsamenerzeugnisse"
      },
      "merkmale": "",
      "naehrstoffe": "",
      "zusatzstoffe": [
        {
          "de": "Farbstoff",
          "en": "Colouring Agent"
        },
        {
          "de": "Antioxidationsmittel",
          "en": "Antioxidation"
        },
        {
          "de": "Alkohol",
          "en": "Alcohol"
        }
      ],
      "PrintOrder": "11",
      "CO2Value": null,
      "CO2Rating": null,
      "CO2Perc": null,
      "ClimateFriendly": null,
      "GastDesc": "Sesam-Keks | Mehlfrei | Vegan",
      "date_de": "16.01.2026"
    },
    {
      "id": "5251412",
      "outlet": "cafe",
      "date": "2026-01-19",
      "CalendarWeek": "3",
      "day": "Montag",
      "mealtime": "Mittagessen",
      "IdentNr": "12026011998001",
      "itemId": "21059",
      "RecipeID": "8054",
      "ProductPrice": "3.20",
      "ProductPrice_2": null,
      "GastDesc_de": "Pflaumenmus-Croffin mit Vanilleschmand",
      "GastDesc_en": "Plum Jam Croffin with Vanilla Sour Cream",
      "MenuName": "CROFFIN",
      "allergene": {
        "gluten": "Glutenhaltiges Getreide",
        "schalenfruchte": "Schalenfrüchte und Schalenfruchterzeugnisse",
        "huhnerei": "Hühnerei und Hühnereierzeugnisse",
        "soja": "Soja und Sojaerzeugnisse",
        "milch": "Milch und Milcherzeugnisse"
      },
      "merkmale": "",
      "naehrstoffe": "",
      "zusatzstoffe": [
        {
          "de": "Farbstoff",
          "en": "Colouring Agent"
        },
        {
          "de": "Alkohol",
          "en": "Alcohol"
        }
      ],
      "PrintOrder": "1",
      "CO2Value": null,
      "CO2Rating": null,
      "CO2Perc": null,
      "ClimateFriendly": null,
      "GastDesc": "Pflaumenmus-Croffin mit Vanilleschmand",
      "date_de": "19.01.2026"
    },
    {
      "id": "5251413",
      "outlet": "cafe",
      "date": "2026-01-19",
      "CalendarWeek": "3",
      "day": "Montag",
      "mealtime": "Mittagessen",
      "IdentNr": "12026011998002",
      "itemId": "21062",
      "RecipeID": "8871",
      "ProductPrice": "3.60",
      "ProductPrice_2": null,
      "GastDesc_de": "Baskischer Cheesecake mit Johannisbeer-Birnenkompott",
      "GastDesc_en": "Basque-style Cheesecake with Black Currant and Pear Compote",
      "MenuName": "FAVOURITES",
      "allergene": {
        "huhnerei": "Hühnerei und Hühnereierzeugnisse",
        "milch": "Milch und Milcherzeugnisse"
      },
      "merkmale": "",
      "naehrstoffe": "",
      "zusatzstoffe": [
        {
          "de": "Farbstoff",
          "en": "Colouring Agent"
        },
        {
          "de": "Alkohol",
          "en": "Alcohol"
        }
      ],
      "PrintOrder": "2",
      "CO2Value": null,
      "CO2Rating": null,
      "CO2Perc": null,
      "ClimateFriendly": null,
      "GastDesc": "Baskischer Cheesecake mit Johannisbeer-Birnenkompott",
      "date_de": "19.01.2026"
    },
    {
      "id": "5251414",
      "outlet": "cafe",
      "date": "2026-01-19",
      "CalendarWeek": "3",
      "day": "Montag",
      "mealtime": "Mittagessen",
      "IdentNr": "12026011998003",
      "itemId": "21063",
      "RecipeID": "8211",
      "ProductPrice": "0.50",
      "ProductPrice_2": null,
      "GastDesc_de": "LES ARLETTES (Französische Blätterteigkekse) Vegan",
      "GastDesc_en": "LES ARLETTES  (French Puff Pastry Cookies) Vegan",
      "MenuName": "MINIS",
      "allergene": {
        "gluten": "Glutenhaltiges Getreide"
      },
      "merkmale": {
        "vegan": "Vegan",
        "vegetarisch": "Vegetarisch"
      },
      "naehrstoffe": "",
      "zusatzstoffe": [
        {
          "de": "Farbstoff",
          "en": "Colouring Agent"
        },
        {
          "de": "Alkohol",
          "en": "Alcohol"
        }
      ],
      "PrintOrder": "3",
      "CO2Value": null,
      "CO2Rating": null,
      "CO2Perc": null,
      "ClimateFriendly": null,
      "GastDesc": "LES ARLETTES (Französische Blätterteigkekse) Vegan",
      "date_de": "19.01.2026"
    },
    {
      "id": "5251415",
      "outlet": "cafe",
      "date": "2026-01-19",
      "CalendarWeek": "3",
      "day": "Montag",
      "mealtime": "Mittagessen",
      "IdentNr": "12026011998005",
      "itemId": "21064",
      "RecipeID": "8330",
      "ProductPrice": "1.50",
      "ProductPrice_2": null,
      "GastDesc_de": "Saftige Brownie-Bananen-Cookies | Zuckerfrei",
      "GastDesc_en": "Fudgy Brownie Banana Cookies | Sugar-Free",
      "MenuName": "PEOPLES CHOICE",
      "allergene": {
        "erdnuss": "Erdnüsse und Erdnusserzeugnisse"
      },
      "merkmale": {
        "ohne_zucker": "Ohne_Zucker",
        "vegan": "Vegan",
        "vegetarisch": "Vegetarisch"
      },
      "naehrstoffe": "",
      "zusatzstoffe": null,
      "PrintOrder": "5",
      "CO2Value": null,
      "CO2Rating": null,
      "CO2Perc": null,
      "ClimateFriendly": null,
      "GastDesc": "Saftige Brownie-Bananen-Cookies | Zuckerfrei",
      "date_de": "19.01.2026"
    },
    {
      "id": "5251416",
      "outlet": "cafe",
      "date": "2026-01-19",
      "CalendarWeek": "3",
      "day": "Montag",
      "mealtime": "Mittagessen",
      "IdentNr": "12026011998006",
      "itemId": "21061",
      "RecipeID": "8697",
      "ProductPrice": "2.50",
      "ProductPrice_2": null,
      "GastDesc_de": "Erdnussbutter-Cookie mit Schokolade und Salzkaramell | Vegan",
      "GastDesc_en": "Peanutbutter Cookie with Chocolate Salty Caramel | Vegan",
      "MenuName": "SEASON",
      "allergene": {
        "gluten": "Glutenhaltiges Getreide",
        "soja": "Soja und Sojaerzeugnisse",
        "erdnuss": "Erdnüsse und Erdnusserzeugnisse"
      },
      "merkmale": "",
      "naehrstoffe": "",
      "zusatzstoffe": [
        {
          "de": "Farbstoff",
          "en": "Colouring Agent"
        },
        {
          "de": "Antioxidationsmittel",
          "en": "Antioxidation"
        },
        {
          "de": "Alkohol",
          "en": "Alcohol"
        }
      ],
      "PrintOrder": "6",
      "CO2Value": null,
      "CO2Rating": null,
      "CO2Perc": null,
      "ClimateFriendly": null,
      "GastDesc": "Erdnussbutter-Cookie mit Schokolade und Salzkaramell | Vegan",
      "date_de": "19.01.2026"
    },
    {
      "id": "5251417",
      "outlet": "cafe",
      "date": "2026-01-19",
      "CalendarWeek": "3",
      "day": "Montag",
      "mealtime": "Mittagessen",
      "IdentNr": "12026011998007",
      "itemId": "12776",
      "RecipeID": "8453",
      "ProductPrice": "2.50",
      "ProductPrice_2": null,
      "GastDesc_de": "Oreo-Cheesecake-Cookies",
      "GastDesc_en": "Oreo Cheesecake Cookies",
      "MenuName": "COOKIE",
      "allergene": {
        "gluten": "Glutenhaltiges Getreide",
        "huhnerei": "Hühnerei und Hühnereierzeugnisse",
        "milch": "Milch und Milcherzeugnisse"
      },
      "merkmale": "",
      "naehrstoffe": "",
      "zusatzstoffe": [
        {
          "de": "Farbstoff",
          "en": "Colouring Agent"
        },
        {
          "de": "Alkohol",
          "en": "Alcohol"
        }
      ],
      "PrintOrder": "7",
      "CO2Value": null,
      "CO2Rating": null,
      "CO2Perc": null,
      "ClimateFriendly": null,
      "GastDesc": "Oreo-Cheesecake-Cookies",
      "date_de": "19.01.2026"
    },
    {
      "id": "5251418",
      "outlet": "cafe",
      "date": "2026-01-19",
      "CalendarWeek": "3",
      "day": "Montag",
      "mealtime": "Mittagessen",
      "IdentNr": "12026011998008",
      "itemId": "12777",
      "RecipeID": "9121",
      "ProductPrice": "2.50",
      "ProductPrice_2": null,
      "GastDesc_de": "Carrotcake  Bananenbrot | Zuckerfrei",
      "GastDesc_en": "Carrot Cake Banana Bread | Sugar-Free",
      "MenuName": "TAG des KASTENKUCHENS",
      "allergene": {
        "gluten": "Glutenhaltiges Getreide",
        "huhnerei": "Hühnerei und Hühnereierzeugnisse",
        "milch": "Milch und Milcherzeugnisse",
        "schwefel": "Schwefeldioxid und Sulfide"
      },
      "merkmale": "",
      "naehrstoffe": "",
      "zusatzstoffe": [
        {
          "de": "Farbstoff",
          "en": "Colouring Agent"
        }
      ],
      "PrintOrder": "8",
      "CO2Value": null,
      "CO2Rating": null,
      "CO2Perc": null,
      "ClimateFriendly": null,
      "GastDesc": "Carrotcake  Bananenbrot | Zuckerfrei",
      "date_de": "19.01.2026"
    },
    {
      "id": "5251419",
      "outlet": "cafe",
      "date": "2026-01-19",
      "CalendarWeek": "3",
      "day": "Montag",
      "mealtime": "Mittagessen",
      "IdentNr": "12026011998011",
      "itemId": "16256",
      "RecipeID": "9122",
      "ProductPrice": "2.50",
      "ProductPrice_2": null,
      "GastDesc_de": "Sesam-Keks | Mehlfrei | Vegan",
      "GastDesc_en": "Sesame Cookie | Flour-Free | Vegan",
      "MenuName": "VEGAN SPECIAL",
      "allergene": {
        "schalenfruchte": "Schalenfrüchte und Schalenfruchterzeugnisse",
        "sesam": "Sesamsamen und Sesamsamenerzeugnisse"
      },
      "merkmale": "",
      "naehrstoffe": "",
      "zusatzstoffe": [
        {
          "de": "Farbstoff",
          "en": "Colouring Agent"
        },
        {
          "de": "Antioxidationsmittel",
          "en": "Antioxidation"
        },
        {
          "de": "Alkohol",
          "en": "Alcohol"
        }
      ],
      "PrintOrder": "11",
      "CO2Value": null,
      "CO2Rating": null,
      "CO2Perc": null,
      "ClimateFriendly": null,
      "GastDesc": "Sesam-Keks | Mehlfrei | Vegan",
      "date_de": "19.01.2026"
    },
    {
      "id": "5251420",
      "outlet": "cafe",
      "date": "2026-01-20",
      "CalendarWeek": "3",
      "day": "Dienstag",
      "mealtime": "Mittagessen",
      "IdentNr": "12026012098001",
      "itemId": "21059",
      "RecipeID": "8054",
      "ProductPrice": "3.20",
      "ProductPrice_2": null,
      "GastDesc_de": "Pflaumenmus-Croffin mit Vanilleschmand",
      "GastDesc_en": "Plum Jam Croffin with Vanilla Sour Cream",
      "MenuName": "CROFFIN",
      "allergene": {
        "gluten": "Glutenhaltiges Getreide",
        "schalenfruchte": "Schalenfrüchte und Schalenfruchterzeugnisse",
        "huhnerei": "Hühnerei und Hühnereierzeugnisse",
        "soja": "Soja und Sojaerzeugnisse",
        "milch": "Milch und Milcherzeugnisse"
      },
      "merkmale": "",
      "naehrstoffe": "",
      "zusatzstoffe": [
        {
          "de": "Farbstoff",
          "en": "Colouring Agent"
        },
        {
          "de": "Alkohol",
          "en": "Alcohol"
        }
      ],
      "PrintOrder": "1",
      "CO2Value": null,
      "CO2Rating": null,
      "CO2Perc": null,
      "ClimateFriendly": null,
      "GastDesc": "Pflaumenmus-Croffin mit Vanilleschmand",
      "date_de": "20.01.2026"
    },
    {
      "id": "5251421",
      "outlet": "cafe",
      "date": "2026-01-20",
      "CalendarWeek": "3",
      "day": "Dienstag",
      "mealtime": "Mittagessen",
      "IdentNr": "12026012098002",
      "itemId": "21062",
      "RecipeID": "8871",
      "ProductPrice": "3.60",
      "ProductPrice_2": null,
      "GastDesc_de": "Baskischer Cheesecake mit Johannisbeer-Birnenkompott",
      "GastDesc_en": "Basque-style Cheesecake with Black Currant and Pear Compote",
      "MenuName": "FAVOURITES",
      "allergene": {
        "huhnerei": "Hühnerei und Hühnereierzeugnisse",
        "milch": "Milch und Milcherzeugnisse"
      },
      "merkmale": "",
      "naehrstoffe": "",
      "zusatzstoffe": [
        {
          "de": "Farbstoff",
          "en": "Colouring Agent"
        },
        {
          "de": "Alkohol",
          "en": "Alcohol"
        }
      ],
      "PrintOrder": "2",
      "CO2Value": null,
      "CO2Rating": null,
      "CO2Perc": null,
      "ClimateFriendly": null,
      "GastDesc": "Baskischer Cheesecake mit Johannisbeer-Birnenkompott",
      "date_de": "20.01.2026"
    },
    {
      "id": "5251422",
      "outlet": "cafe",
      "date": "2026-01-20",
      "CalendarWeek": "3",
      "day": "Dienstag",
      "mealtime": "Mittagessen",
      "IdentNr": "12026012098003",
      "itemId": "21063",
      "RecipeID": "8211",
      "ProductPrice": "0.50",
      "ProductPrice_2": null,
      "GastDesc_de": "LES ARLETTES (Französische Blätterteigkekse) Vegan",
      "GastDesc_en": "LES ARLETTES  (French Puff Pastry Cookies) Vegan",
      "MenuName": "MINIS",
      "allergene": {
        "gluten": "Glutenhaltiges Getreide"
      },
      "merkmale": {
        "vegan": "Vegan",
        "vegetarisch": "Vegetarisch"
      },
      "naehrstoffe": "",
      "zusatzstoffe": [
        {
          "de": "Farbstoff",
          "en": "Colouring Agent"
        },
        {
          "de": "Alkohol",
          "en": "Alcohol"
        }
      ],
      "PrintOrder": "3",
      "CO2Value": null,
      "CO2Rating": null,
      "CO2Perc": null,
      "ClimateFriendly": null,
      "GastDesc": "LES ARLETTES (Französische Blätterteigkekse) Vegan",
      "date_de": "20.01.2026"
    },
    {
      "id": "5251423",
      "outlet": "cafe",
      "date": "2026-01-20",
      "CalendarWeek": "3",
      "day": "Dienstag",
      "mealtime": "Mittagessen",
      "IdentNr": "12026012098005",
      "itemId": "21064",
      "RecipeID": "8330",
      "ProductPrice": "1.50",
      "ProductPrice_2": null,
      "GastDesc_de": "Saftige Brownie-Bananen-Cookies | Zuckerfrei",
      "GastDesc_en": "Fudgy Brownie Banana Cookies | Sugar-Free",
      "MenuName": "PEOPLES CHOICE",
      "allergene": {
        "erdnuss": "Erdnüsse und Erdnusserzeugnisse"
      },
      "merkmale": {
        "ohne_zucker": "Ohne_Zucker",
        "vegan": "Vegan",
        "vegetarisch": "Vegetarisch"
      },
      "naehrstoffe": "",
      "zusatzstoffe": null,
      "PrintOrder": "5",
      "CO2Value": null,
      "CO2Rating": null,
      "CO2Perc": null,
      "ClimateFriendly": null,
      "GastDesc": "Saftige Brownie-Bananen-Cookies | Zuckerfrei",
      "date_de": "20.01.2026"
    },
    {
      "id": "5251424",
      "outlet": "cafe",
      "date": "2026-01-20",
      "CalendarWeek": "3",
      "day": "Dienstag",
      "mealtime": "Mittagessen",
      "IdentNr": "12026012098006",
      "itemId": "21061",
      "RecipeID": "8697",
      "ProductPrice": "2.50",
      "ProductPrice_2": null,
      "GastDesc_de": "Erdnussbutter-Cookie mit Schokolade und Salzkaramell | Vegan",
      "GastDesc_en": "Peanutbutter Cookie with Chocolate Salty Caramel | Vegan",
      "MenuName": "SEASON",
      "allergene": {
        "gluten": "Glutenhaltiges Getreide",
        "soja": "Soja und Sojaerzeugnisse",
        "erdnuss": "Erdnüsse und Erdnusserzeugnisse"
      },
      "merkmale": "",
      "naehrstoffe": "",
      "zusatzstoffe": [
        {
          "de": "Farbstoff",
          "en": "Colouring Agent"
        },
        {
          "de": "Antioxidationsmittel",
          "en": "Antioxidation"
        },
        {
          "de": "Alkohol",
          "en": "Alcohol"
        }
      ],
      "PrintOrder": "6",
      "CO2Value": null,
      "CO2Rating": null,
      "CO2Perc": null,
      "ClimateFriendly": null,
      "GastDesc": "Erdnussbutter-Cookie mit Schokolade und Salzkaramell | Vegan",
      "date_de": "20.01.2026"
    },
    {
      "id": "5251425",
      "outlet": "cafe",
      "date": "2026-01-20",
      "CalendarWeek": "3",
      "day": "Dienstag",
      "mealtime": "Mittagessen",
      "IdentNr": "12026012098007",
      "itemId": "12776",
      "RecipeID": "8453",
      "ProductPrice": "2.50",
      "ProductPrice_2": null,
      "GastDesc_de": "Oreo-Cheesecake-Cookies",
      "GastDesc_en": "Oreo Cheesecake Cookies",
      "MenuName": "COOKIE",
      "allergene": {
        "gluten": "Glutenhaltiges Getreide",
        "huhnerei": "Hühnerei und Hühnereierzeugnisse",
        "milch": "Milch und Milcherzeugnisse"
      },
      "merkmale": "",
      "naehrstoffe": "",
      "zusatzstoffe": [
        {
          "de": "Farbstoff",
          "en": "Colouring Agent"
        },
        {
          "de": "Alkohol",
          "en": "Alcohol"
        }
      ],
      "PrintOrder": "7",
      "CO2Value": null,
      "CO2Rating": null,
      "CO2Perc": null,
      "ClimateFriendly": null,
      "GastDesc": "Oreo-Cheesecake-Cookies",
      "date_de": "20.01.2026"
    },
    {
      "id": "5251426",
      "outlet": "cafe",
      "date": "2026-01-20",
      "CalendarWeek": "3",
      "day": "Dienstag",
      "mealtime": "Mittagessen",
      "IdentNr": "12026012098008",
      "itemId": "12777",
      "RecipeID": "9121",
      "ProductPrice": "2.50",
      "ProductPrice_2": null,
      "GastDesc_de": "Carrotcake  Bananenbrot | Zuckerfrei",
      "GastDesc_en": "Carrot Cake Banana Bread | Sugar-Free",
      "MenuName": "TAG des KASTENKUCHENS",
      "allergene": {
        "gluten": "Glutenhaltiges Getreide",
        "huhnerei": "Hühnerei und Hühnereierzeugnisse",
        "milch": "Milch und Milcherzeugnisse",
        "schwefel": "Schwefeldioxid und Sulfide"
      },
      "merkmale": "",
      "naehrstoffe": "",
      "zusatzstoffe": [
        {
          "de": "Farbstoff",
          "en": "Colouring Agent"
        }
      ],
      "PrintOrder": "8",
      "CO2Value": null,
      "CO2Rating": null,
      "CO2Perc": null,
      "ClimateFriendly": null,
      "GastDesc": "Carrotcake  Bananenbrot | Zuckerfrei",
      "date_de": "20.01.2026"
    },
    {
      "id": "5251427",
      "outlet": "cafe",
      "date": "2026-01-20",
      "CalendarWeek": "3",
      "day": "Dienstag",
      "mealtime": "Mittagessen",
      "IdentNr": "12026012098011",
      "itemId": "16256",
      "RecipeID": "9122",
      "ProductPrice": "2.50",
      "ProductPrice_2": null,
      "GastDesc_de": "Sesam-Keks | Mehlfrei | Vegan",
      "GastDesc_en": "Sesame Cookie | Flour-Free | Vegan",
      "MenuName": "VEGAN SPECIAL",
      "allergene": {
        "schalenfruchte": "Schalenfrüchte und Schalenfruchterzeugnisse",
        "sesam": "Sesamsamen und Sesamsamenerzeugnisse"
      },
      "merkmale": "",
      "naehrstoffe": "",
      "zusatzstoffe": [
        {
          "de": "Farbstoff",
          "en": "Colouring Agent"
        },
        {
          "de": "Antioxidationsmittel",
          "en": "Antioxidation"
        },
        {
          "de": "Alkohol",
          "en": "Alcohol"
        }
      ],
      "PrintOrder": "11",
      "CO2Value": null,
      "CO2Rating": null,
      "CO2Perc": null,
      "ClimateFriendly": null,
      "GastDesc": "Sesam-Keks | Mehlfrei | Vegan",
      "date_de": "20.01.2026"
    },
    {
      "id": "5251428",
      "outlet": "cafe",
      "date": "2026-01-21",
      "CalendarWeek": "3",
      "day": "Mittwoch",
      "mealtime": "Mittagessen",
      "IdentNr": "12026012198001",
      "itemId": "21059",
      "RecipeID": "8054",
      "ProductPrice": "3.20",
      "ProductPrice_2": null,
      "GastDesc_de": "Pflaumenmus-Croffin mit Vanilleschmand",
      "GastDesc_en": "Plum Jam Croffin with Vanilla Sour Cream",
      "MenuName": "CROFFIN",
      "allergene": {
        "gluten": "Glutenhaltiges Getreide",
        "schalenfruchte": "Schalenfrüchte und Schalenfruchterzeugnisse",
        "huhnerei": "Hühnerei und Hühnereierzeugnisse",
        "soja": "Soja und Sojaerzeugnisse",
        "milch": "Milch und Milcherzeugnisse"
      },
      "merkmale": "",
      "naehrstoffe": "",
      "zusatzstoffe": [
        {
          "de": "Farbstoff",
          "en": "Colouring Agent"
        },
        {
          "de": "Alkohol",
          "en": "Alcohol"
        }
      ],
      "PrintOrder": "1",
      "CO2Value": null,
      "CO2Rating": null,
      "CO2Perc": null,
      "ClimateFriendly": null,
      "GastDesc": "Pflaumenmus-Croffin mit Vanilleschmand",
      "date_de": "21.01.2026"
    },
    {
      "id": "5251429",
      "outlet": "cafe",
      "date": "2026-01-21",
      "CalendarWeek": "3",
      "day": "Mittwoch",
      "mealtime": "Mittagessen",
      "IdentNr": "12026012198002",
      "itemId": "21062",
      "RecipeID": "8871",
      "ProductPrice": "3.60",
      "ProductPrice_2": null,
      "GastDesc_de": "Baskischer Cheesecake mit Johannisbeer-Birnenkompott",
      "GastDesc_en": "Basque-style Cheesecake with Black Currant and Pear Compote",
      "MenuName": "FAVOURITES",
      "allergene": {
        "huhnerei": "Hühnerei und Hühnereierzeugnisse",
        "milch": "Milch und Milcherzeugnisse"
      },
      "merkmale": "",
      "naehrstoffe": "",
      "zusatzstoffe": [
        {
          "de": "Farbstoff",
          "en": "Colouring Agent"
        },
        {
          "de": "Alkohol",
          "en": "Alcohol"
        }
      ],
      "PrintOrder": "2",
      "CO2Value": null,
      "CO2Rating": null,
      "CO2Perc": null,
      "ClimateFriendly": null,
      "GastDesc": "Baskischer Cheesecake mit Johannisbeer-Birnenkompott",
      "date_de": "21.01.2026"
    },
    {
      "id": "5251430",
      "outlet": "cafe",
      "date": "2026-01-21",
      "CalendarWeek": "3",
      "day": "Mittwoch",
      "mealtime": "Mittagessen",
      "IdentNr": "12026012198003",
      "itemId": "21063",
      "RecipeID": "8211",
      "ProductPrice": "0.50",
      "ProductPrice_2": null,
      "GastDesc_de": "LES ARLETTES (Französische Blätterteigkekse) Vegan",
      "GastDesc_en": "LES ARLETTES  (French Puff Pastry Cookies) Vegan",
      "MenuName": "MINIS",
      "allergene": {
        "gluten": "Glutenhaltiges Getreide"
      },
      "merkmale": {
        "vegan": "Vegan",
        "vegetarisch": "Vegetarisch"
      },
      "naehrstoffe": "",
      "zusatzstoffe": [
        {
          "de": "Farbstoff",
          "en": "Colouring Agent"
        },
        {
          "de": "Alkohol",
          "en": "Alcohol"
        }
      ],
      "PrintOrder": "3",
      "CO2Value": null,
      "CO2Rating": null,
      "CO2Perc": null,
      "ClimateFriendly": null,
      "GastDesc": "LES ARLETTES (Französische Blätterteigkekse) Vegan",
      "date_de": "21.01.2026"
    },
    {
      "id": "5251431",
      "outlet": "cafe",
      "date": "2026-01-21",
      "CalendarWeek": "3",
      "day": "Mittwoch",
      "mealtime": "Mittagessen",
      "IdentNr": "12026012198005",
      "itemId": "21064",
      "RecipeID": "8330",
      "ProductPrice": "1.50",
      "ProductPrice_2": null,
      "GastDesc_de": "Saftige Brownie-Bananen-Cookies | Zuckerfrei",
      "GastDesc_en": "Fudgy Brownie Banana Cookies | Sugar-Free",
      "MenuName": "PEOPLES CHOICE",
      "allergene": {
        "erdnuss": "Erdnüsse und Erdnusserzeugnisse"
      },
      "merkmale": {
        "ohne_zucker": "Ohne_Zucker",
        "vegan": "Vegan",
        "vegetarisch": "Vegetarisch"
      },
      "naehrstoffe": "",
      "zusatzstoffe": null,
      "PrintOrder": "5",
      "CO2Value": null,
      "CO2Rating": null,
      "CO2Perc": null,
      "ClimateFriendly": null,
      "GastDesc": "Saftige Brownie-Bananen-Cookies | Zuckerfrei",
      "date_de": "21.01.2026"
    },
    {
      "id": "5251432",
      "outlet": "cafe",
      "date": "2026-01-21",
      "CalendarWeek": "3",
      "day": "Mittwoch",
      "mealtime": "Mittagessen",
      "IdentNr": "12026012198006",
      "itemId": "21061",
      "RecipeID": "8697",
      "ProductPrice": "2.50",
      "ProductPrice_2": null,
      "GastDesc_de": "Erdnussbutter-Cookie mit Schokolade und Salzkaramell | Vegan",
      "GastDesc_en": "Peanutbutter Cookie with Chocolate Salty Caramel | Vegan",
      "MenuName": "SEASON",
      "allergene": {
        "gluten": "Glutenhaltiges Getreide",
        "soja": "Soja und Sojaerzeugnisse",
        "erdnuss": "Erdnüsse und Erdnusserzeugnisse"
      },
      "merkmale": "",
      "naehrstoffe": "",
      "zusatzstoffe": [
        {
          "de": "Farbstoff",
          "en": "Colouring Agent"
        },
        {
          "de": "Antioxidationsmittel",
          "en": "Antioxidation"
        },
        {
          "de": "Alkohol",
          "en": "Alcohol"
        }
      ],
      "PrintOrder": "6",
      "CO2Value": null,
      "CO2Rating": null,
      "CO2Perc": null,
      "ClimateFriendly": null,
      "GastDesc": "Erdnussbutter-Cookie mit Schokolade und Salzkaramell | Vegan",
      "date_de": "21.01.2026"
    },
    {
      "id": "5251433",
      "outlet": "cafe",
      "date": "2026-01-21",
      "CalendarWeek": "3",
      "day": "Mittwoch",
      "mealtime": "Mittagessen",
      "IdentNr": "12026012198007",
      "itemId": "12776",
      "RecipeID": "8453",
      "ProductPrice": "2.50",
      "ProductPrice_2": null,
      "GastDesc_de": "Oreo-Cheesecake-Cookies",
      "GastDesc_en": "Oreo Cheesecake Cookies",
      "MenuName": "COOKIE",
      "allergene": {
        "gluten": "Glutenhaltiges Getreide",
        "huhnerei": "Hühnerei und Hühnereierzeugnisse",
        "milch": "Milch und Milcherzeugnisse"
      },
      "merkmale": "",
      "naehrstoffe": "",
      "zusatzstoffe": [
        {
          "de": "Farbstoff",
          "en": "Colouring Agent"
        },
        {
          "de": "Alkohol",
          "en": "Alcohol"
        }
      ],
      "PrintOrder": "7",
      "CO2Value": null,
      "CO2Rating": null,
      "CO2Perc": null,
      "ClimateFriendly": null,
      "GastDesc": "Oreo-Cheesecake-Cookies",
      "date_de": "21.01.2026"
    },
    {
      "id": "5251434",
      "outlet": "cafe",
      "date": "2026-01-21",
      "CalendarWeek": "3",
      "day": "Mittwoch",
      "mealtime": "Mittagessen",
      "IdentNr": "12026012198008",
      "itemId": "12777",
      "RecipeID": "9121",
      "ProductPrice": "2.50",
      "ProductPrice_2": null,
      "GastDesc_de": "Carrotcake  Bananenbrot | Zuckerfrei",
      "GastDesc_en": "Carrot Cake Banana Bread | Sugar-Free",
      "MenuName": "TAG des KASTENKUCHENS",
      "allergene": {
        "gluten": "Glutenhaltiges Getreide",
        "huhnerei": "Hühnerei und Hühnereierzeugnisse",
        "milch": "Milch und Milcherzeugnisse",
        "schwefel": "Schwefeldioxid und Sulfide"
      },
      "merkmale": "",
      "naehrstoffe": "",
      "zusatzstoffe": [
        {
          "de": "Farbstoff",
          "en": "Colouring Agent"
        }
      ],
      "PrintOrder": "8",
      "CO2Value": null,
      "CO2Rating": null,
      "CO2Perc": null,
      "ClimateFriendly": null,
      "GastDesc": "Carrotcake  Bananenbrot | Zuckerfrei",
      "date_de": "21.01.2026"
    },
    {
      "id": "5251435",
      "outlet": "cafe",
      "date": "2026-01-21",
      "CalendarWeek": "3",
      "day": "Mittwoch",
      "mealtime": "Mittagessen",
      "IdentNr": "12026012198011",
      "itemId": "16256",
      "RecipeID": "9122",
      "ProductPrice": "2.50",
      "ProductPrice_2": null,
      "GastDesc_de": "Sesam-Keks | Mehlfrei | Vegan",
      "GastDesc_en": "Sesame Cookie | Flour-Free | Vegan",
      "MenuName": "VEGAN SPECIAL",
      "allergene": {
        "schalenfruchte": "Schalenfrüchte und Schalenfruchterzeugnisse",
        "sesam": "Sesamsamen und Sesamsamenerzeugnisse"
      },
      "merkmale": "",
      "naehrstoffe": "",
      "zusatzstoffe": [
        {
          "de": "Farbstoff",
          "en": "Colouring Agent"
        },
        {
          "de": "Antioxidationsmittel",
          "en": "Antioxidation"
        },
        {
          "de": "Alkohol",
          "en": "Alcohol"
        }
      ],
      "PrintOrder": "11",
      "CO2Value": null,
      "CO2Rating": null,
      "CO2Perc": null,
      "ClimateFriendly": null,
      "GastDesc": "Sesam-Keks | Mehlfrei | Vegan",
      "date_de": "21.01.2026"
    },
    {
      "id": "5251436",
      "outlet": "cafe",
      "date": "2026-01-22",
      "CalendarWeek": "3",
      "day": "Donnerstag",
      "mealtime": "Mittagessen",
      "IdentNr": "12026012298001",
      "itemId": "21059",
      "RecipeID": "8054",
      "ProductPrice": "3.20",
      "ProductPrice_2": null,
      "GastDesc_de": "Pflaumenmus-Croffin mit Vanilleschmand",
      "GastDesc_en": "Plum Jam Croffin with Vanilla Sour Cream",
      "MenuName": "CROFFIN",
      "allergene": {
        "gluten": "Glutenhaltiges Getreide",
        "schalenfruchte": "Schalenfrüchte und Schalenfruchterzeugnisse",
        "huhnerei": "Hühnerei und Hühnereierzeugnisse",
        "soja": "Soja und Sojaerzeugnisse",
        "milch": "Milch und Milcherzeugnisse"
      },
      "merkmale": "",
      "naehrstoffe": "",
      "zusatzstoffe": [
        {
          "de": "Farbstoff",
          "en": "Colouring Agent"
        },
        {
          "de": "Alkohol",
          "en": "Alcohol"
        }
      ],
      "PrintOrder": "1",
      "CO2Value": null,
      "CO2Rating": null,
      "CO2Perc": null,
      "ClimateFriendly": null,
      "GastDesc": "Pflaumenmus-Croffin mit Vanilleschmand",
      "date_de": "22.01.2026"
    },
    {
      "id": "5251437",
      "outlet": "cafe",
      "date": "2026-01-22",
      "CalendarWeek": "3",
      "day": "Donnerstag",
      "mealtime": "Mittagessen",
      "IdentNr": "12026012298002",
      "itemId": "21062",
      "RecipeID": "8871",
      "ProductPrice": "3.60",
      "ProductPrice_2": null,
      "GastDesc_de": "Baskischer Cheesecake mit Johannisbeer-Birnenkompott",
      "GastDesc_en": "Basque-style Cheesecake with Black Currant and Pear Compote",
      "MenuName": "FAVOURITES",
      "allergene": {
        "huhnerei": "Hühnerei und Hühnereierzeugnisse",
        "milch": "Milch und Milcherzeugnisse"
      },
      "merkmale": "",
      "naehrstoffe": "",
      "zusatzstoffe": [
        {
          "de": "Farbstoff",
          "en": "Colouring Agent"
        },
        {
          "de": "Alkohol",
          "en": "Alcohol"
        }
      ],
      "PrintOrder": "2",
      "CO2Value": null,
      "CO2Rating": null,
      "CO2Perc": null,
      "ClimateFriendly": null,
      "GastDesc": "Baskischer Cheesecake mit Johannisbeer-Birnenkompott",
      "date_de": "22.01.2026"
    },
    {
      "id": "5251438",
      "outlet": "cafe",
      "date": "2026-01-22",
      "CalendarWeek": "3",
      "day": "Donnerstag",
      "mealtime": "Mittagessen",
      "IdentNr": "12026012298003",
      "itemId": "21063",
      "RecipeID": "8211",
      "ProductPrice": "0.50",
      "ProductPrice_2": null,
      "GastDesc_de": "LES ARLETTES (Französische Blätterteigkekse) Vegan",
      "GastDesc_en": "LES ARLETTES  (French Puff Pastry Cookies) Vegan",
      "MenuName": "MINIS",
      "allergene": {
        "gluten": "Glutenhaltiges Getreide"
      },
      "merkmale": {
        "vegan": "Vegan",
        "vegetarisch": "Vegetarisch"
      },
      "naehrstoffe": "",
      "zusatzstoffe": [
        {
          "de": "Farbstoff",
          "en": "Colouring Agent"
        },
        {
          "de": "Alkohol",
          "en": "Alcohol"
        }
      ],
      "PrintOrder": "3",
      "CO2Value": null,
      "CO2Rating": null,
      "CO2Perc": null,
      "ClimateFriendly": null,
      "GastDesc": "LES ARLETTES (Französische Blätterteigkekse) Vegan",
      "date_de": "22.01.2026"
    },
    {
      "id": "5251439",
      "outlet": "cafe",
      "date": "2026-01-22",
      "CalendarWeek": "3",
      "day": "Donnerstag",
      "mealtime": "Mittagessen",
      "IdentNr": "12026012298005",
      "itemId": "21064",
      "RecipeID": "8330",
      "ProductPrice": "1.50",
      "ProductPrice_2": null,
      "GastDesc_de": "Saftige Brownie-Bananen-Cookies | Zuckerfrei",
      "GastDesc_en": "Fudgy Brownie Banana Cookies | Sugar-Free",
      "MenuName": "PEOPLES CHOICE",
      "allergene": {
        "erdnuss": "Erdnüsse und Erdnusserzeugnisse"
      },
      "merkmale": {
        "ohne_zucker": "Ohne_Zucker",
        "vegan": "Vegan",
        "vegetarisch": "Vegetarisch"
      },
      "naehrstoffe": "",
      "zusatzstoffe": null,
      "PrintOrder": "5",
      "CO2Value": null,
      "CO2Rating": null,
      "CO2Perc": null,
      "ClimateFriendly": null,
      "GastDesc": "Saftige Brownie-Bananen-Cookies | Zuckerfrei",
      "date_de": "22.01.2026"
    },
    {
      "id": "5251440",
      "outlet": "cafe",
      "date": "2026-01-22",
      "CalendarWeek": "3",
      "day": "Donnerstag",
      "mealtime": "Mittagessen",
      "IdentNr": "12026012298006",
      "itemId": "21061",
      "RecipeID": "8697",
      "ProductPrice": "2.50",
      "ProductPrice_2": null,
      "GastDesc_de": "Erdnussbutter-Cookie mit Schokolade und Salzkaramell | Vegan",
      "GastDesc_en": "Peanutbutter Cookie with Chocolate Salty Caramel | Vegan",
      "MenuName": "SEASON",
      "allergene": {
        "gluten": "Glutenhaltiges Getreide",
        "soja": "Soja und Sojaerzeugnisse",
        "erdnuss": "Erdnüsse und Erdnusserzeugnisse"
      },
      "merkmale": "",
      "naehrstoffe": "",
      "zusatzstoffe": [
        {
          "de": "Farbstoff",
          "en": "Colouring Agent"
        },
        {
          "de": "Antioxidationsmittel",
          "en": "Antioxidation"
        },
        {
          "de": "Alkohol",
          "en": "Alcohol"
        }
      ],
      "PrintOrder": "6",
      "CO2Value": null,
      "CO2Rating": null,
      "CO2Perc": null,
      "ClimateFriendly": null,
      "GastDesc": "Erdnussbutter-Cookie mit Schokolade und Salzkaramell | Vegan",
      "date_de": "22.01.2026"
    },
    {
      "id": "5251441",
      "outlet": "cafe",
      "date": "2026-01-22",
      "CalendarWeek": "3",
      "day": "Donnerstag",
      "mealtime": "Mittagessen",
      "IdentNr": "12026012298007",
      "itemId": "12776",
      "RecipeID": "8453",
      "ProductPrice": "2.50",
      "ProductPrice_2": null,
      "GastDesc_de": "Oreo-Cheesecake-Cookies",
      "GastDesc_en": "Oreo Cheesecake Cookies",
      "MenuName": "COOKIE",
      "allergene": {
        "gluten": "Glutenhaltiges Getreide",
        "huhnerei": "Hühnerei und Hühnereierzeugnisse",
        "milch": "Milch und Milcherzeugnisse"
      },
      "merkmale": "",
      "naehrstoffe": "",
      "zusatzstoffe": [
        {
          "de": "Farbstoff",
          "en": "Colouring Agent"
        },
        {
          "de": "Alkohol",
          "en": "Alcohol"
        }
      ],
      "PrintOrder": "7",
      "CO2Value": null,
      "CO2Rating": null,
      "CO2Perc": null,
      "ClimateFriendly": null,
      "GastDesc": "Oreo-Cheesecake-Cookies",
      "date_de": "22.01.2026"
    },
    {
      "id": "5251442",
      "outlet": "cafe",
      "date": "2026-01-22",
      "CalendarWeek": "3",
      "day": "Donnerstag",
      "mealtime": "Mittagessen",
      "IdentNr": "12026012298008",
      "itemId": "12777",
      "RecipeID": "9121",
      "ProductPrice": "2.50",
      "ProductPrice_2": null,
      "GastDesc_de": "Carrotcake  Bananenbrot | Zuckerfrei",
      "GastDesc_en": "Carrot Cake Banana Bread | Sugar-Free",
      "MenuName": "TAG des KASTENKUCHENS",
      "allergene": {
        "gluten": "Glutenhaltiges Getreide",
        "huhnerei": "Hühnerei und Hühnereierzeugnisse",
        "milch": "Milch und Milcherzeugnisse",
        "schwefel": "Schwefeldioxid und Sulfide"
      },
      "merkmale": "",
      "naehrstoffe": "",
      "zusatzstoffe": [
        {
          "de": "Farbstoff",
          "en": "Colouring Agent"
        }
      ],
      "PrintOrder": "8",
      "CO2Value": null,
      "CO2Rating": null,
      "CO2Perc": null,
      "ClimateFriendly": null,
      "GastDesc": "Carrotcake  Bananenbrot | Zuckerfrei",
      "date_de": "22.01.2026"
    },
    {
      "id": "5251443",
      "outlet": "cafe",
      "date": "2026-01-22",
      "CalendarWeek": "3",
      "day": "Donnerstag",
      "mealtime": "Mittagessen",
      "IdentNr": "12026012298011",
      "itemId": "16256",
      "RecipeID": "9122",
      "ProductPrice": "2.50",
      "ProductPrice_2": null,
      "GastDesc_de": "Sesam-Keks | Mehlfrei | Vegan",
      "GastDesc_en": "Sesame Cookie | Flour-Free | Vegan",
      "MenuName": "VEGAN SPECIAL",
      "allergene": {
        "schalenfruchte": "Schalenfrüchte und Schalenfruchterzeugnisse",
        "sesam": "Sesamsamen und Sesamsamenerzeugnisse"
      },
      "merkmale": "",
      "naehrstoffe": "",
      "zusatzstoffe": [
        {
          "de": "Farbstoff",
          "en": "Colouring Agent"
        },
        {
          "de": "Antioxidationsmittel",
          "en": "Antioxidation"
        },
        {
          "de": "Alkohol",
          "en": "Alcohol"
        }
      ],
      "PrintOrder": "11",
      "CO2Value": null,
      "CO2Rating": null,
      "CO2Perc": null,
      "ClimateFriendly": null,
      "GastDesc": "Sesam-Keks | Mehlfrei | Vegan",
      "date_de": "22.01.2026"
    },
    {
      "id": "5251444",
