{
  "daySelector": [
    {
      "date": "2026-02-02",
      "day": "Montag",
      "CalendarWeek": "6",
      "date_de": "02.02.2026"
    },
    {
      "date": "2026-02-03",
      "day": "Dienstag",
      "CalendarWeek": "6",
      "date_de": "03.02.2026"
    },
    {
      "date": "2026-02-04",
      "day": "Mittwoch",
      "CalendarWeek": "6",
      "date_de": "04.02.2026"
    },
    {
      "date": "2026-02-05",
      "day": "Donnerstag",
      "CalendarWeek": "6",
      "date_de": "05.02.2026"
    },
    {
      "date": "2026-02-06",
      "day": "Freitag",
      "CalendarWeek": "6",
      "date_de": "06.02.2026"
    },
    {
      "date": "2026-02-07",
      "day": "Samstag",
      "CalendarWeek": "6",
      "date_de": "07.02.2026"
    },
    {
      "date": "2026-02-08",
      "day": "Sonntag",
      "CalendarWeek": "6",
      "date_de": "08.02.2026"
    },
    {
      "date": "2026-02-09",
      "day": "Montag",
      "CalendarWeek": "6",
      "date_de": "09.02.2026"
    },
    {
      "date": "2026-02-10",
      "day": "Dienstag",
      "CalendarWeek": "6",
      "date_de": "10.02.2026"
    },
    {
      "date": "2026-02-11",
      "day": "Mittwoch",
      "CalendarWeek": "6",
      "date_de": "11.02.2026"
    },
    {
      "date": "2026-02-12",
      "day": "Donnerstag",
      "CalendarWeek": "6",
      "date_de": "12.02.2026"
    },
    {
      "date": "2026-02-13",
      "day": "Freitag",
      "CalendarWeek": "6",
      "date_de": "13.02.2026"
    },
    {
      "date": "2026-02-14",
      "day": "Samstag",
      "CalendarWeek": "6",
      "date_de": "14.02.2026"
    },
    {
      "date": "2026-02-15",
      "day": "Sonntag",
      "CalendarWeek": "6",
      "date_de": "15.02.2026"
    },
    {
      "date": "2026-02-16",
      "day": "Montag",
      "CalendarWeek": "6",
      "date_de": "16.02.2026"
    },
    {
      "date": "2026-02-17",
      "day": "Dienstag",
      "CalendarWeek": "6",
      "date_de": "17.02.2026"
    },
    {
      "date": "2026-02-18",
      "day": "Mittwoch",
      "CalendarWeek": "6",
      "date_de": "18.02.2026"
    },
    {
      "date": "2026-02-19",
      "day": "Donnerstag",
      "CalendarWeek": "6",
      "date_de": "19.02.2026"
    },
    {
      "date": "2026-02-20",
      "day": "Freitag",
      "CalendarWeek": "6",
      "date_de": "20.02.2026"
    }
  ],
  "data": [
    {
      "id": "5577286",
      "outlet": "cafe",
      "date": "2026-02-02",
      "CalendarWeek": "6",
      "day": "Montag",
      "mealtime": "Mittagessen",
      "IdentNr": "12026020298001",
      "itemId": "21059",
      "RecipeID": "8054",
      "ProductPrice": "3.20",
      "ProductPrice_2": null,
      "GastDesc_de": "Pflaumenmus-Croffin mit Vanilleschmand",
      "GastDesc_en": "Plum Jam Croffin with Vanilla Sour Cream",
      "MenuName": "CROFFIN",
      "allergene": {
        "gluten": "Glutenhaltiges Getreide",
        "schalenfruchte": "Schalenfrüchte und Schalenfruchterzeugnisse",
        "huhnerei": "Hühnerei und Hühnereierzeugnisse",
        "soja": "Soja und Sojaerzeugnisse",
        "milch": "Milch und Milcherzeugnisse"
      },
      "merkmale": "",
      "naehrstoffe": "",
      "zusatzstoffe": [
        {
          "de": "Farbstoff",
          "en": "Colouring Agent"
        },
        {
          "de": "Alkohol",
          "en": "Alcohol"
        }
      ],
      "PrintOrder": "1",
      "CO2Value": null,
      "CO2Rating": null,
      "CO2Perc": null,
      "ClimateFriendly": null,
      "GastDesc": "Pflaumenmus-Croffin mit Vanilleschmand",
      "date_de": "02.02.2026"
    },
    {
      "id": "5577287",
      "outlet": "cafe",
      "date": "2026-02-02",
      "CalendarWeek": "6",
      "day": "Montag",
      "mealtime": "Mittagessen",
      "IdentNr": "12026020298002",
      "itemId": "21062",
      "RecipeID": "8871",
      "ProductPrice": "3.60",
      "ProductPrice_2": null,
      "GastDesc_de": "Baskischer Cheesecake mit Sauerkirschkompott",
      "GastDesc_en": "Basque-style Cheesecake with Cherry Compote",
      "MenuName": "FAVOURITES",
      "allergene": {
        "huhnerei": "Hühnerei und Hühnereierzeugnisse",
        "milch": "Milch und Milcherzeugnisse"
      },
      "merkmale": "",
      "naehrstoffe": "",
      "zusatzstoffe": [
        {
          "de": "Farbstoff",
          "en": "Colouring Agent"
        },
        {
          "de": "Alkohol",
          "en": "Alcohol"
        }
      ],
      "PrintOrder": "2",
      "CO2Value": null,
      "CO2Rating": null,
      "CO2Perc": null,
      "ClimateFriendly": null,
      "GastDesc": "Baskischer Cheesecake mit Sauerkirschkompott",
      "date_de": "02.02.2026"
    },
    {
      "id": "5577288",
      "outlet": "cafe",
      "date": "2026-02-02",
      "CalendarWeek": "6",
      "day": "Montag",
      "mealtime": "Mittagessen",
      "IdentNr": "12026020298003",
      "itemId": "21063",
      "RecipeID": "8211",
      "ProductPrice": "0.50",
      "ProductPrice_2": null,
      "GastDesc_de": "LES ARLETTES (Französische Blätterteigkekse) Vegan",
      "GastDesc_en": "LES ARLETTES  (French Puff Pastry Cookies) Vegan",
      "MenuName": "MINIS",
      "allergene": {
        "gluten": "Glutenhaltiges Getreide"
      },
      "merkmale": {
        "vegan": "Vegan",
        "vegetarisch": "Vegetarisch"
      },
      "naehrstoffe": "",
      "zusatzstoffe": [
        {
          "de": "Farbstoff",
          "en": "Colouring Agent"
        },
        {
          "de": "Alkohol",
          "en": "Alcohol"
        }
      ],
      "PrintOrder": "3",
      "CO2Value": null,
      "CO2Rating": null,
      "CO2Perc": null,
      "ClimateFriendly": null,
      "GastDesc": "LES ARLETTES (Französische Blätterteigkekse) Vegan",
      "date_de": "02.02.2026"
    },
    {
      "id": "5577289",
      "outlet": "cafe",
      "date": "2026-02-02",
      "CalendarWeek": "6",
      "day": "Montag",
      "mealtime": "Mittagessen",
      "IdentNr": "12026020298005",
      "itemId": "21064",
      "RecipeID": "8330",
      "ProductPrice": "1.50",
      "ProductPrice_2": null,
      "GastDesc_de": "Saftige Brownie-Bananen-Cookies | Zuckerfrei",
      "GastDesc_en": "Fudgy Brownie Banana Cookies | Sugar-Free",
      "MenuName": "PEOPLES CHOICE",
      "allergene": {
        "erdnuss": "Erdnüsse und Erdnusserzeugnisse"
      },
      "merkmale": {
        "ohne_zucker": "Ohne_Zucker",
        "vegan": "Vegan",
        "vegetarisch": "Vegetarisch"
      },
      "naehrstoffe": "",
      "zusatzstoffe": null,
      "PrintOrder": "5",
      "CO2Value": null,
      "CO2Rating": null,
      "CO2Perc": null,
      "ClimateFriendly": null,
      "GastDesc": "Saftige Brownie-Bananen-Cookies | Zuckerfrei",
      "date_de": "02.02.2026"
    },
    {
      "id": "5577290",
      "outlet": "cafe",
      "date": "2026-02-02",
      "CalendarWeek": "6",
      "day": "Montag",
      "mealtime": "Mittagessen",
      "IdentNr": "12026020298006",
      "itemId": "21061",
      "RecipeID": "8697",
      "ProductPrice": "2.50",
      "ProductPrice_2": null,
      "GastDesc_de": "Erdnussbutter-Cookie mit Schokolade und Salzkaramell | Vegan",
      "GastDesc_en": "Peanutbutter Cookie with Chocolate Salty Caramel | Vegan",
      "MenuName": "SEASON",
      "allergene": {
        "gluten": "Glutenhaltiges Getreide",
        "soja": "Soja und Sojaerzeugnisse",
        "erdnuss": "Erdnüsse und Erdnusserzeugnisse"
      },
      "merkmale": "",
      "naehrstoffe": "",
      "zusatzstoffe": [
        {
          "de": "Farbstoff",
          "en": "Colouring Agent"
        },
        {
          "de": "Antioxidationsmittel",
          "en": "Antioxidation"
        },
        {
          "de": "Alkohol",
          "en": "Alcohol"
        }
      ],
      "PrintOrder": "6",
      "CO2Value": null,
      "CO2Rating": null,
      "CO2Perc": null,
      "ClimateFriendly": null,
      "GastDesc": "Erdnussbutter-Cookie mit Schokolade und Salzkaramell | Vegan",
      "date_de": "02.02.2026"
    },
    {
      "id": "5577291",
      "outlet": "cafe",
      "date": "2026-02-02",
      "CalendarWeek": "6",
      "day": "Montag",
      "mealtime": "Mittagessen",
      "IdentNr": "12026020298007",
      "itemId": "12776",
      "RecipeID": "8453",
      "ProductPrice": "2.50",
      "ProductPrice_2": null,
      "GastDesc_de": "Oreo-Cheesecake-Cookies",
      "GastDesc_en": "Oreo Cheesecake Cookies",
      "MenuName": "COOKIE",
      "allergene": {
        "gluten": "Glutenhaltiges Getreide",
        "huhnerei": "Hühnerei und Hühnereierzeugnisse",
        "milch": "Milch und Milcherzeugnisse"
      },
      "merkmale": "",
      "naehrstoffe": "",
      "zusatzstoffe": [
        {
          "de": "Farbstoff",
          "en": "Colouring Agent"
        },
        {
          "de": "Alkohol",
          "en": "Alcohol"
        }
      ],
      "PrintOrder": "7",
      "CO2Value": null,
      "CO2Rating": null,
      "CO2Perc": null,
      "ClimateFriendly": null,
      "GastDesc": "Oreo-Cheesecake-Cookies",
      "date_de": "02.02.2026"
    },
    {
      "id": "5577292",
      "outlet": "cafe",
      "date": "2026-02-02",
      "CalendarWeek": "6",
      "day": "Montag",
      "mealtime": "Mittagessen",
      "IdentNr": "12026020298008",
      "itemId": "12777",
      "RecipeID": "9121",
      "ProductPrice": "2.50",
      "ProductPrice_2": null,
      "GastDesc_de": "Carrotcake  Bananenbrot | Zuckerfrei",
      "GastDesc_en": "Carrot Cake Banana Bread | Sugar-Free",
      "MenuName": "TAG des KASTENKUCHENS",
      "allergene": {
        "gluten": "Glutenhaltiges Getreide",
        "huhnerei": "Hühnerei und Hühnereierzeugnisse",
        "milch": "Milch und Milcherzeugnisse",
        "schwefel": "Schwefeldioxid und Sulfide"
      },
      "merkmale": "",
      "naehrstoffe": "",
      "zusatzstoffe": [
        {
          "de": "Farbstoff",
          "en": "Colouring Agent"
        }
      ],
      "PrintOrder": "8",
      "CO2Value": null,
      "CO2Rating": null,
      "CO2Perc": null,
      "ClimateFriendly": null,
      "GastDesc": "Carrotcake  Bananenbrot | Zuckerfrei",
      "date_de": "02.02.2026"
    },
    {
      "id": "5577293",
      "outlet": "cafe",
      "date": "2026-02-02",
      "CalendarWeek": "6",
      "day": "Montag",
      "mealtime": "Mittagessen",
      "IdentNr": "12026020298011",
      "itemId": "16256",
      "RecipeID": "9122",
      "ProductPrice": "2.50",
      "ProductPrice_2": null,
      "GastDesc_de": "Sesam-Keks | Mehlfrei | Vegan",
      "GastDesc_en": "Sesame Cookie | Flour-Free | Vegan",
      "MenuName": "VEGAN SPECIAL",
      "allergene": {
        "schalenfruchte": "Schalenfrüchte und Schalenfruchterzeugnisse",
        "sesam": "Sesamsamen und Sesamsamenerzeugnisse"
      },
      "merkmale": "",
      "naehrstoffe": "",
      "zusatzstoffe": [
        {
          "de": "Farbstoff",
          "en": "Colouring Agent"
        },
        {
          "de": "Antioxidationsmittel",
          "en": "Antioxidation"
        },
        {
          "de": "Alkohol",
          "en": "Alcohol"
        }
      ],
      "PrintOrder": "11",
      "CO2Value": null,
      "CO2Rating": null,
      "CO2Perc": null,
      "ClimateFriendly": null,
      "GastDesc": "Sesam-Keks | Mehlfrei | Vegan",
      "date_de": "02.02.2026"
    },
    {
      "id": "5600501",
      "outlet": "cafe",
      "date": "2026-02-03",
      "CalendarWeek": "6",
      "day": "Dienstag",
      "mealtime": "Mittagessen",
      "IdentNr": "12026020398001",
      "itemId": "21059",
      "RecipeID": "8054",
      "ProductPrice": "3.20",
      "ProductPrice_2": null,
      "GastDesc_de": "Pflaumenmus-Croffin mit Vanilleschmand",
      "GastDesc_en": "Plum Jam Croffin with Vanilla Sour Cream",
      "MenuName": "CROFFIN",
      "allergene": {
        "gluten": "Glutenhaltiges Getreide",
        "schalenfruchte": "Schalenfrüchte und Schalenfruchterzeugnisse",
        "huhnerei": "Hühnerei und Hühnereierzeugnisse",
        "soja": "Soja und Sojaerzeugnisse",
        "milch": "Milch und Milcherzeugnisse"
      },
      "merkmale": "",
      "naehrstoffe": "",
      "zusatzstoffe": [
        {
          "de": "Farbstoff",
          "en": "Colouring Agent"
        },
        {
          "de": "Alkohol",
          "en": "Alcohol"
        }
      ],
      "PrintOrder": "1",
      "CO2Value": null,
      "CO2Rating": null,
      "CO2Perc": null,
      "ClimateFriendly": null,
      "GastDesc": "Pflaumenmus-Croffin mit Vanilleschmand",
      "date_de": "03.02.2026"
    },
    {
      "id": "5600502",
      "outlet": "cafe",
      "date": "2026-02-03",
      "CalendarWeek": "6",
      "day": "Dienstag",
      "mealtime": "Mittagessen",
      "IdentNr": "12026020398002",
      "itemId": "21062",
      "RecipeID": "8871",
      "ProductPrice": "3.60",
      "ProductPrice_2": null,
      "GastDesc_de": "Baskischer Cheesecake mit Sauerkirschkompott",
      "GastDesc_en": "Basque-style Cheesecake with Cherry Compote",
      "MenuName": "FAVOURITES",
      "allergene": {
        "huhnerei": "Hühnerei und Hühnereierzeugnisse",
        "milch": "Milch und Milcherzeugnisse"
      },
      "merkmale": "",
      "naehrstoffe": "",
      "zusatzstoffe": [
        {
          "de": "Farbstoff",
          "en": "Colouring Agent"
        },
        {
          "de": "Alkohol",
          "en": "Alcohol"
        }
      ],
      "PrintOrder": "2",
      "CO2Value": null,
      "CO2Rating": null,
      "CO2Perc": null,
      "ClimateFriendly": null,
      "GastDesc": "Baskischer Cheesecake mit Sauerkirschkompott",
      "date_de": "03.02.2026"
    },
    {
      "id": "5600503",
      "outlet": "cafe",
      "date": "2026-02-03",
      "CalendarWeek": "6",
      "day": "Dienstag",
      "mealtime": "Mittagessen",
      "IdentNr": "12026020398003",
      "itemId": "21063",
      "RecipeID": "8211",
      "ProductPrice": "0.50",
      "ProductPrice_2": null,
      "GastDesc_de": "LES ARLETTES (Französische Blätterteigkekse) Vegan",
      "GastDesc_en": "LES ARLETTES  (French Puff Pastry Cookies) Vegan",
      "MenuName": "MINIS",
      "allergene": {
        "gluten": "Glutenhaltiges Getreide"
      },
      "merkmale": {
        "vegan": "Vegan",
        "vegetarisch": "Vegetarisch"
      },
      "naehrstoffe": "",
      "zusatzstoffe": [
        {
          "de": "Farbstoff",
          "en": "Colouring Agent"
        },
        {
          "de": "Alkohol",
          "en": "Alcohol"
        }
      ],
      "PrintOrder": "3",
      "CO2Value": null,
      "CO2Rating": null,
      "CO2Perc": null,
      "ClimateFriendly": null,
      "GastDesc": "LES ARLETTES (Französische Blätterteigkekse) Vegan",
      "date_de": "03.02.2026"
    },
    {
      "id": "5600504",
      "outlet": "cafe",
      "date": "2026-02-03",
      "CalendarWeek": "6",
      "day": "Dienstag",
      "mealtime": "Mittagessen",
      "IdentNr": "12026020398005",
      "itemId": "21064",
      "RecipeID": "8330",
      "ProductPrice": "1.50",
      "ProductPrice_2": null,
      "GastDesc_de": "Saftige Brownie-Bananen-Cookies | Zuckerfrei",
      "GastDesc_en": "Fudgy Brownie Banana Cookies | Sugar-Free",
      "MenuName": "PEOPLES CHOICE",
      "allergene": {
        "erdnuss": "Erdnüsse und Erdnusserzeugnisse"
      },
      "merkmale": {
        "ohne_zucker": "Ohne_Zucker",
        "vegan": "Vegan",
        "vegetarisch": "Vegetarisch"
      },
      "naehrstoffe": "",
      "zusatzstoffe": null,
      "PrintOrder": "5",
      "CO2Value": null,
      "CO2Rating": null,
      "CO2Perc": null,
      "ClimateFriendly": null,
      "GastDesc": "Saftige Brownie-Bananen-Cookies | Zuckerfrei",
      "date_de": "03.02.2026"
    },
    {
      "id": "5600505",
      "outlet": "cafe",
      "date": "2026-02-03",
      "CalendarWeek": "6",
      "day": "Dienstag",
      "mealtime": "Mittagessen",
      "IdentNr": "12026020398006",
      "itemId": "21061",
      "RecipeID": "8697",
      "ProductPrice": "2.50",
      "ProductPrice_2": null,
      "GastDesc_de": "Erdnussbutter-Cookie mit Schokolade und Salzkaramell | Vegan",
      "GastDesc_en": "Peanutbutter Cookie with Chocolate Salty Caramel | Vegan",
      "MenuName": "SEASON",
      "allergene": {
        "gluten": "Glutenhaltiges Getreide",
        "soja": "Soja und Sojaerzeugnisse",
        "erdnuss": "Erdnüsse und Erdnusserzeugnisse"
      },
      "merkmale": "",
      "naehrstoffe": "",
      "zusatzstoffe": [
        {
          "de": "Farbstoff",
          "en": "Colouring Agent"
        },
        {
          "de": "Antioxidationsmittel",
          "en": "Antioxidation"
        },
        {
          "de": "Alkohol",
          "en": "Alcohol"
        }
      ],
      "PrintOrder": "6",
      "CO2Value": null,
      "CO2Rating": null,
      "CO2Perc": null,
      "ClimateFriendly": null,
      "GastDesc": "Erdnussbutter-Cookie mit Schokolade und Salzkaramell | Vegan",
      "date_de": "03.02.2026"
    },
    {
      "id": "5600506",
      "outlet": "cafe",
      "date": "2026-02-03",
      "CalendarWeek": "6",
      "day": "Dienstag",
      "mealtime": "Mittagessen",
      "IdentNr": "12026020398007",
      "itemId": "12776",
      "RecipeID": "8453",
      "ProductPrice": "2.50",
      "ProductPrice_2": null,
      "GastDesc_de": "Oreo-Cheesecake-Cookies",
      "GastDesc_en": "Oreo Cheesecake Cookies",
      "MenuName": "COOKIE",
      "allergene": {
        "gluten": "Glutenhaltiges Getreide",
        "huhnerei": "Hühnerei und Hühnereierzeugnisse",
        "milch": "Milch und Milcherzeugnisse"
      },
      "merkmale": "",
      "naehrstoffe": "",
      "zusatzstoffe": [
        {
          "de": "Farbstoff",
          "en": "Colouring Agent"
        },
        {
          "de": "Alkohol",
          "en": "Alcohol"
        }
      ],
      "PrintOrder": "7",
      "CO2Value": null,
      "CO2Rating": null,
      "CO2Perc": null,
      "ClimateFriendly": null,
      "GastDesc": "Oreo-Cheesecake-Cookies",
      "date_de": "03.02.2026"
    },
    {
      "id": "5600507",
      "outlet": "cafe",
      "date": "2026-02-03",
      "CalendarWeek": "6",
      "day": "Dienstag",
      "mealtime": "Mittagessen",
      "IdentNr": "12026020398008",
      "itemId": "12777",
      "RecipeID": "9121",
      "ProductPrice": "2.50",
      "ProductPrice_2": null,
      "GastDesc_de": "Carrotcake  Bananenbrot | Zuckerfrei",
      "GastDesc_en": "Carrot Cake Banana Bread | Sugar-Free",
      "MenuName": "TAG des KASTENKUCHENS",
      "allergene": {
        "gluten": "Glutenhaltiges Getreide",
        "huhnerei": "Hühnerei und Hühnereierzeugnisse",
        "milch": "Milch und Milcherzeugnisse",
        "schwefel": "Schwefeldioxid und Sulfide"
      },
      "merkmale": "",
      "naehrstoffe": "",
      "zusatzstoffe": [
        {
          "de": "Farbstoff",
          "en": "Colouring Agent"
        }
      ],
      "PrintOrder": "8",
      "CO2Value": null,
      "CO2Rating": null,
      "CO2Perc": null,
      "ClimateFriendly": null,
      "GastDesc": "Carrotcake  Bananenbrot | Zuckerfrei",
      "date_de": "03.02.2026"
    },
    {
      "id": "5600508",
      "outlet": "cafe",
      "date": "2026-02-03",
      "CalendarWeek": "6",
      "day": "Dienstag",
      "mealtime": "Mittagessen",
      "IdentNr": "12026020398011",
      "itemId": "16256",
      "RecipeID": "9122",
      "ProductPrice": "2.50",
      "ProductPrice_2": null,
      "GastDesc_de": "Sesam-Keks | Mehlfrei | Vegan",
      "GastDesc_en": "Sesame Cookie | Flour-Free | Vegan",
      "MenuName": "VEGAN SPECIAL",
      "allergene": {
        "schalenfruchte": "Schalenfrüchte und Schalenfruchterzeugnisse",
        "sesam": "Sesamsamen und Sesamsamenerzeugnisse"
      },
      "merkmale": "",
      "naehrstoffe": "",
      "zusatzstoffe": [
        {
          "de": "Farbstoff",
          "en": "Colouring Agent"
        },
        {
          "de": "Antioxidationsmittel",
          "en": "Antioxidation"
        },
        {
          "de": "Alkohol",
          "en": "Alcohol"
        }
      ],
      "PrintOrder": "11",
      "CO2Value": null,
      "CO2Rating": null,
      "CO2Perc": null,
      "ClimateFriendly": null,
      "GastDesc": "Sesam-Keks | Mehlfrei | Vegan",
      "date_de": "03.02.2026"
    },
    {
      "id": "5620706",
      "outlet": "cafe",
      "date": "2026-02-04",
      "CalendarWeek": "6",
      "day": "Mittwoch",
      "mealtime": "Mittagessen",
      "IdentNr": "12026020498001",
      "itemId": "21059",
      "RecipeID": "8054",
      "ProductPrice": "3.20",
      "ProductPrice_2": null,
      "GastDesc_de": "Pflaumenmus-Croffin mit Vanilleschmand",
      "GastDesc_en": "Plum Jam Croffin with Vanilla Sour Cream",
      "MenuName": "CROFFIN",
      "allergene": {
        "gluten": "Glutenhaltiges Getreide",
        "schalenfruchte": "Schalenfrüchte und Schalenfruchterzeugnisse",
        "huhnerei": "Hühnerei und Hühnereierzeugnisse",
        "soja": "Soja und Sojaerzeugnisse",
        "milch": "Milch und Milcherzeugnisse"
      },
      "merkmale": "",
      "naehrstoffe": "",
      "zusatzstoffe": [
        {
          "de": "Farbstoff",
          "en": "Colouring Agent"
        },
        {
          "de": "Alkohol",
          "en": "Alcohol"
        }
      ],
      "PrintOrder": "1",
      "CO2Value": null,
      "CO2Rating": null,
      "CO2Perc": null,
      "ClimateFriendly": null,
      "GastDesc": "Pflaumenmus-Croffin mit Vanilleschmand",
      "date_de": "04.02.2026"
    },
    {
      "id": "5620707",
      "outlet": "cafe",
      "date": "2026-02-04",
      "CalendarWeek": "6",
      "day": "Mittwoch",
      "mealtime": "Mittagessen",
      "IdentNr": "12026020498002",
      "itemId": "21062",
      "RecipeID": "8871",
      "ProductPrice": "3.60",
      "ProductPrice_2": null,
      "GastDesc_de": "Baskischer Cheesecake mit Sauerkirschkompott",
      "GastDesc_en": "Basque-style Cheesecake with Cherry Compote",
      "MenuName": "FAVOURITES",
      "allergene": {
        "huhnerei": "Hühnerei und Hühnereierzeugnisse",
        "milch": "Milch und Milcherzeugnisse"
      },
      "merkmale": "",
      "naehrstoffe": "",
      "zusatzstoffe": [
        {
          "de": "Farbstoff",
          "en": "Colouring Agent"
        },
        {
          "de": "Alkohol",
          "en": "Alcohol"
        }
      ],
      "PrintOrder": "2",
      "CO2Value": null,
      "CO2Rating": null,
      "CO2Perc": null,
      "ClimateFriendly": null,
      "GastDesc": "Baskischer Cheesecake mit Sauerkirschkompott",
      "date_de": "04.02.2026"
    },
    {
      "id": "5620708",
      "outlet": "cafe",
      "date": "2026-02-04",
      "CalendarWeek": "6",
      "day": "Mittwoch",
      "mealtime": "Mittagessen",
      "IdentNr": "12026020498003",
      "itemId": "21063",
      "RecipeID": "8211",
      "ProductPrice": "0.50",
      "ProductPrice_2": null,
      "GastDesc_de": "LES ARLETTES (Französische Blätterteigkekse) Vegan",
      "GastDesc_en": "LES ARLETTES  (French Puff Pastry Cookies) Vegan",
      "MenuName": "MINIS",
      "allergene": {
        "gluten": "Glutenhaltiges Getreide"
      },
      "merkmale": {
        "vegan": "Vegan",
        "vegetarisch": "Vegetarisch"
      },
      "naehrstoffe": "",
      "zusatzstoffe": [
        {
          "de": "Farbstoff",
          "en": "Colouring Agent"
        },
        {
          "de": "Alkohol",
          "en": "Alcohol"
        }
      ],
      "PrintOrder": "3",
      "CO2Value": null,
      "CO2Rating": null,
      "CO2Perc": null,
      "ClimateFriendly": null,
      "GastDesc": "LES ARLETTES (Französische Blätterteigkekse) Vegan",
      "date_de": "04.02.2026"
    },
    {
      "id": "5620709",
      "outlet": "cafe",
      "date": "2026-02-04",
      "CalendarWeek": "6",
      "day": "Mittwoch",
      "mealtime": "Mittagessen",
      "IdentNr": "12026020498005",
      "itemId": "21064",
      "RecipeID": "8330",
      "ProductPrice": "1.50",
      "ProductPrice_2": null,
      "GastDesc_de": "Saftige Brownie-Bananen-Cookies | Zuckerfrei",
      "GastDesc_en": "Fudgy Brownie Banana Cookies | Sugar-Free",
      "MenuName": "PEOPLES CHOICE",
      "allergene": {
        "erdnuss": "Erdnüsse und Erdnusserzeugnisse"
      },
      "merkmale": {
        "ohne_zucker": "Ohne_Zucker",
        "vegan": "Vegan",
        "vegetarisch": "Vegetarisch"
      },
      "naehrstoffe": "",
      "zusatzstoffe": null,
      "PrintOrder": "5",
      "CO2Value": null,
      "CO2Rating": null,
      "CO2Perc": null,
      "ClimateFriendly": null,
      "GastDesc": "Saftige Brownie-Bananen-Cookies | Zuckerfrei",
      "date_de": "04.02.2026"
    },
    {
      "id": "5620710",
      "outlet": "cafe",
      "date": "2026-02-04",
      "CalendarWeek": "6",
      "day": "Mittwoch",
      "mealtime": "Mittagessen",
      "IdentNr": "12026020498006",
      "itemId": "21061",
      "RecipeID": "8697",
      "ProductPrice": "2.50",
      "ProductPrice_2": null,
      "GastDesc_de": "Erdnussbutter-Cookie mit Schokolade und Salzkaramell | Vegan",
      "GastDesc_en": "Peanutbutter Cookie with Chocolate Salty Caramel | Vegan",
      "MenuName": "SEASON",
      "allergene": {
        "gluten": "Glutenhaltiges Getreide",
        "soja": "Soja und Sojaerzeugnisse",
        "erdnuss": "Erdnüsse und Erdnusserzeugnisse"
      },
      "merkmale": "",
      "naehrstoffe": "",
      "zusatzstoffe": [
        {
          "de": "Farbstoff",
          "en": "Colouring Agent"
        },
        {
          "de": "Antioxidationsmittel",
          "en": "Antioxidation"
        },
        {
          "de": "Alkohol",
          "en": "Alcohol"
        }
      ],
      "PrintOrder": "6",
      "CO2Value": null,
      "CO2Rating": null,
      "CO2Perc": null,
      "ClimateFriendly": null,
      "GastDesc": "Erdnussbutter-Cookie mit Schokolade und Salzkaramell | Vegan",
      "date_de": "04.02.2026"
    },
    {
      "id": "5620711",
      "outlet": "cafe",
      "date": "2026-02-04",
      "CalendarWeek": "6",
      "day": "Mittwoch",
      "mealtime": "Mittagessen",
      "IdentNr": "12026020498007",
      "itemId": "12776",
      "RecipeID": "8453",
      "ProductPrice": "2.50",
      "ProductPrice_2": null,
      "GastDesc_de": "Oreo-Cheesecake-Cookies",
      "GastDesc_en": "Oreo Cheesecake Cookies",
      "MenuName": "COOKIE",
      "allergene": {
        "gluten": "Glutenhaltiges Getreide",
        "huhnerei": "Hühnerei und Hühnereierzeugnisse",
        "milch": "Milch und Milcherzeugnisse"
      },
      "merkmale": "",
      "naehrstoffe": "",
      "zusatzstoffe": [
        {
          "de": "Farbstoff",
          "en": "Colouring Agent"
        },
        {
          "de": "Alkohol",
          "en": "Alcohol"
        }
      ],
      "PrintOrder": "7",
      "CO2Value": null,
      "CO2Rating": null,
      "CO2Perc": null,
      "ClimateFriendly": null,
      "GastDesc": "Oreo-Cheesecake-Cookies",
      "date_de": "04.02.2026"
    },
    {
      "id": "5620712",
      "outlet": "cafe",
      "date": "2026-02-04",
      "CalendarWeek": "6",
      "day": "Mittwoch",
      "mealtime": "Mittagessen",
      "IdentNr": "12026020498008",
      "itemId": "12777",
      "RecipeID": "9121",
      "ProductPrice": "2.50",
      "ProductPrice_2": null,
      "GastDesc_de": "Carrotcake  Bananenbrot | Zuckerfrei",
      "GastDesc_en": "Carrot Cake Banana Bread | Sugar-Free",
      "MenuName": "TAG des KASTENKUCHENS",
      "allergene": {
        "gluten": "Glutenhaltiges Getreide",
        "huhnerei": "Hühnerei und Hühnereierzeugnisse",
        "milch": "Milch und Milcherzeugnisse",
        "schwefel": "Schwefeldioxid und Sulfide"
      },
      "merkmale": "",
      "naehrstoffe": "",
      "zusatzstoffe": [
        {
          "de": "Farbstoff",
          "en": "Colouring Agent"
        }
      ],
      "PrintOrder": "8",
      "CO2Value": null,
      "CO2Rating": null,
      "CO2Perc": null,
      "ClimateFriendly": null,
      "GastDesc": "Carrotcake  Bananenbrot | Zuckerfrei",
      "date_de": "04.02.2026"
    },
    {
      "id": "5620713",
      "outlet": "cafe",
      "date": "2026-02-04",
      "CalendarWeek": "6",
      "day": "Mittwoch",
      "mealtime": "Mittagessen",
      "IdentNr": "12026020498011",
      "itemId": "16256",
      "RecipeID": "9122",
      "ProductPrice": "2.50",
      "ProductPrice_2": null,
      "GastDesc_de": "Sesam-Keks | Mehlfrei | Vegan",
      "GastDesc_en": "Sesame Cookie | Flour-Free | Vegan",
      "MenuName": "VEGAN SPECIAL",
      "allergene": {
        "schalenfruchte": "Schalenfrüchte und Schalenfruchterzeugnisse",
        "sesam": "Sesamsamen und Sesamsamenerzeugnisse"
      },
      "merkmale": "",
      "naehrstoffe": "",
      "zusatzstoffe": [
        {
          "de": "Farbstoff",
          "en": "Colouring Agent"
        },
        {
          "de": "Antioxidationsmittel",
          "en": "Antioxidation"
        },
        {
          "de": "Alkohol",
          "en": "Alcohol"
        }
      ],
      "PrintOrder": "11",
      "CO2Value": null,
      "CO2Rating": null,
      "CO2Perc": null,
      "ClimateFriendly": null,
      "GastDesc": "Sesam-Keks | Mehlfrei | Vegan",
      "date_de": "04.02.2026"
    },
    {
      "id": "5639670",
      "outlet": "cafe",
      "date": "2026-02-05",
      "CalendarWeek": "6",
      "day": "Donnerstag",
      "mealtime": "Mittagessen",
      "IdentNr": "12026020598001",
      "itemId": "21059",
      "RecipeID": "8054",
      "ProductPrice": "3.20",
      "ProductPrice_2": null,
      "GastDesc_de": "Pflaumenmus-Croffin mit Vanilleschmand",
      "GastDesc_en": "Plum Jam Croffin with Vanilla Sour Cream",
      "MenuName": "CROFFIN",
      "allergene": {
        "gluten": "Glutenhaltiges Getreide",
        "schalenfruchte": "Schalenfrüchte und Schalenfruchterzeugnisse",
        "huhnerei": "Hühnerei und Hühnereierzeugnisse",
        "soja": "Soja und Sojaerzeugnisse",
        "milch": "Milch und Milcherzeugnisse"
      },
      "merkmale": "",
      "naehrstoffe": "",
      "zusatzstoffe": [
        {
          "de": "Farbstoff",
          "en": "Colouring Agent"
        },
        {
          "de": "Alkohol",
          "en": "Alcohol"
        }
      ],
      "PrintOrder": "1",
      "CO2Value": null,
      "CO2Rating": null,
      "CO2Perc": null,
      "ClimateFriendly": null,
      "GastDesc": "Pflaumenmus-Croffin mit Vanilleschmand",
      "date_de": "05.02.2026"
    },
    {
      "id": "5639671",
      "outlet": "cafe",
      "date": "2026-02-05",
      "CalendarWeek": "6",
      "day": "Donnerstag",
      "mealtime": "Mittagessen",
      "IdentNr": "12026020598002",
      "itemId": "21062",
      "RecipeID": "8871",
      "ProductPrice": "3.60",
      "ProductPrice_2": null,
      "GastDesc_de": "Baskischer Cheesecake mit Sauerkirschkompott",
      "GastDesc_en": "Basque-style Cheesecake with Cherry Compote",
      "MenuName": "FAVOURITES",
      "allergene": {
        "huhnerei": "Hühnerei und Hühnereierzeugnisse",
        "milch": "Milch und Milcherzeugnisse"
      },
      "merkmale": "",
      "naehrstoffe": "",
      "zusatzstoffe": [
        {
          "de": "Farbstoff",
          "en": "Colouring Agent"
        },
        {
          "de": "Alkohol",
          "en": "Alcohol"
        }
      ],
      "PrintOrder": "2",
      "CO2Value": null,
      "CO2Rating": null,
      "CO2Perc": null,
      "ClimateFriendly": null,
      "GastDesc": "Baskischer Cheesecake mit Sauerkirschkompott",
      "date_de": "05.02.2026"
    },
    {
      "id": "5639672",
      "outlet": "cafe",
      "date": "2026-02-05",
      "CalendarWeek": "6",
      "day": "Donnerstag",
      "mealtime": "Mittagessen",
      "IdentNr": "12026020598003",
      "itemId": "21063",
      "RecipeID": "8211",
      "ProductPrice": "0.50",
      "ProductPrice_2": null,
      "GastDesc_de": "LES ARLETTES (Französische Blätterteigkekse) Vegan",
      "GastDesc_en": "LES ARLETTES  (French Puff Pastry Cookies) Vegan",
      "MenuName": "MINIS",
      "allergene": {
        "gluten": "Glutenhaltiges Getreide"
      },
      "merkmale": {
        "vegan": "Vegan",
        "vegetarisch": "Vegetarisch"
      },
      "naehrstoffe": "",
      "zusatzstoffe": [
        {
          "de": "Farbstoff",
          "en": "Colouring Agent"
        },
        {
          "de": "Alkohol",
          "en": "Alcohol"
        }
      ],
      "PrintOrder": "3",
      "CO2Value": null,
      "CO2Rating": null,
      "CO2Perc": null,
      "ClimateFriendly": null,
      "GastDesc": "LES ARLETTES (Französische Blätterteigkekse) Vegan",
      "date_de": "05.02.2026"
    },
    {
      "id": "5639673",
      "outlet": "cafe",
      "date": "2026-02-05",
      "CalendarWeek": "6",
      "day": "Donnerstag",
      "mealtime": "Mittagessen",
      "IdentNr": "12026020598005",
      "itemId": "21064",
      "RecipeID": "8330",
      "ProductPrice": "1.50",
      "ProductPrice_2": null,
      "GastDesc_de": "Saftige Brownie-Bananen-Cookies | Zuckerfrei",
      "GastDesc_en": "Fudgy Brownie Banana Cookies | Sugar-Free",
      "MenuName": "PEOPLES CHOICE",
      "allergene": {
        "erdnuss": "Erdnüsse und Erdnusserzeugnisse"
      },
      "merkmale": {
        "ohne_zucker": "Ohne_Zucker",
        "vegan": "Vegan",
        "vegetarisch": "Vegetarisch"
      },
      "naehrstoffe": "",
      "zusatzstoffe": null,
      "PrintOrder": "5",
      "CO2Value": null,
      "CO2Rating": null,
      "CO2Perc": null,
      "ClimateFriendly": null,
      "GastDesc": "Saftige Brownie-Bananen-Cookies | Zuckerfrei",
      "date_de": "05.02.2026"
    },
    {
      "id": "5639674",
      "outlet": "cafe",
      "date": "2026-02-05",
      "CalendarWeek": "6",
      "day": "Donnerstag",
      "mealtime": "Mittagessen",
      "IdentNr": "12026020598006",
      "itemId": "21061",
      "RecipeID": "8697",
      "ProductPrice": "2.50",
      "ProductPrice_2": null,
      "GastDesc_de": "Erdnussbutter-Cookie mit Schokolade und Salzkaramell | Vegan",
      "GastDesc_en": "Peanutbutter Cookie with Chocolate Salty Caramel | Vegan",
      "MenuName": "SEASON",
      "allergene": {
        "gluten": "Glutenhaltiges Getreide",
        "soja": "Soja und Sojaerzeugnisse",
        "erdnuss": "Erdnüsse und Erdnusserzeugnisse"
      },
      "merkmale": "",
      "naehrstoffe": "",
      "zusatzstoffe": [
        {
          "de": "Farbstoff",
          "en": "Colouring Agent"
        },
        {
          "de": "Antioxidationsmittel",
          "en": "Antioxidation"
        },
        {
          "de": "Alkohol",
          "en": "Alcohol"
        }
      ],
      "PrintOrder": "6",
      "CO2Value": null,
      "CO2Rating": null,
      "CO2Perc": null,
      "ClimateFriendly": null,
      "GastDesc": "Erdnussbutter-Cookie mit Schokolade und Salzkaramell | Vegan",
      "date_de": "05.02.2026"
    },
    {
      "id": "5639675",
      "outlet": "cafe",
      "date": "2026-02-05",
      "CalendarWeek": "6",
      "day": "Donnerstag",
      "mealtime": "Mittagessen",
      "IdentNr": "12026020598007",
      "itemId": "12776",
      "RecipeID": "8453",
      "ProductPrice": "2.50",
      "ProductPrice_2": null,
      "GastDesc_de": "Oreo-Cheesecake-Cookies",
      "GastDesc_en": "Oreo Cheesecake Cookies",
      "MenuName": "COOKIE",
      "allergene": {
        "gluten": "Glutenhaltiges Getreide",
        "huhnerei": "Hühnerei und Hühnereierzeugnisse",
        "milch": "Milch und Milcherzeugnisse"
      },
      "merkmale": "",
      "naehrstoffe": "",
      "zusatzstoffe": [
        {
          "de": "Farbstoff",
          "en": "Colouring Agent"
        },
        {
          "de": "Alkohol",
          "en": "Alcohol"
        }
      ],
      "PrintOrder": "7",
      "CO2Value": null,
      "CO2Rating": null,
      "CO2Perc": null,
      "ClimateFriendly": null,
      "GastDesc": "Oreo-Cheesecake-Cookies",
      "date_de": "05.02.2026"
    },
    {
      "id": "5639676",
      "outlet": "cafe",
      "date": "2026-02-05",
      "CalendarWeek": "6",
      "day": "Donnerstag",
      "mealtime": "Mittagessen",
      "IdentNr": "12026020598008",
      "itemId": "12777",
      "RecipeID": "9121",
      "ProductPrice": "2.50",
      "ProductPrice_2": null,
      "GastDesc_de": "Carrotcake  Bananenbrot | Zuckerfrei",
      "GastDesc_en": "Carrot Cake Banana Bread | Sugar-Free",
      "MenuName": "TAG des KASTENKUCHENS",
      "allergene": {
        "gluten": "Glutenhaltiges Getreide",
        "huhnerei": "Hühnerei und Hühnereierzeugnisse",
        "milch": "Milch und Milcherzeugnisse",
        "schwefel": "Schwefeldioxid und Sulfide"
      },
      "merkmale": "",
      "naehrstoffe": "",
      "zusatzstoffe": [
        {
          "de": "Farbstoff",
          "en": "Colouring Agent"
        }
      ],
      "PrintOrder": "8",
      "CO2Value": null,
      "CO2Rating": null,
      "CO2Perc": null,
      "ClimateFriendly": null,
      "GastDesc": "Carrotcake  Bananenbrot | Zuckerfrei",
      "date_de": "05.02.2026"
    },
    {
      "id": "5639677",
      "outlet": "cafe",
      "date": "2026-02-05",
      "CalendarWeek": "6",
      "day": "Donnerstag",
      "mealtime": "Mittagessen",
      "IdentNr": "12026020598011",
      "itemId": "16256",
      "RecipeID": "9122",
      "ProductPrice": "2.50",
      "ProductPrice_2": null,
      "GastDesc_de": "Sesam-Keks | Mehlfrei | Vegan",
      "GastDesc_en": "Sesame Cookie | Flour-Free | Vegan",
      "MenuName": "VEGAN SPECIAL",
      "allergene": {
        "schalenfruchte": "Schalenfrüchte und Schalenfruchterzeugnisse",
        "sesam": "Sesamsamen und Sesamsamenerzeugnisse"
      },
      "merkmale": "",
      "naehrstoffe": "",
      "zusatzstoffe": [
        {
          "de": "Farbstoff",
          "en": "Colouring Agent"
        },
        {
          "de": "Antioxidationsmittel",
          "en": "Antioxidation"
        },
        {
          "de": "Alkohol",
          "en": "Alcohol"
        }
      ],
      "PrintOrder": "11",
      "CO2Value": null,
      "CO2Rating": null,
      "CO2Perc": null,
      "ClimateFriendly": null,
      "GastDesc": "Sesam-Keks | Mehlfrei | Vegan",
      "date_de": "05.02.2026"
    },
    {
      "id": "5662522",
      "outlet": "cafe",
      "date": "2026-02-06",
      "CalendarWeek": "6",
      "day": "Freitag",
      "mealtime": "Mittagessen",
      "IdentNr": "12026020698002",
      "itemId": "21062",
      "RecipeID": "8871",
      "ProductPrice": "3.60",
      "ProductPrice_2": null,
      "GastDesc_de": "Baskischer Cheesecake mit Sauerkirschkompott",
      "GastDesc_en": "Basque-style Cheesecake with Cherry Compote",
      "MenuName": "FAVOURITES",
      "allergene": {
        "huhnerei": "Hühnerei und Hühnereierzeugnisse",
        "milch": "Milch und Milcherzeugnisse"
      },
      "merkmale": "",
      "naehrstoffe": "",
      "zusatzstoffe": [
        {
          "de": "Farbstoff",
          "en": "Colouring Agent"
        },
        {
          "de": "Alkohol",
          "en": "Alcohol"
        }
      ],
      "PrintOrder": "2",
      "CO2Value": null,
      "CO2Rating": null,
      "CO2Perc": null,
      "ClimateFriendly": null,
      "GastDesc": "Baskischer Cheesecake mit Sauerkirschkompott",
      "date_de": "06.02.2026"
    },
    {
      "id": "5662523",
      "outlet": "cafe",
      "date": "2026-02-06",
      "CalendarWeek": "6",
      "day": "Freitag",
      "mealtime": "Mittagessen",
      "IdentNr": "12026020698003",
      "itemId": "21063",
      "RecipeID": "8211",
      "ProductPrice": "0.50",
      "ProductPrice_2": null,
      "GastDesc_de": "LES ARLETTES (Französische Blätterteigkekse) Vegan",
      "GastDesc_en": "LES ARLETTES  (French Puff Pastry Cookies) Vegan",
      "MenuName": "MINIS",
      "allergene": {
        "gluten": "Glutenhaltiges Getreide"
      },
      "merkmale": {
        "vegan": "Vegan",
        "vegetarisch": "Vegetarisch"
      },
      "naehrstoffe": "",
      "zusatzstoffe": [
        {
          "de": "Farbstoff",
          "en": "Colouring Agent"
        },
        {
          "de": "Alkohol",
          "en": "Alcohol"
        }
      ],
      "PrintOrder": "3",
      "CO2Value": null,
      "CO2Rating": null,
      "CO2Perc": null,
      "ClimateFriendly": null,
      "GastDesc": "LES ARLETTES (Französische Blätterteigkekse) Vegan",
      "date_de": "06.02.2026"
    },
    {
      "id": "5662524",
      "outlet": "cafe",
      "date": "2026-02-06",
      "CalendarWeek": "6",
      "day": "Freitag",
      "mealtime": "Mittagessen",
      "IdentNr": "12026020698005",
      "itemId": "21064",
      "RecipeID": "8330",
      "ProductPrice": "1.50",
      "ProductPrice_2": null,
      "GastDesc_de": "Saftige Brownie-Bananen-Cookies | Zuckerfrei",
      "GastDesc_en": "Fudgy Brownie Banana Cookies | Sugar-Free",
      "MenuName": "PEOPLES CHOICE",
      "allergene": {
        "erdnuss": "Erdnüsse und Erdnusserzeugnisse"
      },
      "merkmale": {
        "ohne_zucker": "Ohne_Zucker",
        "vegan": "Vegan",
        "vegetarisch": "Vegetarisch"
      },
      "naehrstoffe": "",
      "zusatzstoffe": null,
      "PrintOrder": "5",
      "CO2Value": null,
      "CO2Rating": null,
      "CO2Perc": null,
      "ClimateFriendly": null,
      "GastDesc": "Saftige Brownie-Bananen-Cookies | Zuckerfrei",
      "date_de": "06.02.2026"
    },
    {
      "id": "5662525",
      "outlet": "cafe",
      "date": "2026-02-06",
      "CalendarWeek": "6",
      "day": "Freitag",
      "mealtime": "Mittagessen",
      "IdentNr": "12026020698006",
      "itemId": "21061",
      "RecipeID": "8697",
      "ProductPrice": "2.50",
      "ProductPrice_2": null,
      "GastDesc_de": "Erdnussbutter-Cookie mit Schokolade und Salzkaramell | Vegan",
      "GastDesc_en": "Peanutbutter Cookie with Chocolate Salty Caramel | Vegan",
      "MenuName": "SEASON",
      "allergene": {
        "gluten": "Glutenhaltiges Getreide",
        "soja": "Soja und Sojaerzeugnisse",
        "erdnuss": "Erdnüsse und Erdnusserzeugnisse"
      },
      "merkmale": "",
      "naehrstoffe": "",
      "zusatzstoffe": [
        {
          "de": "Farbstoff",
          "en": "Colouring Agent"
        },
        {
          "de": "Antioxidationsmittel",
          "en": "Antioxidation"
        },
        {
          "de": "Alkohol",
          "en": "Alcohol"
        }
      ],
      "PrintOrder": "6",
      "CO2Value": null,
      "CO2Rating": null,
      "CO2Perc": null,
      "ClimateFriendly": null,
      "GastDesc": "Erdnussbutter-Cookie mit Schokolade und Salzkaramell | Vegan",
      "date_de": "06.02.2026"
    },
    {
      "id": "5662526",
      "outlet": "cafe",
      "date": "2026-02-06",
      "CalendarWeek": "6",
      "day": "Freitag",
      "mealtime": "Mittagessen",
      "IdentNr": "12026020698007",
      "itemId": "12776",
      "RecipeID": "8453",
      "ProductPrice": "2.50",
      "ProductPrice_2": null,
      "GastDesc_de": "Oreo-Cheesecake-Cookies",
      "GastDesc_en": "Oreo Cheesecake Cookies",
      "MenuName": "COOKIE",
      "allergene": {
        "gluten": "Glutenhaltiges Getreide",
        "huhnerei": "Hühnerei und Hühnereierzeugnisse",
        "milch": "Milch und Milcherzeugnisse"
      },
      "merkmale": "",
      "naehrstoffe": "",
      "zusatzstoffe": [
        {
          "de": "Farbstoff",
          "en": "Colouring Agent"
        },
        {
          "de": "Alkohol",
          "en": "Alcohol"
        }
      ],
      "PrintOrder": "7",
      "CO2Value": null,
      "CO2Rating": null,
      "CO2Perc": null,
      "ClimateFriendly": null,
      "GastDesc": "Oreo-Cheesecake-Cookies",
      "date_de": "06.02.2026"
    },
    {
      "id": "5662527",
      "outlet": "cafe",
      "date": "2026-02-06",
      "CalendarWeek": "6",
      "day": "Freitag",
      "mealtime": "Mittagessen",
      "IdentNr": "12026020698008",
      "itemId": "12777",
      "RecipeID": "9121",
      "ProductPrice": "2.50",
      "ProductPrice_2": null,
      "GastDesc_de": "Carrotcake  Bananenbrot | Zuckerfrei",
      "GastDesc_en": "Carrot Cake Banana Bread | Sugar-Free",
      "MenuName": "TAG des KASTENKUCHENS",
      "allergene": {
        "gluten": "Glutenhaltiges Getreide",
        "huhnerei": "Hühnerei und Hühnereierzeugnisse",
        "milch": "Milch und Milcherzeugnisse",
        "schwefel": "Schwefeldioxid und Sulfide"
      },
      "merkmale": "",
      "naehrstoffe": "",
      "zusatzstoffe": [
        {
          "de": "Farbstoff",
          "en": "Colouring Agent"
        }
      ],
      "PrintOrder": "8",
      "CO2Value": null,
      "CO2Rating": null,
      "CO2Perc": null,
      "ClimateFriendly": null,
      "GastDesc": "Carrotcake  Bananenbrot | Zuckerfrei",
      "date_de": "06.02.2026"
    },
    {
      "id": "5662528",
      "outlet": "cafe",
      "date": "2026-02-06",
      "CalendarWeek": "6",
      "day": "Freitag",
      "mealtime": "Mittagessen",
      "IdentNr": "12026020698011",
      "itemId": "16256",
      "RecipeID": "9122",
      "ProductPrice": "2.50",
      "ProductPrice_2": null,
      "GastDesc_de": "Sesam-Keks | Mehlfrei | Vegan",
      "GastDesc_en": "Sesame Cookie | Flour-Free | Vegan",
      "MenuName": "VEGAN SPECIAL",
      "allergene": {
        "schalenfruchte": "Schalenfrüchte und Schalenfruchterzeugnisse",
        "sesam": "Sesamsamen und Sesamsamenerzeugnisse"
      },
      "merkmale": "",
      "naehrstoffe": "",
      "zusatzstoffe": [
        {
          "de": "Farbstoff",
          "en": "Colouring Agent"
        },
        {
          "de": "Antioxidationsmittel",
          "en": "Antioxidation"
        },
        {
          "de": "Alkohol",
          "en": "Alcohol"
        }
      ],
      "PrintOrder": "11",
      "CO2Value": null,
      "CO2Rating": null,
      "CO2Perc": null,
      "ClimateFriendly": null,
      "GastDesc": "Sesam-Keks | Mehlfrei | Vegan",
      "date_de": "06.02.2026"
    },
    {
      "id": "5662529",
      "outlet": "cafe",
      "date": "2026-02-09",
      "CalendarWeek": "6",
      "day": "Montag",
      "mealtime": "Mittagessen",
      "IdentNr": "12026020998001",
      "itemId": "21059",
      "RecipeID": "8054",
      "ProductPrice": "3.20",
      "ProductPrice_2": null,
      "GastDesc_de": "Pflaumenmus-Croffin mit Vanilleschmand",
      "GastDesc_en": "Plum Jam Croffin with Vanilla Sour Cream",
      "MenuName": "CROFFIN",
      "allergene": {
        "gluten": "Glutenhaltiges Getreide",
        "schalenfruchte": "Schalenfrüchte und Schalenfruchterzeugnisse",
        "huhnerei": "Hühnerei und Hühnereierzeugnisse",
        "soja": "Soja und Sojaerzeugnisse",
        "milch": "Milch und Milcherzeugnisse"
      },
      "merkmale": "",
      "naehrstoffe": "",
      "zusatzstoffe": [
        {
          "de": "Farbstoff",
          "en": "Colouring Agent"
        },
        {
          "de": "Alkohol",
          "en": "Alcohol"
        }
      ],
      "PrintOrder": "1",
      "CO2Value": null,
      "CO2Rating": null,
      "CO2Perc": null,
      "ClimateFriendly": null,
      "GastDesc": "Pflaumenmus-Croffin mit Vanilleschmand",
      "date_de": "09.02.2026"
    },
    {
      "id": "5662530",
      "outlet": "cafe",
      "date": "2026-02-09",
      "CalendarWeek": "6",
      "day": "Montag",
      "mealtime": "Mittagessen",
      "IdentNr": "12026020998002",
      "itemId": "21062",
      "RecipeID": "8871",
      "ProductPrice": "3.60",
      "ProductPrice_2": null,
      "GastDesc_de": "Baskischer Cheesecake mit Marillenkompott",
      "GastDesc_en": "Basque-style Cheesecake with Apricot Compote",
      "MenuName": "FAVOURITES",
      "allergene": {
        "huhnerei": "Hühnerei und Hühnereierzeugnisse",
        "milch": "Milch und Milcherzeugnisse"
      },
      "merkmale": "",
      "naehrstoffe": "",
      "zusatzstoffe": [
        {
          "de": "Farbstoff",
          "en": "Colouring Agent"
        },
        {
          "de": "Alkohol",
          "en": "Alcohol"
        }
      ],
      "PrintOrder": "2",
      "CO2Value": null,
      "CO2Rating": null,
      "CO2Perc": null,
      "ClimateFriendly": null,
      "GastDesc": "Baskischer Cheesecake mit Marillenkompott",
      "date_de": "09.02.2026"
    },
    {
      "id": "5662531",
      "outlet": "cafe",
      "date": "2026-02-09",
      "CalendarWeek": "6",
      "day": "Montag",
      "mealtime": "Mittagessen",
      "IdentNr": "12026020998003",
      "itemId": "21063",
      "RecipeID": "8211",
      "ProductPrice": "0.50",
      "ProductPrice_2": null,
      "GastDesc_de": "LES ARLETTES (Französische Blätterteigkekse) Vegan",
      "GastDesc_en": "LES ARLETTES  (French Puff Pastry Cookies) Vegan",
      "MenuName": "MINIS",
      "allergene": {
        "gluten": "Glutenhaltiges Getreide"
      },
      "merkmale": {
        "vegan": "Vegan",
        "vegetarisch": "Vegetarisch"
      },
      "naehrstoffe": "",
      "zusatzstoffe": [
        {
          "de": "Farbstoff",
          "en": "Colouring Agent"
        },
        {
          "de": "Alkohol",
          "en": "Alcohol"
        }
      ],
      "PrintOrder": "3",
      "CO2Value": null,
      "CO2Rating": null,
      "CO2Perc": null,
      "ClimateFriendly": null,
      "GastDesc": "LES ARLETTES (Französische Blätterteigkekse) Vegan",
      "date_de": "09.02.2026"
    },
    {
      "id": "5662532",
      "outlet": "cafe",
      "date": "2026-02-09",
      "CalendarWeek": "6",
      "day": "Montag",
      "mealtime": "Mittagessen",
      "IdentNr": "12026020998005",
      "itemId": "21064",
      "RecipeID": "8330",
      "ProductPrice": "1.50",
      "ProductPrice_2": null,
      "GastDesc_de": "Saftige Brownie-Bananen-Cookies | Zuckerfrei",
      "GastDesc_en": "Fudgy Brownie Banana Cookies | Sugar-Free",
      "MenuName": "PEOPLES CHOICE",
      "allergene": {
        "erdnuss": "Erdnüsse und Erdnusserzeugnisse"
      },
      "merkmale": {
        "ohne_zucker": "Ohne_Zucker",
        "vegan": "Vegan",
        "vegetarisch": "Vegetarisch"
      },
      "naehrstoffe": "",
      "zusatzstoffe": null,
      "PrintOrder": "5",
      "CO2Value": null,
      "CO2Rating": null,
      "CO2Perc": null,
      "ClimateFriendly": null,
      "GastDesc": "Saftige Brownie-Bananen-Cookies | Zuckerfrei",
      "date_de": "09.02.2026"
    },
    {
      "id": "5662533",
      "outlet": "cafe",
      "date": "2026-02-09",
      "CalendarWeek": "6",
      "day": "Montag",
      "mealtime": "Mittagessen",
      "IdentNr": "12026020998006",
      "itemId": "21061",
      "RecipeID": "8697",
      "ProductPrice": "2.50",
      "ProductPrice_2": null,
      "GastDesc_de": "Erdnussbutter-Cookie mit Schokolade und Salzkaramell | Vegan",
      "GastDesc_en": "Peanutbutter Cookie with Chocolate Salty Caramel | Vegan",
      "MenuName": "SEASON",
      "allergene": {
        "gluten": "Glutenhaltiges Getreide",
        "soja": "Soja und Sojaerzeugnisse",
        "erdnuss": "Erdnüsse und Erdnusserzeugnisse"
      },
      "merkmale": "",
      "naehrstoffe": "",
      "zusatzstoffe": [
        {
          "de": "Farbstoff",
          "en": "Colouring Agent"
        },
        {
          "de": "Antioxidationsmittel",
          "en": "Antioxidation"
        },
        {
          "de": "Alkohol",
          "en": "Alcohol"
        }
      ],
      "PrintOrder": "6",
      "CO2Value": null,
      "CO2Rating": null,
      "CO2Perc": null,
      "ClimateFriendly": null,
      "GastDesc": "Erdnussbutter-Cookie mit Schokolade und Salzkaramell | Vegan",
      "date_de": "09.02.2026"
    },
    {
      "id": "5662534",
      "outlet": "cafe",
      "date": "2026-02-09",
      "CalendarWeek": "6",
      "day": "Montag",
      "mealtime": "Mittagessen",
      "IdentNr": "12026020998007",
      "itemId": "12776",
      "RecipeID": "8453",
      "ProductPrice": "2.50",
      "ProductPrice_2": null,
      "GastDesc_de": "Oreo-Cheesecake-Cookies",
      "GastDesc_en": "Oreo Cheesecake Cookies",
      "MenuName": "COOKIE",
      "allergene": {
        "gluten": "Glutenhaltiges Getreide",
        "huhnerei": "Hühnerei und Hühnereierzeugnisse",
        "milch": "Milch und Milcherzeugnisse"
      },
      "merkmale": "",
      "naehrstoffe": "",
      "zusatzstoffe": [
        {
          "de": "Farbstoff",
          "en": "Colouring Agent"
        },
        {
          "de": "Alkohol",
          "en": "Alcohol"
        }
      ],
      "PrintOrder": "7",
      "CO2Value": null,
      "CO2Rating": null,
      "CO2Perc": null,
      "ClimateFriendly": null,
      "GastDesc": "Oreo-Cheesecake-Cookies",
      "date_de": "09.02.2026"
    },
    {
      "id": "5662535",
      "outlet": "cafe",
      "date": "2026-02-09",
      "CalendarWeek": "6",
      "day": "Montag",
      "mealtime": "Mittagessen",
      "IdentNr": "12026020998008",
      "itemId": "12777",
      "RecipeID": "9121",
      "ProductPrice": "2.50",
      "ProductPrice_2": null,
      "GastDesc_de": "Carrotcake  Bananenbrot | Zuckerfrei",
      "GastDesc_en": "Carrot Cake Banana Bread | Sugar-Free",
      "MenuName": "TAG des KASTENKUCHENS",
      "allergene": {
        "gluten": "Glutenhaltiges Getreide",
        "huhnerei": "Hühnerei und Hühnereierzeugnisse",
        "milch": "Milch und Milcherzeugnisse",
        "schwefel": "Schwefeldioxid und Sulfide"
      },
      "merkmale": "",
      "naehrstoffe": "",
      "zusatzstoffe": [
        {
          "de": "Farbstoff",
          "en": "Colouring Agent"
        }
      ],
      "PrintOrder": "8",
      "CO2Value": null,
      "CO2Rating": null,
      "CO2Perc": null,
      "ClimateFriendly": null,
      "GastDesc": "Carrotcake  Bananenbrot | Zuckerfrei",
      "date_de": "09.02.2026"
    },
    {
      "id": "5662536",
      "outlet": "cafe",
      "date": "2026-02-09",
      "CalendarWeek": "6",
      "day": "Montag",
      "mealtime": "Mittagessen",
      "IdentNr": "12026020998011",
      "itemId": "16256",
      "RecipeID": "9122",
      "ProductPrice": "2.50",
      "ProductPrice_2": null,
      "GastDesc_de": "Sesam-Keks | Mehlfrei | Vegan",
      "GastDesc_en": "Sesame Cookie | Flour-Free | Vegan",
      "MenuName": "VEGAN SPECIAL",
      "allergene": {
        "schalenfruchte": "Schalenfrüchte und Schalenfruchterzeugnisse",
        "sesam": "Sesamsamen und Sesamsamenerzeugnisse"
      },
      "merkmale": "",
      "naehrstoffe": "",
      "zusatzstoffe": [
        {
          "de": "Farbstoff",
          "en": "Colouring Agent"
        },
        {
          "de": "Antioxidationsmittel",
          "en": "Antioxidation"
        },
        {
          "de": "Alkohol",
          "en": "Alcohol"
        }
      ],
      "PrintOrder": "11",
      "CO2Value": null,
      "CO2Rating": null,
      "CO2Perc": null,
      "ClimateFriendly": null,
      "GastDesc": "Sesam-Keks | Mehlfrei | Vegan",
      "date_de": "09.02.2026"
    },
    {
      "id": "5662537",
      "outlet": "cafe",
      "date": "2026-02-10",
      "CalendarWeek": "6",
      "day": "Dienstag",
      "mealtime": "Mittagessen",
      "IdentNr": "12026021098001",
      "itemId": "21059",
      "RecipeID": "8054",
      "ProductPrice": "3.20",
      "ProductPrice_2": null,
      "GastDesc_de": "Pflaumenmus-Croffin mit Vanilleschmand",
      "GastDesc_en": "Plum Jam Croffin with Vanilla Sour Cream",
      "MenuName": "CROFFIN",
      "allergene": {
        "gluten": "Glutenhaltiges Getreide",
        "schalenfruchte": "Schalenfrüchte und Schalenfruchterzeugnisse",
        "huhnerei": "Hühnerei und Hühnereierzeugnisse",
        "soja": "Soja und Sojaerzeugnisse",
        "milch": "Milch und Milcherzeugnisse"
      },
      "merkmale": "",
      "naehrstoffe": "",
      "zusatzstoffe": [
        {
          "de": "Farbstoff",
          "en": "Colouring Agent"
        },
        {
          "de": "Alkohol",
          "en": "Alcohol"
        }
      ],
      "PrintOrder": "1",
      "CO2Value": null,
      "CO2Rating": null,
      "CO2Perc": null,
      "ClimateFriendly": null,
      "GastDesc": "Pflaumenmus-Croffin mit Vanilleschmand",
      "date_de": "10.02.2026"
    },
    {
      "id": "5662538",
      "outlet": "cafe",
      "date": "2026-02-10",
      "CalendarWeek": "6",
      "day": "Dienstag",
      "mealtime": "Mittagessen",
      "IdentNr": "12026021098002",
      "itemId": "21062",
      "RecipeID": "8871",
      "ProductPrice": "3.60",
      "ProductPrice_2": null,
      "GastDesc_de": "Baskischer Cheesecake mit Marillenkompott",
      "GastDesc_en": "Basque-style Cheesecake with Apricot Compote",
      "MenuName": "FAVOURITES",
      "allergene": {
        "huhnerei": "Hühnerei und Hühnereierzeugnisse",
        "milch": "Milch und Milcherzeugnisse"
      },
      "merkmale": "",
      "naehrstoffe": "",
      "zusatzstoffe": [
        {
          "de": "Farbstoff",
          "en": "Colouring Agent"
        },
        {
          "de": "Alkohol",
          "en": "Alcohol"
        }
      ],
      "PrintOrder": "2",
      "CO2Value": null,
      "CO2Rating": null,
      "CO2Perc": null,
      "ClimateFriendly": null,
      "GastDesc": "Baskischer Cheesecake mit Marillenkompott",
      "date_de": "10.02.2026"
    },
    {
      "id": "5662539",
      "outlet": "cafe",
      "date": "2026-02-10",
      "CalendarWeek": "6",
      "day": "Dienstag",
      "mealtime": "Mittagessen",
      "IdentNr": "12026021098003",
      "itemId": "21063",
      "RecipeID": "8211",
      "ProductPrice": "0.50",
      "ProductPrice_2": null,
      "GastDesc_de": "LES ARLETTES (Französische Blätterteigkekse) Vegan",
      "GastDesc_en": "LES ARLETTES  (French Puff Pastry Cookies) Vegan",
      "MenuName": "MINIS",
      "allergene": {
        "gluten": "Glutenhaltiges Getreide"
      },
      "merkmale": {
        "vegan": "Vegan",
        "vegetarisch": "Vegetarisch"
      },
      "naehrstoffe": "",
      "zusatzstoffe": [
        {
          "de": "Farbstoff",
          "en": "Colouring Agent"
        },
        {
          "de": "Alkohol",
          "en": "Alcohol"
        }
      ],
      "PrintOrder": "3",
      "CO2Value": null,
      "CO2Rating": null,
      "CO2Perc": null,
      "ClimateFriendly": null,
      "GastDesc": "LES ARLETTES (Französische Blätterteigkekse) Vegan",
      "date_de": "10.02.2026"
    },
    {
      "id": "5662540",
      "outlet": "cafe",
      "date": "2026-02-10",
      "CalendarWeek": "6",
      "day": "Dienstag",
      "mealtime": "Mittagessen",
      "IdentNr": "12026021098005",
      "itemId": "21064",
      "RecipeID": "8330",
      "ProductPrice": "1.50",
      "ProductPrice_2": null,
      "GastDesc_de": "Saftige Brownie-Bananen-Cookies | Zuckerfrei",
      "GastDesc_en": "Fudgy Brownie Banana Cookies | Sugar-Free",
      "MenuName": "PEOPLES CHOICE",
      "allergene": {
        "erdnuss": "Erdnüsse und Erdnusserzeugnisse"
      },
      "merkmale": {
        "ohne_zucker": "Ohne_Zucker",
        "vegan": "Vegan",
        "vegetarisch": "Vegetarisch"
      },
      "naehrstoffe": "",
      "zusatzstoffe": null,
      "PrintOrder": "5",
      "CO2Value": null,
      "CO2Rating": null,
      "CO2Perc": null,
      "ClimateFriendly": null,
      "GastDesc": "Saftige Brownie-Bananen-Cookies | Zuckerfrei",
      "date_de": "10.02.2026"
    },
    {
      "id": "5662541",
      "outlet": "cafe",
      "date": "2026-02-10",
      "CalendarWeek": "6",
      "day": "Dienstag",
      "mealtime": "Mittagessen",
      "IdentNr": "12026021098006",
      "itemId": "21061",
      "RecipeID": "8697",
      "ProductPrice": "2.50",
      "ProductPrice_2": null,
      "GastDesc_de": "Erdnussbutter-Cookie mit Schokolade und Salzkaramell | Vegan",
      "GastDesc_en": "Peanutbutter Cookie with Chocolate Salty Caramel | Vegan",
      "MenuName": "SEASON",
      "allergene": {
        "gluten": "Glutenhaltiges Getreide",
        "soja": "Soja und Sojaerzeugnisse",
        "erdnuss": "Erdnüsse und Erdnusserzeugnisse"
      },
      "merkmale": "",
      "naehrstoffe": "",
      "zusatzstoffe": [
        {
          "de": "Farbstoff",
          "en": "Colouring Agent"
        },
        {
          "de": "Antioxidationsmittel",
          "en": "Antioxidation"
        },
        {
          "de": "Alkohol",
          "en": "Alcohol"
        }
      ],
      "PrintOrder": "6",
      "CO2Value": null,
      "CO2Rating": null,
      "CO2Perc": null,
      "ClimateFriendly": null,
      "GastDesc": "Erdnussbutter-Cookie mit Schokolade und Salzkaramell | Vegan",
      "date_de": "10.02.2026"
    },
    {
      "id": "5662542",
      "outlet": "cafe",
      "date": "2026-02-10",
      "CalendarWeek": "6",
      "day": "Dienstag",
      "mealtime": "Mittagessen",
      "IdentNr": "12026021098007",
      "itemId": "12776",
      "RecipeID": "8453",
      "ProductPrice": "2.50",
      "ProductPrice_2": null,
      "GastDesc_de": "Oreo-Cheesecake-Cookies",
      "GastDesc_en": "Oreo Cheesecake Cookies",
      "MenuName": "COOKIE",
      "allergene": {
        "gluten": "Glutenhaltiges Getreide",
        "huhnerei": "Hühnerei und Hühnereierzeugnisse",
        "milch": "Milch und Milcherzeugnisse"
      },
      "merkmale": "",
      "naehrstoffe": "",
      "zusatzstoffe": [
        {
          "de": "Farbstoff",
          "en": "Colouring Agent"
        },
        {
          "de": "Alkohol",
          "en": "Alcohol"
        }
      ],
      "PrintOrder": "7",
      "CO2Value": null,
      "CO2Rating": null,
      "CO2Perc": null,
      "ClimateFriendly": null,
      "GastDesc": "Oreo-Cheesecake-Cookies",
      "date_de": "10.02.2026"
    },
    {
      "id": "5662543",
      "outlet": "cafe",
      "date": "2026-02-10",
      "CalendarWeek": "6",
      "day": "Dienstag",
      "mealtime": "Mittagessen",
      "IdentNr": "12026021098008",
      "itemId": "12777",
      "RecipeID": "9121",
      "ProductPrice": "2.50",
      "ProductPrice_2": null,
      "GastDesc_de": "Carrotcake  Bananenbrot | Zuckerfrei",
      "GastDesc_en": "Carrot Cake Banana Bread | Sugar-Free",
      "MenuName": "TAG des KASTENKUCHENS",
      "allergene": {
        "gluten": "Glutenhaltiges Getreide",
        "huhnerei": "Hühnerei und Hühnereierzeugnisse",
        "milch": "Milch und Milcherzeugnisse",
        "schwefel": "Schwefeldioxid und Sulfide"
      },
      "merkmale": "",
      "naehrstoffe": "",
      "zusatzstoffe": [
        {
          "de": "Farbstoff",
          "en": "Colouring Agent"
        }
      ],
      "PrintOrder": "8",
      "CO2Value": null,
      "CO2Rating": null,
      "CO2Perc": null,
      "ClimateFriendly": null,
      "GastDesc": "Carrotcake  Bananenbrot | Zuckerfrei",
      "date_de": "10.02.2026"
    },
    {
      "id": "5662544",
      "outlet": "cafe",
      "date": "2026-02-10",
      "CalendarWeek": "6",
      "day": "Dienstag",
      "mealtime": "Mittagessen",
      "IdentNr": "12026021098011",
      "itemId": "16256",
      "RecipeID": "9122",
      "ProductPrice": "2.50",
      "ProductPrice_2": null,
      "GastDesc_de": "Sesam-Keks | Mehlfrei | Vegan",
      "GastDesc_en": "Sesame Cookie | Flour-Free | Vegan",
      "MenuName": "VEGAN SPECIAL",
      "allergene": {
        "schalenfruchte": "Schalenfrüchte und Schalenfruchterzeugnisse",
        "sesam": "Sesamsamen und Sesamsamenerzeugnisse"
      },
      "merkmale": "",
      "naehrstoffe": "",
      "zusatzstoffe": [
        {
          "de": "Farbstoff",
          "en": "Colouring Agent"
        },
        {
          "de": "Antioxidationsmittel",
          "en": "Antioxidation"
        },
        {
          "de": "Alkohol",
          "en": "Alcohol"
        }
      ],
      "PrintOrder": "11",
      "CO2Value": null,
      "CO2Rating": null,
      "CO2Perc": null,
      "ClimateFriendly": null,
      "GastDesc": "Sesam-Keks | Mehlfrei | Vegan",
      "date_de": "10.02.2026"
    },
    {
      "id": "5662545",
      "outlet": "cafe",
      "date": "2026-02-11",
      "CalendarWeek": "6",
      "day": "Mittwoch",
      "mealtime": "Mittagessen",
      "IdentNr": "12026021198001",
      "itemId": "21059",
      "RecipeID": "8054",
      "ProductPrice": "3.20",
      "ProductPrice_2": null,
      "GastDesc_de": "Pflaumenmus-Croffin mit Vanilleschmand",
      "GastDesc_en": "Plum Jam Croffin with Vanilla Sour Cream",
      "MenuName": "CROFFIN",
      "allergene": {
        "gluten": "Glutenhaltiges Getreide",
        "schalenfruchte": "Schalenfrüchte und Schalenfruchterzeugnisse",
        "huhnerei": "Hühnerei und Hühnereierzeugnisse",
        "soja": "Soja und Sojaerzeugnisse",
        "milch": "Milch und Milcherzeugnisse"
      },
      "merkmale": "",
      "naehrstoffe": "",
      "zusatzstoffe": [
        {
          "de": "Farbstoff",
          "en": "Colouring Agent"
        },
        {
          "de": "Alkohol",
          "en": "Alcohol"
        }
      ],
      "PrintOrder": "1",
      "CO2Value": null,
      "CO2Rating": null,
      "CO2Perc": null,
      "ClimateFriendly": null,
      "GastDesc": "Pflaumenmus-Croffin mit Vanilleschmand",
      "date_de": "11.02.2026"
    },
    {
      "id": "5662546",
      "outlet": "cafe",
      "date": "2026-02-11",
      "CalendarWeek": "6",
      "day": "Mittwoch",
      "mealtime": "Mittagessen",
      "IdentNr": "12026021198002",
      "itemId": "21062",
      "RecipeID": "8871",
      "ProductPrice": "3.60",
      "ProductPrice_2": null,
      "GastDesc_de": "Baskischer Cheesecake mit Marillenkompott",
      "GastDesc_en": "Basque-style Cheesecake with Apricot Compote",
      "MenuName": "FAVOURITES",
      "allergene": {
        "huhnerei": "Hühnerei und Hühnereierzeugnisse",
        "milch": "Milch und Milcherzeugnisse"
      },
      "merkmale": "",
      "naehrstoffe": "",
      "zusatzstoffe": [
        {
          "de": "Farbstoff",
          "en": "Colouring Agent"
        },
        {
          "de": "Alkohol",
          "en": "Alcohol"
        }
      ],
      "PrintOrder": "2",
      "CO2Value": null,
      "CO2Rating": null,
      "CO2Perc": null,
      "ClimateFriendly": null,
      "GastDesc": "Baskischer Cheesecake mit Marillenkompott",
      "date_de": "11.02.2026"
    },
    {
      "id": "5662547",
      "outlet": "cafe",
      "date": "2026-02-11",
      "CalendarWeek": "6",
      "day": "Mittwoch",
      "mealtime": "Mittagessen",
      "IdentNr": "12026021198003",
      "itemId": "21063",
      "RecipeID": "8211",
      "ProductPrice": "0.50",
      "ProductPrice_2": null,
      "GastDesc_de": "LES ARLETTES (Französische Blätterteigkekse) Vegan",
      "GastDesc_en": "LES ARLETTES  (French Puff Pastry Cookies) Vegan",
      "MenuName": "MINIS",
      "allergene": {
        "gluten": "Glutenhaltiges Getreide"
      },
      "merkmale": {
        "vegan": "Vegan",
        "vegetarisch": "Vegetarisch"
      },
      "naehrstoffe": "",
      "zusatzstoffe": [
        {
          "de": "Farbstoff",
          "en": "Colouring Agent"
        },
        {
          "de": "Alkohol",
          "en": "Alcohol"
        }
      ],
      "PrintOrder": "3",
      "CO2Value": null,
      "CO2Rating": null,
      "CO2Perc": null,
      "ClimateFriendly": null,
      "GastDesc": "LES ARLETTES (Französische Blätterteigkekse) Vegan",
      "date_de": "11.02.2026"
    },
    {
      "id": "5662548",
      "outlet": "cafe",
      "date": "2026-02-11",
      "CalendarWeek": "6",
      "day": "Mittwoch",
      "mealtime": "Mittagessen",
      "IdentNr": "12026021198005",
      "itemId": "21064",
      "RecipeID": "8330",
      "ProductPrice": "1.50",
      "ProductPrice_2": null,
      "GastDesc_de": "Saftige Brownie-Bananen-Cookies | Zuckerfrei",
      "GastDesc_en": "Fudgy Brownie Banana Cookies | Sugar-Free",
      "MenuName": "PEOPLES CHOICE",
      "allergene": {
        "erdnuss": "Erdnüsse und Erdnusserzeugnisse"
      },
      "merkmale": {
        "ohne_zucker": "Ohne_Zucker",
        "vegan": "Vegan",
        "vegetarisch": "Vegetarisch"
      },
      "naehrstoffe": "",
      "zusatzstoffe": null,
      "PrintOrder": "5",
      "CO2Value": null,
      "CO2Rating": null,
      "CO2Perc": null,
      "ClimateFriendly": null,
      "GastDesc": "Saftige Brownie-Bananen-Cookies | Zuckerfrei",
      "date_de": "11.02.2026"
    },
    {
      "id": "5662549",
      "outlet": "cafe",
      "date": "2026-02-11",
      "CalendarWeek": "6",
      "day": "Mittwoch",
      "mealtime": "Mittagessen",
      "IdentNr": "12026021198006",
      "itemId": "21061",
      "RecipeID": "8697",
      "ProductPrice": "2.50",
      "ProductPrice_2": null,
      "GastDesc_de": "Erdnussbutter-Cookie mit Schokolade und Salzkaramell | Vegan",
      "GastDesc_en": "Peanutbutter Cookie with Chocolate Salty Caramel | Vegan",
      "MenuName": "SEASON",
      "allergene": {
        "gluten": "Glutenhaltiges Getreide",
        "soja": "Soja und Sojaerzeugnisse",
        "erdnuss": "Erdnüsse und Erdnusserzeugnisse"
      },
      "merkmale": "",
      "naehrstoffe": "",
      "zusatzstoffe": [
        {
          "de": "Farbstoff",
          "en": "Colouring Agent"
        },
        {
          "de": "Antioxidationsmittel",
          "en": "Antioxidation"
        },
        {
          "de": "Alkohol",
          "en": "Alcohol"
        }
      ],
      "PrintOrder": "6",
      "CO2Value": null,
      "CO2Rating": null,
      "CO2Perc": null,
      "ClimateFriendly": null,
      "GastDesc": "Erdnussbutter-Cookie mit Schokolade und Salzkaramell | Vegan",
      "date_de": "11.02.2026"
    },
    {
      "id": "5662550",
      "outlet": "cafe",
      "date": "2026-02-11",
      "CalendarWeek": "6",
      "day": "Mittwoch",
      "mealtime": "Mittagessen",
      "IdentNr": "12026021198007",
      "itemId": "12776",
      "RecipeID": "8453",
      "ProductPrice": "2.50",
      "ProductPrice_2": null,
      "GastDesc_de": "Oreo-Cheesecake-Cookies",
      "GastDesc_en": "Oreo Cheesecake Cookies",
      "MenuName": "COOKIE",
      "allergene": {
        "gluten": "Glutenhaltiges Getreide",
        "huhnerei": "Hühnerei und Hühnereierzeugnisse",
        "milch": "Milch und Milcherzeugnisse"
      },
      "merkmale": "",
      "naehrstoffe": "",
      "zusatzstoffe": [
        {
          "de": "Farbstoff",
          "en": "Colouring Agent"
        },
        {
          "de": "Alkohol",
          "en": "Alcohol"
        }
      ],
      "PrintOrder": "7",
      "CO2Value": null,
      "CO2Rating": null,
      "CO2Perc": null,
      "ClimateFriendly": null,
      "GastDesc": "Oreo-Cheesecake-Cookies",
      "date_de": "11.02.2026"
    },
    {
      "id": "5662551",
      "outlet": "cafe",
      "date": "2026-02-11",
      "CalendarWeek": "6",
      "day": "Mittwoch",
      "mealtime": "Mittagessen",
      "IdentNr": "12026021198008",
      "itemId": "12777",
      "RecipeID": "9121",
      "ProductPrice": "2.50",
      "ProductPrice_2": null,
      "GastDesc_de": "Carrotcake  Bananenbrot | Zuckerfrei",
      "GastDesc_en": "Carrot Cake Banana Bread | Sugar-Free",
      "MenuName": "TAG des KASTENKUCHENS",
      "allergene": {
        "gluten": "Glutenhaltiges Getreide",
        "huhnerei": "Hühnerei und Hühnereierzeugnisse",
        "milch": "Milch und Milcherzeugnisse",
        "schwefel": "Schwefeldioxid und Sulfide"
      },
      "merkmale": "",
      "naehrstoffe": "",
      "zusatzstoffe": [
        {
          "de": "Farbstoff",
          "en": "Colouring Agent"
        }
      ],
      "PrintOrder": "8",
      "CO2Value": null,
      "CO2Rating": null,
      "CO2Perc": null,
      "ClimateFriendly": null,
      "GastDesc": "Carrotcake  Bananenbrot | Zuckerfrei",
      "date_de": "11.02.2026"
    },
    {
      "id": "5662552",
      "outlet": "cafe",
      "date": "2026-02-11",
      "CalendarWeek": "6",
      "day": "Mittwoch",
      "mealtime": "Mittagessen",
      "IdentNr": "12026021198011",
      "itemId": "16256",
      "RecipeID": "9122",
      "ProductPrice": "2.50",
      "ProductPrice_2": null,
      "GastDesc_de": "Sesam-Keks | Mehlfrei | Vegan",
      "GastDesc_en": "Sesame Cookie | Flour-Free | Vegan",
      "MenuName": "VEGAN SPECIAL",
      "allergene": {
        "schalenfruchte": "Schalenfrüchte und Schalenfruchterzeugnisse",
        "sesam": "Sesamsamen und Sesamsamenerzeugnisse"
      },
      "merkmale": "",
      "naehrstoffe": "",
      "zusatzstoffe": [
        {
          "de": "Farbstoff",
          "en": "Colouring Agent"
        },
        {
          "de": "Antioxidationsmittel",
          "en": "Antioxidation"
        },
        {
          "de": "Alkohol",
          "en": "Alcohol"
        }
      ],
      "PrintOrder": "11",
      "CO2Value": null,
      "CO2Rating": null,
      "CO2Perc": null,
      "ClimateFriendly": null,
      "GastDesc": "Sesam-Keks | Mehlfrei | Vegan",
      "date_de": "11.02.2026"
    },
    {
      "id": "5662553",
      "outlet": "cafe",
      "date": "2026-02-12",
      "CalendarWeek": "6",
      "day": "Donnerstag",
      "mealtime": "Mittagessen",
      "IdentNr": "12026021298001",
      "itemId": "21059",
      "RecipeID": "8054",
      "ProductPrice": "3.20",
      "ProductPrice_2": null,
      "GastDesc_de": "Pflaumenmus-Croffin mit Vanilleschmand",
      "GastDesc_en": "Plum Jam Croffin with Vanilla Sour Cream",
      "MenuName": "CROFFIN",
      "allergene": {
        "gluten": "Glutenhaltiges Getreide",
        "schalenfruchte": "Schalenfrüchte und Schalenfruchterzeugnisse",
        "huhnerei": "Hühnerei und Hühnereierzeugnisse",
        "soja": "Soja und Sojaerzeugnisse",
        "milch": "Milch und Milcherzeugnisse"
      },
      "merkmale": "",
      "naehrstoffe": "",
      "zusatzstoffe": [
        {
          "de": "Farbstoff",
          "en": "Colouring Agent"
        },
        {
          "de": "Alkohol",
          "en": "Alcohol"
        }
      ],
      "PrintOrder": "1",
      "CO2Value": null,
      "CO2Rating": null,
      "CO2Perc": null,
      "ClimateFriendly": null,
      "GastDesc": "Pflaumenmus-Croffin mit Vanilleschmand",
      "date_de": "12.02.2026"
    },
    {
      "id": "5662554",
      "outlet": "cafe",
      "date": "2026-02-12",
      "CalendarWeek": "6",
      "day": "Donnerstag",
      "mealtime": "Mittagessen",
      "IdentNr": "12026021298002",
      "itemId": "21062",
      "RecipeID": "8871",
      "ProductPrice": "3.60",
      "ProductPrice_2": null,
      "GastDesc_de": "Baskischer Cheesecake mit Marillenkompott",
      "GastDesc_en": "Basque-style Cheesecake with Apricot Compote",
      "MenuName": "FAVOURITES",
      "allergene": {
        "huhnerei": "Hühnerei und Hühnereierzeugnisse",
        "milch": "Milch und Milcherzeugnisse"
      },
      "merkmale": "",
      "naehrstoffe": "",
      "zusatzstoffe": [
        {
          "de": "Farbstoff",
          "en": "Colouring Agent"
        },
        {
          "de": "Alkohol",
          "en": "Alcohol"
        }
      ],
      "PrintOrder": "2",
      "CO2Value": null,
      "CO2Rating": null,
      "CO2Perc": null,
      "ClimateFriendly": null,
      "GastDesc": "Baskischer Cheesecake mit Marillenkompott",
      "date_de": "12.02.2026"
    },
    {
      "id": "5662555",
      "outlet": "cafe",
      "date": "2026-02-12",
      "CalendarWeek": "6",
      "day": "Donnerstag",
      "mealtime": "Mittagessen",
      "IdentNr": "12026021298003",
      "itemId": "21063",
      "RecipeID": "8211",
      "ProductPrice": "0.50",
      "ProductPrice_2": null,
      "GastDesc_de": "LES ARLETTES (Französische Blätterteigkekse) Vegan",
      "GastDesc_en": "LES ARLETTES  (French Puff Pastry Cookies) Vegan",
      "MenuName": "MINIS",
      "allergene": {
        "gluten": "Glutenhaltiges Getreide"
      },
      "merkmale": {
        "vegan": "Vegan",
        "vegetarisch": "Vegetarisch"
      },
      "naehrstoffe": "",
      "zusatzstoffe": [
        {
          "de": "Farbstoff",
          "en": "Colouring Agent"
        },
        {
          "de": "Alkohol",
          "en": "Alcohol"
        }
      ],
      "PrintOrder": "3",
      "CO2Value": null,
      "CO2Rating": null,
      "CO2Perc": null,
      "ClimateFriendly": null,
      "GastDesc": "LES ARLETTES (Französische Blätterteigkekse) Vegan",
      "date_de": "12.02.2026"
    },
    {
      "id": "5662556",
      "outlet": "cafe",
      "date": "2026-02-12",
      "CalendarWeek": "6",
      "day": "Donnerstag",
      "mealtime": "Mittagessen",
      "IdentNr": "12026021298005",
      "itemId": "21064",
      "RecipeID": "8330",
      "ProductPrice": "1.50",
      "ProductPrice_2": null,
      "GastDesc_de": "Saftige Brownie-Bananen-Cookies | Zuckerfrei",
      "GastDesc_en": "Fudgy Brownie Banana Cookies | Sugar-Free",
      "MenuName": "PEOPLES CHOICE",
      "allergene": {
        "erdnuss": "Erdnüsse und Erdnusserzeugnisse"
      },
      "merkmale": {
        "ohne_zucker": "Ohne_Zucker",
        "vegan": "Vegan",
        "vegetarisch": "Vegetarisch"
      },
      "naehrstoffe": "",
      "zusatzstoffe": null,
      "PrintOrder": "5",
      "CO2Value": null,
      "CO2Rating": null,
      "CO2Perc": null,
      "ClimateFriendly": null,
      "GastDesc": "Saftige Brownie-Bananen-Cookies | Zuckerfrei",
      "date_de": "12.02.2026"
    },
    {
      "id": "5662557",
      "outlet": "cafe",
      "date": "2026-02-12",
      "CalendarWeek": "6",
      "day": "Donnerstag",
      "mealtime": "Mittagessen",
      "IdentNr": "12026021298006",
      "itemId": "21061",
      "RecipeID": "8697",
      "ProductPrice": "2.50",
      "ProductPrice_2": null,
      "GastDesc_de": "Erdnussbutter-Cookie mit Schokolade und Salzkaramell | Vegan",
      "GastDesc_en": "Peanutbutter Cookie with Chocolate Salty Caramel | Vegan",
      "MenuName": "SEASON",
      "allergene": {
        "gluten": "Glutenhaltiges Getreide",
        "soja": "Soja und Sojaerzeugnisse",
        "erdnuss": "Erdnüsse und Erdnusserzeugnisse"
      },
      "merkmale": "",
      "naehrstoffe": "",
      "zusatzstoffe": [
        {
          "de": "Farbstoff",
          "en": "Colouring Agent"
        },
        {
          "de": "Antioxidationsmittel",
          "en": "Antioxidation"
        },
        {
          "de": "Alkohol",
          "en": "Alcohol"
        }
      ],
      "PrintOrder": "6",
      "CO2Value": null,
      "CO2Rating": null,
      "CO2Perc": null,
      "ClimateFriendly": null,
      "GastDesc": "Erdnussbutter-Cookie mit Schokolade und Salzkaramell | Vegan",
      "date_de": "12.02.2026"
    },
    {
      "id": "5662558",
      "outlet": "cafe",
      "date": "2026-02-12",
      "CalendarWeek": "6",
      "day": "Donnerstag",
      "mealtime": "Mittagessen",
      "IdentNr": "12026021298007",
      "itemId": "12776",
      "RecipeID": "8453",
      "ProductPrice": "2.50",
      "ProductPrice_2": null,
      "GastDesc_de": "Oreo-Cheesecake-Cookies",
      "GastDesc_en": "Oreo Cheesecake Cookies",
      "MenuName": "COOKIE",
      "allergene": {
        "gluten": "Glutenhaltiges Getreide",
        "huhnerei": "Hühnerei und Hühnereierzeugnisse",
        "milch": "Milch und Milcherzeugnisse"
      },
      "merkmale": "",
      "naehrstoffe": "",
      "zusatzstoffe": [
        {
          "de": "Farbstoff",
          "en": "Colouring Agent"
        },
        {
          "de": "Alkohol",
          "en": "Alcohol"
        }
      ],
      "PrintOrder": "7",
      "CO2Value": null,
      "CO2Rating": null,
      "CO2Perc": null,
      "ClimateFriendly": null,
      "GastDesc": "Oreo-Cheesecake-Cookies",
      "date_de": "12.02.2026"
    },
    {
      "id": "5662559",
      "outlet": "cafe",
      "date": "2026-02-12",
      "CalendarWeek": "6",
      "day": "Donnerstag",
      "mealtime": "Mittagessen",
      "IdentNr": "12026021298008",
      "itemId": "12777",
      "RecipeID": "9121",
      "ProductPrice": "2.50",
      "ProductPrice_2": null,
      "GastDesc_de": "Carrotcake  Bananenbrot | Zuckerfrei",
      "GastDesc_en": "Carrot Cake Banana Bread | Sugar-Free",
      "MenuName": "TAG des KASTENKUCHENS",
      "allergene": {
        "gluten": "Glutenhaltiges Getreide",
        "huhnerei": "Hühnerei und Hühnereierzeugnisse",
        "milch": "Milch und Milcherzeugnisse",
        "schwefel": "Schwefeldioxid und Sulfide"
      },
      "merkmale": "",
      "naehrstoffe": "",
      "zusatzstoffe": [
        {
          "de": "Farbstoff",
          "en": "Colouring Agent"
        }
      ],
      "PrintOrder": "8",
      "CO2Value": null,
      "CO2Rating": null,
      "CO2Perc": null,
      "ClimateFriendly": null,
      "GastDesc": "Carrotcake  Bananenbrot | Zuckerfrei",
      "date_de": "12.02.2026"
    },
    {
      "id": "5662560",
      "outlet": "cafe",
      "date": "2026-02-12",
      "CalendarWeek": "6",
      "day": "Donnerstag",
      "mealtime": "Mittagessen",
      "IdentNr": "12026021298011",
      "itemId": "16256",
      "RecipeID": "9122",
      "ProductPrice": "2.50",
      "ProductPrice_2": null,
      "GastDesc_de": "Sesam-Keks | Mehlfrei | Vegan",
      "GastDesc_en": "Sesame Cookie | Flour-Free | Vegan",
      "MenuName": "VEGAN SPECIAL",
      "allergene": {
        "schalenfruchte": "Schalenfrüchte und Schalenfruchterzeugnisse",
        "sesam": "Sesamsamen und Sesamsamenerzeugnisse"
      },
      "merkmale": "",
      "naehrstoffe": "",
      "zusatzstoffe": [
        {
          "de": "Farbstoff",
          "en": "Colouring Agent"
        },
        {
          "de": "Antioxidationsmittel",
          "en": "Antioxidation"
        },
        {
          "de": "Alkohol",
          "en": "Alcohol"
        }
      ],
      "PrintOrder": "11",
      "CO2Value": null,
      "CO2Rating": null,
      "CO2Perc": null,
      "ClimateFriendly": null,
      "GastDesc": "Sesam-Keks | Mehlfrei | Vegan",
      "date_de": "12.02.2026"
    },
    {
      "id": "5662561",
      "outlet": "cafe",
      "date": "2026-02-13",
      "CalendarWeek": "6",
      "day": "Freitag",
      "mealtime": "Mittagessen",
      "IdentNr": "12026021398002",
      "itemId": "21062",
      "RecipeID": "8871",
      "ProductPrice": "3.60",
      "ProductPrice_2": null,
      "GastDesc_de": "Baskischer Cheesecake mit Marillenkompott",
      "GastDesc_en": "Basque-style Cheesecake with Apricot Compote",
      "MenuName": "FAVOURITES",
      "allergene": {
        "huhnerei": "Hühnerei und Hühnereierzeugnisse",
        "milch": "Milch und Milcherzeugnisse"
      },
      "merkmale": "",
      "naehrstoffe": "",
      "zusatzstoffe": [
        {
          "de": "Farbstoff",
          "en": "Colouring Agent"
        },
        {
          "de": "Alkohol",
          "en": "Alcohol"
        }
      ],
      "PrintOrder": "2",
      "CO2Value": null,
      "CO2Rating": null,
      "CO2Perc": null,
      "ClimateFriendly": null,
      "GastDesc": "Baskischer Cheesecake mit Marillenkompott",
      "date_de": "13.02.2026"
    },
    {
      "id": "5662562",
      "outlet": "cafe",
      "date": "2026-02-13",
      "CalendarWeek": "6",
      "day": "Freitag",
      "mealtime": "Mittagessen",
      "IdentNr": "12026021398003",
      "itemId": "21063",
      "RecipeID": "8211",
      "ProductPrice": "0.50",
      "ProductPrice_2": null,
      "GastDesc_de": "LES ARLETTES (Französische Blätterteigkekse) Vegan",
      "GastDesc_en": "LES ARLETTES  (French Puff Pastry Cookies) Vegan",
      "MenuName": "MINIS",
      "allergene": {
        "gluten": "Glutenhaltiges Getreide"
      },
      "merkmale": {
        "vegan": "Vegan",
        "vegetarisch": "Vegetarisch"
      },
      "naehrstoffe": "",
      "zusatzstoffe": [
        {
          "de": "Farbstoff",
          "en": "Colouring Agent"
        },
        {
          "de": "Alkohol",
          "en": "Alcohol"
        }
      ],
      "PrintOrder": "3",
      "CO2Value": null,
      "CO2Rating": null,
      "CO2Perc": null,
      "ClimateFriendly": null,
      "GastDesc": "LES ARLETTES (Französische Blätterteigkekse) Vegan",
      "date_de": "13.02.2026"
    },
    {
      "id": "5662563",
      "outlet": "cafe",
      "date": "2026-02-13",
      "CalendarWeek": "6",
      "day": "Freitag",
      "mealtime": "Mittagessen",
      "IdentNr": "12026021398005",
      "itemId": "21064",
      "RecipeID": "8330",
      "ProductPrice": "1.50",
      "ProductPrice_2": null,
      "GastDesc_de": "Saftige Brownie-Bananen-Cookies | Zuckerfrei",
      "GastDesc_en": "Fudgy Brownie Banana Cookies | Sugar-Free",
      "MenuName": "PEOPLES CHOICE",
      "allergene": {
        "erdnuss": "Erdnüsse und Erdnusserzeugnisse"
      },
      "merkmale": {
        "ohne_zucker": "Ohne_Zucker",
        "vegan": "Vegan",
        "vegetarisch": "Vegetarisch"
      },
      "naehrstoffe": "",
      "zusatzstoffe": null,
      "PrintOrder": "5",
      "CO2Value": null,
      "CO2Rating": null,
      "CO2Perc": null,
      "ClimateFriendly": null,
      "GastDesc": "Saftige Brownie-Bananen-Cookies | Zuckerfrei",
      "date_de": "13.02.2026"
    },
    {
      "id": "5662564",
      "outlet": "cafe",
      "date": "2026-02-13",
      "CalendarWeek": "6",
      "day": "Freitag",
      "mealtime": "Mittagessen",
      "IdentNr": "12026021398006",
      "itemId": "21061",
      "RecipeID": "8697",
      "ProductPrice": "2.50",
      "ProductPrice_2": null,
      "GastDesc_de": "Erdnussbutter-Cookie mit Schokolade und Salzkaramell | Vegan",
      "GastDesc_en": "Peanutbutter Cookie with Chocolate Salty Caramel | Vegan",
      "MenuName": "SEASON",
      "allergene": {
        "gluten": "Glutenhaltiges Getreide",
        "soja": "Soja und Sojaerzeugnisse",
        "erdnuss": "Erdnüsse und Erdnusserzeugnisse"
      },
      "merkmale": "",
      "naehrstoffe": "",
      "zusatzstoffe": [
        {
          "de": "Farbstoff",
          "en": "Colouring Agent"
        },
        {
          "de": "Antioxidationsmittel",
          "en": "Antioxidation"
        },
        {
          "de": "Alkohol",
          "en": "Alcohol"
        }
      ],
      "PrintOrder": "6",
      "CO2Value": null,
      "CO2Rating": null,
      "CO2Perc": null,
      "ClimateFriendly": null,
      "GastDesc": "Erdnussbutter-Cookie mit Schokolade und Salzkaramell | Vegan",
      "date_de": "13.02.2026"
    },
    {
      "id": "5662565",
      "outlet": "cafe",
      "date": "2026-02-13",
      "CalendarWeek": "6",
      "day": "Freitag",
      "mealtime": "Mittagessen",
      "IdentNr": "12026021398007",
      "itemId": "12776",
      "RecipeID": "8453",
      "ProductPrice": "2.50",
      "ProductPrice_2": null,
      "GastDesc_de": "Oreo-Cheesecake-Cookies",
      "GastDesc_en": "Oreo Cheesecake Cookies",
      "MenuName": "COOKIE",
      "allergene": {
        "gluten": "Glutenhaltiges Getreide",
        "huhnerei": "Hühnerei und Hühnereierzeugnisse",
        "milch": "Milch und Milcherzeugnisse"
      },
      "merkmale": "",
      "naehrstoffe": "",
      "zusatzstoffe": [
        {
          "de": "Farbstoff",
          "en": "Colouring Agent"
        },
        {
          "de": "Alkohol",
          "en": "Alcohol"
        }
      ],
      "PrintOrder": "7",
      "CO2Value": null,
      "CO2Rating": null,
      "CO2Perc": null,
      "ClimateFriendly": null,
      "GastDesc": "Oreo-Cheesecake-Cookies",
      "date_de": "13.02.2026"
    },
    {
      "id": "5662566",
      "outlet": "cafe",
      "date": "2026-02-13",
      "CalendarWeek": "6",
      "day": "Freitag",
      "mealtime": "Mittagessen",
      "IdentNr": "12026021398008",
      "itemId": "12777",
      "RecipeID": "9121",
      "ProductPrice": "2.50",
      "ProductPrice_2": null,
      "GastDesc_de": "Carrotcake  Bananenbrot | Zuckerfrei",
      "GastDesc_en": "Carrot Cake Banana Bread | Sugar-Free",
      "MenuName": "TAG des KASTENKUCHENS",
      "allergene": {
        "gluten": "Glutenhaltiges Getreide",
        "huhnerei": "Hühnerei und Hühnereierzeugnisse",
        "milch": "Milch und Milcherzeugnisse",
        "schwefel": "Schwefeldioxid und Sulfide"
      },
      "merkmale": "",
      "naehrstoffe": "",
      "zusatzstoffe": [
        {
          "de": "Farbstoff",
          "en": "Colouring Agent"
        }
      ],
      "PrintOrder": "8",
      "CO2Value": null,
      "CO2Rating": null,
      "CO2Perc": null,
      "ClimateFriendly": null,
      "GastDesc": "Carrotcake  Bananenbrot | Zuckerfrei",
      "date_de": "13.02.2026"
    },
    {
      "id": "5662567",
      "outlet": "cafe",
      "date": "2026-02-13",
      "CalendarWeek": "6",
      "day": "Freitag",
      "mealtime": "Mittagessen",
      "IdentNr": "12026021398011",
      "itemId": "16256",
      "RecipeID": "9122",
      "ProductPrice": "2.50",
      "ProductPrice_2": null,
      "GastDesc_de": "Sesam-Keks | Mehlfrei | Vegan",
      "GastDesc_en": "Sesame Cookie | Flour-Free | Vegan",
      "MenuName": "VEGAN SPECIAL",
      "allergene": {
        "schalenfruchte": "Schalenfrüchte und Schalenfruchterzeugnisse",
        "sesam": "Sesamsamen und Sesamsamenerzeugnisse"
      },
      "merkmale": "",
      "naehrstoffe": "",
      "zusatzstoffe": [
        {
          "de": "Farbstoff",
          "en": "Colouring Agent"
        },
        {
          "de": "Antioxidationsmittel",
          "en": "Antioxidation"
        },
        {
          "de": "Alkohol",
          "en": "Alcohol"
        }
      ],
      "PrintOrder": "11",
      "CO2Value": null,
      "CO2Rating": null,
      "CO2Perc": null,
      "ClimateFriendly": null,
      "GastDesc": "Sesam-Keks | Mehlfrei | Vegan",
      "date_de": "13.02.2026"
    },
    {
      "id": "5577161",
      "outlet": "canteen",
      "date": "2026-02-02",
      "CalendarWeek": "6",
      "day": "Montag",
      "mealtime": "Mittagessen",
      "IdentNr": "12026020298000",
      "itemId": "17549",
      "RecipeID": "9011",
      "ProductPrice": "10.00",
      "ProductPrice_2": null,
      "GastDesc_de": "Wintergemüse-Panzanella | Oliven | körniger Senf",
      "GastDesc_en": "Winter Vegetable Panzanella | Olives | Wholegrain Mustard",
      "MenuName": "COUNTER 1.1 Bowls_",
      "allergene": {
        "gluten": "Glutenhaltiges Getreide",
        "milch": "Milch und Milcherzeugnisse",
        "sellerie": "Sellerie und Sellerieerzeugnisse",
        "senf": "Senf und Senferzeugnisse",
        "schwefel": "Schwefeldioxid und Sulfide"
      },
      "merkmale": {
        "vegetarisch": "Vegetarisch"
      },
      "naehrstoffe": "",
      "zusatzstoffe": [
        {
          "de": "geschwärzt",
          "en": "Blacked Out"
        }
      ],
      "PrintOrder": "0",
      "CO2Value": "793.00",
      "CO2Rating": "B",
      "CO2Perc": "100.00",
      "ClimateFriendly": null,
      "GastDesc": "Wintergemüse-Panzanella | Oliven | körniger Senf",
      "date_de": "02.02.2026"
    },
    {
      "id": "5577162",
      "outlet": "canteen",
      "date": "2026-02-02",
      "CalendarWeek": "6",
      "day": "Montag",
      "mealtime": "Mittagessen",
      "IdentNr": "12026020298001",
      "itemId": "17550",
      "RecipeID": "7284",
      "ProductPrice": "12.00",
      "ProductPrice_2": null,
      "GastDesc_de": "Entenbrust | Süßkartoffel | Granatapfel",
      "GastDesc_en": "Duck Breast | Sweet Potato | Pomegranate",
      "MenuName": "COUNTER 2.1 Meat",
      "allergene": {
        "schalenfruchte": "Schalenfrüchte und Schalenfruchterzeugnisse",
        "milch": "Milch und Milcherzeugnisse",
        "sellerie": "Sellerie und Sellerieerzeugnisse",
        "schwefel": "Schwefeldioxid und Sulfide"
      },
      "merkmale": "",
      "naehrstoffe": "",
      "zusatzstoffe": [
        {
          "de": "Farbstoff",
          "en": "Colouring Agent"
        },
        {
          "de": "Antioxidationsmittel",
          "en": "Antioxidation"
        },
        {
          "de": "Alkohol",
          "en": "Alcohol"
        }
      ],
      "PrintOrder": "1",
      "CO2Value": "1152.00",
      "CO2Rating": "B",
      "CO2Perc": "100.00",
      "ClimateFriendly": null,
      "GastDesc": "Entenbrust | Süßkartoffel | Granatapfel",
      "date_de": "02.02.2026"
    },
    {
      "id": "5577163",
      "outlet": "canteen",
      "date": "2026-02-02",
      "CalendarWeek": "6",
      "day": "Montag",
      "mealtime": "Mittagessen",
      "IdentNr": "12026020298003",
      "itemId": "17552",
      "RecipeID": "8752",
      "ProductPrice": "12.00",
      "ProductPrice_2": null,
      "GastDesc_de": "Schellfisch | Gewürzjoghurt | Chili-Reis",
      "GastDesc_en": "Haddock | Spiced Yoghurt | Chilli Rice",
      "MenuName": "COUNTER 3.1 Fish",
      "allergene": {
        "milch": "Milch und Milcherzeugnisse"
      },
      "merkmale": "",
      "naehrstoffe": "",
      "zusatzstoffe": null,
      "PrintOrder": "3",
      "CO2Value": "1722.00",
      "CO2Rating": "C",
      "CO2Perc": "100.00",
      "ClimateFriendly": null,
      "GastDesc": "Schellfisch | Gewürzjoghurt | Chili-Reis",
      "date_de": "02.02.2026"
    },
    {
      "id": "5577164",
      "outlet": "canteen",
      "date": "2026-02-02",
      "CalendarWeek": "6",
      "day": "Montag",
      "mealtime": "Mittagessen",
      "IdentNr": "12026020298005",
      "itemId": "17554",
      "RecipeID": "8970",
      "ProductPrice": "9.50",
      "ProductPrice_2": null,
      "GastDesc_de": "Grüne Shakshuka | Pitabrot | Kefir",
      "GastDesc_en": "Green Shakshuka | Pita Bread | Kefir",
      "MenuName": "COUNTER 4.1 Vegi",
      "allergene": {
        "gluten": "Glutenhaltiges Getreide",
        "huhnerei": "Hühnerei und Hühnereierzeugnisse",
        "milch": "Milch und Milcherzeugnisse"
      },
      "merkmale": {
        "vegetarisch": "Vegetarisch"
      },
      "naehrstoffe": "",
      "zusatzstoffe": null,
      "PrintOrder": "5",
      "CO2Value": "826.00",
      "CO2Rating": "B",
      "CO2Perc": "100.00",
      "ClimateFriendly": null,
      "GastDesc": "Grüne Shakshuka | Pitabrot | Kefir",
      "date_de": "02.02.2026"
    },
    {
      "id": "5577165",
      "outlet": "canteen",
      "date": "2026-02-02",
      "CalendarWeek": "6",
      "day": "Montag",
      "mealtime": "Abendessen",
      "IdentNr": "12026020298009",
      "itemId": "17558",
      "RecipeID": "9011",
      "ProductPrice": "10.00",
      "ProductPrice_2": null,
      "GastDesc_de": "Wintergemüse-Panzanella | Oliven | körniger Senf",
      "GastDesc_en": "Winter Vegetable Panzanella | Olives | Wholegrain Mustard",
      "MenuName": "DINNER BOWL_",
      "allergene": {
        "gluten": "Glutenhaltiges Getreide",
        "milch": "Milch und Milcherzeugnisse",
        "sellerie": "Sellerie und Sellerieerzeugnisse",
        "senf": "Senf und Senferzeugnisse",
        "schwefel": "Schwefeldioxid und Sulfide"
      },
      "merkmale": {
        "vegetarisch": "Vegetarisch"
      },
      "naehrstoffe": "",
      "zusatzstoffe": [
        {
          "de": "geschwärzt",
          "en": "Blacked Out"
        }
      ],
      "PrintOrder": "9",
      "CO2Value": "793.00",
      "CO2Rating": "B",
      "CO2Perc": "100.00",
      "ClimateFriendly": null,
      "GastDesc": "Wintergemüse-Panzanella | Oliven | körniger Senf",
      "date_de": "02.02.2026"
    },
    {
      "id": "5577167",
      "outlet": "canteen",
      "date": "2026-02-02",
      "CalendarWeek": "6",
      "day": "Montag",
      "mealtime": "Abendessen",
      "IdentNr": "12026020298010",
      "itemId": "17559",
      "RecipeID": "7284",
      "ProductPrice": "12.00",
      "ProductPrice_2": null,
      "GastDesc_de": "Entenbrust | Süßkartoffel | Granatapfel",
      "GastDesc_en": "Duck Breast | Sweet Potato | Pomegranate",
      "MenuName": "DINNER Meat_17:00-19:00",
      "allergene": {
        "schalenfruchte": "Schalenfrüchte und Schalenfruchterzeugnisse",
        "milch": "Milch und Milcherzeugnisse",
        "sellerie": "Sellerie und Sellerieerzeugnisse",
        "schwefel": "Schwefeldioxid und Sulfide"
      },
      "merkmale": "",
      "naehrstoffe": "",
      "zusatzstoffe": [
        {
          "de": "Farbstoff",
          "en": "Colouring Agent"
        },
        {
          "de": "Antioxidationsmittel",
          "en": "Antioxidation"
        },
        {
          "de": "Alkohol",
          "en": "Alcohol"
        }
      ],
      "PrintOrder": "10",
      "CO2Value": "1152.00",
      "CO2Rating": "B",
      "CO2Perc": "100.00",
      "ClimateFriendly": null,
      "GastDesc": "Entenbrust | Süßkartoffel | Granatapfel",
      "date_de": "02.02.2026"
    },
    {
      "id": "5577169",
      "outlet": "canteen",
      "date": "2026-02-02",
      "CalendarWeek": "6",
      "day": "Montag",
      "mealtime": "Abendessen",
      "IdentNr": "12026020298012",
      "itemId": "17561",
      "RecipeID": "8970",
      "ProductPrice": "9.50",
      "ProductPrice_2": null,
      "GastDesc_de": "Grüne Shakshuka | Pitabrot | Kefir",
      "GastDesc_en": "Green Shakshuka | Pita Bread | Kefir",
      "MenuName": "DINNER Vegi/Vegan_17:00-19:00",
      "allergene": {
        "gluten": "Glutenhaltiges Getreide",
        "huhnerei": "Hühnerei und Hühnereierzeugnisse",
        "milch": "Milch und Milcherzeugnisse"
      },
      "merkmale": {
        "vegetarisch": "Vegetarisch"
      },
      "naehrstoffe": "",
      "zusatzstoffe": null,
      "PrintOrder": "12",
      "CO2Value": "826.00",
      "CO2Rating": "B",
      "CO2Perc": "100.00",
      "ClimateFriendly": null,
      "GastDesc": "Grüne Shakshuka | Pitabrot | Kefir",
      "date_de": "02.02.2026"
    },
    {
      "id": "5600376",
      "outlet": "canteen",
      "date": "2026-02-03",
      "CalendarWeek": "6",
      "day": "Dienstag",
      "mealtime": "Mittagessen",
      "IdentNr": "12026020398000",
      "itemId": "17549",
      "RecipeID": "7358",
      "ProductPrice": "11.00",
      "ProductPrice_2": null,
      "GastDesc_de": "Salsiccia | Linsen | Endiviensalat",
      "GastDesc_en": "Salsiccia | Lentils | Endive",
      "MenuName": "COUNTER 1.1 Bowls_",
      "allergene": {
        "sellerie": "Sellerie und Sellerieerzeugnisse",
        "schwefel": "Schwefeldioxid und Sulfide"
      },
      "merkmale": {
        "schwein": "Schwein"
      },
      "naehrstoffe": "",
      "zusatzstoffe": [
        {
          "de": "Antioxidationsmittel",
          "en": "Antioxidation"
        },
        {
          "de": "Konservierungsstoff",
          "en": "Preservatives"
        },
        {
          "de": "Alkohol",
          "en": "Alcohol"
        }
      ],
      "PrintOrder": "0",
      "CO2Value": "761.00",
      "CO2Rating": "B",
      "CO2Perc": "100.00",
      "ClimateFriendly": null,
      "GastDesc": "Salsiccia | Linsen | Endiviensalat",
      "date_de": "03.02.2026"
    },
    {
      "id": "5600377",
      "outlet": "canteen",
      "date": "2026-02-03",
      "CalendarWeek": "6",
      "day": "Dienstag",
      "mealtime": "Mittagessen",
      "IdentNr": "12026020398001",
      "itemId": "17550",
      "RecipeID": "7284",
      "ProductPrice": "12.00",
      "ProductPrice_2": null,
      "GastDesc_de": "Entenbrust | Süßkartoffel | Granatapfel",
      "GastDesc_en": "Duck Breast | Sweet Potato | Pomegranate",
      "MenuName": "COUNTER 2.1 Meat",
      "allergene": {
        "schalenfruchte": "Schalenfrüchte und Schalenfruchterzeugnisse",
        "milch": "Milch und Milcherzeugnisse",
        "sellerie": "Sellerie und Sellerieerzeugnisse",
        "schwefel": "Schwefeldioxid und Sulfide"
      },
      "merkmale": "",
      "naehrstoffe": "",
      "zusatzstoffe": [
        {
          "de": "Farbstoff",
          "en": "Colouring Agent"
        },
        {
          "de": "Antioxidationsmittel",
          "en": "Antioxidation"
        },
        {
          "de": "Alkohol",
          "en": "Alcohol"
        }
      ],
      "PrintOrder": "1",
      "CO2Value": "1152.00",
      "CO2Rating": "B",
      "CO2Perc": "100.00",
      "ClimateFriendly": null,
      "GastDesc": "Entenbrust | Süßkartoffel | Granatapfel",
      "date_de": "03.02.2026"
    },
    {
      "id": "5600378",
      "outlet": "canteen",
