{
  "daySelector": [
    {
      "date": "2025-12-30",
      "day": "Dienstag",
      "CalendarWeek": "1",
      "date_de": "30.12.2025"
    },
    {
      "date": "2026-01-01",
      "day": "Donnerstag",
      "CalendarWeek": "1",
      "date_de": "01.01.2026"
    },
    {
      "date": "2026-01-02",
      "day": "Freitag",
      "CalendarWeek": "1",
      "date_de": "02.01.2026"
    },
    {
      "date": "2026-01-03",
      "day": "Samstag",
      "CalendarWeek": "1",
      "date_de": "03.01.2026"
    },
    {
      "date": "2026-01-04",
      "day": "Sonntag",
      "CalendarWeek": "1",
      "date_de": "04.01.2026"
    },
    {
      "date": "2026-01-05",
      "day": "Montag",
      "CalendarWeek": "2",
      "date_de": "05.01.2026"
    },
    {
      "date": "2026-01-06",
      "day": "Dienstag",
      "CalendarWeek": "2",
      "date_de": "06.01.2026"
    },
    {
      "date": "2026-01-07",
      "day": "Mittwoch",
      "CalendarWeek": "2",
      "date_de": "07.01.2026"
    },
    {
      "date": "2026-01-08",
      "day": "Donnerstag",
      "CalendarWeek": "2",
      "date_de": "08.01.2026"
    },
    {
      "date": "2026-01-09",
      "day": "Freitag",
      "CalendarWeek": "2",
      "date_de": "09.01.2026"
    },
    {
      "date": "2026-01-10",
      "day": "Samstag",
      "CalendarWeek": "2",
      "date_de": "10.01.2026"
    },
    {
      "date": "2026-01-11",
      "day": "Sonntag",
      "CalendarWeek": "2",
      "date_de": "11.01.2026"
    },
    {
      "date": "2026-01-12",
      "day": "Montag",
      "CalendarWeek": "2",
      "date_de": "12.01.2026"
    },
    {
      "date": "2026-01-13",
      "day": "Dienstag",
      "CalendarWeek": "2",
      "date_de": "13.01.2026"
    },
    {
      "date": "2026-01-14",
      "day": "Mittwoch",
      "CalendarWeek": "2",
      "date_de": "14.01.2026"
    },
    {
      "date": "2026-01-15",
      "day": "Donnerstag",
      "CalendarWeek": "2",
      "date_de": "15.01.2026"
    },
    {
      "date": "2026-01-16",
      "day": "Freitag",
      "CalendarWeek": "2",
      "date_de": "16.01.2026"
    },
    {
      "date": "2026-01-17",
      "day": "Samstag",
      "CalendarWeek": "2",
      "date_de": "17.01.2026"
    },
    {
      "date": "2026-01-19",
      "day": "Montag",
      "CalendarWeek": "2",
      "date_de": "19.01.2026"
    }
  ],
  "data": [
    {
      "id": "5078016",
      "outlet": "cafe",
      "date": "2026-01-06",
      "CalendarWeek": "2",
      "day": "Dienstag",
      "mealtime": "Mittagessen",
      "IdentNr": "12026010698001",
      "itemId": "21059",
      "RecipeID": "8054",
      "ProductPrice": "3.20",
      "ProductPrice_2": null,
      "GastDesc_de": "Pflaumenmus-Croffin mit Vanilleschmand",
      "GastDesc_en": "Plum jam Croffin with vanilla sour cream",
      "MenuName": "CROFFIN",
      "allergene": {
        "gluten": "Glutenhaltiges Getreide",
        "schalenfruchte": "Schalenfrüchte und Schalenfruchterzeugnisse",
        "huhnerei": "Hühnerei und Hühnereierzeugnisse",
        "soja": "Soja und Sojaerzeugnisse",
        "milch": "Milch und Milcherzeugnisse"
      },
      "merkmale": "",
      "naehrstoffe": "",
      "zusatzstoffe": [
        {
          "de": "Farbstoff",
          "en": "Colouring Agent"
        },
        {
          "de": "Alkohol",
          "en": "Alcohol"
        }
      ],
      "PrintOrder": "1",
      "CO2Value": null,
      "CO2Rating": null,
      "CO2Perc": null,
      "ClimateFriendly": null,
      "GastDesc": "Pflaumenmus-Croffin mit Vanilleschmand",
      "date_de": "06.01.2026"
    },
    {
      "id": "5078017",
      "outlet": "cafe",
      "date": "2026-01-06",
      "CalendarWeek": "2",
      "day": "Dienstag",
      "mealtime": "Mittagessen",
      "IdentNr": "12026010698002",
      "itemId": "21062",
      "RecipeID": "8871",
      "ProductPrice": "3.60",
      "ProductPrice_2": null,
      "GastDesc_de": "Baskischer Cheesecake mit Johannisbeer-Birnenkompott",
      "GastDesc_en": "Basque-style Cheesecake with Black Currant and Pear Compote",
      "MenuName": "FAVOURITES",
      "allergene": {
        "huhnerei": "Hühnerei und Hühnereierzeugnisse",
        "milch": "Milch und Milcherzeugnisse"
      },
      "merkmale": "",
      "naehrstoffe": "",
      "zusatzstoffe": [
        {
          "de": "Farbstoff",
          "en": "Colouring Agent"
        },
        {
          "de": "Alkohol",
          "en": "Alcohol"
        }
      ],
      "PrintOrder": "2",
      "CO2Value": null,
      "CO2Rating": null,
      "CO2Perc": null,
      "ClimateFriendly": null,
      "GastDesc": "Baskischer Cheesecake mit Johannisbeer-Birnenkompott",
      "date_de": "06.01.2026"
    },
    {
      "id": "5078018",
      "outlet": "cafe",
      "date": "2026-01-06",
      "CalendarWeek": "2",
      "day": "Dienstag",
      "mealtime": "Mittagessen",
      "IdentNr": "12026010698003",
      "itemId": "21063",
      "RecipeID": "8211",
      "ProductPrice": "0.50",
      "ProductPrice_2": null,
      "GastDesc_de": "LES ARLETTES (Französische Blätterteigkekse) Vegan",
      "GastDesc_en": "LES ARLETTES  (French Puff Pastry Cookies) Vegan",
      "MenuName": "MINIS",
      "allergene": {
        "gluten": "Glutenhaltiges Getreide"
      },
      "merkmale": {
        "vegan": "Vegan",
        "vegetarisch": "Vegetarisch"
      },
      "naehrstoffe": "",
      "zusatzstoffe": [
        {
          "de": "Farbstoff",
          "en": "Colouring Agent"
        },
        {
          "de": "Alkohol",
          "en": "Alcohol"
        }
      ],
      "PrintOrder": "3",
      "CO2Value": null,
      "CO2Rating": null,
      "CO2Perc": null,
      "ClimateFriendly": null,
      "GastDesc": "LES ARLETTES (Französische Blätterteigkekse) Vegan",
      "date_de": "06.01.2026"
    },
    {
      "id": "5078019",
      "outlet": "cafe",
      "date": "2026-01-06",
      "CalendarWeek": "2",
      "day": "Dienstag",
      "mealtime": "Mittagessen",
      "IdentNr": "12026010698005",
      "itemId": "21064",
      "RecipeID": "8330",
      "ProductPrice": "1.50",
      "ProductPrice_2": null,
      "GastDesc_de": "Saftige Brownie-Bananen-Cookies | Zuckerfrei",
      "GastDesc_en": "Fudgy Brownie Banana Cookies | Sugar-Free",
      "MenuName": "PEOPLES CHOICE",
      "allergene": {
        "erdnuss": "Erdnüsse und Erdnusserzeugnisse"
      },
      "merkmale": {
        "ohne_zucker": "Ohne_Zucker",
        "vegan": "Vegan",
        "vegetarisch": "Vegetarisch"
      },
      "naehrstoffe": "",
      "zusatzstoffe": null,
      "PrintOrder": "5",
      "CO2Value": null,
      "CO2Rating": null,
      "CO2Perc": null,
      "ClimateFriendly": null,
      "GastDesc": "Saftige Brownie-Bananen-Cookies | Zuckerfrei",
      "date_de": "06.01.2026"
    },
    {
      "id": "5078020",
      "outlet": "cafe",
      "date": "2026-01-06",
      "CalendarWeek": "2",
      "day": "Dienstag",
      "mealtime": "Mittagessen",
      "IdentNr": "12026010698006",
      "itemId": "21061",
      "RecipeID": "8697",
      "ProductPrice": "2.50",
      "ProductPrice_2": null,
      "GastDesc_de": "Erdnussbutter-Cookie mit Schokolade und Salzkaramell | Vegan",
      "GastDesc_en": "Peanutbutter Cookie with Chocolate Salty Caramel | Vegan",
      "MenuName": "SEASON",
      "allergene": {
        "gluten": "Glutenhaltiges Getreide",
        "soja": "Soja und Sojaerzeugnisse",
        "erdnuss": "Erdnüsse und Erdnusserzeugnisse"
      },
      "merkmale": "",
      "naehrstoffe": "",
      "zusatzstoffe": [
        {
          "de": "Farbstoff",
          "en": "Colouring Agent"
        },
        {
          "de": "Antioxidationsmittel",
          "en": "Antioxidation"
        },
        {
          "de": "Alkohol",
          "en": "Alcohol"
        }
      ],
      "PrintOrder": "6",
      "CO2Value": null,
      "CO2Rating": null,
      "CO2Perc": null,
      "ClimateFriendly": null,
      "GastDesc": "Erdnussbutter-Cookie mit Schokolade und Salzkaramell | Vegan",
      "date_de": "06.01.2026"
    },
    {
      "id": "5078021",
      "outlet": "cafe",
      "date": "2026-01-06",
      "CalendarWeek": "2",
      "day": "Dienstag",
      "mealtime": "Mittagessen",
      "IdentNr": "12026010698007",
      "itemId": "12776",
      "RecipeID": "8453",
      "ProductPrice": "2.50",
      "ProductPrice_2": null,
      "GastDesc_de": "Oreo-Cheesecake-Cookies",
      "GastDesc_en": "Oreo Cheesecake Cookies",
      "MenuName": "COOKIE",
      "allergene": {
        "gluten": "Glutenhaltiges Getreide",
        "huhnerei": "Hühnerei und Hühnereierzeugnisse",
        "milch": "Milch und Milcherzeugnisse"
      },
      "merkmale": "",
      "naehrstoffe": "",
      "zusatzstoffe": [
        {
          "de": "Farbstoff",
          "en": "Colouring Agent"
        },
        {
          "de": "Alkohol",
          "en": "Alcohol"
        }
      ],
      "PrintOrder": "7",
      "CO2Value": null,
      "CO2Rating": null,
      "CO2Perc": null,
      "ClimateFriendly": null,
      "GastDesc": "Oreo-Cheesecake-Cookies",
      "date_de": "06.01.2026"
    },
    {
      "id": "5078022",
      "outlet": "cafe",
      "date": "2026-01-06",
      "CalendarWeek": "2",
      "day": "Dienstag",
      "mealtime": "Mittagessen",
      "IdentNr": "12026010698008",
      "itemId": "12777",
      "RecipeID": "8349",
      "ProductPrice": "2.70",
      "ProductPrice_2": null,
      "GastDesc_de": "\"Banana Bread\" mit Blaubeeren | Zuckerfrei",
      "GastDesc_en": "\"Banana Bread\" with Blueberries | Sugar-Free",
      "MenuName": "TAG des KASTENKUCHENS",
      "allergene": {
        "gluten": "Glutenhaltiges Getreide",
        "huhnerei": "Hühnerei und Hühnereierzeugnisse",
        "milch": "Milch und Milcherzeugnisse"
      },
      "merkmale": {
        "ohne_zucker": "Ohne_Zucker"
      },
      "naehrstoffe": "",
      "zusatzstoffe": null,
      "PrintOrder": "8",
      "CO2Value": null,
      "CO2Rating": null,
      "CO2Perc": null,
      "ClimateFriendly": null,
      "GastDesc": "\"Banana Bread\" mit Blaubeeren | Zuckerfrei",
      "date_de": "06.01.2026"
    },
    {
      "id": "5078023",
      "outlet": "cafe",
      "date": "2026-01-06",
      "CalendarWeek": "2",
      "day": "Dienstag",
      "mealtime": "Mittagessen",
      "IdentNr": "12026010698011",
      "itemId": "16256",
      "RecipeID": "8775",
      "ProductPrice": "1.50",
      "ProductPrice_2": null,
      "GastDesc_de": "Schwedische Haferkekse | Vegan",
      "GastDesc_en": "Swedish Style Oatmeal Cookies | Vegan",
      "MenuName": "VEGAN SPECIAL",
      "allergene": {
        "gluten": "Glutenhaltiges Getreide"
      },
      "merkmale": {
        "vegan": "Vegan",
        "vegetarisch": "Vegetarisch"
      },
      "naehrstoffe": "",
      "zusatzstoffe": [
        {
          "de": "Farbstoff",
          "en": "Colouring Agent"
        },
        {
          "de": "Antioxidationsmittel",
          "en": "Antioxidation"
        },
        {
          "de": "Alkohol",
          "en": "Alcohol"
        }
      ],
      "PrintOrder": "11",
      "CO2Value": null,
      "CO2Rating": null,
      "CO2Perc": null,
      "ClimateFriendly": null,
      "GastDesc": "Schwedische Haferkekse | Vegan",
      "date_de": "06.01.2026"
    },
    {
      "id": "5078024",
      "outlet": "cafe",
      "date": "2026-01-07",
      "CalendarWeek": "2",
      "day": "Mittwoch",
      "mealtime": "Mittagessen",
      "IdentNr": "12026010798001",
      "itemId": "21059",
      "RecipeID": "8054",
      "ProductPrice": "3.20",
      "ProductPrice_2": null,
      "GastDesc_de": "Pflaumenmus-Croffin mit Vanilleschmand",
      "GastDesc_en": "Plum jam Croffin with vanilla sour cream",
      "MenuName": "CROFFIN",
      "allergene": {
        "gluten": "Glutenhaltiges Getreide",
        "schalenfruchte": "Schalenfrüchte und Schalenfruchterzeugnisse",
        "huhnerei": "Hühnerei und Hühnereierzeugnisse",
        "soja": "Soja und Sojaerzeugnisse",
        "milch": "Milch und Milcherzeugnisse"
      },
      "merkmale": "",
      "naehrstoffe": "",
      "zusatzstoffe": [
        {
          "de": "Farbstoff",
          "en": "Colouring Agent"
        },
        {
          "de": "Alkohol",
          "en": "Alcohol"
        }
      ],
      "PrintOrder": "1",
      "CO2Value": null,
      "CO2Rating": null,
      "CO2Perc": null,
      "ClimateFriendly": null,
      "GastDesc": "Pflaumenmus-Croffin mit Vanilleschmand",
      "date_de": "07.01.2026"
    },
    {
      "id": "5078025",
      "outlet": "cafe",
      "date": "2026-01-07",
      "CalendarWeek": "2",
      "day": "Mittwoch",
      "mealtime": "Mittagessen",
      "IdentNr": "12026010798002",
      "itemId": "21062",
      "RecipeID": "8871",
      "ProductPrice": "3.60",
      "ProductPrice_2": null,
      "GastDesc_de": "Baskischer Cheesecake mit Johannisbeer-Birnenkompott",
      "GastDesc_en": "Basque-style Cheesecake with Black Currant and Pear Compote",
      "MenuName": "FAVOURITES",
      "allergene": {
        "huhnerei": "Hühnerei und Hühnereierzeugnisse",
        "milch": "Milch und Milcherzeugnisse"
      },
      "merkmale": "",
      "naehrstoffe": "",
      "zusatzstoffe": [
        {
          "de": "Farbstoff",
          "en": "Colouring Agent"
        },
        {
          "de": "Alkohol",
          "en": "Alcohol"
        }
      ],
      "PrintOrder": "2",
      "CO2Value": null,
      "CO2Rating": null,
      "CO2Perc": null,
      "ClimateFriendly": null,
      "GastDesc": "Baskischer Cheesecake mit Johannisbeer-Birnenkompott",
      "date_de": "07.01.2026"
    },
    {
      "id": "5078026",
      "outlet": "cafe",
      "date": "2026-01-07",
      "CalendarWeek": "2",
      "day": "Mittwoch",
      "mealtime": "Mittagessen",
      "IdentNr": "12026010798003",
      "itemId": "21063",
      "RecipeID": "8211",
      "ProductPrice": "0.50",
      "ProductPrice_2": null,
      "GastDesc_de": "LES ARLETTES (Französische Blätterteigkekse) Vegan",
      "GastDesc_en": "LES ARLETTES  (French Puff Pastry Cookies) Vegan",
      "MenuName": "MINIS",
      "allergene": {
        "gluten": "Glutenhaltiges Getreide"
      },
      "merkmale": {
        "vegan": "Vegan",
        "vegetarisch": "Vegetarisch"
      },
      "naehrstoffe": "",
      "zusatzstoffe": [
        {
          "de": "Farbstoff",
          "en": "Colouring Agent"
        },
        {
          "de": "Alkohol",
          "en": "Alcohol"
        }
      ],
      "PrintOrder": "3",
      "CO2Value": null,
      "CO2Rating": null,
      "CO2Perc": null,
      "ClimateFriendly": null,
      "GastDesc": "LES ARLETTES (Französische Blätterteigkekse) Vegan",
      "date_de": "07.01.2026"
    },
    {
      "id": "5078027",
      "outlet": "cafe",
      "date": "2026-01-07",
      "CalendarWeek": "2",
      "day": "Mittwoch",
      "mealtime": "Mittagessen",
      "IdentNr": "12026010798005",
      "itemId": "21064",
      "RecipeID": "8330",
      "ProductPrice": "1.50",
      "ProductPrice_2": null,
      "GastDesc_de": "Saftige Brownie-Bananen-Cookies | Zuckerfrei",
      "GastDesc_en": "Fudgy Brownie Banana Cookies | Sugar-Free",
      "MenuName": "PEOPLES CHOICE",
      "allergene": {
        "erdnuss": "Erdnüsse und Erdnusserzeugnisse"
      },
      "merkmale": {
        "ohne_zucker": "Ohne_Zucker",
        "vegan": "Vegan",
        "vegetarisch": "Vegetarisch"
      },
      "naehrstoffe": "",
      "zusatzstoffe": null,
      "PrintOrder": "5",
      "CO2Value": null,
      "CO2Rating": null,
      "CO2Perc": null,
      "ClimateFriendly": null,
      "GastDesc": "Saftige Brownie-Bananen-Cookies | Zuckerfrei",
      "date_de": "07.01.2026"
    },
    {
      "id": "5078028",
      "outlet": "cafe",
      "date": "2026-01-07",
      "CalendarWeek": "2",
      "day": "Mittwoch",
      "mealtime": "Mittagessen",
      "IdentNr": "12026010798006",
      "itemId": "21061",
      "RecipeID": "8697",
      "ProductPrice": "2.50",
      "ProductPrice_2": null,
      "GastDesc_de": "Erdnussbutter-Cookie mit Schokolade und Salzkaramell | Vegan",
      "GastDesc_en": "Peanutbutter Cookie with Chocolate Salty Caramel | Vegan",
      "MenuName": "SEASON",
      "allergene": {
        "gluten": "Glutenhaltiges Getreide",
        "soja": "Soja und Sojaerzeugnisse",
        "erdnuss": "Erdnüsse und Erdnusserzeugnisse"
      },
      "merkmale": "",
      "naehrstoffe": "",
      "zusatzstoffe": [
        {
          "de": "Farbstoff",
          "en": "Colouring Agent"
        },
        {
          "de": "Antioxidationsmittel",
          "en": "Antioxidation"
        },
        {
          "de": "Alkohol",
          "en": "Alcohol"
        }
      ],
      "PrintOrder": "6",
      "CO2Value": null,
      "CO2Rating": null,
      "CO2Perc": null,
      "ClimateFriendly": null,
      "GastDesc": "Erdnussbutter-Cookie mit Schokolade und Salzkaramell | Vegan",
      "date_de": "07.01.2026"
    },
    {
      "id": "5078029",
      "outlet": "cafe",
      "date": "2026-01-07",
      "CalendarWeek": "2",
      "day": "Mittwoch",
      "mealtime": "Mittagessen",
      "IdentNr": "12026010798007",
      "itemId": "12776",
      "RecipeID": "8453",
      "ProductPrice": "2.50",
      "ProductPrice_2": null,
      "GastDesc_de": "Oreo-Cheesecake-Cookies",
      "GastDesc_en": "Oreo Cheesecake Cookies",
      "MenuName": "COOKIE",
      "allergene": {
        "gluten": "Glutenhaltiges Getreide",
        "huhnerei": "Hühnerei und Hühnereierzeugnisse",
        "milch": "Milch und Milcherzeugnisse"
      },
      "merkmale": "",
      "naehrstoffe": "",
      "zusatzstoffe": [
        {
          "de": "Farbstoff",
          "en": "Colouring Agent"
        },
        {
          "de": "Alkohol",
          "en": "Alcohol"
        }
      ],
      "PrintOrder": "7",
      "CO2Value": null,
      "CO2Rating": null,
      "CO2Perc": null,
      "ClimateFriendly": null,
      "GastDesc": "Oreo-Cheesecake-Cookies",
      "date_de": "07.01.2026"
    },
    {
      "id": "5078030",
      "outlet": "cafe",
      "date": "2026-01-07",
      "CalendarWeek": "2",
      "day": "Mittwoch",
      "mealtime": "Mittagessen",
      "IdentNr": "12026010798008",
      "itemId": "12777",
      "RecipeID": "8349",
      "ProductPrice": "2.70",
      "ProductPrice_2": null,
      "GastDesc_de": "\"Banana Bread\" mit Blaubeeren | Zuckerfrei",
      "GastDesc_en": "\"Banana Bread\" with Blueberries | Sugar-Free",
      "MenuName": "TAG des KASTENKUCHENS",
      "allergene": {
        "gluten": "Glutenhaltiges Getreide",
        "huhnerei": "Hühnerei und Hühnereierzeugnisse",
        "milch": "Milch und Milcherzeugnisse"
      },
      "merkmale": {
        "ohne_zucker": "Ohne_Zucker"
      },
      "naehrstoffe": "",
      "zusatzstoffe": null,
      "PrintOrder": "8",
      "CO2Value": null,
      "CO2Rating": null,
      "CO2Perc": null,
      "ClimateFriendly": null,
      "GastDesc": "\"Banana Bread\" mit Blaubeeren | Zuckerfrei",
      "date_de": "07.01.2026"
    },
    {
      "id": "5078031",
      "outlet": "cafe",
      "date": "2026-01-07",
      "CalendarWeek": "2",
      "day": "Mittwoch",
      "mealtime": "Mittagessen",
      "IdentNr": "12026010798011",
      "itemId": "16256",
      "RecipeID": "8775",
      "ProductPrice": "1.50",
      "ProductPrice_2": null,
      "GastDesc_de": "Schwedische Haferkekse | Vegan",
      "GastDesc_en": "Swedish Style Oatmeal Cookies | Vegan",
      "MenuName": "VEGAN SPECIAL",
      "allergene": {
        "gluten": "Glutenhaltiges Getreide"
      },
      "merkmale": {
        "vegan": "Vegan",
        "vegetarisch": "Vegetarisch"
      },
      "naehrstoffe": "",
      "zusatzstoffe": [
        {
          "de": "Farbstoff",
          "en": "Colouring Agent"
        },
        {
          "de": "Antioxidationsmittel",
          "en": "Antioxidation"
        },
        {
          "de": "Alkohol",
          "en": "Alcohol"
        }
      ],
      "PrintOrder": "11",
      "CO2Value": null,
      "CO2Rating": null,
      "CO2Perc": null,
      "ClimateFriendly": null,
      "GastDesc": "Schwedische Haferkekse | Vegan",
      "date_de": "07.01.2026"
    },
    {
      "id": "5078032",
      "outlet": "cafe",
      "date": "2026-01-08",
      "CalendarWeek": "2",
      "day": "Donnerstag",
      "mealtime": "Mittagessen",
      "IdentNr": "12026010898001",
      "itemId": "21059",
      "RecipeID": "8054",
      "ProductPrice": "3.20",
      "ProductPrice_2": null,
      "GastDesc_de": "Pflaumenmus-Croffin mit Vanilleschmand",
      "GastDesc_en": "Plum jam Croffin with vanilla sour cream",
      "MenuName": "CROFFIN",
      "allergene": {
        "gluten": "Glutenhaltiges Getreide",
        "schalenfruchte": "Schalenfrüchte und Schalenfruchterzeugnisse",
        "huhnerei": "Hühnerei und Hühnereierzeugnisse",
        "soja": "Soja und Sojaerzeugnisse",
        "milch": "Milch und Milcherzeugnisse"
      },
      "merkmale": "",
      "naehrstoffe": "",
      "zusatzstoffe": [
        {
          "de": "Farbstoff",
          "en": "Colouring Agent"
        },
        {
          "de": "Alkohol",
          "en": "Alcohol"
        }
      ],
      "PrintOrder": "1",
      "CO2Value": null,
      "CO2Rating": null,
      "CO2Perc": null,
      "ClimateFriendly": null,
      "GastDesc": "Pflaumenmus-Croffin mit Vanilleschmand",
      "date_de": "08.01.2026"
    },
    {
      "id": "5078033",
      "outlet": "cafe",
      "date": "2026-01-08",
      "CalendarWeek": "2",
      "day": "Donnerstag",
      "mealtime": "Mittagessen",
      "IdentNr": "12026010898002",
      "itemId": "21062",
      "RecipeID": "8871",
      "ProductPrice": "3.60",
      "ProductPrice_2": null,
      "GastDesc_de": "Baskischer Cheesecake mit Johannisbeer-Birnenkompott",
      "GastDesc_en": "Basque-style Cheesecake with Black Currant and Pear Compote",
      "MenuName": "FAVOURITES",
      "allergene": {
        "huhnerei": "Hühnerei und Hühnereierzeugnisse",
        "milch": "Milch und Milcherzeugnisse"
      },
      "merkmale": "",
      "naehrstoffe": "",
      "zusatzstoffe": [
        {
          "de": "Farbstoff",
          "en": "Colouring Agent"
        },
        {
          "de": "Alkohol",
          "en": "Alcohol"
        }
      ],
      "PrintOrder": "2",
      "CO2Value": null,
      "CO2Rating": null,
      "CO2Perc": null,
      "ClimateFriendly": null,
      "GastDesc": "Baskischer Cheesecake mit Johannisbeer-Birnenkompott",
      "date_de": "08.01.2026"
    },
    {
      "id": "5078034",
      "outlet": "cafe",
      "date": "2026-01-08",
      "CalendarWeek": "2",
      "day": "Donnerstag",
      "mealtime": "Mittagessen",
      "IdentNr": "12026010898003",
      "itemId": "21063",
      "RecipeID": "8211",
      "ProductPrice": "0.50",
      "ProductPrice_2": null,
      "GastDesc_de": "LES ARLETTES (Französische Blätterteigkekse) Vegan",
      "GastDesc_en": "LES ARLETTES  (French Puff Pastry Cookies) Vegan",
      "MenuName": "MINIS",
      "allergene": {
        "gluten": "Glutenhaltiges Getreide"
      },
      "merkmale": {
        "vegan": "Vegan",
        "vegetarisch": "Vegetarisch"
      },
      "naehrstoffe": "",
      "zusatzstoffe": [
        {
          "de": "Farbstoff",
          "en": "Colouring Agent"
        },
        {
          "de": "Alkohol",
          "en": "Alcohol"
        }
      ],
      "PrintOrder": "3",
      "CO2Value": null,
      "CO2Rating": null,
      "CO2Perc": null,
      "ClimateFriendly": null,
      "GastDesc": "LES ARLETTES (Französische Blätterteigkekse) Vegan",
      "date_de": "08.01.2026"
    },
    {
      "id": "5078035",
      "outlet": "cafe",
      "date": "2026-01-08",
      "CalendarWeek": "2",
      "day": "Donnerstag",
      "mealtime": "Mittagessen",
      "IdentNr": "12026010898005",
      "itemId": "21064",
      "RecipeID": "8330",
      "ProductPrice": "1.50",
      "ProductPrice_2": null,
      "GastDesc_de": "Saftige Brownie-Bananen-Cookies | Zuckerfrei",
      "GastDesc_en": "Fudgy Brownie Banana Cookies | Sugar-Free",
      "MenuName": "PEOPLES CHOICE",
      "allergene": {
        "erdnuss": "Erdnüsse und Erdnusserzeugnisse"
      },
      "merkmale": {
        "ohne_zucker": "Ohne_Zucker",
        "vegan": "Vegan",
        "vegetarisch": "Vegetarisch"
      },
      "naehrstoffe": "",
      "zusatzstoffe": null,
      "PrintOrder": "5",
      "CO2Value": null,
      "CO2Rating": null,
      "CO2Perc": null,
      "ClimateFriendly": null,
      "GastDesc": "Saftige Brownie-Bananen-Cookies | Zuckerfrei",
      "date_de": "08.01.2026"
    },
    {
      "id": "5078036",
      "outlet": "cafe",
      "date": "2026-01-08",
      "CalendarWeek": "2",
      "day": "Donnerstag",
      "mealtime": "Mittagessen",
      "IdentNr": "12026010898006",
      "itemId": "21061",
      "RecipeID": "8697",
      "ProductPrice": "2.50",
      "ProductPrice_2": null,
      "GastDesc_de": "Erdnussbutter-Cookie mit Schokolade und Salzkaramell | Vegan",
      "GastDesc_en": "Peanutbutter Cookie with Chocolate Salty Caramel | Vegan",
      "MenuName": "SEASON",
      "allergene": {
        "gluten": "Glutenhaltiges Getreide",
        "soja": "Soja und Sojaerzeugnisse",
        "erdnuss": "Erdnüsse und Erdnusserzeugnisse"
      },
      "merkmale": "",
      "naehrstoffe": "",
      "zusatzstoffe": [
        {
          "de": "Farbstoff",
          "en": "Colouring Agent"
        },
        {
          "de": "Antioxidationsmittel",
          "en": "Antioxidation"
        },
        {
          "de": "Alkohol",
          "en": "Alcohol"
        }
      ],
      "PrintOrder": "6",
      "CO2Value": null,
      "CO2Rating": null,
      "CO2Perc": null,
      "ClimateFriendly": null,
      "GastDesc": "Erdnussbutter-Cookie mit Schokolade und Salzkaramell | Vegan",
      "date_de": "08.01.2026"
    },
    {
      "id": "5078037",
      "outlet": "cafe",
      "date": "2026-01-08",
      "CalendarWeek": "2",
      "day": "Donnerstag",
      "mealtime": "Mittagessen",
      "IdentNr": "12026010898007",
      "itemId": "12776",
      "RecipeID": "8453",
      "ProductPrice": "2.50",
      "ProductPrice_2": null,
      "GastDesc_de": "Oreo-Cheesecake-Cookies",
      "GastDesc_en": "Oreo Cheesecake Cookies",
      "MenuName": "COOKIE",
      "allergene": {
        "gluten": "Glutenhaltiges Getreide",
        "huhnerei": "Hühnerei und Hühnereierzeugnisse",
        "milch": "Milch und Milcherzeugnisse"
      },
      "merkmale": "",
      "naehrstoffe": "",
      "zusatzstoffe": [
        {
          "de": "Farbstoff",
          "en": "Colouring Agent"
        },
        {
          "de": "Alkohol",
          "en": "Alcohol"
        }
      ],
      "PrintOrder": "7",
      "CO2Value": null,
      "CO2Rating": null,
      "CO2Perc": null,
      "ClimateFriendly": null,
      "GastDesc": "Oreo-Cheesecake-Cookies",
      "date_de": "08.01.2026"
    },
    {
      "id": "5078038",
      "outlet": "cafe",
      "date": "2026-01-08",
      "CalendarWeek": "2",
      "day": "Donnerstag",
      "mealtime": "Mittagessen",
      "IdentNr": "12026010898008",
      "itemId": "12777",
      "RecipeID": "8349",
      "ProductPrice": "2.70",
      "ProductPrice_2": null,
      "GastDesc_de": "\"Banana Bread\" mit Blaubeeren | Zuckerfrei",
      "GastDesc_en": "\"Banana Bread\" with Blueberries | Sugar-Free",
      "MenuName": "TAG des KASTENKUCHENS",
      "allergene": {
        "gluten": "Glutenhaltiges Getreide",
        "huhnerei": "Hühnerei und Hühnereierzeugnisse",
        "milch": "Milch und Milcherzeugnisse"
      },
      "merkmale": {
        "ohne_zucker": "Ohne_Zucker"
      },
      "naehrstoffe": "",
      "zusatzstoffe": null,
      "PrintOrder": "8",
      "CO2Value": null,
      "CO2Rating": null,
      "CO2Perc": null,
      "ClimateFriendly": null,
      "GastDesc": "\"Banana Bread\" mit Blaubeeren | Zuckerfrei",
      "date_de": "08.01.2026"
    },
    {
      "id": "5078039",
      "outlet": "cafe",
      "date": "2026-01-08",
      "CalendarWeek": "2",
      "day": "Donnerstag",
      "mealtime": "Mittagessen",
      "IdentNr": "12026010898011",
      "itemId": "16256",
      "RecipeID": "8775",
      "ProductPrice": "1.50",
      "ProductPrice_2": null,
      "GastDesc_de": "Schwedische Haferkekse | Vegan",
      "GastDesc_en": "Swedish Style Oatmeal Cookies | Vegan",
      "MenuName": "VEGAN SPECIAL",
      "allergene": {
        "gluten": "Glutenhaltiges Getreide"
      },
      "merkmale": {
        "vegan": "Vegan",
        "vegetarisch": "Vegetarisch"
      },
      "naehrstoffe": "",
      "zusatzstoffe": [
        {
          "de": "Farbstoff",
          "en": "Colouring Agent"
        },
        {
          "de": "Antioxidationsmittel",
          "en": "Antioxidation"
        },
        {
          "de": "Alkohol",
          "en": "Alcohol"
        }
      ],
      "PrintOrder": "11",
      "CO2Value": null,
      "CO2Rating": null,
      "CO2Perc": null,
      "ClimateFriendly": null,
      "GastDesc": "Schwedische Haferkekse | Vegan",
      "date_de": "08.01.2026"
    },
    {
      "id": "5078040",
      "outlet": "cafe",
      "date": "2026-01-09",
      "CalendarWeek": "2",
      "day": "Freitag",
      "mealtime": "Mittagessen",
      "IdentNr": "12026010998001",
      "itemId": "21059",
      "RecipeID": "8054",
      "ProductPrice": "3.20",
      "ProductPrice_2": null,
      "GastDesc_de": "Pflaumenmus-Croffin mit Vanilleschmand",
      "GastDesc_en": "Plum jam Croffin with vanilla sour cream",
      "MenuName": "CROFFIN",
      "allergene": {
        "gluten": "Glutenhaltiges Getreide",
        "schalenfruchte": "Schalenfrüchte und Schalenfruchterzeugnisse",
        "huhnerei": "Hühnerei und Hühnereierzeugnisse",
        "soja": "Soja und Sojaerzeugnisse",
        "milch": "Milch und Milcherzeugnisse"
      },
      "merkmale": "",
      "naehrstoffe": "",
      "zusatzstoffe": [
        {
          "de": "Farbstoff",
          "en": "Colouring Agent"
        },
        {
          "de": "Alkohol",
          "en": "Alcohol"
        }
      ],
      "PrintOrder": "1",
      "CO2Value": null,
      "CO2Rating": null,
      "CO2Perc": null,
      "ClimateFriendly": null,
      "GastDesc": "Pflaumenmus-Croffin mit Vanilleschmand",
      "date_de": "09.01.2026"
    },
    {
      "id": "5078041",
      "outlet": "cafe",
      "date": "2026-01-09",
      "CalendarWeek": "2",
      "day": "Freitag",
      "mealtime": "Mittagessen",
      "IdentNr": "12026010998002",
      "itemId": "21062",
      "RecipeID": "8871",
      "ProductPrice": "3.60",
      "ProductPrice_2": null,
      "GastDesc_de": "Baskischer Cheesecake mit Johannisbeer-Birnenkompott",
      "GastDesc_en": "Basque-style Cheesecake with Black Currant and Pear Compote",
      "MenuName": "FAVOURITES",
      "allergene": {
        "huhnerei": "Hühnerei und Hühnereierzeugnisse",
        "milch": "Milch und Milcherzeugnisse"
      },
      "merkmale": "",
      "naehrstoffe": "",
      "zusatzstoffe": [
        {
          "de": "Farbstoff",
          "en": "Colouring Agent"
        },
        {
          "de": "Alkohol",
          "en": "Alcohol"
        }
      ],
      "PrintOrder": "2",
      "CO2Value": null,
      "CO2Rating": null,
      "CO2Perc": null,
      "ClimateFriendly": null,
      "GastDesc": "Baskischer Cheesecake mit Johannisbeer-Birnenkompott",
      "date_de": "09.01.2026"
    },
    {
      "id": "5078042",
      "outlet": "cafe",
      "date": "2026-01-09",
      "CalendarWeek": "2",
      "day": "Freitag",
      "mealtime": "Mittagessen",
      "IdentNr": "12026010998003",
      "itemId": "21063",
      "RecipeID": "8211",
      "ProductPrice": "0.50",
      "ProductPrice_2": null,
      "GastDesc_de": "LES ARLETTES (Französische Blätterteigkekse) Vegan",
      "GastDesc_en": "LES ARLETTES  (French Puff Pastry Cookies) Vegan",
      "MenuName": "MINIS",
      "allergene": {
        "gluten": "Glutenhaltiges Getreide"
      },
      "merkmale": {
        "vegan": "Vegan",
        "vegetarisch": "Vegetarisch"
      },
      "naehrstoffe": "",
      "zusatzstoffe": [
        {
          "de": "Farbstoff",
          "en": "Colouring Agent"
        },
        {
          "de": "Alkohol",
          "en": "Alcohol"
        }
      ],
      "PrintOrder": "3",
      "CO2Value": null,
      "CO2Rating": null,
      "CO2Perc": null,
      "ClimateFriendly": null,
      "GastDesc": "LES ARLETTES (Französische Blätterteigkekse) Vegan",
      "date_de": "09.01.2026"
    },
    {
      "id": "5078043",
      "outlet": "cafe",
      "date": "2026-01-09",
      "CalendarWeek": "2",
      "day": "Freitag",
      "mealtime": "Mittagessen",
      "IdentNr": "12026010998005",
      "itemId": "21064",
      "RecipeID": "8330",
      "ProductPrice": "1.50",
      "ProductPrice_2": null,
      "GastDesc_de": "Saftige Brownie-Bananen-Cookies | Zuckerfrei",
      "GastDesc_en": "Fudgy Brownie Banana Cookies | Sugar-Free",
      "MenuName": "PEOPLES CHOICE",
      "allergene": {
        "erdnuss": "Erdnüsse und Erdnusserzeugnisse"
      },
      "merkmale": {
        "ohne_zucker": "Ohne_Zucker",
        "vegan": "Vegan",
        "vegetarisch": "Vegetarisch"
      },
      "naehrstoffe": "",
      "zusatzstoffe": null,
      "PrintOrder": "5",
      "CO2Value": null,
      "CO2Rating": null,
      "CO2Perc": null,
      "ClimateFriendly": null,
      "GastDesc": "Saftige Brownie-Bananen-Cookies | Zuckerfrei",
      "date_de": "09.01.2026"
    },
    {
      "id": "5078044",
      "outlet": "cafe",
      "date": "2026-01-09",
      "CalendarWeek": "2",
      "day": "Freitag",
      "mealtime": "Mittagessen",
      "IdentNr": "12026010998006",
      "itemId": "21061",
      "RecipeID": "8697",
      "ProductPrice": "2.50",
      "ProductPrice_2": null,
      "GastDesc_de": "Erdnussbutter-Cookie mit Schokolade und Salzkaramell | Vegan",
      "GastDesc_en": "Peanutbutter Cookie with Chocolate Salty Caramel | Vegan",
      "MenuName": "SEASON",
      "allergene": {
        "gluten": "Glutenhaltiges Getreide",
        "soja": "Soja und Sojaerzeugnisse",
        "erdnuss": "Erdnüsse und Erdnusserzeugnisse"
      },
      "merkmale": "",
      "naehrstoffe": "",
      "zusatzstoffe": [
        {
          "de": "Farbstoff",
          "en": "Colouring Agent"
        },
        {
          "de": "Antioxidationsmittel",
          "en": "Antioxidation"
        },
        {
          "de": "Alkohol",
          "en": "Alcohol"
        }
      ],
      "PrintOrder": "6",
      "CO2Value": null,
      "CO2Rating": null,
      "CO2Perc": null,
      "ClimateFriendly": null,
      "GastDesc": "Erdnussbutter-Cookie mit Schokolade und Salzkaramell | Vegan",
      "date_de": "09.01.2026"
    },
    {
      "id": "5078045",
      "outlet": "cafe",
      "date": "2026-01-09",
      "CalendarWeek": "2",
      "day": "Freitag",
      "mealtime": "Mittagessen",
      "IdentNr": "12026010998007",
      "itemId": "12776",
      "RecipeID": "8453",
      "ProductPrice": "2.50",
      "ProductPrice_2": null,
      "GastDesc_de": "Oreo-Cheesecake-Cookies",
      "GastDesc_en": "Oreo Cheesecake Cookies",
      "MenuName": "COOKIE",
      "allergene": {
        "gluten": "Glutenhaltiges Getreide",
        "huhnerei": "Hühnerei und Hühnereierzeugnisse",
        "milch": "Milch und Milcherzeugnisse"
      },
      "merkmale": "",
      "naehrstoffe": "",
      "zusatzstoffe": [
        {
          "de": "Farbstoff",
          "en": "Colouring Agent"
        },
        {
          "de": "Alkohol",
          "en": "Alcohol"
        }
      ],
      "PrintOrder": "7",
      "CO2Value": null,
      "CO2Rating": null,
      "CO2Perc": null,
      "ClimateFriendly": null,
      "GastDesc": "Oreo-Cheesecake-Cookies",
      "date_de": "09.01.2026"
    },
    {
      "id": "5078046",
      "outlet": "cafe",
      "date": "2026-01-09",
      "CalendarWeek": "2",
      "day": "Freitag",
      "mealtime": "Mittagessen",
      "IdentNr": "12026010998008",
      "itemId": "12777",
      "RecipeID": "8349",
      "ProductPrice": "2.70",
      "ProductPrice_2": null,
      "GastDesc_de": "\"Banana Bread\" mit Blaubeeren | Zuckerfrei",
      "GastDesc_en": "\"Banana Bread\" with Blueberries | Sugar-Free",
      "MenuName": "TAG des KASTENKUCHENS",
      "allergene": {
        "gluten": "Glutenhaltiges Getreide",
        "huhnerei": "Hühnerei und Hühnereierzeugnisse",
        "milch": "Milch und Milcherzeugnisse"
      },
      "merkmale": {
        "ohne_zucker": "Ohne_Zucker"
      },
      "naehrstoffe": "",
      "zusatzstoffe": null,
      "PrintOrder": "8",
      "CO2Value": null,
      "CO2Rating": null,
      "CO2Perc": null,
      "ClimateFriendly": null,
      "GastDesc": "\"Banana Bread\" mit Blaubeeren | Zuckerfrei",
      "date_de": "09.01.2026"
    },
    {
      "id": "5078047",
      "outlet": "cafe",
      "date": "2026-01-09",
      "CalendarWeek": "2",
      "day": "Freitag",
      "mealtime": "Mittagessen",
      "IdentNr": "12026010998011",
      "itemId": "16256",
      "RecipeID": "8775",
      "ProductPrice": "1.50",
      "ProductPrice_2": null,
      "GastDesc_de": "Schwedische Haferkekse | Vegan",
      "GastDesc_en": "Swedish Style Oatmeal Cookies | Vegan",
      "MenuName": "VEGAN SPECIAL",
      "allergene": {
        "gluten": "Glutenhaltiges Getreide"
      },
      "merkmale": {
        "vegan": "Vegan",
        "vegetarisch": "Vegetarisch"
      },
      "naehrstoffe": "",
      "zusatzstoffe": [
        {
          "de": "Farbstoff",
          "en": "Colouring Agent"
        },
        {
          "de": "Antioxidationsmittel",
          "en": "Antioxidation"
        },
        {
          "de": "Alkohol",
          "en": "Alcohol"
        }
      ],
      "PrintOrder": "11",
      "CO2Value": null,
      "CO2Rating": null,
      "CO2Perc": null,
      "ClimateFriendly": null,
      "GastDesc": "Schwedische Haferkekse | Vegan",
      "date_de": "09.01.2026"
    },
    {
      "id": "5009423",
      "outlet": "canteen",
      "date": "2025-12-30",
      "CalendarWeek": "1",
      "day": "Dienstag",
      "mealtime": "Mittagessen",
      "IdentNr": "12025123098000",
      "itemId": "17549",
      "RecipeID": "5008",
      "ProductPrice": "11.00",
      "ProductPrice_2": null,
      "GastDesc_de": "Hoi Sin | Champignon | Bulgur",
      "GastDesc_en": "Hoi Sin | Mushroom | Bulgur",
      "MenuName": "COUNTER 1.1 Bowls_",
      "allergene": {
        "gluten": "Glutenhaltiges Getreide",
        "soja": "Soja und Sojaerzeugnisse",
        "sellerie": "Sellerie und Sellerieerzeugnisse",
        "sesam": "Sesamsamen und Sesamsamenerzeugnisse",
        "schwefel": "Schwefeldioxid und Sulfide"
      },
      "merkmale": {
        "vegan": "Vegan",
        "vegetarisch": "Vegetarisch"
      },
      "naehrstoffe": "",
      "zusatzstoffe": [
        {
          "de": "geschwefelt",
          "en": "Sulphurous"
        },
        {
          "de": "Farbstoff",
          "en": "Colouring Agent"
        },
        {
          "de": "Antioxidationsmittel",
          "en": "Antioxidation"
        },
        {
          "de": "Alkohol",
          "en": "Alcohol"
        }
      ],
      "PrintOrder": "0",
      "CO2Value": "712.00",
      "CO2Rating": "B",
      "CO2Perc": "100.00",
      "ClimateFriendly": null,
      "GastDesc": "Hoi Sin | Champignon | Bulgur",
      "date_de": "30.12.2025"
    },
    {
      "id": "5009424",
      "outlet": "canteen",
      "date": "2025-12-30",
      "CalendarWeek": "1",
      "day": "Dienstag",
      "mealtime": "Mittagessen",
      "IdentNr": "12025123098001",
      "itemId": "17550",
      "RecipeID": "8841",
      "ProductPrice": "12.00",
      "ProductPrice_2": null,
      "GastDesc_de": "Jamaican-Pork-Curry | Erbsen | Butterreis",
      "GastDesc_en": "Jamaican pork curry | Green Peas | Butter Rice",
      "MenuName": "COUNTER 2.1 Meat",
      "allergene": {
        "milch": "Milch und Milcherzeugnisse",
        "sellerie": "Sellerie und Sellerieerzeugnisse"
      },
      "merkmale": {
        "schwein": "Schwein"
      },
      "naehrstoffe": "",
      "zusatzstoffe": null,
      "PrintOrder": "1",
      "CO2Value": "2439.00",
      "CO2Rating": "C",
      "CO2Perc": "100.00",
      "ClimateFriendly": null,
      "GastDesc": "Jamaican-Pork-Curry | Erbsen | Butterreis",
      "date_de": "30.12.2025"
    },
    {
      "id": "5009425",
      "outlet": "canteen",
      "date": "2025-12-30",
      "CalendarWeek": "1",
      "day": "Dienstag",
      "mealtime": "Mittagessen",
      "IdentNr": "12025123098003",
      "itemId": "17552",
      "RecipeID": "8538",
      "ProductPrice": "12.00",
      "ProductPrice_2": null,
      "GastDesc_de": "Rotbarsch | Süßkartoffel | Harissa",
      "GastDesc_en": "Redfish | Sweet Potato | Spicy Harissa",
      "MenuName": "COUNTER 3.1 Fish",
      "allergene": {
        "fisch": "Fisch und Fischerzeugnisse",
        "milch": "Milch und Milcherzeugnisse",
        "sellerie": "Sellerie und Sellerieerzeugnisse"
      },
      "merkmale": "",
      "naehrstoffe": "",
      "zusatzstoffe": null,
      "PrintOrder": "3",
      "CO2Value": "1024.00",
      "CO2Rating": "C",
      "CO2Perc": "100.00",
      "ClimateFriendly": null,
      "GastDesc": "Rotbarsch | Süßkartoffel | Harissa",
      "date_de": "30.12.2025"
    },
    {
      "id": "5009426",
      "outlet": "canteen",
      "date": "2025-12-30",
      "CalendarWeek": "1",
      "day": "Dienstag",
      "mealtime": "Mittagessen",
      "IdentNr": "12025123098005",
      "itemId": "17554",
      "RecipeID": "2840",
      "ProductPrice": "9.50",
      "ProductPrice_2": null,
      "GastDesc_de": "Grenaille Kartoffeln | Kräuterquark | Leinöl | Wildkräutersalat",
      "GastDesc_en": "Baby Potatoes I Herb curd I Linseed Oil I Wild herb salad",
      "MenuName": "COUNTER 4.1 Vegi",
      "allergene": {
        "milch": "Milch und Milcherzeugnisse"
      },
      "merkmale": {
        "vegetarisch": "Vegetarisch"
      },
      "naehrstoffe": "",
      "zusatzstoffe": null,
      "PrintOrder": "5",
      "CO2Value": "1162.00",
      "CO2Rating": "B",
      "CO2Perc": "100.00",
      "ClimateFriendly": null,
      "GastDesc": "Grenaille Kartoffeln | Kräuterquark | Leinöl | Wildkräutersalat",
      "date_de": "30.12.2025"
    },
    {
      "id": "5009427",
      "outlet": "canteen",
      "date": "2025-12-30",
      "CalendarWeek": "1",
      "day": "Dienstag",
      "mealtime": "Abendessen",
      "IdentNr": "12025123098009",
      "itemId": "17558",
      "RecipeID": "5008",
      "ProductPrice": "11.00",
      "ProductPrice_2": null,
      "GastDesc_de": "Hoi Sin | Champignon | Bulgur",
      "GastDesc_en": "Hoi Sin | Mushroom | Bulgur",
      "MenuName": "DINNER BOWL_",
      "allergene": {
        "gluten": "Glutenhaltiges Getreide",
        "soja": "Soja und Sojaerzeugnisse",
        "sellerie": "Sellerie und Sellerieerzeugnisse",
        "sesam": "Sesamsamen und Sesamsamenerzeugnisse",
        "schwefel": "Schwefeldioxid und Sulfide"
      },
      "merkmale": {
        "vegan": "Vegan",
        "vegetarisch": "Vegetarisch"
      },
      "naehrstoffe": "",
      "zusatzstoffe": [
        {
          "de": "geschwefelt",
          "en": "Sulphurous"
        },
        {
          "de": "Farbstoff",
          "en": "Colouring Agent"
        },
        {
          "de": "Antioxidationsmittel",
          "en": "Antioxidation"
        },
        {
          "de": "Alkohol",
          "en": "Alcohol"
        }
      ],
      "PrintOrder": "9",
      "CO2Value": "712.00",
      "CO2Rating": "B",
      "CO2Perc": "100.00",
      "ClimateFriendly": null,
      "GastDesc": "Hoi Sin | Champignon | Bulgur",
      "date_de": "30.12.2025"
    },
    {
      "id": "5009429",
      "outlet": "canteen",
      "date": "2025-12-30",
      "CalendarWeek": "1",
      "day": "Dienstag",
      "mealtime": "Abendessen",
      "IdentNr": "12025123098010",
      "itemId": "17559",
      "RecipeID": "8538",
      "ProductPrice": "12.00",
      "ProductPrice_2": null,
      "GastDesc_de": "Rotbarsch | Süßkartoffel | Harissa",
      "GastDesc_en": "Redfish | Sweet Potato | Spicy Harissa",
      "MenuName": "DINNER Meat_17:00-19:00",
      "allergene": {
        "fisch": "Fisch und Fischerzeugnisse",
        "milch": "Milch und Milcherzeugnisse",
        "sellerie": "Sellerie und Sellerieerzeugnisse"
      },
      "merkmale": "",
      "naehrstoffe": "",
      "zusatzstoffe": null,
      "PrintOrder": "10",
      "CO2Value": "1024.00",
      "CO2Rating": "C",
      "CO2Perc": "100.00",
      "ClimateFriendly": null,
      "GastDesc": "Rotbarsch | Süßkartoffel | Harissa",
      "date_de": "30.12.2025"
    },
    {
      "id": "5009431",
      "outlet": "canteen",
      "date": "2025-12-30",
      "CalendarWeek": "1",
      "day": "Dienstag",
      "mealtime": "Abendessen",
      "IdentNr": "12025123098011",
      "itemId": "17560",
      "RecipeID": "2840",
      "ProductPrice": "9.50",
      "ProductPrice_2": null,
      "GastDesc_de": "Grenaille Kartoffeln | Kräuterquark | Leinöl | Wildkräutersalat",
      "GastDesc_en": "Baby Potatoes I Herb curd I Linseed Oil I Wild herb salad",
      "MenuName": "DINNER Fish_17:00-19:00",
      "allergene": {
        "milch": "Milch und Milcherzeugnisse"
      },
      "merkmale": {
        "vegetarisch": "Vegetarisch"
      },
      "naehrstoffe": "",
      "zusatzstoffe": null,
      "PrintOrder": "11",
      "CO2Value": "1162.00",
      "CO2Rating": "B",
      "CO2Perc": "100.00",
      "ClimateFriendly": null,
      "GastDesc": "Grenaille Kartoffeln | Kräuterquark | Leinöl | Wildkräutersalat",
      "date_de": "30.12.2025"
    },
    {
      "id": "5040016",
      "outlet": "canteen",
      "date": "2026-01-01",
      "CalendarWeek": "1",
      "day": "Donnerstag",
      "mealtime": "Abendessen",
      "IdentNr": "12026010198018",
      "itemId": "17864",
      "RecipeID": "9000",
      "ProductPrice": "12.00",
      "ProductPrice_2": null,
      "GastDesc_de": "Currywurst | Fritten | Salat",
      "GastDesc_en": "Curry Sausage | Steakhouse Chips | Salad",
      "MenuName": "DINNER Meat _|",
      "allergene": {
        "huhnerei": "Hühnerei und Hühnereierzeugnisse",
        "sellerie": "Sellerie und Sellerieerzeugnisse",
        "senf": "Senf und Senferzeugnisse",
        "schwefel": "Schwefeldioxid und Sulfide"
      },
      "merkmale": "",
      "naehrstoffe": "",
      "zusatzstoffe": [
        {
          "de": "Süßungsmittel",
          "en": "Sweetener"
        },
        {
          "de": "Phosphat",
          "en": "Phosphate"
        },
        {
          "de": "Farbstoff",
          "en": "Colouring Agent"
        },
        {
          "de": "Antioxidationsmittel",
          "en": "Antioxidation"
        },
        {
          "de": "Konservierungsstoff",
          "en": "Preservatives"
        }
      ],
      "PrintOrder": "18",
      "CO2Value": "1038.00",
      "CO2Rating": "B",
      "CO2Perc": "100.00",
      "ClimateFriendly": null,
      "GastDesc": "Currywurst | Fritten | Salat",
      "date_de": "01.01.2026"
    },
    {
      "id": "5040018",
      "outlet": "canteen",
      "date": "2026-01-01",
      "CalendarWeek": "1",
      "day": "Donnerstag",
      "mealtime": "Abendessen",
      "IdentNr": "12026010198019",
      "itemId": "17865",
      "RecipeID": "8795",
      "ProductPrice": "12.00",
      "ProductPrice_2": null,
      "GastDesc_de": "Seelachs | Apfel | Gurke | Rahm",
      "GastDesc_en": "Coalfish | Apple | Cucumber | Cream",
      "MenuName": "DINNER Fish _|",
      "allergene": {
        "huhnerei": "Hühnerei und Hühnereierzeugnisse",
        "fisch": "Fisch und Fischerzeugnisse",
        "milch": "Milch und Milcherzeugnisse",
        "senf": "Senf und Senferzeugnisse",
        "schwefel": "Schwefeldioxid und Sulfide"
      },
      "merkmale": "",
      "naehrstoffe": "",
      "zusatzstoffe": [
        {
          "de": "Süßungsmittel",
          "en": "Sweetener"
        },
        {
          "de": "Farbstoff",
          "en": "Colouring Agent"
        },
        {
          "de": "Antioxidationsmittel",
          "en": "Antioxidation"
        },
        {
          "de": "Alkohol",
          "en": "Alcohol"
        }
      ],
      "PrintOrder": "19",
      "CO2Value": "1564.00",
      "CO2Rating": "C",
      "CO2Perc": "100.00",
      "ClimateFriendly": null,
      "GastDesc": "Seelachs | Apfel | Gurke | Rahm",
      "date_de": "01.01.2026"
    },
    {
      "id": "5040020",
      "outlet": "canteen",
      "date": "2026-01-01",
      "CalendarWeek": "1",
      "day": "Donnerstag",
      "mealtime": "Abendessen",
      "IdentNr": "12026010198020",
      "itemId": "17866",
      "RecipeID": "6410",
      "ProductPrice": "9.50",
      "ProductPrice_2": null,
      "GastDesc_de": "Linguine | Kürbis | Zuckerschote",
      "GastDesc_en": "Linguine | Pumpkin | Sweet Peas",
      "MenuName": "DINNER Vegi / Vegan_|",
      "allergene": {
        "gluten": "Glutenhaltiges Getreide"
      },
      "merkmale": {
        "vegan": "Vegan",
        "vegetarisch": "Vegetarisch"
      },
      "naehrstoffe": "",
      "zusatzstoffe": null,
      "PrintOrder": "20",
      "CO2Value": "303.00",
      "CO2Rating": "A",
      "CO2Perc": "100.00",
      "ClimateFriendly": "1",
      "GastDesc": "Linguine | Kürbis | Zuckerschote",
      "date_de": "01.01.2026"
    },
    {
      "id": "5057214",
      "outlet": "canteen",
      "date": "2026-01-02",
      "CalendarWeek": "1",
      "day": "Freitag",
      "mealtime": "Mittagessen",
      "IdentNr": "12026010298000",
      "itemId": "17549",
      "RecipeID": "5060",
      "ProductPrice": "11.00",
      "ProductPrice_2": null,
      "GastDesc_de": "Couscous | Ofen-Paprika | Kräuterfeta",
      "GastDesc_en": "Couscous | Oven peppers | Herb feta",
      "MenuName": "COUNTER 1.1 Bowls_",
      "allergene": {
        "gluten": "Glutenhaltiges Getreide",
        "schalenfruchte": "Schalenfrüchte und Schalenfruchterzeugnisse",
        "milch": "Milch und Milcherzeugnisse"
      },
      "merkmale": {
        "vegetarisch": "Vegetarisch"
      },
      "naehrstoffe": "",
      "zusatzstoffe": [
        {
          "de": "geschwärzt",
          "en": "Blacked Out"
        }
      ],
      "PrintOrder": "0",
      "CO2Value": "1638.00",
      "CO2Rating": "C",
      "CO2Perc": "100.00",
      "ClimateFriendly": null,
      "GastDesc": "Couscous | Ofen-Paprika | Kräuterfeta",
      "date_de": "02.01.2026"
    },
    {
      "id": "5057215",
      "outlet": "canteen",
      "date": "2026-01-02",
      "CalendarWeek": "1",
      "day": "Freitag",
      "mealtime": "Mittagessen",
      "IdentNr": "12026010298001",
      "itemId": "17550",
      "RecipeID": "5118",
      "ProductPrice": "12.00",
      "ProductPrice_2": null,
      "GastDesc_de": "Maishähnchen | Ebli | Strauchtomaten | Minzayran",
      "GastDesc_en": "Corn fed Chicken | Ebli | Tomato | Mint Ayran",
      "MenuName": "COUNTER 2.1 Meat",
      "allergene": {
        "gluten": "Glutenhaltiges Getreide",
        "milch": "Milch und Milcherzeugnisse",
        "sellerie": "Sellerie und Sellerieerzeugnisse"
      },
      "merkmale": "",
      "naehrstoffe": "",
      "zusatzstoffe": null,
      "PrintOrder": "1",
      "CO2Value": "1387.00",
      "CO2Rating": "C",
      "CO2Perc": "100.00",
      "ClimateFriendly": null,
      "GastDesc": "Maishähnchen | Ebli | Strauchtomaten | Minzayran",
      "date_de": "02.01.2026"
    },
    {
      "id": "5057216",
      "outlet": "canteen",
      "date": "2026-01-02",
      "CalendarWeek": "1",
      "day": "Freitag",
      "mealtime": "Mittagessen",
      "IdentNr": "12026010298003",
      "itemId": "17552",
      "RecipeID": "2931",
      "ProductPrice": "12.00",
      "ProductPrice_2": null,
      "GastDesc_de": "Zander | Kohlrabi-Gemüse | Kapernsauce",
      "GastDesc_en": "Pike perch | Kohlrabi | Capers",
      "MenuName": "COUNTER 3.1 Fish",
      "allergene": {
        "gluten": "Glutenhaltiges Getreide",
        "fisch": "Fisch und Fischerzeugnisse",
        "milch": "Milch und Milcherzeugnisse",
        "sellerie": "Sellerie und Sellerieerzeugnisse"
      },
      "merkmale": "",
      "naehrstoffe": "",
      "zusatzstoffe": null,
      "PrintOrder": "3",
      "CO2Value": "646.00",
      "CO2Rating": "B",
      "CO2Perc": "100.00",
      "ClimateFriendly": null,
      "GastDesc": "Zander | Kohlrabi-Gemüse | Kapernsauce",
      "date_de": "02.01.2026"
    },
    {
      "id": "5057217",
      "outlet": "canteen",
      "date": "2026-01-02",
      "CalendarWeek": "1",
      "day": "Freitag",
      "mealtime": "Mittagessen",
      "IdentNr": "12026010298005",
      "itemId": "17554",
      "RecipeID": "5077",
      "ProductPrice": "9.50",
      "ProductPrice_2": null,
      "GastDesc_de": "Soja-Frikasee | Reis | Wildkräuter",
      "GastDesc_en": "Soya Frikasee | Rice | Wild Herbs",
      "MenuName": "COUNTER 4.1 Vegi",
      "allergene": {
        "soja": "Soja und Sojaerzeugnisse",
        "sellerie": "Sellerie und Sellerieerzeugnisse",
        "schwefel": "Schwefeldioxid und Sulfide"
      },
      "merkmale": {
        "vegan": "Vegan",
        "vegetarisch": "Vegetarisch"
      },
      "naehrstoffe": "",
      "zusatzstoffe": [
        {
          "de": "Antioxidationsmittel",
          "en": "Antioxidation"
        },
        {
          "de": "Alkohol",
          "en": "Alcohol"
        }
      ],
      "PrintOrder": "5",
      "CO2Value": "528.00",
      "CO2Rating": "A",
      "CO2Perc": "100.00",
      "ClimateFriendly": "1",
      "GastDesc": "Soja-Frikasee | Reis | Wildkräuter",
      "date_de": "02.01.2026"
    },
    {
      "id": "5057218",
      "outlet": "canteen",
      "date": "2026-01-02",
      "CalendarWeek": "1",
      "day": "Freitag",
      "mealtime": "Abendessen",
      "IdentNr": "12026010298009",
      "itemId": "17558",
      "RecipeID": "5060",
      "ProductPrice": "11.00",
      "ProductPrice_2": null,
      "GastDesc_de": "Couscous | Ofen-Paprika | Kräuterfeta",
      "GastDesc_en": "Couscous | Oven peppers | Herb feta",
      "MenuName": "DINNER BOWL_",
      "allergene": {
        "gluten": "Glutenhaltiges Getreide",
        "schalenfruchte": "Schalenfrüchte und Schalenfruchterzeugnisse",
        "milch": "Milch und Milcherzeugnisse"
      },
      "merkmale": {
        "vegetarisch": "Vegetarisch"
      },
      "naehrstoffe": "",
      "zusatzstoffe": [
        {
          "de": "geschwärzt",
          "en": "Blacked Out"
        }
      ],
      "PrintOrder": "9",
      "CO2Value": "1638.00",
      "CO2Rating": "C",
      "CO2Perc": "100.00",
      "ClimateFriendly": null,
      "GastDesc": "Couscous | Ofen-Paprika | Kräuterfeta",
      "date_de": "02.01.2026"
    },
    {
      "id": "5057220",
      "outlet": "canteen",
      "date": "2026-01-02",
      "CalendarWeek": "1",
      "day": "Freitag",
      "mealtime": "Abendessen",
      "IdentNr": "12026010298011",
      "itemId": "17560",
      "RecipeID": "5077",
      "ProductPrice": "9.50",
      "ProductPrice_2": null,
      "GastDesc_de": "Soja-Frikasee | Reis | Wildkräuter",
      "GastDesc_en": "Soya Frikasee | Rice | Wild Herbs",
      "MenuName": "DINNER Fish_17:00-19:00",
      "allergene": {
        "soja": "Soja und Sojaerzeugnisse",
        "sellerie": "Sellerie und Sellerieerzeugnisse",
        "schwefel": "Schwefeldioxid und Sulfide"
      },
      "merkmale": {
        "vegan": "Vegan",
        "vegetarisch": "Vegetarisch"
      },
      "naehrstoffe": "",
      "zusatzstoffe": [
        {
          "de": "Antioxidationsmittel",
          "en": "Antioxidation"
        },
        {
          "de": "Alkohol",
          "en": "Alcohol"
        }
      ],
      "PrintOrder": "11",
      "CO2Value": "528.00",
      "CO2Rating": "A",
      "CO2Perc": "100.00",
      "ClimateFriendly": "1",
      "GastDesc": "Soja-Frikasee | Reis | Wildkräuter",
      "date_de": "02.01.2026"
    },
    {
      "id": "5057222",
      "outlet": "canteen",
      "date": "2026-01-03",
      "CalendarWeek": "1",
      "day": "Samstag",
      "mealtime": "Abendessen",
      "IdentNr": "12026010398014",
      "itemId": "17563",
      "RecipeID": "7944",
      "ProductPrice": "12.00",
      "ProductPrice_2": null,
      "GastDesc_de": "Leberkäse | Kartoffelsalat | Blattsalat | Spiegelei",
      "GastDesc_en": "Traditional Leberkäse | Vinegar Potato Salad | Leafy Salad | Fried Egg",
      "MenuName": "LUNCH Meat_",
      "allergene": {
        "huhnerei": "Hühnerei und Hühnereierzeugnisse",
        "milch": "Milch und Milcherzeugnisse",
        "sellerie": "Sellerie und Sellerieerzeugnisse",
        "senf": "Senf und Senferzeugnisse",
        "schwefel": "Schwefeldioxid und Sulfide"
      },
      "merkmale": {
        "schwein": "Schwein"
      },
      "naehrstoffe": "",
      "zusatzstoffe": [
        {
          "de": "Phosphat",
          "en": "Phosphate"
        },
        {
          "de": "Antioxidationsmittel",
          "en": "Antioxidation"
        },
        {
          "de": "Konservierungsstoff",
          "en": "Preservatives"
        },
        {
          "de": "Alkohol",
          "en": "Alcohol"
        }
      ],
      "PrintOrder": "14",
      "CO2Value": "1083.00",
      "CO2Rating": "B",
      "CO2Perc": "100.00",
      "ClimateFriendly": null,
      "GastDesc": "Leberkäse | Kartoffelsalat | Blattsalat | Spiegelei",
      "date_de": "03.01.2026"
    },
    {
      "id": "5057224",
      "outlet": "canteen",
      "date": "2026-01-03",
      "CalendarWeek": "1",
      "day": "Samstag",
      "mealtime": "Abendessen",
      "IdentNr": "12026010398015",
      "itemId": "17564",
      "RecipeID": "2904",
      "ProductPrice": "12.00",
      "ProductPrice_2": null,
      "GastDesc_de": "Schellfisch | Kartoffel-Endivienstampf | Dijon-Senf",
      "GastDesc_en": "Haddock | Potato Endive Mash | Dijon Mustard",
      "MenuName": "LUNCH Fish_",
      "allergene": {
        "fisch": "Fisch und Fischerzeugnisse",
        "milch": "Milch und Milcherzeugnisse",
        "sellerie": "Sellerie und Sellerieerzeugnisse",
        "senf": "Senf und Senferzeugnisse",
        "schwefel": "Schwefeldioxid und Sulfide"
      },
      "merkmale": "",
      "naehrstoffe": "",
      "zusatzstoffe": null,
      "PrintOrder": "15",
      "CO2Value": "1129.00",
      "CO2Rating": "C",
      "CO2Perc": "100.00",
      "ClimateFriendly": null,
      "GastDesc": "Schellfisch | Kartoffel-Endivienstampf | Dijon-Senf",
      "date_de": "03.01.2026"
    },
    {
      "id": "5057226",
      "outlet": "canteen",
      "date": "2026-01-03",
      "CalendarWeek": "1",
      "day": "Samstag",
      "mealtime": "Abendessen",
      "IdentNr": "12026010398016",
      "itemId": "17565",
      "RecipeID": "6418",
      "ProductPrice": "9.50",
      "ProductPrice_2": null,
      "GastDesc_de": "Muschelnudeln | Gemüseragout | Basilikumöl",
      "GastDesc_en": "Castellane | Vegetableragout | Basil oil",
      "MenuName": "LUNCH Vegi/Vegan_",
      "allergene": {
        "gluten": "Glutenhaltiges Getreide"
      },
      "merkmale": {
        "vegan": "Vegan",
        "vegetarisch": "Vegetarisch"
      },
      "naehrstoffe": "",
      "zusatzstoffe": null,
      "PrintOrder": "16",
      "CO2Value": "546.00",
      "CO2Rating": "B",
      "CO2Perc": "100.00",
      "ClimateFriendly": null,
      "GastDesc": "Muschelnudeln | Gemüseragout | Basilikumöl",
      "date_de": "03.01.2026"
    },
    {
      "id": "5057228",
      "outlet": "canteen",
      "date": "2026-01-04",
      "CalendarWeek": "1",
      "day": "Sonntag",
      "mealtime": "Abendessen",
      "IdentNr": "12026010498018",
      "itemId": "17864",
      "RecipeID": "8851",
      "ProductPrice": "12.00",
      "ProductPrice_2": null,
      "GastDesc_de": "Enten-Chop-Suey | Ingwer-Reis | Kroepoek",
      "GastDesc_en": "Duck Chop Suey | Ginger Rice | Prawn Crackers",
      "MenuName": "DINNER Meat _|",
      "allergene": {
        "gluten": "Glutenhaltiges Getreide",
        "soja": "Soja und Sojaerzeugnisse",
        "krebstier": "Krebstiere und Krebstiererzeugnisse",
        "sellerie": "Sellerie und Sellerieerzeugnisse",
        "sesam": "Sesamsamen und Sesamsamenerzeugnisse",
        "weichtier": "Weichtier und Weichtiererzeugnisse"
      },
      "merkmale": "",
      "naehrstoffe": "",
      "zusatzstoffe": [
        {
          "de": "Farbstoff",
          "en": "Colouring Agent"
        },
        {
          "de": "Geschmacksverstärker",
          "en": "Flavor Enhancer"
        }
      ],
      "PrintOrder": "18",
      "CO2Value": "1446.00",
      "CO2Rating": "B",
      "CO2Perc": "100.00",
      "ClimateFriendly": null,
      "GastDesc": "Enten-Chop-Suey | Ingwer-Reis | Kroepoek",
      "date_de": "04.01.2026"
    },
    {
      "id": "5057229",
      "outlet": "canteen",
      "date": "2026-01-04",
      "CalendarWeek": "1",
      "day": "Sonntag",
      "mealtime": "Mittagessen",
      "IdentNr": "12026010498018",
      "itemId": "17864",
      "RecipeID": "8851",
      "ProductPrice": "12.00",
      "ProductPrice_2": null,
      "GastDesc_de": "Enten-Chop-Suey | Ingwer-Reis | Kroepoek",
      "GastDesc_en": "Duck Chop Suey | Ginger Rice | Prawn Crackers",
      "MenuName": "DINNER Meat _|",
      "allergene": {
        "gluten": "Glutenhaltiges Getreide",
        "soja": "Soja und Sojaerzeugnisse",
        "krebstier": "Krebstiere und Krebstiererzeugnisse",
        "sellerie": "Sellerie und Sellerieerzeugnisse",
        "sesam": "Sesamsamen und Sesamsamenerzeugnisse",
        "weichtier": "Weichtier und Weichtiererzeugnisse"
      },
      "merkmale": "",
      "naehrstoffe": "",
      "zusatzstoffe": [
        {
          "de": "Farbstoff",
          "en": "Colouring Agent"
        },
        {
          "de": "Geschmacksverstärker",
          "en": "Flavor Enhancer"
        }
      ],
      "PrintOrder": "18",
      "CO2Value": "1446.00",
      "CO2Rating": "B",
      "CO2Perc": "100.00",
      "ClimateFriendly": null,
      "GastDesc": "Enten-Chop-Suey | Ingwer-Reis | Kroepoek",
      "date_de": "04.01.2026"
    },
    {
      "id": "5057231",
      "outlet": "canteen",
      "date": "2026-01-04",
      "CalendarWeek": "1",
      "day": "Sonntag",
      "mealtime": "Abendessen",
      "IdentNr": "12026010498019",
      "itemId": "17865",
      "RecipeID": "7315",
      "ProductPrice": "12.00",
      "ProductPrice_2": null,
      "GastDesc_de": "Forellenfilet | Erbsen | Kartoffel-Frikassee",
      "GastDesc_en": "Trout fillet | peas | potato fricassee",
      "MenuName": "DINNER Fish _|",
      "allergene": {
        "fisch": "Fisch und Fischerzeugnisse",
        "soja": "Soja und Sojaerzeugnisse",
        "milch": "Milch und Milcherzeugnisse",
        "sellerie": "Sellerie und Sellerieerzeugnisse",
        "schwefel": "Schwefeldioxid und Sulfide"
      },
      "merkmale": {
        "schwein": "Schwein"
      },
      "naehrstoffe": "",
      "zusatzstoffe": [
        {
          "de": "Phosphat",
          "en": "Phosphate"
        },
        {
          "de": "Antioxidationsmittel",
          "en": "Antioxidation"
        },
        {
          "de": "Konservierungsstoff",
          "en": "Preservatives"
        },
        {
          "de": "Alkohol",
          "en": "Alcohol"
        }
      ],
      "PrintOrder": "19",
      "CO2Value": "1071.00",
      "CO2Rating": "B",
      "CO2Perc": "100.00",
      "ClimateFriendly": null,
      "GastDesc": "Forellenfilet | Erbsen | Kartoffel-Frikassee",
      "date_de": "04.01.2026"
    },
    {
      "id": "5057232",
      "outlet": "canteen",
      "date": "2026-01-04",
      "CalendarWeek": "1",
      "day": "Sonntag",
      "mealtime": "Mittagessen",
      "IdentNr": "12026010498019",
      "itemId": "17865",
      "RecipeID": "7315",
      "ProductPrice": "12.00",
      "ProductPrice_2": null,
      "GastDesc_de": "Forellenfilet | Erbsen | Kartoffel-Frikassee",
      "GastDesc_en": "Trout fillet | peas | potato fricassee",
      "MenuName": "DINNER Fish _|",
      "allergene": {
        "fisch": "Fisch und Fischerzeugnisse",
        "soja": "Soja und Sojaerzeugnisse",
        "milch": "Milch und Milcherzeugnisse",
        "sellerie": "Sellerie und Sellerieerzeugnisse",
        "schwefel": "Schwefeldioxid und Sulfide"
      },
      "merkmale": {
        "schwein": "Schwein"
      },
      "naehrstoffe": "",
      "zusatzstoffe": [
        {
          "de": "Phosphat",
          "en": "Phosphate"
        },
        {
          "de": "Antioxidationsmittel",
          "en": "Antioxidation"
        },
        {
          "de": "Konservierungsstoff",
          "en": "Preservatives"
        },
        {
          "de": "Alkohol",
          "en": "Alcohol"
        }
      ],
      "PrintOrder": "19",
      "CO2Value": "1071.00",
      "CO2Rating": "B",
      "CO2Perc": "100.00",
      "ClimateFriendly": null,
      "GastDesc": "Forellenfilet | Erbsen | Kartoffel-Frikassee",
      "date_de": "04.01.2026"
    },
    {
      "id": "5057234",
      "outlet": "canteen",
      "date": "2026-01-04",
      "CalendarWeek": "1",
      "day": "Sonntag",
      "mealtime": "Abendessen",
      "IdentNr": "12026010498020",
      "itemId": "17866",
      "RecipeID": "4327",
      "ProductPrice": "9.50",
      "ProductPrice_2": null,
      "GastDesc_de": "Curry von roten Linsen | Kürbis | Limettenjoghurt",
      "GastDesc_en": "Red Lentil Curry | Pumpkin | Lime Yoghurt",
      "MenuName": "DINNER Vegi / Vegan_|",
      "allergene": {
        "gluten": "Glutenhaltiges Getreide",
        "milch": "Milch und Milcherzeugnisse",
        "erdnuss": "Erdnüsse und Erdnusserzeugnisse",
        "sellerie": "Sellerie und Sellerieerzeugnisse"
      },
      "merkmale": {
        "vegan": "Vegan",
        "vegetarisch": "Vegetarisch"
      },
      "naehrstoffe": "",
      "zusatzstoffe": null,
      "PrintOrder": "20",
      "CO2Value": "580.00",
      "CO2Rating": "B",
      "CO2Perc": "100.00",
      "ClimateFriendly": null,
      "GastDesc": "Curry von roten Linsen | Kürbis | Limettenjoghurt",
      "date_de": "04.01.2026"
    },
    {
      "id": "5057235",
      "outlet": "canteen",
      "date": "2026-01-04",
      "CalendarWeek": "1",
      "day": "Sonntag",
      "mealtime": "Mittagessen",
      "IdentNr": "12026010498020",
      "itemId": "17866",
      "RecipeID": "4327",
      "ProductPrice": "9.50",
      "ProductPrice_2": null,
      "GastDesc_de": "Curry von roten Linsen | Kürbis | Limettenjoghurt",
      "GastDesc_en": "Red Lentil Curry | Pumpkin | Lime Yoghurt",
      "MenuName": "DINNER Vegi / Vegan_|",
      "allergene": {
        "gluten": "Glutenhaltiges Getreide",
        "milch": "Milch und Milcherzeugnisse",
        "erdnuss": "Erdnüsse und Erdnusserzeugnisse",
        "sellerie": "Sellerie und Sellerieerzeugnisse"
      },
      "merkmale": {
        "vegan": "Vegan",
        "vegetarisch": "Vegetarisch"
      },
      "naehrstoffe": "",
      "zusatzstoffe": null,
      "PrintOrder": "20",
      "CO2Value": "580.00",
      "CO2Rating": "B",
      "CO2Perc": "100.00",
      "ClimateFriendly": null,
      "GastDesc": "Curry von roten Linsen | Kürbis | Limettenjoghurt",
      "date_de": "04.01.2026"
    },
    {
      "id": "5079376",
      "outlet": "canteen",
      "date": "2026-01-05",
      "CalendarWeek": "2",
      "day": "Montag",
      "mealtime": "Mittagessen",
      "IdentNr": "12026010598000",
      "itemId": "17549",
      "RecipeID": "4412",
      "ProductPrice": "10.00",
      "ProductPrice_2": null,
      "GastDesc_de": "Couscous | Brokkoli | Spinat-Hummus",
      "GastDesc_en": "Couscous | Broccoli | Spinach Hummus",
      "MenuName": "COUNTER 1.1 Bowls_",
      "allergene": {
        "gluten": "Glutenhaltiges Getreide",
        "sellerie": "Sellerie und Sellerieerzeugnisse",
        "sesam": "Sesamsamen und Sesamsamenerzeugnisse",
        "schwefel": "Schwefeldioxid und Sulfide"
      },
      "merkmale": {
        "veganuary": "Veganuary"
      },
      "naehrstoffe": "",
      "zusatzstoffe": [
        {
          "de": "Süßungsmittel",
          "en": "Sweetener"
        },
        {
          "de": "Phenylalaninquelle",
          "en": "Phenylalanine"
        },
        {
          "de": "Konservierungsstoff",
          "en": "Preservatives"
        }
      ],
      "PrintOrder": "0",
      "CO2Value": "562.00",
      "CO2Rating": "A",
      "CO2Perc": "100.00",
      "ClimateFriendly": "1",
      "GastDesc": "Couscous | Brokkoli | Spinat-Hummus",
      "date_de": "05.01.2026"
    },
    {
      "id": "5079377",
      "outlet": "canteen",
      "date": "2026-01-05",
      "CalendarWeek": "2",
      "day": "Montag",
      "mealtime": "Mittagessen",
      "IdentNr": "12026010598001",
      "itemId": "17550",
      "RecipeID": "4865",
      "ProductPrice": "12.00",
      "ProductPrice_2": null,
      "GastDesc_de": "Rinderschmorbraten | Blaukraut | Spätzle",
      "GastDesc_en": "Braised Beef | Red cabbage | Spätzle",
      "MenuName": "COUNTER 2.1 Meat",
      "allergene": {
        "gluten": "Glutenhaltiges Getreide",
        "huhnerei": "Hühnerei und Hühnereierzeugnisse",
        "milch": "Milch und Milcherzeugnisse",
        "sellerie": "Sellerie und Sellerieerzeugnisse",
        "schwefel": "Schwefeldioxid und Sulfide"
      },
      "merkmale": "",
      "naehrstoffe": "",
      "zusatzstoffe": [
        {
          "de": "Alkohol",
          "en": "Alcohol"
        }
      ],
      "PrintOrder": "1",
      "CO2Value": "7035.00",
      "CO2Rating": "E",
      "CO2Perc": "100.00",
      "ClimateFriendly": null,
      "GastDesc": "Rinderschmorbraten | Blaukraut | Spätzle",
      "date_de": "05.01.2026"
    },
    {
      "id": "5079378",
      "outlet": "canteen",
      "date": "2026-01-05",
      "CalendarWeek": "2",
      "day": "Montag",
      "mealtime": "Mittagessen",
      "IdentNr": "12026010598003",
      "itemId": "17552",
      "RecipeID": "8972",
      "ProductPrice": "12.00",
      "ProductPrice_2": null,
      "GastDesc_de": "Rotbarschfilet | Kartoffel-Blumenkohlpüree | Safranschaum",
      "GastDesc_en": "Redfish | Potato and Cauliflower Purée | Saffron Foam",
      "MenuName": "COUNTER 3.1 Fish",
      "allergene": {
        "fisch": "Fisch und Fischerzeugnisse",
        "milch": "Milch und Milcherzeugnisse",
        "sellerie": "Sellerie und Sellerieerzeugnisse",
        "schwefel": "Schwefeldioxid und Sulfide"
      },
      "merkmale": "",
      "naehrstoffe": "",
      "zusatzstoffe": null,
      "PrintOrder": "3",
      "CO2Value": "1162.00",
      "CO2Rating": "C",
      "CO2Perc": "100.00",
      "ClimateFriendly": null,
      "GastDesc": "Rotbarschfilet | Kartoffel-Blumenkohlpüree | Safranschaum",
      "date_de": "05.01.2026"
    },
    {
      "id": "5079379",
      "outlet": "canteen",
      "date": "2026-01-05",
      "CalendarWeek": "2",
      "day": "Montag",
      "mealtime": "Mittagessen",
      "IdentNr": "12026010598005",
      "itemId": "17554",
      "RecipeID": "2987",
      "ProductPrice": "9.50",
      "ProductPrice_2": null,
      "GastDesc_de": "Gemüsecurry | Kohlrabi | Romanesco*",
      "GastDesc_en": "Vegetable Curry | Cabbage | Romanesco *",
      "MenuName": "COUNTER 4.1 Vegi",
      "allergene": {
        "sellerie": "Sellerie und Sellerieerzeugnisse"
      },
      "merkmale": {
        "veganuary": "Veganuary"
      },
      "naehrstoffe": "",
      "zusatzstoffe": [
        {
          "de": "Süßungsmittel",
          "en": "Sweetener"
        },
        {
          "de": "Phenylalaninquelle",
          "en": "Phenylalanine"
        },
        {
          "de": "Konservierungsstoff",
          "en": "Preservatives"
        }
      ],
      "PrintOrder": "5",
      "CO2Value": "672.00",
      "CO2Rating": "C",
      "CO2Perc": "100.00",
      "ClimateFriendly": null,
      "GastDesc": "Gemüsecurry | Kohlrabi | Romanesco*",
      "date_de": "05.01.2026"
    },
    {
      "id": "5079380",
      "outlet": "canteen",
      "date": "2026-01-05",
      "CalendarWeek": "2",
      "day": "Montag",
      "mealtime": "Abendessen",
      "IdentNr": "12026010598009",
      "itemId": "17558",
      "RecipeID": "4412",
      "ProductPrice": "10.00",
      "ProductPrice_2": null,
      "GastDesc_de": "Couscous | Brokkoli | Spinat-Hummus",
      "GastDesc_en": "Couscous | Broccoli | Spinach Hummus",
      "MenuName": "DINNER BOWL_",
      "allergene": {
        "gluten": "Glutenhaltiges Getreide",
        "sellerie": "Sellerie und Sellerieerzeugnisse",
        "sesam": "Sesamsamen und Sesamsamenerzeugnisse",
        "schwefel": "Schwefeldioxid und Sulfide"
      },
      "merkmale": {
        "veganuary": "Veganuary"
      },
      "naehrstoffe": "",
      "zusatzstoffe": [
        {
          "de": "Süßungsmittel",
          "en": "Sweetener"
        },
        {
          "de": "Phenylalaninquelle",
          "en": "Phenylalanine"
        },
        {
          "de": "Konservierungsstoff",
          "en": "Preservatives"
        }
      ],
      "PrintOrder": "9",
      "CO2Value": "562.00",
      "CO2Rating": "A",
      "CO2Perc": "100.00",
      "ClimateFriendly": "1",
      "GastDesc": "Couscous | Brokkoli | Spinat-Hummus",
      "date_de": "05.01.2026"
    },
    {
      "id": "5079382",
      "outlet": "canteen",
      "date": "2026-01-05",
      "CalendarWeek": "2",
      "day": "Montag",
      "mealtime": "Abendessen",
      "IdentNr": "12026010598010",
      "itemId": "17559",
      "RecipeID": "4865",
      "ProductPrice": "12.00",
      "ProductPrice_2": null,
      "GastDesc_de": "Rinderschmorbraten | Blaukraut | Spätzle",
      "GastDesc_en": "Braised Beef | Red cabbage | Spätzle",
      "MenuName": "DINNER Meat_17:00-19:00",
      "allergene": {
        "gluten": "Glutenhaltiges Getreide",
        "huhnerei": "Hühnerei und Hühnereierzeugnisse",
        "milch": "Milch und Milcherzeugnisse",
        "sellerie": "Sellerie und Sellerieerzeugnisse",
        "schwefel": "Schwefeldioxid und Sulfide"
      },
      "merkmale": "",
      "naehrstoffe": "",
      "zusatzstoffe": [
        {
          "de": "Alkohol",
          "en": "Alcohol"
        }
      ],
      "PrintOrder": "10",
      "CO2Value": "7035.00",
      "CO2Rating": "E",
      "CO2Perc": "100.00",
      "ClimateFriendly": null,
      "GastDesc": "Rinderschmorbraten | Blaukraut | Spätzle",
      "date_de": "05.01.2026"
    },
    {
      "id": "5079384",
      "outlet": "canteen",
      "date": "2026-01-05",
      "CalendarWeek": "2",
      "day": "Montag",
      "mealtime": "Abendessen",
      "IdentNr": "12026010598012",
      "itemId": "17561",
      "RecipeID": "2987",
      "ProductPrice": "9.50",
      "ProductPrice_2": null,
      "GastDesc_de": "Gemüsecurry | Kohlrabi | Romanesco*",
      "GastDesc_en": "Vegetable Curry | Cabbage | Romanesco *",
      "MenuName": "DINNER Vegi/Vegan_17:00-19:00",
      "allergene": {
        "sellerie": "Sellerie und Sellerieerzeugnisse"
      },
      "merkmale": {
        "veganuary": "Veganuary"
      },
      "naehrstoffe": "",
      "zusatzstoffe": [
        {
          "de": "Süßungsmittel",
          "en": "Sweetener"
        },
        {
          "de": "Phenylalaninquelle",
          "en": "Phenylalanine"
        },
        {
          "de": "Konservierungsstoff",
          "en": "Preservatives"
        }
      ],
      "PrintOrder": "12",
      "CO2Value": "672.00",
      "CO2Rating": "C",
      "CO2Perc": "100.00",
      "ClimateFriendly": null,
      "GastDesc": "Gemüsecurry | Kohlrabi | Romanesco*",
      "date_de": "05.01.2026"
    },
    {
      "id": "5079386",
      "outlet": "canteen",
      "date": "2026-01-06",
      "CalendarWeek": "2",
      "day": "Dienstag",
      "mealtime": "Mittagessen",
      "IdentNr": "12026010698000",
      "itemId": "17549",
      "RecipeID": "7575",
      "ProductPrice": "10.00",
      "ProductPrice_2": null,
      "GastDesc_de": "Chili-Pilze | Sesamgurken | Spicy Dressing",
      "GastDesc_en": "Chili mushrooms | Sesame cucumbers | Spicy dressing",
      "MenuName": "COUNTER 1.1 Bowls_",
      "allergene": {
        "gluten": "Glutenhaltiges Getreide",
        "soja": "Soja und Sojaerzeugnisse",
        "senf": "Senf und Senferzeugnisse",
        "sesam": "Sesamsamen und Sesamsamenerzeugnisse"
      },
      "merkmale": {
        "veganuary": "Veganuary"
      },
      "naehrstoffe": "",
      "zusatzstoffe": [
        {
          "de": "Geschmacksverstärker",
          "en": "Flavor Enhancer"
        },
        {
          "de": "Konservierungsstoff",
          "en": "Preservatives"
        }
      ],
      "PrintOrder": "0",
      "CO2Value": "784.00",
      "CO2Rating": "C",
      "CO2Perc": "100.00",
      "ClimateFriendly": null,
      "GastDesc": "Chili-Pilze | Sesamgurken | Spicy Dressing",
      "date_de": "06.01.2026"
    },
    {
      "id": "5079387",
      "outlet": "canteen",
      "date": "2026-01-06",
      "CalendarWeek": "2",
      "day": "Dienstag",
      "mealtime": "Mittagessen",
      "IdentNr": "12026010698001",
      "itemId": "17550",
      "RecipeID": "4865",
      "ProductPrice": "12.00",
      "ProductPrice_2": null,
      "GastDesc_de": "Rinderschmorbraten | Blaukraut | Spätzle",
      "GastDesc_en": "Braised Beef | Red cabbage | Spätzle",
      "MenuName": "COUNTER 2.1 Meat",
      "allergene": {
        "gluten": "Glutenhaltiges Getreide",
        "huhnerei": "Hühnerei und Hühnereierzeugnisse",
        "milch": "Milch und Milcherzeugnisse",
        "sellerie": "Sellerie und Sellerieerzeugnisse",
        "schwefel": "Schwefeldioxid und Sulfide"
      },
      "merkmale": "",
      "naehrstoffe": "",
      "zusatzstoffe": [
        {
          "de": "Alkohol",
          "en": "Alcohol"
        }
      ],
      "PrintOrder": "1",
      "CO2Value": "7035.00",
      "CO2Rating": "E",
      "CO2Perc": "100.00",
      "ClimateFriendly": null,
      "GastDesc": "Rinderschmorbraten | Blaukraut | Spätzle",
      "date_de": "06.01.2026"
    },
    {
      "id": "5079388",
      "outlet": "canteen",
      "date": "2026-01-06",
      "CalendarWeek": "2",
      "day": "Dienstag",
      "mealtime": "Mittagessen",
      "IdentNr": "12026010698003",
      "itemId": "17552",
      "RecipeID": "8972",
      "ProductPrice": "12.00",
      "ProductPrice_2": null,
      "GastDesc_de": "Rotbarschfilet | Kartoffel-Blumenkohlpüree | Safranschaum",
      "GastDesc_en": "Redfish | Potato and Cauliflower Purée | Saffron Foam",
      "MenuName": "COUNTER 3.1 Fish",
      "allergene": {
        "fisch": "Fisch und Fischerzeugnisse",
        "milch": "Milch und Milcherzeugnisse",
        "sellerie": "Sellerie und Sellerieerzeugnisse",
        "schwefel": "Schwefeldioxid und Sulfide"
      },
      "merkmale": "",
      "naehrstoffe": "",
      "zusatzstoffe": null,
      "PrintOrder": "3",
      "CO2Value": "1162.00",
      "CO2Rating": "C",
      "CO2Perc": "100.00",
      "ClimateFriendly": null,
      "GastDesc": "Rotbarschfilet | Kartoffel-Blumenkohlpüree | Safranschaum",
      "date_de": "06.01.2026"
    },
    {
      "id": "5079389",
      "outlet": "canteen",
      "date": "2026-01-06",
      "CalendarWeek": "2",
      "day": "Dienstag",
      "mealtime": "Mittagessen",
      "IdentNr": "12026010698005",
      "itemId": "17554",
      "RecipeID": "9089",
      "ProductPrice": "9.50",
      "ProductPrice_2": null,
      "GastDesc_de": "Ahorn-Miso-Süßkartoffel | Tofu | Grünkohl",
      "GastDesc_en": "Maple-Miso Sweet Potato | Tofu | Kale",
      "MenuName": "COUNTER 4.1 Vegi",
      "allergene": {
        "soja": "Soja und Sojaerzeugnisse",
        "sellerie": "Sellerie und Sellerieerzeugnisse",
        "senf": "Senf und Senferzeugnisse",
        "schwefel": "Schwefeldioxid und Sulfide"
      },
      "merkmale": {
        "veganuary": "Veganuary"
      },
      "naehrstoffe": "",
      "zusatzstoffe": null,
      "PrintOrder": "5",
      "CO2Value": "354.00",
      "CO2Rating": "A",
      "CO2Perc": "100.00",
      "ClimateFriendly": "1",
      "GastDesc": "Ahorn-Miso-Süßkartoffel | Tofu | Grünkohl",
      "date_de": "06.01.2026"
    },
    {
      "id": "5079390",
      "outlet": "canteen",
      "date": "2026-01-06",
      "CalendarWeek": "2",
      "day": "Dienstag",
      "mealtime": "Abendessen",
      "IdentNr": "12026010698009",
      "itemId": "17558",
      "RecipeID": "7575",
      "ProductPrice": "10.00",
      "ProductPrice_2": null,
      "GastDesc_de": "Chili-Pilze | Sesamgurken | Spicy Dressing",
      "GastDesc_en": "Chili mushrooms | Sesame cucumbers | Spicy dressing",
      "MenuName": "DINNER BOWL_",
      "allergene": {
        "gluten": "Glutenhaltiges Getreide",
        "soja": "Soja und Sojaerzeugnisse",
        "senf": "Senf und Senferzeugnisse",
        "sesam": "Sesamsamen und Sesamsamenerzeugnisse"
      },
      "merkmale": {
        "veganuary": "Veganuary"
      },
      "naehrstoffe": "",
      "zusatzstoffe": [
        {
          "de": "Geschmacksverstärker",
          "en": "Flavor Enhancer"
        },
        {
          "de": "Konservierungsstoff",
          "en": "Preservatives"
        }
      ],
      "PrintOrder": "9",
      "CO2Value": "784.00",
      "CO2Rating": "C",
      "CO2Perc": "100.00",
      "ClimateFriendly": null,
      "GastDesc": "Chili-Pilze | Sesamgurken | Spicy Dressing",
      "date_de": "06.01.2026"
    },
    {
      "id": "5079392",
      "outlet": "canteen",
      "date": "2026-01-06",
      "CalendarWeek": "2",
      "day": "Dienstag",
      "mealtime": "Abendessen",
      "IdentNr": "12026010698011",
      "itemId": "17560",
      "RecipeID": "8972",
      "ProductPrice": "12.00",
      "ProductPrice_2": null,
      "GastDesc_de": "Rotbarschfilet | Kartoffel-Blumenkohlpüree | Safranschaum",
      "GastDesc_en": "Redfish | Potato and Cauliflower Purée | Saffron Foam",
      "MenuName": "DINNER Fish_17:00-19:00",
      "allergene": {
        "fisch": "Fisch und Fischerzeugnisse",
        "milch": "Milch und Milcherzeugnisse",
        "sellerie": "Sellerie und Sellerieerzeugnisse",
        "schwefel": "Schwefeldioxid und Sulfide"
      },
      "merkmale": "",
      "naehrstoffe": "",
      "zusatzstoffe": null,
      "PrintOrder": "11",
      "CO2Value": "1162.00",
      "CO2Rating": "C",
      "CO2Perc": "100.00",
      "ClimateFriendly": null,
      "GastDesc": "Rotbarschfilet | Kartoffel-Blumenkohlpüree | Safranschaum",
      "date_de": "06.01.2026"
    },
    {
      "id": "5079394",
      "outlet": "canteen",
      "date": "2026-01-06",
      "CalendarWeek": "2",
      "day": "Dienstag",
      "mealtime": "Abendessen",
      "IdentNr": "12026010698012",
      "itemId": "17561",
      "RecipeID": "9089",
      "ProductPrice": "9.50",
      "ProductPrice_2": null,
      "GastDesc_de": "Ahorn-Miso-Süßkartoffel | Tofu | Grünkohl",
      "GastDesc_en": "Maple-Miso Sweet Potato | Tofu | Kale",
      "MenuName": "DINNER Vegi/Vegan_17:00-19:00",
      "allergene": {
        "soja": "Soja und Sojaerzeugnisse",
        "sellerie": "Sellerie und Sellerieerzeugnisse",
        "senf": "Senf und Senferzeugnisse",
        "schwefel": "Schwefeldioxid und Sulfide"
      },
      "merkmale": {
        "veganuary": "Veganuary"
      },
      "naehrstoffe": "",
      "zusatzstoffe": null,
      "PrintOrder": "12",
      "CO2Value": "354.00",
      "CO2Rating": "A",
      "CO2Perc": "100.00",
      "ClimateFriendly": "1",
      "GastDesc": "Ahorn-Miso-Süßkartoffel | Tofu | Grünkohl",
      "date_de": "06.01.2026"
    },
    {
      "id": "5079396",
      "outlet": "canteen",
      "date": "2026-01-07",
      "CalendarWeek": "2",
      "day": "Mittwoch",
      "mealtime": "Mittagessen",
      "IdentNr": "12026010798000",
      "itemId": "17549",
      "RecipeID": "4250",
      "ProductPrice": "10.00",
      "ProductPrice_2": null,
      "GastDesc_de": "Falafel | Mandeln | Couscous",
      "GastDesc_en": "Falafel | Almonds | Couscous",
      "MenuName": "COUNTER 1.1 Bowls_",
      "allergene": {
        "gluten": "Glutenhaltiges Getreide",
        "schalenfruchte": "Schalenfrüchte und Schalenfruchterzeugnisse",
        "milch": "Milch und Milcherzeugnisse",
        "sellerie": "Sellerie und Sellerieerzeugnisse"
      },
      "merkmale": {
        "veganuary": "Veganuary"
      },
      "naehrstoffe": "",
      "zusatzstoffe": null,
      "PrintOrder": "0",
      "CO2Value": "394.00",
      "CO2Rating": "B",
      "CO2Perc": "100.00",
      "ClimateFriendly": null,
      "GastDesc": "Falafel | Mandeln | Couscous",
      "date_de": "07.01.2026"
    },
    {
      "id": "5079397",
      "outlet": "canteen",
      "date": "2026-01-07",
      "CalendarWeek": "2",
      "day": "Mittwoch",
      "mealtime": "Mittagessen",
      "IdentNr": "12026010798001",
      "itemId": "17550",
      "RecipeID": "4865",
      "ProductPrice": "12.00",
      "ProductPrice_2": null,
      "GastDesc_de": "Rinderschmorbraten | Blaukraut | Spätzle",
      "GastDesc_en": "Braised Beef | Red cabbage | Spätzle",
      "MenuName": "COUNTER 2.1 Meat",
      "allergene": {
        "gluten": "Glutenhaltiges Getreide",
        "huhnerei": "Hühnerei und Hühnereierzeugnisse",
        "milch": "Milch und Milcherzeugnisse",
        "sellerie": "Sellerie und Sellerieerzeugnisse",
        "schwefel": "Schwefeldioxid und Sulfide"
      },
      "merkmale": "",
      "naehrstoffe": "",
      "zusatzstoffe": [
        {
          "de": "Alkohol",
          "en": "Alcohol"
        }
      ],
      "PrintOrder": "1",
      "CO2Value": "7035.00",
      "CO2Rating": "E",
      "CO2Perc": "100.00",
      "ClimateFriendly": null,
      "GastDesc": "Rinderschmorbraten | Blaukraut | Spätzle",
      "date_de": "07.01.2026"
    },
    {
      "id": "5079398",
      "outlet": "canteen",
      "date": "2026-01-07",
      "CalendarWeek": "2",
      "day": "Mittwoch",
      "mealtime": "Mittagessen",
      "IdentNr": "12026010798003",
      "itemId": "17552",
      "RecipeID": "7576",
      "ProductPrice": "12.00",
      "ProductPrice_2": null,
      "GastDesc_de": "Lachs | Reisnudeln | Rote Bete | Fenchel",
      "GastDesc_en": "Salmon | Rice Noodles | Beetroot | Fennel",
      "MenuName": "COUNTER 3.1 Fish",
      "allergene": {
        "gluten": "Glutenhaltiges Getreide",
        "fisch": "Fisch und Fischerzeugnisse",
        "milch": "Milch und Milcherzeugnisse",
        "sellerie": "Sellerie und Sellerieerzeugnisse",
        "schwefel": "Schwefeldioxid und Sulfide"
      },
      "merkmale": "",
      "naehrstoffe": "",
      "zusatzstoffe": [
        {
          "de": "Antioxidationsmittel",
          "en": "Antioxidation"
        },
        {
          "de": "Alkohol",
          "en": "Alcohol"
        }
      ],
      "PrintOrder": "3",
      "CO2Value": "1193.00",
      "CO2Rating": "B",
      "CO2Perc": "100.00",
      "ClimateFriendly": null,
      "GastDesc": "Lachs | Reisnudeln | Rote Bete | Fenchel",
      "date_de": "07.01.2026"
    },
    {
      "id": "5079399",
      "outlet": "canteen",
      "date": "2026-01-07",
      "CalendarWeek": "2",
      "day": "Mittwoch",
      "mealtime": "Mittagessen",
      "IdentNr": "12026010798005",
      "itemId": "17554",
      "RecipeID": "7035",
      "ProductPrice": "9.50",
      "ProductPrice_2": null,
      "GastDesc_de": "Tortellini Verdura | Tomate | Basilikum",
      "GastDesc_en": "Tortellini Verdura | Tomato | Basil",
      "MenuName": "COUNTER 4.1 Vegi",
      "allergene": {
        "gluten": "Glutenhaltiges Getreide",
        "milch": "Milch und Milcherzeugnisse",
        "sellerie": "Sellerie und Sellerieerzeugnisse"
      },
      "merkmale": {
        "veganuary": "Veganuary"
      },
      "naehrstoffe": "",
      "zusatzstoffe": null,
      "PrintOrder": "5",
      "CO2Value": "248.00",
      "CO2Rating": "A",
      "CO2Perc": "100.00",
      "ClimateFriendly": "1",
      "GastDesc": "Tortellini Verdura | Tomate | Basilikum",
      "date_de": "07.01.2026"
    },
    {
      "id": "5079400",
      "outlet": "canteen",
      "date": "2026-01-07",
      "CalendarWeek": "2",
      "day": "Mittwoch",
      "mealtime": "Abendessen",
      "IdentNr": "12026010798009",
      "itemId": "17558",
      "RecipeID": "4250",
      "ProductPrice": "10.00",
      "ProductPrice_2": null,
      "GastDesc_de": "Falafel | Mandeln | Couscous",
      "GastDesc_en": "Falafel | Almonds | Couscous",
      "MenuName": "DINNER BOWL_",
      "allergene": {
        "gluten": "Glutenhaltiges Getreide",
        "schalenfruchte": "Schalenfrüchte und Schalenfruchterzeugnisse",
        "milch": "Milch und Milcherzeugnisse",
        "sellerie": "Sellerie und Sellerieerzeugnisse"
      },
      "merkmale": {
        "veganuary": "Veganuary"
      },
      "naehrstoffe": "",
      "zusatzstoffe": null,
      "PrintOrder": "9",
      "CO2Value": "394.00",
      "CO2Rating": "B",
      "CO2Perc": "100.00",
      "ClimateFriendly": null,
      "GastDesc": "Falafel | Mandeln | Couscous",
      "date_de": "07.01.2026"
    },
    {
      "id": "5079402",
      "outlet": "canteen",
      "date": "2026-01-07",
      "CalendarWeek": "2",
      "day": "Mittwoch",
      "mealtime": "Abendessen",
      "IdentNr": "12026010798010",
      "itemId": "17559",
      "RecipeID": "4865",
      "ProductPrice": "12.00",
      "ProductPrice_2": null,
      "GastDesc_de": "Rinderschmorbraten | Blaukraut | Spätzle",
      "GastDesc_en": "Braised Beef | Red cabbage | Spätzle",
      "MenuName": "DINNER Meat_17:00-19:00",
      "allergene": {
        "gluten": "Glutenhaltiges Getreide",
        "huhnerei": "Hühnerei und Hühnereierzeugnisse",
        "milch": "Milch und Milcherzeugnisse",
        "sellerie": "Sellerie und Sellerieerzeugnisse",
        "schwefel": "Schwefeldioxid und Sulfide"
      },
      "merkmale": "",
      "naehrstoffe": "",
      "zusatzstoffe": [
        {
          "de": "Alkohol",
          "en": "Alcohol"
        }
      ],
      "PrintOrder": "10",
      "CO2Value": "7035.00",
      "CO2Rating": "E",
      "CO2Perc": "100.00",
      "ClimateFriendly": null,
      "GastDesc": "Rinderschmorbraten | Blaukraut | Spätzle",
      "date_de": "07.01.2026"
    },
    {
      "id": "5079404",
      "outlet": "canteen",
      "date": "2026-01-07",
      "CalendarWeek": "2",
      "day": "Mittwoch",
      "mealtime": "Abendessen",
      "IdentNr": "12026010798012",
      "itemId": "17561",
      "RecipeID": "7035",
      "ProductPrice": "9.50",
      "ProductPrice_2": null,
      "GastDesc_de": "Tortellini Verdura | Tomate | Basilikum",
      "GastDesc_en": "Tortellini Verdura | Tomato | Basil",
      "MenuName": "DINNER Vegi/Vegan_17:00-19:00",
      "allergene": {
        "gluten": "Glutenhaltiges Getreide",
        "milch": "Milch und Milcherzeugnisse",
        "sellerie": "Sellerie und Sellerieerzeugnisse"
      },
      "merkmale": {
        "veganuary": "Veganuary"
      },
      "naehrstoffe": "",
      "zusatzstoffe": null,
      "PrintOrder": "12",
      "CO2Value": "248.00",
      "CO2Rating": "A",
      "CO2Perc": "100.00",
      "ClimateFriendly": "1",
      "GastDesc": "Tortellini Verdura | Tomate | Basilikum",
      "date_de": "07.01.2026"
    },
    {
      "id": "5079406",
      "outlet": "canteen",
      "date": "2026-01-08",
      "CalendarWeek": "2",
      "day": "Donnerstag",
      "mealtime": "Mittagessen",
      "IdentNr": "12026010898000",
      "itemId": "17549",
      "RecipeID": "8703",
      "ProductPrice": "11.00",
      "ProductPrice_2": null,
      "GastDesc_de": "Vegane Bibimbap | Sojasprossen | Zucchini",
      "GastDesc_en": "Vegan Bibimbap | Soybean Sprouts | Zucchini",
      "MenuName": "COUNTER 1.1 Bowls_",
      "allergene": {
        "gluten": "Glutenhaltiges Getreide",
        "soja": "Soja und Sojaerzeugnisse",
        "sesam": "Sesamsamen und Sesamsamenerzeugnisse",
        "schwefel": "Schwefeldioxid und Sulfide"
      },
      "merkmale": {
        "veganuary": "Veganuary"
      },
      "naehrstoffe": "",
      "zusatzstoffe": [
        {
          "de": "Süßungsmittel",
          "en": "Sweetener"
        },
        {
          "de": "Phenylalaninquelle",
          "en": "Phenylalanine"
        },
        {
          "de": "Konservierungsstoff",
          "en": "Preservatives"
        },
        {
          "de": "Alkohol",
          "en": "Alcohol"
        }
      ],
      "PrintOrder": "0",
      "CO2Value": "828.00",
      "CO2Rating": "A",
      "CO2Perc": "100.00",
      "ClimateFriendly": "1",
      "GastDesc": "Vegane Bibimbap | Sojasprossen | Zucchini",
      "date_de": "08.01.2026"
    },
    {
      "id": "5079407",
      "outlet": "canteen",
      "date": "2026-01-08",
      "CalendarWeek": "2",
      "day": "Donnerstag",
      "mealtime": "Mittagessen",
      "IdentNr": "12026010898001",
      "itemId": "17550",
      "RecipeID": "8438",
      "ProductPrice": "12.00",
      "ProductPrice_2": null,
      "GastDesc_de": "Lammhüfte | Maispolenta | Peperonate | Rosmarin",
      "GastDesc_en": "Lamb Rump | Corn Polenta | Peperonata | Rosemary",
      "MenuName": "COUNTER 2.1 Meat",
      "allergene": {
        "huhnerei": "Hühnerei und Hühnereierzeugnisse",
        "milch": "Milch und Milcherzeugnisse",
        "sellerie": "Sellerie und Sellerieerzeugnisse",
        "schwefel": "Schwefeldioxid und Sulfide"
      },
      "merkmale": "",
      "naehrstoffe": "",
      "zusatzstoffe": [
        {
          "de": "Alkohol",
          "en": "Alcohol"
        }
      ],
      "PrintOrder": "1",
      "CO2Value": "6757.00",
      "CO2Rating": "E",
      "CO2Perc": "100.00",
      "ClimateFriendly": null,
      "GastDesc": "Lammhüfte | Maispolenta | Peperonate | Rosmarin",
      "date_de": "08.01.2026"
    },
    {
      "id": "5079408",
      "outlet": "canteen",
      "date": "2026-01-08",
      "CalendarWeek": "2",
      "day": "Donnerstag",
      "mealtime": "Mittagessen",
      "IdentNr": "12026010898003",
      "itemId": "17552",
      "RecipeID": "7576",
      "ProductPrice": "12.00",
      "ProductPrice_2": null,
      "GastDesc_de": "Lachs | Reisnudeln | Rote Bete | Fenchel",
      "GastDesc_en": "Salmon | Rice Noodles | Beetroot | Fennel",
      "MenuName": "COUNTER 3.1 Fish",
      "allergene": {
        "gluten": "Glutenhaltiges Getreide",
        "fisch": "Fisch und Fischerzeugnisse",
        "milch": "Milch und Milcherzeugnisse",
        "sellerie": "Sellerie und Sellerieerzeugnisse",
        "schwefel": "Schwefeldioxid und Sulfide"
      },
      "merkmale": "",
      "naehrstoffe": "",
      "zusatzstoffe": [
        {
          "de": "Antioxidationsmittel",
          "en": "Antioxidation"
        },
        {
          "de": "Alkohol",
          "en": "Alcohol"
        }
      ],
      "PrintOrder": "3",
      "CO2Value": "1193.00",
      "CO2Rating": "B",
      "CO2Perc": "100.00",
      "ClimateFriendly": null,
      "GastDesc": "Lachs | Reisnudeln | Rote Bete | Fenchel",
      "date_de": "08.01.2026"
    },
    {
      "id": "5079409",
      "outlet": "canteen",
      "date": "2026-01-08",
      "CalendarWeek": "2",
      "day": "Donnerstag",
      "mealtime": "Mittagessen",
      "IdentNr": "12026010898005",
      "itemId": "17554",
      "RecipeID": "6758",
      "ProductPrice": "10.00",
      "ProductPrice_2": null,
      "GastDesc_de": "Süßkartoffel | Avocado | Tzatziki",
      "GastDesc_en": "Sweet Potato | Avocado | Tzatziki",
      "MenuName": "COUNTER 4.1 Vegi",
      "allergene": {
        "gluten": "Glutenhaltiges Getreide",
        "schalenfruchte": "Schalenfrüchte und Schalenfruchterzeugnisse",
        "schwefel": "Schwefeldioxid und Sulfide"
      },
      "merkmale": {
        "veganuary": "Veganuary"
      },
      "naehrstoffe": "",
      "zusatzstoffe": null,
      "PrintOrder": "5",
      "CO2Value": "382.00",
      "CO2Rating": "A",
      "CO2Perc": "100.00",
      "ClimateFriendly": "1",
      "GastDesc": "Süßkartoffel | Avocado | Tzatziki",
      "date_de": "08.01.2026"
    },
    {
      "id": "5079410",
      "outlet": "canteen",
      "date": "2026-01-08",
      "CalendarWeek": "2",
      "day": "Donnerstag",
      "mealtime": "Abendessen",
      "IdentNr": "12026010898009",
      "itemId": "17558",
      "RecipeID": "8703",
      "ProductPrice": "11.00",
      "ProductPrice_2": null,
      "GastDesc_de": "Vegane Bibimbap | Sojasprossen | Zucchini",
      "GastDesc_en": "Vegan Bibimbap | Soybean Sprouts | Zucchini",
      "MenuName": "DINNER BOWL_",
      "allergene": {
        "gluten": "Glutenhaltiges Getreide",
        "soja": "Soja und Sojaerzeugnisse",
        "sesam": "Sesamsamen und Sesamsamenerzeugnisse",
        "schwefel": "Schwefeldioxid und Sulfide"
      },
      "merkmale": {
        "veganuary": "Veganuary"
      },
      "naehrstoffe": "",
      "zusatzstoffe": [
        {
          "de": "Süßungsmittel",
          "en": "Sweetener"
        },
        {
          "de": "Phenylalaninquelle",
          "en": "Phenylalanine"
        },
        {
          "de": "Konservierungsstoff",
          "en": "Preservatives"
        },
        {
          "de": "Alkohol",
          "en": "Alcohol"
        }
      ],
      "PrintOrder": "9",
      "CO2Value": "828.00",
      "CO2Rating": "A",
      "CO2Perc": "100.00",
      "ClimateFriendly": "1",
      "GastDesc": "Vegane Bibimbap | Sojasprossen | Zucchini",
      "date_de": "08.01.2026"
    },
    {
      "id": "5079412",
      "outlet": "canteen",
      "date": "2026-01-08",
      "CalendarWeek": "2",
      "day": "Donnerstag",
      "mealtime": "Abendessen",
      "IdentNr": "12026010898011",
      "itemId": "17560",
      "RecipeID": "8438",
      "ProductPrice": "12.00",
      "ProductPrice_2": null,
      "GastDesc_de": "Lammhüfte | Maispolenta | Peperonate | Rosmarin",
      "GastDesc_en": "Lamb Rump | Corn Polenta | Peperonata | Rosemary",
      "MenuName": "DINNER Fish_17:00-19:00",
      "allergene": {
        "huhnerei": "Hühnerei und Hühnereierzeugnisse",
        "milch": "Milch und Milcherzeugnisse",
        "sellerie": "Sellerie und Sellerieerzeugnisse",
        "schwefel": "Schwefeldioxid und Sulfide"
      },
      "merkmale": "",
      "naehrstoffe": "",
      "zusatzstoffe": [
        {
          "de": "Alkohol",
          "en": "Alcohol"
        }
      ],
      "PrintOrder": "11",
      "CO2Value": "6757.00",
      "CO2Rating": "E",
      "CO2Perc": "100.00",
      "ClimateFriendly": null,
      "GastDesc": "Lammhüfte | Maispolenta | Peperonate | Rosmarin",
      "date_de": "08.01.2026"
    },
    {
      "id": "5079414",
      "outlet": "canteen",
      "date": "2026-01-08",
      "CalendarWeek": "2",
      "day": "Donnerstag",
      "mealtime": "Abendessen",
      "IdentNr": "12026010898012",
      "itemId": "17561",
      "RecipeID": "6758",
      "ProductPrice": "10.00",
      "ProductPrice_2": null,
      "GastDesc_de": "Süßkartoffel | Avocado | Tzatziki",
      "GastDesc_en": "Sweet Potato | Avocado | Tzatziki",
      "MenuName": "DINNER Vegi/Vegan_17:00-19:00",
      "allergene": {
        "gluten": "Glutenhaltiges Getreide",
        "schalenfruchte": "Schalenfrüchte und Schalenfruchterzeugnisse",
        "schwefel": "Schwefeldioxid und Sulfide"
      },
      "merkmale": {
        "veganuary": "Veganuary"
      },
      "naehrstoffe": "",
      "zusatzstoffe": null,
      "PrintOrder": "12",
      "CO2Value": "382.00",
      "CO2Rating": "A",
      "CO2Perc": "100.00",
      "ClimateFriendly": "1",
      "GastDesc": "Süßkartoffel | Avocado | Tzatziki",
      "date_de": "08.01.2026"
    },
    {
      "id": "5079416",
      "outlet": "canteen",
      "date": "2026-01-09",
      "CalendarWeek": "2",
      "day": "Freitag",
      "mealtime": "Mittagessen",
      "IdentNr": "12026010998000",
      "itemId": "17549",
      "RecipeID": "4776",
