{
  "daySelector": [
    {
      "date": "2025-12-28",
      "day": "Sonntag",
      "CalendarWeek": "52",
      "date_de": "28.12.2025"
    },
    {
      "date": "2025-12-29",
      "day": "Montag",
      "CalendarWeek": "1",
      "date_de": "29.12.2025"
    },
    {
      "date": "2025-12-30",
      "day": "Dienstag",
      "CalendarWeek": "1",
      "date_de": "30.12.2025"
    },
    {
      "date": "2026-01-01",
      "day": "Donnerstag",
      "CalendarWeek": "1",
      "date_de": "01.01.2026"
    },
    {
      "date": "2026-01-02",
      "day": "Freitag",
      "CalendarWeek": "1",
      "date_de": "02.01.2026"
    },
    {
      "date": "2026-01-03",
      "day": "Samstag",
      "CalendarWeek": "1",
      "date_de": "03.01.2026"
    },
    {
      "date": "2026-01-04",
      "day": "Sonntag",
      "CalendarWeek": "1",
      "date_de": "04.01.2026"
    },
    {
      "date": "2026-01-05",
      "day": "Montag",
      "CalendarWeek": "1",
      "date_de": "05.01.2026"
    },
    {
      "date": "2026-01-06",
      "day": "Dienstag",
      "CalendarWeek": "1",
      "date_de": "06.01.2026"
    },
    {
      "date": "2026-01-07",
      "day": "Mittwoch",
      "CalendarWeek": "1",
      "date_de": "07.01.2026"
    },
    {
      "date": "2026-01-08",
      "day": "Donnerstag",
      "CalendarWeek": "1",
      "date_de": "08.01.2026"
    },
    {
      "date": "2026-01-09",
      "day": "Freitag",
      "CalendarWeek": "1",
      "date_de": "09.01.2026"
    },
    {
      "date": "2026-01-12",
      "day": "Montag",
      "CalendarWeek": "1",
      "date_de": "12.01.2026"
    },
    {
      "date": "2026-01-13",
      "day": "Dienstag",
      "CalendarWeek": "1",
      "date_de": "13.01.2026"
    },
    {
      "date": "2026-01-14",
      "day": "Mittwoch",
      "CalendarWeek": "1",
      "date_de": "14.01.2026"
    },
    {
      "date": "2026-01-15",
      "day": "Donnerstag",
      "CalendarWeek": "1",
      "date_de": "15.01.2026"
    },
    {
      "date": "2026-01-16",
      "day": "Freitag",
      "CalendarWeek": "1",
      "date_de": "16.01.2026"
    }
  ],
  "data": [
    {
      "id": "4981942",
      "outlet": "canteen",
      "date": "2025-12-28",
      "CalendarWeek": "52",
      "day": "Sonntag",
      "mealtime": "Abendessen",
      "IdentNr": "12025122898018",
      "itemId": "17864",
      "RecipeID": "6327",
      "ProductPrice": "12.00",
      "ProductPrice_2": null,
      "GastDesc_de": "Prager Schinken | Weißkrautsalat | Salzkartoffeln",
      "GastDesc_en": "Gammon | Cabbage | Boiled Potatoes",
      "MenuName": "DINNER Meat _|",
      "allergene": {
        "milch": "Milch und Milcherzeugnisse",
        "sellerie": "Sellerie und Sellerieerzeugnisse",
        "schwefel": "Schwefeldioxid und Sulfide"
      },
      "merkmale": {
        "schwein": "Schwein"
      },
      "naehrstoffe": "",
      "zusatzstoffe": [
        {
          "de": "Alkohol",
          "en": "Alcohol"
        }
      ],
      "PrintOrder": "18",
      "CO2Value": "1188.00",
      "CO2Rating": "B",
      "CO2Perc": "100.00",
      "ClimateFriendly": null,
      "GastDesc": "Prager Schinken | Weißkrautsalat | Salzkartoffeln",
      "date_de": "28.12.2025"
    },
    {
      "id": "4981943",
      "outlet": "canteen",
      "date": "2025-12-28",
      "CalendarWeek": "52",
      "day": "Sonntag",
      "mealtime": "Mittagessen",
      "IdentNr": "12025122898018",
      "itemId": "17864",
      "RecipeID": "6327",
      "ProductPrice": "12.00",
      "ProductPrice_2": null,
      "GastDesc_de": "Prager Schinken | Weißkrautsalat | Salzkartoffeln",
      "GastDesc_en": "Gammon | Cabbage | Boiled Potatoes",
      "MenuName": "DINNER Meat _|",
      "allergene": {
        "milch": "Milch und Milcherzeugnisse",
        "sellerie": "Sellerie und Sellerieerzeugnisse",
        "schwefel": "Schwefeldioxid und Sulfide"
      },
      "merkmale": {
        "schwein": "Schwein"
      },
      "naehrstoffe": "",
      "zusatzstoffe": [
        {
          "de": "Alkohol",
          "en": "Alcohol"
        }
      ],
      "PrintOrder": "18",
      "CO2Value": "1188.00",
      "CO2Rating": "B",
      "CO2Perc": "100.00",
      "ClimateFriendly": null,
      "GastDesc": "Prager Schinken | Weißkrautsalat | Salzkartoffeln",
      "date_de": "28.12.2025"
    },
    {
      "id": "4981945",
      "outlet": "canteen",
      "date": "2025-12-28",
      "CalendarWeek": "52",
      "day": "Sonntag",
      "mealtime": "Abendessen",
      "IdentNr": "12025122898019",
      "itemId": "17865",
      "RecipeID": "2972",
      "ProductPrice": "12.00",
      "ProductPrice_2": null,
      "GastDesc_de": "Lachsfilet | Arbequina-Olivenöl  | provenzalisches Gemüse",
      "GastDesc_en": "Salmon fillet | Arbequina olive oil | Provençal vegetables",
      "MenuName": "DINNER Fish _|",
      "allergene": {
        "gluten": "Glutenhaltiges Getreide",
        "fisch": "Fisch und Fischerzeugnisse"
      },
      "merkmale": "",
      "naehrstoffe": "",
      "zusatzstoffe": null,
      "PrintOrder": "19",
      "CO2Value": "1168.00",
      "CO2Rating": "B",
      "CO2Perc": "100.00",
      "ClimateFriendly": null,
      "GastDesc": "Lachsfilet | Arbequina-Olivenöl  | provenzalisches Gemüse",
      "date_de": "28.12.2025"
    },
    {
      "id": "4981946",
      "outlet": "canteen",
      "date": "2025-12-28",
      "CalendarWeek": "52",
      "day": "Sonntag",
      "mealtime": "Mittagessen",
      "IdentNr": "12025122898019",
      "itemId": "17865",
      "RecipeID": "2972",
      "ProductPrice": "12.00",
      "ProductPrice_2": null,
      "GastDesc_de": "Lachsfilet | Arbequina-Olivenöl  | provenzalisches Gemüse",
      "GastDesc_en": "Salmon fillet | Arbequina olive oil | Provençal vegetables",
      "MenuName": "DINNER Fish _|",
      "allergene": {
        "gluten": "Glutenhaltiges Getreide",
        "fisch": "Fisch und Fischerzeugnisse"
      },
      "merkmale": "",
      "naehrstoffe": "",
      "zusatzstoffe": null,
      "PrintOrder": "19",
      "CO2Value": "1168.00",
      "CO2Rating": "B",
      "CO2Perc": "100.00",
      "ClimateFriendly": null,
      "GastDesc": "Lachsfilet | Arbequina-Olivenöl  | provenzalisches Gemüse",
      "date_de": "28.12.2025"
    },
    {
      "id": "4981948",
      "outlet": "canteen",
      "date": "2025-12-28",
      "CalendarWeek": "52",
      "day": "Sonntag",
      "mealtime": "Abendessen",
      "IdentNr": "12025122898020",
      "itemId": "17866",
      "RecipeID": "4564",
      "ProductPrice": "9.50",
      "ProductPrice_2": null,
      "GastDesc_de": "Kichererbsen-Masala | Basmati | Papadam",
      "GastDesc_en": "Chickpea Masala | Basmati Rice | Papadam",
      "MenuName": "DINNER Vegi / Vegan_|",
      "allergene": {
        "sellerie": "Sellerie und Sellerieerzeugnisse"
      },
      "merkmale": {
        "vegan": "Vegan",
        "vegetarisch": "Vegetarisch"
      },
      "naehrstoffe": "",
      "zusatzstoffe": [
        {
          "de": "Süßungsmittel",
          "en": "Sweetener"
        },
        {
          "de": "Phenylalaninquelle",
          "en": "Phenylalanine"
        },
        {
          "de": "Konservierungsstoff",
          "en": "Preservatives"
        }
      ],
      "PrintOrder": "20",
      "CO2Value": "532.00",
      "CO2Rating": "A",
      "CO2Perc": "100.00",
      "ClimateFriendly": "1",
      "GastDesc": "Kichererbsen-Masala | Basmati | Papadam",
      "date_de": "28.12.2025"
    },
    {
      "id": "4981949",
      "outlet": "canteen",
      "date": "2025-12-28",
      "CalendarWeek": "52",
      "day": "Sonntag",
      "mealtime": "Mittagessen",
      "IdentNr": "12025122898020",
      "itemId": "17866",
      "RecipeID": "4564",
      "ProductPrice": "9.50",
      "ProductPrice_2": null,
      "GastDesc_de": "Kichererbsen-Masala | Basmati | Papadam",
      "GastDesc_en": "Chickpea Masala | Basmati Rice | Papadam",
      "MenuName": "DINNER Vegi / Vegan_|",
      "allergene": {
        "sellerie": "Sellerie und Sellerieerzeugnisse"
      },
      "merkmale": {
        "vegan": "Vegan",
        "vegetarisch": "Vegetarisch"
      },
      "naehrstoffe": "",
      "zusatzstoffe": [
        {
          "de": "Süßungsmittel",
          "en": "Sweetener"
        },
        {
          "de": "Phenylalaninquelle",
          "en": "Phenylalanine"
        },
        {
          "de": "Konservierungsstoff",
          "en": "Preservatives"
        }
      ],
      "PrintOrder": "20",
      "CO2Value": "532.00",
      "CO2Rating": "A",
      "CO2Perc": "100.00",
      "ClimateFriendly": "1",
      "GastDesc": "Kichererbsen-Masala | Basmati | Papadam",
      "date_de": "28.12.2025"
    },
    {
      "id": "4995238",
      "outlet": "canteen",
      "date": "2025-12-29",
      "CalendarWeek": "1",
      "day": "Montag",
      "mealtime": "Mittagessen",
      "IdentNr": "12025122998000",
      "itemId": "17549",
      "RecipeID": "5651",
      "ProductPrice": "10.00",
      "ProductPrice_2": null,
      "GastDesc_de": "Rote-Bete-Falafel | Römersalat | Joghurt",
      "GastDesc_en": "Beetroot falafel | Romaine lettuce | Yogurt",
      "MenuName": "COUNTER 1.1 Bowls_",
      "allergene": {
        "gluten": "Glutenhaltiges Getreide",
        "schalenfruchte": "Schalenfrüchte und Schalenfruchterzeugnisse",
        "milch": "Milch und Milcherzeugnisse",
        "schwefel": "Schwefeldioxid und Sulfide"
      },
      "merkmale": {
        "veganuary": "Veganuary"
      },
      "naehrstoffe": "",
      "zusatzstoffe": [
        {
          "de": "Antioxidationsmittel",
          "en": "Antioxidation"
        },
        {
          "de": "Alkohol",
          "en": "Alcohol"
        }
      ],
      "PrintOrder": "0",
      "CO2Value": "380.00",
      "CO2Rating": "A",
      "CO2Perc": "100.00",
      "ClimateFriendly": "1",
      "GastDesc": "Rote-Bete-Falafel | Römersalat | Joghurt",
      "date_de": "29.12.2025"
    },
    {
      "id": "4995239",
      "outlet": "canteen",
      "date": "2025-12-29",
      "CalendarWeek": "1",
      "day": "Montag",
      "mealtime": "Mittagessen",
      "IdentNr": "12025122998001",
      "itemId": "17550",
      "RecipeID": "8841",
      "ProductPrice": "12.00",
      "ProductPrice_2": null,
      "GastDesc_de": "Jamaican-Pork-Curry | Erbsen | Butterreis",
      "GastDesc_en": "Jamaican pork curry | Green Peas | Butter Rice",
      "MenuName": "COUNTER 2.1 Meat",
      "allergene": {
        "milch": "Milch und Milcherzeugnisse",
        "sellerie": "Sellerie und Sellerieerzeugnisse"
      },
      "merkmale": {
        "schwein": "Schwein"
      },
      "naehrstoffe": "",
      "zusatzstoffe": null,
      "PrintOrder": "1",
      "CO2Value": "2439.00",
      "CO2Rating": "C",
      "CO2Perc": "100.00",
      "ClimateFriendly": null,
      "GastDesc": "Jamaican-Pork-Curry | Erbsen | Butterreis",
      "date_de": "29.12.2025"
    },
    {
      "id": "4995240",
      "outlet": "canteen",
      "date": "2025-12-29",
      "CalendarWeek": "1",
      "day": "Montag",
      "mealtime": "Mittagessen",
      "IdentNr": "12025122998003",
      "itemId": "17552",
      "RecipeID": "8538",
      "ProductPrice": "12.00",
      "ProductPrice_2": null,
      "GastDesc_de": "Rotbarsch | Süßkartoffel | Harissa",
      "GastDesc_en": "Redfish | Sweet Potato | Spicy Harissa",
      "MenuName": "COUNTER 3.1 Fish",
      "allergene": {
        "fisch": "Fisch und Fischerzeugnisse",
        "milch": "Milch und Milcherzeugnisse",
        "sellerie": "Sellerie und Sellerieerzeugnisse"
      },
      "merkmale": "",
      "naehrstoffe": "",
      "zusatzstoffe": null,
      "PrintOrder": "3",
      "CO2Value": "1024.00",
      "CO2Rating": "C",
      "CO2Perc": "100.00",
      "ClimateFriendly": null,
      "GastDesc": "Rotbarsch | Süßkartoffel | Harissa",
      "date_de": "29.12.2025"
    },
    {
      "id": "4995241",
      "outlet": "canteen",
      "date": "2025-12-29",
      "CalendarWeek": "1",
      "day": "Montag",
      "mealtime": "Mittagessen",
      "IdentNr": "12025122998005",
      "itemId": "17554",
      "RecipeID": "4449",
      "ProductPrice": "10.00",
      "ProductPrice_2": null,
      "GastDesc_de": "Fagottini | Pomodori | Basilikum",
      "GastDesc_en": "Fagottini | Pomodori | Basil",
      "MenuName": "COUNTER 4.1 Vegi",
      "allergene": {
        "gluten": "Glutenhaltiges Getreide",
        "schwefel": "Schwefeldioxid und Sulfide"
      },
      "merkmale": {
        "vegan": "Vegan",
        "vegetarisch": "Vegetarisch"
      },
      "naehrstoffe": "",
      "zusatzstoffe": null,
      "PrintOrder": "5",
      "CO2Value": "417.00",
      "CO2Rating": "A",
      "CO2Perc": "100.00",
      "ClimateFriendly": "1",
      "GastDesc": "Fagottini | Pomodori | Basilikum",
      "date_de": "29.12.2025"
    },
    {
      "id": "4995242",
      "outlet": "canteen",
      "date": "2025-12-29",
      "CalendarWeek": "1",
      "day": "Montag",
      "mealtime": "Abendessen",
      "IdentNr": "12025122998009",
      "itemId": "17558",
      "RecipeID": "5651",
      "ProductPrice": "10.00",
      "ProductPrice_2": null,
      "GastDesc_de": "Rote-Bete-Falafel | Römersalat | Joghurt",
      "GastDesc_en": "Beetroot falafel | Romaine lettuce | Yogurt",
      "MenuName": "DINNER BOWL_",
      "allergene": {
        "gluten": "Glutenhaltiges Getreide",
        "schalenfruchte": "Schalenfrüchte und Schalenfruchterzeugnisse",
        "milch": "Milch und Milcherzeugnisse",
        "schwefel": "Schwefeldioxid und Sulfide"
      },
      "merkmale": {
        "veganuary": "Veganuary"
      },
      "naehrstoffe": "",
      "zusatzstoffe": [
        {
          "de": "Antioxidationsmittel",
          "en": "Antioxidation"
        },
        {
          "de": "Alkohol",
          "en": "Alcohol"
        }
      ],
      "PrintOrder": "9",
      "CO2Value": "380.00",
      "CO2Rating": "A",
      "CO2Perc": "100.00",
      "ClimateFriendly": "1",
      "GastDesc": "Rote-Bete-Falafel | Römersalat | Joghurt",
      "date_de": "29.12.2025"
    },
    {
      "id": "4995244",
      "outlet": "canteen",
      "date": "2025-12-29",
      "CalendarWeek": "1",
      "day": "Montag",
      "mealtime": "Abendessen",
      "IdentNr": "12025122998010",
      "itemId": "17559",
      "RecipeID": "8841",
      "ProductPrice": "12.00",
      "ProductPrice_2": null,
      "GastDesc_de": "Jamaican-Pork-Curry | Erbsen | Butterreis",
      "GastDesc_en": "Jamaican pork curry | Green Peas | Butter Rice",
      "MenuName": "DINNER Meat_17:00-19:00",
      "allergene": {
        "milch": "Milch und Milcherzeugnisse",
        "sellerie": "Sellerie und Sellerieerzeugnisse"
      },
      "merkmale": {
        "schwein": "Schwein"
      },
      "naehrstoffe": "",
      "zusatzstoffe": null,
      "PrintOrder": "10",
      "CO2Value": "2439.00",
      "CO2Rating": "C",
      "CO2Perc": "100.00",
      "ClimateFriendly": null,
      "GastDesc": "Jamaican-Pork-Curry | Erbsen | Butterreis",
      "date_de": "29.12.2025"
    },
    {
      "id": "4995246",
      "outlet": "canteen",
      "date": "2025-12-29",
      "CalendarWeek": "1",
      "day": "Montag",
      "mealtime": "Abendessen",
      "IdentNr": "12025122998011",
      "itemId": "17560",
      "RecipeID": "4449",
      "ProductPrice": "10.00",
      "ProductPrice_2": null,
      "GastDesc_de": "Fagottini | Pomodori | Basilikum",
      "GastDesc_en": "Fagottini | Pomodori | Basil",
      "MenuName": "DINNER Fish_17:00-19:00",
      "allergene": {
        "gluten": "Glutenhaltiges Getreide",
        "schwefel": "Schwefeldioxid und Sulfide"
      },
      "merkmale": {
        "vegan": "Vegan",
        "vegetarisch": "Vegetarisch"
      },
      "naehrstoffe": "",
      "zusatzstoffe": null,
      "PrintOrder": "11",
      "CO2Value": "417.00",
      "CO2Rating": "A",
      "CO2Perc": "100.00",
      "ClimateFriendly": "1",
      "GastDesc": "Fagottini | Pomodori | Basilikum",
      "date_de": "29.12.2025"
    },
    {
      "id": "5009423",
      "outlet": "canteen",
      "date": "2025-12-30",
      "CalendarWeek": "1",
      "day": "Dienstag",
      "mealtime": "Mittagessen",
      "IdentNr": "12025123098000",
      "itemId": "17549",
      "RecipeID": "5008",
      "ProductPrice": "11.00",
      "ProductPrice_2": null,
      "GastDesc_de": "Hoi Sin | Champignon | Bulgur",
      "GastDesc_en": "Hoi Sin | Mushroom | Bulgur",
      "MenuName": "COUNTER 1.1 Bowls_",
      "allergene": {
        "gluten": "Glutenhaltiges Getreide",
        "soja": "Soja und Sojaerzeugnisse",
        "sellerie": "Sellerie und Sellerieerzeugnisse",
        "sesam": "Sesamsamen und Sesamsamenerzeugnisse",
        "schwefel": "Schwefeldioxid und Sulfide"
      },
      "merkmale": {
        "vegan": "Vegan",
        "vegetarisch": "Vegetarisch"
      },
      "naehrstoffe": "",
      "zusatzstoffe": [
        {
          "de": "geschwefelt",
          "en": "Sulphurous"
        },
        {
          "de": "Farbstoff",
          "en": "Colouring Agent"
        },
        {
          "de": "Antioxidationsmittel",
          "en": "Antioxidation"
        },
        {
          "de": "Alkohol",
          "en": "Alcohol"
        }
      ],
      "PrintOrder": "0",
      "CO2Value": "712.00",
      "CO2Rating": "B",
      "CO2Perc": "100.00",
      "ClimateFriendly": null,
      "GastDesc": "Hoi Sin | Champignon | Bulgur",
      "date_de": "30.12.2025"
    },
    {
      "id": "5009424",
      "outlet": "canteen",
      "date": "2025-12-30",
      "CalendarWeek": "1",
      "day": "Dienstag",
      "mealtime": "Mittagessen",
      "IdentNr": "12025123098001",
      "itemId": "17550",
      "RecipeID": "8841",
      "ProductPrice": "12.00",
      "ProductPrice_2": null,
      "GastDesc_de": "Jamaican-Pork-Curry | Erbsen | Butterreis",
      "GastDesc_en": "Jamaican pork curry | Green Peas | Butter Rice",
      "MenuName": "COUNTER 2.1 Meat",
      "allergene": {
        "milch": "Milch und Milcherzeugnisse",
        "sellerie": "Sellerie und Sellerieerzeugnisse"
      },
      "merkmale": {
        "schwein": "Schwein"
      },
      "naehrstoffe": "",
      "zusatzstoffe": null,
      "PrintOrder": "1",
      "CO2Value": "2439.00",
      "CO2Rating": "C",
      "CO2Perc": "100.00",
      "ClimateFriendly": null,
      "GastDesc": "Jamaican-Pork-Curry | Erbsen | Butterreis",
      "date_de": "30.12.2025"
    },
    {
      "id": "5009425",
      "outlet": "canteen",
      "date": "2025-12-30",
      "CalendarWeek": "1",
      "day": "Dienstag",
      "mealtime": "Mittagessen",
      "IdentNr": "12025123098003",
      "itemId": "17552",
      "RecipeID": "8538",
      "ProductPrice": "12.00",
      "ProductPrice_2": null,
      "GastDesc_de": "Rotbarsch | Süßkartoffel | Harissa",
      "GastDesc_en": "Redfish | Sweet Potato | Spicy Harissa",
      "MenuName": "COUNTER 3.1 Fish",
      "allergene": {
        "fisch": "Fisch und Fischerzeugnisse",
        "milch": "Milch und Milcherzeugnisse",
        "sellerie": "Sellerie und Sellerieerzeugnisse"
      },
      "merkmale": "",
      "naehrstoffe": "",
      "zusatzstoffe": null,
      "PrintOrder": "3",
      "CO2Value": "1024.00",
      "CO2Rating": "C",
      "CO2Perc": "100.00",
      "ClimateFriendly": null,
      "GastDesc": "Rotbarsch | Süßkartoffel | Harissa",
      "date_de": "30.12.2025"
    },
    {
      "id": "5009426",
      "outlet": "canteen",
      "date": "2025-12-30",
      "CalendarWeek": "1",
      "day": "Dienstag",
      "mealtime": "Mittagessen",
      "IdentNr": "12025123098005",
      "itemId": "17554",
      "RecipeID": "2840",
      "ProductPrice": "9.50",
      "ProductPrice_2": null,
      "GastDesc_de": "Grenaille Kartoffeln | Kräuterquark | Leinöl | Wildkräutersalat",
      "GastDesc_en": "Baby Potatoes I Herb curd I Linseed Oil I Wild herb salad",
      "MenuName": "COUNTER 4.1 Vegi",
      "allergene": {
        "milch": "Milch und Milcherzeugnisse"
      },
      "merkmale": {
        "vegetarisch": "Vegetarisch"
      },
      "naehrstoffe": "",
      "zusatzstoffe": null,
      "PrintOrder": "5",
      "CO2Value": "1162.00",
      "CO2Rating": "B",
      "CO2Perc": "100.00",
      "ClimateFriendly": null,
      "GastDesc": "Grenaille Kartoffeln | Kräuterquark | Leinöl | Wildkräutersalat",
      "date_de": "30.12.2025"
    },
    {
      "id": "5009427",
      "outlet": "canteen",
      "date": "2025-12-30",
      "CalendarWeek": "1",
      "day": "Dienstag",
      "mealtime": "Abendessen",
      "IdentNr": "12025123098009",
      "itemId": "17558",
      "RecipeID": "5008",
      "ProductPrice": "11.00",
      "ProductPrice_2": null,
      "GastDesc_de": "Hoi Sin | Champignon | Bulgur",
      "GastDesc_en": "Hoi Sin | Mushroom | Bulgur",
      "MenuName": "DINNER BOWL_",
      "allergene": {
        "gluten": "Glutenhaltiges Getreide",
        "soja": "Soja und Sojaerzeugnisse",
        "sellerie": "Sellerie und Sellerieerzeugnisse",
        "sesam": "Sesamsamen und Sesamsamenerzeugnisse",
        "schwefel": "Schwefeldioxid und Sulfide"
      },
      "merkmale": {
        "vegan": "Vegan",
        "vegetarisch": "Vegetarisch"
      },
      "naehrstoffe": "",
      "zusatzstoffe": [
        {
          "de": "geschwefelt",
          "en": "Sulphurous"
        },
        {
          "de": "Farbstoff",
          "en": "Colouring Agent"
        },
        {
          "de": "Antioxidationsmittel",
          "en": "Antioxidation"
        },
        {
          "de": "Alkohol",
          "en": "Alcohol"
        }
      ],
      "PrintOrder": "9",
      "CO2Value": "712.00",
      "CO2Rating": "B",
      "CO2Perc": "100.00",
      "ClimateFriendly": null,
      "GastDesc": "Hoi Sin | Champignon | Bulgur",
      "date_de": "30.12.2025"
    },
    {
      "id": "5009429",
      "outlet": "canteen",
      "date": "2025-12-30",
      "CalendarWeek": "1",
      "day": "Dienstag",
      "mealtime": "Abendessen",
      "IdentNr": "12025123098010",
      "itemId": "17559",
      "RecipeID": "8538",
      "ProductPrice": "12.00",
      "ProductPrice_2": null,
      "GastDesc_de": "Rotbarsch | Süßkartoffel | Harissa",
      "GastDesc_en": "Redfish | Sweet Potato | Spicy Harissa",
      "MenuName": "DINNER Meat_17:00-19:00",
      "allergene": {
        "fisch": "Fisch und Fischerzeugnisse",
        "milch": "Milch und Milcherzeugnisse",
        "sellerie": "Sellerie und Sellerieerzeugnisse"
      },
      "merkmale": "",
      "naehrstoffe": "",
      "zusatzstoffe": null,
      "PrintOrder": "10",
      "CO2Value": "1024.00",
      "CO2Rating": "C",
      "CO2Perc": "100.00",
      "ClimateFriendly": null,
      "GastDesc": "Rotbarsch | Süßkartoffel | Harissa",
      "date_de": "30.12.2025"
    },
    {
      "id": "5009431",
      "outlet": "canteen",
      "date": "2025-12-30",
      "CalendarWeek": "1",
      "day": "Dienstag",
      "mealtime": "Abendessen",
      "IdentNr": "12025123098011",
      "itemId": "17560",
      "RecipeID": "2840",
      "ProductPrice": "9.50",
      "ProductPrice_2": null,
      "GastDesc_de": "Grenaille Kartoffeln | Kräuterquark | Leinöl | Wildkräutersalat",
      "GastDesc_en": "Baby Potatoes I Herb curd I Linseed Oil I Wild herb salad",
      "MenuName": "DINNER Fish_17:00-19:00",
      "allergene": {
        "milch": "Milch und Milcherzeugnisse"
      },
      "merkmale": {
        "vegetarisch": "Vegetarisch"
      },
      "naehrstoffe": "",
      "zusatzstoffe": null,
      "PrintOrder": "11",
      "CO2Value": "1162.00",
      "CO2Rating": "B",
      "CO2Perc": "100.00",
      "ClimateFriendly": null,
      "GastDesc": "Grenaille Kartoffeln | Kräuterquark | Leinöl | Wildkräutersalat",
      "date_de": "30.12.2025"
    },
    {
      "id": "5040016",
      "outlet": "canteen",
      "date": "2026-01-01",
      "CalendarWeek": "1",
      "day": "Donnerstag",
      "mealtime": "Abendessen",
      "IdentNr": "12026010198018",
      "itemId": "17864",
      "RecipeID": "9000",
      "ProductPrice": "12.00",
      "ProductPrice_2": null,
      "GastDesc_de": "Currywurst | Fritten | Salat",
      "GastDesc_en": "Curry Sausage | Steakhouse Chips | Salad",
      "MenuName": "DINNER Meat _|",
      "allergene": {
        "huhnerei": "Hühnerei und Hühnereierzeugnisse",
        "sellerie": "Sellerie und Sellerieerzeugnisse",
        "senf": "Senf und Senferzeugnisse",
        "schwefel": "Schwefeldioxid und Sulfide"
      },
      "merkmale": "",
      "naehrstoffe": "",
      "zusatzstoffe": [
        {
          "de": "Süßungsmittel",
          "en": "Sweetener"
        },
        {
          "de": "Phosphat",
          "en": "Phosphate"
        },
        {
          "de": "Farbstoff",
          "en": "Colouring Agent"
        },
        {
          "de": "Antioxidationsmittel",
          "en": "Antioxidation"
        },
        {
          "de": "Konservierungsstoff",
          "en": "Preservatives"
        }
      ],
      "PrintOrder": "18",
      "CO2Value": "1038.00",
      "CO2Rating": "B",
      "CO2Perc": "100.00",
      "ClimateFriendly": null,
      "GastDesc": "Currywurst | Fritten | Salat",
      "date_de": "01.01.2026"
    },
    {
      "id": "5040018",
      "outlet": "canteen",
      "date": "2026-01-01",
      "CalendarWeek": "1",
      "day": "Donnerstag",
      "mealtime": "Abendessen",
      "IdentNr": "12026010198019",
      "itemId": "17865",
      "RecipeID": "8795",
      "ProductPrice": "12.00",
      "ProductPrice_2": null,
      "GastDesc_de": "Seelachs | Apfel | Gurke | Rahm",
      "GastDesc_en": "Coalfish | Apple | Cucumber | Cream",
      "MenuName": "DINNER Fish _|",
      "allergene": {
        "huhnerei": "Hühnerei und Hühnereierzeugnisse",
        "fisch": "Fisch und Fischerzeugnisse",
        "milch": "Milch und Milcherzeugnisse",
        "senf": "Senf und Senferzeugnisse",
        "schwefel": "Schwefeldioxid und Sulfide"
      },
      "merkmale": "",
      "naehrstoffe": "",
      "zusatzstoffe": [
        {
          "de": "Süßungsmittel",
          "en": "Sweetener"
        },
        {
          "de": "Farbstoff",
          "en": "Colouring Agent"
        },
        {
          "de": "Antioxidationsmittel",
          "en": "Antioxidation"
        },
        {
          "de": "Alkohol",
          "en": "Alcohol"
        }
      ],
      "PrintOrder": "19",
      "CO2Value": "1564.00",
      "CO2Rating": "C",
      "CO2Perc": "100.00",
      "ClimateFriendly": null,
      "GastDesc": "Seelachs | Apfel | Gurke | Rahm",
      "date_de": "01.01.2026"
    },
    {
      "id": "5040020",
      "outlet": "canteen",
      "date": "2026-01-01",
      "CalendarWeek": "1",
      "day": "Donnerstag",
      "mealtime": "Abendessen",
      "IdentNr": "12026010198020",
      "itemId": "17866",
      "RecipeID": "6410",
      "ProductPrice": "9.50",
      "ProductPrice_2": null,
      "GastDesc_de": "Linguine | Kürbis | Zuckerschote",
      "GastDesc_en": "Linguine | Pumpkin | Sweet Peas",
      "MenuName": "DINNER Vegi / Vegan_|",
      "allergene": {
        "gluten": "Glutenhaltiges Getreide"
      },
      "merkmale": {
        "vegan": "Vegan",
        "vegetarisch": "Vegetarisch"
      },
      "naehrstoffe": "",
      "zusatzstoffe": null,
      "PrintOrder": "20",
      "CO2Value": "303.00",
      "CO2Rating": "A",
      "CO2Perc": "100.00",
      "ClimateFriendly": "1",
      "GastDesc": "Linguine | Kürbis | Zuckerschote",
      "date_de": "01.01.2026"
    },
    {
      "id": "5057214",
      "outlet": "canteen",
      "date": "2026-01-02",
      "CalendarWeek": "1",
      "day": "Freitag",
      "mealtime": "Mittagessen",
      "IdentNr": "12026010298000",
      "itemId": "17549",
      "RecipeID": "5060",
      "ProductPrice": "11.00",
      "ProductPrice_2": null,
      "GastDesc_de": "Couscous | Ofen-Paprika | Kräuterfeta",
      "GastDesc_en": "Couscous | Oven peppers | Herb feta",
      "MenuName": "COUNTER 1.1 Bowls_",
      "allergene": {
        "gluten": "Glutenhaltiges Getreide",
        "schalenfruchte": "Schalenfrüchte und Schalenfruchterzeugnisse",
        "milch": "Milch und Milcherzeugnisse"
      },
      "merkmale": {
        "vegetarisch": "Vegetarisch"
      },
      "naehrstoffe": "",
      "zusatzstoffe": [
        {
          "de": "geschwärzt",
          "en": "Blacked Out"
        }
      ],
      "PrintOrder": "0",
      "CO2Value": "1638.00",
      "CO2Rating": "C",
      "CO2Perc": "100.00",
      "ClimateFriendly": null,
      "GastDesc": "Couscous | Ofen-Paprika | Kräuterfeta",
      "date_de": "02.01.2026"
    },
    {
      "id": "5057215",
      "outlet": "canteen",
      "date": "2026-01-02",
      "CalendarWeek": "1",
      "day": "Freitag",
      "mealtime": "Mittagessen",
      "IdentNr": "12026010298001",
      "itemId": "17550",
      "RecipeID": "5118",
      "ProductPrice": "12.00",
      "ProductPrice_2": null,
      "GastDesc_de": "Maishähnchen | Ebli | Strauchtomaten | Minzayran",
      "GastDesc_en": "Corn fed Chicken | Ebli | Tomato | Mint Ayran",
      "MenuName": "COUNTER 2.1 Meat",
      "allergene": {
        "gluten": "Glutenhaltiges Getreide",
        "milch": "Milch und Milcherzeugnisse",
        "sellerie": "Sellerie und Sellerieerzeugnisse"
      },
      "merkmale": "",
      "naehrstoffe": "",
      "zusatzstoffe": null,
      "PrintOrder": "1",
      "CO2Value": "1387.00",
      "CO2Rating": "C",
      "CO2Perc": "100.00",
      "ClimateFriendly": null,
      "GastDesc": "Maishähnchen | Ebli | Strauchtomaten | Minzayran",
      "date_de": "02.01.2026"
    },
    {
      "id": "5057216",
      "outlet": "canteen",
      "date": "2026-01-02",
      "CalendarWeek": "1",
      "day": "Freitag",
      "mealtime": "Mittagessen",
      "IdentNr": "12026010298003",
      "itemId": "17552",
      "RecipeID": "2931",
      "ProductPrice": "12.00",
      "ProductPrice_2": null,
      "GastDesc_de": "Zander | Kohlrabi-Gemüse | Kapernsauce",
      "GastDesc_en": "Pike perch | Kohlrabi | Capers",
      "MenuName": "COUNTER 3.1 Fish",
      "allergene": {
        "gluten": "Glutenhaltiges Getreide",
        "fisch": "Fisch und Fischerzeugnisse",
        "milch": "Milch und Milcherzeugnisse",
        "sellerie": "Sellerie und Sellerieerzeugnisse"
      },
      "merkmale": "",
      "naehrstoffe": "",
      "zusatzstoffe": null,
      "PrintOrder": "3",
      "CO2Value": "646.00",
      "CO2Rating": "B",
      "CO2Perc": "100.00",
      "ClimateFriendly": null,
      "GastDesc": "Zander | Kohlrabi-Gemüse | Kapernsauce",
      "date_de": "02.01.2026"
    },
    {
      "id": "5057217",
      "outlet": "canteen",
      "date": "2026-01-02",
      "CalendarWeek": "1",
      "day": "Freitag",
      "mealtime": "Mittagessen",
      "IdentNr": "12026010298005",
      "itemId": "17554",
      "RecipeID": "5077",
      "ProductPrice": "9.50",
      "ProductPrice_2": null,
      "GastDesc_de": "Soja-Frikasee | Reis | Wildkräuter",
      "GastDesc_en": "Soya Frikasee | Rice | Wild Herbs",
      "MenuName": "COUNTER 4.1 Vegi",
      "allergene": {
        "soja": "Soja und Sojaerzeugnisse",
        "sellerie": "Sellerie und Sellerieerzeugnisse",
        "schwefel": "Schwefeldioxid und Sulfide"
      },
      "merkmale": {
        "vegan": "Vegan",
        "vegetarisch": "Vegetarisch"
      },
      "naehrstoffe": "",
      "zusatzstoffe": [
        {
          "de": "Antioxidationsmittel",
          "en": "Antioxidation"
        },
        {
          "de": "Alkohol",
          "en": "Alcohol"
        }
      ],
      "PrintOrder": "5",
      "CO2Value": "528.00",
      "CO2Rating": "A",
      "CO2Perc": "100.00",
      "ClimateFriendly": "1",
      "GastDesc": "Soja-Frikasee | Reis | Wildkräuter",
      "date_de": "02.01.2026"
    },
    {
      "id": "5057218",
      "outlet": "canteen",
      "date": "2026-01-02",
      "CalendarWeek": "1",
      "day": "Freitag",
      "mealtime": "Abendessen",
      "IdentNr": "12026010298009",
      "itemId": "17558",
      "RecipeID": "5060",
      "ProductPrice": "11.00",
      "ProductPrice_2": null,
      "GastDesc_de": "Couscous | Ofen-Paprika | Kräuterfeta",
      "GastDesc_en": "Couscous | Oven peppers | Herb feta",
      "MenuName": "DINNER BOWL_",
      "allergene": {
        "gluten": "Glutenhaltiges Getreide",
        "schalenfruchte": "Schalenfrüchte und Schalenfruchterzeugnisse",
        "milch": "Milch und Milcherzeugnisse"
      },
      "merkmale": {
        "vegetarisch": "Vegetarisch"
      },
      "naehrstoffe": "",
      "zusatzstoffe": [
        {
          "de": "geschwärzt",
          "en": "Blacked Out"
        }
      ],
      "PrintOrder": "9",
      "CO2Value": "1638.00",
      "CO2Rating": "C",
      "CO2Perc": "100.00",
      "ClimateFriendly": null,
      "GastDesc": "Couscous | Ofen-Paprika | Kräuterfeta",
      "date_de": "02.01.2026"
    },
    {
      "id": "5057220",
      "outlet": "canteen",
      "date": "2026-01-02",
      "CalendarWeek": "1",
      "day": "Freitag",
      "mealtime": "Abendessen",
      "IdentNr": "12026010298011",
      "itemId": "17560",
      "RecipeID": "5077",
      "ProductPrice": "9.50",
      "ProductPrice_2": null,
      "GastDesc_de": "Soja-Frikasee | Reis | Wildkräuter",
      "GastDesc_en": "Soya Frikasee | Rice | Wild Herbs",
      "MenuName": "DINNER Fish_17:00-19:00",
      "allergene": {
        "soja": "Soja und Sojaerzeugnisse",
        "sellerie": "Sellerie und Sellerieerzeugnisse",
        "schwefel": "Schwefeldioxid und Sulfide"
      },
      "merkmale": {
        "vegan": "Vegan",
        "vegetarisch": "Vegetarisch"
      },
      "naehrstoffe": "",
      "zusatzstoffe": [
        {
          "de": "Antioxidationsmittel",
          "en": "Antioxidation"
        },
        {
          "de": "Alkohol",
          "en": "Alcohol"
        }
      ],
      "PrintOrder": "11",
      "CO2Value": "528.00",
      "CO2Rating": "A",
      "CO2Perc": "100.00",
      "ClimateFriendly": "1",
      "GastDesc": "Soja-Frikasee | Reis | Wildkräuter",
      "date_de": "02.01.2026"
    },
    {
      "id": "5057222",
      "outlet": "canteen",
      "date": "2026-01-03",
      "CalendarWeek": "1",
      "day": "Samstag",
      "mealtime": "Abendessen",
      "IdentNr": "12026010398014",
      "itemId": "17563",
      "RecipeID": "7944",
      "ProductPrice": "12.00",
      "ProductPrice_2": null,
      "GastDesc_de": "Leberkäse | Kartoffelsalat | Blattsalat | Spiegelei",
      "GastDesc_en": "Traditional Leberkäse | Vinegar Potato Salad | Leafy Salad | Fried Egg",
      "MenuName": "LUNCH Meat_",
      "allergene": {
        "huhnerei": "Hühnerei und Hühnereierzeugnisse",
        "milch": "Milch und Milcherzeugnisse",
        "sellerie": "Sellerie und Sellerieerzeugnisse",
        "senf": "Senf und Senferzeugnisse",
        "schwefel": "Schwefeldioxid und Sulfide"
      },
      "merkmale": {
        "schwein": "Schwein"
      },
      "naehrstoffe": "",
      "zusatzstoffe": [
        {
          "de": "Phosphat",
          "en": "Phosphate"
        },
        {
          "de": "Antioxidationsmittel",
          "en": "Antioxidation"
        },
        {
          "de": "Konservierungsstoff",
          "en": "Preservatives"
        },
        {
          "de": "Alkohol",
          "en": "Alcohol"
        }
      ],
      "PrintOrder": "14",
      "CO2Value": "1083.00",
      "CO2Rating": "B",
      "CO2Perc": "100.00",
      "ClimateFriendly": null,
      "GastDesc": "Leberkäse | Kartoffelsalat | Blattsalat | Spiegelei",
      "date_de": "03.01.2026"
    },
    {
      "id": "5057224",
      "outlet": "canteen",
      "date": "2026-01-03",
      "CalendarWeek": "1",
      "day": "Samstag",
      "mealtime": "Abendessen",
      "IdentNr": "12026010398015",
      "itemId": "17564",
      "RecipeID": "2904",
      "ProductPrice": "12.00",
      "ProductPrice_2": null,
      "GastDesc_de": "Schellfisch | Kartoffel-Endivienstampf | Dijon-Senf",
      "GastDesc_en": "Haddock | Potato Endive Mash | Dijon Mustard",
      "MenuName": "LUNCH Fish_",
      "allergene": {
        "fisch": "Fisch und Fischerzeugnisse",
        "milch": "Milch und Milcherzeugnisse",
        "sellerie": "Sellerie und Sellerieerzeugnisse",
        "senf": "Senf und Senferzeugnisse",
        "schwefel": "Schwefeldioxid und Sulfide"
      },
      "merkmale": "",
      "naehrstoffe": "",
      "zusatzstoffe": null,
      "PrintOrder": "15",
      "CO2Value": "1129.00",
      "CO2Rating": "C",
      "CO2Perc": "100.00",
      "ClimateFriendly": null,
      "GastDesc": "Schellfisch | Kartoffel-Endivienstampf | Dijon-Senf",
      "date_de": "03.01.2026"
    },
    {
      "id": "5057226",
      "outlet": "canteen",
      "date": "2026-01-03",
      "CalendarWeek": "1",
      "day": "Samstag",
      "mealtime": "Abendessen",
      "IdentNr": "12026010398016",
      "itemId": "17565",
      "RecipeID": "6418",
      "ProductPrice": "9.50",
      "ProductPrice_2": null,
      "GastDesc_de": "Muschelnudeln | Gemüseragout | Basilikumöl",
      "GastDesc_en": "Castellane | Vegetableragout | Basil oil",
      "MenuName": "LUNCH Vegi/Vegan_",
      "allergene": {
        "gluten": "Glutenhaltiges Getreide"
      },
      "merkmale": {
        "vegan": "Vegan",
        "vegetarisch": "Vegetarisch"
      },
      "naehrstoffe": "",
      "zusatzstoffe": null,
      "PrintOrder": "16",
      "CO2Value": "546.00",
      "CO2Rating": "B",
      "CO2Perc": "100.00",
      "ClimateFriendly": null,
      "GastDesc": "Muschelnudeln | Gemüseragout | Basilikumöl",
      "date_de": "03.01.2026"
    },
    {
      "id": "5057228",
      "outlet": "canteen",
      "date": "2026-01-04",
      "CalendarWeek": "1",
      "day": "Sonntag",
      "mealtime": "Abendessen",
      "IdentNr": "12026010498018",
      "itemId": "17864",
      "RecipeID": "8851",
      "ProductPrice": "12.00",
      "ProductPrice_2": null,
      "GastDesc_de": "Enten-Chop-Suey | Ingwer-Reis | Kroepoek",
      "GastDesc_en": "Duck Chop Suey | Ginger Rice | Prawn Crackers",
      "MenuName": "DINNER Meat _|",
      "allergene": {
        "gluten": "Glutenhaltiges Getreide",
        "soja": "Soja und Sojaerzeugnisse",
        "krebstier": "Krebstiere und Krebstiererzeugnisse",
        "sellerie": "Sellerie und Sellerieerzeugnisse",
        "sesam": "Sesamsamen und Sesamsamenerzeugnisse",
        "weichtier": "Weichtier und Weichtiererzeugnisse"
      },
      "merkmale": "",
      "naehrstoffe": "",
      "zusatzstoffe": [
        {
          "de": "Farbstoff",
          "en": "Colouring Agent"
        },
        {
          "de": "Geschmacksverstärker",
          "en": "Flavor Enhancer"
        }
      ],
      "PrintOrder": "18",
      "CO2Value": "1446.00",
      "CO2Rating": "B",
      "CO2Perc": "100.00",
      "ClimateFriendly": null,
      "GastDesc": "Enten-Chop-Suey | Ingwer-Reis | Kroepoek",
      "date_de": "04.01.2026"
    },
    {
      "id": "5057229",
      "outlet": "canteen",
      "date": "2026-01-04",
      "CalendarWeek": "1",
      "day": "Sonntag",
      "mealtime": "Mittagessen",
      "IdentNr": "12026010498018",
      "itemId": "17864",
      "RecipeID": "8851",
      "ProductPrice": "12.00",
      "ProductPrice_2": null,
      "GastDesc_de": "Enten-Chop-Suey | Ingwer-Reis | Kroepoek",
      "GastDesc_en": "Duck Chop Suey | Ginger Rice | Prawn Crackers",
      "MenuName": "DINNER Meat _|",
      "allergene": {
        "gluten": "Glutenhaltiges Getreide",
        "soja": "Soja und Sojaerzeugnisse",
        "krebstier": "Krebstiere und Krebstiererzeugnisse",
        "sellerie": "Sellerie und Sellerieerzeugnisse",
        "sesam": "Sesamsamen und Sesamsamenerzeugnisse",
        "weichtier": "Weichtier und Weichtiererzeugnisse"
      },
      "merkmale": "",
      "naehrstoffe": "",
      "zusatzstoffe": [
        {
          "de": "Farbstoff",
          "en": "Colouring Agent"
        },
        {
          "de": "Geschmacksverstärker",
          "en": "Flavor Enhancer"
        }
      ],
      "PrintOrder": "18",
      "CO2Value": "1446.00",
      "CO2Rating": "B",
      "CO2Perc": "100.00",
      "ClimateFriendly": null,
      "GastDesc": "Enten-Chop-Suey | Ingwer-Reis | Kroepoek",
      "date_de": "04.01.2026"
    },
    {
      "id": "5057231",
      "outlet": "canteen",
      "date": "2026-01-04",
      "CalendarWeek": "1",
      "day": "Sonntag",
      "mealtime": "Abendessen",
      "IdentNr": "12026010498019",
      "itemId": "17865",
      "RecipeID": "7315",
      "ProductPrice": "12.00",
      "ProductPrice_2": null,
      "GastDesc_de": "Forellenfilet | Erbsen | Kartoffel-Frikassee",
      "GastDesc_en": "Trout fillet | peas | potato fricassee",
      "MenuName": "DINNER Fish _|",
      "allergene": {
        "fisch": "Fisch und Fischerzeugnisse",
        "soja": "Soja und Sojaerzeugnisse",
        "milch": "Milch und Milcherzeugnisse",
        "sellerie": "Sellerie und Sellerieerzeugnisse",
        "schwefel": "Schwefeldioxid und Sulfide"
      },
      "merkmale": {
        "schwein": "Schwein"
      },
      "naehrstoffe": "",
      "zusatzstoffe": [
        {
          "de": "Phosphat",
          "en": "Phosphate"
        },
        {
          "de": "Antioxidationsmittel",
          "en": "Antioxidation"
        },
        {
          "de": "Konservierungsstoff",
          "en": "Preservatives"
        },
        {
          "de": "Alkohol",
          "en": "Alcohol"
        }
      ],
      "PrintOrder": "19",
      "CO2Value": "1071.00",
      "CO2Rating": "B",
      "CO2Perc": "100.00",
      "ClimateFriendly": null,
      "GastDesc": "Forellenfilet | Erbsen | Kartoffel-Frikassee",
      "date_de": "04.01.2026"
    },
    {
      "id": "5057232",
      "outlet": "canteen",
      "date": "2026-01-04",
      "CalendarWeek": "1",
      "day": "Sonntag",
      "mealtime": "Mittagessen",
      "IdentNr": "12026010498019",
      "itemId": "17865",
      "RecipeID": "7315",
      "ProductPrice": "12.00",
      "ProductPrice_2": null,
      "GastDesc_de": "Forellenfilet | Erbsen | Kartoffel-Frikassee",
      "GastDesc_en": "Trout fillet | peas | potato fricassee",
      "MenuName": "DINNER Fish _|",
      "allergene": {
        "fisch": "Fisch und Fischerzeugnisse",
        "soja": "Soja und Sojaerzeugnisse",
        "milch": "Milch und Milcherzeugnisse",
        "sellerie": "Sellerie und Sellerieerzeugnisse",
        "schwefel": "Schwefeldioxid und Sulfide"
      },
      "merkmale": {
        "schwein": "Schwein"
      },
      "naehrstoffe": "",
      "zusatzstoffe": [
        {
          "de": "Phosphat",
          "en": "Phosphate"
        },
        {
          "de": "Antioxidationsmittel",
          "en": "Antioxidation"
        },
        {
          "de": "Konservierungsstoff",
          "en": "Preservatives"
        },
        {
          "de": "Alkohol",
          "en": "Alcohol"
        }
      ],
      "PrintOrder": "19",
      "CO2Value": "1071.00",
      "CO2Rating": "B",
      "CO2Perc": "100.00",
      "ClimateFriendly": null,
      "GastDesc": "Forellenfilet | Erbsen | Kartoffel-Frikassee",
      "date_de": "04.01.2026"
    },
    {
      "id": "5057234",
      "outlet": "canteen",
      "date": "2026-01-04",
      "CalendarWeek": "1",
      "day": "Sonntag",
      "mealtime": "Abendessen",
      "IdentNr": "12026010498020",
      "itemId": "17866",
      "RecipeID": "4327",
      "ProductPrice": "9.50",
      "ProductPrice_2": null,
      "GastDesc_de": "Curry von roten Linsen | Kürbis | Limettenjoghurt",
      "GastDesc_en": "Red Lentil Curry | Pumpkin | Lime Yoghurt",
      "MenuName": "DINNER Vegi / Vegan_|",
      "allergene": {
        "gluten": "Glutenhaltiges Getreide",
        "milch": "Milch und Milcherzeugnisse",
        "erdnuss": "Erdnüsse und Erdnusserzeugnisse",
        "sellerie": "Sellerie und Sellerieerzeugnisse"
      },
      "merkmale": {
        "vegan": "Vegan",
        "vegetarisch": "Vegetarisch"
      },
      "naehrstoffe": "",
      "zusatzstoffe": null,
      "PrintOrder": "20",
      "CO2Value": "580.00",
      "CO2Rating": "B",
      "CO2Perc": "100.00",
      "ClimateFriendly": null,
      "GastDesc": "Curry von roten Linsen | Kürbis | Limettenjoghurt",
      "date_de": "04.01.2026"
    },
    {
      "id": "5057235",
      "outlet": "canteen",
      "date": "2026-01-04",
      "CalendarWeek": "1",
      "day": "Sonntag",
      "mealtime": "Mittagessen",
      "IdentNr": "12026010498020",
      "itemId": "17866",
      "RecipeID": "4327",
      "ProductPrice": "9.50",
      "ProductPrice_2": null,
      "GastDesc_de": "Curry von roten Linsen | Kürbis | Limettenjoghurt",
      "GastDesc_en": "Red Lentil Curry | Pumpkin | Lime Yoghurt",
      "MenuName": "DINNER Vegi / Vegan_|",
      "allergene": {
        "gluten": "Glutenhaltiges Getreide",
        "milch": "Milch und Milcherzeugnisse",
        "erdnuss": "Erdnüsse und Erdnusserzeugnisse",
        "sellerie": "Sellerie und Sellerieerzeugnisse"
      },
      "merkmale": {
        "vegan": "Vegan",
        "vegetarisch": "Vegetarisch"
      },
      "naehrstoffe": "",
      "zusatzstoffe": null,
      "PrintOrder": "20",
      "CO2Value": "580.00",
      "CO2Rating": "B",
      "CO2Perc": "100.00",
      "ClimateFriendly": null,
      "GastDesc": "Curry von roten Linsen | Kürbis | Limettenjoghurt",
      "date_de": "04.01.2026"
    },
    {
      "id": "5057237",
      "outlet": "canteen",
      "date": "2026-01-05",
      "CalendarWeek": "1",
      "day": "Montag",
      "mealtime": "Mittagessen",
      "IdentNr": "12026010598000",
      "itemId": "17549",
      "RecipeID": "4412",
      "ProductPrice": "10.00",
      "ProductPrice_2": null,
      "GastDesc_de": "Couscous | Brokkoli | Spinat-Hummus",
      "GastDesc_en": "Couscous | Broccoli | Spinach Hummus",
      "MenuName": "COUNTER 1.1 Bowls_",
      "allergene": {
        "gluten": "Glutenhaltiges Getreide",
        "sellerie": "Sellerie und Sellerieerzeugnisse",
        "sesam": "Sesamsamen und Sesamsamenerzeugnisse",
        "schwefel": "Schwefeldioxid und Sulfide"
      },
      "merkmale": {
        "veganuary": "Veganuary"
      },
      "naehrstoffe": "",
      "zusatzstoffe": [
        {
          "de": "Süßungsmittel",
          "en": "Sweetener"
        },
        {
          "de": "Phenylalaninquelle",
          "en": "Phenylalanine"
        },
        {
          "de": "Konservierungsstoff",
          "en": "Preservatives"
        }
      ],
      "PrintOrder": "0",
      "CO2Value": "562.00",
      "CO2Rating": "A",
      "CO2Perc": "100.00",
      "ClimateFriendly": "1",
      "GastDesc": "Couscous | Brokkoli | Spinat-Hummus",
      "date_de": "05.01.2026"
    },
    {
      "id": "5057238",
      "outlet": "canteen",
      "date": "2026-01-05",
      "CalendarWeek": "1",
      "day": "Montag",
      "mealtime": "Mittagessen",
      "IdentNr": "12026010598001",
      "itemId": "17550",
      "RecipeID": "4865",
      "ProductPrice": "12.00",
      "ProductPrice_2": null,
      "GastDesc_de": "Rinderschmorbraten | Blaukraut | Spätzle",
      "GastDesc_en": "Braised Beef | Red cabbage | Spätzle",
      "MenuName": "COUNTER 2.1 Meat",
      "allergene": {
        "gluten": "Glutenhaltiges Getreide",
        "huhnerei": "Hühnerei und Hühnereierzeugnisse",
        "milch": "Milch und Milcherzeugnisse",
        "sellerie": "Sellerie und Sellerieerzeugnisse",
        "schwefel": "Schwefeldioxid und Sulfide"
      },
      "merkmale": "",
      "naehrstoffe": "",
      "zusatzstoffe": [
        {
          "de": "Alkohol",
          "en": "Alcohol"
        }
      ],
      "PrintOrder": "1",
      "CO2Value": "7035.00",
      "CO2Rating": "E",
      "CO2Perc": "100.00",
      "ClimateFriendly": null,
      "GastDesc": "Rinderschmorbraten | Blaukraut | Spätzle",
      "date_de": "05.01.2026"
    },
    {
      "id": "5057239",
      "outlet": "canteen",
      "date": "2026-01-05",
      "CalendarWeek": "1",
      "day": "Montag",
      "mealtime": "Mittagessen",
      "IdentNr": "12026010598003",
      "itemId": "17552",
      "RecipeID": "8972",
      "ProductPrice": "12.00",
      "ProductPrice_2": null,
      "GastDesc_de": "Rotbarschfilet | Kartoffel-Blumenkohlpüree | Safranschaum",
      "GastDesc_en": "Redfish | Potato and Cauliflower Purée | Saffron Foam",
      "MenuName": "COUNTER 3.1 Fish",
      "allergene": {
        "fisch": "Fisch und Fischerzeugnisse",
        "milch": "Milch und Milcherzeugnisse",
        "sellerie": "Sellerie und Sellerieerzeugnisse",
        "schwefel": "Schwefeldioxid und Sulfide"
      },
      "merkmale": "",
      "naehrstoffe": "",
      "zusatzstoffe": null,
      "PrintOrder": "3",
      "CO2Value": "1162.00",
      "CO2Rating": "C",
      "CO2Perc": "100.00",
      "ClimateFriendly": null,
      "GastDesc": "Rotbarschfilet | Kartoffel-Blumenkohlpüree | Safranschaum",
      "date_de": "05.01.2026"
    },
    {
      "id": "5057240",
      "outlet": "canteen",
      "date": "2026-01-05",
      "CalendarWeek": "1",
      "day": "Montag",
      "mealtime": "Mittagessen",
      "IdentNr": "12026010598005",
      "itemId": "17554",
      "RecipeID": "2987",
      "ProductPrice": "9.50",
      "ProductPrice_2": null,
      "GastDesc_de": "Gemüsecurry | Kohlrabi | Romanesco*",
      "GastDesc_en": "Vegetable Curry | Cabbage | Romanesco *",
      "MenuName": "COUNTER 4.1 Vegi",
      "allergene": {
        "sellerie": "Sellerie und Sellerieerzeugnisse"
      },
      "merkmale": {
        "veganuary": "Veganuary"
      },
      "naehrstoffe": "",
      "zusatzstoffe": [
        {
          "de": "Süßungsmittel",
          "en": "Sweetener"
        },
        {
          "de": "Phenylalaninquelle",
          "en": "Phenylalanine"
        },
        {
          "de": "Konservierungsstoff",
          "en": "Preservatives"
        }
      ],
      "PrintOrder": "5",
      "CO2Value": "672.00",
      "CO2Rating": "C",
      "CO2Perc": "100.00",
      "ClimateFriendly": null,
      "GastDesc": "Gemüsecurry | Kohlrabi | Romanesco*",
      "date_de": "05.01.2026"
    },
    {
      "id": "5057241",
      "outlet": "canteen",
      "date": "2026-01-05",
      "CalendarWeek": "1",
      "day": "Montag",
      "mealtime": "Abendessen",
      "IdentNr": "12026010598009",
      "itemId": "17558",
      "RecipeID": "4412",
      "ProductPrice": "10.00",
      "ProductPrice_2": null,
      "GastDesc_de": "Couscous | Brokkoli | Spinat-Hummus",
      "GastDesc_en": "Couscous | Broccoli | Spinach Hummus",
      "MenuName": "DINNER BOWL_",
      "allergene": {
        "gluten": "Glutenhaltiges Getreide",
        "sellerie": "Sellerie und Sellerieerzeugnisse",
        "sesam": "Sesamsamen und Sesamsamenerzeugnisse",
        "schwefel": "Schwefeldioxid und Sulfide"
      },
      "merkmale": {
        "veganuary": "Veganuary"
      },
      "naehrstoffe": "",
      "zusatzstoffe": [
        {
          "de": "Süßungsmittel",
          "en": "Sweetener"
        },
        {
          "de": "Phenylalaninquelle",
          "en": "Phenylalanine"
        },
        {
          "de": "Konservierungsstoff",
          "en": "Preservatives"
        }
      ],
      "PrintOrder": "9",
      "CO2Value": "562.00",
      "CO2Rating": "A",
      "CO2Perc": "100.00",
      "ClimateFriendly": "1",
      "GastDesc": "Couscous | Brokkoli | Spinat-Hummus",
      "date_de": "05.01.2026"
    },
    {
      "id": "5057243",
      "outlet": "canteen",
      "date": "2026-01-05",
      "CalendarWeek": "1",
      "day": "Montag",
      "mealtime": "Abendessen",
      "IdentNr": "12026010598010",
      "itemId": "17559",
      "RecipeID": "4865",
      "ProductPrice": "12.00",
      "ProductPrice_2": null,
      "GastDesc_de": "Rinderschmorbraten | Blaukraut | Spätzle",
      "GastDesc_en": "Braised Beef | Red cabbage | Spätzle",
      "MenuName": "DINNER Meat_17:00-19:00",
      "allergene": {
        "gluten": "Glutenhaltiges Getreide",
        "huhnerei": "Hühnerei und Hühnereierzeugnisse",
        "milch": "Milch und Milcherzeugnisse",
        "sellerie": "Sellerie und Sellerieerzeugnisse",
        "schwefel": "Schwefeldioxid und Sulfide"
      },
      "merkmale": "",
      "naehrstoffe": "",
      "zusatzstoffe": [
        {
          "de": "Alkohol",
          "en": "Alcohol"
        }
      ],
      "PrintOrder": "10",
      "CO2Value": "7035.00",
      "CO2Rating": "E",
      "CO2Perc": "100.00",
      "ClimateFriendly": null,
      "GastDesc": "Rinderschmorbraten | Blaukraut | Spätzle",
      "date_de": "05.01.2026"
    },
    {
      "id": "5057245",
      "outlet": "canteen",
      "date": "2026-01-05",
      "CalendarWeek": "1",
      "day": "Montag",
      "mealtime": "Abendessen",
      "IdentNr": "12026010598012",
      "itemId": "17561",
      "RecipeID": "2987",
      "ProductPrice": "9.50",
      "ProductPrice_2": null,
      "GastDesc_de": "Gemüsecurry | Kohlrabi | Romanesco*",
      "GastDesc_en": "Vegetable Curry | Cabbage | Romanesco *",
      "MenuName": "DINNER Vegi/Vegan_17:00-19:00",
      "allergene": {
        "sellerie": "Sellerie und Sellerieerzeugnisse"
      },
      "merkmale": {
        "veganuary": "Veganuary"
      },
      "naehrstoffe": "",
      "zusatzstoffe": [
        {
          "de": "Süßungsmittel",
          "en": "Sweetener"
        },
        {
          "de": "Phenylalaninquelle",
          "en": "Phenylalanine"
        },
        {
          "de": "Konservierungsstoff",
          "en": "Preservatives"
        }
      ],
      "PrintOrder": "12",
      "CO2Value": "672.00",
      "CO2Rating": "C",
      "CO2Perc": "100.00",
      "ClimateFriendly": null,
      "GastDesc": "Gemüsecurry | Kohlrabi | Romanesco*",
      "date_de": "05.01.2026"
    },
    {
      "id": "5057247",
      "outlet": "canteen",
      "date": "2026-01-06",
      "CalendarWeek": "1",
      "day": "Dienstag",
      "mealtime": "Mittagessen",
      "IdentNr": "12026010698000",
      "itemId": "17549",
      "RecipeID": "7575",
      "ProductPrice": "10.00",
      "ProductPrice_2": null,
      "GastDesc_de": "Chili-Pilze | Sesamgurken | Miso-Dressing",
      "GastDesc_en": "Chili mushrooms | Sesame cucumbers | Miso dressing",
      "MenuName": "COUNTER 1.1 Bowls_",
      "allergene": {
        "gluten": "Glutenhaltiges Getreide",
        "soja": "Soja und Sojaerzeugnisse",
        "senf": "Senf und Senferzeugnisse",
        "sesam": "Sesamsamen und Sesamsamenerzeugnisse"
      },
      "merkmale": {
        "veganuary": "Veganuary"
      },
      "naehrstoffe": "",
      "zusatzstoffe": [
        {
          "de": "Geschmacksverstärker",
          "en": "Flavor Enhancer"
        },
        {
          "de": "Konservierungsstoff",
          "en": "Preservatives"
        }
      ],
      "PrintOrder": "0",
      "CO2Value": "784.00",
      "CO2Rating": "C",
      "CO2Perc": "100.00",
      "ClimateFriendly": null,
      "GastDesc": "Chili-Pilze | Sesamgurken | Miso-Dressing",
      "date_de": "06.01.2026"
    },
    {
      "id": "5057248",
      "outlet": "canteen",
      "date": "2026-01-06",
      "CalendarWeek": "1",
      "day": "Dienstag",
      "mealtime": "Mittagessen",
      "IdentNr": "12026010698001",
      "itemId": "17550",
      "RecipeID": "4865",
      "ProductPrice": "12.00",
      "ProductPrice_2": null,
      "GastDesc_de": "Rinderschmorbraten | Blaukraut | Spätzle",
      "GastDesc_en": "Braised Beef | Red cabbage | Spätzle",
      "MenuName": "COUNTER 2.1 Meat",
      "allergene": {
        "gluten": "Glutenhaltiges Getreide",
        "huhnerei": "Hühnerei und Hühnereierzeugnisse",
        "milch": "Milch und Milcherzeugnisse",
        "sellerie": "Sellerie und Sellerieerzeugnisse",
        "schwefel": "Schwefeldioxid und Sulfide"
      },
      "merkmale": "",
      "naehrstoffe": "",
      "zusatzstoffe": [
        {
          "de": "Alkohol",
          "en": "Alcohol"
        }
      ],
      "PrintOrder": "1",
      "CO2Value": "7035.00",
      "CO2Rating": "E",
      "CO2Perc": "100.00",
      "ClimateFriendly": null,
      "GastDesc": "Rinderschmorbraten | Blaukraut | Spätzle",
      "date_de": "06.01.2026"
    },
    {
      "id": "5057249",
      "outlet": "canteen",
      "date": "2026-01-06",
      "CalendarWeek": "1",
      "day": "Dienstag",
      "mealtime": "Mittagessen",
      "IdentNr": "12026010698003",
      "itemId": "17552",
      "RecipeID": "8972",
      "ProductPrice": "12.00",
      "ProductPrice_2": null,
      "GastDesc_de": "Rotbarschfilet | Kartoffel-Blumenkohlpüree | Safranschaum",
      "GastDesc_en": "Redfish | Potato and Cauliflower Purée | Saffron Foam",
      "MenuName": "COUNTER 3.1 Fish",
      "allergene": {
        "fisch": "Fisch und Fischerzeugnisse",
        "milch": "Milch und Milcherzeugnisse",
        "sellerie": "Sellerie und Sellerieerzeugnisse",
        "schwefel": "Schwefeldioxid und Sulfide"
      },
      "merkmale": "",
      "naehrstoffe": "",
      "zusatzstoffe": null,
      "PrintOrder": "3",
      "CO2Value": "1162.00",
      "CO2Rating": "C",
      "CO2Perc": "100.00",
      "ClimateFriendly": null,
      "GastDesc": "Rotbarschfilet | Kartoffel-Blumenkohlpüree | Safranschaum",
      "date_de": "06.01.2026"
    },
    {
      "id": "5057250",
      "outlet": "canteen",
      "date": "2026-01-06",
      "CalendarWeek": "1",
      "day": "Dienstag",
      "mealtime": "Mittagessen",
      "IdentNr": "12026010698005",
      "itemId": "17554",
      "RecipeID": "9089",
      "ProductPrice": "9.50",
      "ProductPrice_2": null,
      "GastDesc_de": "Kyerras Süßkartoffelpüree mit Ahorn-Miso und Tofu mit Maismehlkruste",
      "GastDesc_en": "Kyerras Maple Miso Whipped Sweet Patatoes with Cornmeal Crusted Tofu",
      "MenuName": "COUNTER 4.1 Vegi",
      "allergene": {
        "soja": "Soja und Sojaerzeugnisse",
        "sellerie": "Sellerie und Sellerieerzeugnisse",
        "senf": "Senf und Senferzeugnisse",
        "schwefel": "Schwefeldioxid und Sulfide"
      },
      "merkmale": {
        "veganuary": "Veganuary"
      },
      "naehrstoffe": "",
      "zusatzstoffe": null,
      "PrintOrder": "5",
      "CO2Value": "354.00",
      "CO2Rating": "A",
      "CO2Perc": "100.00",
      "ClimateFriendly": "1",
      "GastDesc": "Kyerras Süßkartoffelpüree mit Ahorn-Miso und Tofu mit Maismehlkruste",
      "date_de": "06.01.2026"
    },
    {
      "id": "5057251",
      "outlet": "canteen",
      "date": "2026-01-06",
      "CalendarWeek": "1",
      "day": "Dienstag",
      "mealtime": "Abendessen",
      "IdentNr": "12026010698009",
      "itemId": "17558",
      "RecipeID": "7575",
      "ProductPrice": "10.00",
      "ProductPrice_2": null,
      "GastDesc_de": "Chili-Pilze | Sesamgurken | Miso-Dressing",
      "GastDesc_en": "Chili mushrooms | Sesame cucumbers | Miso dressing",
      "MenuName": "DINNER BOWL_",
      "allergene": {
        "gluten": "Glutenhaltiges Getreide",
        "soja": "Soja und Sojaerzeugnisse",
        "senf": "Senf und Senferzeugnisse",
        "sesam": "Sesamsamen und Sesamsamenerzeugnisse"
      },
      "merkmale": {
        "veganuary": "Veganuary"
      },
      "naehrstoffe": "",
      "zusatzstoffe": [
        {
          "de": "Geschmacksverstärker",
          "en": "Flavor Enhancer"
        },
        {
          "de": "Konservierungsstoff",
          "en": "Preservatives"
        }
      ],
      "PrintOrder": "9",
      "CO2Value": "784.00",
      "CO2Rating": "C",
      "CO2Perc": "100.00",
      "ClimateFriendly": null,
      "GastDesc": "Chili-Pilze | Sesamgurken | Miso-Dressing",
      "date_de": "06.01.2026"
    },
    {
      "id": "5057253",
      "outlet": "canteen",
      "date": "2026-01-06",
      "CalendarWeek": "1",
      "day": "Dienstag",
      "mealtime": "Abendessen",
      "IdentNr": "12026010698011",
      "itemId": "17560",
      "RecipeID": "8972",
      "ProductPrice": "12.00",
      "ProductPrice_2": null,
      "GastDesc_de": "Rotbarschfilet | Kartoffel-Blumenkohlpüree | Safranschaum",
      "GastDesc_en": "Redfish | Potato and Cauliflower Purée | Saffron Foam",
      "MenuName": "DINNER Fish_17:00-19:00",
      "allergene": {
        "fisch": "Fisch und Fischerzeugnisse",
        "milch": "Milch und Milcherzeugnisse",
        "sellerie": "Sellerie und Sellerieerzeugnisse",
        "schwefel": "Schwefeldioxid und Sulfide"
      },
      "merkmale": "",
      "naehrstoffe": "",
      "zusatzstoffe": null,
      "PrintOrder": "11",
      "CO2Value": "1162.00",
      "CO2Rating": "C",
      "CO2Perc": "100.00",
      "ClimateFriendly": null,
      "GastDesc": "Rotbarschfilet | Kartoffel-Blumenkohlpüree | Safranschaum",
      "date_de": "06.01.2026"
    },
    {
      "id": "5057255",
      "outlet": "canteen",
      "date": "2026-01-06",
      "CalendarWeek": "1",
      "day": "Dienstag",
      "mealtime": "Abendessen",
      "IdentNr": "12026010698012",
      "itemId": "17561",
      "RecipeID": "9089",
      "ProductPrice": "9.50",
      "ProductPrice_2": null,
      "GastDesc_de": "Maple Miso Süßkartoffel | Tofu | Grünkohl",
      "GastDesc_en": "Maple Miso Sweet Potatoes | Tofu | Kale",
      "MenuName": "DINNER Vegi/Vegan_17:00-19:00",
      "allergene": {
        "soja": "Soja und Sojaerzeugnisse",
        "sellerie": "Sellerie und Sellerieerzeugnisse",
        "senf": "Senf und Senferzeugnisse",
        "schwefel": "Schwefeldioxid und Sulfide"
      },
      "merkmale": {
        "veganuary": "Veganuary"
      },
      "naehrstoffe": "",
      "zusatzstoffe": null,
      "PrintOrder": "12",
      "CO2Value": "354.00",
      "CO2Rating": "A",
      "CO2Perc": "100.00",
      "ClimateFriendly": "1",
      "GastDesc": "Maple Miso Süßkartoffel | Tofu | Grünkohl",
      "date_de": "06.01.2026"
    },
    {
      "id": "5057257",
      "outlet": "canteen",
      "date": "2026-01-07",
      "CalendarWeek": "1",
      "day": "Mittwoch",
      "mealtime": "Mittagessen",
      "IdentNr": "12026010798000",
      "itemId": "17549",
      "RecipeID": "4250",
      "ProductPrice": "10.00",
      "ProductPrice_2": null,
      "GastDesc_de": "Falafel | Mandeln | Couscous",
      "GastDesc_en": "Falafel | Almonds | Couscous",
      "MenuName": "COUNTER 1.1 Bowls_",
      "allergene": {
        "gluten": "Glutenhaltiges Getreide",
        "schalenfruchte": "Schalenfrüchte und Schalenfruchterzeugnisse",
        "milch": "Milch und Milcherzeugnisse",
        "sellerie": "Sellerie und Sellerieerzeugnisse"
      },
      "merkmale": {
        "veganuary": "Veganuary"
      },
      "naehrstoffe": "",
      "zusatzstoffe": null,
      "PrintOrder": "0",
      "CO2Value": "394.00",
      "CO2Rating": "B",
      "CO2Perc": "100.00",
      "ClimateFriendly": null,
      "GastDesc": "Falafel | Mandeln | Couscous",
      "date_de": "07.01.2026"
    },
    {
      "id": "5057258",
      "outlet": "canteen",
      "date": "2026-01-07",
      "CalendarWeek": "1",
      "day": "Mittwoch",
      "mealtime": "Mittagessen",
      "IdentNr": "12026010798001",
      "itemId": "17550",
      "RecipeID": "4865",
      "ProductPrice": "12.00",
      "ProductPrice_2": null,
      "GastDesc_de": "Rinderschmorbraten | Blaukraut | Spätzle",
      "GastDesc_en": "Braised Beef | Red cabbage | Spätzle",
      "MenuName": "COUNTER 2.1 Meat",
      "allergene": {
        "gluten": "Glutenhaltiges Getreide",
        "huhnerei": "Hühnerei und Hühnereierzeugnisse",
        "milch": "Milch und Milcherzeugnisse",
        "sellerie": "Sellerie und Sellerieerzeugnisse",
        "schwefel": "Schwefeldioxid und Sulfide"
      },
      "merkmale": "",
      "naehrstoffe": "",
      "zusatzstoffe": [
        {
          "de": "Alkohol",
          "en": "Alcohol"
        }
      ],
      "PrintOrder": "1",
      "CO2Value": "7035.00",
      "CO2Rating": "E",
      "CO2Perc": "100.00",
      "ClimateFriendly": null,
      "GastDesc": "Rinderschmorbraten | Blaukraut | Spätzle",
      "date_de": "07.01.2026"
    },
    {
      "id": "5057259",
      "outlet": "canteen",
      "date": "2026-01-07",
      "CalendarWeek": "1",
      "day": "Mittwoch",
      "mealtime": "Mittagessen",
      "IdentNr": "12026010798003",
      "itemId": "17552",
      "RecipeID": "7576",
      "ProductPrice": "12.00",
      "ProductPrice_2": null,
      "GastDesc_de": "Lachs | Reisnudeln | Rote Bete | Fenchel",
      "GastDesc_en": "Salmon | Rice Noodles | Beetroot | Fennel",
      "MenuName": "COUNTER 3.1 Fish",
      "allergene": {
        "gluten": "Glutenhaltiges Getreide",
        "fisch": "Fisch und Fischerzeugnisse",
        "milch": "Milch und Milcherzeugnisse",
        "sellerie": "Sellerie und Sellerieerzeugnisse",
        "schwefel": "Schwefeldioxid und Sulfide"
      },
      "merkmale": "",
      "naehrstoffe": "",
      "zusatzstoffe": [
        {
          "de": "Antioxidationsmittel",
          "en": "Antioxidation"
        },
        {
          "de": "Alkohol",
          "en": "Alcohol"
        }
      ],
      "PrintOrder": "3",
      "CO2Value": "1193.00",
      "CO2Rating": "B",
      "CO2Perc": "100.00",
      "ClimateFriendly": null,
      "GastDesc": "Lachs | Reisnudeln | Rote Bete | Fenchel",
      "date_de": "07.01.2026"
    },
    {
      "id": "5057260",
      "outlet": "canteen",
      "date": "2026-01-07",
      "CalendarWeek": "1",
      "day": "Mittwoch",
      "mealtime": "Mittagessen",
      "IdentNr": "12026010798005",
      "itemId": "17554",
      "RecipeID": "7035",
      "ProductPrice": "9.50",
      "ProductPrice_2": null,
      "GastDesc_de": "Tortellini Verdura | Tomate | Basilikum",
      "GastDesc_en": "Tortellini Verdura | Tomato | Basil",
      "MenuName": "COUNTER 4.1 Vegi",
      "allergene": {
        "gluten": "Glutenhaltiges Getreide",
        "milch": "Milch und Milcherzeugnisse",
        "sellerie": "Sellerie und Sellerieerzeugnisse"
      },
      "merkmale": {
        "veganuary": "Veganuary"
      },
      "naehrstoffe": "",
      "zusatzstoffe": null,
      "PrintOrder": "5",
      "CO2Value": "248.00",
      "CO2Rating": "A",
      "CO2Perc": "100.00",
      "ClimateFriendly": "1",
      "GastDesc": "Tortellini Verdura | Tomate | Basilikum",
      "date_de": "07.01.2026"
    },
    {
      "id": "5057261",
      "outlet": "canteen",
      "date": "2026-01-07",
      "CalendarWeek": "1",
      "day": "Mittwoch",
      "mealtime": "Abendessen",
      "IdentNr": "12026010798009",
      "itemId": "17558",
      "RecipeID": "4250",
      "ProductPrice": "10.00",
      "ProductPrice_2": null,
      "GastDesc_de": "Falafel | Mandeln | Couscous",
      "GastDesc_en": "Falafel | Almonds | Couscous",
      "MenuName": "DINNER BOWL_",
      "allergene": {
        "gluten": "Glutenhaltiges Getreide",
        "schalenfruchte": "Schalenfrüchte und Schalenfruchterzeugnisse",
        "milch": "Milch und Milcherzeugnisse",
        "sellerie": "Sellerie und Sellerieerzeugnisse"
      },
      "merkmale": {
        "veganuary": "Veganuary"
      },
      "naehrstoffe": "",
      "zusatzstoffe": null,
      "PrintOrder": "9",
      "CO2Value": "394.00",
      "CO2Rating": "B",
      "CO2Perc": "100.00",
      "ClimateFriendly": null,
      "GastDesc": "Falafel | Mandeln | Couscous",
      "date_de": "07.01.2026"
    },
    {
      "id": "5057263",
      "outlet": "canteen",
      "date": "2026-01-07",
      "CalendarWeek": "1",
      "day": "Mittwoch",
      "mealtime": "Abendessen",
      "IdentNr": "12026010798010",
      "itemId": "17559",
      "RecipeID": "4865",
      "ProductPrice": "12.00",
      "ProductPrice_2": null,
      "GastDesc_de": "Rinderschmorbraten | Blaukraut | Spätzle",
      "GastDesc_en": "Braised Beef | Red cabbage | Spätzle",
      "MenuName": "DINNER Meat_17:00-19:00",
      "allergene": {
        "gluten": "Glutenhaltiges Getreide",
        "huhnerei": "Hühnerei und Hühnereierzeugnisse",
        "milch": "Milch und Milcherzeugnisse",
        "sellerie": "Sellerie und Sellerieerzeugnisse",
        "schwefel": "Schwefeldioxid und Sulfide"
      },
      "merkmale": "",
      "naehrstoffe": "",
      "zusatzstoffe": [
        {
          "de": "Alkohol",
          "en": "Alcohol"
        }
      ],
      "PrintOrder": "10",
      "CO2Value": "7035.00",
      "CO2Rating": "E",
      "CO2Perc": "100.00",
      "ClimateFriendly": null,
      "GastDesc": "Rinderschmorbraten | Blaukraut | Spätzle",
      "date_de": "07.01.2026"
    },
    {
      "id": "5057265",
      "outlet": "canteen",
      "date": "2026-01-07",
      "CalendarWeek": "1",
      "day": "Mittwoch",
      "mealtime": "Abendessen",
      "IdentNr": "12026010798012",
      "itemId": "17561",
      "RecipeID": "7035",
      "ProductPrice": "9.50",
      "ProductPrice_2": null,
      "GastDesc_de": "Tortellini Verdura | Tomate | Basilikum",
      "GastDesc_en": "Tortellini Verdura | Tomato | Basil",
      "MenuName": "DINNER Vegi/Vegan_17:00-19:00",
      "allergene": {
        "gluten": "Glutenhaltiges Getreide",
        "milch": "Milch und Milcherzeugnisse",
        "sellerie": "Sellerie und Sellerieerzeugnisse"
      },
      "merkmale": {
        "veganuary": "Veganuary"
      },
      "naehrstoffe": "",
      "zusatzstoffe": null,
      "PrintOrder": "12",
      "CO2Value": "248.00",
      "CO2Rating": "A",
      "CO2Perc": "100.00",
      "ClimateFriendly": "1",
      "GastDesc": "Tortellini Verdura | Tomate | Basilikum",
      "date_de": "07.01.2026"
    },
    {
      "id": "5057267",
      "outlet": "canteen",
      "date": "2026-01-08",
      "CalendarWeek": "1",
      "day": "Donnerstag",
      "mealtime": "Mittagessen",
      "IdentNr": "12026010898000",
      "itemId": "17549",
      "RecipeID": "8703",
      "ProductPrice": "11.00",
      "ProductPrice_2": null,
      "GastDesc_de": "Vegane Bibimbap | Sojasprossen | Zucchini",
      "GastDesc_en": "Vegan Bibimbap | Beansprouts | Courgette",
      "MenuName": "COUNTER 1.1 Bowls_",
      "allergene": {
        "gluten": "Glutenhaltiges Getreide",
        "soja": "Soja und Sojaerzeugnisse",
        "sesam": "Sesamsamen und Sesamsamenerzeugnisse",
        "schwefel": "Schwefeldioxid und Sulfide"
      },
      "merkmale": {
        "veganuary": "Veganuary"
      },
      "naehrstoffe": "",
      "zusatzstoffe": [
        {
          "de": "Süßungsmittel",
          "en": "Sweetener"
        },
        {
          "de": "Phenylalaninquelle",
          "en": "Phenylalanine"
        },
        {
          "de": "Konservierungsstoff",
          "en": "Preservatives"
        },
        {
          "de": "Alkohol",
          "en": "Alcohol"
        }
      ],
      "PrintOrder": "0",
      "CO2Value": "828.00",
      "CO2Rating": "A",
      "CO2Perc": "100.00",
      "ClimateFriendly": "1",
      "GastDesc": "Vegane Bibimbap | Sojasprossen | Zucchini",
      "date_de": "08.01.2026"
    },
    {
      "id": "5057268",
      "outlet": "canteen",
      "date": "2026-01-08",
      "CalendarWeek": "1",
      "day": "Donnerstag",
      "mealtime": "Mittagessen",
      "IdentNr": "12026010898001",
      "itemId": "17550",
      "RecipeID": "8438",
      "ProductPrice": "12.00",
      "ProductPrice_2": null,
      "GastDesc_de": "Lammhüfte | Maispolenta | Peperonate | Rosmarin",
      "GastDesc_en": "Lamb Rump | corn polenta | peperonata | rosemary",
      "MenuName": "COUNTER 2.1 Meat",
      "allergene": {
        "huhnerei": "Hühnerei und Hühnereierzeugnisse",
        "milch": "Milch und Milcherzeugnisse",
        "sellerie": "Sellerie und Sellerieerzeugnisse",
        "schwefel": "Schwefeldioxid und Sulfide"
      },
      "merkmale": "",
      "naehrstoffe": "",
      "zusatzstoffe": [
        {
          "de": "Alkohol",
          "en": "Alcohol"
        }
      ],
      "PrintOrder": "1",
      "CO2Value": "6757.00",
      "CO2Rating": "E",
      "CO2Perc": "100.00",
      "ClimateFriendly": null,
      "GastDesc": "Lammhüfte | Maispolenta | Peperonate | Rosmarin",
      "date_de": "08.01.2026"
    },
    {
      "id": "5057269",
      "outlet": "canteen",
      "date": "2026-01-08",
      "CalendarWeek": "1",
      "day": "Donnerstag",
      "mealtime": "Mittagessen",
      "IdentNr": "12026010898003",
      "itemId": "17552",
      "RecipeID": "7576",
      "ProductPrice": "12.00",
      "ProductPrice_2": null,
      "GastDesc_de": "Lachs | Reisnudeln | Rote Bete | Fenchel",
      "GastDesc_en": "Salmon | Rice Noodles | Beetroot | Fennel",
      "MenuName": "COUNTER 3.1 Fish",
      "allergene": {
        "gluten": "Glutenhaltiges Getreide",
        "fisch": "Fisch und Fischerzeugnisse",
        "milch": "Milch und Milcherzeugnisse",
        "sellerie": "Sellerie und Sellerieerzeugnisse",
        "schwefel": "Schwefeldioxid und Sulfide"
      },
      "merkmale": "",
      "naehrstoffe": "",
      "zusatzstoffe": [
        {
          "de": "Antioxidationsmittel",
          "en": "Antioxidation"
        },
        {
          "de": "Alkohol",
          "en": "Alcohol"
        }
      ],
      "PrintOrder": "3",
      "CO2Value": "1193.00",
      "CO2Rating": "B",
      "CO2Perc": "100.00",
      "ClimateFriendly": null,
      "GastDesc": "Lachs | Reisnudeln | Rote Bete | Fenchel",
      "date_de": "08.01.2026"
    },
    {
      "id": "5057270",
      "outlet": "canteen",
      "date": "2026-01-08",
      "CalendarWeek": "1",
      "day": "Donnerstag",
      "mealtime": "Mittagessen",
      "IdentNr": "12026010898005",
      "itemId": "17554",
      "RecipeID": "6758",
      "ProductPrice": "10.00",
      "ProductPrice_2": null,
      "GastDesc_de": "Süßkartoffel | Avocado | Tzatziki",
      "GastDesc_en": "Sweet Potato | Avocado | Tzatziki",
      "MenuName": "COUNTER 4.1 Vegi",
      "allergene": {
        "gluten": "Glutenhaltiges Getreide",
        "schalenfruchte": "Schalenfrüchte und Schalenfruchterzeugnisse",
        "schwefel": "Schwefeldioxid und Sulfide"
      },
      "merkmale": {
        "veganuary": "Veganuary"
      },
      "naehrstoffe": "",
      "zusatzstoffe": null,
      "PrintOrder": "5",
      "CO2Value": "382.00",
      "CO2Rating": "A",
      "CO2Perc": "100.00",
      "ClimateFriendly": "1",
      "GastDesc": "Süßkartoffel | Avocado | Tzatziki",
      "date_de": "08.01.2026"
    },
    {
      "id": "5057271",
      "outlet": "canteen",
      "date": "2026-01-08",
      "CalendarWeek": "1",
      "day": "Donnerstag",
      "mealtime": "Abendessen",
      "IdentNr": "12026010898009",
      "itemId": "17558",
      "RecipeID": "8703",
      "ProductPrice": "11.00",
      "ProductPrice_2": null,
      "GastDesc_de": "Vegane Bibimbap | Sojasprossen | Zucchini",
      "GastDesc_en": "Vegan Bibimbap | Beansprouts | Courgette",
      "MenuName": "DINNER BOWL_",
      "allergene": {
        "gluten": "Glutenhaltiges Getreide",
        "soja": "Soja und Sojaerzeugnisse",
        "sesam": "Sesamsamen und Sesamsamenerzeugnisse",
        "schwefel": "Schwefeldioxid und Sulfide"
      },
      "merkmale": {
        "veganuary": "Veganuary"
      },
      "naehrstoffe": "",
      "zusatzstoffe": [
        {
          "de": "Süßungsmittel",
          "en": "Sweetener"
        },
        {
          "de": "Phenylalaninquelle",
          "en": "Phenylalanine"
        },
        {
          "de": "Konservierungsstoff",
          "en": "Preservatives"
        },
        {
          "de": "Alkohol",
          "en": "Alcohol"
        }
      ],
      "PrintOrder": "9",
      "CO2Value": "828.00",
      "CO2Rating": "A",
      "CO2Perc": "100.00",
      "ClimateFriendly": "1",
      "GastDesc": "Vegane Bibimbap | Sojasprossen | Zucchini",
      "date_de": "08.01.2026"
    },
    {
      "id": "5057273",
      "outlet": "canteen",
      "date": "2026-01-08",
      "CalendarWeek": "1",
      "day": "Donnerstag",
      "mealtime": "Abendessen",
      "IdentNr": "12026010898011",
      "itemId": "17560",
      "RecipeID": "8438",
      "ProductPrice": "12.00",
      "ProductPrice_2": null,
      "GastDesc_de": "Lammhüfte | Maispolenta | Peperonate | Rosmarin",
      "GastDesc_en": "Lamb Rump | corn polenta | peperonata | rosemary",
      "MenuName": "DINNER Fish_17:00-19:00",
      "allergene": {
        "huhnerei": "Hühnerei und Hühnereierzeugnisse",
        "milch": "Milch und Milcherzeugnisse",
        "sellerie": "Sellerie und Sellerieerzeugnisse",
        "schwefel": "Schwefeldioxid und Sulfide"
      },
      "merkmale": "",
      "naehrstoffe": "",
      "zusatzstoffe": [
        {
          "de": "Alkohol",
          "en": "Alcohol"
        }
      ],
      "PrintOrder": "11",
      "CO2Value": "6757.00",
      "CO2Rating": "E",
      "CO2Perc": "100.00",
      "ClimateFriendly": null,
      "GastDesc": "Lammhüfte | Maispolenta | Peperonate | Rosmarin",
      "date_de": "08.01.2026"
    },
    {
      "id": "5057275",
      "outlet": "canteen",
      "date": "2026-01-08",
      "CalendarWeek": "1",
      "day": "Donnerstag",
      "mealtime": "Abendessen",
      "IdentNr": "12026010898012",
      "itemId": "17561",
      "RecipeID": "6758",
      "ProductPrice": "10.00",
      "ProductPrice_2": null,
      "GastDesc_de": "Süßkartoffel | Avocado | Tzatziki",
      "GastDesc_en": "Sweet Potato | Avocado | Tzatziki",
      "MenuName": "DINNER Vegi/Vegan_17:00-19:00",
      "allergene": {
        "gluten": "Glutenhaltiges Getreide",
        "schalenfruchte": "Schalenfrüchte und Schalenfruchterzeugnisse",
        "schwefel": "Schwefeldioxid und Sulfide"
      },
      "merkmale": {
        "veganuary": "Veganuary"
      },
      "naehrstoffe": "",
      "zusatzstoffe": null,
      "PrintOrder": "12",
      "CO2Value": "382.00",
      "CO2Rating": "A",
      "CO2Perc": "100.00",
      "ClimateFriendly": "1",
      "GastDesc": "Süßkartoffel | Avocado | Tzatziki",
      "date_de": "08.01.2026"
    },
    {
      "id": "5057277",
      "outlet": "canteen",
      "date": "2026-01-09",
      "CalendarWeek": "1",
      "day": "Freitag",
      "mealtime": "Mittagessen",
      "IdentNr": "12026010998000",
      "itemId": "17549",
      "RecipeID": "4776",
      "ProductPrice": "10.00",
      "ProductPrice_2": null,
      "GastDesc_de": "Grünkohl | Pomelo | Granatapfel",
      "GastDesc_en": "Kale | Pomelo | Pommegranate",
      "MenuName": "COUNTER 1.1 Bowls_",
      "allergene": {
        "gluten": "Glutenhaltiges Getreide",
        "sesam": "Sesamsamen und Sesamsamenerzeugnisse"
      },
      "merkmale": {
        "veganuary": "Veganuary"
      },
      "naehrstoffe": "",
      "zusatzstoffe": null,
      "PrintOrder": "0",
      "CO2Value": "319.00",
      "CO2Rating": "A",
      "CO2Perc": "100.00",
      "ClimateFriendly": "1",
      "GastDesc": "Grünkohl | Pomelo | Granatapfel",
      "date_de": "09.01.2026"
    },
    {
      "id": "5057278",
      "outlet": "canteen",
      "date": "2026-01-09",
      "CalendarWeek": "1",
      "day": "Freitag",
      "mealtime": "Mittagessen",
      "IdentNr": "12026010998001",
      "itemId": "17550",
      "RecipeID": "8438",
      "ProductPrice": "12.00",
      "ProductPrice_2": null,
      "GastDesc_de": "Lammhüfte | Maispolenta | Peperonate | Rosmarin",
      "GastDesc_en": "Lamb Rump | corn polenta | peperonata | rosemary",
      "MenuName": "COUNTER 2.1 Meat",
      "allergene": {
        "huhnerei": "Hühnerei und Hühnereierzeugnisse",
        "milch": "Milch und Milcherzeugnisse",
        "sellerie": "Sellerie und Sellerieerzeugnisse",
        "schwefel": "Schwefeldioxid und Sulfide"
      },
      "merkmale": "",
      "naehrstoffe": "",
      "zusatzstoffe": [
        {
          "de": "Alkohol",
          "en": "Alcohol"
        }
      ],
      "PrintOrder": "1",
      "CO2Value": "6757.00",
      "CO2Rating": "E",
      "CO2Perc": "100.00",
      "ClimateFriendly": null,
      "GastDesc": "Lammhüfte | Maispolenta | Peperonate | Rosmarin",
      "date_de": "09.01.2026"
    },
    {
      "id": "5057279",
      "outlet": "canteen",
      "date": "2026-01-09",
      "CalendarWeek": "1",
      "day": "Freitag",
      "mealtime": "Mittagessen",
      "IdentNr": "12026010998003",
      "itemId": "17552",
      "RecipeID": "7576",
      "ProductPrice": "12.00",
      "ProductPrice_2": null,
      "GastDesc_de": "Lachs | Reisnudeln | Rote Bete | Fenchel",
      "GastDesc_en": "Salmon | Rice Noodles | Beetroot | Fennel",
      "MenuName": "COUNTER 3.1 Fish",
      "allergene": {
        "gluten": "Glutenhaltiges Getreide",
        "fisch": "Fisch und Fischerzeugnisse",
        "milch": "Milch und Milcherzeugnisse",
        "sellerie": "Sellerie und Sellerieerzeugnisse",
        "schwefel": "Schwefeldioxid und Sulfide"
      },
      "merkmale": "",
      "naehrstoffe": "",
      "zusatzstoffe": [
        {
          "de": "Antioxidationsmittel",
          "en": "Antioxidation"
        },
        {
          "de": "Alkohol",
          "en": "Alcohol"
        }
      ],
      "PrintOrder": "3",
      "CO2Value": "1193.00",
      "CO2Rating": "B",
      "CO2Perc": "100.00",
      "ClimateFriendly": null,
      "GastDesc": "Lachs | Reisnudeln | Rote Bete | Fenchel",
      "date_de": "09.01.2026"
    },
    {
      "id": "5057280",
      "outlet": "canteen",
      "date": "2026-01-09",
      "CalendarWeek": "1",
      "day": "Freitag",
      "mealtime": "Mittagessen",
      "IdentNr": "12026010998005",
      "itemId": "17554",
      "RecipeID": "7303",
      "ProductPrice": "9.50",
      "ProductPrice_2": null,
      "GastDesc_de": "Pilz-Stroganoff | Gewürzgurken | Bandnudeln",
      "GastDesc_en": "Mushroom Stroganoff | Pickles | Tagliatelle",
      "MenuName": "COUNTER 4.1 Vegi",
      "allergene": {
        "gluten": "Glutenhaltiges Getreide",
        "schalenfruchte": "Schalenfrüchte und Schalenfruchterzeugnisse",
        "schwefel": "Schwefeldioxid und Sulfide"
      },
      "merkmale": {
        "veganuary": "Veganuary"
      },
      "naehrstoffe": "",
      "zusatzstoffe": [
        {
          "de": "Süßungsmittel",
          "en": "Sweetener"
        },
        {
          "de": "Alkohol",
          "en": "Alcohol"
        }
      ],
      "PrintOrder": "5",
      "CO2Value": "616.00",
      "CO2Rating": "B",
      "CO2Perc": "100.00",
      "ClimateFriendly": null,
      "GastDesc": "Pilz-Stroganoff | Gewürzgurken | Bandnudeln",
      "date_de": "09.01.2026"
    },
    {
      "id": "5057281",
      "outlet": "canteen",
      "date": "2026-01-09",
      "CalendarWeek": "1",
      "day": "Freitag",
      "mealtime": "Abendessen",
      "IdentNr": "12026010998009",
      "itemId": "17558",
      "RecipeID": "7624",
      "ProductPrice": "10.00",
      "ProductPrice_2": null,
      "GastDesc_de": "Curry-Zucchini-Wedges | Hoi Sin | Linsen",
      "GastDesc_en": "Curry Courgette Wedges | Hoi Sin | Lentils",
      "MenuName": "DINNER BOWL_",
      "allergene": {
        "gluten": "Glutenhaltiges Getreide",
        "soja": "Soja und Sojaerzeugnisse",
        "sellerie": "Sellerie und Sellerieerzeugnisse",
        "sesam": "Sesamsamen und Sesamsamenerzeugnisse"
      },
      "merkmale": {
        "veganuary": "Veganuary"
      },
      "naehrstoffe": "",
      "zusatzstoffe": [
        {
          "de": "Farbstoff",
          "en": "Colouring Agent"
        },
        {
          "de": "Geschmacksverstärker",
          "en": "Flavor Enhancer"
        }
      ],
      "PrintOrder": "9",
      "CO2Value": "759.00",
      "CO2Rating": "B",
      "CO2Perc": "100.00",
      "ClimateFriendly": null,
      "GastDesc": "Curry-Zucchini-Wedges | Hoi Sin | Linsen",
      "date_de": "09.01.2026"
    },
    {
      "id": "5057283",
      "outlet": "canteen",
      "date": "2026-01-09",
      "CalendarWeek": "1",
      "day": "Freitag",
      "mealtime": "Abendessen",
      "IdentNr": "12026010998010",
      "itemId": "17559",
      "RecipeID": "7576",
      "ProductPrice": "12.00",
      "ProductPrice_2": null,
      "GastDesc_de": "Lachs | Reisnudeln | Rote Bete | Fenchel",
      "GastDesc_en": "Salmon | Rice Noodles | Beetroot | Fennel",
      "MenuName": "DINNER Meat_17:00-19:00",
      "allergene": {
        "gluten": "Glutenhaltiges Getreide",
        "fisch": "Fisch und Fischerzeugnisse",
        "milch": "Milch und Milcherzeugnisse",
        "sellerie": "Sellerie und Sellerieerzeugnisse",
        "schwefel": "Schwefeldioxid und Sulfide"
      },
      "merkmale": "",
      "naehrstoffe": "",
      "zusatzstoffe": [
        {
          "de": "Antioxidationsmittel",
          "en": "Antioxidation"
        },
        {
          "de": "Alkohol",
          "en": "Alcohol"
        }
      ],
      "PrintOrder": "10",
      "CO2Value": "1193.00",
      "CO2Rating": "B",
      "CO2Perc": "100.00",
      "ClimateFriendly": null,
      "GastDesc": "Lachs | Reisnudeln | Rote Bete | Fenchel",
      "date_de": "09.01.2026"
    },
    {
      "id": "5057285",
      "outlet": "canteen",
      "date": "2026-01-09",
      "CalendarWeek": "1",
      "day": "Freitag",
      "mealtime": "Abendessen",
      "IdentNr": "12026010998012",
      "itemId": "17561",
      "RecipeID": "7303",
      "ProductPrice": "9.50",
      "ProductPrice_2": null,
      "GastDesc_de": "Pilz-Stroganoff | Gewürzgurken | Bandnudeln",
      "GastDesc_en": "Mushroom Stroganoff | Pickles | Tagliatelle",
      "MenuName": "DINNER Vegi/Vegan_17:00-19:00",
      "allergene": {
        "gluten": "Glutenhaltiges Getreide",
        "schalenfruchte": "Schalenfrüchte und Schalenfruchterzeugnisse",
        "schwefel": "Schwefeldioxid und Sulfide"
      },
      "merkmale": {
        "veganuary": "Veganuary"
      },
      "naehrstoffe": "",
      "zusatzstoffe": [
        {
          "de": "Süßungsmittel",
          "en": "Sweetener"
        },
        {
          "de": "Alkohol",
          "en": "Alcohol"
        }
      ],
      "PrintOrder": "12",
      "CO2Value": "616.00",
      "CO2Rating": "B",
      "CO2Perc": "100.00",
      "ClimateFriendly": null,
      "GastDesc": "Pilz-Stroganoff | Gewürzgurken | Bandnudeln",
      "date_de": "09.01.2026"
    },
    {
      "id": "5057287",
      "outlet": "canteen",
      "date": "2026-01-12",
      "CalendarWeek": "1",
      "day": "Montag",
      "mealtime": "Mittagessen",
      "IdentNr": "12026011298000",
      "itemId": "17549",
      "RecipeID": "7852",
      "ProductPrice": "11.00",
      "ProductPrice_2": null,
      "GastDesc_de": "Harissa Falafel | Bulgur | Spinat-Hummus",
      "GastDesc_en": "Harissa Falafel | Bulgur | Spinach Hummus",
      "MenuName": "COUNTER 1.1 Bowls_",
      "allergene": {
        "gluten": "Glutenhaltiges Getreide",
        "milch": "Milch und Milcherzeugnisse",
        "sesam": "Sesamsamen und Sesamsamenerzeugnisse"
      },
      "merkmale": {
        "veganuary": "Veganuary"
      },
      "naehrstoffe": "",
      "zusatzstoffe": null,
      "PrintOrder": "0",
      "CO2Value": "534.00",
      "CO2Rating": "A",
      "CO2Perc": "100.00",
      "ClimateFriendly": "1",
      "GastDesc": "Harissa Falafel | Bulgur | Spinat-Hummus",
      "date_de": "12.01.2026"
    },
    {
      "id": "5057288",
      "outlet": "canteen",
      "date": "2026-01-12",
      "CalendarWeek": "1",
      "day": "Montag",
      "mealtime": "Mittagessen",
      "IdentNr": "12026011298001",
      "itemId": "17550",
      "RecipeID": "5326",
      "ProductPrice": "12.00",
      "ProductPrice_2": null,
      "GastDesc_de": "Shiitake - Eintopf | Hähnchen | Aubergine",
      "GastDesc_en": "Shiitake - Hot Pot | Chicken | Eggplant",
      "MenuName": "COUNTER 2.1 Meat",
      "allergene": {
        "gluten": "Glutenhaltiges Getreide",
        "soja": "Soja und Sojaerzeugnisse",
        "sellerie": "Sellerie und Sellerieerzeugnisse",
        "weichtier": "Weichtier und Weichtiererzeugnisse"
      },
      "merkmale": "",
      "naehrstoffe": "",
      "zusatzstoffe": [
        {
          "de": "Farbstoff",
          "en": "Colouring Agent"
        },
        {
          "de": "Geschmacksverstärker",
          "en": "Flavor Enhancer"
        }
      ],
      "PrintOrder": "1",
      "CO2Value": "944.00",
      "CO2Rating": "C",
      "CO2Perc": "100.00",
      "ClimateFriendly": null,
      "GastDesc": "Shiitake - Eintopf | Hähnchen | Aubergine",
      "date_de": "12.01.2026"
    },
    {
      "id": "5057289",
      "outlet": "canteen",
      "date": "2026-01-12",
      "CalendarWeek": "1",
      "day": "Montag",
      "mealtime": "Mittagessen",
      "IdentNr": "12026011298003",
      "itemId": "17552",
      "RecipeID": "9063",
      "ProductPrice": "12.00",
      "ProductPrice_2": null,
      "GastDesc_de": "Winterwurzel-Eintopf | Estragon | Hoki",
      "GastDesc_en": "Winter Root Onepot | Tarragon | Hoki",
      "MenuName": "COUNTER 3.1 Fish",
      "allergene": {
        "fisch": "Fisch und Fischerzeugnisse",
        "milch": "Milch und Milcherzeugnisse",
        "sellerie": "Sellerie und Sellerieerzeugnisse"
      },
      "merkmale": "",
      "naehrstoffe": "",
      "zusatzstoffe": null,
      "PrintOrder": "3",
      "CO2Value": "1387.00",
      "CO2Rating": "B",
      "CO2Perc": "100.00",
      "ClimateFriendly": null,
      "GastDesc": "Winterwurzel-Eintopf | Estragon | Hoki",
      "date_de": "12.01.2026"
    },
    {
      "id": "5057290",
      "outlet": "canteen",
      "date": "2026-01-12",
      "CalendarWeek": "1",
      "day": "Montag",
      "mealtime": "Mittagessen",
      "IdentNr": "12026011298005",
      "itemId": "17554",
      "RecipeID": "4322",
      "ProductPrice": "9.50",
      "ProductPrice_2": null,
      "GastDesc_de": "Chili sin Carne | Taco | Sojajoghurt",
      "GastDesc_en": "Chilli sin Carne | Taco | Soy Yoghurt",
      "MenuName": "COUNTER 4.1 Vegi",
      "allergene": {
        "gluten": "Glutenhaltiges Getreide",
        "schalenfruchte": "Schalenfrüchte und Schalenfruchterzeugnisse",
        "soja": "Soja und Sojaerzeugnisse",
        "erdnuss": "Erdnüsse und Erdnusserzeugnisse",
        "sellerie": "Sellerie und Sellerieerzeugnisse"
      },
      "merkmale": {
        "vegan": "Vegan",
        "vegetarisch": "Vegetarisch"
      },
      "naehrstoffe": "",
      "zusatzstoffe": null,
      "PrintOrder": "5",
      "CO2Value": "816.00",
      "CO2Rating": "B",
      "CO2Perc": "100.00",
      "ClimateFriendly": null,
      "GastDesc": "Chili sin Carne | Taco | Sojajoghurt",
      "date_de": "12.01.2026"
    },
    {
      "id": "5057291",
      "outlet": "canteen",
      "date": "2026-01-13",
      "CalendarWeek": "1",
      "day": "Dienstag",
      "mealtime": "Mittagessen",
      "IdentNr": "12026011398001",
      "itemId": "17550",
      "RecipeID": "5326",
      "ProductPrice": "12.00",
      "ProductPrice_2": null,
      "GastDesc_de": "Shiitake - Eintopf | Hähnchen | Aubergine",
      "GastDesc_en": "Shiitake - Hot Pot | Chicken | Eggplant",
      "MenuName": "COUNTER 2.1 Meat",
      "allergene": {
        "gluten": "Glutenhaltiges Getreide",
        "soja": "Soja und Sojaerzeugnisse",
        "sellerie": "Sellerie und Sellerieerzeugnisse",
        "weichtier": "Weichtier und Weichtiererzeugnisse"
      },
      "merkmale": "",
      "naehrstoffe": "",
      "zusatzstoffe": [
        {
          "de": "Farbstoff",
          "en": "Colouring Agent"
        },
        {
          "de": "Geschmacksverstärker",
          "en": "Flavor Enhancer"
        }
      ],
      "PrintOrder": "1",
      "CO2Value": "944.00",
      "CO2Rating": "C",
      "CO2Perc": "100.00",
      "ClimateFriendly": null,
      "GastDesc": "Shiitake - Eintopf | Hähnchen | Aubergine",
      "date_de": "13.01.2026"
    },
    {
      "id": "5057292",
      "outlet": "canteen",
      "date": "2026-01-13",
      "CalendarWeek": "1",
      "day": "Dienstag",
      "mealtime": "Mittagessen",
      "IdentNr": "12026011398003",
      "itemId": "17552",
      "RecipeID": "9063",
      "ProductPrice": "12.00",
      "ProductPrice_2": null,
      "GastDesc_de": "Winterwurzel-Eintopf | Estragon | Hoki",
      "GastDesc_en": "Winter Root Onepot | Tarragon | Hoki",
      "MenuName": "COUNTER 3.1 Fish",
      "allergene": {
        "fisch": "Fisch und Fischerzeugnisse",
        "milch": "Milch und Milcherzeugnisse",
        "sellerie": "Sellerie und Sellerieerzeugnisse"
      },
      "merkmale": "",
      "naehrstoffe": "",
      "zusatzstoffe": null,
      "PrintOrder": "3",
      "CO2Value": "1387.00",
      "CO2Rating": "B",
      "CO2Perc": "100.00",
      "ClimateFriendly": null,
      "GastDesc": "Winterwurzel-Eintopf | Estragon | Hoki",
      "date_de": "13.01.2026"
    },
    {
      "id": "5057293",
      "outlet": "canteen",
      "date": "2026-01-13",
      "CalendarWeek": "1",
      "day": "Dienstag",
      "mealtime": "Mittagessen",
      "IdentNr": "12026011398005",
      "itemId": "17554",
      "RecipeID": "9090",
      "ProductPrice": "9.50",
      "ProductPrice_2": null,
      "GastDesc_de": "Safran Pasta | Chipotle Zwiebeln | Eingelegten Chilis",
      "GastDesc_en": "Safran Pasta | Chipotle Onion | Pickled Chilis",
      "MenuName": "COUNTER 4.1 Vegi",
      "allergene": {
        "gluten": "Glutenhaltiges Getreide",
        "milch": "Milch und Milcherzeugnisse"
      },
      "merkmale": {
        "vegan": "Vegan",
        "vegetarisch": "Vegetarisch"
      },
      "naehrstoffe": "",
      "zusatzstoffe": [
        {
          "de": "Farbstoff",
          "en": "Colouring Agent"
        }
      ],
      "PrintOrder": "5",
      "CO2Value": "610.00",
      "CO2Rating": "A",
      "CO2Perc": "100.00",
      "ClimateFriendly": "1",
      "GastDesc": "Safran Pasta | Chipotle Zwiebeln | Eingelegten Chilis",
      "date_de": "13.01.2026"
    },
    {
      "id": "5057294",
      "outlet": "canteen",
      "date": "2026-01-14",
      "CalendarWeek": "1",
      "day": "Mittwoch",
      "mealtime": "Mittagessen",
      "IdentNr": "12026011498000",
      "itemId": "17549",
      "RecipeID": "8617",
      "ProductPrice": "11.00",
      "ProductPrice_2": null,
      "GastDesc_de": "Vegane Kibbeh | Tomaten-Kreuzkümmel-Salat | Cacik",
      "GastDesc_en": "Vegan Kibbeh | Tomato-Cumin Salad | Cacik",
      "MenuName": "COUNTER 1.1 Bowls_",
      "allergene": {
        "gluten": "Glutenhaltiges Getreide",
        "schalenfruchte": "Schalenfrüchte und Schalenfruchterzeugnisse",
        "soja": "Soja und Sojaerzeugnisse",
        "senf": "Senf und Senferzeugnisse",
        "schwefel": "Schwefeldioxid und Sulfide"
      },
      "merkmale": {
        "veganuary": "Veganuary"
      },
      "naehrstoffe": "",
      "zusatzstoffe": [
        {
          "de": "Konservierungsstoff",
          "en": "Preservatives"
        }
      ],
      "PrintOrder": "0",
      "CO2Value": "675.00",
      "CO2Rating": "B",
      "CO2Perc": "100.00",
      "ClimateFriendly": null,
      "GastDesc": "Vegane Kibbeh | Tomaten-Kreuzkümmel-Salat | Cacik",
      "date_de": "14.01.2026"
    },
    {
      "id": "5057295",
      "outlet": "canteen",
      "date": "2026-01-14",
      "CalendarWeek": "1",
      "day": "Mittwoch",
      "mealtime": "Mittagessen",
      "IdentNr": "12026011498001",
      "itemId": "17550",
      "RecipeID": "8564",
      "ProductPrice": "12.00",
      "ProductPrice_2": null,
      "GastDesc_de": "Gegrilltes Schweinefilet | Warmer Kartoffel-Kürbissalat | Pfefferjus",
      "GastDesc_en": "Grilled Pork Tenderloin | Warm Potato Pumpkin salad | Pepperjus",
      "MenuName": "COUNTER 2.1 Meat",
      "allergene": {
        "schalenfruchte": "Schalenfrüchte und Schalenfruchterzeugnisse",
        "milch": "Milch und Milcherzeugnisse",
        "sellerie": "Sellerie und Sellerieerzeugnisse",
        "schwefel": "Schwefeldioxid und Sulfide"
      },
      "merkmale": {
        "schwein": "Schwein"
      },
      "naehrstoffe": "",
      "zusatzstoffe": [
        {
          "de": "Antioxidationsmittel",
          "en": "Antioxidation"
        },
        {
          "de": "Alkohol",
          "en": "Alcohol"
        }
      ],
      "PrintOrder": "1",
      "CO2Value": "3617.00",
      "CO2Rating": "D",
      "CO2Perc": "100.00",
      "ClimateFriendly": null,
      "GastDesc": "Gegrilltes Schweinefilet | Warmer Kartoffel-Kürbissalat | Pfefferjus",
      "date_de": "14.01.2026"
    },
    {
      "id": "5057296",
      "outlet": "canteen",
      "date": "2026-01-14",
      "CalendarWeek": "1",
      "day": "Mittwoch",
      "mealtime": "Mittagessen",
      "IdentNr": "12026011498003",
      "itemId": "17552",
      "RecipeID": "9063",
      "ProductPrice": "12.00",
      "ProductPrice_2": null,
      "GastDesc_de": "Winterwurzel-Eintopf | Estragon | Hoki",
      "GastDesc_en": "Winter Root Onepot | Tarragon | Hoki",
      "MenuName": "COUNTER 3.1 Fish",
      "allergene": {
        "fisch": "Fisch und Fischerzeugnisse",
        "milch": "Milch und Milcherzeugnisse",
        "sellerie": "Sellerie und Sellerieerzeugnisse"
      },
      "merkmale": "",
      "naehrstoffe": "",
      "zusatzstoffe": null,
      "PrintOrder": "3",
      "CO2Value": "1387.00",
      "CO2Rating": "B",
      "CO2Perc": "100.00",
      "ClimateFriendly": null,
      "GastDesc": "Winterwurzel-Eintopf | Estragon | Hoki",
      "date_de": "14.01.2026"
    },
    {
      "id": "5057297",
      "outlet": "canteen",
      "date": "2026-01-14",
      "CalendarWeek": "1",
      "day": "Mittwoch",
      "mealtime": "Mittagessen",
      "IdentNr": "12026011498005",
      "itemId": "17554",
      "RecipeID": "4568",
      "ProductPrice": "9.50",
      "ProductPrice_2": null,
      "GastDesc_de": "Tofu-Kung-Pao | Basmati-Reis | Erdnuss",
      "GastDesc_en": "Kung Pao tofu | Basmati rice | Peanuts",
      "MenuName": "COUNTER 4.1 Vegi",
      "allergene": {
        "gluten": "Glutenhaltiges Getreide",
        "soja": "Soja und Sojaerzeugnisse",
        "erdnuss": "Erdnüsse und Erdnusserzeugnisse",
        "sellerie": "Sellerie und Sellerieerzeugnisse"
      },
      "merkmale": {
        "vegan": "Vegan",
        "vegetarisch": "Vegetarisch"
      },
      "naehrstoffe": "",
      "zusatzstoffe": null,
      "PrintOrder": "5",
      "CO2Value": "999.00",
      "CO2Rating": "B",
      "CO2Perc": "100.00",
      "ClimateFriendly": null,
      "GastDesc": "Tofu-Kung-Pao | Basmati-Reis | Erdnuss",
      "date_de": "14.01.2026"
    },
    {
      "id": "5057298",
      "outlet": "canteen",
      "date": "2026-01-15",
      "CalendarWeek": "1",
      "day": "Donnerstag",
      "mealtime": "Mittagessen",
      "IdentNr": "12026011598000",
      "itemId": "17549",
      "RecipeID": "4302",
      "ProductPrice": "11.00",
      "ProductPrice_2": null,
      "GastDesc_de": "Spicy Ananas | Tofu | Quinoa",
      "GastDesc_en": "Spicy Pineapple | Tofu | Quinoa",
      "MenuName": "COUNTER 1.1 Bowls_",
      "allergene": {
        "gluten": "Glutenhaltiges Getreide",
        "schalenfruchte": "Schalenfrüchte und Schalenfruchterzeugnisse",
        "soja": "Soja und Sojaerzeugnisse"
      },
      "merkmale": {
        "veganuary": "Veganuary"
      },
      "naehrstoffe": "",
      "zusatzstoffe": [
        {
          "de": "Antioxidationsmittel",
          "en": "Antioxidation"
        }
      ],
      "PrintOrder": "0",
      "CO2Value": "562.00",
      "CO2Rating": "B",
      "CO2Perc": "100.00",
      "ClimateFriendly": null,
      "GastDesc": "Spicy Ananas | Tofu | Quinoa",
      "date_de": "15.01.2026"
    },
    {
      "id": "5057299",
      "outlet": "canteen",
      "date": "2026-01-15",
      "CalendarWeek": "1",
      "day": "Donnerstag",
      "mealtime": "Mittagessen",
      "IdentNr": "12026011598001",
      "itemId": "17550",
      "RecipeID": "8564",
      "ProductPrice": "12.00",
      "ProductPrice_2": null,
      "GastDesc_de": "Gegrilltes Schweinefilet | Warmer Kartoffel-Kürbissalat | Pfefferjus",
      "GastDesc_en": "Grilled Pork Tenderloin | Warm Potato Pumpkin salad | Pepperjus",
      "MenuName": "COUNTER 2.1 Meat",
      "allergene": {
        "schalenfruchte": "Schalenfrüchte und Schalenfruchterzeugnisse",
        "milch": "Milch und Milcherzeugnisse",
