{
  "daySelector": [
    {
      "date": "2026-02-22",
      "day": "Sonntag",
      "CalendarWeek": "8",
      "date_de": "22.02.2026"
    },
    {
      "date": "2026-02-23",
      "day": "Montag",
      "CalendarWeek": "9",
      "date_de": "23.02.2026"
    },
    {
      "date": "2026-02-24",
      "day": "Dienstag",
      "CalendarWeek": "9",
      "date_de": "24.02.2026"
    },
    {
      "date": "2026-02-25",
      "day": "Mittwoch",
      "CalendarWeek": "9",
      "date_de": "25.02.2026"
    },
    {
      "date": "2026-02-26",
      "day": "Donnerstag",
      "CalendarWeek": "9",
      "date_de": "26.02.2026"
    },
    {
      "date": "2026-02-27",
      "day": "Freitag",
      "CalendarWeek": "9",
      "date_de": "27.02.2026"
    },
    {
      "date": "2026-02-28",
      "day": "Samstag",
      "CalendarWeek": "9",
      "date_de": "28.02.2026"
    },
    {
      "date": "2026-03-01",
      "day": "Sonntag",
      "CalendarWeek": "9",
      "date_de": "01.03.2026"
    },
    {
      "date": "2026-03-02",
      "day": "Montag",
      "CalendarWeek": "9",
      "date_de": "02.03.2026"
    },
    {
      "date": "2026-03-03",
      "day": "Dienstag",
      "CalendarWeek": "9",
      "date_de": "03.03.2026"
    },
    {
      "date": "2026-03-04",
      "day": "Mittwoch",
      "CalendarWeek": "9",
      "date_de": "04.03.2026"
    },
    {
      "date": "2026-03-05",
      "day": "Donnerstag",
      "CalendarWeek": "9",
      "date_de": "05.03.2026"
    },
    {
      "date": "2026-03-06",
      "day": "Freitag",
      "CalendarWeek": "9",
      "date_de": "06.03.2026"
    },
    {
      "date": "2026-03-07",
      "day": "Samstag",
      "CalendarWeek": "9",
      "date_de": "07.03.2026"
    },
    {
      "date": "2026-03-08",
      "day": "Sonntag",
      "CalendarWeek": "9",
      "date_de": "08.03.2026"
    },
    {
      "date": "2026-03-09",
      "day": "Montag",
      "CalendarWeek": "9",
      "date_de": "09.03.2026"
    },
    {
      "date": "2026-03-10",
      "day": "Dienstag",
      "CalendarWeek": "9",
      "date_de": "10.03.2026"
    },
    {
      "date": "2026-03-11",
      "day": "Mittwoch",
      "CalendarWeek": "9",
      "date_de": "11.03.2026"
    },
    {
      "date": "2026-03-12",
      "day": "Donnerstag",
      "CalendarWeek": "9",
      "date_de": "12.03.2026"
    },
    {
      "date": "2026-03-13",
      "day": "Freitag",
      "CalendarWeek": "9",
      "date_de": "13.03.2026"
    }
  ],
  "data": [
    {
      "id": "5936191",
      "outlet": "cafe",
      "date": "2026-02-23",
      "CalendarWeek": "9",
      "day": "Montag",
      "mealtime": "Mittagessen",
      "IdentNr": "12026022398000",
      "itemId": "21060",
      "RecipeID": "8636",
      "ProductPrice": "2.10",
      "ProductPrice_2": null,
      "GastDesc_de": "Chocolate-Lava-Cookie",
      "GastDesc_en": "Chocolate Lava Cookies",
      "MenuName": "CHOCOLATE",
      "allergene": {
        "gluten": "Glutenhaltiges Getreide",
        "huhnerei": "Hühnerei und Hühnereierzeugnisse",
        "soja": "Soja und Sojaerzeugnisse",
        "milch": "Milch und Milcherzeugnisse"
      },
      "merkmale": "",
      "naehrstoffe": "",
      "zusatzstoffe": [
        {
          "de": "Farbstoff",
          "en": "Colouring Agent"
        },
        {
          "de": "Alkohol",
          "en": "Alcohol"
        }
      ],
      "PrintOrder": "0",
      "CO2Value": null,
      "CO2Rating": null,
      "CO2Perc": null,
      "ClimateFriendly": null,
      "GastDesc": "Chocolate-Lava-Cookie",
      "date_de": "23.02.2026"
    },
    {
      "id": "5936192",
      "outlet": "cafe",
      "date": "2026-02-23",
      "CalendarWeek": "9",
      "day": "Montag",
      "mealtime": "Mittagessen",
      "IdentNr": "12026022398001",
      "itemId": "21059",
      "RecipeID": "9238",
      "ProductPrice": "3.20",
      "ProductPrice_2": null,
      "GastDesc_de": "Heidelbeer-Vanille-Croffin",
      "GastDesc_en": "Blueberry Vanilla Croffin",
      "MenuName": "CROFFIN",
      "allergene": {
        "gluten": "Glutenhaltiges Getreide",
        "huhnerei": "Hühnerei und Hühnereierzeugnisse",
        "milch": "Milch und Milcherzeugnisse"
      },
      "merkmale": "",
      "naehrstoffe": "",
      "zusatzstoffe": [
        {
          "de": "Farbstoff",
          "en": "Colouring Agent"
        },
        {
          "de": "Konservierungsstoff",
          "en": "Preservatives"
        },
        {
          "de": "Alkohol",
          "en": "Alcohol"
        }
      ],
      "PrintOrder": "1",
      "CO2Value": null,
      "CO2Rating": null,
      "CO2Perc": null,
      "ClimateFriendly": null,
      "GastDesc": "Heidelbeer-Vanille-Croffin",
      "date_de": "23.02.2026"
    },
    {
      "id": "5936193",
      "outlet": "cafe",
      "date": "2026-02-23",
      "CalendarWeek": "9",
      "day": "Montag",
      "mealtime": "Mittagessen",
      "IdentNr": "12026022398002",
      "itemId": "21062",
      "RecipeID": "8871",
      "ProductPrice": "3.60",
      "ProductPrice_2": null,
      "GastDesc_de": "Baskischer Cheesecake mit Himbeerkompott",
      "GastDesc_en": "Basque-style Cheesecake with Raspberry Compote",
      "MenuName": "FAVOURITES",
      "allergene": {
        "huhnerei": "Hühnerei und Hühnereierzeugnisse",
        "milch": "Milch und Milcherzeugnisse"
      },
      "merkmale": "",
      "naehrstoffe": "",
      "zusatzstoffe": [
        {
          "de": "Farbstoff",
          "en": "Colouring Agent"
        },
        {
          "de": "Alkohol",
          "en": "Alcohol"
        }
      ],
      "PrintOrder": "2",
      "CO2Value": null,
      "CO2Rating": null,
      "CO2Perc": null,
      "ClimateFriendly": null,
      "GastDesc": "Baskischer Cheesecake mit Himbeerkompott",
      "date_de": "23.02.2026"
    },
    {
      "id": "5936194",
      "outlet": "cafe",
      "date": "2026-02-23",
      "CalendarWeek": "9",
      "day": "Montag",
      "mealtime": "Mittagessen",
      "IdentNr": "12026022398003",
      "itemId": "21063",
      "RecipeID": "8211",
      "ProductPrice": "0.50",
      "ProductPrice_2": null,
      "GastDesc_de": "LES ARLETTES (Französische Blätterteigkekse) Vegan",
      "GastDesc_en": "LES ARLETTES  (French Puff Pastry Cookies) Vegan",
      "MenuName": "MINIS",
      "allergene": {
        "gluten": "Glutenhaltiges Getreide"
      },
      "merkmale": {
        "vegan": "Vegan",
        "vegetarisch": "Vegetarisch"
      },
      "naehrstoffe": "",
      "zusatzstoffe": [
        {
          "de": "Farbstoff",
          "en": "Colouring Agent"
        },
        {
          "de": "Alkohol",
          "en": "Alcohol"
        }
      ],
      "PrintOrder": "3",
      "CO2Value": null,
      "CO2Rating": null,
      "CO2Perc": null,
      "ClimateFriendly": null,
      "GastDesc": "LES ARLETTES (Französische Blätterteigkekse) Vegan",
      "date_de": "23.02.2026"
    },
    {
      "id": "5936195",
      "outlet": "cafe",
      "date": "2026-02-23",
      "CalendarWeek": "9",
      "day": "Montag",
      "mealtime": "Mittagessen",
      "IdentNr": "12026022398005",
      "itemId": "21064",
      "RecipeID": "8330",
      "ProductPrice": "1.50",
      "ProductPrice_2": null,
      "GastDesc_de": "Saftige Brownie-Bananen-Cookies | Zuckerfrei",
      "GastDesc_en": "Fudgy Brownie Banana Cookies | Sugar-Free",
      "MenuName": "PEOPLES CHOICE",
      "allergene": {
        "erdnuss": "Erdnüsse und Erdnusserzeugnisse"
      },
      "merkmale": {
        "ohne_zucker": "Ohne_Zucker",
        "vegan": "Vegan",
        "vegetarisch": "Vegetarisch"
      },
      "naehrstoffe": "",
      "zusatzstoffe": null,
      "PrintOrder": "5",
      "CO2Value": null,
      "CO2Rating": null,
      "CO2Perc": null,
      "ClimateFriendly": null,
      "GastDesc": "Saftige Brownie-Bananen-Cookies | Zuckerfrei",
      "date_de": "23.02.2026"
    },
    {
      "id": "5936196",
      "outlet": "cafe",
      "date": "2026-02-23",
      "CalendarWeek": "9",
      "day": "Montag",
      "mealtime": "Mittagessen",
      "IdentNr": "12026022398006",
      "itemId": "21061",
      "RecipeID": "9237",
      "ProductPrice": "2.80",
      "ProductPrice_2": null,
      "GastDesc_de": "Hagebutten-Cookie | Vegan",
      "GastDesc_en": "Rosehip Cookie | Vegan",
      "MenuName": "SEASON",
      "allergene": {
        "gluten": "Glutenhaltiges Getreide",
        "schalenfruchte": "Schalenfrüchte und Schalenfruchterzeugnisse"
      },
      "merkmale": "",
      "naehrstoffe": "",
      "zusatzstoffe": [
        {
          "de": "Farbstoff",
          "en": "Colouring Agent"
        },
        {
          "de": "Antioxidationsmittel",
          "en": "Antioxidation"
        },
        {
          "de": "Konservierungsstoff",
          "en": "Preservatives"
        },
        {
          "de": "Alkohol",
          "en": "Alcohol"
        }
      ],
      "PrintOrder": "6",
      "CO2Value": null,
      "CO2Rating": null,
      "CO2Perc": null,
      "ClimateFriendly": null,
      "GastDesc": "Hagebutten-Cookie | Vegan",
      "date_de": "23.02.2026"
    },
    {
      "id": "5936197",
      "outlet": "cafe",
      "date": "2026-02-23",
      "CalendarWeek": "9",
      "day": "Montag",
      "mealtime": "Mittagessen",
      "IdentNr": "12026022398007",
      "itemId": "12776",
      "RecipeID": "8453",
      "ProductPrice": "2.50",
      "ProductPrice_2": null,
      "GastDesc_de": "Oreo-Cheesecake-Cookies",
      "GastDesc_en": "Oreo Cheesecake Cookies",
      "MenuName": "COOKIE",
      "allergene": {
        "gluten": "Glutenhaltiges Getreide",
        "huhnerei": "Hühnerei und Hühnereierzeugnisse",
        "milch": "Milch und Milcherzeugnisse"
      },
      "merkmale": "",
      "naehrstoffe": "",
      "zusatzstoffe": [
        {
          "de": "Farbstoff",
          "en": "Colouring Agent"
        },
        {
          "de": "Alkohol",
          "en": "Alcohol"
        }
      ],
      "PrintOrder": "7",
      "CO2Value": null,
      "CO2Rating": null,
      "CO2Perc": null,
      "ClimateFriendly": null,
      "GastDesc": "Oreo-Cheesecake-Cookies",
      "date_de": "23.02.2026"
    },
    {
      "id": "5936198",
      "outlet": "cafe",
      "date": "2026-02-23",
      "CalendarWeek": "9",
      "day": "Montag",
      "mealtime": "Mittagessen",
      "IdentNr": "12026022398008",
      "itemId": "12777",
      "RecipeID": "9121",
      "ProductPrice": "2.50",
      "ProductPrice_2": null,
      "GastDesc_de": "Carrot Cake Bananenbrot | Zuckerfrei",
      "GastDesc_en": "Carrot Cake Banana Bread | Sugar-Free",
      "MenuName": "TAG des KASTENKUCHENS",
      "allergene": {
        "gluten": "Glutenhaltiges Getreide",
        "huhnerei": "Hühnerei und Hühnereierzeugnisse",
        "milch": "Milch und Milcherzeugnisse",
        "schwefel": "Schwefeldioxid und Sulfide"
      },
      "merkmale": "",
      "naehrstoffe": "",
      "zusatzstoffe": [
        {
          "de": "Farbstoff",
          "en": "Colouring Agent"
        }
      ],
      "PrintOrder": "8",
      "CO2Value": null,
      "CO2Rating": null,
      "CO2Perc": null,
      "ClimateFriendly": null,
      "GastDesc": "Carrot Cake Bananenbrot | Zuckerfrei",
      "date_de": "23.02.2026"
    },
    {
      "id": "5936199",
      "outlet": "cafe",
      "date": "2026-02-23",
      "CalendarWeek": "9",
      "day": "Montag",
      "mealtime": "Mittagessen",
      "IdentNr": "12026022398011",
      "itemId": "16256",
      "RecipeID": "9122",
      "ProductPrice": "2.50",
      "ProductPrice_2": null,
      "GastDesc_de": "Sesam-Keks | Mehlfrei | Vegan",
      "GastDesc_en": "Sesame Cookie | Flour-Free | Vegan",
      "MenuName": "VEGAN SPECIAL",
      "allergene": {
        "schalenfruchte": "Schalenfrüchte und Schalenfruchterzeugnisse",
        "sesam": "Sesamsamen und Sesamsamenerzeugnisse"
      },
      "merkmale": "",
      "naehrstoffe": "",
      "zusatzstoffe": [
        {
          "de": "Farbstoff",
          "en": "Colouring Agent"
        },
        {
          "de": "Antioxidationsmittel",
          "en": "Antioxidation"
        },
        {
          "de": "Alkohol",
          "en": "Alcohol"
        }
      ],
      "PrintOrder": "11",
      "CO2Value": null,
      "CO2Rating": null,
      "CO2Perc": null,
      "ClimateFriendly": null,
      "GastDesc": "Sesam-Keks | Mehlfrei | Vegan",
      "date_de": "23.02.2026"
    },
    {
      "id": "5960942",
      "outlet": "cafe",
      "date": "2026-02-24",
      "CalendarWeek": "9",
      "day": "Dienstag",
      "mealtime": "Mittagessen",
      "IdentNr": "12026022498000",
      "itemId": "21060",
      "RecipeID": "8636",
      "ProductPrice": "2.10",
      "ProductPrice_2": null,
      "GastDesc_de": "Chocolate-Lava-Cookie",
      "GastDesc_en": "Chocolate Lava Cookies",
      "MenuName": "CHOCOLATE",
      "allergene": {
        "gluten": "Glutenhaltiges Getreide",
        "huhnerei": "Hühnerei und Hühnereierzeugnisse",
        "soja": "Soja und Sojaerzeugnisse",
        "milch": "Milch und Milcherzeugnisse"
      },
      "merkmale": "",
      "naehrstoffe": "",
      "zusatzstoffe": [
        {
          "de": "Farbstoff",
          "en": "Colouring Agent"
        },
        {
          "de": "Alkohol",
          "en": "Alcohol"
        }
      ],
      "PrintOrder": "0",
      "CO2Value": null,
      "CO2Rating": null,
      "CO2Perc": null,
      "ClimateFriendly": null,
      "GastDesc": "Chocolate-Lava-Cookie",
      "date_de": "24.02.2026"
    },
    {
      "id": "5960943",
      "outlet": "cafe",
      "date": "2026-02-24",
      "CalendarWeek": "9",
      "day": "Dienstag",
      "mealtime": "Mittagessen",
      "IdentNr": "12026022498001",
      "itemId": "21059",
      "RecipeID": "9238",
      "ProductPrice": "3.20",
      "ProductPrice_2": null,
      "GastDesc_de": "Heidelbeer-Vanille-Croffin",
      "GastDesc_en": "Blueberry Vanilla Croffin",
      "MenuName": "CROFFIN",
      "allergene": {
        "gluten": "Glutenhaltiges Getreide",
        "huhnerei": "Hühnerei und Hühnereierzeugnisse",
        "milch": "Milch und Milcherzeugnisse"
      },
      "merkmale": "",
      "naehrstoffe": "",
      "zusatzstoffe": [
        {
          "de": "Farbstoff",
          "en": "Colouring Agent"
        },
        {
          "de": "Konservierungsstoff",
          "en": "Preservatives"
        },
        {
          "de": "Alkohol",
          "en": "Alcohol"
        }
      ],
      "PrintOrder": "1",
      "CO2Value": null,
      "CO2Rating": null,
      "CO2Perc": null,
      "ClimateFriendly": null,
      "GastDesc": "Heidelbeer-Vanille-Croffin",
      "date_de": "24.02.2026"
    },
    {
      "id": "5960944",
      "outlet": "cafe",
      "date": "2026-02-24",
      "CalendarWeek": "9",
      "day": "Dienstag",
      "mealtime": "Mittagessen",
      "IdentNr": "12026022498002",
      "itemId": "21062",
      "RecipeID": "8871",
      "ProductPrice": "3.60",
      "ProductPrice_2": null,
      "GastDesc_de": "Baskischer Cheesecake mit Himbeerkompott",
      "GastDesc_en": "Basque-style Cheesecake with Raspberry Compote",
      "MenuName": "FAVOURITES",
      "allergene": {
        "huhnerei": "Hühnerei und Hühnereierzeugnisse",
        "milch": "Milch und Milcherzeugnisse"
      },
      "merkmale": "",
      "naehrstoffe": "",
      "zusatzstoffe": [
        {
          "de": "Farbstoff",
          "en": "Colouring Agent"
        },
        {
          "de": "Alkohol",
          "en": "Alcohol"
        }
      ],
      "PrintOrder": "2",
      "CO2Value": null,
      "CO2Rating": null,
      "CO2Perc": null,
      "ClimateFriendly": null,
      "GastDesc": "Baskischer Cheesecake mit Himbeerkompott",
      "date_de": "24.02.2026"
    },
    {
      "id": "5960945",
      "outlet": "cafe",
      "date": "2026-02-24",
      "CalendarWeek": "9",
      "day": "Dienstag",
      "mealtime": "Mittagessen",
      "IdentNr": "12026022498003",
      "itemId": "21063",
      "RecipeID": "8211",
      "ProductPrice": "0.50",
      "ProductPrice_2": null,
      "GastDesc_de": "LES ARLETTES (Französische Blätterteigkekse) Vegan",
      "GastDesc_en": "LES ARLETTES  (French Puff Pastry Cookies) Vegan",
      "MenuName": "MINIS",
      "allergene": {
        "gluten": "Glutenhaltiges Getreide"
      },
      "merkmale": {
        "vegan": "Vegan",
        "vegetarisch": "Vegetarisch"
      },
      "naehrstoffe": "",
      "zusatzstoffe": [
        {
          "de": "Farbstoff",
          "en": "Colouring Agent"
        },
        {
          "de": "Alkohol",
          "en": "Alcohol"
        }
      ],
      "PrintOrder": "3",
      "CO2Value": null,
      "CO2Rating": null,
      "CO2Perc": null,
      "ClimateFriendly": null,
      "GastDesc": "LES ARLETTES (Französische Blätterteigkekse) Vegan",
      "date_de": "24.02.2026"
    },
    {
      "id": "5960946",
      "outlet": "cafe",
      "date": "2026-02-24",
      "CalendarWeek": "9",
      "day": "Dienstag",
      "mealtime": "Mittagessen",
      "IdentNr": "12026022498005",
      "itemId": "21064",
      "RecipeID": "8330",
      "ProductPrice": "1.50",
      "ProductPrice_2": null,
      "GastDesc_de": "Saftige Brownie-Bananen-Cookies | Zuckerfrei",
      "GastDesc_en": "Fudgy Brownie Banana Cookies | Sugar-Free",
      "MenuName": "PEOPLES CHOICE",
      "allergene": {
        "erdnuss": "Erdnüsse und Erdnusserzeugnisse"
      },
      "merkmale": {
        "ohne_zucker": "Ohne_Zucker",
        "vegan": "Vegan",
        "vegetarisch": "Vegetarisch"
      },
      "naehrstoffe": "",
      "zusatzstoffe": null,
      "PrintOrder": "5",
      "CO2Value": null,
      "CO2Rating": null,
      "CO2Perc": null,
      "ClimateFriendly": null,
      "GastDesc": "Saftige Brownie-Bananen-Cookies | Zuckerfrei",
      "date_de": "24.02.2026"
    },
    {
      "id": "5960947",
      "outlet": "cafe",
      "date": "2026-02-24",
      "CalendarWeek": "9",
      "day": "Dienstag",
      "mealtime": "Mittagessen",
      "IdentNr": "12026022498006",
      "itemId": "21061",
      "RecipeID": "9237",
      "ProductPrice": "2.80",
      "ProductPrice_2": null,
      "GastDesc_de": "Hagebutten-Cookie | Vegan",
      "GastDesc_en": "Rosehip Cookie | Vegan",
      "MenuName": "SEASON",
      "allergene": {
        "gluten": "Glutenhaltiges Getreide",
        "schalenfruchte": "Schalenfrüchte und Schalenfruchterzeugnisse"
      },
      "merkmale": "",
      "naehrstoffe": "",
      "zusatzstoffe": [
        {
          "de": "Farbstoff",
          "en": "Colouring Agent"
        },
        {
          "de": "Antioxidationsmittel",
          "en": "Antioxidation"
        },
        {
          "de": "Konservierungsstoff",
          "en": "Preservatives"
        },
        {
          "de": "Alkohol",
          "en": "Alcohol"
        }
      ],
      "PrintOrder": "6",
      "CO2Value": null,
      "CO2Rating": null,
      "CO2Perc": null,
      "ClimateFriendly": null,
      "GastDesc": "Hagebutten-Cookie | Vegan",
      "date_de": "24.02.2026"
    },
    {
      "id": "5960948",
      "outlet": "cafe",
      "date": "2026-02-24",
      "CalendarWeek": "9",
      "day": "Dienstag",
      "mealtime": "Mittagessen",
      "IdentNr": "12026022498007",
      "itemId": "12776",
      "RecipeID": "8453",
      "ProductPrice": "2.50",
      "ProductPrice_2": null,
      "GastDesc_de": "Oreo-Cheesecake-Cookies",
      "GastDesc_en": "Oreo Cheesecake Cookies",
      "MenuName": "COOKIE",
      "allergene": {
        "gluten": "Glutenhaltiges Getreide",
        "huhnerei": "Hühnerei und Hühnereierzeugnisse",
        "milch": "Milch und Milcherzeugnisse"
      },
      "merkmale": "",
      "naehrstoffe": "",
      "zusatzstoffe": [
        {
          "de": "Farbstoff",
          "en": "Colouring Agent"
        },
        {
          "de": "Alkohol",
          "en": "Alcohol"
        }
      ],
      "PrintOrder": "7",
      "CO2Value": null,
      "CO2Rating": null,
      "CO2Perc": null,
      "ClimateFriendly": null,
      "GastDesc": "Oreo-Cheesecake-Cookies",
      "date_de": "24.02.2026"
    },
    {
      "id": "5960949",
      "outlet": "cafe",
      "date": "2026-02-24",
      "CalendarWeek": "9",
      "day": "Dienstag",
      "mealtime": "Mittagessen",
      "IdentNr": "12026022498008",
      "itemId": "12777",
      "RecipeID": "9121",
      "ProductPrice": "2.50",
      "ProductPrice_2": null,
      "GastDesc_de": "Carrot Cake Bananenbrot | Zuckerfrei",
      "GastDesc_en": "Carrot Cake Banana Bread | Sugar-Free",
      "MenuName": "TAG des KASTENKUCHENS",
      "allergene": {
        "gluten": "Glutenhaltiges Getreide",
        "huhnerei": "Hühnerei und Hühnereierzeugnisse",
        "milch": "Milch und Milcherzeugnisse",
        "schwefel": "Schwefeldioxid und Sulfide"
      },
      "merkmale": "",
      "naehrstoffe": "",
      "zusatzstoffe": [
        {
          "de": "Farbstoff",
          "en": "Colouring Agent"
        }
      ],
      "PrintOrder": "8",
      "CO2Value": null,
      "CO2Rating": null,
      "CO2Perc": null,
      "ClimateFriendly": null,
      "GastDesc": "Carrot Cake Bananenbrot | Zuckerfrei",
      "date_de": "24.02.2026"
    },
    {
      "id": "5960950",
      "outlet": "cafe",
      "date": "2026-02-24",
      "CalendarWeek": "9",
      "day": "Dienstag",
      "mealtime": "Mittagessen",
      "IdentNr": "12026022498011",
      "itemId": "16256",
      "RecipeID": "9122",
      "ProductPrice": "2.50",
      "ProductPrice_2": null,
      "GastDesc_de": "Sesam-Keks | Mehlfrei | Vegan",
      "GastDesc_en": "Sesame Cookie | Flour-Free | Vegan",
      "MenuName": "VEGAN SPECIAL",
      "allergene": {
        "schalenfruchte": "Schalenfrüchte und Schalenfruchterzeugnisse",
        "sesam": "Sesamsamen und Sesamsamenerzeugnisse"
      },
      "merkmale": "",
      "naehrstoffe": "",
      "zusatzstoffe": [
        {
          "de": "Farbstoff",
          "en": "Colouring Agent"
        },
        {
          "de": "Antioxidationsmittel",
          "en": "Antioxidation"
        },
        {
          "de": "Alkohol",
          "en": "Alcohol"
        }
      ],
      "PrintOrder": "11",
      "CO2Value": null,
      "CO2Rating": null,
      "CO2Perc": null,
      "ClimateFriendly": null,
      "GastDesc": "Sesam-Keks | Mehlfrei | Vegan",
      "date_de": "24.02.2026"
    },
    {
      "id": "5982905",
      "outlet": "cafe",
      "date": "2026-02-25",
      "CalendarWeek": "9",
      "day": "Mittwoch",
      "mealtime": "Mittagessen",
      "IdentNr": "12026022598000",
      "itemId": "21060",
      "RecipeID": "8636",
      "ProductPrice": "2.10",
      "ProductPrice_2": null,
      "GastDesc_de": "Chocolate-Lava-Cookie",
      "GastDesc_en": "Chocolate Lava Cookies",
      "MenuName": "CHOCOLATE",
      "allergene": {
        "gluten": "Glutenhaltiges Getreide",
        "huhnerei": "Hühnerei und Hühnereierzeugnisse",
        "soja": "Soja und Sojaerzeugnisse",
        "milch": "Milch und Milcherzeugnisse"
      },
      "merkmale": "",
      "naehrstoffe": "",
      "zusatzstoffe": [
        {
          "de": "Farbstoff",
          "en": "Colouring Agent"
        },
        {
          "de": "Alkohol",
          "en": "Alcohol"
        }
      ],
      "PrintOrder": "0",
      "CO2Value": null,
      "CO2Rating": null,
      "CO2Perc": null,
      "ClimateFriendly": null,
      "GastDesc": "Chocolate-Lava-Cookie",
      "date_de": "25.02.2026"
    },
    {
      "id": "5982906",
      "outlet": "cafe",
      "date": "2026-02-25",
      "CalendarWeek": "9",
      "day": "Mittwoch",
      "mealtime": "Mittagessen",
      "IdentNr": "12026022598001",
      "itemId": "21059",
      "RecipeID": "9238",
      "ProductPrice": "3.20",
      "ProductPrice_2": null,
      "GastDesc_de": "Heidelbeer-Vanille-Croffin",
      "GastDesc_en": "Blueberry Vanilla Croffin",
      "MenuName": "CROFFIN",
      "allergene": {
        "gluten": "Glutenhaltiges Getreide",
        "huhnerei": "Hühnerei und Hühnereierzeugnisse",
        "milch": "Milch und Milcherzeugnisse"
      },
      "merkmale": "",
      "naehrstoffe": "",
      "zusatzstoffe": [
        {
          "de": "Farbstoff",
          "en": "Colouring Agent"
        },
        {
          "de": "Konservierungsstoff",
          "en": "Preservatives"
        },
        {
          "de": "Alkohol",
          "en": "Alcohol"
        }
      ],
      "PrintOrder": "1",
      "CO2Value": null,
      "CO2Rating": null,
      "CO2Perc": null,
      "ClimateFriendly": null,
      "GastDesc": "Heidelbeer-Vanille-Croffin",
      "date_de": "25.02.2026"
    },
    {
      "id": "5982907",
      "outlet": "cafe",
      "date": "2026-02-25",
      "CalendarWeek": "9",
      "day": "Mittwoch",
      "mealtime": "Mittagessen",
      "IdentNr": "12026022598002",
      "itemId": "21062",
      "RecipeID": "8871",
      "ProductPrice": "3.60",
      "ProductPrice_2": null,
      "GastDesc_de": "Baskischer Cheesecake mit Himbeerkompott",
      "GastDesc_en": "Basque-style Cheesecake with Raspberry Compote",
      "MenuName": "FAVOURITES",
      "allergene": {
        "huhnerei": "Hühnerei und Hühnereierzeugnisse",
        "milch": "Milch und Milcherzeugnisse"
      },
      "merkmale": "",
      "naehrstoffe": "",
      "zusatzstoffe": [
        {
          "de": "Farbstoff",
          "en": "Colouring Agent"
        },
        {
          "de": "Alkohol",
          "en": "Alcohol"
        }
      ],
      "PrintOrder": "2",
      "CO2Value": null,
      "CO2Rating": null,
      "CO2Perc": null,
      "ClimateFriendly": null,
      "GastDesc": "Baskischer Cheesecake mit Himbeerkompott",
      "date_de": "25.02.2026"
    },
    {
      "id": "5982908",
      "outlet": "cafe",
      "date": "2026-02-25",
      "CalendarWeek": "9",
      "day": "Mittwoch",
      "mealtime": "Mittagessen",
      "IdentNr": "12026022598003",
      "itemId": "21063",
      "RecipeID": "8211",
      "ProductPrice": "0.50",
      "ProductPrice_2": null,
      "GastDesc_de": "LES ARLETTES (Französische Blätterteigkekse) Vegan",
      "GastDesc_en": "LES ARLETTES  (French Puff Pastry Cookies) Vegan",
      "MenuName": "MINIS",
      "allergene": {
        "gluten": "Glutenhaltiges Getreide"
      },
      "merkmale": {
        "vegan": "Vegan",
        "vegetarisch": "Vegetarisch"
      },
      "naehrstoffe": "",
      "zusatzstoffe": [
        {
          "de": "Farbstoff",
          "en": "Colouring Agent"
        },
        {
          "de": "Alkohol",
          "en": "Alcohol"
        }
      ],
      "PrintOrder": "3",
      "CO2Value": null,
      "CO2Rating": null,
      "CO2Perc": null,
      "ClimateFriendly": null,
      "GastDesc": "LES ARLETTES (Französische Blätterteigkekse) Vegan",
      "date_de": "25.02.2026"
    },
    {
      "id": "5982909",
      "outlet": "cafe",
      "date": "2026-02-25",
      "CalendarWeek": "9",
      "day": "Mittwoch",
      "mealtime": "Mittagessen",
      "IdentNr": "12026022598005",
      "itemId": "21064",
      "RecipeID": "8330",
      "ProductPrice": "1.50",
      "ProductPrice_2": null,
      "GastDesc_de": "Saftige Brownie-Bananen-Cookies | Zuckerfrei",
      "GastDesc_en": "Fudgy Brownie Banana Cookies | Sugar-Free",
      "MenuName": "PEOPLES CHOICE",
      "allergene": {
        "erdnuss": "Erdnüsse und Erdnusserzeugnisse"
      },
      "merkmale": {
        "ohne_zucker": "Ohne_Zucker",
        "vegan": "Vegan",
        "vegetarisch": "Vegetarisch"
      },
      "naehrstoffe": "",
      "zusatzstoffe": null,
      "PrintOrder": "5",
      "CO2Value": null,
      "CO2Rating": null,
      "CO2Perc": null,
      "ClimateFriendly": null,
      "GastDesc": "Saftige Brownie-Bananen-Cookies | Zuckerfrei",
      "date_de": "25.02.2026"
    },
    {
      "id": "5982910",
      "outlet": "cafe",
      "date": "2026-02-25",
      "CalendarWeek": "9",
      "day": "Mittwoch",
      "mealtime": "Mittagessen",
      "IdentNr": "12026022598006",
      "itemId": "21061",
      "RecipeID": "9237",
      "ProductPrice": "2.80",
      "ProductPrice_2": null,
      "GastDesc_de": "Hagebutten-Cookie | Vegan",
      "GastDesc_en": "Rosehip Cookie | Vegan",
      "MenuName": "SEASON",
      "allergene": {
        "gluten": "Glutenhaltiges Getreide",
        "schalenfruchte": "Schalenfrüchte und Schalenfruchterzeugnisse"
      },
      "merkmale": "",
      "naehrstoffe": "",
      "zusatzstoffe": [
        {
          "de": "Farbstoff",
          "en": "Colouring Agent"
        },
        {
          "de": "Antioxidationsmittel",
          "en": "Antioxidation"
        },
        {
          "de": "Konservierungsstoff",
          "en": "Preservatives"
        },
        {
          "de": "Alkohol",
          "en": "Alcohol"
        }
      ],
      "PrintOrder": "6",
      "CO2Value": null,
      "CO2Rating": null,
      "CO2Perc": null,
      "ClimateFriendly": null,
      "GastDesc": "Hagebutten-Cookie | Vegan",
      "date_de": "25.02.2026"
    },
    {
      "id": "5982911",
      "outlet": "cafe",
      "date": "2026-02-25",
      "CalendarWeek": "9",
      "day": "Mittwoch",
      "mealtime": "Mittagessen",
      "IdentNr": "12026022598007",
      "itemId": "12776",
      "RecipeID": "8453",
      "ProductPrice": "2.50",
      "ProductPrice_2": null,
      "GastDesc_de": "Oreo-Cheesecake-Cookies",
      "GastDesc_en": "Oreo Cheesecake Cookies",
      "MenuName": "COOKIE",
      "allergene": {
        "gluten": "Glutenhaltiges Getreide",
        "huhnerei": "Hühnerei und Hühnereierzeugnisse",
        "milch": "Milch und Milcherzeugnisse"
      },
      "merkmale": "",
      "naehrstoffe": "",
      "zusatzstoffe": [
        {
          "de": "Farbstoff",
          "en": "Colouring Agent"
        },
        {
          "de": "Alkohol",
          "en": "Alcohol"
        }
      ],
      "PrintOrder": "7",
      "CO2Value": null,
      "CO2Rating": null,
      "CO2Perc": null,
      "ClimateFriendly": null,
      "GastDesc": "Oreo-Cheesecake-Cookies",
      "date_de": "25.02.2026"
    },
    {
      "id": "5982912",
      "outlet": "cafe",
      "date": "2026-02-25",
      "CalendarWeek": "9",
      "day": "Mittwoch",
      "mealtime": "Mittagessen",
      "IdentNr": "12026022598008",
      "itemId": "12777",
      "RecipeID": "9121",
      "ProductPrice": "2.50",
      "ProductPrice_2": null,
      "GastDesc_de": "Carrot Cake Bananenbrot | Zuckerfrei",
      "GastDesc_en": "Carrot Cake Banana Bread | Sugar-Free",
      "MenuName": "TAG des KASTENKUCHENS",
      "allergene": {
        "gluten": "Glutenhaltiges Getreide",
        "huhnerei": "Hühnerei und Hühnereierzeugnisse",
        "milch": "Milch und Milcherzeugnisse",
        "schwefel": "Schwefeldioxid und Sulfide"
      },
      "merkmale": "",
      "naehrstoffe": "",
      "zusatzstoffe": [
        {
          "de": "Farbstoff",
          "en": "Colouring Agent"
        }
      ],
      "PrintOrder": "8",
      "CO2Value": null,
      "CO2Rating": null,
      "CO2Perc": null,
      "ClimateFriendly": null,
      "GastDesc": "Carrot Cake Bananenbrot | Zuckerfrei",
      "date_de": "25.02.2026"
    },
    {
      "id": "5982913",
      "outlet": "cafe",
      "date": "2026-02-25",
      "CalendarWeek": "9",
      "day": "Mittwoch",
      "mealtime": "Mittagessen",
      "IdentNr": "12026022598011",
      "itemId": "16256",
      "RecipeID": "9122",
      "ProductPrice": "2.50",
      "ProductPrice_2": null,
      "GastDesc_de": "Sesam-Keks | Mehlfrei | Vegan",
      "GastDesc_en": "Sesame Cookie | Flour-Free | Vegan",
      "MenuName": "VEGAN SPECIAL",
      "allergene": {
        "schalenfruchte": "Schalenfrüchte und Schalenfruchterzeugnisse",
        "sesam": "Sesamsamen und Sesamsamenerzeugnisse"
      },
      "merkmale": "",
      "naehrstoffe": "",
      "zusatzstoffe": [
        {
          "de": "Farbstoff",
          "en": "Colouring Agent"
        },
        {
          "de": "Antioxidationsmittel",
          "en": "Antioxidation"
        },
        {
          "de": "Alkohol",
          "en": "Alcohol"
        }
      ],
      "PrintOrder": "11",
      "CO2Value": null,
      "CO2Rating": null,
      "CO2Perc": null,
      "ClimateFriendly": null,
      "GastDesc": "Sesam-Keks | Mehlfrei | Vegan",
      "date_de": "25.02.2026"
    },
    {
      "id": "6007006",
      "outlet": "cafe",
      "date": "2026-02-26",
      "CalendarWeek": "9",
      "day": "Donnerstag",
      "mealtime": "Mittagessen",
      "IdentNr": "12026022698000",
      "itemId": "21060",
      "RecipeID": "8636",
      "ProductPrice": "2.10",
      "ProductPrice_2": null,
      "GastDesc_de": "Chocolate-Lava-Cookie",
      "GastDesc_en": "Chocolate Lava Cookies",
      "MenuName": "CHOCOLATE",
      "allergene": {
        "gluten": "Glutenhaltiges Getreide",
        "huhnerei": "Hühnerei und Hühnereierzeugnisse",
        "soja": "Soja und Sojaerzeugnisse",
        "milch": "Milch und Milcherzeugnisse"
      },
      "merkmale": "",
      "naehrstoffe": "",
      "zusatzstoffe": [
        {
          "de": "Farbstoff",
          "en": "Colouring Agent"
        },
        {
          "de": "Alkohol",
          "en": "Alcohol"
        }
      ],
      "PrintOrder": "0",
      "CO2Value": null,
      "CO2Rating": null,
      "CO2Perc": null,
      "ClimateFriendly": null,
      "GastDesc": "Chocolate-Lava-Cookie",
      "date_de": "26.02.2026"
    },
    {
      "id": "6007007",
      "outlet": "cafe",
      "date": "2026-02-26",
      "CalendarWeek": "9",
      "day": "Donnerstag",
      "mealtime": "Mittagessen",
      "IdentNr": "12026022698001",
      "itemId": "21059",
      "RecipeID": "9238",
      "ProductPrice": "3.20",
      "ProductPrice_2": null,
      "GastDesc_de": "Heidelbeer-Vanille-Croffin",
      "GastDesc_en": "Blueberry Vanilla Croffin",
      "MenuName": "CROFFIN",
      "allergene": {
        "gluten": "Glutenhaltiges Getreide",
        "huhnerei": "Hühnerei und Hühnereierzeugnisse",
        "milch": "Milch und Milcherzeugnisse"
      },
      "merkmale": "",
      "naehrstoffe": "",
      "zusatzstoffe": [
        {
          "de": "Farbstoff",
          "en": "Colouring Agent"
        },
        {
          "de": "Konservierungsstoff",
          "en": "Preservatives"
        },
        {
          "de": "Alkohol",
          "en": "Alcohol"
        }
      ],
      "PrintOrder": "1",
      "CO2Value": null,
      "CO2Rating": null,
      "CO2Perc": null,
      "ClimateFriendly": null,
      "GastDesc": "Heidelbeer-Vanille-Croffin",
      "date_de": "26.02.2026"
    },
    {
      "id": "6007008",
      "outlet": "cafe",
      "date": "2026-02-26",
      "CalendarWeek": "9",
      "day": "Donnerstag",
      "mealtime": "Mittagessen",
      "IdentNr": "12026022698002",
      "itemId": "21062",
      "RecipeID": "8871",
      "ProductPrice": "3.60",
      "ProductPrice_2": null,
      "GastDesc_de": "Baskischer Cheesecake mit Himbeerkompott",
      "GastDesc_en": "Basque-style Cheesecake with Raspberry Compote",
      "MenuName": "FAVOURITES",
      "allergene": {
        "huhnerei": "Hühnerei und Hühnereierzeugnisse",
        "milch": "Milch und Milcherzeugnisse"
      },
      "merkmale": "",
      "naehrstoffe": "",
      "zusatzstoffe": [
        {
          "de": "Farbstoff",
          "en": "Colouring Agent"
        },
        {
          "de": "Alkohol",
          "en": "Alcohol"
        }
      ],
      "PrintOrder": "2",
      "CO2Value": null,
      "CO2Rating": null,
      "CO2Perc": null,
      "ClimateFriendly": null,
      "GastDesc": "Baskischer Cheesecake mit Himbeerkompott",
      "date_de": "26.02.2026"
    },
    {
      "id": "6007009",
      "outlet": "cafe",
      "date": "2026-02-26",
      "CalendarWeek": "9",
      "day": "Donnerstag",
      "mealtime": "Mittagessen",
      "IdentNr": "12026022698003",
      "itemId": "21063",
      "RecipeID": "8211",
      "ProductPrice": "0.50",
      "ProductPrice_2": null,
      "GastDesc_de": "LES ARLETTES (Französische Blätterteigkekse) Vegan",
      "GastDesc_en": "LES ARLETTES  (French Puff Pastry Cookies) Vegan",
      "MenuName": "MINIS",
      "allergene": {
        "gluten": "Glutenhaltiges Getreide"
      },
      "merkmale": {
        "vegan": "Vegan",
        "vegetarisch": "Vegetarisch"
      },
      "naehrstoffe": "",
      "zusatzstoffe": [
        {
          "de": "Farbstoff",
          "en": "Colouring Agent"
        },
        {
          "de": "Alkohol",
          "en": "Alcohol"
        }
      ],
      "PrintOrder": "3",
      "CO2Value": null,
      "CO2Rating": null,
      "CO2Perc": null,
      "ClimateFriendly": null,
      "GastDesc": "LES ARLETTES (Französische Blätterteigkekse) Vegan",
      "date_de": "26.02.2026"
    },
    {
      "id": "6007010",
      "outlet": "cafe",
      "date": "2026-02-26",
      "CalendarWeek": "9",
      "day": "Donnerstag",
      "mealtime": "Mittagessen",
      "IdentNr": "12026022698005",
      "itemId": "21064",
      "RecipeID": "8330",
      "ProductPrice": "1.50",
      "ProductPrice_2": null,
      "GastDesc_de": "Saftige Brownie-Bananen-Cookies | Zuckerfrei",
      "GastDesc_en": "Fudgy Brownie Banana Cookies | Sugar-Free",
      "MenuName": "PEOPLES CHOICE",
      "allergene": {
        "erdnuss": "Erdnüsse und Erdnusserzeugnisse"
      },
      "merkmale": {
        "ohne_zucker": "Ohne_Zucker",
        "vegan": "Vegan",
        "vegetarisch": "Vegetarisch"
      },
      "naehrstoffe": "",
      "zusatzstoffe": null,
      "PrintOrder": "5",
      "CO2Value": null,
      "CO2Rating": null,
      "CO2Perc": null,
      "ClimateFriendly": null,
      "GastDesc": "Saftige Brownie-Bananen-Cookies | Zuckerfrei",
      "date_de": "26.02.2026"
    },
    {
      "id": "6007011",
      "outlet": "cafe",
      "date": "2026-02-26",
      "CalendarWeek": "9",
      "day": "Donnerstag",
      "mealtime": "Mittagessen",
      "IdentNr": "12026022698006",
      "itemId": "21061",
      "RecipeID": "9237",
      "ProductPrice": "2.80",
      "ProductPrice_2": null,
      "GastDesc_de": "Hagebutten-Cookie | Vegan",
      "GastDesc_en": "Rosehip Cookie | Vegan",
      "MenuName": "SEASON",
      "allergene": {
        "gluten": "Glutenhaltiges Getreide",
        "schalenfruchte": "Schalenfrüchte und Schalenfruchterzeugnisse"
      },
      "merkmale": "",
      "naehrstoffe": "",
      "zusatzstoffe": [
        {
          "de": "Farbstoff",
          "en": "Colouring Agent"
        },
        {
          "de": "Antioxidationsmittel",
          "en": "Antioxidation"
        },
        {
          "de": "Konservierungsstoff",
          "en": "Preservatives"
        },
        {
          "de": "Alkohol",
          "en": "Alcohol"
        }
      ],
      "PrintOrder": "6",
      "CO2Value": null,
      "CO2Rating": null,
      "CO2Perc": null,
      "ClimateFriendly": null,
      "GastDesc": "Hagebutten-Cookie | Vegan",
      "date_de": "26.02.2026"
    },
    {
      "id": "6007012",
      "outlet": "cafe",
      "date": "2026-02-26",
      "CalendarWeek": "9",
      "day": "Donnerstag",
      "mealtime": "Mittagessen",
      "IdentNr": "12026022698007",
      "itemId": "12776",
      "RecipeID": "8453",
      "ProductPrice": "2.50",
      "ProductPrice_2": null,
      "GastDesc_de": "Oreo-Cheesecake-Cookies",
      "GastDesc_en": "Oreo Cheesecake Cookies",
      "MenuName": "COOKIE",
      "allergene": {
        "gluten": "Glutenhaltiges Getreide",
        "huhnerei": "Hühnerei und Hühnereierzeugnisse",
        "milch": "Milch und Milcherzeugnisse"
      },
      "merkmale": "",
      "naehrstoffe": "",
      "zusatzstoffe": [
        {
          "de": "Farbstoff",
          "en": "Colouring Agent"
        },
        {
          "de": "Alkohol",
          "en": "Alcohol"
        }
      ],
      "PrintOrder": "7",
      "CO2Value": null,
      "CO2Rating": null,
      "CO2Perc": null,
      "ClimateFriendly": null,
      "GastDesc": "Oreo-Cheesecake-Cookies",
      "date_de": "26.02.2026"
    },
    {
      "id": "6007013",
      "outlet": "cafe",
      "date": "2026-02-26",
      "CalendarWeek": "9",
      "day": "Donnerstag",
      "mealtime": "Mittagessen",
      "IdentNr": "12026022698008",
      "itemId": "12777",
      "RecipeID": "9121",
      "ProductPrice": "2.50",
      "ProductPrice_2": null,
      "GastDesc_de": "Carrot Cake Bananenbrot | Zuckerfrei",
      "GastDesc_en": "Carrot Cake Banana Bread | Sugar-Free",
      "MenuName": "TAG des KASTENKUCHENS",
      "allergene": {
        "gluten": "Glutenhaltiges Getreide",
        "huhnerei": "Hühnerei und Hühnereierzeugnisse",
        "milch": "Milch und Milcherzeugnisse",
        "schwefel": "Schwefeldioxid und Sulfide"
      },
      "merkmale": "",
      "naehrstoffe": "",
      "zusatzstoffe": [
        {
          "de": "Farbstoff",
          "en": "Colouring Agent"
        }
      ],
      "PrintOrder": "8",
      "CO2Value": null,
      "CO2Rating": null,
      "CO2Perc": null,
      "ClimateFriendly": null,
      "GastDesc": "Carrot Cake Bananenbrot | Zuckerfrei",
      "date_de": "26.02.2026"
    },
    {
      "id": "6007014",
      "outlet": "cafe",
      "date": "2026-02-26",
      "CalendarWeek": "9",
      "day": "Donnerstag",
      "mealtime": "Mittagessen",
      "IdentNr": "12026022698011",
      "itemId": "16256",
      "RecipeID": "9122",
      "ProductPrice": "2.50",
      "ProductPrice_2": null,
      "GastDesc_de": "Sesam-Keks | Mehlfrei | Vegan",
      "GastDesc_en": "Sesame Cookie | Flour-Free | Vegan",
      "MenuName": "VEGAN SPECIAL",
      "allergene": {
        "schalenfruchte": "Schalenfrüchte und Schalenfruchterzeugnisse",
        "sesam": "Sesamsamen und Sesamsamenerzeugnisse"
      },
      "merkmale": "",
      "naehrstoffe": "",
      "zusatzstoffe": [
        {
          "de": "Farbstoff",
          "en": "Colouring Agent"
        },
        {
          "de": "Antioxidationsmittel",
          "en": "Antioxidation"
        },
        {
          "de": "Alkohol",
          "en": "Alcohol"
        }
      ],
      "PrintOrder": "11",
      "CO2Value": null,
      "CO2Rating": null,
      "CO2Perc": null,
      "ClimateFriendly": null,
      "GastDesc": "Sesam-Keks | Mehlfrei | Vegan",
      "date_de": "26.02.2026"
    },
    {
      "id": "6034098",
      "outlet": "cafe",
      "date": "2026-02-27",
      "CalendarWeek": "9",
      "day": "Freitag",
      "mealtime": "Mittagessen",
      "IdentNr": "12026022798000",
      "itemId": "21060",
      "RecipeID": "8636",
      "ProductPrice": "2.10",
      "ProductPrice_2": null,
      "GastDesc_de": "Chocolate-Lava-Cookie",
      "GastDesc_en": "Chocolate Lava Cookies",
      "MenuName": "CHOCOLATE",
      "allergene": {
        "gluten": "Glutenhaltiges Getreide",
        "huhnerei": "Hühnerei und Hühnereierzeugnisse",
        "soja": "Soja und Sojaerzeugnisse",
        "milch": "Milch und Milcherzeugnisse"
      },
      "merkmale": "",
      "naehrstoffe": "",
      "zusatzstoffe": [
        {
          "de": "Farbstoff",
          "en": "Colouring Agent"
        },
        {
          "de": "Alkohol",
          "en": "Alcohol"
        }
      ],
      "PrintOrder": "0",
      "CO2Value": null,
      "CO2Rating": null,
      "CO2Perc": null,
      "ClimateFriendly": null,
      "GastDesc": "Chocolate-Lava-Cookie",
      "date_de": "27.02.2026"
    },
    {
      "id": "6034099",
      "outlet": "cafe",
      "date": "2026-02-27",
      "CalendarWeek": "9",
      "day": "Freitag",
      "mealtime": "Mittagessen",
      "IdentNr": "12026022798001",
      "itemId": "21059",
      "RecipeID": "9238",
      "ProductPrice": "3.20",
      "ProductPrice_2": null,
      "GastDesc_de": "Heidelbeer-Vanille-Croffin",
      "GastDesc_en": "Blueberry Vanilla Croffin",
      "MenuName": "CROFFIN",
      "allergene": {
        "gluten": "Glutenhaltiges Getreide",
        "huhnerei": "Hühnerei und Hühnereierzeugnisse",
        "milch": "Milch und Milcherzeugnisse"
      },
      "merkmale": "",
      "naehrstoffe": "",
      "zusatzstoffe": [
        {
          "de": "Farbstoff",
          "en": "Colouring Agent"
        },
        {
          "de": "Konservierungsstoff",
          "en": "Preservatives"
        },
        {
          "de": "Alkohol",
          "en": "Alcohol"
        }
      ],
      "PrintOrder": "1",
      "CO2Value": null,
      "CO2Rating": null,
      "CO2Perc": null,
      "ClimateFriendly": null,
      "GastDesc": "Heidelbeer-Vanille-Croffin",
      "date_de": "27.02.2026"
    },
    {
      "id": "6034100",
      "outlet": "cafe",
      "date": "2026-02-27",
      "CalendarWeek": "9",
      "day": "Freitag",
      "mealtime": "Mittagessen",
      "IdentNr": "12026022798002",
      "itemId": "21062",
      "RecipeID": "8871",
      "ProductPrice": "3.60",
      "ProductPrice_2": null,
      "GastDesc_de": "Baskischer Cheesecake mit Himbeerkompott",
      "GastDesc_en": "Basque-style Cheesecake with Raspberry Compote",
      "MenuName": "FAVOURITES",
      "allergene": {
        "huhnerei": "Hühnerei und Hühnereierzeugnisse",
        "milch": "Milch und Milcherzeugnisse"
      },
      "merkmale": "",
      "naehrstoffe": "",
      "zusatzstoffe": [
        {
          "de": "Farbstoff",
          "en": "Colouring Agent"
        },
        {
          "de": "Alkohol",
          "en": "Alcohol"
        }
      ],
      "PrintOrder": "2",
      "CO2Value": null,
      "CO2Rating": null,
      "CO2Perc": null,
      "ClimateFriendly": null,
      "GastDesc": "Baskischer Cheesecake mit Himbeerkompott",
      "date_de": "27.02.2026"
    },
    {
      "id": "6034101",
      "outlet": "cafe",
      "date": "2026-02-27",
      "CalendarWeek": "9",
      "day": "Freitag",
      "mealtime": "Mittagessen",
      "IdentNr": "12026022798003",
      "itemId": "21063",
      "RecipeID": "8211",
      "ProductPrice": "0.50",
      "ProductPrice_2": null,
      "GastDesc_de": "LES ARLETTES (Französische Blätterteigkekse) Vegan",
      "GastDesc_en": "LES ARLETTES  (French Puff Pastry Cookies) Vegan",
      "MenuName": "MINIS",
      "allergene": {
        "gluten": "Glutenhaltiges Getreide"
      },
      "merkmale": {
        "vegan": "Vegan",
        "vegetarisch": "Vegetarisch"
      },
      "naehrstoffe": "",
      "zusatzstoffe": [
        {
          "de": "Farbstoff",
          "en": "Colouring Agent"
        },
        {
          "de": "Alkohol",
          "en": "Alcohol"
        }
      ],
      "PrintOrder": "3",
      "CO2Value": null,
      "CO2Rating": null,
      "CO2Perc": null,
      "ClimateFriendly": null,
      "GastDesc": "LES ARLETTES (Französische Blätterteigkekse) Vegan",
      "date_de": "27.02.2026"
    },
    {
      "id": "6034102",
      "outlet": "cafe",
      "date": "2026-02-27",
      "CalendarWeek": "9",
      "day": "Freitag",
      "mealtime": "Mittagessen",
      "IdentNr": "12026022798005",
      "itemId": "21064",
      "RecipeID": "8330",
      "ProductPrice": "1.50",
      "ProductPrice_2": null,
      "GastDesc_de": "Saftige Brownie-Bananen-Cookies | Zuckerfrei",
      "GastDesc_en": "Fudgy Brownie Banana Cookies | Sugar-Free",
      "MenuName": "PEOPLES CHOICE",
      "allergene": {
        "erdnuss": "Erdnüsse und Erdnusserzeugnisse"
      },
      "merkmale": {
        "ohne_zucker": "Ohne_Zucker",
        "vegan": "Vegan",
        "vegetarisch": "Vegetarisch"
      },
      "naehrstoffe": "",
      "zusatzstoffe": null,
      "PrintOrder": "5",
      "CO2Value": null,
      "CO2Rating": null,
      "CO2Perc": null,
      "ClimateFriendly": null,
      "GastDesc": "Saftige Brownie-Bananen-Cookies | Zuckerfrei",
      "date_de": "27.02.2026"
    },
    {
      "id": "6034103",
      "outlet": "cafe",
      "date": "2026-02-27",
      "CalendarWeek": "9",
      "day": "Freitag",
      "mealtime": "Mittagessen",
      "IdentNr": "12026022798006",
      "itemId": "21061",
      "RecipeID": "9237",
      "ProductPrice": "2.80",
      "ProductPrice_2": null,
      "GastDesc_de": "Hagebutten-Cookie | Vegan",
      "GastDesc_en": "Rosehip Cookie | Vegan",
      "MenuName": "SEASON",
      "allergene": {
        "gluten": "Glutenhaltiges Getreide",
        "schalenfruchte": "Schalenfrüchte und Schalenfruchterzeugnisse"
      },
      "merkmale": "",
      "naehrstoffe": "",
      "zusatzstoffe": [
        {
          "de": "Farbstoff",
          "en": "Colouring Agent"
        },
        {
          "de": "Antioxidationsmittel",
          "en": "Antioxidation"
        },
        {
          "de": "Konservierungsstoff",
          "en": "Preservatives"
        },
        {
          "de": "Alkohol",
          "en": "Alcohol"
        }
      ],
      "PrintOrder": "6",
      "CO2Value": null,
      "CO2Rating": null,
      "CO2Perc": null,
      "ClimateFriendly": null,
      "GastDesc": "Hagebutten-Cookie | Vegan",
      "date_de": "27.02.2026"
    },
    {
      "id": "6034104",
      "outlet": "cafe",
      "date": "2026-02-27",
      "CalendarWeek": "9",
      "day": "Freitag",
      "mealtime": "Mittagessen",
      "IdentNr": "12026022798007",
      "itemId": "12776",
      "RecipeID": "8453",
      "ProductPrice": "2.50",
      "ProductPrice_2": null,
      "GastDesc_de": "Oreo-Cheesecake-Cookies",
      "GastDesc_en": "Oreo Cheesecake Cookies",
      "MenuName": "COOKIE",
      "allergene": {
        "gluten": "Glutenhaltiges Getreide",
        "huhnerei": "Hühnerei und Hühnereierzeugnisse",
        "milch": "Milch und Milcherzeugnisse"
      },
      "merkmale": "",
      "naehrstoffe": "",
      "zusatzstoffe": [
        {
          "de": "Farbstoff",
          "en": "Colouring Agent"
        },
        {
          "de": "Alkohol",
          "en": "Alcohol"
        }
      ],
      "PrintOrder": "7",
      "CO2Value": null,
      "CO2Rating": null,
      "CO2Perc": null,
      "ClimateFriendly": null,
      "GastDesc": "Oreo-Cheesecake-Cookies",
      "date_de": "27.02.2026"
    },
    {
      "id": "6034105",
      "outlet": "cafe",
      "date": "2026-02-27",
      "CalendarWeek": "9",
      "day": "Freitag",
      "mealtime": "Mittagessen",
      "IdentNr": "12026022798008",
      "itemId": "12777",
      "RecipeID": "9121",
      "ProductPrice": "2.50",
      "ProductPrice_2": null,
      "GastDesc_de": "Carrot Cake Bananenbrot | Zuckerfrei",
      "GastDesc_en": "Carrot Cake Banana Bread | Sugar-Free",
      "MenuName": "TAG des KASTENKUCHENS",
      "allergene": {
        "gluten": "Glutenhaltiges Getreide",
        "huhnerei": "Hühnerei und Hühnereierzeugnisse",
        "milch": "Milch und Milcherzeugnisse",
        "schwefel": "Schwefeldioxid und Sulfide"
      },
      "merkmale": "",
      "naehrstoffe": "",
      "zusatzstoffe": [
        {
          "de": "Farbstoff",
          "en": "Colouring Agent"
        }
      ],
      "PrintOrder": "8",
      "CO2Value": null,
      "CO2Rating": null,
      "CO2Perc": null,
      "ClimateFriendly": null,
      "GastDesc": "Carrot Cake Bananenbrot | Zuckerfrei",
      "date_de": "27.02.2026"
    },
    {
      "id": "6034106",
      "outlet": "cafe",
      "date": "2026-02-27",
      "CalendarWeek": "9",
      "day": "Freitag",
      "mealtime": "Mittagessen",
      "IdentNr": "12026022798011",
      "itemId": "16256",
      "RecipeID": "9122",
      "ProductPrice": "2.50",
      "ProductPrice_2": null,
      "GastDesc_de": "Sesam-Keks | Mehlfrei | Vegan",
      "GastDesc_en": "Sesame Cookie | Flour-Free | Vegan",
      "MenuName": "VEGAN SPECIAL",
      "allergene": {
        "schalenfruchte": "Schalenfrüchte und Schalenfruchterzeugnisse",
        "sesam": "Sesamsamen und Sesamsamenerzeugnisse"
      },
      "merkmale": "",
      "naehrstoffe": "",
      "zusatzstoffe": [
        {
          "de": "Farbstoff",
          "en": "Colouring Agent"
        },
        {
          "de": "Antioxidationsmittel",
          "en": "Antioxidation"
        },
        {
          "de": "Alkohol",
          "en": "Alcohol"
        }
      ],
      "PrintOrder": "11",
      "CO2Value": null,
      "CO2Rating": null,
      "CO2Perc": null,
      "ClimateFriendly": null,
      "GastDesc": "Sesam-Keks | Mehlfrei | Vegan",
      "date_de": "27.02.2026"
    },
    {
      "id": "6034107",
      "outlet": "cafe",
      "date": "2026-03-02",
      "CalendarWeek": "9",
      "day": "Montag",
      "mealtime": "Mittagessen",
      "IdentNr": "12026030298000",
      "itemId": "21060",
      "RecipeID": "8636",
      "ProductPrice": "2.10",
      "ProductPrice_2": null,
      "GastDesc_de": "Chocolate-Lava-Cookie",
      "GastDesc_en": "Chocolate Lava Cookies",
      "MenuName": "CHOCOLATE",
      "allergene": {
        "gluten": "Glutenhaltiges Getreide",
        "huhnerei": "Hühnerei und Hühnereierzeugnisse",
        "soja": "Soja und Sojaerzeugnisse",
        "milch": "Milch und Milcherzeugnisse"
      },
      "merkmale": "",
      "naehrstoffe": "",
      "zusatzstoffe": [
        {
          "de": "Farbstoff",
          "en": "Colouring Agent"
        },
        {
          "de": "Alkohol",
          "en": "Alcohol"
        }
      ],
      "PrintOrder": "0",
      "CO2Value": null,
      "CO2Rating": null,
      "CO2Perc": null,
      "ClimateFriendly": null,
      "GastDesc": "Chocolate-Lava-Cookie",
      "date_de": "02.03.2026"
    },
    {
      "id": "6034108",
      "outlet": "cafe",
      "date": "2026-03-02",
      "CalendarWeek": "9",
      "day": "Montag",
      "mealtime": "Mittagessen",
      "IdentNr": "12026030298001",
      "itemId": "21059",
      "RecipeID": "9238",
      "ProductPrice": "3.20",
      "ProductPrice_2": null,
      "GastDesc_de": "Heidelbeer-Vanille-Croffin",
      "GastDesc_en": "Blueberry Vanilla Croffin",
      "MenuName": "CROFFIN",
      "allergene": {
        "gluten": "Glutenhaltiges Getreide",
        "huhnerei": "Hühnerei und Hühnereierzeugnisse",
        "milch": "Milch und Milcherzeugnisse"
      },
      "merkmale": "",
      "naehrstoffe": "",
      "zusatzstoffe": [
        {
          "de": "Farbstoff",
          "en": "Colouring Agent"
        },
        {
          "de": "Konservierungsstoff",
          "en": "Preservatives"
        },
        {
          "de": "Alkohol",
          "en": "Alcohol"
        }
      ],
      "PrintOrder": "1",
      "CO2Value": null,
      "CO2Rating": null,
      "CO2Perc": null,
      "ClimateFriendly": null,
      "GastDesc": "Heidelbeer-Vanille-Croffin",
      "date_de": "02.03.2026"
    },
    {
      "id": "6034109",
      "outlet": "cafe",
      "date": "2026-03-02",
      "CalendarWeek": "9",
      "day": "Montag",
      "mealtime": "Mittagessen",
      "IdentNr": "12026030298002",
      "itemId": "21062",
      "RecipeID": "8871",
      "ProductPrice": "3.60",
      "ProductPrice_2": null,
      "GastDesc_de": "Baskischer Cheesecake mit Pfirsichkompott",
      "GastDesc_en": "Basque-style Cheesecake with Peach Compote",
      "MenuName": "FAVOURITES",
      "allergene": {
        "huhnerei": "Hühnerei und Hühnereierzeugnisse",
        "milch": "Milch und Milcherzeugnisse"
      },
      "merkmale": "",
      "naehrstoffe": "",
      "zusatzstoffe": [
        {
          "de": "Farbstoff",
          "en": "Colouring Agent"
        },
        {
          "de": "Alkohol",
          "en": "Alcohol"
        }
      ],
      "PrintOrder": "2",
      "CO2Value": null,
      "CO2Rating": null,
      "CO2Perc": null,
      "ClimateFriendly": null,
      "GastDesc": "Baskischer Cheesecake mit Pfirsichkompott",
      "date_de": "02.03.2026"
    },
    {
      "id": "6034110",
      "outlet": "cafe",
      "date": "2026-03-02",
      "CalendarWeek": "9",
      "day": "Montag",
      "mealtime": "Mittagessen",
      "IdentNr": "12026030298003",
      "itemId": "21063",
      "RecipeID": "8211",
      "ProductPrice": "0.50",
      "ProductPrice_2": null,
      "GastDesc_de": "LES ARLETTES (Französische Blätterteigkekse) Vegan",
      "GastDesc_en": "LES ARLETTES  (French Puff Pastry Cookies) Vegan",
      "MenuName": "MINIS",
      "allergene": {
        "gluten": "Glutenhaltiges Getreide"
      },
      "merkmale": {
        "vegan": "Vegan",
        "vegetarisch": "Vegetarisch"
      },
      "naehrstoffe": "",
      "zusatzstoffe": [
        {
          "de": "Farbstoff",
          "en": "Colouring Agent"
        },
        {
          "de": "Alkohol",
          "en": "Alcohol"
        }
      ],
      "PrintOrder": "3",
      "CO2Value": null,
      "CO2Rating": null,
      "CO2Perc": null,
      "ClimateFriendly": null,
      "GastDesc": "LES ARLETTES (Französische Blätterteigkekse) Vegan",
      "date_de": "02.03.2026"
    },
    {
      "id": "6034111",
      "outlet": "cafe",
      "date": "2026-03-02",
      "CalendarWeek": "9",
      "day": "Montag",
      "mealtime": "Mittagessen",
      "IdentNr": "12026030298005",
      "itemId": "21064",
      "RecipeID": "8330",
      "ProductPrice": "1.50",
      "ProductPrice_2": null,
      "GastDesc_de": "Saftige Brownie-Bananen-Cookies | Zuckerfrei",
      "GastDesc_en": "Fudgy Brownie Banana Cookies | Sugar-Free",
      "MenuName": "PEOPLES CHOICE",
      "allergene": {
        "erdnuss": "Erdnüsse und Erdnusserzeugnisse"
      },
      "merkmale": {
        "ohne_zucker": "Ohne_Zucker",
        "vegan": "Vegan",
        "vegetarisch": "Vegetarisch"
      },
      "naehrstoffe": "",
      "zusatzstoffe": null,
      "PrintOrder": "5",
      "CO2Value": null,
      "CO2Rating": null,
      "CO2Perc": null,
      "ClimateFriendly": null,
      "GastDesc": "Saftige Brownie-Bananen-Cookies | Zuckerfrei",
      "date_de": "02.03.2026"
    },
    {
      "id": "6034112",
      "outlet": "cafe",
      "date": "2026-03-02",
      "CalendarWeek": "9",
      "day": "Montag",
      "mealtime": "Mittagessen",
      "IdentNr": "12026030298006",
      "itemId": "21061",
      "RecipeID": "9237",
      "ProductPrice": "2.80",
      "ProductPrice_2": null,
      "GastDesc_de": "Hagebutten-Cookie | Vegan",
      "GastDesc_en": "Rosehip Cookie | Vegan",
      "MenuName": "SEASON",
      "allergene": {
        "gluten": "Glutenhaltiges Getreide",
        "schalenfruchte": "Schalenfrüchte und Schalenfruchterzeugnisse"
      },
      "merkmale": "",
      "naehrstoffe": "",
      "zusatzstoffe": [
        {
          "de": "Farbstoff",
          "en": "Colouring Agent"
        },
        {
          "de": "Antioxidationsmittel",
          "en": "Antioxidation"
        },
        {
          "de": "Konservierungsstoff",
          "en": "Preservatives"
        },
        {
          "de": "Alkohol",
          "en": "Alcohol"
        }
      ],
      "PrintOrder": "6",
      "CO2Value": null,
      "CO2Rating": null,
      "CO2Perc": null,
      "ClimateFriendly": null,
      "GastDesc": "Hagebutten-Cookie | Vegan",
      "date_de": "02.03.2026"
    },
    {
      "id": "6034113",
      "outlet": "cafe",
      "date": "2026-03-02",
      "CalendarWeek": "9",
      "day": "Montag",
      "mealtime": "Mittagessen",
      "IdentNr": "12026030298007",
      "itemId": "12776",
      "RecipeID": "8453",
      "ProductPrice": "2.50",
      "ProductPrice_2": null,
      "GastDesc_de": "Oreo-Cheesecake-Cookies",
      "GastDesc_en": "Oreo Cheesecake Cookies",
      "MenuName": "COOKIE",
      "allergene": {
        "gluten": "Glutenhaltiges Getreide",
        "huhnerei": "Hühnerei und Hühnereierzeugnisse",
        "milch": "Milch und Milcherzeugnisse"
      },
      "merkmale": "",
      "naehrstoffe": "",
      "zusatzstoffe": [
        {
          "de": "Farbstoff",
          "en": "Colouring Agent"
        },
        {
          "de": "Alkohol",
          "en": "Alcohol"
        }
      ],
      "PrintOrder": "7",
      "CO2Value": null,
      "CO2Rating": null,
      "CO2Perc": null,
      "ClimateFriendly": null,
      "GastDesc": "Oreo-Cheesecake-Cookies",
      "date_de": "02.03.2026"
    },
    {
      "id": "6034114",
      "outlet": "cafe",
      "date": "2026-03-02",
      "CalendarWeek": "9",
      "day": "Montag",
      "mealtime": "Mittagessen",
      "IdentNr": "12026030298008",
      "itemId": "12777",
      "RecipeID": "9121",
      "ProductPrice": "2.50",
      "ProductPrice_2": null,
      "GastDesc_de": "Carrot Cake Bananenbrot | Zuckerfrei",
      "GastDesc_en": "Carrot Cake Banana Bread | Sugar-Free",
      "MenuName": "TAG des KASTENKUCHENS",
      "allergene": {
        "gluten": "Glutenhaltiges Getreide",
        "huhnerei": "Hühnerei und Hühnereierzeugnisse",
        "milch": "Milch und Milcherzeugnisse",
        "schwefel": "Schwefeldioxid und Sulfide"
      },
      "merkmale": "",
      "naehrstoffe": "",
      "zusatzstoffe": [
        {
          "de": "Farbstoff",
          "en": "Colouring Agent"
        }
      ],
      "PrintOrder": "8",
      "CO2Value": null,
      "CO2Rating": null,
      "CO2Perc": null,
      "ClimateFriendly": null,
      "GastDesc": "Carrot Cake Bananenbrot | Zuckerfrei",
      "date_de": "02.03.2026"
    },
    {
      "id": "6034115",
      "outlet": "cafe",
      "date": "2026-03-02",
      "CalendarWeek": "9",
      "day": "Montag",
      "mealtime": "Mittagessen",
      "IdentNr": "12026030298011",
      "itemId": "16256",
      "RecipeID": "9122",
      "ProductPrice": "2.50",
      "ProductPrice_2": null,
      "GastDesc_de": "Sesam-Keks | Mehlfrei | Vegan",
      "GastDesc_en": "Sesame Cookie | Flour-Free | Vegan",
      "MenuName": "VEGAN SPECIAL",
      "allergene": {
        "schalenfruchte": "Schalenfrüchte und Schalenfruchterzeugnisse",
        "sesam": "Sesamsamen und Sesamsamenerzeugnisse"
      },
      "merkmale": "",
      "naehrstoffe": "",
      "zusatzstoffe": [
        {
          "de": "Farbstoff",
          "en": "Colouring Agent"
        },
        {
          "de": "Antioxidationsmittel",
          "en": "Antioxidation"
        },
        {
          "de": "Alkohol",
          "en": "Alcohol"
        }
      ],
      "PrintOrder": "11",
      "CO2Value": null,
      "CO2Rating": null,
      "CO2Perc": null,
      "ClimateFriendly": null,
      "GastDesc": "Sesam-Keks | Mehlfrei | Vegan",
      "date_de": "02.03.2026"
    },
    {
      "id": "6034116",
      "outlet": "cafe",
      "date": "2026-03-03",
      "CalendarWeek": "9",
      "day": "Dienstag",
      "mealtime": "Mittagessen",
      "IdentNr": "12026030398000",
      "itemId": "21060",
      "RecipeID": "8636",
      "ProductPrice": "2.10",
      "ProductPrice_2": null,
      "GastDesc_de": "Chocolate-Lava-Cookie",
      "GastDesc_en": "Chocolate Lava Cookies",
      "MenuName": "CHOCOLATE",
      "allergene": {
        "gluten": "Glutenhaltiges Getreide",
        "huhnerei": "Hühnerei und Hühnereierzeugnisse",
        "soja": "Soja und Sojaerzeugnisse",
        "milch": "Milch und Milcherzeugnisse"
      },
      "merkmale": "",
      "naehrstoffe": "",
      "zusatzstoffe": [
        {
          "de": "Farbstoff",
          "en": "Colouring Agent"
        },
        {
          "de": "Alkohol",
          "en": "Alcohol"
        }
      ],
      "PrintOrder": "0",
      "CO2Value": null,
      "CO2Rating": null,
      "CO2Perc": null,
      "ClimateFriendly": null,
      "GastDesc": "Chocolate-Lava-Cookie",
      "date_de": "03.03.2026"
    },
    {
      "id": "6034117",
      "outlet": "cafe",
      "date": "2026-03-03",
      "CalendarWeek": "9",
      "day": "Dienstag",
      "mealtime": "Mittagessen",
      "IdentNr": "12026030398001",
      "itemId": "21059",
      "RecipeID": "9238",
      "ProductPrice": "3.20",
      "ProductPrice_2": null,
      "GastDesc_de": "Heidelbeer-Vanille-Croffin",
      "GastDesc_en": "Blueberry Vanilla Croffin",
      "MenuName": "CROFFIN",
      "allergene": {
        "gluten": "Glutenhaltiges Getreide",
        "huhnerei": "Hühnerei und Hühnereierzeugnisse",
        "milch": "Milch und Milcherzeugnisse"
      },
      "merkmale": "",
      "naehrstoffe": "",
      "zusatzstoffe": [
        {
          "de": "Farbstoff",
          "en": "Colouring Agent"
        },
        {
          "de": "Konservierungsstoff",
          "en": "Preservatives"
        },
        {
          "de": "Alkohol",
          "en": "Alcohol"
        }
      ],
      "PrintOrder": "1",
      "CO2Value": null,
      "CO2Rating": null,
      "CO2Perc": null,
      "ClimateFriendly": null,
      "GastDesc": "Heidelbeer-Vanille-Croffin",
      "date_de": "03.03.2026"
    },
    {
      "id": "6034118",
      "outlet": "cafe",
      "date": "2026-03-03",
      "CalendarWeek": "9",
      "day": "Dienstag",
      "mealtime": "Mittagessen",
      "IdentNr": "12026030398002",
      "itemId": "21062",
      "RecipeID": "8871",
      "ProductPrice": "3.60",
      "ProductPrice_2": null,
      "GastDesc_de": "Baskischer Cheesecake mit Pfirsichkompott",
      "GastDesc_en": "Basque-style Cheesecake with Peach Compote",
      "MenuName": "FAVOURITES",
      "allergene": {
        "huhnerei": "Hühnerei und Hühnereierzeugnisse",
        "milch": "Milch und Milcherzeugnisse"
      },
      "merkmale": "",
      "naehrstoffe": "",
      "zusatzstoffe": [
        {
          "de": "Farbstoff",
          "en": "Colouring Agent"
        },
        {
          "de": "Alkohol",
          "en": "Alcohol"
        }
      ],
      "PrintOrder": "2",
      "CO2Value": null,
      "CO2Rating": null,
      "CO2Perc": null,
      "ClimateFriendly": null,
      "GastDesc": "Baskischer Cheesecake mit Pfirsichkompott",
      "date_de": "03.03.2026"
    },
    {
      "id": "6034119",
      "outlet": "cafe",
      "date": "2026-03-03",
      "CalendarWeek": "9",
      "day": "Dienstag",
      "mealtime": "Mittagessen",
      "IdentNr": "12026030398003",
      "itemId": "21063",
      "RecipeID": "8211",
      "ProductPrice": "0.50",
      "ProductPrice_2": null,
      "GastDesc_de": "LES ARLETTES (Französische Blätterteigkekse) Vegan",
      "GastDesc_en": "LES ARLETTES  (French Puff Pastry Cookies) Vegan",
      "MenuName": "MINIS",
      "allergene": {
        "gluten": "Glutenhaltiges Getreide"
      },
      "merkmale": {
        "vegan": "Vegan",
        "vegetarisch": "Vegetarisch"
      },
      "naehrstoffe": "",
      "zusatzstoffe": [
        {
          "de": "Farbstoff",
          "en": "Colouring Agent"
        },
        {
          "de": "Alkohol",
          "en": "Alcohol"
        }
      ],
      "PrintOrder": "3",
      "CO2Value": null,
      "CO2Rating": null,
      "CO2Perc": null,
      "ClimateFriendly": null,
      "GastDesc": "LES ARLETTES (Französische Blätterteigkekse) Vegan",
      "date_de": "03.03.2026"
    },
    {
      "id": "6034120",
      "outlet": "cafe",
      "date": "2026-03-03",
      "CalendarWeek": "9",
      "day": "Dienstag",
      "mealtime": "Mittagessen",
      "IdentNr": "12026030398005",
      "itemId": "21064",
      "RecipeID": "8330",
      "ProductPrice": "1.50",
      "ProductPrice_2": null,
      "GastDesc_de": "Saftige Brownie-Bananen-Cookies | Zuckerfrei",
      "GastDesc_en": "Fudgy Brownie Banana Cookies | Sugar-Free",
      "MenuName": "PEOPLES CHOICE",
      "allergene": {
        "erdnuss": "Erdnüsse und Erdnusserzeugnisse"
      },
      "merkmale": {
        "ohne_zucker": "Ohne_Zucker",
        "vegan": "Vegan",
        "vegetarisch": "Vegetarisch"
      },
      "naehrstoffe": "",
      "zusatzstoffe": null,
      "PrintOrder": "5",
      "CO2Value": null,
      "CO2Rating": null,
      "CO2Perc": null,
      "ClimateFriendly": null,
      "GastDesc": "Saftige Brownie-Bananen-Cookies | Zuckerfrei",
      "date_de": "03.03.2026"
    },
    {
      "id": "6034121",
      "outlet": "cafe",
      "date": "2026-03-03",
      "CalendarWeek": "9",
      "day": "Dienstag",
      "mealtime": "Mittagessen",
      "IdentNr": "12026030398006",
      "itemId": "21061",
      "RecipeID": "9237",
      "ProductPrice": "2.80",
      "ProductPrice_2": null,
      "GastDesc_de": "Hagebutten-Cookie | Vegan",
      "GastDesc_en": "Rosehip Cookie | Vegan",
      "MenuName": "SEASON",
      "allergene": {
        "gluten": "Glutenhaltiges Getreide",
        "schalenfruchte": "Schalenfrüchte und Schalenfruchterzeugnisse"
      },
      "merkmale": "",
      "naehrstoffe": "",
      "zusatzstoffe": [
        {
          "de": "Farbstoff",
          "en": "Colouring Agent"
        },
        {
          "de": "Antioxidationsmittel",
          "en": "Antioxidation"
        },
        {
          "de": "Konservierungsstoff",
          "en": "Preservatives"
        },
        {
          "de": "Alkohol",
          "en": "Alcohol"
        }
      ],
      "PrintOrder": "6",
      "CO2Value": null,
      "CO2Rating": null,
      "CO2Perc": null,
      "ClimateFriendly": null,
      "GastDesc": "Hagebutten-Cookie | Vegan",
      "date_de": "03.03.2026"
    },
    {
      "id": "6034122",
      "outlet": "cafe",
      "date": "2026-03-03",
      "CalendarWeek": "9",
      "day": "Dienstag",
      "mealtime": "Mittagessen",
      "IdentNr": "12026030398007",
      "itemId": "12776",
      "RecipeID": "8453",
      "ProductPrice": "2.50",
      "ProductPrice_2": null,
      "GastDesc_de": "Oreo-Cheesecake-Cookies",
      "GastDesc_en": "Oreo Cheesecake Cookies",
      "MenuName": "COOKIE",
      "allergene": {
        "gluten": "Glutenhaltiges Getreide",
        "huhnerei": "Hühnerei und Hühnereierzeugnisse",
        "milch": "Milch und Milcherzeugnisse"
      },
      "merkmale": "",
      "naehrstoffe": "",
      "zusatzstoffe": [
        {
          "de": "Farbstoff",
          "en": "Colouring Agent"
        },
        {
          "de": "Alkohol",
          "en": "Alcohol"
        }
      ],
      "PrintOrder": "7",
      "CO2Value": null,
      "CO2Rating": null,
      "CO2Perc": null,
      "ClimateFriendly": null,
      "GastDesc": "Oreo-Cheesecake-Cookies",
      "date_de": "03.03.2026"
    },
    {
      "id": "6034123",
      "outlet": "cafe",
      "date": "2026-03-03",
      "CalendarWeek": "9",
      "day": "Dienstag",
      "mealtime": "Mittagessen",
      "IdentNr": "12026030398008",
      "itemId": "12777",
      "RecipeID": "9121",
      "ProductPrice": "2.50",
      "ProductPrice_2": null,
      "GastDesc_de": "Carrot Cake Bananenbrot | Zuckerfrei",
      "GastDesc_en": "Carrot Cake Banana Bread | Sugar-Free",
      "MenuName": "TAG des KASTENKUCHENS",
      "allergene": {
        "gluten": "Glutenhaltiges Getreide",
        "huhnerei": "Hühnerei und Hühnereierzeugnisse",
        "milch": "Milch und Milcherzeugnisse",
        "schwefel": "Schwefeldioxid und Sulfide"
      },
      "merkmale": "",
      "naehrstoffe": "",
      "zusatzstoffe": [
        {
          "de": "Farbstoff",
          "en": "Colouring Agent"
        }
      ],
      "PrintOrder": "8",
      "CO2Value": null,
      "CO2Rating": null,
      "CO2Perc": null,
      "ClimateFriendly": null,
      "GastDesc": "Carrot Cake Bananenbrot | Zuckerfrei",
      "date_de": "03.03.2026"
    },
    {
      "id": "6034124",
      "outlet": "cafe",
      "date": "2026-03-03",
      "CalendarWeek": "9",
      "day": "Dienstag",
      "mealtime": "Mittagessen",
      "IdentNr": "12026030398011",
      "itemId": "16256",
      "RecipeID": "9122",
      "ProductPrice": "2.50",
      "ProductPrice_2": null,
      "GastDesc_de": "Sesam-Keks | Mehlfrei | Vegan",
      "GastDesc_en": "Sesame Cookie | Flour-Free | Vegan",
      "MenuName": "VEGAN SPECIAL",
      "allergene": {
        "schalenfruchte": "Schalenfrüchte und Schalenfruchterzeugnisse",
        "sesam": "Sesamsamen und Sesamsamenerzeugnisse"
      },
      "merkmale": "",
      "naehrstoffe": "",
      "zusatzstoffe": [
        {
          "de": "Farbstoff",
          "en": "Colouring Agent"
        },
        {
          "de": "Antioxidationsmittel",
          "en": "Antioxidation"
        },
        {
          "de": "Alkohol",
          "en": "Alcohol"
        }
      ],
      "PrintOrder": "11",
      "CO2Value": null,
      "CO2Rating": null,
      "CO2Perc": null,
      "ClimateFriendly": null,
      "GastDesc": "Sesam-Keks | Mehlfrei | Vegan",
      "date_de": "03.03.2026"
    },
    {
      "id": "6034125",
      "outlet": "cafe",
      "date": "2026-03-04",
      "CalendarWeek": "9",
      "day": "Mittwoch",
      "mealtime": "Mittagessen",
      "IdentNr": "12026030498000",
      "itemId": "21060",
      "RecipeID": "8636",
      "ProductPrice": "2.10",
      "ProductPrice_2": null,
      "GastDesc_de": "Chocolate-Lava-Cookie",
      "GastDesc_en": "Chocolate Lava Cookies",
      "MenuName": "CHOCOLATE",
      "allergene": {
        "gluten": "Glutenhaltiges Getreide",
        "huhnerei": "Hühnerei und Hühnereierzeugnisse",
        "soja": "Soja und Sojaerzeugnisse",
        "milch": "Milch und Milcherzeugnisse"
      },
      "merkmale": "",
      "naehrstoffe": "",
      "zusatzstoffe": [
        {
          "de": "Farbstoff",
          "en": "Colouring Agent"
        },
        {
          "de": "Alkohol",
          "en": "Alcohol"
        }
      ],
      "PrintOrder": "0",
      "CO2Value": null,
      "CO2Rating": null,
      "CO2Perc": null,
      "ClimateFriendly": null,
      "GastDesc": "Chocolate-Lava-Cookie",
      "date_de": "04.03.2026"
    },
    {
      "id": "6034126",
      "outlet": "cafe",
      "date": "2026-03-04",
      "CalendarWeek": "9",
      "day": "Mittwoch",
      "mealtime": "Mittagessen",
      "IdentNr": "12026030498001",
      "itemId": "21059",
      "RecipeID": "9238",
      "ProductPrice": "3.20",
      "ProductPrice_2": null,
      "GastDesc_de": "Heidelbeer-Vanille-Croffin",
      "GastDesc_en": "Blueberry Vanilla Croffin",
      "MenuName": "CROFFIN",
      "allergene": {
        "gluten": "Glutenhaltiges Getreide",
        "huhnerei": "Hühnerei und Hühnereierzeugnisse",
        "milch": "Milch und Milcherzeugnisse"
      },
      "merkmale": "",
      "naehrstoffe": "",
      "zusatzstoffe": [
        {
          "de": "Farbstoff",
          "en": "Colouring Agent"
        },
        {
          "de": "Konservierungsstoff",
          "en": "Preservatives"
        },
        {
          "de": "Alkohol",
          "en": "Alcohol"
        }
      ],
      "PrintOrder": "1",
      "CO2Value": null,
      "CO2Rating": null,
      "CO2Perc": null,
      "ClimateFriendly": null,
      "GastDesc": "Heidelbeer-Vanille-Croffin",
      "date_de": "04.03.2026"
    },
    {
      "id": "6034127",
      "outlet": "cafe",
      "date": "2026-03-04",
      "CalendarWeek": "9",
      "day": "Mittwoch",
      "mealtime": "Mittagessen",
      "IdentNr": "12026030498002",
      "itemId": "21062",
      "RecipeID": "8871",
      "ProductPrice": "3.60",
      "ProductPrice_2": null,
      "GastDesc_de": "Baskischer Cheesecake mit Pfirsichkompott",
      "GastDesc_en": "Basque-style Cheesecake with Peach Compote",
      "MenuName": "FAVOURITES",
      "allergene": {
        "huhnerei": "Hühnerei und Hühnereierzeugnisse",
        "milch": "Milch und Milcherzeugnisse"
      },
      "merkmale": "",
      "naehrstoffe": "",
      "zusatzstoffe": [
        {
          "de": "Farbstoff",
          "en": "Colouring Agent"
        },
        {
          "de": "Alkohol",
          "en": "Alcohol"
        }
      ],
      "PrintOrder": "2",
      "CO2Value": null,
      "CO2Rating": null,
      "CO2Perc": null,
      "ClimateFriendly": null,
      "GastDesc": "Baskischer Cheesecake mit Pfirsichkompott",
      "date_de": "04.03.2026"
    },
    {
      "id": "6034128",
      "outlet": "cafe",
      "date": "2026-03-04",
      "CalendarWeek": "9",
      "day": "Mittwoch",
      "mealtime": "Mittagessen",
      "IdentNr": "12026030498003",
      "itemId": "21063",
      "RecipeID": "8211",
      "ProductPrice": "0.50",
      "ProductPrice_2": null,
      "GastDesc_de": "LES ARLETTES (Französische Blätterteigkekse) Vegan",
      "GastDesc_en": "LES ARLETTES  (French Puff Pastry Cookies) Vegan",
      "MenuName": "MINIS",
      "allergene": {
        "gluten": "Glutenhaltiges Getreide"
      },
      "merkmale": {
        "vegan": "Vegan",
        "vegetarisch": "Vegetarisch"
      },
      "naehrstoffe": "",
      "zusatzstoffe": [
        {
          "de": "Farbstoff",
          "en": "Colouring Agent"
        },
        {
          "de": "Alkohol",
          "en": "Alcohol"
        }
      ],
      "PrintOrder": "3",
      "CO2Value": null,
      "CO2Rating": null,
      "CO2Perc": null,
      "ClimateFriendly": null,
      "GastDesc": "LES ARLETTES (Französische Blätterteigkekse) Vegan",
      "date_de": "04.03.2026"
    },
    {
      "id": "6034129",
      "outlet": "cafe",
      "date": "2026-03-04",
      "CalendarWeek": "9",
      "day": "Mittwoch",
      "mealtime": "Mittagessen",
      "IdentNr": "12026030498005",
      "itemId": "21064",
      "RecipeID": "8330",
      "ProductPrice": "1.50",
      "ProductPrice_2": null,
      "GastDesc_de": "Saftige Brownie-Bananen-Cookies | Zuckerfrei",
      "GastDesc_en": "Fudgy Brownie Banana Cookies | Sugar-Free",
      "MenuName": "PEOPLES CHOICE",
      "allergene": {
        "erdnuss": "Erdnüsse und Erdnusserzeugnisse"
      },
      "merkmale": {
        "ohne_zucker": "Ohne_Zucker",
        "vegan": "Vegan",
        "vegetarisch": "Vegetarisch"
      },
      "naehrstoffe": "",
      "zusatzstoffe": null,
      "PrintOrder": "5",
      "CO2Value": null,
      "CO2Rating": null,
      "CO2Perc": null,
      "ClimateFriendly": null,
      "GastDesc": "Saftige Brownie-Bananen-Cookies | Zuckerfrei",
      "date_de": "04.03.2026"
    },
    {
      "id": "6034130",
      "outlet": "cafe",
      "date": "2026-03-04",
      "CalendarWeek": "9",
      "day": "Mittwoch",
      "mealtime": "Mittagessen",
      "IdentNr": "12026030498006",
      "itemId": "21061",
      "RecipeID": "9237",
      "ProductPrice": "2.80",
      "ProductPrice_2": null,
      "GastDesc_de": "Hagebutten-Cookie | Vegan",
      "GastDesc_en": "Rosehip Cookie | Vegan",
      "MenuName": "SEASON",
      "allergene": {
        "gluten": "Glutenhaltiges Getreide",
        "schalenfruchte": "Schalenfrüchte und Schalenfruchterzeugnisse"
      },
      "merkmale": "",
      "naehrstoffe": "",
      "zusatzstoffe": [
        {
          "de": "Farbstoff",
          "en": "Colouring Agent"
        },
        {
          "de": "Antioxidationsmittel",
          "en": "Antioxidation"
        },
        {
          "de": "Konservierungsstoff",
          "en": "Preservatives"
        },
        {
          "de": "Alkohol",
          "en": "Alcohol"
        }
      ],
      "PrintOrder": "6",
      "CO2Value": null,
      "CO2Rating": null,
      "CO2Perc": null,
      "ClimateFriendly": null,
      "GastDesc": "Hagebutten-Cookie | Vegan",
      "date_de": "04.03.2026"
    },
    {
      "id": "6034131",
      "outlet": "cafe",
      "date": "2026-03-04",
      "CalendarWeek": "9",
      "day": "Mittwoch",
      "mealtime": "Mittagessen",
      "IdentNr": "12026030498007",
      "itemId": "12776",
      "RecipeID": "8453",
      "ProductPrice": "2.50",
      "ProductPrice_2": null,
      "GastDesc_de": "Oreo-Cheesecake-Cookies",
      "GastDesc_en": "Oreo Cheesecake Cookies",
      "MenuName": "COOKIE",
      "allergene": {
        "gluten": "Glutenhaltiges Getreide",
        "huhnerei": "Hühnerei und Hühnereierzeugnisse",
        "milch": "Milch und Milcherzeugnisse"
      },
      "merkmale": "",
      "naehrstoffe": "",
      "zusatzstoffe": [
        {
          "de": "Farbstoff",
          "en": "Colouring Agent"
        },
        {
          "de": "Alkohol",
          "en": "Alcohol"
        }
      ],
      "PrintOrder": "7",
      "CO2Value": null,
      "CO2Rating": null,
      "CO2Perc": null,
      "ClimateFriendly": null,
      "GastDesc": "Oreo-Cheesecake-Cookies",
      "date_de": "04.03.2026"
    },
    {
      "id": "6034132",
      "outlet": "cafe",
      "date": "2026-03-04",
      "CalendarWeek": "9",
      "day": "Mittwoch",
      "mealtime": "Mittagessen",
      "IdentNr": "12026030498008",
      "itemId": "12777",
      "RecipeID": "9121",
      "ProductPrice": "2.50",
      "ProductPrice_2": null,
      "GastDesc_de": "Carrot Cake Bananenbrot | Zuckerfrei",
      "GastDesc_en": "Carrot Cake Banana Bread | Sugar-Free",
      "MenuName": "TAG des KASTENKUCHENS",
      "allergene": {
        "gluten": "Glutenhaltiges Getreide",
        "huhnerei": "Hühnerei und Hühnereierzeugnisse",
        "milch": "Milch und Milcherzeugnisse",
        "schwefel": "Schwefeldioxid und Sulfide"
      },
      "merkmale": "",
      "naehrstoffe": "",
      "zusatzstoffe": [
        {
          "de": "Farbstoff",
          "en": "Colouring Agent"
        }
      ],
      "PrintOrder": "8",
      "CO2Value": null,
      "CO2Rating": null,
      "CO2Perc": null,
      "ClimateFriendly": null,
      "GastDesc": "Carrot Cake Bananenbrot | Zuckerfrei",
      "date_de": "04.03.2026"
    },
    {
      "id": "6034133",
      "outlet": "cafe",
      "date": "2026-03-04",
      "CalendarWeek": "9",
      "day": "Mittwoch",
      "mealtime": "Mittagessen",
      "IdentNr": "12026030498011",
      "itemId": "16256",
      "RecipeID": "9122",
      "ProductPrice": "2.50",
      "ProductPrice_2": null,
      "GastDesc_de": "Sesam-Keks | Mehlfrei | Vegan",
      "GastDesc_en": "Sesame Cookie | Flour-Free | Vegan",
      "MenuName": "VEGAN SPECIAL",
      "allergene": {
        "schalenfruchte": "Schalenfrüchte und Schalenfruchterzeugnisse",
        "sesam": "Sesamsamen und Sesamsamenerzeugnisse"
      },
      "merkmale": "",
      "naehrstoffe": "",
      "zusatzstoffe": [
        {
          "de": "Farbstoff",
          "en": "Colouring Agent"
        },
        {
          "de": "Antioxidationsmittel",
          "en": "Antioxidation"
        },
        {
          "de": "Alkohol",
          "en": "Alcohol"
        }
      ],
      "PrintOrder": "11",
      "CO2Value": null,
      "CO2Rating": null,
      "CO2Perc": null,
      "ClimateFriendly": null,
      "GastDesc": "Sesam-Keks | Mehlfrei | Vegan",
      "date_de": "04.03.2026"
    },
    {
      "id": "6034134",
      "outlet": "cafe",
      "date": "2026-03-05",
      "CalendarWeek": "9",
      "day": "Donnerstag",
      "mealtime": "Mittagessen",
      "IdentNr": "12026030598000",
      "itemId": "21060",
      "RecipeID": "8636",
      "ProductPrice": "2.10",
      "ProductPrice_2": null,
      "GastDesc_de": "Chocolate-Lava-Cookie",
      "GastDesc_en": "Chocolate Lava Cookies",
      "MenuName": "CHOCOLATE",
      "allergene": {
        "gluten": "Glutenhaltiges Getreide",
        "huhnerei": "Hühnerei und Hühnereierzeugnisse",
        "soja": "Soja und Sojaerzeugnisse",
        "milch": "Milch und Milcherzeugnisse"
      },
      "merkmale": "",
      "naehrstoffe": "",
      "zusatzstoffe": [
        {
          "de": "Farbstoff",
          "en": "Colouring Agent"
        },
        {
          "de": "Alkohol",
          "en": "Alcohol"
        }
      ],
      "PrintOrder": "0",
      "CO2Value": null,
      "CO2Rating": null,
      "CO2Perc": null,
      "ClimateFriendly": null,
      "GastDesc": "Chocolate-Lava-Cookie",
      "date_de": "05.03.2026"
    },
    {
      "id": "6034135",
      "outlet": "cafe",
      "date": "2026-03-05",
      "CalendarWeek": "9",
      "day": "Donnerstag",
      "mealtime": "Mittagessen",
      "IdentNr": "12026030598001",
      "itemId": "21059",
      "RecipeID": "9238",
      "ProductPrice": "3.20",
      "ProductPrice_2": null,
      "GastDesc_de": "Heidelbeer-Vanille-Croffin",
      "GastDesc_en": "Blueberry Vanilla Croffin",
      "MenuName": "CROFFIN",
      "allergene": {
        "gluten": "Glutenhaltiges Getreide",
        "huhnerei": "Hühnerei und Hühnereierzeugnisse",
        "milch": "Milch und Milcherzeugnisse"
      },
      "merkmale": "",
      "naehrstoffe": "",
      "zusatzstoffe": [
        {
          "de": "Farbstoff",
          "en": "Colouring Agent"
        },
        {
          "de": "Konservierungsstoff",
          "en": "Preservatives"
        },
        {
          "de": "Alkohol",
          "en": "Alcohol"
        }
      ],
      "PrintOrder": "1",
      "CO2Value": null,
      "CO2Rating": null,
      "CO2Perc": null,
      "ClimateFriendly": null,
      "GastDesc": "Heidelbeer-Vanille-Croffin",
      "date_de": "05.03.2026"
    },
    {
      "id": "6034136",
      "outlet": "cafe",
      "date": "2026-03-05",
      "CalendarWeek": "9",
      "day": "Donnerstag",
      "mealtime": "Mittagessen",
      "IdentNr": "12026030598002",
      "itemId": "21062",
      "RecipeID": "8871",
      "ProductPrice": "3.60",
      "ProductPrice_2": null,
      "GastDesc_de": "Baskischer Cheesecake mit Pfirsichkompott",
      "GastDesc_en": "Basque-style Cheesecake with Peach Compote",
      "MenuName": "FAVOURITES",
      "allergene": {
        "huhnerei": "Hühnerei und Hühnereierzeugnisse",
        "milch": "Milch und Milcherzeugnisse"
      },
      "merkmale": "",
      "naehrstoffe": "",
      "zusatzstoffe": [
        {
          "de": "Farbstoff",
          "en": "Colouring Agent"
        },
        {
          "de": "Alkohol",
          "en": "Alcohol"
        }
      ],
      "PrintOrder": "2",
      "CO2Value": null,
      "CO2Rating": null,
      "CO2Perc": null,
      "ClimateFriendly": null,
      "GastDesc": "Baskischer Cheesecake mit Pfirsichkompott",
      "date_de": "05.03.2026"
    },
    {
      "id": "6034137",
      "outlet": "cafe",
      "date": "2026-03-05",
      "CalendarWeek": "9",
      "day": "Donnerstag",
      "mealtime": "Mittagessen",
      "IdentNr": "12026030598003",
      "itemId": "21063",
      "RecipeID": "8211",
      "ProductPrice": "0.50",
      "ProductPrice_2": null,
      "GastDesc_de": "LES ARLETTES (Französische Blätterteigkekse) Vegan",
      "GastDesc_en": "LES ARLETTES  (French Puff Pastry Cookies) Vegan",
      "MenuName": "MINIS",
      "allergene": {
        "gluten": "Glutenhaltiges Getreide"
      },
      "merkmale": {
        "vegan": "Vegan",
        "vegetarisch": "Vegetarisch"
      },
      "naehrstoffe": "",
      "zusatzstoffe": [
        {
          "de": "Farbstoff",
          "en": "Colouring Agent"
        },
        {
          "de": "Alkohol",
          "en": "Alcohol"
        }
      ],
      "PrintOrder": "3",
      "CO2Value": null,
      "CO2Rating": null,
      "CO2Perc": null,
      "ClimateFriendly": null,
      "GastDesc": "LES ARLETTES (Französische Blätterteigkekse) Vegan",
      "date_de": "05.03.2026"
    },
    {
      "id": "6034138",
      "outlet": "cafe",
      "date": "2026-03-05",
      "CalendarWeek": "9",
      "day": "Donnerstag",
      "mealtime": "Mittagessen",
      "IdentNr": "12026030598005",
      "itemId": "21064",
      "RecipeID": "8330",
      "ProductPrice": "1.50",
      "ProductPrice_2": null,
      "GastDesc_de": "Saftige Brownie-Bananen-Cookies | Zuckerfrei",
      "GastDesc_en": "Fudgy Brownie Banana Cookies | Sugar-Free",
      "MenuName": "PEOPLES CHOICE",
      "allergene": {
        "erdnuss": "Erdnüsse und Erdnusserzeugnisse"
      },
      "merkmale": {
        "ohne_zucker": "Ohne_Zucker",
        "vegan": "Vegan",
        "vegetarisch": "Vegetarisch"
      },
      "naehrstoffe": "",
      "zusatzstoffe": null,
      "PrintOrder": "5",
      "CO2Value": null,
      "CO2Rating": null,
      "CO2Perc": null,
      "ClimateFriendly": null,
      "GastDesc": "Saftige Brownie-Bananen-Cookies | Zuckerfrei",
      "date_de": "05.03.2026"
    },
    {
      "id": "6034139",
      "outlet": "cafe",
      "date": "2026-03-05",
      "CalendarWeek": "9",
      "day": "Donnerstag",
      "mealtime": "Mittagessen",
      "IdentNr": "12026030598006",
      "itemId": "21061",
      "RecipeID": "9237",
      "ProductPrice": "2.80",
      "ProductPrice_2": null,
      "GastDesc_de": "Hagebutten-Cookie | Vegan",
      "GastDesc_en": "Rosehip Cookie | Vegan",
      "MenuName": "SEASON",
      "allergene": {
        "gluten": "Glutenhaltiges Getreide",
        "schalenfruchte": "Schalenfrüchte und Schalenfruchterzeugnisse"
      },
      "merkmale": "",
      "naehrstoffe": "",
      "zusatzstoffe": [
        {
          "de": "Farbstoff",
          "en": "Colouring Agent"
        },
        {
          "de": "Antioxidationsmittel",
          "en": "Antioxidation"
        },
        {
          "de": "Konservierungsstoff",
          "en": "Preservatives"
        },
        {
          "de": "Alkohol",
          "en": "Alcohol"
        }
      ],
      "PrintOrder": "6",
      "CO2Value": null,
      "CO2Rating": null,
      "CO2Perc": null,
      "ClimateFriendly": null,
      "GastDesc": "Hagebutten-Cookie | Vegan",
      "date_de": "05.03.2026"
    },
    {
      "id": "6034140",
      "outlet": "cafe",
      "date": "2026-03-05",
      "CalendarWeek": "9",
      "day": "Donnerstag",
      "mealtime": "Mittagessen",
      "IdentNr": "12026030598007",
      "itemId": "12776",
      "RecipeID": "8453",
      "ProductPrice": "2.50",
      "ProductPrice_2": null,
      "GastDesc_de": "Oreo-Cheesecake-Cookies",
      "GastDesc_en": "Oreo Cheesecake Cookies",
      "MenuName": "COOKIE",
      "allergene": {
        "gluten": "Glutenhaltiges Getreide",
        "huhnerei": "Hühnerei und Hühnereierzeugnisse",
        "milch": "Milch und Milcherzeugnisse"
      },
      "merkmale": "",
      "naehrstoffe": "",
      "zusatzstoffe": [
        {
          "de": "Farbstoff",
          "en": "Colouring Agent"
        },
        {
          "de": "Alkohol",
          "en": "Alcohol"
        }
      ],
      "PrintOrder": "7",
      "CO2Value": null,
      "CO2Rating": null,
      "CO2Perc": null,
      "ClimateFriendly": null,
      "GastDesc": "Oreo-Cheesecake-Cookies",
      "date_de": "05.03.2026"
    },
    {
      "id": "6034141",
      "outlet": "cafe",
      "date": "2026-03-05",
      "CalendarWeek": "9",
      "day": "Donnerstag",
      "mealtime": "Mittagessen",
      "IdentNr": "12026030598008",
      "itemId": "12777",
      "RecipeID": "9121",
      "ProductPrice": "2.50",
      "ProductPrice_2": null,
      "GastDesc_de": "Carrot Cake Bananenbrot | Zuckerfrei",
      "GastDesc_en": "Carrot Cake Banana Bread | Sugar-Free",
      "MenuName": "TAG des KASTENKUCHENS",
      "allergene": {
        "gluten": "Glutenhaltiges Getreide",
        "huhnerei": "Hühnerei und Hühnereierzeugnisse",
        "milch": "Milch und Milcherzeugnisse",
        "schwefel": "Schwefeldioxid und Sulfide"
      },
      "merkmale": "",
      "naehrstoffe": "",
      "zusatzstoffe": [
        {
          "de": "Farbstoff",
          "en": "Colouring Agent"
        }
      ],
      "PrintOrder": "8",
      "CO2Value": null,
      "CO2Rating": null,
      "CO2Perc": null,
      "ClimateFriendly": null,
      "GastDesc": "Carrot Cake Bananenbrot | Zuckerfrei",
      "date_de": "05.03.2026"
    },
    {
      "id": "6034142",
      "outlet": "cafe",
      "date": "2026-03-05",
      "CalendarWeek": "9",
      "day": "Donnerstag",
      "mealtime": "Mittagessen",
      "IdentNr": "12026030598011",
      "itemId": "16256",
      "RecipeID": "9122",
      "ProductPrice": "2.50",
      "ProductPrice_2": null,
      "GastDesc_de": "Sesam-Keks | Mehlfrei | Vegan",
      "GastDesc_en": "Sesame Cookie | Flour-Free | Vegan",
      "MenuName": "VEGAN SPECIAL",
      "allergene": {
        "schalenfruchte": "Schalenfrüchte und Schalenfruchterzeugnisse",
        "sesam": "Sesamsamen und Sesamsamenerzeugnisse"
      },
      "merkmale": "",
      "naehrstoffe": "",
      "zusatzstoffe": [
        {
          "de": "Farbstoff",
          "en": "Colouring Agent"
        },
        {
          "de": "Antioxidationsmittel",
          "en": "Antioxidation"
        },
        {
          "de": "Alkohol",
          "en": "Alcohol"
        }
      ],
      "PrintOrder": "11",
      "CO2Value": null,
      "CO2Rating": null,
      "CO2Perc": null,
      "ClimateFriendly": null,
      "GastDesc": "Sesam-Keks | Mehlfrei | Vegan",
      "date_de": "05.03.2026"
    },
    {
      "id": "6034143",
      "outlet": "cafe",
      "date": "2026-03-06",
      "CalendarWeek": "9",
      "day": "Freitag",
      "mealtime": "Mittagessen",
      "IdentNr": "12026030698000",
      "itemId": "21060",
      "RecipeID": "8636",
      "ProductPrice": "2.10",
      "ProductPrice_2": null,
      "GastDesc_de": "Chocolate-Lava-Cookie",
      "GastDesc_en": "Chocolate Lava Cookies",
      "MenuName": "CHOCOLATE",
      "allergene": {
        "gluten": "Glutenhaltiges Getreide",
        "huhnerei": "Hühnerei und Hühnereierzeugnisse",
        "soja": "Soja und Sojaerzeugnisse",
        "milch": "Milch und Milcherzeugnisse"
      },
      "merkmale": "",
      "naehrstoffe": "",
      "zusatzstoffe": [
        {
          "de": "Farbstoff",
          "en": "Colouring Agent"
        },
        {
          "de": "Alkohol",
          "en": "Alcohol"
        }
      ],
      "PrintOrder": "0",
      "CO2Value": null,
      "CO2Rating": null,
      "CO2Perc": null,
      "ClimateFriendly": null,
      "GastDesc": "Chocolate-Lava-Cookie",
      "date_de": "06.03.2026"
    },
    {
      "id": "6034144",
      "outlet": "cafe",
      "date": "2026-03-06",
      "CalendarWeek": "9",
      "day": "Freitag",
      "mealtime": "Mittagessen",
      "IdentNr": "12026030698001",
      "itemId": "21059",
      "RecipeID": "9238",
      "ProductPrice": "3.20",
      "ProductPrice_2": null,
      "GastDesc_de": "Heidelbeer-Vanille-Croffin",
      "GastDesc_en": "Blueberry Vanilla Croffin",
      "MenuName": "CROFFIN",
      "allergene": {
        "gluten": "Glutenhaltiges Getreide",
        "huhnerei": "Hühnerei und Hühnereierzeugnisse",
        "milch": "Milch und Milcherzeugnisse"
      },
      "merkmale": "",
      "naehrstoffe": "",
      "zusatzstoffe": [
        {
          "de": "Farbstoff",
          "en": "Colouring Agent"
        },
        {
          "de": "Konservierungsstoff",
          "en": "Preservatives"
        },
        {
          "de": "Alkohol",
          "en": "Alcohol"
        }
      ],
      "PrintOrder": "1",
      "CO2Value": null,
      "CO2Rating": null,
      "CO2Perc": null,
      "ClimateFriendly": null,
      "GastDesc": "Heidelbeer-Vanille-Croffin",
      "date_de": "06.03.2026"
    },
    {
      "id": "6034145",
      "outlet": "cafe",
      "date": "2026-03-06",
      "CalendarWeek": "9",
      "day": "Freitag",
      "mealtime": "Mittagessen",
      "IdentNr": "12026030698002",
      "itemId": "21062",
      "RecipeID": "8871",
      "ProductPrice": "3.60",
      "ProductPrice_2": null,
      "GastDesc_de": "Baskischer Cheesecake mit Pfirsichkompott",
      "GastDesc_en": "Basque-style Cheesecake with Peach Compote",
      "MenuName": "FAVOURITES",
      "allergene": {
        "huhnerei": "Hühnerei und Hühnereierzeugnisse",
        "milch": "Milch und Milcherzeugnisse"
      },
      "merkmale": "",
      "naehrstoffe": "",
      "zusatzstoffe": [
        {
          "de": "Farbstoff",
          "en": "Colouring Agent"
        },
        {
          "de": "Alkohol",
          "en": "Alcohol"
        }
      ],
      "PrintOrder": "2",
      "CO2Value": null,
      "CO2Rating": null,
      "CO2Perc": null,
      "ClimateFriendly": null,
      "GastDesc": "Baskischer Cheesecake mit Pfirsichkompott",
      "date_de": "06.03.2026"
    },
    {
      "id": "6034146",
      "outlet": "cafe",
      "date": "2026-03-06",
      "CalendarWeek": "9",
      "day": "Freitag",
      "mealtime": "Mittagessen",
      "IdentNr": "12026030698003",
      "itemId": "21063",
      "RecipeID": "8211",
      "ProductPrice": "0.50",
      "ProductPrice_2": null,
      "GastDesc_de": "LES ARLETTES (Französische Blätterteigkekse) Vegan",
      "GastDesc_en": "LES ARLETTES  (French Puff Pastry Cookies) Vegan",
      "MenuName": "MINIS",
      "allergene": {
        "gluten": "Glutenhaltiges Getreide"
      },
      "merkmale": {
        "vegan": "Vegan",
        "vegetarisch": "Vegetarisch"
      },
      "naehrstoffe": "",
      "zusatzstoffe": [
        {
          "de": "Farbstoff",
          "en": "Colouring Agent"
        },
        {
          "de": "Alkohol",
          "en": "Alcohol"
        }
      ],
      "PrintOrder": "3",
      "CO2Value": null,
      "CO2Rating": null,
      "CO2Perc": null,
      "ClimateFriendly": null,
      "GastDesc": "LES ARLETTES (Französische Blätterteigkekse) Vegan",
      "date_de": "06.03.2026"
    },
    {
      "id": "6034147",
      "outlet": "cafe",
      "date": "2026-03-06",
      "CalendarWeek": "9",
      "day": "Freitag",
      "mealtime": "Mittagessen",
      "IdentNr": "12026030698005",
      "itemId": "21064",
      "RecipeID": "8330",
      "ProductPrice": "1.50",
      "ProductPrice_2": null,
      "GastDesc_de": "Saftige Brownie-Bananen-Cookies | Zuckerfrei",
      "GastDesc_en": "Fudgy Brownie Banana Cookies | Sugar-Free",
      "MenuName": "PEOPLES CHOICE",
      "allergene": {
        "erdnuss": "Erdnüsse und Erdnusserzeugnisse"
      },
      "merkmale": {
        "ohne_zucker": "Ohne_Zucker",
        "vegan": "Vegan",
        "vegetarisch": "Vegetarisch"
      },
      "naehrstoffe": "",
      "zusatzstoffe": null,
      "PrintOrder": "5",
      "CO2Value": null,
      "CO2Rating": null,
      "CO2Perc": null,
      "ClimateFriendly": null,
      "GastDesc": "Saftige Brownie-Bananen-Cookies | Zuckerfrei",
      "date_de": "06.03.2026"
    },
    {
      "id": "6034148",
      "outlet": "cafe",
      "date": "2026-03-06",
      "CalendarWeek": "9",
      "day": "Freitag",
      "mealtime": "Mittagessen",
      "IdentNr": "12026030698006",
      "itemId": "21061",
      "RecipeID": "9237",
      "ProductPrice": "2.80",
      "ProductPrice_2": null,
      "GastDesc_de": "Hagebutten-Cookie | Vegan",
      "GastDesc_en": "Rosehip Cookie | Vegan",
      "MenuName": "SEASON",
      "allergene": {
        "gluten": "Glutenhaltiges Getreide",
        "schalenfruchte": "Schalenfrüchte und Schalenfruchterzeugnisse"
      },
      "merkmale": "",
      "naehrstoffe": "",
      "zusatzstoffe": [
        {
          "de": "Farbstoff",
          "en": "Colouring Agent"
        },
        {
          "de": "Antioxidationsmittel",
          "en": "Antioxidation"
        },
        {
          "de": "Konservierungsstoff",
          "en": "Preservatives"
        },
        {
          "de": "Alkohol",
          "en": "Alcohol"
        }
      ],
      "PrintOrder": "6",
      "CO2Value": null,
      "CO2Rating": null,
      "CO2Perc": null,
      "ClimateFriendly": null,
      "GastDesc": "Hagebutten-Cookie | Vegan",
      "date_de": "06.03.2026"
    },
    {
      "id": "6034149",
      "outlet": "cafe",
      "date": "2026-03-06",
      "CalendarWeek": "9",
      "day": "Freitag",
      "mealtime": "Mittagessen",
      "IdentNr": "12026030698007",
      "itemId": "12776",
      "RecipeID": "8453",
      "ProductPrice": "2.50",
      "ProductPrice_2": null,
      "GastDesc_de": "Oreo-Cheesecake-Cookies",
      "GastDesc_en": "Oreo Cheesecake Cookies",
      "MenuName": "COOKIE",
      "allergene": {
        "gluten": "Glutenhaltiges Getreide",
        "huhnerei": "Hühnerei und Hühnereierzeugnisse",
        "milch": "Milch und Milcherzeugnisse"
      },
      "merkmale": "",
      "naehrstoffe": "",
      "zusatzstoffe": [
        {
          "de": "Farbstoff",
          "en": "Colouring Agent"
        },
        {
          "de": "Alkohol",
          "en": "Alcohol"
        }
      ],
      "PrintOrder": "7",
      "CO2Value": null,
      "CO2Rating": null,
      "CO2Perc": null,
      "ClimateFriendly": null,
      "GastDesc": "Oreo-Cheesecake-Cookies",
      "date_de": "06.03.2026"
    },
    {
      "id": "6034150",
      "outlet": "cafe",
      "date": "2026-03-06",
      "CalendarWeek": "9",
      "day": "Freitag",
      "mealtime": "Mittagessen",
      "IdentNr": "12026030698008",
