{
  "daySelector": [
    {
      "date": "2026-01-01",
      "day": "Donnerstag",
      "CalendarWeek": "1",
      "date_de": "01.01.2026"
    },
    {
      "date": "2026-01-02",
      "day": "Freitag",
      "CalendarWeek": "1",
      "date_de": "02.01.2026"
    },
    {
      "date": "2026-01-03",
      "day": "Samstag",
      "CalendarWeek": "1",
      "date_de": "03.01.2026"
    },
    {
      "date": "2026-01-04",
      "day": "Sonntag",
      "CalendarWeek": "1",
      "date_de": "04.01.2026"
    },
    {
      "date": "2026-01-05",
      "day": "Montag",
      "CalendarWeek": "2",
      "date_de": "05.01.2026"
    },
    {
      "date": "2026-01-06",
      "day": "Dienstag",
      "CalendarWeek": "2",
      "date_de": "06.01.2026"
    },
    {
      "date": "2026-01-07",
      "day": "Mittwoch",
      "CalendarWeek": "2",
      "date_de": "07.01.2026"
    },
    {
      "date": "2026-01-08",
      "day": "Donnerstag",
      "CalendarWeek": "2",
      "date_de": "08.01.2026"
    },
    {
      "date": "2026-01-09",
      "day": "Freitag",
      "CalendarWeek": "2",
      "date_de": "09.01.2026"
    },
    {
      "date": "2026-01-10",
      "day": "Samstag",
      "CalendarWeek": "2",
      "date_de": "10.01.2026"
    },
    {
      "date": "2026-01-11",
      "day": "Sonntag",
      "CalendarWeek": "2",
      "date_de": "11.01.2026"
    },
    {
      "date": "2026-01-12",
      "day": "Montag",
      "CalendarWeek": "2",
      "date_de": "12.01.2026"
    },
    {
      "date": "2026-01-13",
      "day": "Dienstag",
      "CalendarWeek": "2",
      "date_de": "13.01.2026"
    },
    {
      "date": "2026-01-14",
      "day": "Mittwoch",
      "CalendarWeek": "2",
      "date_de": "14.01.2026"
    },
    {
      "date": "2026-01-15",
      "day": "Donnerstag",
      "CalendarWeek": "2",
      "date_de": "15.01.2026"
    },
    {
      "date": "2026-01-16",
      "day": "Freitag",
      "CalendarWeek": "2",
      "date_de": "16.01.2026"
    },
    {
      "date": "2026-01-17",
      "day": "Samstag",
      "CalendarWeek": "2",
      "date_de": "17.01.2026"
    },
    {
      "date": "2026-01-19",
      "day": "Montag",
      "CalendarWeek": "2",
      "date_de": "19.01.2026"
    },
    {
      "date": "2026-01-20",
      "day": "Dienstag",
      "CalendarWeek": "2",
      "date_de": "20.01.2026"
    },
    {
      "date": "2026-01-21",
      "day": "Mittwoch",
      "CalendarWeek": "2",
      "date_de": "21.01.2026"
    }
  ],
  "data": [
    {
      "id": "5103082",
      "outlet": "cafe",
      "date": "2026-01-06",
      "CalendarWeek": "2",
      "day": "Dienstag",
      "mealtime": "Mittagessen",
      "IdentNr": "12026010698001",
      "itemId": "21059",
      "RecipeID": "8054",
      "ProductPrice": "3.20",
      "ProductPrice_2": null,
      "GastDesc_de": "Pflaumenmus-Croffin mit Vanilleschmand",
      "GastDesc_en": "Plum jam Croffin with vanilla sour cream",
      "MenuName": "CROFFIN",
      "allergene": {
        "gluten": "Glutenhaltiges Getreide",
        "schalenfruchte": "Schalenfrüchte und Schalenfruchterzeugnisse",
        "huhnerei": "Hühnerei und Hühnereierzeugnisse",
        "soja": "Soja und Sojaerzeugnisse",
        "milch": "Milch und Milcherzeugnisse"
      },
      "merkmale": "",
      "naehrstoffe": "",
      "zusatzstoffe": [
        {
          "de": "Farbstoff",
          "en": "Colouring Agent"
        },
        {
          "de": "Alkohol",
          "en": "Alcohol"
        }
      ],
      "PrintOrder": "1",
      "CO2Value": null,
      "CO2Rating": null,
      "CO2Perc": null,
      "ClimateFriendly": null,
      "GastDesc": "Pflaumenmus-Croffin mit Vanilleschmand",
      "date_de": "06.01.2026"
    },
    {
      "id": "5103083",
      "outlet": "cafe",
      "date": "2026-01-06",
      "CalendarWeek": "2",
      "day": "Dienstag",
      "mealtime": "Mittagessen",
      "IdentNr": "12026010698002",
      "itemId": "21062",
      "RecipeID": "8871",
      "ProductPrice": "3.60",
      "ProductPrice_2": null,
      "GastDesc_de": "Baskischer Cheesecake mit Johannisbeer-Birnenkompott",
      "GastDesc_en": "Basque-style Cheesecake with Black Currant and Pear Compote",
      "MenuName": "FAVOURITES",
      "allergene": {
        "huhnerei": "Hühnerei und Hühnereierzeugnisse",
        "milch": "Milch und Milcherzeugnisse"
      },
      "merkmale": "",
      "naehrstoffe": "",
      "zusatzstoffe": [
        {
          "de": "Farbstoff",
          "en": "Colouring Agent"
        },
        {
          "de": "Alkohol",
          "en": "Alcohol"
        }
      ],
      "PrintOrder": "2",
      "CO2Value": null,
      "CO2Rating": null,
      "CO2Perc": null,
      "ClimateFriendly": null,
      "GastDesc": "Baskischer Cheesecake mit Johannisbeer-Birnenkompott",
      "date_de": "06.01.2026"
    },
    {
      "id": "5103084",
      "outlet": "cafe",
      "date": "2026-01-06",
      "CalendarWeek": "2",
      "day": "Dienstag",
      "mealtime": "Mittagessen",
      "IdentNr": "12026010698003",
      "itemId": "21063",
      "RecipeID": "8211",
      "ProductPrice": "0.50",
      "ProductPrice_2": null,
      "GastDesc_de": "LES ARLETTES (Französische Blätterteigkekse) Vegan",
      "GastDesc_en": "LES ARLETTES  (French Puff Pastry Cookies) Vegan",
      "MenuName": "MINIS",
      "allergene": {
        "gluten": "Glutenhaltiges Getreide"
      },
      "merkmale": {
        "vegan": "Vegan",
        "vegetarisch": "Vegetarisch"
      },
      "naehrstoffe": "",
      "zusatzstoffe": [
        {
          "de": "Farbstoff",
          "en": "Colouring Agent"
        },
        {
          "de": "Alkohol",
          "en": "Alcohol"
        }
      ],
      "PrintOrder": "3",
      "CO2Value": null,
      "CO2Rating": null,
      "CO2Perc": null,
      "ClimateFriendly": null,
      "GastDesc": "LES ARLETTES (Französische Blätterteigkekse) Vegan",
      "date_de": "06.01.2026"
    },
    {
      "id": "5103085",
      "outlet": "cafe",
      "date": "2026-01-06",
      "CalendarWeek": "2",
      "day": "Dienstag",
      "mealtime": "Mittagessen",
      "IdentNr": "12026010698005",
      "itemId": "21064",
      "RecipeID": "8330",
      "ProductPrice": "1.50",
      "ProductPrice_2": null,
      "GastDesc_de": "Saftige Brownie-Bananen-Cookies | Zuckerfrei",
      "GastDesc_en": "Fudgy Brownie Banana Cookies | Sugar-Free",
      "MenuName": "PEOPLES CHOICE",
      "allergene": {
        "erdnuss": "Erdnüsse und Erdnusserzeugnisse"
      },
      "merkmale": {
        "ohne_zucker": "Ohne_Zucker",
        "vegan": "Vegan",
        "vegetarisch": "Vegetarisch"
      },
      "naehrstoffe": "",
      "zusatzstoffe": null,
      "PrintOrder": "5",
      "CO2Value": null,
      "CO2Rating": null,
      "CO2Perc": null,
      "ClimateFriendly": null,
      "GastDesc": "Saftige Brownie-Bananen-Cookies | Zuckerfrei",
      "date_de": "06.01.2026"
    },
    {
      "id": "5103086",
      "outlet": "cafe",
      "date": "2026-01-06",
      "CalendarWeek": "2",
      "day": "Dienstag",
      "mealtime": "Mittagessen",
      "IdentNr": "12026010698006",
      "itemId": "21061",
      "RecipeID": "8697",
      "ProductPrice": "2.50",
      "ProductPrice_2": null,
      "GastDesc_de": "Erdnussbutter-Cookie mit Schokolade und Salzkaramell | Vegan",
      "GastDesc_en": "Peanutbutter Cookie with Chocolate Salty Caramel | Vegan",
      "MenuName": "SEASON",
      "allergene": {
        "gluten": "Glutenhaltiges Getreide",
        "soja": "Soja und Sojaerzeugnisse",
        "erdnuss": "Erdnüsse und Erdnusserzeugnisse"
      },
      "merkmale": "",
      "naehrstoffe": "",
      "zusatzstoffe": [
        {
          "de": "Farbstoff",
          "en": "Colouring Agent"
        },
        {
          "de": "Antioxidationsmittel",
          "en": "Antioxidation"
        },
        {
          "de": "Alkohol",
          "en": "Alcohol"
        }
      ],
      "PrintOrder": "6",
      "CO2Value": null,
      "CO2Rating": null,
      "CO2Perc": null,
      "ClimateFriendly": null,
      "GastDesc": "Erdnussbutter-Cookie mit Schokolade und Salzkaramell | Vegan",
      "date_de": "06.01.2026"
    },
    {
      "id": "5103087",
      "outlet": "cafe",
      "date": "2026-01-06",
      "CalendarWeek": "2",
      "day": "Dienstag",
      "mealtime": "Mittagessen",
      "IdentNr": "12026010698007",
      "itemId": "12776",
      "RecipeID": "8453",
      "ProductPrice": "2.50",
      "ProductPrice_2": null,
      "GastDesc_de": "Oreo-Cheesecake-Cookies",
      "GastDesc_en": "Oreo Cheesecake Cookies",
      "MenuName": "COOKIE",
      "allergene": {
        "gluten": "Glutenhaltiges Getreide",
        "huhnerei": "Hühnerei und Hühnereierzeugnisse",
        "milch": "Milch und Milcherzeugnisse"
      },
      "merkmale": "",
      "naehrstoffe": "",
      "zusatzstoffe": [
        {
          "de": "Farbstoff",
          "en": "Colouring Agent"
        },
        {
          "de": "Alkohol",
          "en": "Alcohol"
        }
      ],
      "PrintOrder": "7",
      "CO2Value": null,
      "CO2Rating": null,
      "CO2Perc": null,
      "ClimateFriendly": null,
      "GastDesc": "Oreo-Cheesecake-Cookies",
      "date_de": "06.01.2026"
    },
    {
      "id": "5103088",
      "outlet": "cafe",
      "date": "2026-01-06",
      "CalendarWeek": "2",
      "day": "Dienstag",
      "mealtime": "Mittagessen",
      "IdentNr": "12026010698008",
      "itemId": "12777",
      "RecipeID": "8349",
      "ProductPrice": "2.70",
      "ProductPrice_2": null,
      "GastDesc_de": "\"Banana Bread\" mit Blaubeeren | Zuckerfrei",
      "GastDesc_en": "\"Banana Bread\" with Blueberries | Sugar-Free",
      "MenuName": "TAG des KASTENKUCHENS",
      "allergene": {
        "gluten": "Glutenhaltiges Getreide",
        "huhnerei": "Hühnerei und Hühnereierzeugnisse",
        "milch": "Milch und Milcherzeugnisse"
      },
      "merkmale": {
        "ohne_zucker": "Ohne_Zucker"
      },
      "naehrstoffe": "",
      "zusatzstoffe": null,
      "PrintOrder": "8",
      "CO2Value": null,
      "CO2Rating": null,
      "CO2Perc": null,
      "ClimateFriendly": null,
      "GastDesc": "\"Banana Bread\" mit Blaubeeren | Zuckerfrei",
      "date_de": "06.01.2026"
    },
    {
      "id": "5103089",
      "outlet": "cafe",
      "date": "2026-01-06",
      "CalendarWeek": "2",
      "day": "Dienstag",
      "mealtime": "Mittagessen",
      "IdentNr": "12026010698011",
      "itemId": "16256",
      "RecipeID": "8775",
      "ProductPrice": "1.50",
      "ProductPrice_2": null,
      "GastDesc_de": "Schwedische Haferkekse | Vegan",
      "GastDesc_en": "Swedish Style Oatmeal Cookies | Vegan",
      "MenuName": "VEGAN SPECIAL",
      "allergene": {
        "gluten": "Glutenhaltiges Getreide"
      },
      "merkmale": {
        "vegan": "Vegan",
        "vegetarisch": "Vegetarisch"
      },
      "naehrstoffe": "",
      "zusatzstoffe": [
        {
          "de": "Farbstoff",
          "en": "Colouring Agent"
        },
        {
          "de": "Antioxidationsmittel",
          "en": "Antioxidation"
        },
        {
          "de": "Alkohol",
          "en": "Alcohol"
        }
      ],
      "PrintOrder": "11",
      "CO2Value": null,
      "CO2Rating": null,
      "CO2Perc": null,
      "ClimateFriendly": null,
      "GastDesc": "Schwedische Haferkekse | Vegan",
      "date_de": "06.01.2026"
    },
    {
      "id": "5126692",
      "outlet": "cafe",
      "date": "2026-01-07",
      "CalendarWeek": "2",
      "day": "Mittwoch",
      "mealtime": "Mittagessen",
      "IdentNr": "12026010798001",
      "itemId": "21059",
      "RecipeID": "8054",
      "ProductPrice": "3.20",
      "ProductPrice_2": null,
      "GastDesc_de": "Pflaumenmus-Croffin mit Vanilleschmand",
      "GastDesc_en": "Plum Jam Croffin with Vanilla Sour Cream",
      "MenuName": "CROFFIN",
      "allergene": {
        "gluten": "Glutenhaltiges Getreide",
        "schalenfruchte": "Schalenfrüchte und Schalenfruchterzeugnisse",
        "huhnerei": "Hühnerei und Hühnereierzeugnisse",
        "soja": "Soja und Sojaerzeugnisse",
        "milch": "Milch und Milcherzeugnisse"
      },
      "merkmale": "",
      "naehrstoffe": "",
      "zusatzstoffe": [
        {
          "de": "Farbstoff",
          "en": "Colouring Agent"
        },
        {
          "de": "Alkohol",
          "en": "Alcohol"
        }
      ],
      "PrintOrder": "1",
      "CO2Value": null,
      "CO2Rating": null,
      "CO2Perc": null,
      "ClimateFriendly": null,
      "GastDesc": "Pflaumenmus-Croffin mit Vanilleschmand",
      "date_de": "07.01.2026"
    },
    {
      "id": "5126693",
      "outlet": "cafe",
      "date": "2026-01-07",
      "CalendarWeek": "2",
      "day": "Mittwoch",
      "mealtime": "Mittagessen",
      "IdentNr": "12026010798002",
      "itemId": "21062",
      "RecipeID": "8871",
      "ProductPrice": "3.60",
      "ProductPrice_2": null,
      "GastDesc_de": "Baskischer Cheesecake mit Johannisbeer-Birnenkompott",
      "GastDesc_en": "Basque-style Cheesecake with Black Currant and Pear Compote",
      "MenuName": "FAVOURITES",
      "allergene": {
        "huhnerei": "Hühnerei und Hühnereierzeugnisse",
        "milch": "Milch und Milcherzeugnisse"
      },
      "merkmale": "",
      "naehrstoffe": "",
      "zusatzstoffe": [
        {
          "de": "Farbstoff",
          "en": "Colouring Agent"
        },
        {
          "de": "Alkohol",
          "en": "Alcohol"
        }
      ],
      "PrintOrder": "2",
      "CO2Value": null,
      "CO2Rating": null,
      "CO2Perc": null,
      "ClimateFriendly": null,
      "GastDesc": "Baskischer Cheesecake mit Johannisbeer-Birnenkompott",
      "date_de": "07.01.2026"
    },
    {
      "id": "5126694",
      "outlet": "cafe",
      "date": "2026-01-07",
      "CalendarWeek": "2",
      "day": "Mittwoch",
      "mealtime": "Mittagessen",
      "IdentNr": "12026010798003",
      "itemId": "21063",
      "RecipeID": "8211",
      "ProductPrice": "0.50",
      "ProductPrice_2": null,
      "GastDesc_de": "LES ARLETTES (Französische Blätterteigkekse) Vegan",
      "GastDesc_en": "LES ARLETTES  (French Puff Pastry Cookies) Vegan",
      "MenuName": "MINIS",
      "allergene": {
        "gluten": "Glutenhaltiges Getreide"
      },
      "merkmale": {
        "vegan": "Vegan",
        "vegetarisch": "Vegetarisch"
      },
      "naehrstoffe": "",
      "zusatzstoffe": [
        {
          "de": "Farbstoff",
          "en": "Colouring Agent"
        },
        {
          "de": "Alkohol",
          "en": "Alcohol"
        }
      ],
      "PrintOrder": "3",
      "CO2Value": null,
      "CO2Rating": null,
      "CO2Perc": null,
      "ClimateFriendly": null,
      "GastDesc": "LES ARLETTES (Französische Blätterteigkekse) Vegan",
      "date_de": "07.01.2026"
    },
    {
      "id": "5126695",
      "outlet": "cafe",
      "date": "2026-01-07",
      "CalendarWeek": "2",
      "day": "Mittwoch",
      "mealtime": "Mittagessen",
      "IdentNr": "12026010798005",
      "itemId": "21064",
      "RecipeID": "8330",
      "ProductPrice": "1.50",
      "ProductPrice_2": null,
      "GastDesc_de": "Saftige Brownie-Bananen-Cookies | Zuckerfrei",
      "GastDesc_en": "Fudgy Brownie Banana Cookies | Sugar-Free",
      "MenuName": "PEOPLES CHOICE",
      "allergene": {
        "erdnuss": "Erdnüsse und Erdnusserzeugnisse"
      },
      "merkmale": {
        "ohne_zucker": "Ohne_Zucker",
        "vegan": "Vegan",
        "vegetarisch": "Vegetarisch"
      },
      "naehrstoffe": "",
      "zusatzstoffe": null,
      "PrintOrder": "5",
      "CO2Value": null,
      "CO2Rating": null,
      "CO2Perc": null,
      "ClimateFriendly": null,
      "GastDesc": "Saftige Brownie-Bananen-Cookies | Zuckerfrei",
      "date_de": "07.01.2026"
    },
    {
      "id": "5126696",
      "outlet": "cafe",
      "date": "2026-01-07",
      "CalendarWeek": "2",
      "day": "Mittwoch",
      "mealtime": "Mittagessen",
      "IdentNr": "12026010798006",
      "itemId": "21061",
      "RecipeID": "8697",
      "ProductPrice": "2.50",
      "ProductPrice_2": null,
      "GastDesc_de": "Erdnussbutter-Cookie mit Schokolade und Salzkaramell | Vegan",
      "GastDesc_en": "Peanutbutter Cookie with Chocolate Salty Caramel | Vegan",
      "MenuName": "SEASON",
      "allergene": {
        "gluten": "Glutenhaltiges Getreide",
        "soja": "Soja und Sojaerzeugnisse",
        "erdnuss": "Erdnüsse und Erdnusserzeugnisse"
      },
      "merkmale": "",
      "naehrstoffe": "",
      "zusatzstoffe": [
        {
          "de": "Farbstoff",
          "en": "Colouring Agent"
        },
        {
          "de": "Antioxidationsmittel",
          "en": "Antioxidation"
        },
        {
          "de": "Alkohol",
          "en": "Alcohol"
        }
      ],
      "PrintOrder": "6",
      "CO2Value": null,
      "CO2Rating": null,
      "CO2Perc": null,
      "ClimateFriendly": null,
      "GastDesc": "Erdnussbutter-Cookie mit Schokolade und Salzkaramell | Vegan",
      "date_de": "07.01.2026"
    },
    {
      "id": "5126697",
      "outlet": "cafe",
      "date": "2026-01-07",
      "CalendarWeek": "2",
      "day": "Mittwoch",
      "mealtime": "Mittagessen",
      "IdentNr": "12026010798007",
      "itemId": "12776",
      "RecipeID": "8453",
      "ProductPrice": "2.50",
      "ProductPrice_2": null,
      "GastDesc_de": "Oreo-Cheesecake-Cookies",
      "GastDesc_en": "Oreo Cheesecake Cookies",
      "MenuName": "COOKIE",
      "allergene": {
        "gluten": "Glutenhaltiges Getreide",
        "huhnerei": "Hühnerei und Hühnereierzeugnisse",
        "milch": "Milch und Milcherzeugnisse"
      },
      "merkmale": "",
      "naehrstoffe": "",
      "zusatzstoffe": [
        {
          "de": "Farbstoff",
          "en": "Colouring Agent"
        },
        {
          "de": "Alkohol",
          "en": "Alcohol"
        }
      ],
      "PrintOrder": "7",
      "CO2Value": null,
      "CO2Rating": null,
      "CO2Perc": null,
      "ClimateFriendly": null,
      "GastDesc": "Oreo-Cheesecake-Cookies",
      "date_de": "07.01.2026"
    },
    {
      "id": "5126698",
      "outlet": "cafe",
      "date": "2026-01-07",
      "CalendarWeek": "2",
      "day": "Mittwoch",
      "mealtime": "Mittagessen",
      "IdentNr": "12026010798008",
      "itemId": "12777",
      "RecipeID": "8349",
      "ProductPrice": "2.70",
      "ProductPrice_2": null,
      "GastDesc_de": "\"Banana Bread\" mit Blaubeeren | Zuckerfrei",
      "GastDesc_en": "\"Banana Bread\" with Blueberries | Sugar-Free",
      "MenuName": "TAG des KASTENKUCHENS",
      "allergene": {
        "gluten": "Glutenhaltiges Getreide",
        "huhnerei": "Hühnerei und Hühnereierzeugnisse",
        "milch": "Milch und Milcherzeugnisse"
      },
      "merkmale": {
        "ohne_zucker": "Ohne_Zucker"
      },
      "naehrstoffe": "",
      "zusatzstoffe": null,
      "PrintOrder": "8",
      "CO2Value": null,
      "CO2Rating": null,
      "CO2Perc": null,
      "ClimateFriendly": null,
      "GastDesc": "\"Banana Bread\" mit Blaubeeren | Zuckerfrei",
      "date_de": "07.01.2026"
    },
    {
      "id": "5126699",
      "outlet": "cafe",
      "date": "2026-01-07",
      "CalendarWeek": "2",
      "day": "Mittwoch",
      "mealtime": "Mittagessen",
      "IdentNr": "12026010798011",
      "itemId": "16256",
      "RecipeID": "8775",
      "ProductPrice": "1.50",
      "ProductPrice_2": null,
      "GastDesc_de": "Schwedische Haferkekse | Vegan",
      "GastDesc_en": "Swedish Style Oatmeal Cookies | Vegan",
      "MenuName": "VEGAN SPECIAL",
      "allergene": {
        "gluten": "Glutenhaltiges Getreide"
      },
      "merkmale": {
        "vegan": "Vegan",
        "vegetarisch": "Vegetarisch"
      },
      "naehrstoffe": "",
      "zusatzstoffe": [
        {
          "de": "Farbstoff",
          "en": "Colouring Agent"
        },
        {
          "de": "Antioxidationsmittel",
          "en": "Antioxidation"
        },
        {
          "de": "Alkohol",
          "en": "Alcohol"
        }
      ],
      "PrintOrder": "11",
      "CO2Value": null,
      "CO2Rating": null,
      "CO2Perc": null,
      "ClimateFriendly": null,
      "GastDesc": "Schwedische Haferkekse | Vegan",
      "date_de": "07.01.2026"
    },
    {
      "id": "5126700",
      "outlet": "cafe",
      "date": "2026-01-08",
      "CalendarWeek": "2",
      "day": "Donnerstag",
      "mealtime": "Mittagessen",
      "IdentNr": "12026010898001",
      "itemId": "21059",
      "RecipeID": "8054",
      "ProductPrice": "3.20",
      "ProductPrice_2": null,
      "GastDesc_de": "Pflaumenmus-Croffin mit Vanilleschmand",
      "GastDesc_en": "Plum Jam Croffin with Vanilla Sour Cream",
      "MenuName": "CROFFIN",
      "allergene": {
        "gluten": "Glutenhaltiges Getreide",
        "schalenfruchte": "Schalenfrüchte und Schalenfruchterzeugnisse",
        "huhnerei": "Hühnerei und Hühnereierzeugnisse",
        "soja": "Soja und Sojaerzeugnisse",
        "milch": "Milch und Milcherzeugnisse"
      },
      "merkmale": "",
      "naehrstoffe": "",
      "zusatzstoffe": [
        {
          "de": "Farbstoff",
          "en": "Colouring Agent"
        },
        {
          "de": "Alkohol",
          "en": "Alcohol"
        }
      ],
      "PrintOrder": "1",
      "CO2Value": null,
      "CO2Rating": null,
      "CO2Perc": null,
      "ClimateFriendly": null,
      "GastDesc": "Pflaumenmus-Croffin mit Vanilleschmand",
      "date_de": "08.01.2026"
    },
    {
      "id": "5126701",
      "outlet": "cafe",
      "date": "2026-01-08",
      "CalendarWeek": "2",
      "day": "Donnerstag",
      "mealtime": "Mittagessen",
      "IdentNr": "12026010898002",
      "itemId": "21062",
      "RecipeID": "8871",
      "ProductPrice": "3.60",
      "ProductPrice_2": null,
      "GastDesc_de": "Baskischer Cheesecake mit Johannisbeer-Birnenkompott",
      "GastDesc_en": "Basque-style Cheesecake with Black Currant and Pear Compote",
      "MenuName": "FAVOURITES",
      "allergene": {
        "huhnerei": "Hühnerei und Hühnereierzeugnisse",
        "milch": "Milch und Milcherzeugnisse"
      },
      "merkmale": "",
      "naehrstoffe": "",
      "zusatzstoffe": [
        {
          "de": "Farbstoff",
          "en": "Colouring Agent"
        },
        {
          "de": "Alkohol",
          "en": "Alcohol"
        }
      ],
      "PrintOrder": "2",
      "CO2Value": null,
      "CO2Rating": null,
      "CO2Perc": null,
      "ClimateFriendly": null,
      "GastDesc": "Baskischer Cheesecake mit Johannisbeer-Birnenkompott",
      "date_de": "08.01.2026"
    },
    {
      "id": "5126702",
      "outlet": "cafe",
      "date": "2026-01-08",
      "CalendarWeek": "2",
      "day": "Donnerstag",
      "mealtime": "Mittagessen",
      "IdentNr": "12026010898003",
      "itemId": "21063",
      "RecipeID": "8211",
      "ProductPrice": "0.50",
      "ProductPrice_2": null,
      "GastDesc_de": "LES ARLETTES (Französische Blätterteigkekse) Vegan",
      "GastDesc_en": "LES ARLETTES  (French Puff Pastry Cookies) Vegan",
      "MenuName": "MINIS",
      "allergene": {
        "gluten": "Glutenhaltiges Getreide"
      },
      "merkmale": {
        "vegan": "Vegan",
        "vegetarisch": "Vegetarisch"
      },
      "naehrstoffe": "",
      "zusatzstoffe": [
        {
          "de": "Farbstoff",
          "en": "Colouring Agent"
        },
        {
          "de": "Alkohol",
          "en": "Alcohol"
        }
      ],
      "PrintOrder": "3",
      "CO2Value": null,
      "CO2Rating": null,
      "CO2Perc": null,
      "ClimateFriendly": null,
      "GastDesc": "LES ARLETTES (Französische Blätterteigkekse) Vegan",
      "date_de": "08.01.2026"
    },
    {
      "id": "5126703",
      "outlet": "cafe",
      "date": "2026-01-08",
      "CalendarWeek": "2",
      "day": "Donnerstag",
      "mealtime": "Mittagessen",
      "IdentNr": "12026010898005",
      "itemId": "21064",
      "RecipeID": "8330",
      "ProductPrice": "1.50",
      "ProductPrice_2": null,
      "GastDesc_de": "Saftige Brownie-Bananen-Cookies | Zuckerfrei",
      "GastDesc_en": "Fudgy Brownie Banana Cookies | Sugar-Free",
      "MenuName": "PEOPLES CHOICE",
      "allergene": {
        "erdnuss": "Erdnüsse und Erdnusserzeugnisse"
      },
      "merkmale": {
        "ohne_zucker": "Ohne_Zucker",
        "vegan": "Vegan",
        "vegetarisch": "Vegetarisch"
      },
      "naehrstoffe": "",
      "zusatzstoffe": null,
      "PrintOrder": "5",
      "CO2Value": null,
      "CO2Rating": null,
      "CO2Perc": null,
      "ClimateFriendly": null,
      "GastDesc": "Saftige Brownie-Bananen-Cookies | Zuckerfrei",
      "date_de": "08.01.2026"
    },
    {
      "id": "5126704",
      "outlet": "cafe",
      "date": "2026-01-08",
      "CalendarWeek": "2",
      "day": "Donnerstag",
      "mealtime": "Mittagessen",
      "IdentNr": "12026010898006",
      "itemId": "21061",
      "RecipeID": "8697",
      "ProductPrice": "2.50",
      "ProductPrice_2": null,
      "GastDesc_de": "Erdnussbutter-Cookie mit Schokolade und Salzkaramell | Vegan",
      "GastDesc_en": "Peanutbutter Cookie with Chocolate Salty Caramel | Vegan",
      "MenuName": "SEASON",
      "allergene": {
        "gluten": "Glutenhaltiges Getreide",
        "soja": "Soja und Sojaerzeugnisse",
        "erdnuss": "Erdnüsse und Erdnusserzeugnisse"
      },
      "merkmale": "",
      "naehrstoffe": "",
      "zusatzstoffe": [
        {
          "de": "Farbstoff",
          "en": "Colouring Agent"
        },
        {
          "de": "Antioxidationsmittel",
          "en": "Antioxidation"
        },
        {
          "de": "Alkohol",
          "en": "Alcohol"
        }
      ],
      "PrintOrder": "6",
      "CO2Value": null,
      "CO2Rating": null,
      "CO2Perc": null,
      "ClimateFriendly": null,
      "GastDesc": "Erdnussbutter-Cookie mit Schokolade und Salzkaramell | Vegan",
      "date_de": "08.01.2026"
    },
    {
      "id": "5126705",
      "outlet": "cafe",
      "date": "2026-01-08",
      "CalendarWeek": "2",
      "day": "Donnerstag",
      "mealtime": "Mittagessen",
      "IdentNr": "12026010898007",
      "itemId": "12776",
      "RecipeID": "8453",
      "ProductPrice": "2.50",
      "ProductPrice_2": null,
      "GastDesc_de": "Oreo-Cheesecake-Cookies",
      "GastDesc_en": "Oreo Cheesecake Cookies",
      "MenuName": "COOKIE",
      "allergene": {
        "gluten": "Glutenhaltiges Getreide",
        "huhnerei": "Hühnerei und Hühnereierzeugnisse",
        "milch": "Milch und Milcherzeugnisse"
      },
      "merkmale": "",
      "naehrstoffe": "",
      "zusatzstoffe": [
        {
          "de": "Farbstoff",
          "en": "Colouring Agent"
        },
        {
          "de": "Alkohol",
          "en": "Alcohol"
        }
      ],
      "PrintOrder": "7",
      "CO2Value": null,
      "CO2Rating": null,
      "CO2Perc": null,
      "ClimateFriendly": null,
      "GastDesc": "Oreo-Cheesecake-Cookies",
      "date_de": "08.01.2026"
    },
    {
      "id": "5126706",
      "outlet": "cafe",
      "date": "2026-01-08",
      "CalendarWeek": "2",
      "day": "Donnerstag",
      "mealtime": "Mittagessen",
      "IdentNr": "12026010898008",
      "itemId": "12777",
      "RecipeID": "8349",
      "ProductPrice": "2.70",
      "ProductPrice_2": null,
      "GastDesc_de": "\"Banana Bread\" mit Blaubeeren | Zuckerfrei",
      "GastDesc_en": "\"Banana Bread\" with Blueberries | Sugar-Free",
      "MenuName": "TAG des KASTENKUCHENS",
      "allergene": {
        "gluten": "Glutenhaltiges Getreide",
        "huhnerei": "Hühnerei und Hühnereierzeugnisse",
        "milch": "Milch und Milcherzeugnisse"
      },
      "merkmale": {
        "ohne_zucker": "Ohne_Zucker"
      },
      "naehrstoffe": "",
      "zusatzstoffe": null,
      "PrintOrder": "8",
      "CO2Value": null,
      "CO2Rating": null,
      "CO2Perc": null,
      "ClimateFriendly": null,
      "GastDesc": "\"Banana Bread\" mit Blaubeeren | Zuckerfrei",
      "date_de": "08.01.2026"
    },
    {
      "id": "5126707",
      "outlet": "cafe",
      "date": "2026-01-08",
      "CalendarWeek": "2",
      "day": "Donnerstag",
      "mealtime": "Mittagessen",
      "IdentNr": "12026010898011",
      "itemId": "16256",
      "RecipeID": "8775",
      "ProductPrice": "1.50",
      "ProductPrice_2": null,
      "GastDesc_de": "Schwedische Haferkekse | Vegan",
      "GastDesc_en": "Swedish Style Oatmeal Cookies | Vegan",
      "MenuName": "VEGAN SPECIAL",
      "allergene": {
        "gluten": "Glutenhaltiges Getreide"
      },
      "merkmale": {
        "vegan": "Vegan",
        "vegetarisch": "Vegetarisch"
      },
      "naehrstoffe": "",
      "zusatzstoffe": [
        {
          "de": "Farbstoff",
          "en": "Colouring Agent"
        },
        {
          "de": "Antioxidationsmittel",
          "en": "Antioxidation"
        },
        {
          "de": "Alkohol",
          "en": "Alcohol"
        }
      ],
      "PrintOrder": "11",
      "CO2Value": null,
      "CO2Rating": null,
      "CO2Perc": null,
      "ClimateFriendly": null,
      "GastDesc": "Schwedische Haferkekse | Vegan",
      "date_de": "08.01.2026"
    },
    {
      "id": "5126708",
      "outlet": "cafe",
      "date": "2026-01-09",
      "CalendarWeek": "2",
      "day": "Freitag",
      "mealtime": "Mittagessen",
      "IdentNr": "12026010998001",
      "itemId": "21059",
      "RecipeID": "8054",
      "ProductPrice": "3.20",
      "ProductPrice_2": null,
      "GastDesc_de": "Pflaumenmus-Croffin mit Vanilleschmand",
      "GastDesc_en": "Plum Jam Croffin with Vanilla Sour Cream",
      "MenuName": "CROFFIN",
      "allergene": {
        "gluten": "Glutenhaltiges Getreide",
        "schalenfruchte": "Schalenfrüchte und Schalenfruchterzeugnisse",
        "huhnerei": "Hühnerei und Hühnereierzeugnisse",
        "soja": "Soja und Sojaerzeugnisse",
        "milch": "Milch und Milcherzeugnisse"
      },
      "merkmale": "",
      "naehrstoffe": "",
      "zusatzstoffe": [
        {
          "de": "Farbstoff",
          "en": "Colouring Agent"
        },
        {
          "de": "Alkohol",
          "en": "Alcohol"
        }
      ],
      "PrintOrder": "1",
      "CO2Value": null,
      "CO2Rating": null,
      "CO2Perc": null,
      "ClimateFriendly": null,
      "GastDesc": "Pflaumenmus-Croffin mit Vanilleschmand",
      "date_de": "09.01.2026"
    },
    {
      "id": "5126709",
      "outlet": "cafe",
      "date": "2026-01-09",
      "CalendarWeek": "2",
      "day": "Freitag",
      "mealtime": "Mittagessen",
      "IdentNr": "12026010998002",
      "itemId": "21062",
      "RecipeID": "8871",
      "ProductPrice": "3.60",
      "ProductPrice_2": null,
      "GastDesc_de": "Baskischer Cheesecake mit Johannisbeer-Birnenkompott",
      "GastDesc_en": "Basque-style Cheesecake with Black Currant and Pear Compote",
      "MenuName": "FAVOURITES",
      "allergene": {
        "huhnerei": "Hühnerei und Hühnereierzeugnisse",
        "milch": "Milch und Milcherzeugnisse"
      },
      "merkmale": "",
      "naehrstoffe": "",
      "zusatzstoffe": [
        {
          "de": "Farbstoff",
          "en": "Colouring Agent"
        },
        {
          "de": "Alkohol",
          "en": "Alcohol"
        }
      ],
      "PrintOrder": "2",
      "CO2Value": null,
      "CO2Rating": null,
      "CO2Perc": null,
      "ClimateFriendly": null,
      "GastDesc": "Baskischer Cheesecake mit Johannisbeer-Birnenkompott",
      "date_de": "09.01.2026"
    },
    {
      "id": "5126710",
      "outlet": "cafe",
      "date": "2026-01-09",
      "CalendarWeek": "2",
      "day": "Freitag",
      "mealtime": "Mittagessen",
      "IdentNr": "12026010998003",
      "itemId": "21063",
      "RecipeID": "8211",
      "ProductPrice": "0.50",
      "ProductPrice_2": null,
      "GastDesc_de": "LES ARLETTES (Französische Blätterteigkekse) Vegan",
      "GastDesc_en": "LES ARLETTES  (French Puff Pastry Cookies) Vegan",
      "MenuName": "MINIS",
      "allergene": {
        "gluten": "Glutenhaltiges Getreide"
      },
      "merkmale": {
        "vegan": "Vegan",
        "vegetarisch": "Vegetarisch"
      },
      "naehrstoffe": "",
      "zusatzstoffe": [
        {
          "de": "Farbstoff",
          "en": "Colouring Agent"
        },
        {
          "de": "Alkohol",
          "en": "Alcohol"
        }
      ],
      "PrintOrder": "3",
      "CO2Value": null,
      "CO2Rating": null,
      "CO2Perc": null,
      "ClimateFriendly": null,
      "GastDesc": "LES ARLETTES (Französische Blätterteigkekse) Vegan",
      "date_de": "09.01.2026"
    },
    {
      "id": "5126711",
      "outlet": "cafe",
      "date": "2026-01-09",
      "CalendarWeek": "2",
      "day": "Freitag",
      "mealtime": "Mittagessen",
      "IdentNr": "12026010998005",
      "itemId": "21064",
      "RecipeID": "8330",
      "ProductPrice": "1.50",
      "ProductPrice_2": null,
      "GastDesc_de": "Saftige Brownie-Bananen-Cookies | Zuckerfrei",
      "GastDesc_en": "Fudgy Brownie Banana Cookies | Sugar-Free",
      "MenuName": "PEOPLES CHOICE",
      "allergene": {
        "erdnuss": "Erdnüsse und Erdnusserzeugnisse"
      },
      "merkmale": {
        "ohne_zucker": "Ohne_Zucker",
        "vegan": "Vegan",
        "vegetarisch": "Vegetarisch"
      },
      "naehrstoffe": "",
      "zusatzstoffe": null,
      "PrintOrder": "5",
      "CO2Value": null,
      "CO2Rating": null,
      "CO2Perc": null,
      "ClimateFriendly": null,
      "GastDesc": "Saftige Brownie-Bananen-Cookies | Zuckerfrei",
      "date_de": "09.01.2026"
    },
    {
      "id": "5126712",
      "outlet": "cafe",
      "date": "2026-01-09",
      "CalendarWeek": "2",
      "day": "Freitag",
      "mealtime": "Mittagessen",
      "IdentNr": "12026010998006",
      "itemId": "21061",
      "RecipeID": "8697",
      "ProductPrice": "2.50",
      "ProductPrice_2": null,
      "GastDesc_de": "Erdnussbutter-Cookie mit Schokolade und Salzkaramell | Vegan",
      "GastDesc_en": "Peanutbutter Cookie with Chocolate Salty Caramel | Vegan",
      "MenuName": "SEASON",
      "allergene": {
        "gluten": "Glutenhaltiges Getreide",
        "soja": "Soja und Sojaerzeugnisse",
        "erdnuss": "Erdnüsse und Erdnusserzeugnisse"
      },
      "merkmale": "",
      "naehrstoffe": "",
      "zusatzstoffe": [
        {
          "de": "Farbstoff",
          "en": "Colouring Agent"
        },
        {
          "de": "Antioxidationsmittel",
          "en": "Antioxidation"
        },
        {
          "de": "Alkohol",
          "en": "Alcohol"
        }
      ],
      "PrintOrder": "6",
      "CO2Value": null,
      "CO2Rating": null,
      "CO2Perc": null,
      "ClimateFriendly": null,
      "GastDesc": "Erdnussbutter-Cookie mit Schokolade und Salzkaramell | Vegan",
      "date_de": "09.01.2026"
    },
    {
      "id": "5126713",
      "outlet": "cafe",
      "date": "2026-01-09",
      "CalendarWeek": "2",
      "day": "Freitag",
      "mealtime": "Mittagessen",
      "IdentNr": "12026010998007",
      "itemId": "12776",
      "RecipeID": "8453",
      "ProductPrice": "2.50",
      "ProductPrice_2": null,
      "GastDesc_de": "Oreo-Cheesecake-Cookies",
      "GastDesc_en": "Oreo Cheesecake Cookies",
      "MenuName": "COOKIE",
      "allergene": {
        "gluten": "Glutenhaltiges Getreide",
        "huhnerei": "Hühnerei und Hühnereierzeugnisse",
        "milch": "Milch und Milcherzeugnisse"
      },
      "merkmale": "",
      "naehrstoffe": "",
      "zusatzstoffe": [
        {
          "de": "Farbstoff",
          "en": "Colouring Agent"
        },
        {
          "de": "Alkohol",
          "en": "Alcohol"
        }
      ],
      "PrintOrder": "7",
      "CO2Value": null,
      "CO2Rating": null,
      "CO2Perc": null,
      "ClimateFriendly": null,
      "GastDesc": "Oreo-Cheesecake-Cookies",
      "date_de": "09.01.2026"
    },
    {
      "id": "5126714",
      "outlet": "cafe",
      "date": "2026-01-09",
      "CalendarWeek": "2",
      "day": "Freitag",
      "mealtime": "Mittagessen",
      "IdentNr": "12026010998008",
      "itemId": "12777",
      "RecipeID": "8349",
      "ProductPrice": "2.70",
      "ProductPrice_2": null,
      "GastDesc_de": "\"Banana Bread\" mit Blaubeeren | Zuckerfrei",
      "GastDesc_en": "\"Banana Bread\" with Blueberries | Sugar-Free",
      "MenuName": "TAG des KASTENKUCHENS",
      "allergene": {
        "gluten": "Glutenhaltiges Getreide",
        "huhnerei": "Hühnerei und Hühnereierzeugnisse",
        "milch": "Milch und Milcherzeugnisse"
      },
      "merkmale": {
        "ohne_zucker": "Ohne_Zucker"
      },
      "naehrstoffe": "",
      "zusatzstoffe": null,
      "PrintOrder": "8",
      "CO2Value": null,
      "CO2Rating": null,
      "CO2Perc": null,
      "ClimateFriendly": null,
      "GastDesc": "\"Banana Bread\" mit Blaubeeren | Zuckerfrei",
      "date_de": "09.01.2026"
    },
    {
      "id": "5126715",
      "outlet": "cafe",
      "date": "2026-01-09",
      "CalendarWeek": "2",
      "day": "Freitag",
      "mealtime": "Mittagessen",
      "IdentNr": "12026010998011",
      "itemId": "16256",
      "RecipeID": "8775",
      "ProductPrice": "1.50",
      "ProductPrice_2": null,
      "GastDesc_de": "Schwedische Haferkekse | Vegan",
      "GastDesc_en": "Swedish Style Oatmeal Cookies | Vegan",
      "MenuName": "VEGAN SPECIAL",
      "allergene": {
        "gluten": "Glutenhaltiges Getreide"
      },
      "merkmale": {
        "vegan": "Vegan",
        "vegetarisch": "Vegetarisch"
      },
      "naehrstoffe": "",
      "zusatzstoffe": [
        {
          "de": "Farbstoff",
          "en": "Colouring Agent"
        },
        {
          "de": "Antioxidationsmittel",
          "en": "Antioxidation"
        },
        {
          "de": "Alkohol",
          "en": "Alcohol"
        }
      ],
      "PrintOrder": "11",
      "CO2Value": null,
      "CO2Rating": null,
      "CO2Perc": null,
      "ClimateFriendly": null,
      "GastDesc": "Schwedische Haferkekse | Vegan",
      "date_de": "09.01.2026"
    },
    {
      "id": "5126716",
      "outlet": "cafe",
      "date": "2026-01-12",
      "CalendarWeek": "2",
      "day": "Montag",
      "mealtime": "Mittagessen",
      "IdentNr": "12026011298001",
      "itemId": "21059",
      "RecipeID": "8054",
      "ProductPrice": "3.20",
      "ProductPrice_2": null,
      "GastDesc_de": "Pflaumenmus-Croffin mit Vanilleschmand",
      "GastDesc_en": "Plum Jam Croffin with Vanilla Sour Cream",
      "MenuName": "CROFFIN",
      "allergene": {
        "gluten": "Glutenhaltiges Getreide",
        "schalenfruchte": "Schalenfrüchte und Schalenfruchterzeugnisse",
        "huhnerei": "Hühnerei und Hühnereierzeugnisse",
        "soja": "Soja und Sojaerzeugnisse",
        "milch": "Milch und Milcherzeugnisse"
      },
      "merkmale": "",
      "naehrstoffe": "",
      "zusatzstoffe": [
        {
          "de": "Farbstoff",
          "en": "Colouring Agent"
        },
        {
          "de": "Alkohol",
          "en": "Alcohol"
        }
      ],
      "PrintOrder": "1",
      "CO2Value": null,
      "CO2Rating": null,
      "CO2Perc": null,
      "ClimateFriendly": null,
      "GastDesc": "Pflaumenmus-Croffin mit Vanilleschmand",
      "date_de": "12.01.2026"
    },
    {
      "id": "5126717",
      "outlet": "cafe",
      "date": "2026-01-12",
      "CalendarWeek": "2",
      "day": "Montag",
      "mealtime": "Mittagessen",
      "IdentNr": "12026011298002",
      "itemId": "21062",
      "RecipeID": "8871",
      "ProductPrice": "3.60",
      "ProductPrice_2": null,
      "GastDesc_de": "Baskischer Cheesecake mit Johannisbeer-Birnenkompott",
      "GastDesc_en": "Basque-style Cheesecake with Black Currant and Pear Compote",
      "MenuName": "FAVOURITES",
      "allergene": {
        "huhnerei": "Hühnerei und Hühnereierzeugnisse",
        "milch": "Milch und Milcherzeugnisse"
      },
      "merkmale": "",
      "naehrstoffe": "",
      "zusatzstoffe": [
        {
          "de": "Farbstoff",
          "en": "Colouring Agent"
        },
        {
          "de": "Alkohol",
          "en": "Alcohol"
        }
      ],
      "PrintOrder": "2",
      "CO2Value": null,
      "CO2Rating": null,
      "CO2Perc": null,
      "ClimateFriendly": null,
      "GastDesc": "Baskischer Cheesecake mit Johannisbeer-Birnenkompott",
      "date_de": "12.01.2026"
    },
    {
      "id": "5126718",
      "outlet": "cafe",
      "date": "2026-01-12",
      "CalendarWeek": "2",
      "day": "Montag",
      "mealtime": "Mittagessen",
      "IdentNr": "12026011298003",
      "itemId": "21063",
      "RecipeID": "8211",
      "ProductPrice": "0.50",
      "ProductPrice_2": null,
      "GastDesc_de": "LES ARLETTES (Französische Blätterteigkekse) Vegan",
      "GastDesc_en": "LES ARLETTES  (French Puff Pastry Cookies) Vegan",
      "MenuName": "MINIS",
      "allergene": {
        "gluten": "Glutenhaltiges Getreide"
      },
      "merkmale": {
        "vegan": "Vegan",
        "vegetarisch": "Vegetarisch"
      },
      "naehrstoffe": "",
      "zusatzstoffe": [
        {
          "de": "Farbstoff",
          "en": "Colouring Agent"
        },
        {
          "de": "Alkohol",
          "en": "Alcohol"
        }
      ],
      "PrintOrder": "3",
      "CO2Value": null,
      "CO2Rating": null,
      "CO2Perc": null,
      "ClimateFriendly": null,
      "GastDesc": "LES ARLETTES (Französische Blätterteigkekse) Vegan",
      "date_de": "12.01.2026"
    },
    {
      "id": "5126719",
      "outlet": "cafe",
      "date": "2026-01-12",
      "CalendarWeek": "2",
      "day": "Montag",
      "mealtime": "Mittagessen",
      "IdentNr": "12026011298005",
      "itemId": "21064",
      "RecipeID": "8330",
      "ProductPrice": "1.50",
      "ProductPrice_2": null,
      "GastDesc_de": "Saftige Brownie-Bananen-Cookies | Zuckerfrei",
      "GastDesc_en": "Fudgy Brownie Banana Cookies | Sugar-Free",
      "MenuName": "PEOPLES CHOICE",
      "allergene": {
        "erdnuss": "Erdnüsse und Erdnusserzeugnisse"
      },
      "merkmale": {
        "ohne_zucker": "Ohne_Zucker",
        "vegan": "Vegan",
        "vegetarisch": "Vegetarisch"
      },
      "naehrstoffe": "",
      "zusatzstoffe": null,
      "PrintOrder": "5",
      "CO2Value": null,
      "CO2Rating": null,
      "CO2Perc": null,
      "ClimateFriendly": null,
      "GastDesc": "Saftige Brownie-Bananen-Cookies | Zuckerfrei",
      "date_de": "12.01.2026"
    },
    {
      "id": "5126720",
      "outlet": "cafe",
      "date": "2026-01-12",
      "CalendarWeek": "2",
      "day": "Montag",
      "mealtime": "Mittagessen",
      "IdentNr": "12026011298006",
      "itemId": "21061",
      "RecipeID": "8697",
      "ProductPrice": "2.50",
      "ProductPrice_2": null,
      "GastDesc_de": "Erdnussbutter-Cookie mit Schokolade und Salzkaramell | Vegan",
      "GastDesc_en": "Peanutbutter Cookie with Chocolate Salty Caramel | Vegan",
      "MenuName": "SEASON",
      "allergene": {
        "gluten": "Glutenhaltiges Getreide",
        "soja": "Soja und Sojaerzeugnisse",
        "erdnuss": "Erdnüsse und Erdnusserzeugnisse"
      },
      "merkmale": "",
      "naehrstoffe": "",
      "zusatzstoffe": [
        {
          "de": "Farbstoff",
          "en": "Colouring Agent"
        },
        {
          "de": "Antioxidationsmittel",
          "en": "Antioxidation"
        },
        {
          "de": "Alkohol",
          "en": "Alcohol"
        }
      ],
      "PrintOrder": "6",
      "CO2Value": null,
      "CO2Rating": null,
      "CO2Perc": null,
      "ClimateFriendly": null,
      "GastDesc": "Erdnussbutter-Cookie mit Schokolade und Salzkaramell | Vegan",
      "date_de": "12.01.2026"
    },
    {
      "id": "5126721",
      "outlet": "cafe",
      "date": "2026-01-12",
      "CalendarWeek": "2",
      "day": "Montag",
      "mealtime": "Mittagessen",
      "IdentNr": "12026011298007",
      "itemId": "12776",
      "RecipeID": "8453",
      "ProductPrice": "2.50",
      "ProductPrice_2": null,
      "GastDesc_de": "Oreo-Cheesecake-Cookies",
      "GastDesc_en": "Oreo Cheesecake Cookies",
      "MenuName": "COOKIE",
      "allergene": {
        "gluten": "Glutenhaltiges Getreide",
        "huhnerei": "Hühnerei und Hühnereierzeugnisse",
        "milch": "Milch und Milcherzeugnisse"
      },
      "merkmale": "",
      "naehrstoffe": "",
      "zusatzstoffe": [
        {
          "de": "Farbstoff",
          "en": "Colouring Agent"
        },
        {
          "de": "Alkohol",
          "en": "Alcohol"
        }
      ],
      "PrintOrder": "7",
      "CO2Value": null,
      "CO2Rating": null,
      "CO2Perc": null,
      "ClimateFriendly": null,
      "GastDesc": "Oreo-Cheesecake-Cookies",
      "date_de": "12.01.2026"
    },
    {
      "id": "5126722",
      "outlet": "cafe",
      "date": "2026-01-12",
      "CalendarWeek": "2",
      "day": "Montag",
      "mealtime": "Mittagessen",
      "IdentNr": "12026011298008",
      "itemId": "12777",
      "RecipeID": "9121",
      "ProductPrice": "2.70",
      "ProductPrice_2": null,
      "GastDesc_de": "Carrotcake Bananabread Zuckerfrei",
      "GastDesc_en": "Carrotcake Bananabread Sugarfree",
      "MenuName": "TAG des KASTENKUCHENS",
      "allergene": {
        "gluten": "Glutenhaltiges Getreide",
        "milch": "Milch und Milcherzeugnisse",
        "schwefel": "Schwefeldioxid und Sulfide"
      },
      "merkmale": "",
      "naehrstoffe": "",
      "zusatzstoffe": [
        {
          "de": "Farbstoff",
          "en": "Colouring Agent"
        }
      ],
      "PrintOrder": "8",
      "CO2Value": null,
      "CO2Rating": null,
      "CO2Perc": null,
      "ClimateFriendly": null,
      "GastDesc": "Carrotcake Bananabread Zuckerfrei",
      "date_de": "12.01.2026"
    },
    {
      "id": "5126723",
      "outlet": "cafe",
      "date": "2026-01-12",
      "CalendarWeek": "2",
      "day": "Montag",
      "mealtime": "Mittagessen",
      "IdentNr": "12026011298011",
      "itemId": "16256",
      "RecipeID": "9122",
      "ProductPrice": "1.50",
      "ProductPrice_2": null,
      "GastDesc_de": "Sesamkeks Mehlfrei Vegan",
      "GastDesc_en": "Sesame Cookie without flour and vegan",
      "MenuName": "VEGAN SPECIAL",
      "allergene": {
        "schalenfruchte": "Schalenfrüchte und Schalenfruchterzeugnisse",
        "sesam": "Sesamsamen und Sesamsamenerzeugnisse"
      },
      "merkmale": "",
      "naehrstoffe": "",
      "zusatzstoffe": [
        {
          "de": "Farbstoff",
          "en": "Colouring Agent"
        },
        {
          "de": "Alkohol",
          "en": "Alcohol"
        }
      ],
      "PrintOrder": "11",
      "CO2Value": null,
      "CO2Rating": null,
      "CO2Perc": null,
      "ClimateFriendly": null,
      "GastDesc": "Sesamkeks Mehlfrei Vegan",
      "date_de": "12.01.2026"
    },
    {
      "id": "5126724",
      "outlet": "cafe",
      "date": "2026-01-13",
      "CalendarWeek": "2",
      "day": "Dienstag",
      "mealtime": "Mittagessen",
      "IdentNr": "12026011398001",
      "itemId": "21059",
      "RecipeID": "8054",
      "ProductPrice": "3.20",
      "ProductPrice_2": null,
      "GastDesc_de": "Pflaumenmus-Croffin mit Vanilleschmand",
      "GastDesc_en": "Plum Jam Croffin with Vanilla Sour Cream",
      "MenuName": "CROFFIN",
      "allergene": {
        "gluten": "Glutenhaltiges Getreide",
        "schalenfruchte": "Schalenfrüchte und Schalenfruchterzeugnisse",
        "huhnerei": "Hühnerei und Hühnereierzeugnisse",
        "soja": "Soja und Sojaerzeugnisse",
        "milch": "Milch und Milcherzeugnisse"
      },
      "merkmale": "",
      "naehrstoffe": "",
      "zusatzstoffe": [
        {
          "de": "Farbstoff",
          "en": "Colouring Agent"
        },
        {
          "de": "Alkohol",
          "en": "Alcohol"
        }
      ],
      "PrintOrder": "1",
      "CO2Value": null,
      "CO2Rating": null,
      "CO2Perc": null,
      "ClimateFriendly": null,
      "GastDesc": "Pflaumenmus-Croffin mit Vanilleschmand",
      "date_de": "13.01.2026"
    },
    {
      "id": "5126725",
      "outlet": "cafe",
      "date": "2026-01-13",
      "CalendarWeek": "2",
      "day": "Dienstag",
      "mealtime": "Mittagessen",
      "IdentNr": "12026011398002",
      "itemId": "21062",
      "RecipeID": "8871",
      "ProductPrice": "3.60",
      "ProductPrice_2": null,
      "GastDesc_de": "Baskischer Cheesecake mit Johannisbeer-Birnenkompott",
      "GastDesc_en": "Basque-style Cheesecake with Black Currant and Pear Compote",
      "MenuName": "FAVOURITES",
      "allergene": {
        "huhnerei": "Hühnerei und Hühnereierzeugnisse",
        "milch": "Milch und Milcherzeugnisse"
      },
      "merkmale": "",
      "naehrstoffe": "",
      "zusatzstoffe": [
        {
          "de": "Farbstoff",
          "en": "Colouring Agent"
        },
        {
          "de": "Alkohol",
          "en": "Alcohol"
        }
      ],
      "PrintOrder": "2",
      "CO2Value": null,
      "CO2Rating": null,
      "CO2Perc": null,
      "ClimateFriendly": null,
      "GastDesc": "Baskischer Cheesecake mit Johannisbeer-Birnenkompott",
      "date_de": "13.01.2026"
    },
    {
      "id": "5126726",
      "outlet": "cafe",
      "date": "2026-01-13",
      "CalendarWeek": "2",
      "day": "Dienstag",
      "mealtime": "Mittagessen",
      "IdentNr": "12026011398003",
      "itemId": "21063",
      "RecipeID": "8211",
      "ProductPrice": "0.50",
      "ProductPrice_2": null,
      "GastDesc_de": "LES ARLETTES (Französische Blätterteigkekse) Vegan",
      "GastDesc_en": "LES ARLETTES  (French Puff Pastry Cookies) Vegan",
      "MenuName": "MINIS",
      "allergene": {
        "gluten": "Glutenhaltiges Getreide"
      },
      "merkmale": {
        "vegan": "Vegan",
        "vegetarisch": "Vegetarisch"
      },
      "naehrstoffe": "",
      "zusatzstoffe": [
        {
          "de": "Farbstoff",
          "en": "Colouring Agent"
        },
        {
          "de": "Alkohol",
          "en": "Alcohol"
        }
      ],
      "PrintOrder": "3",
      "CO2Value": null,
      "CO2Rating": null,
      "CO2Perc": null,
      "ClimateFriendly": null,
      "GastDesc": "LES ARLETTES (Französische Blätterteigkekse) Vegan",
      "date_de": "13.01.2026"
    },
    {
      "id": "5126727",
      "outlet": "cafe",
      "date": "2026-01-13",
      "CalendarWeek": "2",
      "day": "Dienstag",
      "mealtime": "Mittagessen",
      "IdentNr": "12026011398005",
      "itemId": "21064",
      "RecipeID": "8330",
      "ProductPrice": "1.50",
      "ProductPrice_2": null,
      "GastDesc_de": "Saftige Brownie-Bananen-Cookies | Zuckerfrei",
      "GastDesc_en": "Fudgy Brownie Banana Cookies | Sugar-Free",
      "MenuName": "PEOPLES CHOICE",
      "allergene": {
        "erdnuss": "Erdnüsse und Erdnusserzeugnisse"
      },
      "merkmale": {
        "ohne_zucker": "Ohne_Zucker",
        "vegan": "Vegan",
        "vegetarisch": "Vegetarisch"
      },
      "naehrstoffe": "",
      "zusatzstoffe": null,
      "PrintOrder": "5",
      "CO2Value": null,
      "CO2Rating": null,
      "CO2Perc": null,
      "ClimateFriendly": null,
      "GastDesc": "Saftige Brownie-Bananen-Cookies | Zuckerfrei",
      "date_de": "13.01.2026"
    },
    {
      "id": "5126728",
      "outlet": "cafe",
      "date": "2026-01-13",
      "CalendarWeek": "2",
      "day": "Dienstag",
      "mealtime": "Mittagessen",
      "IdentNr": "12026011398006",
      "itemId": "21061",
      "RecipeID": "8697",
      "ProductPrice": "2.50",
      "ProductPrice_2": null,
      "GastDesc_de": "Erdnussbutter-Cookie mit Schokolade und Salzkaramell | Vegan",
      "GastDesc_en": "Peanutbutter Cookie with Chocolate Salty Caramel | Vegan",
      "MenuName": "SEASON",
      "allergene": {
        "gluten": "Glutenhaltiges Getreide",
        "soja": "Soja und Sojaerzeugnisse",
        "erdnuss": "Erdnüsse und Erdnusserzeugnisse"
      },
      "merkmale": "",
      "naehrstoffe": "",
      "zusatzstoffe": [
        {
          "de": "Farbstoff",
          "en": "Colouring Agent"
        },
        {
          "de": "Antioxidationsmittel",
          "en": "Antioxidation"
        },
        {
          "de": "Alkohol",
          "en": "Alcohol"
        }
      ],
      "PrintOrder": "6",
      "CO2Value": null,
      "CO2Rating": null,
      "CO2Perc": null,
      "ClimateFriendly": null,
      "GastDesc": "Erdnussbutter-Cookie mit Schokolade und Salzkaramell | Vegan",
      "date_de": "13.01.2026"
    },
    {
      "id": "5126729",
      "outlet": "cafe",
      "date": "2026-01-13",
      "CalendarWeek": "2",
      "day": "Dienstag",
      "mealtime": "Mittagessen",
      "IdentNr": "12026011398007",
      "itemId": "12776",
      "RecipeID": "8453",
      "ProductPrice": "2.50",
      "ProductPrice_2": null,
      "GastDesc_de": "Oreo-Cheesecake-Cookies",
      "GastDesc_en": "Oreo Cheesecake Cookies",
      "MenuName": "COOKIE",
      "allergene": {
        "gluten": "Glutenhaltiges Getreide",
        "huhnerei": "Hühnerei und Hühnereierzeugnisse",
        "milch": "Milch und Milcherzeugnisse"
      },
      "merkmale": "",
      "naehrstoffe": "",
      "zusatzstoffe": [
        {
          "de": "Farbstoff",
          "en": "Colouring Agent"
        },
        {
          "de": "Alkohol",
          "en": "Alcohol"
        }
      ],
      "PrintOrder": "7",
      "CO2Value": null,
      "CO2Rating": null,
      "CO2Perc": null,
      "ClimateFriendly": null,
      "GastDesc": "Oreo-Cheesecake-Cookies",
      "date_de": "13.01.2026"
    },
    {
      "id": "5126730",
      "outlet": "cafe",
      "date": "2026-01-13",
      "CalendarWeek": "2",
      "day": "Dienstag",
      "mealtime": "Mittagessen",
      "IdentNr": "12026011398008",
      "itemId": "12777",
      "RecipeID": "9121",
      "ProductPrice": "2.70",
      "ProductPrice_2": null,
      "GastDesc_de": "Carrotcake Bananabread Zuckerfrei",
      "GastDesc_en": "Carrotcake Bananabread Sugarfree",
      "MenuName": "TAG des KASTENKUCHENS",
      "allergene": {
        "gluten": "Glutenhaltiges Getreide",
        "milch": "Milch und Milcherzeugnisse",
        "schwefel": "Schwefeldioxid und Sulfide"
      },
      "merkmale": "",
      "naehrstoffe": "",
      "zusatzstoffe": [
        {
          "de": "Farbstoff",
          "en": "Colouring Agent"
        }
      ],
      "PrintOrder": "8",
      "CO2Value": null,
      "CO2Rating": null,
      "CO2Perc": null,
      "ClimateFriendly": null,
      "GastDesc": "Carrotcake Bananabread Zuckerfrei",
      "date_de": "13.01.2026"
    },
    {
      "id": "5126731",
      "outlet": "cafe",
      "date": "2026-01-13",
      "CalendarWeek": "2",
      "day": "Dienstag",
      "mealtime": "Mittagessen",
      "IdentNr": "12026011398011",
      "itemId": "16256",
      "RecipeID": "9122",
      "ProductPrice": "1.50",
      "ProductPrice_2": null,
      "GastDesc_de": "Sesamkeks Mehlfrei Vegan",
      "GastDesc_en": "Sesame Cookie without flour and vegan",
      "MenuName": "VEGAN SPECIAL",
      "allergene": {
        "schalenfruchte": "Schalenfrüchte und Schalenfruchterzeugnisse",
        "sesam": "Sesamsamen und Sesamsamenerzeugnisse"
      },
      "merkmale": "",
      "naehrstoffe": "",
      "zusatzstoffe": [
        {
          "de": "Farbstoff",
          "en": "Colouring Agent"
        },
        {
          "de": "Alkohol",
          "en": "Alcohol"
        }
      ],
      "PrintOrder": "11",
      "CO2Value": null,
      "CO2Rating": null,
      "CO2Perc": null,
      "ClimateFriendly": null,
      "GastDesc": "Sesamkeks Mehlfrei Vegan",
      "date_de": "13.01.2026"
    },
    {
      "id": "5126732",
      "outlet": "cafe",
      "date": "2026-01-14",
      "CalendarWeek": "2",
      "day": "Mittwoch",
      "mealtime": "Mittagessen",
      "IdentNr": "12026011498001",
      "itemId": "21059",
      "RecipeID": "8054",
      "ProductPrice": "3.20",
      "ProductPrice_2": null,
      "GastDesc_de": "Pflaumenmus-Croffin mit Vanilleschmand",
      "GastDesc_en": "Plum Jam Croffin with Vanilla Sour Cream",
      "MenuName": "CROFFIN",
      "allergene": {
        "gluten": "Glutenhaltiges Getreide",
        "schalenfruchte": "Schalenfrüchte und Schalenfruchterzeugnisse",
        "huhnerei": "Hühnerei und Hühnereierzeugnisse",
        "soja": "Soja und Sojaerzeugnisse",
        "milch": "Milch und Milcherzeugnisse"
      },
      "merkmale": "",
      "naehrstoffe": "",
      "zusatzstoffe": [
        {
          "de": "Farbstoff",
          "en": "Colouring Agent"
        },
        {
          "de": "Alkohol",
          "en": "Alcohol"
        }
      ],
      "PrintOrder": "1",
      "CO2Value": null,
      "CO2Rating": null,
      "CO2Perc": null,
      "ClimateFriendly": null,
      "GastDesc": "Pflaumenmus-Croffin mit Vanilleschmand",
      "date_de": "14.01.2026"
    },
    {
      "id": "5126733",
      "outlet": "cafe",
      "date": "2026-01-14",
      "CalendarWeek": "2",
      "day": "Mittwoch",
      "mealtime": "Mittagessen",
      "IdentNr": "12026011498002",
      "itemId": "21062",
      "RecipeID": "8871",
      "ProductPrice": "3.60",
      "ProductPrice_2": null,
      "GastDesc_de": "Baskischer Cheesecake mit Johannisbeer-Birnenkompott",
      "GastDesc_en": "Basque-style Cheesecake with Black Currant and Pear Compote",
      "MenuName": "FAVOURITES",
      "allergene": {
        "huhnerei": "Hühnerei und Hühnereierzeugnisse",
        "milch": "Milch und Milcherzeugnisse"
      },
      "merkmale": "",
      "naehrstoffe": "",
      "zusatzstoffe": [
        {
          "de": "Farbstoff",
          "en": "Colouring Agent"
        },
        {
          "de": "Alkohol",
          "en": "Alcohol"
        }
      ],
      "PrintOrder": "2",
      "CO2Value": null,
      "CO2Rating": null,
      "CO2Perc": null,
      "ClimateFriendly": null,
      "GastDesc": "Baskischer Cheesecake mit Johannisbeer-Birnenkompott",
      "date_de": "14.01.2026"
    },
    {
      "id": "5126734",
      "outlet": "cafe",
      "date": "2026-01-14",
      "CalendarWeek": "2",
      "day": "Mittwoch",
      "mealtime": "Mittagessen",
      "IdentNr": "12026011498003",
      "itemId": "21063",
      "RecipeID": "8211",
      "ProductPrice": "0.50",
      "ProductPrice_2": null,
      "GastDesc_de": "LES ARLETTES (Französische Blätterteigkekse) Vegan",
      "GastDesc_en": "LES ARLETTES  (French Puff Pastry Cookies) Vegan",
      "MenuName": "MINIS",
      "allergene": {
        "gluten": "Glutenhaltiges Getreide"
      },
      "merkmale": {
        "vegan": "Vegan",
        "vegetarisch": "Vegetarisch"
      },
      "naehrstoffe": "",
      "zusatzstoffe": [
        {
          "de": "Farbstoff",
          "en": "Colouring Agent"
        },
        {
          "de": "Alkohol",
          "en": "Alcohol"
        }
      ],
      "PrintOrder": "3",
      "CO2Value": null,
      "CO2Rating": null,
      "CO2Perc": null,
      "ClimateFriendly": null,
      "GastDesc": "LES ARLETTES (Französische Blätterteigkekse) Vegan",
      "date_de": "14.01.2026"
    },
    {
      "id": "5126735",
      "outlet": "cafe",
      "date": "2026-01-14",
      "CalendarWeek": "2",
      "day": "Mittwoch",
      "mealtime": "Mittagessen",
      "IdentNr": "12026011498005",
      "itemId": "21064",
      "RecipeID": "8330",
      "ProductPrice": "1.50",
      "ProductPrice_2": null,
      "GastDesc_de": "Saftige Brownie-Bananen-Cookies | Zuckerfrei",
      "GastDesc_en": "Fudgy Brownie Banana Cookies | Sugar-Free",
      "MenuName": "PEOPLES CHOICE",
      "allergene": {
        "erdnuss": "Erdnüsse und Erdnusserzeugnisse"
      },
      "merkmale": {
        "ohne_zucker": "Ohne_Zucker",
        "vegan": "Vegan",
        "vegetarisch": "Vegetarisch"
      },
      "naehrstoffe": "",
      "zusatzstoffe": null,
      "PrintOrder": "5",
      "CO2Value": null,
      "CO2Rating": null,
      "CO2Perc": null,
      "ClimateFriendly": null,
      "GastDesc": "Saftige Brownie-Bananen-Cookies | Zuckerfrei",
      "date_de": "14.01.2026"
    },
    {
      "id": "5126736",
      "outlet": "cafe",
      "date": "2026-01-14",
      "CalendarWeek": "2",
      "day": "Mittwoch",
      "mealtime": "Mittagessen",
      "IdentNr": "12026011498006",
      "itemId": "21061",
      "RecipeID": "8697",
      "ProductPrice": "2.50",
      "ProductPrice_2": null,
      "GastDesc_de": "Erdnussbutter-Cookie mit Schokolade und Salzkaramell | Vegan",
      "GastDesc_en": "Peanutbutter Cookie with Chocolate Salty Caramel | Vegan",
      "MenuName": "SEASON",
      "allergene": {
        "gluten": "Glutenhaltiges Getreide",
        "soja": "Soja und Sojaerzeugnisse",
        "erdnuss": "Erdnüsse und Erdnusserzeugnisse"
      },
      "merkmale": "",
      "naehrstoffe": "",
      "zusatzstoffe": [
        {
          "de": "Farbstoff",
          "en": "Colouring Agent"
        },
        {
          "de": "Antioxidationsmittel",
          "en": "Antioxidation"
        },
        {
          "de": "Alkohol",
          "en": "Alcohol"
        }
      ],
      "PrintOrder": "6",
      "CO2Value": null,
      "CO2Rating": null,
      "CO2Perc": null,
      "ClimateFriendly": null,
      "GastDesc": "Erdnussbutter-Cookie mit Schokolade und Salzkaramell | Vegan",
      "date_de": "14.01.2026"
    },
    {
      "id": "5126737",
      "outlet": "cafe",
      "date": "2026-01-14",
      "CalendarWeek": "2",
      "day": "Mittwoch",
      "mealtime": "Mittagessen",
      "IdentNr": "12026011498007",
      "itemId": "12776",
      "RecipeID": "8453",
      "ProductPrice": "2.50",
      "ProductPrice_2": null,
      "GastDesc_de": "Oreo-Cheesecake-Cookies",
      "GastDesc_en": "Oreo Cheesecake Cookies",
      "MenuName": "COOKIE",
      "allergene": {
        "gluten": "Glutenhaltiges Getreide",
        "huhnerei": "Hühnerei und Hühnereierzeugnisse",
        "milch": "Milch und Milcherzeugnisse"
      },
      "merkmale": "",
      "naehrstoffe": "",
      "zusatzstoffe": [
        {
          "de": "Farbstoff",
          "en": "Colouring Agent"
        },
        {
          "de": "Alkohol",
          "en": "Alcohol"
        }
      ],
      "PrintOrder": "7",
      "CO2Value": null,
      "CO2Rating": null,
      "CO2Perc": null,
      "ClimateFriendly": null,
      "GastDesc": "Oreo-Cheesecake-Cookies",
      "date_de": "14.01.2026"
    },
    {
      "id": "5126738",
      "outlet": "cafe",
      "date": "2026-01-14",
      "CalendarWeek": "2",
      "day": "Mittwoch",
      "mealtime": "Mittagessen",
      "IdentNr": "12026011498008",
      "itemId": "12777",
      "RecipeID": "9121",
      "ProductPrice": "2.70",
      "ProductPrice_2": null,
      "GastDesc_de": "Carrotcake Bananabread Zuckerfrei",
      "GastDesc_en": "Carrotcake Bananabread Sugarfree",
      "MenuName": "TAG des KASTENKUCHENS",
      "allergene": {
        "gluten": "Glutenhaltiges Getreide",
        "milch": "Milch und Milcherzeugnisse",
        "schwefel": "Schwefeldioxid und Sulfide"
      },
      "merkmale": "",
      "naehrstoffe": "",
      "zusatzstoffe": [
        {
          "de": "Farbstoff",
          "en": "Colouring Agent"
        }
      ],
      "PrintOrder": "8",
      "CO2Value": null,
      "CO2Rating": null,
      "CO2Perc": null,
      "ClimateFriendly": null,
      "GastDesc": "Carrotcake Bananabread Zuckerfrei",
      "date_de": "14.01.2026"
    },
    {
      "id": "5126739",
      "outlet": "cafe",
      "date": "2026-01-14",
      "CalendarWeek": "2",
      "day": "Mittwoch",
      "mealtime": "Mittagessen",
      "IdentNr": "12026011498011",
      "itemId": "16256",
      "RecipeID": "9122",
      "ProductPrice": "1.50",
      "ProductPrice_2": null,
      "GastDesc_de": "Sesamkeks Mehlfrei Vegan",
      "GastDesc_en": "Sesame Cookie without flour and vegan",
      "MenuName": "VEGAN SPECIAL",
      "allergene": {
        "schalenfruchte": "Schalenfrüchte und Schalenfruchterzeugnisse",
        "sesam": "Sesamsamen und Sesamsamenerzeugnisse"
      },
      "merkmale": "",
      "naehrstoffe": "",
      "zusatzstoffe": [
        {
          "de": "Farbstoff",
          "en": "Colouring Agent"
        },
        {
          "de": "Alkohol",
          "en": "Alcohol"
        }
      ],
      "PrintOrder": "11",
      "CO2Value": null,
      "CO2Rating": null,
      "CO2Perc": null,
      "ClimateFriendly": null,
      "GastDesc": "Sesamkeks Mehlfrei Vegan",
      "date_de": "14.01.2026"
    },
    {
      "id": "5126740",
      "outlet": "cafe",
      "date": "2026-01-15",
      "CalendarWeek": "2",
      "day": "Donnerstag",
      "mealtime": "Mittagessen",
      "IdentNr": "12026011598001",
      "itemId": "21059",
      "RecipeID": "8054",
      "ProductPrice": "3.20",
      "ProductPrice_2": null,
      "GastDesc_de": "Pflaumenmus-Croffin mit Vanilleschmand",
      "GastDesc_en": "Plum Jam Croffin with Vanilla Sour Cream",
      "MenuName": "CROFFIN",
      "allergene": {
        "gluten": "Glutenhaltiges Getreide",
        "schalenfruchte": "Schalenfrüchte und Schalenfruchterzeugnisse",
        "huhnerei": "Hühnerei und Hühnereierzeugnisse",
        "soja": "Soja und Sojaerzeugnisse",
        "milch": "Milch und Milcherzeugnisse"
      },
      "merkmale": "",
      "naehrstoffe": "",
      "zusatzstoffe": [
        {
          "de": "Farbstoff",
          "en": "Colouring Agent"
        },
        {
          "de": "Alkohol",
          "en": "Alcohol"
        }
      ],
      "PrintOrder": "1",
      "CO2Value": null,
      "CO2Rating": null,
      "CO2Perc": null,
      "ClimateFriendly": null,
      "GastDesc": "Pflaumenmus-Croffin mit Vanilleschmand",
      "date_de": "15.01.2026"
    },
    {
      "id": "5126741",
      "outlet": "cafe",
      "date": "2026-01-15",
      "CalendarWeek": "2",
      "day": "Donnerstag",
      "mealtime": "Mittagessen",
      "IdentNr": "12026011598002",
      "itemId": "21062",
      "RecipeID": "8871",
      "ProductPrice": "3.60",
      "ProductPrice_2": null,
      "GastDesc_de": "Baskischer Cheesecake mit Johannisbeer-Birnenkompott",
      "GastDesc_en": "Basque-style Cheesecake with Black Currant and Pear Compote",
      "MenuName": "FAVOURITES",
      "allergene": {
        "huhnerei": "Hühnerei und Hühnereierzeugnisse",
        "milch": "Milch und Milcherzeugnisse"
      },
      "merkmale": "",
      "naehrstoffe": "",
      "zusatzstoffe": [
        {
          "de": "Farbstoff",
          "en": "Colouring Agent"
        },
        {
          "de": "Alkohol",
          "en": "Alcohol"
        }
      ],
      "PrintOrder": "2",
      "CO2Value": null,
      "CO2Rating": null,
      "CO2Perc": null,
      "ClimateFriendly": null,
      "GastDesc": "Baskischer Cheesecake mit Johannisbeer-Birnenkompott",
      "date_de": "15.01.2026"
    },
    {
      "id": "5126742",
      "outlet": "cafe",
      "date": "2026-01-15",
      "CalendarWeek": "2",
      "day": "Donnerstag",
      "mealtime": "Mittagessen",
      "IdentNr": "12026011598003",
      "itemId": "21063",
      "RecipeID": "8211",
      "ProductPrice": "0.50",
      "ProductPrice_2": null,
      "GastDesc_de": "LES ARLETTES (Französische Blätterteigkekse) Vegan",
      "GastDesc_en": "LES ARLETTES  (French Puff Pastry Cookies) Vegan",
      "MenuName": "MINIS",
      "allergene": {
        "gluten": "Glutenhaltiges Getreide"
      },
      "merkmale": {
        "vegan": "Vegan",
        "vegetarisch": "Vegetarisch"
      },
      "naehrstoffe": "",
      "zusatzstoffe": [
        {
          "de": "Farbstoff",
          "en": "Colouring Agent"
        },
        {
          "de": "Alkohol",
          "en": "Alcohol"
        }
      ],
      "PrintOrder": "3",
      "CO2Value": null,
      "CO2Rating": null,
      "CO2Perc": null,
      "ClimateFriendly": null,
      "GastDesc": "LES ARLETTES (Französische Blätterteigkekse) Vegan",
      "date_de": "15.01.2026"
    },
    {
      "id": "5126743",
      "outlet": "cafe",
      "date": "2026-01-15",
      "CalendarWeek": "2",
      "day": "Donnerstag",
      "mealtime": "Mittagessen",
      "IdentNr": "12026011598005",
      "itemId": "21064",
      "RecipeID": "8330",
      "ProductPrice": "1.50",
      "ProductPrice_2": null,
      "GastDesc_de": "Saftige Brownie-Bananen-Cookies | Zuckerfrei",
      "GastDesc_en": "Fudgy Brownie Banana Cookies | Sugar-Free",
      "MenuName": "PEOPLES CHOICE",
      "allergene": {
        "erdnuss": "Erdnüsse und Erdnusserzeugnisse"
      },
      "merkmale": {
        "ohne_zucker": "Ohne_Zucker",
        "vegan": "Vegan",
        "vegetarisch": "Vegetarisch"
      },
      "naehrstoffe": "",
      "zusatzstoffe": null,
      "PrintOrder": "5",
      "CO2Value": null,
      "CO2Rating": null,
      "CO2Perc": null,
      "ClimateFriendly": null,
      "GastDesc": "Saftige Brownie-Bananen-Cookies | Zuckerfrei",
      "date_de": "15.01.2026"
    },
    {
      "id": "5126744",
      "outlet": "cafe",
      "date": "2026-01-15",
      "CalendarWeek": "2",
      "day": "Donnerstag",
      "mealtime": "Mittagessen",
      "IdentNr": "12026011598006",
      "itemId": "21061",
      "RecipeID": "8697",
      "ProductPrice": "2.50",
      "ProductPrice_2": null,
      "GastDesc_de": "Erdnussbutter-Cookie mit Schokolade und Salzkaramell | Vegan",
      "GastDesc_en": "Peanutbutter Cookie with Chocolate Salty Caramel | Vegan",
      "MenuName": "SEASON",
      "allergene": {
        "gluten": "Glutenhaltiges Getreide",
        "soja": "Soja und Sojaerzeugnisse",
        "erdnuss": "Erdnüsse und Erdnusserzeugnisse"
      },
      "merkmale": "",
      "naehrstoffe": "",
      "zusatzstoffe": [
        {
          "de": "Farbstoff",
          "en": "Colouring Agent"
        },
        {
          "de": "Antioxidationsmittel",
          "en": "Antioxidation"
        },
        {
          "de": "Alkohol",
          "en": "Alcohol"
        }
      ],
      "PrintOrder": "6",
      "CO2Value": null,
      "CO2Rating": null,
      "CO2Perc": null,
      "ClimateFriendly": null,
      "GastDesc": "Erdnussbutter-Cookie mit Schokolade und Salzkaramell | Vegan",
      "date_de": "15.01.2026"
    },
    {
      "id": "5126745",
      "outlet": "cafe",
      "date": "2026-01-15",
      "CalendarWeek": "2",
      "day": "Donnerstag",
      "mealtime": "Mittagessen",
      "IdentNr": "12026011598007",
      "itemId": "12776",
      "RecipeID": "8453",
      "ProductPrice": "2.50",
      "ProductPrice_2": null,
      "GastDesc_de": "Oreo-Cheesecake-Cookies",
      "GastDesc_en": "Oreo Cheesecake Cookies",
      "MenuName": "COOKIE",
      "allergene": {
        "gluten": "Glutenhaltiges Getreide",
        "huhnerei": "Hühnerei und Hühnereierzeugnisse",
        "milch": "Milch und Milcherzeugnisse"
      },
      "merkmale": "",
      "naehrstoffe": "",
      "zusatzstoffe": [
        {
          "de": "Farbstoff",
          "en": "Colouring Agent"
        },
        {
          "de": "Alkohol",
          "en": "Alcohol"
        }
      ],
      "PrintOrder": "7",
      "CO2Value": null,
      "CO2Rating": null,
      "CO2Perc": null,
      "ClimateFriendly": null,
      "GastDesc": "Oreo-Cheesecake-Cookies",
      "date_de": "15.01.2026"
    },
    {
      "id": "5126746",
      "outlet": "cafe",
      "date": "2026-01-15",
      "CalendarWeek": "2",
      "day": "Donnerstag",
      "mealtime": "Mittagessen",
      "IdentNr": "12026011598008",
      "itemId": "12777",
      "RecipeID": "9121",
      "ProductPrice": "2.70",
      "ProductPrice_2": null,
      "GastDesc_de": "Carrotcake Bananabread Zuckerfrei",
      "GastDesc_en": "Carrotcake Bananabread Sugarfree",
      "MenuName": "TAG des KASTENKUCHENS",
      "allergene": {
        "gluten": "Glutenhaltiges Getreide",
        "milch": "Milch und Milcherzeugnisse",
        "schwefel": "Schwefeldioxid und Sulfide"
      },
      "merkmale": "",
      "naehrstoffe": "",
      "zusatzstoffe": [
        {
          "de": "Farbstoff",
          "en": "Colouring Agent"
        }
      ],
      "PrintOrder": "8",
      "CO2Value": null,
      "CO2Rating": null,
      "CO2Perc": null,
      "ClimateFriendly": null,
      "GastDesc": "Carrotcake Bananabread Zuckerfrei",
      "date_de": "15.01.2026"
    },
    {
      "id": "5126747",
      "outlet": "cafe",
      "date": "2026-01-15",
      "CalendarWeek": "2",
      "day": "Donnerstag",
      "mealtime": "Mittagessen",
      "IdentNr": "12026011598011",
      "itemId": "16256",
      "RecipeID": "9122",
      "ProductPrice": "1.50",
      "ProductPrice_2": null,
      "GastDesc_de": "Sesamkeks Mehlfrei Vegan",
      "GastDesc_en": "Sesame Cookie without flour and vegan",
      "MenuName": "VEGAN SPECIAL",
      "allergene": {
        "schalenfruchte": "Schalenfrüchte und Schalenfruchterzeugnisse",
        "sesam": "Sesamsamen und Sesamsamenerzeugnisse"
      },
      "merkmale": "",
      "naehrstoffe": "",
      "zusatzstoffe": [
        {
          "de": "Farbstoff",
          "en": "Colouring Agent"
        },
        {
          "de": "Alkohol",
          "en": "Alcohol"
        }
      ],
      "PrintOrder": "11",
      "CO2Value": null,
      "CO2Rating": null,
      "CO2Perc": null,
      "ClimateFriendly": null,
      "GastDesc": "Sesamkeks Mehlfrei Vegan",
      "date_de": "15.01.2026"
    },
    {
      "id": "5126748",
      "outlet": "cafe",
      "date": "2026-01-16",
      "CalendarWeek": "2",
      "day": "Freitag",
      "mealtime": "Mittagessen",
      "IdentNr": "12026011698001",
      "itemId": "21059",
      "RecipeID": "8054",
      "ProductPrice": "3.20",
      "ProductPrice_2": null,
      "GastDesc_de": "Pflaumenmus-Croffin mit Vanilleschmand",
      "GastDesc_en": "Plum Jam Croffin with Vanilla Sour Cream",
      "MenuName": "CROFFIN",
      "allergene": {
        "gluten": "Glutenhaltiges Getreide",
        "schalenfruchte": "Schalenfrüchte und Schalenfruchterzeugnisse",
        "huhnerei": "Hühnerei und Hühnereierzeugnisse",
        "soja": "Soja und Sojaerzeugnisse",
        "milch": "Milch und Milcherzeugnisse"
      },
      "merkmale": "",
      "naehrstoffe": "",
      "zusatzstoffe": [
        {
          "de": "Farbstoff",
          "en": "Colouring Agent"
        },
        {
          "de": "Alkohol",
          "en": "Alcohol"
        }
      ],
      "PrintOrder": "1",
      "CO2Value": null,
      "CO2Rating": null,
      "CO2Perc": null,
      "ClimateFriendly": null,
      "GastDesc": "Pflaumenmus-Croffin mit Vanilleschmand",
      "date_de": "16.01.2026"
    },
    {
      "id": "5126749",
      "outlet": "cafe",
      "date": "2026-01-16",
      "CalendarWeek": "2",
      "day": "Freitag",
      "mealtime": "Mittagessen",
      "IdentNr": "12026011698002",
      "itemId": "21062",
      "RecipeID": "8871",
      "ProductPrice": "3.60",
      "ProductPrice_2": null,
      "GastDesc_de": "Baskischer Cheesecake mit Johannisbeer-Birnenkompott",
      "GastDesc_en": "Basque-style Cheesecake with Black Currant and Pear Compote",
      "MenuName": "FAVOURITES",
      "allergene": {
        "huhnerei": "Hühnerei und Hühnereierzeugnisse",
        "milch": "Milch und Milcherzeugnisse"
      },
      "merkmale": "",
      "naehrstoffe": "",
      "zusatzstoffe": [
        {
          "de": "Farbstoff",
          "en": "Colouring Agent"
        },
        {
          "de": "Alkohol",
          "en": "Alcohol"
        }
      ],
      "PrintOrder": "2",
      "CO2Value": null,
      "CO2Rating": null,
      "CO2Perc": null,
      "ClimateFriendly": null,
      "GastDesc": "Baskischer Cheesecake mit Johannisbeer-Birnenkompott",
      "date_de": "16.01.2026"
    },
    {
      "id": "5126750",
      "outlet": "cafe",
      "date": "2026-01-16",
      "CalendarWeek": "2",
      "day": "Freitag",
      "mealtime": "Mittagessen",
      "IdentNr": "12026011698003",
      "itemId": "21063",
      "RecipeID": "8211",
      "ProductPrice": "0.50",
      "ProductPrice_2": null,
      "GastDesc_de": "LES ARLETTES (Französische Blätterteigkekse) Vegan",
      "GastDesc_en": "LES ARLETTES  (French Puff Pastry Cookies) Vegan",
      "MenuName": "MINIS",
      "allergene": {
        "gluten": "Glutenhaltiges Getreide"
      },
      "merkmale": {
        "vegan": "Vegan",
        "vegetarisch": "Vegetarisch"
      },
      "naehrstoffe": "",
      "zusatzstoffe": [
        {
          "de": "Farbstoff",
          "en": "Colouring Agent"
        },
        {
          "de": "Alkohol",
          "en": "Alcohol"
        }
      ],
      "PrintOrder": "3",
      "CO2Value": null,
      "CO2Rating": null,
      "CO2Perc": null,
      "ClimateFriendly": null,
      "GastDesc": "LES ARLETTES (Französische Blätterteigkekse) Vegan",
      "date_de": "16.01.2026"
    },
    {
      "id": "5126751",
      "outlet": "cafe",
      "date": "2026-01-16",
      "CalendarWeek": "2",
      "day": "Freitag",
      "mealtime": "Mittagessen",
      "IdentNr": "12026011698005",
      "itemId": "21064",
      "RecipeID": "8330",
      "ProductPrice": "1.50",
      "ProductPrice_2": null,
      "GastDesc_de": "Saftige Brownie-Bananen-Cookies | Zuckerfrei",
      "GastDesc_en": "Fudgy Brownie Banana Cookies | Sugar-Free",
      "MenuName": "PEOPLES CHOICE",
      "allergene": {
        "erdnuss": "Erdnüsse und Erdnusserzeugnisse"
      },
      "merkmale": {
        "ohne_zucker": "Ohne_Zucker",
        "vegan": "Vegan",
        "vegetarisch": "Vegetarisch"
      },
      "naehrstoffe": "",
      "zusatzstoffe": null,
      "PrintOrder": "5",
      "CO2Value": null,
      "CO2Rating": null,
      "CO2Perc": null,
      "ClimateFriendly": null,
      "GastDesc": "Saftige Brownie-Bananen-Cookies | Zuckerfrei",
      "date_de": "16.01.2026"
    },
    {
      "id": "5126752",
      "outlet": "cafe",
      "date": "2026-01-16",
      "CalendarWeek": "2",
      "day": "Freitag",
      "mealtime": "Mittagessen",
      "IdentNr": "12026011698006",
      "itemId": "21061",
      "RecipeID": "8697",
      "ProductPrice": "2.50",
      "ProductPrice_2": null,
      "GastDesc_de": "Erdnussbutter-Cookie mit Schokolade und Salzkaramell | Vegan",
      "GastDesc_en": "Peanutbutter Cookie with Chocolate Salty Caramel | Vegan",
      "MenuName": "SEASON",
      "allergene": {
        "gluten": "Glutenhaltiges Getreide",
        "soja": "Soja und Sojaerzeugnisse",
        "erdnuss": "Erdnüsse und Erdnusserzeugnisse"
      },
      "merkmale": "",
      "naehrstoffe": "",
      "zusatzstoffe": [
        {
          "de": "Farbstoff",
          "en": "Colouring Agent"
        },
        {
          "de": "Antioxidationsmittel",
          "en": "Antioxidation"
        },
        {
          "de": "Alkohol",
          "en": "Alcohol"
        }
      ],
      "PrintOrder": "6",
      "CO2Value": null,
      "CO2Rating": null,
      "CO2Perc": null,
      "ClimateFriendly": null,
      "GastDesc": "Erdnussbutter-Cookie mit Schokolade und Salzkaramell | Vegan",
      "date_de": "16.01.2026"
    },
    {
      "id": "5126753",
      "outlet": "cafe",
      "date": "2026-01-16",
      "CalendarWeek": "2",
      "day": "Freitag",
      "mealtime": "Mittagessen",
      "IdentNr": "12026011698007",
      "itemId": "12776",
      "RecipeID": "8453",
      "ProductPrice": "2.50",
      "ProductPrice_2": null,
      "GastDesc_de": "Oreo-Cheesecake-Cookies",
      "GastDesc_en": "Oreo Cheesecake Cookies",
      "MenuName": "COOKIE",
      "allergene": {
        "gluten": "Glutenhaltiges Getreide",
        "huhnerei": "Hühnerei und Hühnereierzeugnisse",
        "milch": "Milch und Milcherzeugnisse"
      },
      "merkmale": "",
      "naehrstoffe": "",
      "zusatzstoffe": [
        {
          "de": "Farbstoff",
          "en": "Colouring Agent"
        },
        {
          "de": "Alkohol",
          "en": "Alcohol"
        }
      ],
      "PrintOrder": "7",
      "CO2Value": null,
      "CO2Rating": null,
      "CO2Perc": null,
      "ClimateFriendly": null,
      "GastDesc": "Oreo-Cheesecake-Cookies",
      "date_de": "16.01.2026"
    },
    {
      "id": "5126754",
      "outlet": "cafe",
      "date": "2026-01-16",
      "CalendarWeek": "2",
      "day": "Freitag",
      "mealtime": "Mittagessen",
      "IdentNr": "12026011698008",
      "itemId": "12777",
      "RecipeID": "9121",
      "ProductPrice": "2.70",
      "ProductPrice_2": null,
      "GastDesc_de": "Carrotcake Bananabread Zuckerfrei",
      "GastDesc_en": "Carrotcake Bananabread Sugarfree",
      "MenuName": "TAG des KASTENKUCHENS",
      "allergene": {
        "gluten": "Glutenhaltiges Getreide",
        "milch": "Milch und Milcherzeugnisse",
        "schwefel": "Schwefeldioxid und Sulfide"
      },
      "merkmale": "",
      "naehrstoffe": "",
      "zusatzstoffe": [
        {
          "de": "Farbstoff",
          "en": "Colouring Agent"
        }
      ],
      "PrintOrder": "8",
      "CO2Value": null,
      "CO2Rating": null,
      "CO2Perc": null,
      "ClimateFriendly": null,
      "GastDesc": "Carrotcake Bananabread Zuckerfrei",
      "date_de": "16.01.2026"
    },
    {
      "id": "5126755",
      "outlet": "cafe",
      "date": "2026-01-16",
      "CalendarWeek": "2",
      "day": "Freitag",
      "mealtime": "Mittagessen",
      "IdentNr": "12026011698011",
      "itemId": "16256",
      "RecipeID": "9122",
      "ProductPrice": "1.50",
      "ProductPrice_2": null,
      "GastDesc_de": "Sesamkeks Mehlfrei Vegan",
      "GastDesc_en": "Sesame Cookie without flour and vegan",
      "MenuName": "VEGAN SPECIAL",
      "allergene": {
        "schalenfruchte": "Schalenfrüchte und Schalenfruchterzeugnisse",
        "sesam": "Sesamsamen und Sesamsamenerzeugnisse"
      },
      "merkmale": "",
      "naehrstoffe": "",
      "zusatzstoffe": [
        {
          "de": "Farbstoff",
          "en": "Colouring Agent"
        },
        {
          "de": "Alkohol",
          "en": "Alcohol"
        }
      ],
      "PrintOrder": "11",
      "CO2Value": null,
      "CO2Rating": null,
      "CO2Perc": null,
      "ClimateFriendly": null,
      "GastDesc": "Sesamkeks Mehlfrei Vegan",
      "date_de": "16.01.2026"
    },
    {
      "id": "5040016",
      "outlet": "canteen",
      "date": "2026-01-01",
      "CalendarWeek": "1",
      "day": "Donnerstag",
      "mealtime": "Abendessen",
      "IdentNr": "12026010198018",
      "itemId": "17864",
      "RecipeID": "9000",
      "ProductPrice": "12.00",
      "ProductPrice_2": null,
      "GastDesc_de": "Currywurst | Fritten | Salat",
      "GastDesc_en": "Curry Sausage | Steakhouse Chips | Salad",
      "MenuName": "DINNER Meat _|",
      "allergene": {
        "huhnerei": "Hühnerei und Hühnereierzeugnisse",
        "sellerie": "Sellerie und Sellerieerzeugnisse",
        "senf": "Senf und Senferzeugnisse",
        "schwefel": "Schwefeldioxid und Sulfide"
      },
      "merkmale": "",
      "naehrstoffe": "",
      "zusatzstoffe": [
        {
          "de": "Süßungsmittel",
          "en": "Sweetener"
        },
        {
          "de": "Phosphat",
          "en": "Phosphate"
        },
        {
          "de": "Farbstoff",
          "en": "Colouring Agent"
        },
        {
          "de": "Antioxidationsmittel",
          "en": "Antioxidation"
        },
        {
          "de": "Konservierungsstoff",
          "en": "Preservatives"
        }
      ],
      "PrintOrder": "18",
      "CO2Value": "1038.00",
      "CO2Rating": "B",
      "CO2Perc": "100.00",
      "ClimateFriendly": null,
      "GastDesc": "Currywurst | Fritten | Salat",
      "date_de": "01.01.2026"
    },
    {
      "id": "5040018",
      "outlet": "canteen",
      "date": "2026-01-01",
      "CalendarWeek": "1",
      "day": "Donnerstag",
      "mealtime": "Abendessen",
      "IdentNr": "12026010198019",
      "itemId": "17865",
      "RecipeID": "8795",
      "ProductPrice": "12.00",
      "ProductPrice_2": null,
      "GastDesc_de": "Seelachs | Apfel | Gurke | Rahm",
      "GastDesc_en": "Coalfish | Apple | Cucumber | Cream",
      "MenuName": "DINNER Fish _|",
      "allergene": {
        "huhnerei": "Hühnerei und Hühnereierzeugnisse",
        "fisch": "Fisch und Fischerzeugnisse",
        "milch": "Milch und Milcherzeugnisse",
        "senf": "Senf und Senferzeugnisse",
        "schwefel": "Schwefeldioxid und Sulfide"
      },
      "merkmale": "",
      "naehrstoffe": "",
      "zusatzstoffe": [
        {
          "de": "Süßungsmittel",
          "en": "Sweetener"
        },
        {
          "de": "Farbstoff",
          "en": "Colouring Agent"
        },
        {
          "de": "Antioxidationsmittel",
          "en": "Antioxidation"
        },
        {
          "de": "Alkohol",
          "en": "Alcohol"
        }
      ],
      "PrintOrder": "19",
      "CO2Value": "1564.00",
      "CO2Rating": "C",
      "CO2Perc": "100.00",
      "ClimateFriendly": null,
      "GastDesc": "Seelachs | Apfel | Gurke | Rahm",
      "date_de": "01.01.2026"
    },
    {
      "id": "5040020",
      "outlet": "canteen",
      "date": "2026-01-01",
      "CalendarWeek": "1",
      "day": "Donnerstag",
      "mealtime": "Abendessen",
      "IdentNr": "12026010198020",
      "itemId": "17866",
      "RecipeID": "6410",
      "ProductPrice": "9.50",
      "ProductPrice_2": null,
      "GastDesc_de": "Linguine | Kürbis | Zuckerschote",
      "GastDesc_en": "Linguine | Pumpkin | Sweet Peas",
      "MenuName": "DINNER Vegi / Vegan_|",
      "allergene": {
        "gluten": "Glutenhaltiges Getreide"
      },
      "merkmale": {
        "vegan": "Vegan",
        "vegetarisch": "Vegetarisch"
      },
      "naehrstoffe": "",
      "zusatzstoffe": null,
      "PrintOrder": "20",
      "CO2Value": "303.00",
      "CO2Rating": "A",
      "CO2Perc": "100.00",
      "ClimateFriendly": "1",
      "GastDesc": "Linguine | Kürbis | Zuckerschote",
      "date_de": "01.01.2026"
    },
    {
      "id": "5057214",
      "outlet": "canteen",
      "date": "2026-01-02",
      "CalendarWeek": "1",
      "day": "Freitag",
      "mealtime": "Mittagessen",
      "IdentNr": "12026010298000",
      "itemId": "17549",
      "RecipeID": "5060",
      "ProductPrice": "11.00",
      "ProductPrice_2": null,
      "GastDesc_de": "Couscous | Ofen-Paprika | Kräuterfeta",
      "GastDesc_en": "Couscous | Oven peppers | Herb feta",
      "MenuName": "COUNTER 1.1 Bowls_",
      "allergene": {
        "gluten": "Glutenhaltiges Getreide",
        "schalenfruchte": "Schalenfrüchte und Schalenfruchterzeugnisse",
        "milch": "Milch und Milcherzeugnisse"
      },
      "merkmale": {
        "vegetarisch": "Vegetarisch"
      },
      "naehrstoffe": "",
      "zusatzstoffe": [
        {
          "de": "geschwärzt",
          "en": "Blacked Out"
        }
      ],
      "PrintOrder": "0",
      "CO2Value": "1638.00",
      "CO2Rating": "C",
      "CO2Perc": "100.00",
      "ClimateFriendly": null,
      "GastDesc": "Couscous | Ofen-Paprika | Kräuterfeta",
      "date_de": "02.01.2026"
    },
    {
      "id": "5057215",
      "outlet": "canteen",
      "date": "2026-01-02",
      "CalendarWeek": "1",
      "day": "Freitag",
      "mealtime": "Mittagessen",
      "IdentNr": "12026010298001",
      "itemId": "17550",
      "RecipeID": "5118",
      "ProductPrice": "12.00",
      "ProductPrice_2": null,
      "GastDesc_de": "Maishähnchen | Ebli | Strauchtomaten | Minzayran",
      "GastDesc_en": "Corn fed Chicken | Ebli | Tomato | Mint Ayran",
      "MenuName": "COUNTER 2.1 Meat",
      "allergene": {
        "gluten": "Glutenhaltiges Getreide",
        "milch": "Milch und Milcherzeugnisse",
        "sellerie": "Sellerie und Sellerieerzeugnisse"
      },
      "merkmale": "",
      "naehrstoffe": "",
      "zusatzstoffe": null,
      "PrintOrder": "1",
      "CO2Value": "1387.00",
      "CO2Rating": "C",
      "CO2Perc": "100.00",
      "ClimateFriendly": null,
      "GastDesc": "Maishähnchen | Ebli | Strauchtomaten | Minzayran",
      "date_de": "02.01.2026"
    },
    {
      "id": "5057216",
      "outlet": "canteen",
      "date": "2026-01-02",
      "CalendarWeek": "1",
      "day": "Freitag",
      "mealtime": "Mittagessen",
      "IdentNr": "12026010298003",
      "itemId": "17552",
      "RecipeID": "2931",
      "ProductPrice": "12.00",
      "ProductPrice_2": null,
      "GastDesc_de": "Zander | Kohlrabi-Gemüse | Kapernsauce",
      "GastDesc_en": "Pike perch | Kohlrabi | Capers",
      "MenuName": "COUNTER 3.1 Fish",
      "allergene": {
        "gluten": "Glutenhaltiges Getreide",
        "fisch": "Fisch und Fischerzeugnisse",
        "milch": "Milch und Milcherzeugnisse",
        "sellerie": "Sellerie und Sellerieerzeugnisse"
      },
      "merkmale": "",
      "naehrstoffe": "",
      "zusatzstoffe": null,
      "PrintOrder": "3",
      "CO2Value": "646.00",
      "CO2Rating": "B",
      "CO2Perc": "100.00",
      "ClimateFriendly": null,
      "GastDesc": "Zander | Kohlrabi-Gemüse | Kapernsauce",
      "date_de": "02.01.2026"
    },
    {
      "id": "5057217",
      "outlet": "canteen",
      "date": "2026-01-02",
      "CalendarWeek": "1",
      "day": "Freitag",
      "mealtime": "Mittagessen",
      "IdentNr": "12026010298005",
      "itemId": "17554",
      "RecipeID": "5077",
      "ProductPrice": "9.50",
      "ProductPrice_2": null,
      "GastDesc_de": "Soja-Frikasee | Reis | Wildkräuter",
      "GastDesc_en": "Soya Frikasee | Rice | Wild Herbs",
      "MenuName": "COUNTER 4.1 Vegi",
      "allergene": {
        "soja": "Soja und Sojaerzeugnisse",
        "sellerie": "Sellerie und Sellerieerzeugnisse",
        "schwefel": "Schwefeldioxid und Sulfide"
      },
      "merkmale": {
        "vegan": "Vegan",
        "vegetarisch": "Vegetarisch"
      },
      "naehrstoffe": "",
      "zusatzstoffe": [
        {
          "de": "Antioxidationsmittel",
          "en": "Antioxidation"
        },
        {
          "de": "Alkohol",
          "en": "Alcohol"
        }
      ],
      "PrintOrder": "5",
      "CO2Value": "528.00",
      "CO2Rating": "A",
      "CO2Perc": "100.00",
      "ClimateFriendly": "1",
      "GastDesc": "Soja-Frikasee | Reis | Wildkräuter",
      "date_de": "02.01.2026"
    },
    {
      "id": "5057218",
      "outlet": "canteen",
      "date": "2026-01-02",
      "CalendarWeek": "1",
      "day": "Freitag",
      "mealtime": "Abendessen",
      "IdentNr": "12026010298009",
      "itemId": "17558",
      "RecipeID": "5060",
      "ProductPrice": "11.00",
      "ProductPrice_2": null,
      "GastDesc_de": "Couscous | Ofen-Paprika | Kräuterfeta",
      "GastDesc_en": "Couscous | Oven peppers | Herb feta",
      "MenuName": "DINNER BOWL_",
      "allergene": {
        "gluten": "Glutenhaltiges Getreide",
        "schalenfruchte": "Schalenfrüchte und Schalenfruchterzeugnisse",
        "milch": "Milch und Milcherzeugnisse"
      },
      "merkmale": {
        "vegetarisch": "Vegetarisch"
      },
      "naehrstoffe": "",
      "zusatzstoffe": [
        {
          "de": "geschwärzt",
          "en": "Blacked Out"
        }
      ],
      "PrintOrder": "9",
      "CO2Value": "1638.00",
      "CO2Rating": "C",
      "CO2Perc": "100.00",
      "ClimateFriendly": null,
      "GastDesc": "Couscous | Ofen-Paprika | Kräuterfeta",
      "date_de": "02.01.2026"
    },
    {
      "id": "5057220",
      "outlet": "canteen",
      "date": "2026-01-02",
      "CalendarWeek": "1",
      "day": "Freitag",
      "mealtime": "Abendessen",
      "IdentNr": "12026010298011",
      "itemId": "17560",
      "RecipeID": "5077",
      "ProductPrice": "9.50",
      "ProductPrice_2": null,
      "GastDesc_de": "Soja-Frikasee | Reis | Wildkräuter",
      "GastDesc_en": "Soya Frikasee | Rice | Wild Herbs",
      "MenuName": "DINNER Fish_17:00-19:00",
      "allergene": {
        "soja": "Soja und Sojaerzeugnisse",
        "sellerie": "Sellerie und Sellerieerzeugnisse",
        "schwefel": "Schwefeldioxid und Sulfide"
      },
      "merkmale": {
        "vegan": "Vegan",
        "vegetarisch": "Vegetarisch"
      },
      "naehrstoffe": "",
      "zusatzstoffe": [
        {
          "de": "Antioxidationsmittel",
          "en": "Antioxidation"
        },
        {
          "de": "Alkohol",
          "en": "Alcohol"
        }
      ],
      "PrintOrder": "11",
      "CO2Value": "528.00",
      "CO2Rating": "A",
      "CO2Perc": "100.00",
      "ClimateFriendly": "1",
      "GastDesc": "Soja-Frikasee | Reis | Wildkräuter",
      "date_de": "02.01.2026"
    },
    {
      "id": "5057222",
      "outlet": "canteen",
      "date": "2026-01-03",
      "CalendarWeek": "1",
      "day": "Samstag",
      "mealtime": "Abendessen",
      "IdentNr": "12026010398014",
      "itemId": "17563",
      "RecipeID": "7944",
      "ProductPrice": "12.00",
      "ProductPrice_2": null,
      "GastDesc_de": "Leberkäse | Kartoffelsalat | Blattsalat | Spiegelei",
      "GastDesc_en": "Traditional Leberkäse | Vinegar Potato Salad | Leafy Salad | Fried Egg",
      "MenuName": "LUNCH Meat_",
      "allergene": {
        "huhnerei": "Hühnerei und Hühnereierzeugnisse",
        "milch": "Milch und Milcherzeugnisse",
        "sellerie": "Sellerie und Sellerieerzeugnisse",
        "senf": "Senf und Senferzeugnisse",
        "schwefel": "Schwefeldioxid und Sulfide"
      },
      "merkmale": {
        "schwein": "Schwein"
      },
      "naehrstoffe": "",
      "zusatzstoffe": [
        {
          "de": "Phosphat",
          "en": "Phosphate"
        },
        {
          "de": "Antioxidationsmittel",
          "en": "Antioxidation"
        },
        {
          "de": "Konservierungsstoff",
          "en": "Preservatives"
        },
        {
          "de": "Alkohol",
          "en": "Alcohol"
        }
      ],
      "PrintOrder": "14",
      "CO2Value": "1083.00",
      "CO2Rating": "B",
      "CO2Perc": "100.00",
      "ClimateFriendly": null,
      "GastDesc": "Leberkäse | Kartoffelsalat | Blattsalat | Spiegelei",
      "date_de": "03.01.2026"
    },
    {
      "id": "5057224",
      "outlet": "canteen",
      "date": "2026-01-03",
      "CalendarWeek": "1",
      "day": "Samstag",
      "mealtime": "Abendessen",
      "IdentNr": "12026010398015",
      "itemId": "17564",
      "RecipeID": "2904",
      "ProductPrice": "12.00",
      "ProductPrice_2": null,
      "GastDesc_de": "Schellfisch | Kartoffel-Endivienstampf | Dijon-Senf",
      "GastDesc_en": "Haddock | Potato Endive Mash | Dijon Mustard",
      "MenuName": "LUNCH Fish_",
      "allergene": {
        "fisch": "Fisch und Fischerzeugnisse",
        "milch": "Milch und Milcherzeugnisse",
        "sellerie": "Sellerie und Sellerieerzeugnisse",
        "senf": "Senf und Senferzeugnisse",
        "schwefel": "Schwefeldioxid und Sulfide"
      },
      "merkmale": "",
      "naehrstoffe": "",
      "zusatzstoffe": null,
      "PrintOrder": "15",
      "CO2Value": "1129.00",
      "CO2Rating": "C",
      "CO2Perc": "100.00",
      "ClimateFriendly": null,
      "GastDesc": "Schellfisch | Kartoffel-Endivienstampf | Dijon-Senf",
      "date_de": "03.01.2026"
    },
    {
      "id": "5057226",
      "outlet": "canteen",
      "date": "2026-01-03",
      "CalendarWeek": "1",
      "day": "Samstag",
      "mealtime": "Abendessen",
      "IdentNr": "12026010398016",
      "itemId": "17565",
      "RecipeID": "6418",
      "ProductPrice": "9.50",
      "ProductPrice_2": null,
      "GastDesc_de": "Muschelnudeln | Gemüseragout | Basilikumöl",
      "GastDesc_en": "Castellane | Vegetableragout | Basil oil",
      "MenuName": "LUNCH Vegi/Vegan_",
      "allergene": {
        "gluten": "Glutenhaltiges Getreide"
      },
      "merkmale": {
        "vegan": "Vegan",
        "vegetarisch": "Vegetarisch"
      },
      "naehrstoffe": "",
      "zusatzstoffe": null,
      "PrintOrder": "16",
      "CO2Value": "546.00",
      "CO2Rating": "B",
      "CO2Perc": "100.00",
      "ClimateFriendly": null,
      "GastDesc": "Muschelnudeln | Gemüseragout | Basilikumöl",
      "date_de": "03.01.2026"
    },
    {
      "id": "5057228",
      "outlet": "canteen",
      "date": "2026-01-04",
      "CalendarWeek": "1",
      "day": "Sonntag",
      "mealtime": "Abendessen",
      "IdentNr": "12026010498018",
      "itemId": "17864",
      "RecipeID": "8851",
      "ProductPrice": "12.00",
      "ProductPrice_2": null,
      "GastDesc_de": "Enten-Chop-Suey | Ingwer-Reis | Kroepoek",
      "GastDesc_en": "Duck Chop Suey | Ginger Rice | Prawn Crackers",
      "MenuName": "DINNER Meat _|",
      "allergene": {
        "gluten": "Glutenhaltiges Getreide",
        "soja": "Soja und Sojaerzeugnisse",
        "krebstier": "Krebstiere und Krebstiererzeugnisse",
        "sellerie": "Sellerie und Sellerieerzeugnisse",
        "sesam": "Sesamsamen und Sesamsamenerzeugnisse",
        "weichtier": "Weichtier und Weichtiererzeugnisse"
      },
      "merkmale": "",
      "naehrstoffe": "",
      "zusatzstoffe": [
        {
          "de": "Farbstoff",
          "en": "Colouring Agent"
        },
        {
          "de": "Geschmacksverstärker",
          "en": "Flavor Enhancer"
        }
      ],
      "PrintOrder": "18",
      "CO2Value": "1446.00",
      "CO2Rating": "B",
      "CO2Perc": "100.00",
      "ClimateFriendly": null,
      "GastDesc": "Enten-Chop-Suey | Ingwer-Reis | Kroepoek",
      "date_de": "04.01.2026"
    },
    {
      "id": "5057229",
      "outlet": "canteen",
      "date": "2026-01-04",
      "CalendarWeek": "1",
      "day": "Sonntag",
      "mealtime": "Mittagessen",
      "IdentNr": "12026010498018",
      "itemId": "17864",
      "RecipeID": "8851",
      "ProductPrice": "12.00",
      "ProductPrice_2": null,
      "GastDesc_de": "Enten-Chop-Suey | Ingwer-Reis | Kroepoek",
      "GastDesc_en": "Duck Chop Suey | Ginger Rice | Prawn Crackers",
      "MenuName": "DINNER Meat _|",
      "allergene": {
        "gluten": "Glutenhaltiges Getreide",
        "soja": "Soja und Sojaerzeugnisse",
        "krebstier": "Krebstiere und Krebstiererzeugnisse",
        "sellerie": "Sellerie und Sellerieerzeugnisse",
        "sesam": "Sesamsamen und Sesamsamenerzeugnisse",
        "weichtier": "Weichtier und Weichtiererzeugnisse"
      },
      "merkmale": "",
      "naehrstoffe": "",
      "zusatzstoffe": [
        {
          "de": "Farbstoff",
          "en": "Colouring Agent"
        },
        {
          "de": "Geschmacksverstärker",
          "en": "Flavor Enhancer"
        }
      ],
      "PrintOrder": "18",
      "CO2Value": "1446.00",
      "CO2Rating": "B",
      "CO2Perc": "100.00",
      "ClimateFriendly": null,
      "GastDesc": "Enten-Chop-Suey | Ingwer-Reis | Kroepoek",
      "date_de": "04.01.2026"
    },
    {
      "id": "5057231",
      "outlet": "canteen",
      "date": "2026-01-04",
      "CalendarWeek": "1",
      "day": "Sonntag",
      "mealtime": "Abendessen",
      "IdentNr": "12026010498019",
      "itemId": "17865",
      "RecipeID": "7315",
      "ProductPrice": "12.00",
      "ProductPrice_2": null,
      "GastDesc_de": "Forellenfilet | Erbsen | Kartoffel-Frikassee",
      "GastDesc_en": "Trout fillet | peas | potato fricassee",
      "MenuName": "DINNER Fish _|",
      "allergene": {
        "fisch": "Fisch und Fischerzeugnisse",
        "soja": "Soja und Sojaerzeugnisse",
        "milch": "Milch und Milcherzeugnisse",
        "sellerie": "Sellerie und Sellerieerzeugnisse",
        "schwefel": "Schwefeldioxid und Sulfide"
      },
      "merkmale": {
        "schwein": "Schwein"
      },
      "naehrstoffe": "",
      "zusatzstoffe": [
        {
          "de": "Phosphat",
          "en": "Phosphate"
        },
        {
          "de": "Antioxidationsmittel",
          "en": "Antioxidation"
        },
        {
          "de": "Konservierungsstoff",
          "en": "Preservatives"
        },
        {
          "de": "Alkohol",
          "en": "Alcohol"
        }
